Band,Lyrics,Song,Year
Dianne Reeves,"Comes a rain storm put rubbers on your feet
Comes a snow storm you can get a little heat
Comes love nothing can be done
Comes a fire then you know just what to do
Blow a tire you can buy another shoe
Comes love nothing can be done

Don't try hiding cause there isn't any use
You'll start sliding when your heart turns on the juice

Comes a headache you can lose it in a day
Comes a toothache see your dentist right away
Comes love nothing can be done

Comes a heat wave you can hurry to the shore
Comes a summons you can hide behind the door
Comes love nothing can be done
Comes the measles you can quarantine the room
Comes a mouse you can chase him with a broom
Comes love nothing can be done

That's all brother if you've ever been in love
That's all sister you know what I'm thinking of

Comes a nightmare you can always stay awake
Comes depression you might get another break
Comes love nothing can be done",Comes Love,1998
Dianne Reeves,"You come with tender eyes
My welcome reprieve
My pleasant reprieve
It would be simple
To be seized away
By the heat of your smile
By the words that you say
What to do my love
With the passion you bring
With your sincere emotion
Such a fragile thing
Should I risk what is precious, my friend
For a fleeting indulgence
For a fated end
Skilled in the game of chance
I'm tempted
When you ask me to dance
But the urgency that is now your voice
Leaves me shaken and sober
Leaves me only one choice
On this bitter sweet night
I must tell you goodbye

",Goodbye,1999
Dianne Reeves,"[Incomprehensible]

It's coming on Christmas
They're cutting down trees
Putting up reindeer
Singing songs of joy and peace

Oh I wish I had a river, I could skate away on

But it don't snow here, it stays pretty green
I'm gonna make a lot of money
Then I'm gonna quit this crazy scene

I wish I had a river, I could skate away on
I wish I had a river so long, I'd teach my feet to fly
Wish I had a river, I could skate away on

I made my baby cry, he tried hard to please me
You know, he put me at ease
And he loved me so naughty
Made me weak in the knees

I need a river, I could skate away on

You see I'm so hard to handle
I'm selfish and I'm sad
Now I've lost the best baby that I, that I ever had

Oh, I wish I had a river, I could skate away on
Wish I had a river so long, I'd teach my feet to fly
Oh, oh oh wish I had a river, I could skate away on
My baby said goodbye

[Incomprehensible]
Oh oh

[Incomprehensible]

It's coming on Christmas
They're cutting down trees
Putting up reindeer
Singing songs of joy and peace

I need a river, I could skate away on

Oh
Oh oh
Oh oh oh

",River,1999
Dianne Reeves,"Suzanne takes you down to her place near the river
You can hear the boats go by
You can spend the night beside her
And you know that she's half crazy
But that's why you want to be there
And she feeds you tea and oranges
That come all the way from China
And just when you mean to tell her
That you have no love to give her
Then she gets you on her wavelength
And she lets the river answer
That you've always been her lover
And you want to travel with her
And you want to travel blind
And you know that she will trust you
For you've touched her perfect body with your mind.
And Jesus was a sailor
When he walked upon the water
And he spent a long time watching
From his lonely wooden tower
And when he knew for certain
Only drowning men could see him
He said ""All men will be sailors then
Until the sea shall free them""
But he himself was broken
Long before the sky would open
Forsaken, almost human
He sank beneath your wisdom like a stone
And you want to travel with him
And you want to travel blind
And you think maybe you'll trust him
For he's touched your perfect body with his mind.
Now Suzanne takes your hand
And she leads you to the river
She is wearing rags and feathers
From Salvation Army counters
And the sun pours down like honey
On our lady of the harbor
And she shows you where to look
Among the garbage and the flowers
There are heroes in the seaweed
There are children in the morning
They are leaning out for love
And they will lean that way forever
While Suzanne holds the mirror
And you want to travel with her
And you want to travel blind
And you know that you can trust her
For she's touched your perfect body with her mind.",Suzanne,1999
Dianne Reeves,"Jaime Paris au mois de mai
Quand les bourgeons renaissent
Quune nouvelle jeunesse
Sempare de la vieille cit
Qui se met  rayonner
Jaime Paris au mois de mai
Quand lhiver le dlaisse
Que le soleil caresse
Ses vieux toits  peine veills

Jaime sentir sur les places
Dans les rues o je passe
Ce parfum de muguet que chasse
Le vent qui passe
Il me plat  me promener
Par les rues qui sfaufilent
A travers toute la ville
Jaime Paris au mois de mai

Jaime le vent qui mapporte
Des bruits de toutes sortes
Et les potins que lon colporte
De porte en porte
Il me plat  me promener
En souriant aux filles
Dans les rues qui fourmillent
Jaime Paris au mois de mai

Jaime Paris au mois de mai
Avec ses bouquinistes
Et ses aquarellistes
Que le printemps a ramen
Comme chaque anne le long des quais
Jaime Paris au mois de mai
La Seine qui larrose
Mille petites choses
Que je ne pourrais expliquer

Jaime quand la nuit svre
tend la paix sur terre
Et que la ville soudain sclaire
De millions de lumires
Il me plat  me promener
Contemplant les vitrines
La nuit qui me fascine
Jaime, jaime Paris au mois de mai",J'Aime Paris au Mois de Mai,1999
Dianne Reeves,"I'm gonna' love you, like nobody's loved you
Come rain or come shine
High as a mountain, deep as a river
Come rain or come shine

I guess when you met me
It was just one of those things
But don't you ever bet me
Cause I'm gonna' be true if you let me

You're gonna' love me, like nobody's loved me
Come rain or come shine
We'll be happy together, unhappy together
Now won't that be fine

The days may be cloudy or sunny
We're in or out of the money
But I'm with you always
I'm with you rain or shine",Come Rain or Come Shine,1999
Dianne Reeves,"Oh, he's got a fine brown frame
I wonder what could be his name
He looks good to me, and all I can see
Is his fine brown frame

How long have you been around
Mister when did you hit this big town
I wanna scream 'cos I've never seen
Such a fine brown frame

All that I have is a broken down chair
But I would gladly make him king on my throne
Don't be a square, why don't you come over here
Together we would really be gone

Woh-ooh! he's got a fine brown frame
I wonder what could be his name
He is solid with me, and all I can see
Is his fine brown frame

Be be be be beep

He's got such a fine brown frame
I wonder what could be his name
He looks good to me, and all I can see
Is his fine brown frame

How long have you been around
Mister when did you hit this big town
I wanna scream, aahhhh, 'cos I've never seen
Such a fine brown frame

All that I have is a broken down chair
But I would gladly make him king on my throne
Don't be a square, why don't you come over here
Together we would really be gone

Ooohh, he's such a fine brown frame
Honey won't you tell me your name
He is solid with me and all I can see
Is his fine brown frame

Now Robert Taylor, Robert Young, Ameche and Gable
Are all as fine as mountain sable
You may not be classed with the elite
And you may not be hip to that jive-like foot, an' all reet

Oh-woh-woh-woh baby you, you look like Hercules done up in bronze
And I know I'm a clown whenever you're around
Because I'm crazy 'bout, mad about, wild about
Your fine brown frame",Fine Brown Frame,1999
Dianne Reeves,"Sad is to live in solitude
Far from your tranquil altitude
Sad is to know that no one ever can live on a dream
That never can be, will never be
Dreamer awake, wake up and see

Your beauty is an aeroplane
So high my heart can't bear the strain
A heart that stops when you pass by
Only to cause me pain
Sad is to live in solitude",Triste,2000
Dianne Reeves,"My mama done tol' me when I was in pigtails
My mama done tol' me, ""Son
A man'll sweet talk and give ya the big eye
But when the sweet talkin's done

A man's a two-face
A worrisome thing who'll leave ya to sing
The blues in the night""

Now the rain's a-fallin'
Hear the train's a callin', whooee
My mama done tol' me
Hear dat lonesome whistle
Blowin' 'cross the trestle, whooee!

My mama done tol' me, a-whooee-ah-whooee
Ol' clickety-clack's a-echoin'
Back th' blues in the night
The evenin' breeze'll start the trees to cryin'
And the moon'll hide it's light
When you get the blues in the night

Take my word, the mockingbird'll sing
The saddest kind o' song
He knows things are wrong
And he's right

From Natchez to Mobile, from Memphis to St. Joe
Wherever the four winds blow
I been in some big towns an' heard me some big talk
But there is one thing I know

A man's a two-face
A worrisome thing who'll leave ya to sing
The blues in the night

The evenin' breeze'll start the trees to cryin'
And the moon'll hide it's light
When you get the blues
Blues in the night

Take my word, the mockingbird'll sing
The saddest kind o' song
He knows things are wrong
And he's right

From Natchez to Mobile, from Memphis to St. Joe
Wherever the four winds blow, winds blow
I been in some big towns an' heard me some big talk
But there is one thing I know

A man's a two-face
A worrisome thing who'll leave ya to sing
The blues in the night
Yes, babe, only, only blues in the night",Blues in the Night,2001
Dianne Reeves,"Walked with no one and talked with no one
And I had nothing but shadows
Then one morning you passed
And I brightened at last
Now I greet the day and complete the day
With the sun in my heart
All my worry blew away
When you taught me how to say

Grab your coat and get your hat
Leave your worry on the doorstep
Just direct your feet
To the sunny side of the street
Can't you hear a pitter-pat?
And that happy tune is your step
Life can be so sweet
On the sunny side of the street

I used to walk in the shade
With those blues on parade
But I'm not afraid
This Rover crossed over

If I never have a cent
I'd be rich as Rockefeller
Gold dust at my feet
On the sunny side of the street
Grab your street",On the Sunny Side of the Street,2001
Dianne Reeves,"Yesterday you came my way,
And when you smiled at me,
In my heart I felt a thrill you see,
That it was love at sight and
I was right to love you as I do.
Still I never dreamed that you could love me too.

Your eyes of blue, your kisses too,
I never knew what they could do.
I can't believe that you're in love with me.

You're telling ev'ry one I know
I'm on your mind each place we go
They can't believe that you're in love with me.

I have always placed you far above me.
I just can't imagine that you love me.
And after all is said and done,
To think that I'm the lucky one.
I can't believe that you're in love with me.

Skies are gray. I'm blue each day
When you are not around.
Ev'ry thing goes wrong, my dear I've found
But when you're by my side I fill with pride
For I'm so proud of you
It all seems too good to me to all be true

Your eyes of blue, your kisses too,
I never knew what they could do.
I can't believe that you're in love with me.

You're telling ev'ry one I know
I'm on your mind each place we go
They can't believe that you're in love with me.

I have always placed you far above me.
I just can't imagine that you love me.
And after all is said and done,
To think that I'm the lucky one.
I can't believe that you're in love with me.",I Can't Believe That You're in Love With Me,2001
Dianne Reeves,"Embrace me, my sweet embraceable you
Embrace me, you irreplaceable you

Just one look at you
My heart grew tipsy in me
You and you alone
Bring out the Gypsy in me

I love all the many charms about you
Above all, I want my arms about you

Don't be a naughty baby
Come to mama, come to mama do
My sweet embraceable you

I love all the many charms about you
Above all, I want my arms about you

Don't be a naughty baby
Come to mama, come to mama do
My sweet embraceable you",Embraceable You,2001
Dianne Reeves,"Got a little rhythm, a rhythm, a rhythm
That pit-a-pats through my brain;
So darn persistent,
The day isn't distant
When it'll drive me insane.
Comes in the morning
Without any warning,
And hangs around me all day.
I'll have to sneak up to it
Someday, and speak up to it.
I hope it listens when I say:

Fascinating rhythm,
You've got me on the go!
Fascinating Rhythm,
I'm all a-quiver.

What a mess you're making!
The neighbors want to know
Why I'm always shaking
Just like a flivver.

Each morning I get up with the sun 
Start a-hopping,
Never stopping 
To find at night no work has been done.

I know that
Once it didn't matter 
But now you're doing wrong;
When you start to patter
I'm so unhappy.

Won't you take a day off?
Decide to run along
Somewhere far away off 
And make it snappy!

Oh, how I long to be the man I used to be!
Fascinating rhythm,
On won't you stop picking on me?",Fascinating Rhythm,2001
Dianne Reeves,"I hadn't anyone till you,
I was a lonely one 'til you,
I used to lie awake and wonder if there could be
A someone in the wide world just made for me,
Now I see

I had to save my love for you, (I saved my love for you)
I never gave my love 'til you, (I saved it all for you)
And through my lonely heart demanding it,
Cupid took a hand in it,
I hadn't anyone till you.

I kept my love in secrecy,
I put it under lock and key,
I had to save my love for you!
I never gave my love away,
I waited for that lucky day
When I could give it to you

And through my lonely heart demanding it,
Cupid took a hand in it,
I hadn't anyone till you.",I Hadn't Anyone Till You,2001
Dianne Reeves,"If you could see me now, you'd know how blue I've been
One look is all you'd need to see the mood I'm in.
Perhaps then you'd realize I'm still in love with you.
If you could see me now, you'd find me being brave
And trying awfully hard to make my tears behave
But that's quite impossible, I'm still in love with you.
 
You'll happen my way on some mem'rable day
And the month will be May for a while.
I'll try to smile but can I play the part
Without my heart behind the smile?
 
The way I feel for you I never could disguise
The look of love is written plainly in my eyes.
I think you'd be mine again if you could see me now.",If You Could See Me Now,2001
Dianne Reeves,"Lullaby of Birdland, that's what I 
Always hear when you sigh
Never in my wordland 
Could there be ways to reveal
In a phrase how I feel

Have you ever heard two turtle doves
Bill and coo when they love?
That's the kind of magic 
Music we make with our lips when we kiss

And there's a weepy old willow
He really knows how to cry
That's how I'd cry in my pillow
If you should tell me farewell and goodbye

Lullaby of Birdland whisper low
Kiss me sweet and we'll go
Flyin' high in Birdland
High in the sky up above
All because we're in love",Lullaby of Birdland,2001
Dianne Reeves,"Isn't it rich?
Are we a pair?
Me here at last on the ground,
you in mid-air.
Where are the clowns?

Isn't it bliss?
Don't you approve?
One who keeps tearing around,
one who can't move.
Where are the clowns?
There ought to be clowns.

Just when I'd stopped
opening doors,
finally knowing 
the one that I wanted was yours,
Making my entrance again,
with my usual flair,
Sure of my lines,
no one is there.

Don't you love farce?
My fault, I fear.
I thought that you'd want what I want 
sorry, my dear.
And where are the clowns?
Quick, send in the clowns.
Don't bother, they're here.

Isn't it rich?
Isn't it queer?
Losing my timing this late
in my career?
And where are the clowns?
There ought to be clowns.
Well, maybe next year",Send in the Clowns,2001
Dianne Reeves,"Speak low when you speak, love
Our summer day withers away too soon, too soon
Speak low when you speak, love
Our moment is swift, like ships adrift, we're swept apart, too soon
Speak low, darling, speak low
Love is a spark, lost in the dark too soon, too soon
I feel wherever I go that tomorrow is near, tomorrow is here and always too soon
Time is so old and love so brief
Love is pure gold and time a thief
We're late, darling, we're late
The curtain descends, ev'rything ends too soon, too soon
I wait, darling, I wait
Will you speak low to me, speak love to me and soon",Speak Low,2001
Dianne Reeves,"It's very clear, our love is here to stay
Not for a year but ever and a day
The radio and the telephone and the movies that we know
May just be passing fancies and in time may go

But oh, my dear, our love is here to stay
Together we're going a long, long way
In time the Rockies may crumble, Gibraltar may tumble
They're only made of clay
But our love is here to stay

In time the Rockies may crumble, Gibraltar may tumble
They're only made of clay
But our love is here to stay",Love Is Here to Stay,2002
Dianne Reeves,"Look at me I'm as helpless as a kitten up a tree
And I feel like I'm clinging to a cloud
I can' t understand
I get misty just holding your hand
Walk my way

And a thousand violins begin to play
Or it could be the sound of your hello
That music I hear
I get misty the moment you're near
You can see that you're leading me on
But it's just what I want you to do
Don't you notice how hopelessly I'm lost
That's why I'm following you
On my own

Should I wander through this wonderland alone
Never knowing my right foot from my left
My hat from my glove
I'm too misty and too much in love You can say that you're leading me on
And it's just what I want you I want you I want you to do
Don't you notice don't you notice how hopelessly I'm lost
That's why I'm following you
Oh on my own

Could I wander through this wonderland alone
Never knowing my right foot from my left
My hat from my glove
I'm too misty and too much in love
I'm too misty and too much in love
Look at me",Misty [#],2002
Dianne Reeves,"Darn that dream I dream each night
You say you love me and you hold me tight
But when I awake, you're out of sight
Oh, darn that dream
Darn your lips and darn your eyes
They lift me high above the moonlit skies
Then I tumble out of paradise
Oh, darn that dream
Darn that one-track mind of mine
I can't understand that you don't care
Just to change the mood I'm in
I'd welcome a nice old nightmare
Darn that dream and bless it too
Without that dream, I never would have you
But it haunts me and it won't come true
Oh, darn that dream",Darn That Dream,2003
Dianne Reeves,"Whenever skies look gray to me
And trouble begins to brew,
Whenever the Winter winds become too strong,
I concentrate on you.

When fortune cries ""Nay! Nay!"" to me
And people declare ""You're through!"",
Whenever the blues become my only song,
I concentrate on you.

On your smile so sweet, so tender,
When at first your kiss I decline.
On the light in your eyes when I surrender,
And once again our arms intertwine

And so, when wise men say to me
That love's young dream never comes true,
To prove that even wise men can be wrong,
I concentrate on you.",I Concentrate on You,2003
Dianne Reeves,"I never have been handed much
I never have demanded much
I just want money, a nice position and loads of lovely love
I never have expected much
I never have rejected much
I want my dinner, some smart conversation and loads of lovely love

Some people go for quantity
Others go for quality

I've got the answer now it's not how much but how
I do not ask for bliss I guess it all boils down to this I guess
I just want money and then more money and loads of lovely love
I just want money, a nice position and loads of lovely love
I want my dinner, some smart conversation and loads of lovely love
I just want money and then more money and loads of lovely love

Some people go for quantity
Others go for quality

I've got the answer now it's not how much but how
I do not ask for bliss I guess it all boils down to this I guess
I just want money and then more money and loads of lovely love
Loads of lovely love...
I want my dinner, some smart conversation, a nice position will do
But I want loads and loads and loads of lovely love
",Loads of Love,2003
Dianne Reeves,"Come on along and listen to
The lullaby of Broadway.
The hip-hooray and balley-hoo.
The lullaby of Broadway.
The rumble of the subway train.
The rattle of the taxi.
The Daffodils who entertain
At Angelo's and Maxi's.
When a Broadway baby says good night,
It's early in the morning.
Manhattan babys don't sleep tight
Until the dawn.
Good night, baby.
Good night. Milkman's on his way.
Sleep tight, baby.
Sleep tight. Let's call it another day.
Come on along and listen to
The lullaby of Broadway.
The hi-de-hi and boop-buh-doo.
It's just the lullaby of Broadway.
The band begins to go to town
And everyone goes crazy.
You rock-a-bye your baby 'round
'til early in the morning.
Hush-a-bye, I'll buy you this nd that,
You hear your daddy sayin'.
Then baby goes home to her flat
To sleep all day.
Good night, baby.
Good night. Milkman's on his way.
Sleep tight, oh, my baby.
Sleep tight. Let's call it a day.
Listen to the lullaby of old Broadway!",Lullaby of Broadway,2003
Dianne Reeves,"As I'm reflecting back on my life
It's like a dream
Things are not quiet what they seem
There's always something missing, something unseen but indeed remembered
I think a pass I might have taken lives I'd have changed
Some living living souls rearranged and I'm amazed how tender feelings can be
In looking back we just peek through the cracks between what's real and false
In this eternal waltz meanwhile we just keep dancing
Now at the end of my reflection
I have to say I would live life the same way
But that's the way that life goes
Thank God I'm a woman who knows
In looking back we just peek through the cracks between what's real and false
In this eternal waltz meanwhile we just keep dancing
Now at the end of my reflection
I have to say I would live lie the same way
But that's the way that life goes
Thank God I'm a woman who knows",Reflections,2003
Dianne Reeves,"Skylark
Have you anything to say to me?
Won't you tell me where my love can be?
Is there a meadow in the mist
Where someone's waiting to be kissed?

Skylark
Have you seen a valley green with spring?
Where my heart can go a journeying
Over the shadows and the rain
To a blossom covered lane

And in your lonely flight
Haven't you heard the music in the night?
Wonderful music, faint as a will o' the wisp
Crazy as a loon, sad as a gypsy serenading the moon

Oh skylark
I don't know if you can find these things
But my heart is riding on your wings
So if you see them anywhere
Won't you lead me there?

Oh skylark
I don't know if you can find these things
But my heart is riding on your wings
So if you see them anywhere
Won't you lead me there?",Skylark,2003
Dianne Reeves,"

Ooh,
What a little moonlight can do
Ooh, ooh, ooh
What a little moonlight can do for you
You're in love
Your heart's aflutter
All day long you only stutter cause your poor tongue
Just will not utter the words
'I love you'
Ooh
Ooh, ooh, ooh
What a little moonlight can do
Wait a while
Till a little moonbeam comes peepin' through
You'll get bold
Can't resist him
All you'll say
When you have kissed him is
Ooh, ooh, ooh
What a little moonlight can do
Ooh, ooh, ooh",What a Little Moonlight Can Do,2003
Dianne Reeves,"Hark! how the bells
Sweet silver bells
All seem to say,
""Throw cares away.""
Christmas is here
Bringing good cheer
To young and old
Meek and the bold

Ding, dong, ding, dong
That is their song
With joyful ring
All caroling
One seems to hear
Words of good cheer
From ev'rywhere
Filling the air

Oh how they pound,
Raising the sound,
O'er hill and dale,
Telling their tale,
Gaily they ring
While people sing
Songs of good cheer
Christmas is here
Merry, merry, merry, merry Christmas
Merry, merry, merry, merry Christmas

On, on they send
On without end
Their joyful tone
To ev'ry home

Hark! how the bells
Sweet silver bells
All seem to say,
""Throw cares away.""
Christmas is here
Bringing good cheer
To young and old
Meek and the bold

Ding, dong, ding, dong
That is their song
With joyful ring
All caroling
One seems to hear
Words of good cheer
From ev'rywhere
Filling the air

Oh how they pound,
Raising the sound,
O'er hill and dale,
Telling their tale,
Gaily they ring
While people sing
Songs of good cheer
Christmas is here
Merry, merry, merry, merry Christmas
Merry, merry, merry, merry Christmas

On, on they send
On without end
Their joyful tone
To ev'ry home

Ding, dong, ding, dong",Carol of the Bells,2004
Dianne Reeves,"Christmas time is here
Happiness and cheer
Fun for all that children call
Their favorite time of the year

Snowflakes in the air
Carols everywhere
Olden times and ancient rhymes
Of love and dreams to share

Sleigh bells in the air
Beauty everywhere
Yuletide by the fireside
And joyful memories there

Christmas time is here
We'll be drawing near
Oh, that we could always see
Such spirit through the year
Oh, that we could always see
Such spirit through the year",Christmas Time Is Here,2004
