Band,Lyrics,Song,Year
Steve March Tormé,"A buzzard took the monkey for a ride in the air
The monkey thought that ev'rything was on the square
The buzzard tried to throw the monkey off his back
But the monkey grabbed his neck and said, now, listen, Jack

Straighten up and fly right
Straighten up and fly right
Straighten up and fly right
Cool down papa, don't you blow your top

Ain't no use in divin', what's the use of jivin'
Straighten up and fly right
Cool down papa, don't you blow your top

The buzzard told the monkey, you're choking me
Release your hold and I'll set you free
The monkey looked the buzzard right dead in the eye and said
Your story's touching, but is sounds like a lie

Straighten up and fly right
Straighten up and stay right
Straighten up and fly right
Cool down papa, don't you blow your top

Straighten up and fly right
Straighten up and stay right
Straighten up and fly right
Cool down papa, don't you blow your top
Fly right",Straighten Up and Fly Right,1999
Steve March Tormé,"Oh, it's a long, long while from May to December
But the days grow short when you reach September
When the autumn weather turns the leaves to flame
One hasn't got time for the waiting game

Oh, the days dwindle down to a precious few
September, November
And these few precious days I'll spend with you
These precious days I'll spend with you",September Song,2000
Steve March Tormé,"When you're young and so in love as we
And bewildered by the world we see
Why do people get a soul
Ony those in love would know
What a town without pity can do

If we stop to gaze upon a star
People talk about how ""bad"" we are
Ours is not an easy age
We're like tigers in a cage
What a town without pity can do

The young have problems
Many problems
We need an understanding heart
Why don't they help us
Try to help us
Before this plain granted planet falls apart

Take these eager lips and hold me fast
I'm afraid this kind of joy can't last
How can we keep love alive
How can anything survive
When these little minds tear you in two
What a town without pity can do

How can we keep love alive
How can anything survive
When these little minds tear you in two
What a town without a pity can do
No it isn't very pretty 
What a town without pity can do
",Town Without Pity,2000
Steve March Tormé,"Though folks with good intentions
Tell me to save my tears
Well I'm so mad about him
I can't live without him

Never treats me sweet and gentle
The way he should
I've got it bad
And that ain't good

My poor heart is so sentimental
Not made of wood
I've got it so bad
And that ain't good

But when the fish are jumpin'
And Friday rolls around
My man an' I, we gin some
We pray some, and sin some

He don't love me like I love him
The way he should
I've got it bad
And that ain't good
Yes I've got it bad
And that ain't good",I Got It Bad (And That Ain't Good),2003
Steve March Tormé,"My love must be a kind of blind love
I can't see anyone but you
Sha bop sha bop

Are the stars out tonight
I don't know if it's cloudy or bright
I only have eyes for you dear

The moon may be high
But I can't see a thing in the sky
I only have eyes for you

I don't know if we're in a garden
Or on a crowded avenue

You are here and so am I
Maybe millions of people go by
But they all disappear from view
And I only have eyes for you",I Only Have Eyes for You,2003
Steve March Tormé,"The very thought of you makes my heart sing
Like an April breeze on the wings of spring,
And you appear in all your splendor,
My one and only love.

The shadows fall and spread their mystic charms
In the hush of night while you're in my arms.
I feel your lips, so warm and tender,
My one and only love.

The touch of your hand is like heaven,
A heaven that I've never known.
The blush on your cheek whenever I speak
Tells me that you are my own.

You fill my eager heart with such desire.
Ev'ry kiss you give sets my soul on fire.
I give myself in sweet surrender,
My one and only love.",My One and Only Love,2003
Steve March Tormé,"Its not the pale moon that excites me
That thrills and delights me, oh no 
Its just the nearness of you 

It isn't your sweet conversation 
That brings this sensation, oh no 
Its just the nearness of you 

When you're in my arms and I feel you so close to me 
All my wildest dreams come true 

I need no soft lights to enchant me 
If you'll only grant me the right 
To hold you ever so tight 
And to feel in the night the nearness of you",The Nearness of You,2003
Steve March Tormé,"And now the purple dusk of twilight time
Steals across the meadows of my heart
High up in the sky the little stars climb
Always reminding me that we're apart
You wander down the lane and far away
Leaving me a song that will not die
Love is now the stardust of yesterday
The music of the years gone by.
 
Sometimes I wonder, how I spend
The lonely nights
Dreaming of a song
The melody 
Haunts my reverie
And I am once again with you
When our love was new 
And each kiss an inspiration
But that was long ago
And now my consolation is in the stardust of a song

Besides the garden wall, when stars are bright
You are in my arms
The nightingale 
Tells his fairytale
Of paradise, where roses grew
Though I dream in vain
In my heart it will remain
My stardust melody
The memory of love's refrain.",Stardust,2003
Steve Marcus,"Listen people to what I say
I say everybody's got to have their day

And don't you know that
Everybody's got to love somebody sometime
Everybody's got to win a heart
Everybody's got to love somebody sometime
When you do, I hope you never part

I once found love, found love just like you
But then he came, he might come to you

And don't you know that
Everybody's got to lose somebody sometime
But everybody can part
Everybody's got to lose somebody sometime
So take care that you don't lose your heart

Take my advice and you'll always find
You'll be happy all of the time
Take my advice and you will see
You'll be happy as you can be

Listen people to what I say
I say everybody's got to have their day

And don't you know that
Everybody's got to love somebody sometime
Everybody's got to win a heart
Everybody's got to love somebody sometime
When you do, I hope you never part
You never part
Listen people
Listen people",Listen People,1968
Steve Marcus,"Hey Jude, don't make it bad
Take a sad song and make it better
Remember to let her into your heart
Then you can start to make it better

Hey Jude, don't be afraid
You were made to go out and get her
The minute you let her under your skin
Then you begin to make it better

And anytime you feel the pain, hey Jude, refrain
Don't carry the world upon your shoulders
For well you know that it's a fool who plays it cool
By making his world a little colder

Hey Jude, don't let me down
You have found her, now go and get her
Remember to let her into your heart
Then you can start to make it better

So let it out and let it in, hey Jude, begin
You're waiting for someone to perform with
And don't you know that it's just you, hey Jude, you'll do
The movement you need is on your shoulder

Hey Jude, don't make it bad
Take a sad song and make it better
Remember to let her under your skin
Then you'll begin to make it
Better better better better better better, oh

Na na na nananana, nannana, hey Jude",Hey Jude,1969
Steve Marcus,"Wild thing, you make my heart sing
You make everything groovy, wild thing
Wild thing, I think I love you
But I wanna know for sure
Come on and hold me tight
I love you
 
Wild thing, you make my heart sing
You make everything groovy, wild thing
Wild thing, I think you move me
But I wanna know for sure
Come on and hold me tight
You move me
 
Wild thing, you make my heart sing
You make everything groovy, wild thing
Wild thing, you make my heart sing
You make everything groovy, wild thing
Wild thing, you make my heart sing
You make everything groovy, wild thing",Wild Thing,1969
Steve Marcus,"The very thought of you makes my heart sing
Like an April breeze on the wings of spring,
And you appear in all your splendor,
My one and only love.

The shadows fall and spread their mystic charms
In the hush of night while you're in my arms.
I feel your lips, so warm and tender,
My one and only love.

The touch of your hand is like heaven,
A heaven that I've never known.
The blush on your cheek whenever I speak
Tells me that you are my own.

You fill my eager heart with such desire.
Ev'ry kiss you give sets my soul on fire.
I give myself in sweet surrender,
My one and only love.",My One and Only Love,1993
Steve Marcus,"Skylark
Have you anything to say to me?
Won't you tell me where my love can be?
Is there a meadow in the mist
Where someone's waiting to be kissed?

Skylark
Have you seen a valley green with spring?
Where my heart can go a journeying
Over the shadows and the rain
To a blossom covered lane

And in your lonely flight
Haven't you heard the music in the night?
Wonderful music, faint as a will o' the wisp
Crazy as a loon, sad as a gypsy serenading the moon

Oh skylark
I don't know if you can find these things
But my heart is riding on your wings
So if you see them anywhere
Won't you lead me there?

Oh skylark
I don't know if you can find these things
But my heart is riding on your wings
So if you see them anywhere
Won't you lead me there?",Skylark,2007
Steve Marriott,"Three six nine, the goose drank wine.
The monkey chew tobacco on the street car line. 
The line broke, the monkey got choked 
and they all went to heaven in a little rowboat.
Clap Pat Clap Pat Clap Pat Slap! Clap Pat!
Clap your hand, Pat it on your partner's hand . . . Right Hand. 
Clap Pat Clap your hand. Cross it with your left arm.
Pat you partner's left palm.
Clap Pat, Clap your hand, Pat your partner's right palm 
with your right palm again.
Clap Slap, Clap your hand, Slap your thighs and sing a little song.
 
My mother told me, If I was goody.
that she would buy me a rubber dolly.
My Aunty told her I kissed a soldier,
now she won't buy me a rubber dolly.
(Spoken) Three six nine, the goose drank wine.
The monkey chew tobacco on the street car line. 
The line broke, the monkey got choked 
and they all went to heaven in a little rowboat.
 
Clap Clap (Clap your hands and prepare to pat)
Pat (Take your right arm Put your partner's right palm with your right palm)
Clap (Take your hand back and clap)
Pat (Take your right arm, cross your right arm with  your left arm. Pat 
your              partner's left palm with your left palm.)
 
Clap(Take your hand back and Clap)
Pat (Take your right arm, cross your left arm Pat your partner's right 
palm       with your right palm.)
Clap(Now back, with a clap)
Slap (Take the pats of your palms and slap your thighs and watch the 
fun          materialize as you sing this little song. . . 
 
My mother told me, If I was goody.
that she would buy me a rubber dolly.
My Aunty told her I kissed a soldier,
now she won't buy me a rubber dolly.
Clap Pat Clap Pat Clap Pat Clap Slap!",The Clapping Song,1989
Steve Marriott,"When you move in right up close to me
That's when I get the shakes all over me
Quivers down my back bone
I've got the shakes down the kneebone
Yeah havin' the tremors in the thighbone
Shakin' all over
 
Just the way you say goodnight to me
Brings that feeling on inside of me
Quivers down my back bone
I've got the quivers down the thighbone
Yeah the tremors in my back bone
Shakin' all over
 
Quivers down my back bone
Yeah I have the shakes in the kneebone
I've got the tremors in the back bone
Shakin' all over

Well, you make me shake and I like it, baby
Well, you make me shake and I like it, baby
Well, you make me shake and I like it, baby",Shakin' All Over,1989
Steve Marriott,"I've been checking over my shoulder
Something's follwing me
The back of my neck is feeling much colder
It's there but I just can't see
One day I'll meet it and that'll be that
I know I'm going to beat it, it's a natural fact

The bigger they come - the harder they fall
The bigger they come - the harder they fall

I've been ducking down some deep dark alleyways
I've done some divin' around
Blindly feeling my way through the city
Got my ear to the ground
I've got to shake it this feeling so bad
It could be the best time that I've ever had 'cause

The bigger they come - the harder they fall
The bigger they come - the harder they fall

Here comes a merchant
he wants money in his hand
I know that he won't listen 
He just don't understand
They creep out after midnight
They sliding all around
Working on the night shift 
It's going on all over town

The bigger they come - the harder they fall
The bigger they come - the harder they fall",The Bigger They Come,1991
Steve Marriott,"I thought you'd listen to my reason
But now I see you don't hear a thing
Got to make you see how it's got to be
Yes if it's all right

All or nothing yeah yeah
All or nothing
All or nothing for me

Things could work out just like I want them to
If I could have the other half of you
That's all I would if I only could
Is to say

All or nothing oh yeah
All or nothing if I could I'd say
All or nothing for me

Pa pa pa pa ta pa pa pa ta ta
Pa pa pa pa ta pa pa pa ta ta

I ain't telling you no lie girl
So don't just sit there and cry girl
All or nothing (oh no)
All or nothing (oh yeah)
All or nothing (gotta gotta gotta keep on tryin')
All or nothing
(For me, for me, for me we're not children)",All or Nothing,1993
Steve Marriott,"I don't need no doctor
'Cause I know what's ailing me
I don't need no doctor, no, no
'Cause I know what's ailing me

I've been too long
Away from my baby, ah
I'm coming down with a misery
(I don't need no doctor)
(I don't need no doctor)

I don't need no doctor
For my prescription to be filled
(I don't need no doctor)
(I don't need no doctor)

I don't need no doctor
I tell you now
For my prescription to be filled
(I don't need no doctor)
(I don't need no doctor)

Only my baby's arms, ah
Could ever take away this chill
(I don't need no doctor)
(I don't need no doctor)

Now the doctor say I need rest
(Hey, hey)
But all I need
Is her tenderness

Put me on the critical list
(Hey, hey)
When all I need
Is her sweet kiss

He gave me a medicated lotion
But it didn't soothe
(It didn't soothe)
My emotion

I don't need no doctor
I don't need no doctor

I don't need no doctor
For my hope to live is gone
(I don't need no doctor)
(I don't need no doctor)

I don't need no doctor, no, no
Whoa, my hope to live is gone
(I don't need no doctor)
(I don't need no doctor)

All I need is my baby
Baby, please
Won't you please come on home
Log on to kill this message

(I don't need no doctor)
You know what I'm talking 'bout
(I don't need no doctor)

I don't need no aspirins
(I don't need no doctor)
I don't need no lotion
(I don't need no doctor)

I say, ""I don't need no vitamin pills""
(I don't need no doctor)
I don't need

",I Don't Need No Doctor,1993
Steve Marriott,"Over Bridges of Sighs
To rest my eyes in shades of green

Under Dreaming Spires 
To Itchycoo Park, that's where I've been

What did you do there? - I got high 
What did you feel there? - Well I cried
But why the tears there? - I'll tell you why - yyyyy 
It's all too beautiful, It's all too beautiful
It's all too beautiful, It's all too beautiful

I feel inclined to blow my mind 
Get hung up, feed the ducks with a bun 
They all come out to groove about 
Be nice and have fun in the sun 
I'll tell you what I'll do - What will you do?

I'd like to go there now with you
You can miss out school - Won't that be cool 
Why go to learn the words of fools?

What will we do there? - We'll get high 
What will we touch there? - We'll touch the sky 
But why the tears there? I'll tell you why 
It's all too beautiful, It's all too beautiful
It's all too beautiful, It's all too beautiful

I feel inclined to blow my mind 
Get hung up, feed the ducks with a bun 
They all come out to groove about 
Be nice and have fun in the sun 
It's all too beautiful, It's all too beautiful
It's all too beautiful, It's all too beautiful",Itchycoo Park,1998
Steve Marriott,"There she is again
Steppin' out of her limousine, well
Looking like the cover of a twenty-dollar magazine
She's got it made and branded
If you know what I mean

She's a...natural born woman
Natural born woman
She's a...she's a natural born woman

There she is again watch her stop the Main Street in its tracks
Looking like Creole queen
Hair hangin' down her back
I say, don't look too long, boy
She'll make your glasses crack

She's a...natural born woman
Natural born woman
She's a...she's a natural born woman

Get your track
Yeah, natural born woman
Yeah, yeah...
Natural born woman
Yeah, yeah...
She's a natural born woman

Well, I'm sweatin' and I'm shakin'
When I'm bringin' you the news
You can do anything
But lay off of my blue suede shoes
That's why I'm standin' here today
Preachin' natural born woman blues

Well, she's a...natural born woman
Well, yeah...
Natural born woman
Well, yeah...
Natural born woman

Well, I'm looking out my back door
Wonderin' which place to go
Think I'll move on down to Memphis
Pay my money to see a rock 'n' roll show
Find me a sweet-heart Susie
Together we can lose control

Ooh, yeah, yeah, yeah, yeah
She's a...natural born woman
Yeah, yeah...
Natural born woman
Yeah...
Natural born woman
Yeah, ooh...
Ooh...
All right...
Ooh...",Natural Born Boogie,1998
Steve Marriott,"Well I went down to the bunny station
Cause I wanted love for a week or two
I wanted you on a week vacation
Cause its costing me but its killing you

NaNa Naaa NaNa
NaNa Naaa NaNa
NaNa Naaa NaNa NaNa Naa
Alright

Well I got a friend in the fire department
He was telling me I'm on the road to Rome
He said you'd better find out where you're going
Cause your wife can't fight out all the fires alone

NaNa Naaa NaNa
NaNa Naaa NaNa
NaNa Naaa NaNa NaNa Naa
Hit me

Well we passed the time in there but we got thrown out
It was falling down and it was overgrown
He said I can see you now ask the captain
He says boy you're really on the road to Rome

NaNa Naaa NaNa
NaNa Naaa NaNa
NaNa Naaa NaNa NaNa Naa",Midnight Lady,1998
Steve Marriott,"I've got sunshine on a cloudy day
When it's cold outside I've got the month of May
I guess you'd say
What can make me feel this way?
My girl (my girl, my girl)
Talkin' 'bout my girl (my girl)

I've got so much honey the bees envy me
I've got a sweeter song than the birds in the trees
I guess you'd say
What can make me feel this way?
My girl (my girl, my girl)
Talkin' 'bout my girl (my girl)

Hey hey hey
Hey hey hey
Ooh

I don't need no money, fortune, or fame
I've got all the riches baby one man can claim
I guess you'd say
What can make me feel this way?
My girl (my girl, my girl)
Talkin' 'bout my girl (my girl)

I've got sunshine on a cloudy day
With my girl

I've even got the month of May
With my girl",My Girl,1999
Steve Marriott,"I am a little tin soldier that wants to jump into your fire
You are a look in your eye
A dream passing by in the sky
I don't understand
And all I need is treat me like a man
I ain't no child
Take me like I am
I got to know that I belong to you
Do anything that you want to do
Sing any so song that you want me to sing to you

I don't need no aggravation
I just got to make you
I just got to make you my occupation, oh yeah (I got to know that I belong to you)
(Do anything that you want to do)
(Sing any so song that you want me to sing to you)

Sing to you
All I need is your whispered hello
Smiles melting the snow, nothing heard
Your eyes, they're deeper than time
Say a love that won't rhyme without words
Now I've lost my way
I need help to show me things to say
Give me your love before mine fades away, yeah, baby 
(I got to know that I belong to you)
(Do anything that you want to do)
(Sing any so song that you want me to sing to you)

Sing to you oh, no, no
Yeah, yeah
I just want some reaction
Someone to give me satisfaction
All I want to do is stick with you, because I love you",Tin Soldier,1999
Steve Marriott,"Together we'll stand
Divided we'll fall
Come on now people
Let's get on the ball
And work together
Come on, come on
Let's work together
(Now now people)
Because together we will stand
Every boy, every girl and man
People, when things go wrong
As they sometimes will
And the road you travel
It stays all uphill
Let's work together
Come on, come on
Let's work together
You know together we will stand
Every boy, girl, woman and man
Oh well now, two or three minutes
Two or three hours
What does it matter now
In this life of ours
Let's work together
Come on, come on
Let's work together
(Now now people)
Because together we will stand
Every boy, every woman and man
Come on, let's work together...
Well now, make someone happy
Make someone smile
Let's all work together
And make life worthwhile
Let's work together
Come on, come on
Let's work together
(Now now people)
Because together we will stand
Every boy, girl, woman and man
Oh well now, come on you people
Walk hand in hand
Let's make this world of ours
A good place to stand
And work together
Come on, come on
Let's work together
(Now now people)
Because together we will stand
Every boy, girl, woman and man
Well now together we will stand
Every boy, girl, woman and man",Let's Work Together,2000
Steve Marriott,"I love you Babe
Do you know?
I'll be any place
You want me to go

Save my love for you
Yes I will
When you need love to help you
Do not fear
Sweet sweet Baby
I've found a nurse
I know I can girl
You be my trust

Ooh ee Baby
Ooh ee
Get down and do those things you do to me
You're alright
Oh! Yer!

All the time since
You left your spell on me
Your lovin' set my soul on fire
Your love is my one desire

Ooh ee Baby
Ooh ee
Get down and do those things you do to me
Yer! Yer!

Like didn't I say the rest girl?
Always tryin' to do
Your best girl
I love you girl
Do you know?
I'll be any place
Anytime you want me to go

Ooh ee Baby
Ooh ee
Get down and do those things you do to me
Get on down
Ooh ee Baby
Get on down",Get Down to It,2005
Steve Marriott,"My, my, my, my
Don't you worry 'bout what's on your mind (oh my)
I'm in no hurry I can take my time (oh my)
I'm going red and my tongue's getting tied (tongues' getting tied)
I'm off my head and my mouth's getting dry.
I'm high, but I try, try, try (oh my)
Let's spend the night together
Now I need you more than ever
Let's spend the night together now

I feel so strong that I can't disguise (oh my)
Let's spend the night together
But I just can't apologize (oh no)
Let's spend the night together
Don't hang me up and don't let me down (don't let me down)
We could have fun just groovin' around around and around
Oh my, my
Let's spend the night together
Now I need you more than ever
Let's spend the night together

Let's spend the night together
Now I need you more than ever

You know I'm smiling baby
You need some guiding baby
I'm just deciding baby; now-
I need you more than ever
Let's spend the night together
Let's spend the night together now

This doesn't happen to me ev'ryday (oh my)
Let's spend the night together
No excuses offered anyway (oh my)
Let's spend the night together
I'll satisfy your every need (every need)
And I now know you will satisfy me
Oh my, my, my, my, my
Let's spend the night together
Now I need you more than ever
Let's spend the night together now",Let's Spend the Night Together,2005
Steve Marriott,"Woman shed tears of Sorrow for their men so far away
With hope they wait for tomorrow - but in the night
They bow their heads and pray
They live by the sword and the gun
And now they march through the darkness
The fire of freedom burns brught like the sun

Soldier
Fighting for liberty
With blood on your hands
You lead your command onward...to victory
Soldier

Thrashing across the seas
Mighty you stand
Defending the land
With a heart that's brave and free

Back home there's fear and hunger
Out in the streets
The desperate bleed
Out in this world there stalks a killer

Who's heart is filled with lust and greed
Soldier
Fighting for liberty
With blood on your hands
You lead your command onward... to victory

Soldier
Thrashing across the seas
Mighty you stand
Defending the land
With a heart that's brave and free...",Soldier,2005
Steve Marriott,"The worst person I know, mother-in-law, mother-in-law
She worries me so, mother-in-law,mother-in-law
If she leaves us alone, we would have a happy home
Sent down from below
Mother-in-law, mother-in-law, mother-in-law, mother-in-law

Sin should be her name, mother-in-law, mother-in-law
To me, they're about the same, mother-in-law, mother-in-law
Every time I open my mouth, she steps in, tries to put me out
How could she stoop so low?
Mother-in-law, mother-in-law, mother-in-law, mother-in-law

I come home with my pay, mother-in-law, mother-in-law
She asks me what I make, mother-in-law, mother-in-law
She thinks her advice is a contribution
But if she will leave that will be a solution
And don't come back no more
Mother-in-law, mother-in-law, mother-in-law, mother-in-law

Sin should be her name,  mother-in-law, mother-in-law
To me, they're about the same, mother-in-law, mother-in-law
Every time I open my mouth, she steps in, tries to put me out
How could she stoop so low?
Mother-in-law, mother-in-law, mother-in-law, mother-in-law",Mother in Law,2006
