Band,Lyrics,Song,Year
Chris August,"The downside of being up is my inside is empty of
The one thing my heart truly needs
When I feel invincible a million miles from miserable
It's always all about me

I don't know why I don't love You like I should, like You would
Through bad and good oh

Funny how we figure out where happiness is found
In the midst of this sadness I'm closer to You now
And thats the upside of down, the upside of down
Its all switched around, I lost and I found
The upside of down

You are more in my less, You are strength in my weakness
I'll never go back again
And then Your sunshine ends the rain and I return to my old ways
Why am I a fair weather friend?

I wanna be the one to love You like I should, like You would
Through the bad and good oh

Funny how we figure out where happiness is found
In the midst of this sadness I'm closer to You now

Thats the upside of tragedies knowing You're holding my heart always, always
I may be down but I'm finding there's joy in the pain, in the pain

Funny how we figure out where happiness is found
In the midst of this sadness I'm closer, Im closer to You now and oh

Funny how we figure out where happiness is found
In the midst of this sadness I'm closer to You now
And thats the upside of down, the upside of down
Its all switched around, I lost and I found
The upside of down

The upside of down
Its all switched around, I lost and I found
The upside of down",The Upside of Down,2012
Chris August,"I've been runnin round in circles, but I can't do this on my own
To be so far away from perfect, thats all I've ever known
It's not like I ain't been tryin, 'cause I've been trying every door
And when they'd open I'd be lyin on the floor 'cause I'm always falling short

I've been lost chasing dreams of yesterday
Found my heart always leading me astray
So take these broken wings and teach them to fly
'Cause You're changing me from water into wine

I guess I thought that it'd be easy 'cause people always speak of peace
And now I'm picking up the pieces left of me
'Cause I can see that it was You breaking me

I've been lost chasing dreams of yesterday
Found my heart always leading me astray
So take these broken wings and teach them to fly
'Cause You're changing me from water into wine
From water into wine

I knew about the story revealing all Your glory
How You can take the nothing and turn it into something
But now I see my own life changing before my eyes
You saw me at my worst and fulfilled my thirst like water into wine

I've been lost chasing dreams of yesterday
Found my heart always leading me astray
So take these broken wings and teach them to fly
'Cause You're changing me from water into wine
From water into wine",Water Into Wine,2012
Chris August,"Seated above, enthroned in the Father's love
Destined to die, poured out for all mankind
God's only Son, perfect and spotless one
He never sinned but suffered as if He did

All authority
Every victory is Yours
All authority
Every victory is Yours

Savior
Savior, worthy of honor and glory
Worthy of all our praise, You overcame
Jesus, awesome in power forever
Awesome and great is Your name, You overcame

Power in hand speaking the Father's plan
You're sending us out, light in this broken land

All authority
Every victory is Yours

Savior, worthy of honor and glory
Worthy of all our praise, You overcame, You overcame
Jesus, awesome in power forever
Awesome and great is Your name, You overcame, yeah

We will overcome by the blood of the Lamb
And the word of our testimony, everyone overcome

We will overcome by the blood of the Lamb
And the word of our testimony, everyone overcome

We will overcome by the blood of the Lamb
And the word of our testimony, everyone overcome

We will overcome by the blood of the Lamb
And the word of our testimony, everyone overcome

Savior, worthy of honor and glory
Worthy of all our praise, You overcame, You overcame Jesus
Jesus, awesome in power forever
Awesome and great is Your name, You overcame

You overcame (You overcame)
Jesus (You overcame)
You overcame (You overcame)
You overcame

Savior, worthy of honor and glory
Worthy of all our praise, You overcame, You overcame
Jesus, awesome in power forever
Awesome and great is Your name (Your name), You overcame
You overcame
Jesus
You overcame",Forever Reign,2014
Chris Aycrigg,"No one here can love or understand me
Oh, what hard luck stories they all hand me
Pack up all my cares and woe, here I go, winging low
Bye, bye, blackbird

Where somebody waits for me
Sugar's sweet, so is she
Bye, bye, blackbird

No one here can love or understand me
Oh, what hard luck stories they all hand me
Make my bed and light the light, I'll arrive late tonight
Blackbird, bye, bye

Bye, bye, blackbird
Where somebody waits for me
Sugar's sweet, so is she
Bye, bye, blackbird

No one here can love or understand me
Oh what hard luck stories they all hand me
Make my bed and light the light, I'll arrive late tonight
Blackbird, bye, bye",Bye Bye Blackbird,
Chris Bailey,"Love, oh love, oh careless love
You've fly through my head like wine
You've wrecked the life of a many poor girl
And you nearly spoiled this life of mine

Love, oh love, oh careless love
In your clutches of desire
You've made me break a many true vow
Then you set my very soul on fire

Love, oh love, oh careless love
All my happiness bereft
You've filled my heart with weary old blues
Now I'm walkin', talkin' to myself

Love, oh love, oh careless love
Trusted you now, it's too late
You've made me throw my old friend down
That's why I sing this song of hate

Love, oh love, oh careless love
Night and day, I weep and moan
You brought the wrong man into this life of mine
For my sins, till judgment I'll atone",Careless Love,1996
Chris Bailey,"You went away and left me long time ago
And now you're knockin' on my door
 
I hear you knocking but you can't come in
I hear you knocking, go back where you've been
I begged you not to go, but you said goodbye
And now you tell me all your lies
I hear you knocking, but you can't come in
I hear you knocking, go back where you've been
 
You better get back to your use to be
'Cause your kind of love ain't good for me
 
I hear you knocking, but you can't come in
I hear you knocking, go back where you've been
I told you way back in Fifty Two 
That I would never go with you
I hear you knocking, but you can't come in
I hear you knocking, go back where you've been
",I Hear You Knockin' [#],1996
Chris Bailey,"Drinkin' beer in the hot sun
I fought the law and
I won
I fought the law and
I won

I needed sex and I got mine
I fought the law and
I won
I fought the law and
I won

The law don't mean shit 
If you got the right friends
That's how this county's run
Twinkies are the best friend I ever had

I fought the law and
I won
I fought the law and
I won

I blew George and Harvey's brains out with my
Six gun!
I fought the law and
I won
I fought the law and
I won

Gonna write my book and make a million
I fought the law and
I won
I fought the law and
I won

I'm the new folk hero of the Ku Klux Klan
My cop friend thinks it's fun
You can get away with murder if you got a badge

I fought the law and
I won
I fought the law and
I won
I fought the law and
I won
I AM the law so I won",I Fought the Law,2004
Chris Bailey,"I bet you're wonderin' how I knew
'Bout your plans to make me blue
With some other guy you knew before 
Between the two of us guys 
You know I loved you more
It took me by surprise I must say 
When I found out yesterday 
Don't you know that I heard it through the grapevine
Not much longer would you be mine
Oh I heard it through the grapevine
Oh I'm just about to lose my mind
 
Honey, honey yeah.
I heard it through the grapevine 
Not much longer would you be mine baby
 
I know a man ain't supposed to cry 
But these tears I can't hold inside
Losin' you would end my life you see
'Cause you mean that much to me
You could have told me yourself 
That you loved some one else
Instead I heard it through the grapevine
Not much longer would you be mine
Oh, I heard it through the grapevine
And I'm just about to lose my mind
 
Honey, honey yeah
I heard it through the grapevine 
Not much longer would you be mine, baby
 
People say believe half of what you see
Son and none of what you hear
But I can't help but be confused
If it's true please tell me dear
Do you plan to let me go
For the other guy you loved before?

Don't you know I heard it through the grapevine 
Not much longer would you be mine, baby yeah
I heard it through the grapevine 
I'm just about to love my mind
Honey, honey, yeah
I heard it through the grapevine,
Not much longer would you be mine, baby yeah",I Heard It Through the Grapevine [Live],2005
Chris Barber,"I want to take you to a little room
A little room where all the roses bloom
I want to lead you into Nature's hall
Where ev'ry year the roses give a ball
They have an orchestra up in the trees
For their musicians are the birds and bees
And they will sing us a song
As we are strolling along
 
In sunny Roseland, where summer breezes are playing
Where the honey bees are ""A-Maying""
There all the roses are swaying
Dancing while the meadow brook flows
The moon when shining is more than ever designing
For 'tis ever then I am pining
Pining to be sweetly reclining
Somewhere in Roseland
Beside a beautiful rose
 
The ball is over and tulips meet
Their little kisses are so short and sweet
The lilies nod to the forget-me-nots
When they're departing in their flower pots
But all the roses with their spirits high
Remain to love until they droop and die
And dear, why shouldn't it be
Just so with you and with me
 
In sunny Roseland, where summer breezes are playing
Where the honey bees are ""A-Maying""
There all the roses are swaying
Dancing while the meadow brook flows
The moon when shining is more than ever designing
For 'tis ever then I am pining
Pining to be sweetly reclining
Somewhere in Roseland
Beside a beautiful rose
",Rose Room,
Chris Barber,"Yeah, everybody loves my baby
But my baby don't love nobody but me, nobody but me
Oh, everybody wants my baby
But my baby don't want nobody but me; that's plain to see

Yes, she got a foam like Venus
Honest, I ain't talking Greek
No one can come between us
She's my Sheba, I am her Sheik

Yes, everybody loves my baby
But my baby love nobody but me, yeah, nobody but me",Everybody Loves My Baby,1998
Chris Barber,"You're bound to fall for the bugle call;
You're gonna brag 'bout the Bugle Call Rag.
Thin or fat, young or old;
Shake their shoulders bold.
You're bound to fall for the bugle call;
You're gonna brag 'bout the Bugle Call Rag.
Hold me baby; Let's syncopate to that blue melody;
Just hesitate while a break they take Shh!
While we're dancing please hold me tight; step lively don't lag.
 

",Bugle Call Rag,2011
Chris Barber,"Where's that tiger! Where's that tiger!
Where's that tiger! Where's that tiger!
Hold that tiger! Hold that tiger ! Hold that tiger! 
Choke him, poke him, kick him and soak him!
Where's that tiger? Where's that tiger?
Where oh where can he be?
Low or highbrow, they all cry now
""Please play that Tiger Rag for me""
 
Where's that tiger! Where's that tiger!
Where's that tiger! Where's that tiger!
Hold that tiger! Hold that tiger ! Hold that tiger! 
Choke him, poke him, kick him and soak him!
Where's that tiger? Where's that tiger?
Where oh where can he be?
Low or highbrow, they all cry now
""Please play that Tiger Rag for me""",Tiger Rag,2011
Chris Barber,"Let's look up as we walk, so that the tears don't spill
Remembering that spring day, that lonely night.
Let's look up as we walk, count the blurry stars
Remembering that summer day, that lonely night.

Happiness is above the clouds, 
Happiness is above the skies.
Let's look up as we walk, so that the tears don't spill
Crying as we walk, that lonely night.
Remembering that autumn day, that lonely night.

Sadness is in the shadow of the clouds, 
Sadness is in the shadow of the moon.
Let's walk with our head held up so that the tears don't spill, 
Crying as we walk, that lonely night.",When The Saints Go Marching In,2011
Chris Barber,"Love, oh love, oh careless love
You've fly through my head like wine
You've wrecked the life of a many poor girl
And you nearly spoiled this life of mine

Love, oh love, oh careless love
In your clutches of desire
You've made me break a many true vow
Then you set my very soul on fire

Love, oh love, oh careless love
All my happiness bereft
You've filled my heart with weary old blues
Now I'm walkin', talkin' to myself

Love, oh love, oh careless love
Trusted you now, it's too late
You've made me throw my old friend down
That's why I sing this song of hate

Love, oh love, oh careless love
Night and day, I weep and moan
You brought the wrong man into this life of mine
For my sins, till judgment I'll atone",Careless Love,2013
Chris Barber,"Gee, but it's tough to be broke, kid.
It's not a joke, kid, it's a curse.
My luck is changing, it's gotten from 
simply rotten to something worse
Who knows, some day I will win too. 
I'll begin to reach my prime.

Now though I see what our end is,
All I can spend is just my time.

I can't give you anything but love, baby.
That's the only thing I've plenty of,baby.

Dream awhile, scheme awhile
We're sure to find

Happiness and I guess
All those things you've always pined for.

Gee I'd like to see you looking swell, baby.
Diamond bracelets Woolworth doesn't sell, baby.

Till that lucky day you know darned well, baby.
I can't give you anything but love.

Rome wasn't built in a day, kid.
You have to pay, kid, for what you get.
But I am willing to wait, dear, 
Your little mate, dear, will not forget.

You have a lifetime before you.
I'll adore you, come what may.

Please don't be blue for the present, 
When it's so pleasant to hear you say

I can't give you anything but love, baby.
That's the only thing I've plenty of,baby.

Dream awhile, scheme awhile
We're sure to find

Happiness and I guess
All those things you've always pined for.

Gee I'd like to see you looking swell, baby.
Diamond bracelets Woolworth doesn't sell, baby.

Till that lucky day you know darned well, baby.
I can't give you anything but love.",I Can't Give You Anything But Love,2013
Chris Barber,"Look down, look down that lonesome road
Before you travel on.

Look down, look down that lonesome road
Before you travel on.
Look up, look up and greet your maker,
For Gabriel blows his horn.

Weary, totin' such a load,
Travelin' down that lonesome road,
Look down, look down that lonesome road
Before you travel on.

Weary totin', it's such a load,
Whike I'm travelin' down, travelin' down that lonesome old road,
Look down, look down that lonesome road
Before you travel on.",The Lonesome Road,2013
Chris Barber,"You ain't never been blue; no, no, no, 
You ain't never been blue, 
Till you've had that mood indigo. 
That feelin' goes stealin' down to my shoes
While I just sit here and sigh, ""Go 'long blues"".

I always get that mood indigo, 
Since my baby said goodbye. 
And in the evenin' when the lights are low, 
I'm so lonely I could cry. 
'Cause there's nobody who cares about me, 
I'm just a poor fool that's bluer than blue can be. 
When I get that mood indigo, 
I could lay me down and die. 

You ain't never been blue; no, no, no, 
You ain't never been blue, 
Till you've had that mood indigo. 
That feelin' goes stealin' down to my shoes
While I just sit here and sigh, ""Go 'long blues"".",Mood Indigo,2013
Chris Barber,"""I'm the Sheik of Araby, 
Your love belongs to me.
At night when you're asleep 
Into your tent I'll creep.
The stars that shine above,
Will light our way to love.
You'll rule this land with me;",The Sheik of Araby,2013
Chris Barber,"Blues stay away from me
Uh-uh-uh, blues why don't you let me be
I don't know why you keep a-haunting me

True love was never meant for me
True love was never meant for me
It seems somehow we never can agree

My life is full of misery
And dreams are like a memory,
they're bringing back your love that used to be

I got teardrops so many I can't see
And years don't mean a thing to me
But time goes by and still I can't be free

Uh-uh-uh, blues stay away from me,
You hear me, blues why don't you let me be,
I don't know why you keep a-haunting me,
No, I don't know why you keep a-haunting me,
Oh, I don't know why you keep a-haunting me",Blues Stay Away From Me,
Chris Barber,"Walked with no one and talked with no one
And I had nothing but shadows
Then one morning you passed
And I brightened at last
Now I greet the day and complete the day
With the sun in my heart
All my worry blew away
When you taught me how to say

Grab your coat and get your hat
Leave your worry on the doorstep
Just direct your feet
To the sunny side of the street
Can't you hear a pitter-pat?
And that happy tune is your step
Life can be so sweet
On the sunny side of the street

I used to walk in the shade
With those blues on parade
But I'm not afraid
This Rover crossed over

If I never have a cent
I'd be rich as Rockefeller
Gold dust at my feet
On the sunny side of the street
Grab your street",On the Sunny Side of the Street,1975
Chris Barber,"""I'm the Sheik of Araby, 
Your love belongs to me.
At night when you're asleep 
Into your tent I'll creep.
The stars that shine above,
Will light our way to love.
You'll rule this land with me;",The Sheik of Araby,1975
Chris Barber,"Want you to know I go for your squeezin'
Want you to know it really is pleasin'
Want you to know  I ain't for no teasin'
 
Treat me sweet and gentle when you say goodnight 
Just squeeze me but please don't tease me
I get sentimental when you hold me tight 
Just squeeze me but please don't tease me 
Missing you since you went away
Singing the blues away each day
Counting the rights and waiting for you 
I'm in the mood to let you know 
I never knew I loved you so 
Please say you love me too 
When I get this feelin' I'm in ecstasy
So squeeze me but please don't tease me
 
Treat me sweet and gentle when you say goodnight 
Just squeeze me but please don't tease me
I get sentimental when you hold me tight 
Just squeeze me but please don't tease me 
Missing you since you went away
Singing the blues away each day
Counting the rights and waiting for you 
I'm in the mood to let you know 
I never knew I loved you so 
Please say you love me too 
When I get this feelin' I'm in ecstasy
So squeeze me but please don't tease me
",Just Squeeze Me,1976
Chris Barber,"Sophisticated lady tryin' to change my ways
Just because you're caught in your social maze
I think it's 'bout time that you realize
Your money and your power's got you mesmerized

Pretty lady, get back
Pretty lady, yea
Sophisticated lady put your blue jeans on
You're anybody's baby when your mama's gone

Educated lady with your college degree
Amazes me why you just can't see
Learned everything from your books on the shelf
But no one ever taught you how to think for yourself

Pretty lady, get back
Pretty lady, yea, sweet thing
Sophisticated lady put your blue jeans on
You're anybody's baby when your mama's gone

Sophisticated lady take a lesson from me
I can help you be what you want to be
Together we'll see many brighter days
If it takes forever, gonna change your ways

Pretty lady, get back
Pretty lady, yea, sweet thing
Sophisticated lady put your blue jeans on
You're anybody's baby when your mama's gone

Sophisticated lady put your blue jeans on
You're anybody's baby when your mama's gone

Sophisticated lady put your blue jeans on
You're anybody's baby when your mama's gone",Sophisticated Lady,1976
Chris Barber,"Listen to my tale of woe, 
It's terribly sad but true, 
All dressed up, no place to go 
Each evening I'm awfully blue. 

I must win some handsome guy 
Can't go on like this, 
I could blossom out I know, 
With somebody just like you. So

Oh, sweet and lovely lady, be good 
Oh, lady, be good to me 
I am so awfully misunderstood 
So lady, be good to me 
Oh, please have some pity 
I'm all-alone in this big city 
I tell you I'm just a lonesome babe in the wood, 
So lady be good to me. 

Oh, please have some pity 
I'm all alone in this big city 
I tell you I'm just a lonesome babe in the wood, 
So lady be good to me. 
Oh lady be good to me.","Oh, Lady Be Good",1977
Chris Barber,"I saw a blind man,
He was a kind man,
Helping a fellow along,
One could not see,
One could not walk,
But they both were humming this song;
 
When you're smiling, When you're smiling, 
The whole world smiles with you,
When you're laughing, When you're laughing,
The sun comes shining through,
But when you're crying you bring on the rain,
So stop your sighing be happy again,
Keep on smiling 'cause when you're smiling,
The whole world smiles with you.
 
I used to worry,
I used to hurry,
Each time it started to rain,
Now I see light,
Learned wrong from right,
And you'll never hear me complain;
 
When you're smiling, When you're smiling, 
The whole world smiles with you,
When you're laughing, When you're laughing,
The sun comes shining through,
But when you're crying you bring on the rain,
So stop your sighing be happy again,
Keep on smiling 'cause when you're smiling,",When You're Smiling,1977
Chris Barber,"You ain't never been blue; no, no, no, 
You ain't never been blue, 
Till you've had that mood indigo. 
That feelin' goes stealin' down to my shoes
While I just sit here and sigh, ""Go 'long blues"".

I always get that mood indigo, 
Since my baby said goodbye. 
And in the evenin' when the lights are low, 
I'm so lonely I could cry. 
'Cause there's nobody who cares about me, 
I'm just a poor fool that's bluer than blue can be. 
When I get that mood indigo, 
I could lay me down and die. 

You ain't never been blue; no, no, no, 
You ain't never been blue, 
Till you've had that mood indigo. 
That feelin' goes stealin' down to my shoes
While I just sit here and sigh, ""Go 'long blues"".",Mood Indigo,1979
Chris Barber,"Let's look up as we walk, so that the tears don't spill
Remembering that spring day, that lonely night.
Let's look up as we walk, count the blurry stars
Remembering that summer day, that lonely night.

Happiness is above the clouds, 
Happiness is above the skies.
Let's look up as we walk, so that the tears don't spill
Crying as we walk, that lonely night.
Remembering that autumn day, that lonely night.

Sadness is in the shadow of the clouds, 
Sadness is in the shadow of the moon.
Let's walk with our head held up so that the tears don't spill, 
Crying as we walk, that lonely night.",When the Saints Go Marching In,1979
Chris Barber,"I hate to see that evening sun go down
I hate to see that evening sun go down
Cause my baby, he's gone left this town

Feelin' tomorrow like I feel today
If I'm feelin' tomorrow like I feel today
I'll pack my truck and make my give-a-way

St. Louis woman with her diamond ring
Pulls that man around by her, if it wasn't for her and her
That man I love would have gone nowhere, nowhere

I got the St. Louis blues, blues as I can be
That man's got a heart like a rock cast in the sea
Or else he wouldn't have gone so far from me

I love my baby like a school boy loves his pie
Like a Kentucky colonel loves his mint 'n rye
I love my man till the day I die",St. Louis Blues,1980
Chris Barber,"In the South Land there's a city
Way down on the river
Where the women are very pretty
And all the men deliver

They got music
It's always playin'
Start in the day time, go all through the night

When you hear that music playin'
Hear what I'm saying, it make you feel alright

Grab somebody, come on down
Bring your paintbrush, we're paintin' the town
Honey, there's some sweetness goin' 'round
Catch it down in New Orleans

We got magic, good and bad
Make you happy or make you real sad
Get everything you want, lose what you had
Down here in New Orleans

Hey partner, don't be shy
Come on down here and give us a try
You wanna do some livin' before you die
Do it down in New Orleans

Stately homes and mansions
Of the Sugar Barons and the Cotton Kings
Rich people, poor people, all got dreams
Dreams do come true in New Orleans",New Orleans,1980
Chris Barber,"Tipitina tra la la la
Whoa la la la-ah tra la la
Tipitina, oola malla walla dalla 
(little mama wants a dollar)
Tra ma tra la la

Hey Loberta, oh poor Loberta
Girl you hear me callin' you
Well you're three times seven, baby
Knows what you want to do

Say Loberta, oh poor Loberta
Girl, you tell me where you been
When you come home this mornin', honey
You had your belly full o' gin

I'll say hurry, hurry, come on Loberta
Girl, you have company waiting for you at home
Why don't you hurry little Loberta girl, hurry
Don't leave that boy alone

Tipitina tra la la la
Whoa la la la-ah tra la la la
Tipitina, hoola malla walla dalla
Tra ma ti na na

Come on baby, we're going ballin'
We're gonna have ourselves a good time
We gonna hoola tralla walla malla dalla
Drink some mellow wine",Tipitina,1980
