Band,Lyrics,Song,Year
Florence + the Machine,"That original lifeline
Original lifeline
That original lifeline

Hey, look up
Don't make a shadow of yourself
Always shutting out the light
Caught in your own creation
Look up, look up
It tore you open
And oh, how much?

Cause there’s a hole where your heart lies
And I see can it with my third eye
And though my touch, it magnifies
You pull away, you don't know why

That original lifeline
Original lifeline
That original lifeline

Hey, look up
You don't have to be a ghost
Hidden amongst the living
You are flesh and blood
And you deserve to be loved
And you deserve what you are given
And oh, how much?

Cause there’s a hole where your heart lies
And I see can it with my third eye
And though my touch, it magnifies
You pull away, you don't know why

That original lifeline
Original lifeline
That original lifeline
Original lifeline

Cause there’s a hole where your heart lies
And I see can it with my third eye
And though my touch, it magnifies
You pull away, you don't know why

That original lifeline
Original lifeline
That original lifeline

Cause your pain is a tribute
The only thing you let hold you
Well now I'm a memento
Always there to remind you
But your pain is a tribute
The only thing you let hold you
Well now I'm a memento
Always there to remind you

I'm the same, I'm the same
I'm try'na change
I'm the same, I'm the same
I'm try'na change
I'm the same, I'm the same
I'm try'na change
I'm the same, I'm the same
I'm try'na change

Cause there’s a hole where your heart lies
And I see can it with my third eye
And though my touch, it magnifies
You pull away, you don't know why

That original lifeline
Original lifeline
That original lifeline

I'm the same, I'm the same
I'm try'na change",Third Eye,2015
Florence + the Machine,"And the air was full
Of various storms and saints
Praying in the street
As the banks began to break
And I'm in the throes of it
Somewhere in the belly of the beast
But you took your toll on me
So I gave myself over willingly
Oh, you got a hold on me
I don't know how I don't just stand outside and scream
I am teaching myself how to be free

The monument of a memory
You tear it down in your head
Don't make the mountain your enemy
Get out, get up there instead
You saw the stars out in front of you
Too tempting not to touch
But even though it shocked you
Something's electric in your blood

And people just untie themselves
Uncurling lifelines
If you could just forgive yourself

But still you stumble, feet give way
Outside the world seems a violent place
But you had to have him, and so you did
Some things you let go in order to live
While all around you the buildings sway
You sing it out loud, who made us this way
I know you're bleeding, but you'll be okay
Hold on to your heart, you'll keep it safe
Hold on to your heart, don't give it away

You'll find a rooftop to sing from
Or find a hallway to dance
You don't need no edge to cling from
Your heart is there, it's in your hands
I know it seems like forever
I know it seems like an age
But one day this will be over
I swear it's not so far away

And people just untie themselves
Uncurling lifelines
If you could just forgive yourself

But still you stumble, feet give way
Outside the world seems a violent place
But you had to have him, and so you did
Some things you let go in order to live
While all around you the buildings sway
You sing it out loud, who made us this way
I know you're bleeding, but you'll be okay
Hold on to your heart, you'll keep it safe
Hold on to your heart",Various Storms and Saints,2015
Florence + the Machine,"And it's my whole heart
Weighed and measured inside
And it's an old scar
Trying to bleach it out
And it's my whole heart
Deemed and delivered a crime
I'm on trial, waiting 'til the beat comes out
I'm on trial, waiting 'til the beat comes out

Who's a heretic now?
Am I making sense?
How can you make it stick?
Waiting 'til the beat comes out
Who's a heretic, child?
Can you make it stick, now?
And I'm on trial
Waiting 'til the beat comes out

I'm miles away, he's on my mind
I'm getting tired of crawling all the way
And I've had enough, it's obvious
And I'm getting tired of crawling all the way
Crawling all the way
Crawling all the way

I'm not beat up by this yet
You can't tell me to regret
Been in the dark since the day we met
Fire, help me to forget

I'm not beat up by this yet
You can't tell me to regret
Been in the dark since the day we met
Fire, help me to forget

And it's my whole heart
While tried and tested, it's mine
And it's my whole heart
Trying to reach it out
And it's my whole heart
Burned but not buried this time
I'm on trial, waiting 'til the beat comes out
I'm on trial, waiting 'til the beat comes out

I'm miles away, he's on my mind
I'm getting tired of crawling all the way
And I've had enough, it's obvious
And I'm getting tired of crawling all the way

I'm not beat up by this yet
You can't tell me to regret
Been in the dark since the day we met
Fire, help me to forget

I'm not beat up by this yet
You can't tell me to regret
Been in the dark since the day we met
Fire, help me to forget

Chained and shackled, oh
All that gravel, oh
It's a pity, oh
Never to return
But I never learn
It's a pity, oh
Chained and shackled, oh
All that gravel, oh
It's a pity, oh
Say I won't return
But I never learn
It's a pity, oh
Ooh
Ooh
Ooh
Ooh",Which Witch [Demo] [*][Demo Version],2015
Florence + the Machine,"I was on a heavy tip
Try'na cross a canyon with a broken limb
You were on the other side, like always
Wondering what to do with life

I'd already had a sip
So I'd reasoned I was drunk enough to deal with it
You were on the other side, like always
You could never make you mine

And with one kiss
You inspired a fire of devotion that lasts for twenty years
What kind of man loves like this?

To let me dangle at a cruel angle
Oh, my feet don't touch the floor
Sometimes you're half in and then you're half out
But you never close the door

What kind of man loves like this?
What kind of man?
What kind of man loves like this?
What kind of man?

You're a holy fool, all colored blue
Red feet upon the floor
You do such damage, how do you manage?
Trying to crawl in back for more

And with one kiss
You inspired a fire of devotion that lasts for twenty years
What kind of man loves like this?

What kind of man loves like this?
What kind of man?
What kind of man loves like this?
What kind of man?

But I can't beat ya, 'cause I'm still with ya
""Oh mercy"", I implore (""oh mercy"", I implore)
How do you do it? I think I'm through it
Then I'm back against the wall

What kind of man loves like this? What kind of man?",What Kind of Man,2015
Florence + the Machine,"Oh
I will be
I will be
I will be
I will be

Silence will not cover me
I will be
I will be

Silence will not cover me
I will be
I will be
I will be
I will be

And silence will not cover me
Silence will not cover me
I will be
I will be

And silence will not cover me
And silence will not cover me
And silence will not cover me
I will be
I will be
I will be
I will be

And silence will not cover me
And silence will not cover me
And silence will not cover me
I will be
I will be
I will be",I Will Be,2016
Florence + the Machine,"When the night has come
And the land is dark
And the moon is the only light we'll see
No, I won't be afraid
Oh, I won't be afraid
Just as long as you stand, stand by me

So darling, darling stand by me
Oh, stand by me
Oh, stand now
Stand by me
Stand by me

If the sky that we look upon should tumble and fall
Or the mountain should crumble to the sea
I won't cry, I won't cry
No, I won't shed a tear
Just as long as you stand, stand by me

And darling, darling stand by me
Oh, stand by me
Oh, stand now
Stand by me
Stand by me

And darling, darling stand by me
Oh, stand by me
Oh, stand
Stand by me
Stand by me

Whenever you're in trouble
Won't you stand by me?
Oh, stand by me
Oh, stand now
Stand by me

And darling, darling stand by me
Oh, stand by me
Oh, stand now
Stand by me
Whenever you're in trouble
Won't you stand by me?
Oh, stand by me
Oh, stand now
Stand by me
Stand by me",Stand by Me,2016
Florence + the Machine,"I've tried to leave it all behind me
But I woke up and there they were beside me
And I don't believe it but I guess it's true
Some feelings, they can travel too
Oh there it is again, sitting on my chest
Makes it hard to catch my breath
I scramble for the light to change

You're always on my mind
You're always on my mind

And I never minded being on my own
Then something broke in me and I wanted to go home
To be where you are
But even closer to you, you seem so very far
And now I'm reaching out with every note I sing
And I hope it gets to you on some pacific wind
Wraps itself around you and whispers in your ear
Tells you that I miss you and I wish that you were here

And if I stay home, I don't know
There'll be so much that I'll have to let go
You're disappearing all the time
But I still see you in the light
For you, the shadows fight
And it's beautiful but there's that tug in the sight
I must stop time traveling, you're always on my mind

You're always on my mind
You're always on my mind

And I never minded being on my own
Then something broke in me and I wanted to go home
To be where you are
But even closer to you, you seem so very far
And now I'm reaching out with every note I sing
And I hope it gets to you on some pacific wind
Wraps itself around you and whispers in your ear
Tells you that I miss you and I wish that you were here

We all need something watching over us
Be it the falcons, the clouds or the crows
And then the sea swept in and left us all speechless
Speechless

And I never minded being on my own
Then something broke in me and I wanted to go home
To be where you are
But even closer to you, you seem so very far
And now I'm reaching out with every note I sing
And I hope it gets to you on some pacific wind
Wraps itself around you and whispers in your ear
Tells you that I miss you and I wish that you were here

Wish that you were here
Wish that you were here
Wish that you were here
I wish that you",Wish That You Were Here,2016
Florence + the Machine,"I believe in you and in our hearts we know the truth and
I believe in love and the darker it gets, the more I do
Try and fill us with your hate and we will shine a light
And the days will become endless and never, and never turn to night
And never, and never turn to night

Then it's just too much, I cannot get you close enough
A hundred arms, a hundred years, you can always find me here
And lord, don't let me break this, let me hold you lightly
Give me arms to pray with instead of ones that hold too tightly

We have no need to fight
We raise our voices and let our hearts take flight
Get higher than those planes can fly
Where the stars do not take sides

Then it's just too much, I cannot get you close enough
A hundred arms, a hundred years, you can always find me here
And lord, don't let me break this, let me hold you lightly
Give me arms to pray with instead of ones that hold too tightly

And then it's just too much, the streets, they still run with blood
A hundred arms, a hundred years, you can always find me here
And lord, don't let me break this, let me hold you lightly
Give me arms to pray with instead of ones that hold too tightly

I let him sleep, and as he does
My held breath fills the room with blood
Hurts in ways I can't describe
My heart bends and breaks so many, many times
And is born again with each sunrise
And is born again with each sunrise

Funerals were held all over the city
The youth bleed in the square
And women raged as old men fumbled and cried
We're sorry, we thought you didn't care
And how does it feel now you've scratched that itch?
How does it feel?
Pulled out all your stitches
Cuteness is a bitch

A hundred arms, a hundred years
A hundred arms, a hundred years

And then it's just too much, the streets, they still run with blood
A hundred arms, a hundred years, you can always find me here
And lord, don't let me break this, let me hold you lightly
Give me arms to pray with instead of ones that hold too tightly, yeah

Oh, oh, oh (hundred, hundred years)",100 Years,2018
Florence + the Machine,"You need a big god
Big enough to hold your love
You need a big god
Big enough to fill you up

You keep me up at night
To my messages, you do not reply
You know I still like you the most
The best of the best and the worst of the worst
Well, you can never know
The places that I go
I still like you the most
You'll always be my favorite ghost

You need a big god
Big enough to hold your love
You need a big god
Big enough to fill you up

Sometimes I think it's gettin' better
And then it gets much worse
Is it just part of the process?
Well, Jesus Christ, it hurts
Though I know I should know better
Well, I can make this work
Is it just part of the process?
Well, Jesus Christ, Jesus Christ, it hurts
Jesus Christ, Jesus Christ, it hurts

You need a big god
Big enough to hold your love
You need a big god
Big enough to fill you up

Shower your affection, let it rain on me
And pull down the mountain, drag your cities to the sea, yeah
Shower your affection, let it rain on me
Don't leave me on this white cliff
Let it slide down to the, slide down to the sea
Slide down to the, slide down to the sea",Big God,2018
Florence + the Machine,"I feel nervous in a way that can't be named
I dreamt last night of a sign that read, ""the end of love""
And I remember thinking
Even in my dreaming it was a good line for a song

We're a family pulled from the flood
You tore the floorboards up
And let the river rush in
Not wash away, wash away

We were reaching in the dark
That summer in New York
And it was so far to fall?
But it didn't hurt at all
And let it wash away, wash away

And in a moment of joy and fury I threw myself
In the balcony like my grandmother so many years before me
I've always been in love with you
Could you tell it from the moment that I met you?

And we're a family pulled from the flood
You tore the floorboards up
And let the river rush in
Not wash away, wash away

We were reaching in the dark (wash away)
That summer in New York (wash away)
And was it so far to fall? (wash away)
You said it didn't hurt at all
And let it wash away, wash away

And Joshua came down from the mountain
With a tablet in his hands
Told me that he loved me, yeah
And then ghosted me again

We were reaching in the dark
That summer in New York
And it was so far to fall
But it didn't hurt at all
I let it wash away, wash away
Reaching in the dark (wash away)
That summer in New York (wash away)
And was it so far to fall? (wash away)
Said it didn't hurt at all
And let it wash away, wash away",The End of Love,2018
Florence + the Machine,"I'm sorry I ruined your birthday
I guess I could go back to University
Try and make my mother proud
Stop this phase I'm in, she deems dangerous
In love
The spelling is a problem
As is the discipline
And I don't think it would be too long
Before I was drunk in Camberwell again

But this is the only thing I've ever had any faith in
Grace, I know you carry us
Grace, and it was such a mess
Grace, I don't say it enough
Grace, you are so loved

I'm sorry I ruined your birthday you had turned 18
And the sunshine hit me and I was behaving strangely
All the walls were melting and there where mermaids? everywhere
Hearts flew from my hands and I could see people's feelings

This is the only thing I've ever had any faith in
Grace, I know you carry us
Grace, and it was such a mess
Grace, I don't say it enough
Grace, you are so loved

Uh uh 
And you, you were the one I treated the worst
Only because you loved me the most
We haven't spoken in a long time
I think about it sometimes
I don't know who I was back then
And I hope on hope
I would never treat anyone like that again

This is the only thing I've ever had any faith in
Grace, I know you carry us
Grace, and it was such a mess
Grace, I don't say it enough
Grace, you are so loved
Grace, I know you carry us
Grace, and it was such a fucking mess
Oh Grace, I don't say it enough
Grace, you are so loved

This is the only thing I've ever had any faith in
This is the only thing I've ever had any faith in
This is the only thing I've ever had any faith in
This is the only thing I've ever had any faith in",Grace,2018
Florence + the Machine,"The show was ending and I had started to crack
Woke up in Chicago and the sky turned black
And you're so high, you're so high, you had to be an angel
And I'm so high, I'm so high, I can see an angel

I hear your heart beating in your chest
The world slows 'till there's nothing left
Skyscrapers look on like great, unblinking giants (oh)

In those heavy days in June
When love became an act of defiance

(Oh)
(Oh)
(Oh)
Hold onto each other
Hold onto each other
Hold onto each other
Hold onto each other

You were broken-hearted and the world was, too
And I was beginning to lose my grip
And I have always held it loosely
But this time I admit
I felt it really start to slip

And choir singing in the street
And I will come to you
To watch the television screen
In your hotel room

Always down to hide with you
Hold onto each other
Hold onto each other
Hold onto each other
Hold onto each other

You're so high, you're so high
You're so high, you're so high
You're so high, you're so high
You had to be an angel
I'm so high, I'm so high
I'm so high, I'm so high
I'm so high, I'm so high
I can see an angel",June,2018
Florence + the Machine,"And it's hard to write about being happy
'Cause all that I get
I find that happiness is an extremely uneventful subject

And there would be no grand choirs to sing
No chorus could come in
About two people sitting doing nothing
But I must confess
I did it all for myself
I gathered you here
To hide from some vast unnameable fear

But the loneliness never left me
I always took it with me
But I can put it down in the pleasure of your company
And there will be no grand choirs to sing
No chorus will come in
No ballad will be written
It will be entirely forgotten
And if tomorrow it's all over
At least we had it for a moment
Oh darling things seem so unstable
But for a moment we were able to be still

Oh ooh ooh oh

And there will be no grand choirs to sing
No chorus will come in
No ballad will be written
This will be entirely forgotten

Da da da da da
Da da da da da
Da da da
La da da da da
La da da da da
La da da da da
La da da da 
La da da da da
La da da da da
La da da da",No Choir,2018
Florence + the Machine,"Oh Patricia, you've always been my North Star
And I have to tell you something I'm still afraid of the dark
You take my hand in your hand from you flowers grow
And you understand with every seed you sow you make this cold world beautiful

She told me all doors are open to the believer
I believe her, I believe her, I believe her
She told me all doors are open to the believer
I believe her, I believe her, I believe her

Oh Patricia, you've always been my North Star, oh
Oh Patricia, you've always been my North Star, oh

You're a real man, and you do what you can
You only take as much as you can grab with two hands
With your big heart, you praise God above
But how's it working out for you, honey?
Do you feel loved?

She told me all doors are open to the believer
I believe her, I believe her, I believe her
(Do you feel loved?) she told me all doors are open to the believer
I believe her, I believe her, I believe her

Oh Patricia, you've always been my North Star, oh
Oh Patricia, you've always been my North Star, oh

I drink too much coffee and I think of you often
In a city where reality has long been forgotten
Are you afraid? 'Cause I'm terrified
But you remind me that it's such a wonderful thing to love

It's such a wonderful thing to love
It's such a wonderful thing to love
It's such a wonderful thing to love
It's such a wonderful thing

It's such a wonderful thing to love
It's such a wonderful thing to love
It's such a wonderful thing to love
It's such a wonderful thing",Patricia,2018
Florence + the Machine,"Oh oh
Oh oh 
And I go home alone
I drive past the place that I was born
And the places that I used to drink
Young and drunk and stumbling in the street
Outside the Joiners Arm's like foals unsteady on their feet
With the art students and the boys in bands
High on E and holding hands with someone that I just met

I thought it doesn't get 
Better than this
There can be nothing better than this
Better than this
And we climbed onto the roof, the museum
And someone made love in the glass
And I'd forgot my name
And the way back to my mother's house
With your black cool eyes and your bitten lips
The world is at your fingertips
It doesn't get better than this
What else could be better than this?

Oh, don't you know I have seen
I have seen the fields aflame
And everything I ever did
Was just another way to scream your name

Over and over and over and over again
Over and over and over and over again

Oh oh
Oh oh
And we're just children wanting children of our own
I want a space to watch things grow
But did I dream too big?
Do I have to let it go?
What if one day there is no such thing as snow?
Oh God, what do I know?

And I don't know anything (uh uh uh)
Except that green is so green
And there's a special kind of sadness that seems to come with spring

Oh, don't you know I have seen
I have seen the fields aflame
And everything I ever did
Was just another way to scream your name

Over and over and over and over again
Over and over and over and over again

Oh, don't you know that I have seen
I have seen the fields aflame
But everything I ever did
Was just another way to scream your name",South London Forever,2018
Florence + the Machine,"At seventeen, I started to starve myself
I thought that love was a kind of emptiness
And at least I understood then the hunger I felt
And I didn't have to call it loneliness

We all have a hunger
We all have a hunger
We all have a hunger
We all have a hunger

Tell me what you need, oh, you look so free
The way you use your body, baby, come on and work it for me
Don't let it get you down, you're the best thing I've seen
We never found the answer but we knew one thing

We all have a hunger (we all have a hunger)
We all have a hunger (we all have a hunger)
We all have a hunger (we all have a hunger)
We all have a hunger (we all have a hunger)

And it's Friday night and it's kicking in
And I can't dress, they're gonna crucify me
Oh, but you and all your vibrant youth
How could anything bad ever happen to you?
You make a fool of death with your beauty, and for a moment

I thought that love was in the drugs
But the more I took, the more it took away
And I could never get enough
I thought that love was on the stage
You give yourself to strangers
You don't have to be afraid
And then it tries to find a home with people, oh, and I'm alone
Picking it apart and staring at your phone

We all have a hunger
We all have a hunger
We all have a hunger
We all have a hunger

Tell me what you need, oh, you look so free
The way you use your body, baby, come on and work it for me
Don't let it get you down, you're the best thing I've seen
We never found the answer but we knew one thing

We all have a hunger (we all have a hunger)
We all have a hunger (we all have a hunger)
We all have a hunger (we all have a hunger)
We all have a hunger (we all have a hunger)

And it's Friday night and it's kicking in
And I can't dress, they're gonna crucify me
Oh, you and all your vibrant youth
How could anything bad ever happen to you?
You make a fool of death with your beauty, and for a moment
I forget to worry",Hunger,2018
Florence + the Machine,"Blue jean baby, L.A. lady, seamstress for the band
Pretty eyed, pirate smile, you'll marry a music man
Ballerina, you must have seen her dancing in the sand
And now she's in me, always with me, tiny dancer in my hand

Jesus freaks out in the street
Handing tickets out for God
Turning back she just laughs
The boulevard is not that bad

Piano man he makes his stand
In the auditorium
Looking on she sings the songs
The words she knows, the tune she hums

But oh how it feels so real
Lying here with no one near
Only you and you can hear me
When I say softly, slowly

Hold me closer tiny dancer
Count the headlights on the highway
Lay me down in sheets of linen
You had a busy day today

Blue jean baby, L.A. lady, seamstress for the band
Pretty eyed, pirate smile, you'll marry a music man
Ballerina, you must have seen her dancing in the sand
And now she's in me, always with me, tiny dancer in my hand

But oh how it feels so real
Lying here with no one near
Only you and you can hear me
When I say softly, slowly

Hold me closer tiny dancer
Count the headlights on the highway
Lay me down in sheets of linen
You had a busy day today

Hold me closer tiny dancer
Count the headlights on the highway
Lay me down in sheets of linen
You had a busy day today",Tiny Dancer,2018
