Band,Lyrics,Song,Year
Ben Jelen,"Christine, she tells me that she's in love again
Christine, she says that she still loves me
She stands there calling my name 
In her boyfriend's jacket in the rain
I guess she's in love with the whole damned world

And the whole world loves her
Won't turn without her
It has to have her
I can't live without her

Just one moment with Christine
You know exactly what I mean
She stays the night and then she leaves
Just a little hope in between 
One more moment with Christine
She's like a life-time where I've been
I want to live to the extreme
I need another taste of Christine

Oh I need another taste (another taste) of Christine

Christine, the touch of another human's hand
Their whispered breath falling on your skin
I don't know where to begin
Well, I just arrived, now I'm locked in
And now I'm caught in your mixed-up world

And the whole world loves you
Won't turn without you
It has to have you
I can't live without you

Just one moment with Christine
You know exactly what I mean
She stays the night and then she leaves
Just a little hope in between 
One more moment with Christine
She's like a life-time where I've been
I want to live to the extreme
Won't you tell me, where's Christine?

How many times will it take for me to learn
Tell me, are we heading for nowhere
Christine
How many times will it take for me to learn
Tell me, are we heading for nowhere (echo)

And the whole world loves her

Just one moment with Christine
You know exactly what I mean
She stays the night and then she leaves
Just a little hope in between 
One more moment with Christine
Is like a life-time where I've been
I want to live to the extreme
I need another taste of Christine

How many times does it take to learn?
How many times does it take to learn?
How many times does it take to learn?
How many times does it take to learn?

Another taste of Christine",Christine,2004
Ben Jelen,"Leaving waves of lies behind
No time to contemplate 
Sailing ships of solitude
I never let the sadness dissipate 
Leave behind an angry anchor 
It's never too late 

I guess it's in a time like this 
The winds would blow the other way 
Sailing through a sea of doubt
I have the time to contemplate 
A world so harsh to face and lies so commonplace 
We're insecure 'cause we want more 
What about the time before? 
Was it ignorance? 
We said never again 

I'm a criminal 
I turn away when I know what's going on 
My children will ask me, “How did you ignore” 
If you really don't see
Then open up your eyes 
'Cause its glaring out in front of me 
I'll go by myself 

I guess it's in the times like these
When the winds are fake 
When I wish we'd sail together
Take these empty seas away 
In a world so harsh to face and lies so commonplace 
We're insecure 'cause we want more 
What about the time before? 
Was it ignorance? We said never again 
Was it ignorance or innocence? 
Aren't they really the same?",Criminal,2004
Ben Jelen,"You know me, You know my every step
Since you I feel like no one understands
I know this, I tangled with your lips 
Since you the sun has gone into eclipse

Close our eyes realize were running circles in the sun 
I'm feeling fine just losing time and knowing your the one 
So come with me come with me 
I can't wait till we run away 'cause we need no reasons 
Run away 'cause we love the night

You know me, You know my every step
Since you I feel like no one understands
I know this I tangled with your lips 
Since you the sun has gone into eclipse

Through the dark make a start and we'll leave this all behind 
Lose the time free our mind and well build a paradise

Come with me come with me 
I can't wait till we run away 'cause we need no reasons 
Run away 'cause we love the night

Oh, oh, oh, I want to run away
Oh oh run away with you..

You know me, You know my every step
Since you I feel like no one understands
I know this I tangled with your lips 
Since you the sun has gone into eclipse

You know me, You know my every step
Since you I feel like no one understands
I know this I tangled with your lips 
Since you the sun has gone into eclipse",Every Step,2004
Ben Jelen,"At a stoplight in the middle of the night
Stuck in 1st and I wonder if I should stay
The ride is history and to my left the shores is right
But this seems a little bit too hard
And all the questions come running through my mind and will I see this another way
The simple truth isn't falling falling down 
And I don't want to drag you through the bottom

Then she says 
Sit in front of me 
Turn around you'll see
I'm everything you want
All you'll ever need
Come back into my world 
You know I'm always yours
And she makes so much since
When she says done throw this away

Its hard to know what's real when it all seems wrong
But I promise you ill find what's going on
I just need to follow the sun before Ill know if ill see this another way
The simple truth isn't falling falling down
And I don't want to drag you through the bottom

Then she says 
Sit in front of me 
Turn around you'll see
I'm everything you want
All you'll ever need
Come back into my world 
You know I'm always yours
And she makes so much since
When she says done throw this away

Isabelle she drifts so lightly floating in her dripsy dresses
Even as her words cut deep I can't deny the truth in them 
On the phone she talks so loud to me and I listen hopelessly 
So direction the side headed to oblivion
And then I decide to give another round of memories of the firs time we sang out to the sea
Oh Isabelle you always understood me
Please Isabelle forgive me now

And all the questions come running through my mind and will I see this another way
The simple truth isn't falling falling down 
And I don't want to drag you through the bottom",Falling Down,2004
Ben Jelen,"Swinging 'round in circles, looking for the way
Fleeing from the time when she wanted me to stay
My world's swirling round, this time I know it well
Our love is coming down again

Then I realize inside me, I've had myself all wrong
This time I know for certain, I've never been that strong
The moment you remember, those times you stop to think
Our love will come undone again

But with demons sitting at my side
An angel's come to ask me why
And slowly I give up inside to say
To feel alive, I'd give it all away

Destructive words to make it so
But none of this is you, you know

Another year, another week
Another sets of summer sheets
Another, well we should hang out again soon
Another drink, another kiss

And with demons sitting at my side
Another angel asks me why
And it doesn't takes too much to say
To feel alive, I'd give it all away

Destructive words to make it so
But none of this is you, you know

Again, and again and again

She's sitting at my side
An angel's come to ask me why
And it takes nothing to say
To feel alive, I'll give it all away

I'll give it all away, I'll give it all away

",Give It Away,2004
Ben Jelen,"Strokes of dark, a brush of light,
I watch you bring your canvas into light.
Oh I know that's how you see the world,
I know that you see anything you like.
But now I'm doubting me,
I know I shouldn't be, but I've been down,
I've been down

'Cause it was love wasn't it?
Well it's killing me not having it.
It's hard to not remember,
Forget it's not the same,
When still you come and tell me, 
'Sorry I came without an invitation - just wanted to be loved.'

The last perfect thing,
You know that you bring me back to life.
Oh, on and on and on and on,
I think about you all day long,
I need you to be stronger.
'Cause now I'm doubting me, 
I know I shouldn't be, but I've been down,
I've been down

'Cause it was love wasn't it?
Well it's killing me not having it.
It's hard to not remember,
Yet it's not the same,
When still you come and tell me baby, 
'I came without an invitation - just wanted to be loved.'

Yeah, yeah, yeah,
I hear the sound,
And I know that you'll be coming 'round
(You know I'll wait) You know I'll wait for you.

Oh love, it's killing me not having it.
I need you to be stronger,
Don't want to hear the sound,
'Cause rocks upon my window mean that you're coming 'round.
And how could I resist when I think you're still in love.
How can I move on when I want to be in love with you.

Oh, with you",Rocks,2004
Ben Jelen,"She sits beside her
Stares out across the waves as she's digging in the sand
And looks around her
And knows the crazy world would never understand

And she says,
""Please would you find me
I've lost my way
Please would you save me now""

He wakes to find that he's out of love again 
And it's time for him to run
And back inside her
He feels his innocence slowly setting with the sun

And he says,
""Please would you save me
I'll lose my way
Please would you help me to escape""

And their answers lie in a setting sun
And the reasons why will remain unknown
'Cause we live our lives 'till we come undone
We just have to believe
We just have to believe
We just have to believe",Setting of the Sun,2004
Ben Jelen,"The years flash by
Today melts to yesterdays memories
Time's holding us tight
I'm looking back to remember the days we said we'd never say goodbye.

Sometimes I feel like we've been running too far from the truth
You know I'm tired of hearing 'another day another time'
All this senseless waiting won't fill these dark empty rooms
Why won't you come home?

And now you're gone
My hands melt to yesterday's melodies
Time's pushing along
Still looking back to hold on to the days we said we'd never say goodbye.

Yeah, she'll hear you

Sometimes I feel like we've been running too far from the truth
You know I'm tired of hearing 'another day another time'
All this senseless waiting won't fill these dark empty rooms
You know I hate to say it,
But since you're gone I know that 

Even though I'm feeling low,
I guess I'm feeling free.
We can live our own existence,
'Cause I know these dreams will bring you back to me.

Bring you back, bring you back (oh, to me) to me
Bring you back, bring you back
Yeah, she'll hear you

Sometimes I feel like we've been running too far from the truth
You know I'm tired of hearing 'another day another time'
All this senseless waiting won't fill these dark empty rooms
You know I hate to say it,
But since you're gone I know that 

Sometimes I feel like we've been running too far from the truth
You know I'm tired of hearing 'another day another time'
All this senseless waiting won't fill these dark empty rooms,
You know I hate to say it,
But since you're gone I know that",She'll Hear You,2004
Ben Jelen,"And all of my answers 
And all my reasons
And all my excuses
They never asked
'Cause all of my answers
They keep on changing
I spend my life waiting for the next 

No I just keep on moving 
No I just keep on pushing forward
No I forgot what I was looking for

No

And all their illusions
I won't believe them
I'll always believe what I can't forget 
Cause all of their reasons 
They keep on changing 
I spend my life waiting for the next 

No I just keep on moving
No I just keep on pushing forward
No I forgot what I was looking for

Well I'll trade wisdom back in for innocence
To get away from all my lies
I'd trade wisdom back in for innocence 
To get away from getting by
I'd trade wisdom back in for innocence
For just one look through those eyes",Slow Down,2004
Ben Jelen,"She wakes up and rolls into the kitchen
She turns on her favorite radio 
She jumps on the bed kisses me as I'm sleeping
And her smile starts 

She's amazing, ever changing 
Oh, you'll feel like your sailing
Oh, you'll feel your life changing
Oh, she'll bring back that feeling
Oh, she'll have you beggin
Please, please, please stay
Just stay

She's off to yoga just to clear her head out
Sometimes sees the world from upside down
She forgets about the song she's singing 
As my smile starts 

She's amazing, ever changing 
Oh, you'll feel like your sailing
Oh, you'll feel your life changing
Oh, she'll bring back that feeling
Oh, she'll have you beggin' 
Please, please, please stay
Just stay

I'll brush your hair, tell you you're beautiful
When you wake up, stay awake at night
To watch you while you're sleeping 
Be a confidant for secrets that you're keeping
I'll pick you up girl; I'll pick you up girl 

Oh, you'll feel like your sailing
Oh, you'll feel your life changing
Oh, she'll bring back that feeling
Oh, she'll have you beggin' 
Please, please, please stay
Just stay",Stay,2004
Ben Jelen,"You know, the sun is in your eyes
And hurricanes and rains
And black and cloudy skies.

You're running up and down that hill.
You turn it on and off at will.
There's nothing here to thrill
Or bring you down.
And if you've got no other choice
You know you can follow my voice
Through the dark turns and noise
Of this wicked little town.

Oh Lady, luck has led you here
And they're so twisted up
They'll twist you up. I fear.

The pious, hateful and devout,
You're turning tricks till you're turned out,
The wind so cold it burns,
You're burning out 
and blowing round.

And if you've got no other choice
You know you can follow my voice
Through the dark turns and noise
Of this wicked little town.

The fates are vicious 
and they're cruel.
You learn too late you've used two wishes like a fool

And then you're someone you are not,
And Junction City ain't the spot,
Remember Mrs. Lot
And when she turned around.

And if you've got no other choice
You know you can follow my voice
Through the dark turns and noise
Of this wicked little town. 
Of this wicked little town.",Wicked Little Town,2004
Ben Jelen,"Don't you know they're talkin' about a revolution, it sounds like a whisper
Don't you know they're talkin' about a revolution, it sounds like a whisper

While they're standing in the welfare lines 
Crying at the doorsteps of those armies of salvation
Wasting time in the unemployment lines
Sitting around waiting for a promotion

Don't you know they're talkin' about a revolution, it sounds like a whisper

Poor people gonna rise up and get their share
Poor people gonna rise up and take what's theirs
Don't you know you better run run run run run run run run run run run run
I said you better run run run run run run run run run run run run 

'Cause finally the tables are starting to turn, talkin' 'bout a revolution
Yes, finally the tables are starting to turn, talkin' 'bout a revolution
Oh no, talkin' 'bout a revolution

Oh, I been standing in the welfare lines
Crying at the doorsteps of those armies of salvation
Wasting time in the unemployment lines
Sitting around waiting for a promotion

Don't you know they're talkin' about a revolution, it sounds like a whisper
And finally the tables are starting to turn, talkin' 'bout a revolution
Yes, finally the tables are starting to turn, talkin' 'bout a revolution
",Talking About a Revolution,2004
Ben Jelen,"Once upon a midnight dream
There were tiny little soldiers marching in
Breaking through the fortress, I hide behind
Constructing all the chaos that disturbs me in my mind
It's all over the headlines

If we'd cry just a little, maybe laugh a little more
If it's not worth having, then it's not worth dying for
We've got to live just a little, maybe love a little more
'Cause it can't be all for nothing, so what're we fighting for?

I'm not afraid to show my fear
'Cause it's the only way to face what's growing here
I wonder if I'll live to see the day
When practical solutions for a modern world
Return to a state of grace

If we'd cry just a little, maybe laugh a little more
If it's not worth having, then it's not worth dying for
We've got to live just a little, maybe love a little more
'Cause it can't be all for nothing, so what're we fighting for?

La da da, da da, da da
La da da, da da, da da

It seems I have worn out my thinking cap
I've come to this conclusion 'cause all I do is laugh
What choice do I have?

If we'd cry just a little, maybe laugh a little more
If it's not worth having, then it's not worth dying for
We've got to live just a little, maybe love a little more
'Cause it can't be all for nothing, so what're we fighting for?

La da da, da da, da da",Just a Little,2007
Ben Jelen,"Every day I write the book
And how the story changes
The people come and go
The feelings stay the same

Tell me whats wrong
Show me the moon that I fell from
Help me to find where I belong
Here on this earth

Its getting harder to return
All the lessons I have learned
The knowledge I have gained
Somehow the tables turned

Was I lost out in space?
Was I looking to find an altered state?
Wanting to save the human race
Here on this earth

I weighted it down
Across my heart
But when I fell back
I had no start

I have to pretend
To make my amends
But I must admit

This was not my plan
This was not my plan
This was not my way at all
This was not my plan

",Not My Plan,2007
Ben Jelen,"Here do we go?
We're sitting on pins and needles
Locked in a box going blind, out go the lights

We never see it eye to eye, our love collides
When something goes wrong
You say you don't want to talk about it

So where do we go from here?
Where do we go from here?

I give you your way
I follow you to a place where I am set to stay
But those things you do

It's like you don't know how much love I'd give for you
You give me a smile
You say you don't like to talk about it

So where do we go from here?
Where do we go from here?
La, la, la, la, la, la, la, la, la, la, la, la, la, la, la, la

This is right where you want to be
Sleeping in my spiderweb
But when it breaks with every morning
You've go to tell me where do we go from here?

Where do we go from here?
Where do we go from here?
La, la, la, la, la, la, la, la, la, la, la, la, la, la, la, la

We've got to figure it out, you know
I'm listening now, Where do we go?
Tell me, where do we go?
My beautiful, no, I won't let you go

We'll figure it out, I'm listening now
Where do we go?
Where do we go, my beautiful?
I won't let you go, we'll figure it out

I'm listening now, where do we go?
Tell me, where do we go, my beautiful?
No, I won't let you go, we'll figure it out

I'm listening now, where do we go?
Where do we go, my beautiful?

",Where Do We Go,2007
Ben Jones,"Once I was alone
So lonely and then
You came, out of nowhere
Like the sun up from the hills

Cold, cold was the wind
Warm, warm were your lips
Out there, on that ski trail
Where your kiss filled me with thrills

A weekend in Canada, a change of scene
Was the most I bargained for
And then I discovered you and in your eyes
I found the love that I couldn't ignore

Down, down came the sun
Fast, fast, fast, beat my heart
I knew when the sun set
From that day, we'd never ever part
",Canadian Sunset,1997
Ben Jones,"Woo, 
Wo-o-oo-wo-wo, 
Wo-o-oo-wo-wo, 
Wo-o-oo-wo-wo
When the deep purple falls
Over sleepy garden walls
And the stars begin to twinkle in the night
In the mist of a memory
You wander all back to me
Breathing my name with a sigh

In the still of the night
Once again I hold you tight
Tho' you're gone your love lives on when light beams
And as long as my heart will beat
Sweet lover, we'll always meet
Here in my deep purple dreams

When the deep purple falls
Over sleepy garden walls
And the stars begin to twinkle
In the night
In the mist of a memory
You wander all back to me
Breathing my name with a sigh

In the still of the night 
Once again I hold you tight
Tho' you're gone your love lives on when moonlight beams
And as long as my heart will beat
Sweet lover, we'll always meet
Here in my deep purple dreams
And as long as my heart will beat
Sweet lover, we'll always meet
Here in my deep purple dreams
Wo-o-oo-wo-wo, 
Wo-o-oo-wo-wo, 
Wo-o-oo-wo-wo",Deep Purple,1997
Ben Jones,"Never thought I'd fall,
But now I hear love call,
I'm getting sentimental over you

Things you say and do,
Just thrill me through and through,
I'm getting sentimental over you.

I thought I was happy,
I could live without love
Now I must admit,
Love is all I'm thinking of

Won't you please be kind,
And just make up your mind
That you'll be sweet & gentle,
Be gentle with me
Because I'm sentimental over you
",Getting Sentimental Over You,2001
Ben Jones,"I need your love so badly, I love you, oh, so madly
But I don't stand a ghost of a chance with you!
I thought at last I'd found you, but other lovers surround you
And ""I don't stand a ghost of a chance with you!""
If you'd surrender just for a tender kiss or two
You might discover, that I'm the lover meant for you
And I'd be true, but what's the good of scheming
I know I must be dreaming",I Don't Stand a Ghost of a Chance With You,2001
Ben Jones,"I'm as restless as a willow in a windstorm, I'm as jumpy as puppet on a string
I'd say that I had spring fever, but I know it isn't spring
I am starry eyed and vaguely discontented, like a nightingale without a song to sing
O why should I have spring fever, when it isn't even spring 

I keep wishing I were someone else, walking down a strange new street
And hearing words that I've never heard from a girl I've yet to meet
I'm as busy as spider spinning daydreams, spinning spinning daydreams
I'm as giddy as a baby on a swing 

I haven't seen a crocus or a rosebud, or a robin on the wing
But I feel so gay in a melancholy way, that it might as well be spring
It might as well be spring.",It Might as Well Be Spring,2001
Ben Kaufmann,"To see you coming 'round the bend
I just can't think of anything that could make me smile like you can
When you're coming 'round the bend, noooo

I've been in love a time or two before
And all of that experience allows me to be sure
That you're the one
Sure as darkness brings the rising sun

[ Chorus ]

We both share the trials of the road
Cursing all the miles and the nights we spend alone
But then I smile
You've been waiting for me all the while

[ Chorus ]

I know the sun could hide behind the clouds for days
And I've walked down crowded streets and never seen a smiling face
And times like those, I'll just close my eyes and picture when

[ Chorus - ""I'll see you coming..."" ]
",To See You Coming 'Round the Bend,2001
Ben Keith,"Come, they told me pa-rum pum pum pum
Our newborn King to see, pa-rum pum pum pum
Our finest gifts we bring pa-rum pum pum pum
To lay before the King pa-rum pum pum pum
Rum pum pum pum. rum pum pum pum
So to honor Him pa-rum pum pum pum
When we come
 
Little Baby pa-rum pum pum pum
I am a poor boy too, pa-rum pum pum pum
I have no gift to bring pa-rum pum pum pum
That's fit to give our King pa- rum pum pum pum
Rum pum pum pum, rum pum pum pum
Shall I play for you, pa-rum pum pum pum
on my drum?
 
Mary nodded pa-rum pum pum pum
The Ox and Lamb kept time pa-rum pum pum pum
I played my drum for Him pa-rum pum pum pum
I played my best for Him pa -rum pum pum pum
Rum pum pum pum, rum pum pum pum
Then He smiled at me pa-rum pum pum pum
Me and my drum",The Little Drummer Boy,1994
Ben Keith,"Christmas time's a comin', Christmas time's a comin'
Christmas time's a comin' and I know I'm going home

Snowflakes are falling, my old home's a calling
Tall pines are humming, Christmas time's a coming
Can't you hear them bells ringing, ringing joy, joy hear them singing
When it's snowing I'll be going back to my country home

Christmas time's a comin', Christmas time's a comin'
Christmas time's a comin' and I know I'm going home

Holly's in the window, home's where the wind blows
Can't walk for running, Christmas time's a comin'
Can't you hear them bells ringing, ringing joy, joy hear them singing
When it's snowing I'll be going back to my country home

Christmas time's a comin', Christmas time's a comin'
Christmas time's a comin' and I know I'm going home

White candles burning, my old heart's a yearning
For the folks at home when Christmas time's a coming
Can't you hear them bells ringing, ringing joy, joy hear them singing
When it's snowing I'll be going back to my country home

Christmas time's a comin', Christmas time's a comin'
Christmas time's a comin' and I know I'm going home

",Christmas Time's a Comin',2008
Ben Keith & Friends,"Come, they told me pa-rum pum pum pum
Our newborn King to see, pa-rum pum pum pum
Our finest gifts we bring pa-rum pum pum pum
To lay before the King pa-rum pum pum pum
Rum pum pum pum. rum pum pum pum
So to honor Him pa-rum pum pum pum
When we come
 
Little Baby pa-rum pum pum pum
I am a poor boy too, pa-rum pum pum pum
I have no gift to bring pa-rum pum pum pum
That's fit to give our King pa- rum pum pum pum
Rum pum pum pum, rum pum pum pum
Shall I play for you, pa-rum pum pum pum
on my drum?
 
Mary nodded pa-rum pum pum pum
The Ox and Lamb kept time pa-rum pum pum pum
I played my drum for Him pa-rum pum pum pum
I played my best for Him pa -rum pum pum pum
Rum pum pum pum, rum pum pum pum
Then He smiled at me pa-rum pum pum pum
Me and my drum",The Little Drummer Boy,2008
