Band,Lyrics,Song,Year
Hazel Dickens,"Just a few old memories
Slipped in through my door
Though I thought I had closed it
So tightly before
I can't understand it
Why it should bother my mind
For it all belongs to another place and time

Just a few old keep-sakes
Way back on the shelf
No, they don't mean nothin'
Well I'm surprised they're still left
Just a few old love letters
With the edges all brown
And an old faded picture
I keep turned upside-down

Just a few old memories
Going way back in time
Well I can hardly remember
I don't know why I'm cryin'
I can't understand it
Well I'm surprised myself
First thing tomorrow morning
I'll clean off that shelf

Just a few old keep-sakes
Way back on the shelf
No, they don't mean nothin'
Well I'm surprised that they're left
Just a few old love letters
With their edges all brown
And an old faded picture
I keep turned upside-down
",A Few Old Memories,1987
Hazel Dickens,"There ain't much that's left here that ain't all run down.
Gone all the echoes of old familiar sound.
Families are scattered, parted, and gone.
Left a lot of good things to wither away back home.

(Chorus:) Can't you feel those hills around you?
Can't you feel that touch of home?
And don't you wish you'd never gone?
There are some things memories can't bring home.
Hills of home, hills of home,
Families scattered off and gone.
These old hills that have been passed by,
Well, they've seen their share of leavin' in their time.

Old familiar dirt roads wind through the piney glade,
Where all the longing of childhood dreams were made,
Where we passed the mossy mounds where I could run and play,
Never a care to cross my mind all the livelong day. (Chorus)

Yes, they've seen their share of leavin' in their time.",Hills of Home,1987
Hazel Dickens,"She's lost a lot of herself that time cannot replace
Bits and pieces of herself gone without a trace
She's been holding on to everything that happened to be there
She's all used up and forgotten and scatterd eveerywhere

She's not an angel, so don't look for her wings
She's a hurtin woman who lives the song she sings
She learned them all the hard way on the streets all alone
That's why it's hard to tell the singer from the song

One by one her young years were gone before she knew
Wasted on some loser who was only walking through
Each time her bruised and lonely heart tried to break the fall
Rather put the pieces of the life on the wall

She's not an angel, so don't look for her wings
She's a hurtin woman who lives the song she sings
She learned them all the hard way on the streets all alone
That's why it's hard to tell the singer from the song
",It's Hard to Tell the Singer from the Song,1987
Hazel Dickens,"MAMA'S HANDS

I said goodbye to that plain little miner town
With just a few old clothes that layed around
I knew I was leavin' a lot a things they were good
But I thought I'd make a break while I still could;

As I looked back to wave once more
To mama cryin' in the door
For me and what the world might have in store
For she knew I'd never be her little girl no more;

But she was driftin' back to another time
When she was young and hoped to find
A better life than what her mama's had been
But it was so they'd go of mama's hands, my mama's hands;

CHORUS
One old paper bag filled with hand-me-downs
Plain old country girl raised on gospel sounds
With only the love she gave me and pride in what I am
It was hard to let go of mama's hands, my mama's hands.

I thought of all the love she gave
I thought of all the years she slaved
To try and make this run-down shack a home
A dream that really died 'fore it was born;

But she pulled us thru the hardest times
And made us hold our head up high
A gift we carry with us all our lives
For we were special in mama's eyes

As I looked down the dusty road
To mama and her heavy load
I knew I was leavin' i'd never find again
It was hard to let go of mama's hands, my mama's hands.

CHORUS

TAG:
It was hard to let go of mama's hand, my mama's hands.",Mama's Hand,1987
Hazel Dickens,"Fly away little pretty bird
Fly Fly away 
Fly away little pretty bird
And pretty you'll always stay

I see in your eyes a promise
Your own tender love you bring
But fly away little pretty bird
Close    the spring

Loves own tender flame warms this meeting
And loves tender song should sing
But fly away little pretty bird
And pretty you'll always stay

I cannot make you no promise
For love is such a daily good thing
Fly away little pretty bird
For he'd only clip your wings

Fly away little pretty bird
And pretty you'd always stay
Fly far beyond the dark mountain
To where you'll be free ever more

Fly away little pretty bird
Where the cold winter winds don't blow

",Pretty Bird,1987
Hazel Dickens,"I held him as close as I dared to go
All his sweet love has started to show
I know that I need him, but trustin his love
But the scars from an old love haven't quite healed enough

Yes the battle is over, but healing takes time
Leave it all them old memories behind
I know that I love him, need him so much
But the scars from an old love haven't quite healed enough

Yes the battle is over, and the victor has fled
Wounded and dying, one lonely heart bled
Now love sounds her bugle, playing loves old sweet song
While the scars from an old love haven't quite all gone

Yes the battle is over, but healing takes time
Leave it all them old memories behind
I know that I love him, need him so much
But the scars from an old love haven't quite healed enough",Scars from an Old Love,1987
Hazel Dickens,"Hey I got the early Monday morning working blues
I put on my worn out working shoes
Well the weekend was too short but I can choose
When the lord made the working girl, he made the blues

Well I'm tired of working my life way
And givin someone else all of my pay
While they get rich on the profits that I lose
And leaving me here with the working girl blues

I do oh lay eee Working Girl Blues!
And I can't even afford a new pair of shoes
While they can live in any penthouse they choose
And all I got is the working girl blues

My boss said a raise is due almost any day
But I wonder will my hair be all turned gray
Before he turns that dollar loose and I get my dues
And lose a little bit of these working girl blues

Well I'm tired of working my life way
And givin someone else all of my pay
While they get rich on the profits that I lose
And leaving me here with the working girl blues

I do oh lay eee Working Girl Blues!
And I can't even afford a new pair of shoes
While they can live in any penthouse they choose
And all I got is the working girl blues",Working Girl Blues,1987
Hazel Dickens,"As you go from me, you want all that's left, 
The last thread of pride in my heart. 
'Til you've wrung the last teardrop from my eye, 
You won't be satisfied. 
[Chorus] 
So, take your cold, unloving heart, 
Your eyes too blinded to see 
Oh, you never found the door to this heart of mine, 
You'll get no more of me. 
You have raked my heart like a cruel winter storm, 
Bending my branches so low. 
Oh, your wayward heart and your tortured soul 
Leave no memory worthy to hold 
[Chorus] 

So, I'll take back my heart from the $%^&*# (wh-something) 
I'll hang my tears out to dry. 
And I'll hang my head in sorrow no more, 
And no more tears will I cry. 
[Chorus]
",You'll Get No More of Me,1987
Hazel Dickens,"West Virginia, oh my home.
            D                          A
West Virginia, where I belong.
            D
G
In the dead of the night, in the still and the quiet I slip away like a bird
in flight
         D                           A                        D
Back to those hills, the place that I call home.

It's been years now since I left there
And this city life's about got the best of me.
I can't remember why I left so free what I wanted to do, what I wanted to see,
But I can sure remember where I come from.

Chorus-----

Well I paid the price for the leavin'
And this life I have is not one I thought I'd find.
Just let me live, love, let my cry, but when I go just let me die
Among the friends who'll remember when I'm gone.

Chorus-----

Bridge:
G         A        D                                                 A
Home, home, home. I can see it so clear in my mind.
G         A       D
A
Home, home, home. I can almost smell the honeysuckle vines.

[Repeat last two lines of chorus.]
","West Virginia, My Home",1988
Hazel Dickens,"You pull the string
She's your plaything
You can make her or break her, it's true
You abuse her, accuse her
Turn her round and use her
Then forsake her any time it suits you

There's more to her than powder and paint
Than her peroxided bleached-out hair
And if she acts that way
It's 'cause you've had your day
Don't put her down, you helped put her there

She hangs around
Playing her clown
While her soul is aching inside
She's heartbreak's child
She just lives for your smile
To build her up in a world made by man

There's more to her than powder and paint
Than her peroxided bleached-out hair
And if she acts that way
It's 'cause you've had your day
Don't put her down, you helped put her there

At the house down the way
You sneak and you pay
For her love, her body or her shame
Then you call yourself a man
And say you just don't understand
How a woman could turn out that way

There's more to her than powder and paint
The men she picks up at the bar
And if she acts that way
It's 'cause you've had your day
Don't put her down, you helped put her there

And if she acts that way
It's 'cause you've had your day
Don't put her down, you helped put her there

","Don't Put Her Down, You Helped Put Her There",1991
Hazel Dickens,"Last week I played with a tiny baby
I thought how soon he'd be a man
But the day came last time
Rock his cradle he's 

Oh here today, and gone tomorrow
That's how life in this world is
Oh here today and gone tomorrow
There's a better world than ths

Daddy worked hard to raise a family
Then his time come
We gathered here for celebration
But God called him, his work is done

Oh here today, and gone tomorrow
That's how life in this world is
Oh here today and gone tomorrow
There's a better world than ths

Oh the bluebirds sing out in my garden
Summer days are here to stay
But autumn came and winter followed
My flowers died, the birds flew away","Here Today, Gone Tomorrow",1992
Hazel Dickens,"I'm gonna lay down my old guitar
lay down my old guitar
I wish I could tie it to my side
And take it along with me

(Now sing it) I'm sick in a lonesome bed
(I heard that son) I'm sick in a lonesome bed
Oh there's no one to hold my aching head
And I'm sick in a lonesome bed

I'm gonna lay down my old guitar
Lay down my old guitar
I wish I could tie it to my side
And take it along with me (jump on son)

Well there's no one to cry for me 
No one to cry for me
Well, I've wandered so far away don't you see 
And there's no one to cry for me

I'm gonna lay down my old guitar
Lay down my old guitar
I wish I could tie it to my side
And take it along with me (oh bring it)

Well, I'm telling this world goodbye 
Telling this world goodbye
I'm telling the world and my dear little girl
I'm tell them all goodbye

I'm gonna lay down my old guitar
Lay down my old guitar
I wish I could tie it to my side
And take it along with me (get it son)

I'm gonna lay down my old guitar
Lay down my old guitar
I wish I could tie it to my side
And take it along with me",Gonna Lay Down My Old Guitar,1996
Hazel Dickens,"Ten years ago
On a cold dark night
Someone was killed
'Neath the Town Hall light

Few were at the scene
But they all did agree
The slayer who ran
Looked a lot like me

The judge said, ""son
What is your alibi?
If you were somewhere else
You won't have to die""

Well I spoke not a word
Although it meant my life
For I had been in the arms
Of my best friend's wife

She walks these hills
In a long black veil
She visits my grave
When the night winds wail

Nobody knows, nobody sees
Nobody knows but me

The scaffold was high
And eternity near
She stood in the crowd
And shed not a tear

But sometimes at night
When the cold wind moans
In a long black veil
She cries o'er my bones

She walks these hills
In a long black veil
She visits my grave
When the night winds wail

Nobody knows, nobody sees
Nobody knows but me

Nobody knows, nobody sees
Nobody knows but me",Long Black Veil,1996
Hazel Dickens,"Daylight of dark
In rain or shine
It don't much matter
Down in the mine
Where the tunnel's deep
Lord, the air gets thin
That's the way of life
For the minin' man

His lungs are weak
His back is gone
His sixty years
Are plainly shown
Lived half his life
Down in the ground
A cold steel hammer
Rings a mournful sound

Daylight of dark
In rain or shine
It don't much matter
Down in the mine
Where the tunnel's deep
Lord, the air gets thin
That's the way of life
For the minin' man

I'll tell you, Son
He said to me
There's just two things
I pray to see
That the day my Savior
Calls me home
And to see my son
Stop minin' coal

Oh daddy dear
I'll tell you true
There's nothing else
For me to do
But to make my livin'
Underneath this land
And live and die
A coal minin' man

Daylight of dark
In rain or shine
It don't much matter
Down in the mine
Where the tunnel's deep
Lord, the air gets thin
That's the way of life
For the minin' man

I'll make my livin'
Underneath this land
And die like you
A coal minin' man",Coal Mining Woman,1997
Hazel Dickens,"United we stand, divided we fall
For every dime they give us a battle must be fought
So working people use your power the key to liberty
Don't support the rich man's style of luxury

There ain't no way they can ever keep us down
There ain't no way they can ever keep us down
We won't be bought, we won't be sold
To be treated right, well that's our goal
There ain't no way they can ever keep us down

We've been shot, we've been jailed, lord its a sin
Women and children stood right by the men
We've got a union contract that keeps the worker free
They'll never shoot that union out of me

They'll never shoot that union out of me, oh no
They'll never shoot that union out of me
Got a contract in our hand signed by the blood of honest 
men
They'll never shoot that union out of me

The power wheel is rolling, rolling right along
The government is keep it going going strong
so working people get your help from your own kind
Your welfare on the rich man's mind

Your welfare on the rich man's mind
Your welfare on the rich man's mind
They want the power in their hands just to keep out of the workers hands
Your welfare on the rich man's mind

They'll never, never, never keep us down
They'll never, never, never keep us down
The cheat, rob and kill but we'll stop that big wheel
They'll never, never, never keep us down",They'll Never Keep Us Down,1997
Hazel English,"I, I can't deny I'm paralysed from the inside
Everyday I wake to feel the same
And every time you ask me how I'm feeling
I just smile and tell you that I'm fine

I, I don't know why I'm terrified of everything
Just to call the doctor seems daunting
For most of my life I felt a sharp uncertainty
Now its just become a part of me

I, I can't deny I'm paralysed from the inside
Everyday I wake to feel the same
And every time you ask me how I'm feeling
I just smile and tell you that I'm fine

It's hard to stay true, to myself and to you
I can't measure up to this girl you thought you knew
This aching in my heart is tearing me apart
But, darling all your love is somehow not enough",I'm Fine,2017
Hazel English,"Driven by fantasy
How do I get back to it once again
But the dream is all I have

I try to recreate the image in my head
It's all I see
But the flaws are all that's left

All our lives
We just keep searching for what does not exist
When will I
Be willing to finally admit
It's not real

It's tempting to predict the future but it's futile all the same
The past is all we have
And every time I try to replicate the signals in my brain
The flaws are all that's left

All our lives
We just keep searching for what does not exist
When will I
Be willing to finally admit
It's not real

What am I doing?
Why am I trying to forget you, oh?
What am I doing?
Why am I trying to forget you, oh?

All our lives
We just keep searching for what does not exist
When will I
Be willing to finally admit
It's not real",It's Not Real,2017
Hazel English,"I can't seem to ascertain
How you make me feel this way
When there's nothing left to say
Just our eyes communicate
I lose control
When I'm alone with you
I’m unable to restrain
All my body gravitates

I love it when you do that thing
I love it when you do that thing to me
I love it when you do that thing
I love it when you do that thing to me

I love it when you do

I know I should stay away
But you hold me with your gaze
Seems like time has been delayed
We exist in our own space

I love it when you do that thing
I love it when you do that thing to me
I love it when you do that thing
I love it when you do that thing to me

I love it when you do

I lose control
When I'm alone with you
I’m unable to restrain
All my body gravitates

I love it when you do that thing
I love it when you do that thing to me
I love it when you do that thing
I love it when you do that thing to me

I love it when you do",That Thing [*],2017
Hazel English,"I'm drawn in
Etched into this
It's part of me
It’s under my skin
And I'm addicted tonight

There is no wait
I've got to satiate
This burning feeling in my throat
I'm not playing it safe
And it's getting late

Wasted on this feeling
Helpless to this call

Never going home again
Turn the lights out when you’re leaving
Never going home again
Don’t wait up for me I'm not leaving

Falling in
Inch by inch
I'm not resisting
And I'm addicted tonight

There is no wait
I've got to satiate
This burning feeling in my throat
I'm not playing it safe
And it's getting late

Wasted on this feeling
Helpless to this call

Never going home again
Turn the lights out when you’re leaving
Never going home again
Don’t wait up for me
I'm not leaving

Falling in
Inch by inch
I'm not resisting
And I'm addicted tonight
Falling in
Inch by inch
I'm not resisting
And I'm addicted tonight

Think I'm getting closer

Never going home again
Turn the lights out when you’re leaving
Never going home again
Don’t wait up for me
I'm not leaving",Never Going Home,2017
Hazel Fernandez,"Well here I am with so much to offer
Nothing to do but be here today
Giving myself it's the best I can do if I'm needed
Use my strength in anyway

[Chorus]
If we all work together
We would be stronger
If we all open our eyes
We could see further
If we all stand tall enough no one can beat us
If we all hold our hands up high we can carry the world

And all I ask is that we be honest
Do what we can if we're gonna stay
I want to make you a promise
Love and understanding
Is the game I want to play

[Chorus]

With my hands with my feet
When I dream when I sleep
From the start here inside I believe

If we all work together
We would be stronger
If we all hold our hands up high we can carry the world

[Chorus]",High,2007
Hazel Miller,"Well, it's a marvelous night for a moondance
With the stars up above in your eyes
A fantabulous night to make romance
'Neath the cover of October skies

And all the leaves on the trees are fallin'
To the sound of the breezes that blow
An' I'm trying to please to the callin'
Of your heart strings that play soft and low

And all the nights magic seems to whisper and hush
And all the soft moonlight seems to shine in your blush
Can I just have one more moondance with you, my love?
Can I just make some more romance with you, my love?

Well, I wanna make love to you tonight
I can't wait 'til the morning has come
And I know now the time is just right
And straight in to my arms you will run

And when you come, my heart will be waiting
To make sure that you're never alone
There and then, all my dreams will come true, dear
There and then, I will make you my own

And every time I touch you, you just tremble inside
And I know how much you want me that you can't hide
Can I just have one more moondance with you, my love?
Can I just make some more romance with you, my love?

Well, it's a marvelous night for a moondance
With the stars up above in your eyes
A fantabulous night to make romance
'Neath the cover of October skies

And all the leaves on the trees are falling
To the sound of the breezes that blow
And I'm trying to please to the calling
Of your heart strings that play soft and low

And all the nights magic seems to whisper and hush
And all the soft moonlight seems to shine in your blush
Can I just have one more moondance with you, my love?
Can I just make some more romance with you, my love?

One more moon dance with you
In the moon light, on a magic night
All the moon light, on a magic night
Can I just have one more moondance with you, my love?",Moon Dance,2006
Hazel O'Conner,"I am the Blackman and you are the white
I am the deviant and you're always right
I am the darkness and you are the light
I am the Blackman, you're the white

Yeah, I'm the good little holier than thou, hide my head in my hand
I hear no, see no, speak no, no, no, no understand

Well, I am the blackness, I am the dark
I am the alcoholic beast in a park
I am the girl who sold her body to the dark
I am the truth of it, you are the hypocrite

I am the dirty and you are the clean
I live in places where you've never been
I eat the garbage and you eat the cream
I am the dirty, you're the clean

You give me the third degree for being different to thee
You hit me, you kick me, you tell me [Incomprehensible] I should be

Well, I am the blackness, I am the dark
I am the alcoholic beast in a park
I am the girl who sold her body to the dark
I am the truth of it, you are the hypocrite

I am the white man, I paint you black
I am the traitor but I put you on the whack
I am the coward, I shoot you in the back
I am the white man, I paint you black

Yeah, I'm the good little holier than thou, hide my head in my hand
I hear no, see no, speak no, no, no, no understand

Well, I am the blackness, I am the dark
I am the alcoholic beast in a park
I am the girl who sold her body to the dark
I am the truth of it, you are the hypocrite

Say I am the blackness, I am the dark
I am the alcoholic beast in a park
I am the girl who sold her body to the dark
I am the truth of it, you are the hypocrite
Blackman
",Black Man,2004
Hazel O'Conner,"Well, I saw your face in a photograph
Cried so much, I nearly laughed
You never really had the chance
To question why did you live some to cry some and die?

Who, what and how writes the song, calls the tune
Says what's right and wrong
Writes the song, calls the tune
Says what's right and wrong

Oh, I'd have caught your eyes, but my hands were tied
Was it truth? Was it lies?
Many words of truth are spoken in jest
Who would have guessed that, or trust that? What a mess!

Who, what and how writes the song, calls the tune
Says what's right and wrong
Writes the song, calls the tune
Says what's right and wrong

Who, what and how writes the song, calls the tune
Says what's right and wrong
Writes the song, calls the tune
Says what's right and wrong

Who, what and how writes the song, calls the tune
Says what's right and wrong
Writes the song, calls the tune
Says what's right and wrong

Who, what and how writes the song, calls the tune
Says what's right and wrong
Writes the song, calls the tune
Says what's right and wrong, ooh ... [fade out]



",Calls The Tune,2004
Hazel O'Conner,"In the beginning was the word, man said: Let there be more light
Electric scenes and laser beams, neon brights the light abhorring nights
On the second day he said: Let's have a gas
Hydrogen and cholera and pest
Let's make some germs, we'll poison the worms
Man will never be suppressed

And he said: Behold what I have done
I've made a better world for everyone
Nobody laugh, nobody cry
World without end, forever and ever
Amen, amen, amen

On the third we get green and blue for pie
On the fourth we send rockets to the sky
On the fifth make the beasts and submarines
On the sixth man prepares his final dream:
In our image, let's make robots for our slaves
Imagine all the time that we can save
Computers, machines, the silicon dream
Seventh he retired from the scene

And he said: Behold what I have done
I've made a better world for everyone
Nobody laugh, nobody cry
World without end, forever and ever
Amen (amen), amen (amen), amen (amen)

On the eighth day machine just got upset
A problem man had never seen as yet
No time for flight, a blinding light
And nothing but a void, forever night

He said: Behold what man has done
There's not a world for anyone
Nobody laughed, nobody cried
World's at an end, everyone has died
Forever amen (amen), amen (amen), amen (amen)

He said: Behold what man has done
There's not a world for anyone
Nobody laughed, nobody cried
World's at an end, everyone has died
Forever amen (amen), amen (amen), amen (amen)

(Amen)",Eighth Day,2004
