Band,Lyrics,Song,Year
Tommy Faragher,"You gotta work a little harder
than the next guy
Be a little smarter
If you wanna survive
You gotta move a little faster
Than the last time
Know just what you're after
And never look behind

[Chorus]
You gotta look out for number one
Set your sides of the stars and the sun
Look out for number one
You gotta push a little harder, push a little harder
Yeeeeah yeah

You gotta stand a little closer to the fire
Give a little more if you wanna get higher
Fly just like an arrow
Don't you ever lose sight
You gotta walk straight and narrow
Every day and every night

[Chorus]

You gotta work a little harder
be a little smarter
move a little faster
Know just what you're after

[Chorus]

You gotta look out for number one
Push a little harder
Push a little harder
Be a little smarter
Oh yeah!",Look Out for Number One,1991
Tommy Flanagan,"Old man sunshine listen you
Never tell me dreams come true
Just try it and I'll start a riot
Beatrice Fairfax don't you dare
Ever tell me he will care
I'm certain it's the final curtain
I never want to hear from any cheerful Pollyannas
Who tell you fate supplies a mate
It's all bananas

They're writing songs of love but not for me
A lucky star's above but not for me
With love to lead the way I've found more clouds of gray
Than any Russian play could guarantee

I was a fool to fall and get that way
Hi-ho, alas, and also lack-a-day
Although I can't dismiss the memory of his kiss
I guess he's not for me

I was a fool to fall and get that way
Hi-ho, alas, and also lack-a-day
Although I can't dismiss the memory of his kiss",But Not for Me,1956
Tommy Flanagan,"Oh, the shark, babe, has such teeth, dear
And it shows them pearly white
Just a jackknife has old MacHeath, babe
And he keeps it, ah, out of sight
Ya know when that shark bites with his teeth, babe
Scarlet billows start to spread
Fancy gloves, oh, wears old MacHeath, babe
So there's never, never a trace of red

Now on the sidewalk, huh, huh, whoo sunny morning, un huh
Lies a body just oozin' life, eek
And someone's sneakin' 'round the corner
Could that someone be Mack the Knife?

There's a tugboat, huh, huh, down by the river dontcha know
Where a cement bag's just a'drooppin' on down
Oh, that cement is just, it's there for the weight, dear
Five'll get ya ten old Macky's back in town
Now d'ja hear 'bout Louie Miller? He disappeared, babe
After drawin' out all his hard-earned cash
And now MacHeath spends just like a sailor
Could it be our boy's done somethin' rash?

Now Jenny Diver, ho, ho, yeah, Sukey Tawdry
Ooh, Miss Lotte Lenya and old Lucy Brown
Oh, the line forms on the right, babe
Now that Macky's back in town",Moritat (Mack the Knife),1956
Tommy Flanagan,"You don't know what love is
'Til you've learned the meaning of the blues
Until you've loved a love you've had  to lose,
You don't know what love  is.

You don't know how lips hurt
Until you've kissed and had to pay the cost,
Until you've flipped your heart and you have lost,
You don't know what love is.

Do you know how a lost heart fears
At the thought of reminiscing,
And how lips that taste of tears
Lose their taste for kissing?
You don't know how hearts burn
For love that can, not live yet never dies.
Until you've faced each dawn with sleepless eyes,
You don't know what love is.",You Don't Know What Love is,1956
Tommy Flanagan,"As a tot, when I trotted in little velvet panties,
I was kissed by my sisters, my cousins, and my aunties.
Sad to tell, it was hell, an inferno worse than Dante's.

So my dear I swore,
""Never, never more !""
On my list, I insisted that kissing must be crossed out.
Now, I find I was blind, and oh my! How I lost out!

I could cry salty tears,
Where have I been all these years?
Little wow, tell me now:
How long has this been going on?

There were chills up my spine,
And some thrills I can't define.
Listen, sweet, I repeat:
How long has this been going on?

Oh, I feel that I could melt,
Into Heaven I'm hurled!
I know how Columbus felt,
Finding another world.

Kiss me once, then once more.
What a dunce I was before.
What a break! For Heaven's sake!
How long has this been going on?

Dear, when in your arms I creep,
That divine rendezvous,
Don't wake me, if I'm asleep,
Let me dream that it's true!

Kiss me twice, then once more.
That makes thrice, let's make it four!
What a break! For Heaven's sake!
How long has this been going on?
How long has this, been going on?",How Long Has This Been Goin' On?,1957
Tommy Flanagan,"Paradise can not refuse us
Never such a happy pair

Everybody must excuse us
If we walk on air

All the shadows now will lose us
Lucky stars are everywhere

As a happy being
Here's what I'm foreseeing

For you, for me, forever more
It's bound to be forever more

It's plain to see
We found, by finding each other
The love we waited for

I'm yours, you're mine
And in our hearts
The happy ending starts

What a lovely world
This world will be
With a world of love in store
For you, for me, forever more.

What a lovely world
This world will be
With a world of love in store
For you, for me, forever more.","For You, For Me, Forevermore",1960
Tommy Flanagan,"I'll get by
As long as I have you
Though there be rain
And darkness too
I'll not complain
I'll see it through

Poverty
May come to me, it's true
But what care I
Say, I'll get by
As long as I have you.

But what care I
Say, I'll get by
As long as I have you.",I'll Get By (As Long as I Have You),1960
Tommy Flanagan,"You look at me and wonder, you look at me and doubt,
Darling your eyes are asking, ""Will the flame burn out?""
Well, no one is sure of sun shine, no one is sure of dawn,
But I am sure my love will live on and  on.
I'll be tired of you  when stars are tired of gleaming
When I am tired of dreaming, then I'll be tired of  you.
This I know is true, when winds are tired of blowing,
When grass is tired of growing, then I'll be tired  of you.

Beyond the years, 
'Til day is night, 'til wrong is right,
'Til birds refuse to sing,
Beyond the years, the echo of my only love 
Will still be whispering, whispering.
And if my throbbing heart should ever start repeating 
That it is tired of beating, then I'll be tired of you.",Then I'll Be Tired of You,1960
Tommy Flanagan,"Perdido,
I look for my heart
It`s perdido
I lost it way down in Torito
The day the fiesta started

Bolero,
I sway that they play the Bolero
I kissed me the listing sombrero
And that`s when my heart departed

High, was the sun when I held him close
Low, was the moon when we said, ""Adios""

Perdido
My heart ever since is Perdido
I know I must go to Torito
To find what I lost Perdido

High, was the sun when I held him close
Low, was the moon when we said, ""Adios""

Perdido
Goodnight perdido
I lost perdido",Perdido,1962
Tommy Flanagan,"Star eyes,
That to me is what your eyes are,
Soft as stars in April skies are,
Tell me some day you'll fulfill
Their promise of a thrill.

Star eyes,
Flashing eyes in which my hopes rise,
Let me show you where my heart lies.
Let me prove that it adores
That loveliness of yours.

All my life I've felt
Content to stargaze at the skies.
Now I only want to to melt
The stardust in your eyes.

Star eyes,
When if ever, will my lips know
If it's me for whom those eyes glow?
Makes no diff'rence where you are,
Your eyes still hold my wishing star,
Oh, star eyes, how lovely you are.",Star Eyes,1965
Tommy Flanagan,"You stepped out of a dream
You are too wonderful to be what you seem!
Could there be eyes like yours, 
Could there be lips like yours
Could there be smiles like yours, 
Honest and truly?
You stepped out of a cloud
I want to take you away, away from the crowd
And have you all to myself, 
Alone and apart out of a dream, 
Safe in my heart
 
You stepped out of a dream
You are too wonderful to be what you seem!
Could there be eyes like yours, 
Could there be lips like yours
Could there be smiles like yours, 
Honest and truly?
You stepped out of a cloud
I want to take you away, away from the crowd
And have you all to myself, 
Alone and apart out of a dream, 
Safe in my heart",You Stepped out of a Dream,1965
Tommy Flanagan,"Good morning heartache
You old gloomy sight
Good morning heartache
Thought we said goodbye last night

I turned and tossed until it seems you have gone
But here you are with the dawn
Wish I forget you, but you're here to stay
It seems I met you
When my love went away
Now everyday I stop I'm saying to you
Good morning heartache what's new

Stop haunting me now
Can't shake you no how
Just leave me alone
I've got those Monday blues
Straight to Sunday blues

Good morning heartache
Here we go again
Good morning heartache
You're the one
Who knows me well
Might as well get use to you hanging around
Good morning heartache
Sit down",Good Morning Heartache,1973
Tommy Flanagan,"You, get me feelin' crazy
There always on my mind
And I get to feelin' lately
If I never knew your name,
I'd love you all the same
But I have you to myself
Wanting nothing else
Knowing that you're mine

Good time,bad time,all the time
Hands reachin' 'cross a room
And I know somewhere inside my mind
If I never knew your name,
I'd love you all the same,
But I have you to myself
Wanting nothing else
Knowing that you're mine

Ba ba ba ba ba
Ba ba ba ba ba

And I know somewhere inside my mind
If I never knew your name,
I'd love you all the same
But I have you to myself

Wanting nothing else
Knowing that you're mine
Have you to myself
Wanting nothing else
Knowing that you're mine...",I Never Knew,1975
Tommy Flanagan,"I could show the world how to smile
I could be glad all of the while
I could change the grey skies to blues 
If I had you
I could leave the old days behind
Leave all my pals, I'd never mind
I could start my life all a new 
If I had you
I could climb the snow capped mountains
Sail the mighty ocean wide
I could cross the burning desert
If I had you by my side
I could be a king, dear, uncrowned
Humble or poor, rich or renowned
There is nothing I couldn't do 
If I had you
 
I could show the world how to smile
I could be glad all of the while
I could change the grey skies to blues 
If I had you
I could leave the old days behind
Leave all my pals, I'd never mind
I could start my life all a new 
If I had you
I could climb the snow capped mountains
Sail the mighty ocean wide
I could cross the burning desert
If I had you by my side
I could be a king, dear, uncrowned
Humble or poor, rich or renowned
There is nothing I couldn't do",If I Had You,1975
Tommy Flanagan,"Night and stars above that shine so bright 
The myst'ry of their fading light 
That shines upon our caravan 
 
Sleep upon my shoulder as we creep 
Across the sand so I may keep 
The mem'ry of our caravan 
 
This is so exciting 
You are so inviting 
Resting in my arms 
As I thrill to the magic charms 
Of you beside me here beneath the blue 
My dream of love is coming true 
Within our desert caravan",Caravan,1975
Tommy Flanagan,"I have almost ev'ry thing a human could desire,
Cars and houses, bear-skin rugs to lie before my fire
But there's something missing,
Something isn't there,
It seems I'm never kissing the one whom I care for.
I want Something To Live For
Someone to make my life an adventurous dream
Oh, what wouldn't I give for 
Someone who'd take my life 
And make it seem gay as they say it ought to be.
Why can't I have love like that brought to me?
My eye is watching the noon crowds 
Searching the promenades seeking a clue
To the one who will someday be my 
Something To Live For.
I want Something To Live For
Someone to make my life an adventurous dream
Oh, what wouln't I give for 
Someone who'd take my life 
And make it seem gay as they say it ought to be.
Why can't I have love like that brought to me?
My eye is watching the noon crowds 
Searching the promenades seeking a clue
To the one who will someday be my Something To Live For.
",Something to Live For,1975
Tommy Flanagan,"Maybe I should have saved those left over dreams
Funny, but here's that rainy day
Here's that rainy day they told me about
And I laughed at the thought that it might turn out this way

Where is that worn out wish that I threw aside
After it brought my lover near
It's funny how love becomes a cold rainy day
Funny, that rainy day is here

Funny how love becomes a cold rainy day
Funny, that rainy day is here",Here's That Rainy Day,1977
Tommy Flanagan,"Somewhere there's music
How faint the tune
Somewhere there's heaven
How high the moon
There is no moon above
When love is far away too
Till it comes true
That you love me as I love you

Somewhere there's music
How near, how far
Somewhere there's heaven
It's where you are
The darkest night would shine
If you would come to me soon
Until you will, how still my heart
How high the moon

Somewhere there's music
How faint the tune
Somewhere there's heaven
How high the moon
The darkest night would shine
If you would come to me soon
Until you will, how still my heart
How high the moon",How High the Moon,1978
Tommy Flanagan,"The falling leaves drift by the window
The autumn leaves of red and gold
I see your lips, the summer kisses
The sun-burned hands I used to hold

Since you went away the days grow long
And soon I'll hear old winter's song
But I miss you most of all my darling
When autumn leaves start to fall

C'est une chanson, qui nous ressemble
Toi tu m'aimais et je t'aimais
Nous vivions tous deux ensemble
Toi qui m'aimais moi qui t'aimais
Mais la vie separe ceux qui s'aiment
Tout doucement sans faire de bruit
Et la mer efface sur le sable les pas des amants desunis",Autumn Leaves,1978
Tommy Flanagan,"I don't want you, but I'd hate to lose you
You've got me in between the devil and the deep blue sea
I forgive you, 'cause I can't forget you
You've got me in between the devil and the deep blue sea

[Repeat: x2]
I ought to cross you off my list
But when you come a-knocking at my door
Fate seems to give my heart a twist
And I come running back for more
I should hate you, but I guess I love you
You've got me in between the devil and the deep blue sea

You've got me in between the devil and the deep blue sea
The devil and the deep blue sea",Between the Devil and the Deep Blue Sea,1980
Tommy Flanagan,"Pack up your troubles and just get happy 
Ya better chase all your cares away 
Sing Hallelujah, come on get happy 
Get ready for the judgment day 

The sun is shining, come on get happy 
The Lord is waiting to take your hand 
Shout Hallelujah, come on get happy 
We're going to the Promised Land 

We're heading 'cross the river 
Gonna wash our sins in the tide 
It's all so peaceful 
On the other side 

Forget your troubles and just get happy 
Ya better chase all your cares away 
Sing Hallelujah, c'mon get happy 
Get ready for the judgment day 

The sun is shining, come on get happy 
The Lord is waiting to take your hand 
Shout Hallelujah, come on get happy 
We're going to the Promised Land 

We're heading 'cross the river 
Wash our sins away in the tide 
It's all so peaceful 
On the other side 

We're heading 'cross the river 
Wash our sins away in the tide 
It's all so peaceful 
On the other side 

Forget your troubles and just get happy 
Ya better chase your cares away!
Sing Hallelujah, come on get happy 
Get ready for the judgment day",Get Happy,1980
Tommy Flanagan,"Hush now don't explain
I know you raise Cain
I'm glad you're back
Don't explain

Quiet, don't explain
You mixed with some dame
Skip that lipstick
Don't explain

You know that I love you and what love endures
All my thoughts are of you
For I'm so completely yours
Cry to hear folks chatter, and I know you cheat
But right and wrong don't matter when you're with me sleep

Hush now, don't explain
You're my joy and pain
My life's yours love
Don't explain",Ill Wind,1980
Tommy Flanagan,"Last night when we were young
Love was a star, a song unsung
Life was so new, so real so right
Ages ago last night

Today the world is old
You flew away and time grew cold
Where is that star that shone so bright
Ages ago last night?

To think that spring had depended
On merely this, a look, a kiss
To think that something so splendid
Could slip away in one little daybreak

So now, let's reminisce
And recollect the sighs and the kisses
The arms that clung

When we were young last night",Last Night When We Were Young,1980
Tommy Flanagan,"Somewhere over the rainbow, way up high
There's a land that I've heard of once in a lullaby.
Somewhere over the rainbow, skies are blue
And the dreams that you dare to dream,
Really do come true.

Someday I'll wish upon a star
And wake up where the clouds are far behind me.
Where troubles melt like lemon drops,
High above the chimney tops,
That's where you'll find me.

Somewhere over the rainbow, blue birds fly
Birds fly over the rainbow
Why then, oh why can't I?
If happy little bluebirds fly beyond the rainbow
Why, oh why can't I?

Somewhere over the rainbow, way up high
There's a land that I've heard of once in a lullaby.
Somewhere over the rainbow, skies are blue
And the dreams that you dare to dream,
Really do come true.

Someday I'll wish upon a star
And wake up where the clouds are far behind me.
Where troubles melt like lemon drops,
High above the chimney tops,
That's where you'll find me.

Somewhere over the rainbow, blue birds fly
Birds fly over the rainbow
Why then, oh why can't I?
If happy little bluebirds fly beyond the rainbow
Why, oh why can't I?",Over the Rainbow,1980
Tommy Flanagan,"I fall in love too easily, I fall in love too fast
I fall in love too terribly hard, for love to ever last
My heart should be well schooled, 'cause I've been fooled in the past
And still I fall in love too easily, I fall in love too fast
 
I fall in love too easily, I fall in love too fast
I fall in love too terribly hard, for love to ever last
My heart should be well schooled, 'cause I've been fooled in the past
And still I fall in love too easily, I fall in love too fast",I Fall in Love Too Easily,1981
Tommy Flanagan,"I look at you and suddenly
Something in your eyes I see
Soon begins bewitching me
It's that old devil moon
That you stole from the skies
It's that old devil moon in your eyes

You and you glance make this romance
Too hot to handle
Stars in the night
Blazing their light
Can't hold a candle
To your razzle-dazzle

You've got me flyin' high and wide
On a magic carpet ride
Full of butterflies inside
Wanna cry, wanna croon
Wanna laugh like a loon
It's that old devil moon in your eyes

Just when I think
I'm free as a dove
Old devil moon
Deep in your eyes
Blinds me with love",Old Devil Moon,1981
Tommy Flanagan,"Speak low when you speak, love,
Our summer day withers away
Too soon, too soon.

Speak low when you speak, love,
Our moment is swift, like ships adrift,
We're swept apart too soon.

Speak low, darling speak low,
Love is a spark lost in the dark,
Too soon, too soon,
I feel wherever I go
That tomorrow is near, tomorrow is here
And always too soon.

Time is so old and love so brief,
Love is pure gold and time a thief.
We're late darling, we're late,
The curtain descends, ev'rything ends
Too soon, too soon,
I wait darling, I wait
Will you speak low to me,
Speak love to me and soon.",Speak Low,1981
Tommy Flanagan,"Somewhere waiting for me
There is someone I'm longing to see
Someone I simply can't help but adore
Someone who'll thrill me forever
Some day my prince will come
Some day I'll find my love
And how thrilling that moment will be
When the prince of my dreams comes to me
He'll whisper, I love you,
And steal a kiss or two
Though he's far away,
I'll find my love some day
Some day when my dreams come true
Some day I'll find my love
Someone to call my own
And I'll know her the moment we meet
For my heart will start skipping a beat
Some day we'll say and do
Things we've been longing to
Though she's far away
I'll find my love some day
Some day when my dreams come true",Some Day My Prince Will Come,1983
Tommy Flanagan,"Embrace me, my sweet embraceable you!
Embrace me, you irreplaceable you!

Just one look at you
My heart grew tipsy in me,
You and you alone
Bring out the gypsy in me! 

I love all, the many charms about you!
Above all, I want my arms about you! 

Don't be a naughty baby,
Come to papa, come to papa, do!
My sweet embraceable you!",St. Thomas,1983
Tommy Flanagan,"Chillun', listen here to me
This is my philosophy
To see me through the day
To scare my cares away

All God's Chillun Got Rhythm
All God's Chillun got swing
Maybe haven't got money
Maybe haven't got shoes
All God's Chillun Got Rhythm
For to push away the blues
Yeah !

All God's Chillun got trouble
Trouble don't mean a thing
When they start to go ho ho ho de ho
Troubles bound to go 'way, say!

All God's Chillun Got Swing.
",All God's Chillun Got Rhythm,1986
Tommy Flanagan,"Whether you are here or yonder, 
Whether you are false or true
Whether you remain or wander, 
I'm growing fonder of you
Even though your friends forsake you, 
Even though you don't succeed
Wouldn't I be glad to take you, 
Give you the break you need

More than you know, more than you know
Girl of my heart, I love you so
Lately I find you're on my mind
More than you know

Whether you're right, whether you're wrong
Girl of my heart, I'll string along
You need me so
Much more than you'll ever know (ever know)        
Loving you the way that I do      
  
There's nothing I can do about it        
Loving may be all you can give        
But baby I can't live without it
Oh, how I'd cry, oh, how I'd cry
If you got tired and said ""Good-bye""

More than I'd show
More than you'd ever know",More Than You Know,1986
Tommy Flanagan,"I am dejected, I am depressed
Yet resurrected and sailing the crest
Why this elation mixed with deflation
What explanation 
I am in love

Such conflicting questions rise around my brain
Should I order cyanide or order champagne
Oh, what is this sudden jolt
I feel like a frightened colt
Just hit by a thunderbolt
I am in love

I knew the hours were against me before
I have no flare for flaming desire
But since the gods gave me you to adore
I may lose but I refuse to fight the fire

So, come and enlighten my days and never depart
You only can brighten the blaze that burns in my heart
But I am only in love with you
And so in need of a stampede of love
I'm so in need of a stampede of love
I'm so in need of a stampede of love
I'm so in need of love",I Am in Love,1991
Tommy Flanagan,"It don't mean a thing
If it ain't got that swing
(doo wah, doo wah, doo wah, doo wah
Doo wah, doo wah, doo wah, doo wah)
It don't mean a thing
All you got to do is sing
(doo wah, doo wah, doo wah, doo wah
Doo wah, doo wah, doo wah, doo wah)
It makes no diff'rence 
If it's sweet or hot
Just give that rhythm 
Ev'rything you got
Oh, it don't mean a thing
If it ain't got that swing
(doo wah, doo wah, doo wah, doo wah
Doo wah, doo wah, doo wah, doo wah)",It Don't Mean a Thing (If It Ain't Got That Swing),1994
Tommy Flanagan,"Love is funny or it's sad, 
Or it's quiet or it's mad,
It's a good thing or it's bad,
But beautiful!

Beautiful to take a chance
And if you fall, you fall,
And I'm thinking I wouldn't mind at all.
Love is tearful or it's gay.
It's a problem or it's play,
It's a heartache either way,
But beautiful!

And I'm thinking if you were mine
I'd never let you go,
And that would be but beautiful I know.",But Beautiful,1995
Tommy Flanagan,"Lately, I find myself out gazing at stars, 
Hearing guitars like someone in love.
Sometimes the things I do astound me, 
Mostly whenever you're around me.
Lately I seem to walk as though I had wings, 
Bump into things like someone in love.
Each time I look at you, 
I'm limp as a glove, 
And feeling like someone in love.",Like Someone in Love,1995
Tommy Flanagan,"In A Sentimental Mood 
I can see the stars come thru my room
While your loving attitude
Is like a flame that lights the gloom
On the wings of ev'ry kiss 
Drift a melody so strange and sweet
In this sentimental bliss you make my 
Paradise complete
Rose pearls seem to fall
It's all like a dream to call you mine
My heart's lighter thing 
Since you made me this night a thing divine
In A Sentimental Mood 
I'm within a world so heavenly
For I never dreamt 
That you'd be loving sentimental me
In A Sentimental Mood 
I can see the stars come thru my room
While your loving attitude 
Is like a flame that lights the gloom
On the wings of ev'ry kiss 
Drift a melody so strange and sweet
In this sentimental bliss you make my 
Paradise complete
Rose pearls seem to fall
It's all like a dream to call you mine
My heart's lighter thing 
Since you made me this night a thing divine
In A Sentimental Mood 
I'm within a world so heavenly
For I never dreamt 
That you'd be loving sentimental me",In a Sentimental Mood,1995
Tommy Flanagan,"Just friends, lovers no more
Just friends, but not like before
To think of what we've been and not to kiss again
Seems like pretending it isn't the ending
Two friends drifting apart
Two friends, but one broken heart
We loved, we laughed, we cried, and suddenly love died",Just Friends,1996
