Band,Lyrics,Song,Year
Stan Getz,"If I should write a book for you
That brought me fame and fortune too,
That book would be,
Like my heart and me,
Dedicated to you.

And if I should paint a picture too
That showed the loveliness of you,
My art would be,
Like my heart and me,
Dedicated to you.

To you,
Because your love is the beacon that lights up my way.
To you,
Because with you I know a lifetime could be just one heavenly day.

If I should find a twinkling star,
One half as wondrous as you are,
That star would be
Like my heart and me,
Dedicated to you.

To you,
Because your love is the beacon that lights up my way.
To you,
Because with you I know a lifetime could be just one heavenly day.

If I should find a twinkling star,
One half as wondrous as you are,
That star would be
Like my heart and me,
Dedicated to you.",Dedicated to You,2005
Stan Getz,"The very thought of you makes my heart sing
Like an April breeze on the wings of spring,
And you appear in all your splendor,
My one and only love.

The shadows fall and spread their mystic charms
In the hush of night while you're in my arms.
I feel your lips, so warm and tender,
My one and only love.

The touch of your hand is like heaven,
A heaven that I've never known.
The blush on your cheek whenever I speak
Tells me that you are my own.

You fill my eager heart with such desire.
Ev'ry kiss you give sets my soul on fire.
I give myself in sweet surrender,
My one and only love.",My One and Only Love,2005
Stan Getz,"Too young to go steady, too young
I hear him (her) say.
He (she) says I'm (we're) not ready
But then why am I (are we) feeling this way?

Too young so he (she) tells me
He (she) says we'll have to wait.
Why wait till it may be too late?

Can't he (she) realize he (she) drive me wild
Is he (she) made of stone?
Must he (she) always treat me (act just) like a child?

Won't he (she) ever own up
I'm (we're) grown up?
Some day he'll (she'll) be sorry
Some day just wait and see
He'll (she'll) wish he'd (she'd) gone steady with me!  
",Too Young to Go Steady,2005
Stan Getz,"The touch of your lips upon my brow
Your lips that are cool and sweet
Such tenderness lies in their soft caress
My heart forgets to beat

The touch of your hands upon my head
The love in your eyes, ashine
And now at last the moment divine
The touch of your lips, the love in your eyes

The touch of your lips on mine

",The Touch of Your Lips,2005
Stan Getz,"You're mine, you
You belong to me, you
I will never free you
You're here with me to stay

You're mine, you
You are mine completely
Love me strong or sweetly
I need you night and day

Arm in arm, hand in hand
We will be found together
Heart to heart, lips to lips
We're chained and long together

I own you
I don't need to buy love
You're a slave to my love
In every way you're mine

Arm in arm, hand in hand
We will be found together
Heart to heart, lips to lips
We're chained and long together

I own you
I don't need to buy love
You're a slave to my love
In every way you're mine

","You're Mine, You",2005
Stan Getz,"You went away
I let you
We broke the ties that bind
I wanted to forget you
And leave the past behind
Still, the magic of the night I met you
Seems to stay forever in my mind

The sky was blue
And high above
The moon was new
And so was love
This eager heart of mine was singing
Lover where can you be

You came at last
Love had its day
That day is past
You've gone away
This aching heart of mine is singing
Lover come back to me
When I remember every little thing

You used to do
I'm so lonely
Every road I walk along
I walk along with you
No wonder I am lonely

The sky is blue
The night is cold
The moon is new
But love is old
And while I'm waiting here
This heart of mine is singing
Lover come back to me
When I remember every little thing

You used to do
I grow lonely
Every road I walk along
I walk along with you
No wonder I am lonely

The sky is blue
The  night is cold
The moon is new
But love is old
And while I'm waiting here
This heart of mine is singing
Lover come back to me",Lover Come Back to Me,2005
Stan Getz,"Um cantinho e um violÃ£o
Este amor, uma canÃ§Ã£o
Pra fazer feliz a quem se ama

Muita calma pra pensar
E ter tempo pra sonhar

Da janela vÃª-se o Corcovado
O Redentor que lindo

Quero a vida sempre assim com vocÃª perto de mim
AtÃ© o apagar da velha chama

E eu que era triste
Descrente deste mundo
Ao encontrar vocÃª eu conheci
O que Ã© felicidade meu amor

O que Ã© felicidade, o que Ã© felicidade",Corcovado,2005
Stan Getz,"Let the drums roll out
Let the trumpet call
While the people shout, ""strike up the band""

Hear the cymbals ring
Calling one and all
To the martial swing, strike up the band

There is work to be done, to be done
Let's have fun, fun, fun
You son of a gun of a gun, take your stand

Form a line, oh, oh
Come on, let's go
Hey, leader, strike up the band!

There is work to be done, to be done
Let's have fun, fun, fun
Come on, son of a gun of a gun, take your stand

Form a line, oh, oh
Come on, let's go
Hey, Mr. Leader, 
Hey, Mr. Leader,
Please strike up the band!",Strike Up the Band,2005
Stan Getz,"All around the world
There are people like you and me
From the poorest beggar in the street
To the richest king and queen

Some people take and then they never give
Gotta learn to give and take
If ya want to learn to live
In a small world, small, small world

Now we can fight one another
Like they to on TV
Or we can help one another
The way it's supposed to be

If we all give a little
It could really mean a lot
It's a small, small world
But it's the only one we've got
Small world, small, small world

Small world, small, small world
It's our world, it's our power
Small world, oh

Small world, small, small world
Our one and only small world
You gotta learn to give if you want to live
Small world",Small World [Single Edit],2006
Stan Getz,"The shadow of your smile
When you have gone
Will color all my dreams
And light the dawn

Look into my eyes my love and see
All the lovely things you are to me

Our wistful little star
It was far, too high
A teardrop kissed your lips
And so did I

Now when I remember spring
All the joys that love can bring
I will be remembering
The shadow of your smile",The Shadow of Your Smile,2006
Stan Getz,"Through the mirror of my mind
Time after time
I see reflections of you and me

Reflections of
The way life used to be
Reflections of
The love you took from me

Oh, I'm all alone now
No love to shield me
Trapped in a world
That's a distorted reality

Happiness you took from me
And left me alone
With only memories

Through the mirror of my mind
Through these tears that I'm crying
Reflects a hurt I can't control
'Cause although you're gone
I keep holding on
To the happy times
Oh, when you were mine

As I peer through the window
Of lost time
Looking over my yesterdays
And all the love I gave all in vain
(All the love) All the love
That I've wasted
(All the tears) All the tears
That I've tasted
All in vain

Through the hollow of my tears
I see a dream that's lost
From the hurt
That you have caused

Everywhere I turn
Seems like everything I see
Reflects the love that used to be

In you I put
All my faith and trust
Right before my eyes
My world has turned to dust

After all the nights
I sat alone and wept
Just a handful of promises
Are all that's left of loving you

Reflections of
The way life used to be
Reflections of
The love you took from me

In you I put
All my faith and trust
Right before my eyes
My world has turned to dust",Reflections,2006
Stan Getz,"Magic mirror come and search my heart
Can you tell me what you see
There's a thousand voices whispering
Songs and you're the melody

So I imagine my heart with you
See what imagination can do
It's not hard to conceive
Love ecstasy imagining you with me

Many, many days our shadows passed
Seeing visions of a new bright horizon
Set the morning light
And that morning light is you
So I imagine my heart with you

See what imagination can do
It's not hard to conceive 
love ecstasy imagining you, imagining me
The beauty we both can see

You're the dream I prayed would come along
To make my fantasy
Day and night you live inside my heart
You're the flame of love to me
",Imagination,2006
Stan Getz,"You and I, an unmatched pair
Took the time to touch, to share
Worlds apart the night we met
We braved the odds and won the bet
Not perfect yet but close enough for love

How old-fashioned, pure romance
Shared a kiss and shared the dance
Shared the body and bouquet
We'll taste the wine another day
When you and I are close enough for love

Not just lovers, more than friends
Who knows where one starts, one ends
Tracing lights through sleepless nights
That I'll remember always, always

Long goodbyes and tearful looks
Hold up well in poems and books
But you and I have life to hold
The greatest story ever told
Not perfect yet but close enough for love

Not perfect yet but close enough for love

",Close Enough for Love,2006
Stan Getz,"A time for summer skies
For hummingbirds and butterflies
For tender words that harmonize with love

A time for climbing hills
For leaning out of windowsills
Admiring daffodils above

A time for holding hands together
A time for rainbow coloured weather
A time of make believe that we've been dreaming of

As time goes drifting by
The willow bends and so do I
But all my friends whatever skies above
I know a time for spring
A time for fall
But best of all
A time for love

A time for holding hands together
A time for rainbow coloured weather
A time of make believe that we've been dreaming of

As time goes drifting by
The willow bends and so do I
But all my friends whatever skies above
I know a time for spring
A time for fall
But best of all
A time for love",A Time for Love,2006
Stan Getz,"Your lips were like a red and ruby chalice, warmer than the summer night
The clouds were like an alabaster palace rising to a snowy height.
Each star it's own aurora borealis, suddenly you held me tight,
I could see the midnight sun.

I can't explain the silver rain that found me--or was that a moonlight veil?
The music of the universe around me, or was that a nightingale?
And then your arms miraculously found me,suddenly the sky turned pale,
I could see the midnight sun.

Was there such a night, it's a thrill i still don't quite believe,
But after you were gone, there was still some stardust on my sleeve.

The flame of it may dwindle to an ember, and the stars forget to shine,
And we may see the meadow in december, icy white and crystalline.
But oh my darling always i'll remember when your lips were close to mine,
And we saw the midnight sun.",Midnight Sun,2007
Stan Getz,"Savoy--the home of sweet romance
Savoy--it wins you with a glance
Savoy gives happy feet a chance to dance
Your old form just like a clinging vine
Your lips so warm and sweet as wine
Your cheek so soft and close to mine, divine

How my heart is singing
While the band is swinging
I'm never tired of romping
And stomping with you at the Savoy
What joy, a perfect holiday
Savoy, where we can glide and sway
Savoy, let me stomp away with you

The home of sweet romance
It wins you at a glance
Gives happy feet a chance to dance
Just like a clinging vine
So soft and sweet as wine
So soft and close to mine, divine

How my heart is singing
While the band is swinging
I'm never, never, never tired of romping
And stomping with you at the Savoy
What joy, a perfect holiday
Savoy, where we can glide and sway
Savoy, let me stomp away with you",Stompin' at the Savoy [DVD],2007
Stan Getz,"Eu quis amar mais tive medo
E quis salvar meu coraÃ§Ã£o
Mas o amor sabe um segredo
O medo pode matar o seu coraÃ§Ã£o

Ãgua de beber
Ãgua de beber camarÃ¡
Ãgua de beber
Ãgua de beber camarÃ¡

Eu nunca fiz coisa tÃ£o certa
Entrei pra escola do perdÃ£o
A minha casa vive aberta
Abri todas as portas do coraÃ§Ã£o

Ãgua de beber
Ãgua de beber camarÃ¡
Ãgua de beber
Ãgua de beber camarÃ¡

Eu sempre tive uma certeza
Que sÃ³ me deu desilusÃ£o
Ã‰ que o amor Ã© uma tristeza
Muita mÃ¡goa demais para um coraÃ§Ã£o

Ãgua de beber
Ãgua de beber camarÃ¡
Ãgua de beber
Ãgua de beber camarÃ¡",Agua de Beber (Water to Drink),2007
Stan Getz,"Ã‰ o pau, Ã© a pedra, Ã© o fim do caminho
Ã‰ um resto de toco, Ã© um pouco sozinho
Ã‰ um caco de vidro, Ã© a vida, Ã© o sol
Ã‰ a noite, Ã© a morte, Ã© um laÃ§o, Ã© o anzol
Ã‰ peroba do campo, Ã© o nÃ³ da madeira
CaingÃ¡ candeia, Ã© o matita-pereira

Ã‰ madeira de vento, tombo da ribanceira
Ã‰ o mistÃ©rio profundo, Ã© o queira ou nÃ£o queira
Ã‰ o vento vetando, Ã© o fim da ladeira
Ã‰ a viga, Ã© o vÃ£o, festa da cumieira
Ã‰ a chuva chovendo, Ã© conversa ribeira
Das Ã¡guas de MarÃ§o, Ã© o fim da canseira
Ã‰ o pÃ©, Ã© o chÃ£o, Ã© a marcha estradeira
Passarinho na mÃ£o, pedra de atiradeira

Ã‰ uma ave no cÃ©u, Ã© uma ave no chÃ£o
Ã‰ um regato, Ã© uma fonte, Ã© um pedaÃ§o de pÃ£o
Ã‰ o fundo do poÃ§o, Ã© o fim do caminho
No rosto um desgosto, Ã© um pouco sozinho

Ã‰ um estepe, Ã© um prego, Ã© uma conta, Ã© um conto
Ã‰ um pingo pingando, Ã© uma conta, Ã© um ponto
Ã‰ um peixe, Ã© um gesto, Ã© uma prata brilhando
Ã‰ a luz da manhÃ£, Ã© o tijolo chegando
Ã‰ a lenha, Ã© o dia, Ã© o fim da picada
Ã‰ a garrafa de cana, o estilhaÃ§o na estrada
Ã‰ o projeto da casa, Ã© o corpo na cama
Ã‰ o carro enguiÃ§ado, Ã© a lama, Ã© a lama

Ã‰ um passo, Ã© uma ponte, Ã© um sapo, Ã© uma rÃ£
Ã‰ um resto de mato na luz da manhÃ£
SÃ£o as Ã¡guas de marÃ§o fechando o verÃ£o
Ã‰ a promessa de vida no teu coraÃ§Ã£o

Ã‰ uma cobra, Ã© um pau, Ã© JoÃ£o, Ã© JosÃ©
Ã‰ um espinho na mÃ£o, Ã© um corte no pÃ©
SÃ£o as Ã¡guas de MarÃ§o fechando o verÃ£o
Ã‰ a promessa de vida no teu coraÃ§Ã£o
Ã‰ pau, Ã© pedra, Ã© o fim do caminho
Ã‰ um resto de toco, Ã© um pouco sozinho
Ã‰ um passo, Ã© uma ponte, Ã© um sapo, Ã© uma rÃ£
Ã‰ um belo horizonte, Ã© uma febre terÃ§Ã£
SÃ£o as Ã¡guas de MarÃ§o fechando o verÃ£o
Ã‰ a promessa de vida no teu coraÃ§Ã£o

Pau (edra)
In (inho)
Peixe (peixe)
Oco (vinho)
Ãgua (vidro)
Vida (Ã³l)
Oite (orti)
AÃ§o (zol)
SÃ£o as Ã¡guas de MarÃ§o fechando o verÃ£o
Ã‰ a promessa de vida no teu coraÃ§Ã£o",Aguas de MarÃ§o (Waters of March),2007
Stan Getz,"Eis aqui este sambinha 
Feito numa nota sÃ³ 
Outras notas vÃ£o entrar 
Mas a base Ã© uma sÃ³ 
Esta outra Ã© consequÃªncia 
Do que acabo de dizer 
Como eu sou a conseqÃ¼Ãªncia 
InevitÃ¡vel de vocÃª 

Quanta gente existe por aÃ­ 
Que fala, fala e nÃ£o diz nada 
Ou quase nada 
JÃ¡ me utilizei de toda a escala 
E no final nÃ£o deu em nada 
Ou quase nada

E voltei prÃ¡ minha nota 
Como eu volto prÃ¡ vocÃª 
Vou cantar em uma nota 
Como eu gosto de vocÃª 
E quem quer todas as notas 
RÃ©, mi, fÃ¡, sol, lÃ¡, si, dÃ³ 
Acaba sem nenhuma 
Fique numa nota sÃ³",Samba de uma Nota SÃ³ (One Note Samba),2007
Stan Getz,"It don't mean a thing
If it ain't got that swing
(doo wah, doo wah, doo wah, doo wah
Doo wah, doo wah, doo wah, doo wah)
It don't mean a thing
All you got to do is sing
(doo wah, doo wah, doo wah, doo wah
Doo wah, doo wah, doo wah, doo wah)
It makes no diff'rence 
If it's sweet or hot
Just give that rhythm 
Ev'rything you got
Oh, it don't mean a thing
If it ain't got that swing
(doo wah, doo wah, doo wah, doo wah
Doo wah, doo wah, doo wah, doo wah)",It Don't Mean a Thing,2007
Stan Getz,"Sad is to live in solitude
Far from your tranquil altitude
Sad is to know that no one ever can live on a dream
That never can be, will never be
Dreamer awake, wake up and see.

Your beauty is an aeroplane
So high my heart can't bear the strain
A heart that stops when you pass by
Only to cause me pain
Sad is to live in solitude",Triste,2008
Stan Getz,"Once I laughed when I heard you saying
That I'd be playing solitaire
Uneasy in my easy chair
It never entered my mind

And once you told me I was mistaken
That I'd awaken with the sun
And ordered orange juice for one
It never entered my mind
You had what I lack, myself
Now I even have to scratch my back myself

Once you warned me that if you scorned me
I'd say a lonely prayer again
And wish that you were there again
To get into my hair again
It never entered my mind

Once you warned me that if you scorned me
I'd say a lonely prayer again
And wish that you were there again
To get into my hair again
It never entered my mind",It Never Entered My Mind [Mono Version],2010
Stan Getz,"I don't believe in frettin' and grievin',
Why mess around with strife?
I never was cut out to step and strut out.
Give me the simple life.

Some find it pleasant dining on pheasant.
Those things roll off my knife,
Just serve me tomatoes, and mashed potatoes,
Give me the simple life.

A cottage small is all I'm after,
Not one that's spacious and wide.
A house that rings with joy and laughter
And the ones you love inside.

Some like the high road, I like the low road,
Free from the care and strife.
Sounds corny and seedy, but yes, indeed-y,
Give me the simple life.",Give Me the Simple Life,2011
Stan Getz,"I'm a very ordinary man
Trying to work out life's happy plan
Doing unto others as I'd like to have them doing unto me

When I find a very lonely soul
Soon be-kinda-comes my only goal
I feel so much better when I tell them my philosophy

I want to be happy
But I won't be happy
Till I make you happy too.

Life's really worth living
When we are mirth giving
Why can't I give some to you

When skies are gray and you say you are blue
I'll send the sun smiling through

I want to be happy
But I won't be happy
Till I make you happy too.

When skies are gray and you say you are blue
I'll send the sun smiling through

I want to be happy
But I won't be happy
Till I make you happy too.",I Want to Be Happy',2011
Stan Getz,"Don't worry 'bout me
I'll get along
Forget about me
Just be happy my love

Let's say that our little show is over
And so the story ends
Why not call it a day the sensible way
And still be friends

Look out for yourself
That should be the rule
Give your heart and your love
To whomever you love
Darlin' don't be a fool

Why do we cling to this old faded thing
That used to be
So if you can forget
Then don't worry 'bout me

Why should we cling to some old faded thing
That used to be
So if you can forget
Then you don't worry 'bout me",Don't Worry About Me,2012
Stan Getz,"Love me or leave me and let me be lonely
You won't believe me that I love you only
I'd rather be lonely than happy with somebody else

You might find the night time the right time for kissing
But night time is my time for just reminiscing
Regretting instead of forgetting with somebody else
There'll be no else unless that someone is you, you, you

I intend to be independently blue
I want your love but I don't want to borrow
I have it today and give back tomorrow
For my love is your love but there's no love for nobody else",Love Me or Leave Me,2013
Stan Getz,"Vai minha tristeza
E diz a ela
Que sem ela nÃ£o pode ser
Diz-lhe numa prece que ela regresse
Porque eu nÃ£o posso mais sofrer
Chega de saudade, a realidade Ã© que sem ela

NÃ£o hÃ¡ paz, nÃ£o hÃ¡ beleza, Ã© sÃ³ tristeza
E a melancolia que nÃ£o sai de mim
NÃ£o sai de mim, nÃ£o sai
Mas se ela voltar, se ela voltar
Que coisa linda, que coisa louca
Pois hÃ¡ menos peixinhos a nadar no mar
Do que os beijinhos que eu darei na sua boca

Dentro dos meus braÃ§os os abraÃ§os hÃ£o de ser milhÃµes de abraÃ§os
Apertado assim, colado assim, calado assim
AbraÃ§os e beijinhos e carinhos sem ter fim
Que Ã© pra acabar com esse negÃ³cio de viver longe de mim
NÃ£o quero mais esse negÃ³cio de vocÃª viver assim
Vamos deixar desse negÃ³cio de vocÃª viver sem mim
NÃ£o quero mais esse negÃ³cio de vocÃª viver assim",Chega de Saudade,2016
Stan Getz,"Morena boca de ouro que me faz sofrer
O teu jeitinho Ã© que me mata
Roda morena, vai nÃ£o vai
Ginga morena, cai nÃ£o cai

Samba, morena ele desacata
Morena uma brasa viva pronta pra queimar
Queimando a gente sem clemÃªncia
Roda morena, vai nÃ£o vai
Ginga morena, cai nÃ£o cai

Samba morena, com malemolÃªncia
Meu coraÃ§Ã£o Ã© um pandeiro
Gingando ao compasso de um samba feiticeiro
Samba que mexe com a gente
Samba que zomba da gente

O amor Ã© um samba tÃ£o diferente
Morena samba no terreiro
Pisando vaidosa, sestrosa
Meu coraÃ§Ã£o, morena, tem pena
De mais um sofredor que se queimou
Na brasa viva do teu amor",Morena Boca de Ouro,2016
Stan Getz,"Quem acreditou
No amor, no sorriso, na flor
EntÃ£o sonhou, sonhou
E perdeu a paz
O amor, o sorriso e a flor
Se transformam depressa demais
Quem, no coraÃ§Ã£o
Abrigou a tristeza de ver
Tudo isto se perder

E, na solidÃ£o
Procurou um caminho e seguiu
JÃ¡ descrente de um dia feliz
Quem chorou, chorou
E tanto que o seu pranto jÃ¡ secou
Quem depois voltou
Ao amor, ao sorriso e Ã  flor
EntÃ£o tudo encontrou
Pois a prÃ³pria dor
Revelou o caminho do amor
E a tristeza acabou",Meditacao [Live],2017
Stan Getz All Stars,"My love must be a kind of blind love
I can't see anyone but you
Sha bop sha bop

Are the stars out tonight
I don't know if it's cloudy or bright
I only have eyes for you dear

The moon may be high
But I can't see a thing in the sky
I only have eyes for you

I don't know if we're in a garden
Or on a crowded avenue

You are here and so am I
Maybe millions of people go by
But they all disappear from view
And I only have eyes for you",I Only Have Eyes for You,2007
Stan Getz All Stars,"Never thought I'd fall,
But now I hear love call,
I'm getting sentimental over you

Things you say and do,
Just thrill me through and through,
I'm getting sentimental over you.

I thought I was happy,
I could live without love
Now I must admit,
Love is all I'm thinking of

Won't you please be kind,
And just make up your mind
That you'll be sweet & gentle,
Be gentle with me
Because I'm sentimental over you
",I'm Getting Sentimental Over You,2007
Stan Getz All Stars,"If you hear
A song in blue
Like a flower crying
For the dew
That was my heart serenading you
My prelude to a kiss

If you hear a song that grows
From my tender sentimental woes
That was my heart trying to compose
A prelude to a kiss

Though it's just a simple melody
With nothing fancy
Nothing much
You could turn it to a symphony
A Shubert tune with a Gershwin touch

Oh how my love song gently cries
For the tenderness within your eyes
My love is a prelude that never dies
A prelude to a kiss

Though it's just a simple melody
With nothing fancy
Nothing much
You could turn it to a symphony
A Shubert tune with a Gershwin touch

Oh how my love song so gently cries
For the tenderness within your eyes
My love is a prelude that never dies
A prelude to a kiss",Prelude to a Kiss,2007
Stan Getz Quartet,"I'd like to get away, Junior
Somewhere alone with you
It could be oh, so gay, Junior
You need a laugh
Or two

A certain place I know, Frankie
Where funny people can have fun
That's where the two will go,
Darling

Before you can count up
One, two, three. 
For there's a small hotel
With a wishing well

I wish that we were there together
There's a bridal suite
One room bright and neat
Complete for us to
Share together

Looking through the window
You can see a distant steeple
Not a sign of people who
Wants people?
When the steeple bell says,
""Good night, sleep well,""
We'll thank the small hotel
Together

We'll creep into our little shell
And we will thank the small hotel together",There's a Small Hotel,
Stan Getz Quartet,"You're just too marvelous, too marvelous for words
Like glorious, glamorous and that old standby amorous
It's all too wonderful, I'll never find the words
That say enough, tell enough, I mean they just aren't swell enough

You're much too much and just too very, very
To ever be in Webster's Dictionary
And so I'm borrowing a love song from the birds
To tell you that you're marvelous, too marvelous for words

You're much, you're too much and just too very, very
To ever be, to ever be in Webster's Dictionary
And so I'm borrowing a love song from the birds
To tell you that you're marvelous, tell you that you're marvelous
Tell you that you're marvelous, too marvelous for words",Too Marvelous for Words,1950
Stan Getz Quartet,"What's new?
How is the world treating you?
You haven't changed a bit
Handsome as ever I must admit

What's new?
How did that romance come through?
We haven't met since then
Gee, but it's nice to see you again

What's new?
Probably I'm boring you
But seeing you is grand
And you were sweet to offer your hand
I understand

Adieu
Pardon my asking what's new
Of course you couldn't know
I haven't changed
I still love you so

Adieu
Pardon my asking what's new
Of course you couldn't know
I haven't changed
I still love you so",What's New?,1950
