Band,Lyrics,Song,Year
Oscar Peterson,"Comes a rainstorm, put your rubbers on your feet
Comes a snowstorm, you can get a little heat
Comes love, nothing can be done

Comes a fire, then you know just what to do
Blow a tire, you can buy another shoe
Comes love, nothing can be done

Don't try hiding, cause there isn't any use
You'll start sliding, when your heart turns on the juice

Comes a headache, you can lose it in a day
Comes a toothache, see your dentist right away
Comes love, nothing can be done

Comes a heatwave, you can hurry to the shore
Comes a summons, you can hide behind the door
Comes love, nothing can be done

Comes the measles, you can quarantine a room
Comes a mousy, you can chase it with a broom
Comes love, nothing can be done

That's all, brother, if you ever been in love
That's all, brother, you know what I'm speaking of

Comes a nightmare, you can always stay awake
Comes depression, you may get another break
Comes love, nothing can be done
Comes love, nothing can be done
Comes love, nothing can be done

Comes love
Comes love
Comes love
Comes love
(fade)",Comes Love,1998
Oscar Peterson,"April skies are in your eyes
But, darling, don't be blue

Don't cry
Oh, honey, please
Don't be that way

Clouds in the sky
Should never make you feel that way

The rain
Will bring the violets of May
Tears are in vain so, honey, please, don't be that way

As long as we
See it through
You'll have me
I'll have you

Sweetheart
Tomorrow is another day
Don't break my heart
Oh, honey, please, don't be that way

Don't cry
Oh, honey, please
Don't be that way

Clouds in the skies
Should never make you feel that way

The rain
Will bring the violets of May
Tears in vain
So, honey, please, don't be that way

As long as we
Will see it through
You'll have me
And I'll have you

Sweetheart
Tomorrow is another day
Don't break my heart
Oh, honey, please don't be that way

Don't cry
Don't cry, don't cry
Oh, honey, please, don't be that way
Oh, honey, please, don't be that way
Clouds in the sky
Dig those crazy sky
Should never make you feel that way
So don't be that way
Dig the rain
Pitter, pitter, pitter, pitter-patter
Bring the violets of may
Pitter-patter of rain drops
Tears in vain
Tears, tears
So, honey, please don't be that way
Don't be that way

As long as we
Will see it through
Oh, baby, you'll have me
And I'll have you
Sweetheart

Tomorrow is another day
Tomorrow is another day
Don't break my heart

Oh, honey, please, don't be that way
Looky here, baby, don't cry
Oh, honey, please, don't be that way
Clouds in the sky

Should never make you feel that way
Yeah, don't cry
Honey, please, don't be that way

Clouds in the sky
Oh, honey, please, don't be that way
No, I'll never be that way",Don't Be That Way,1998
Oscar Peterson,"Chicago, Chicago, that toddlin' town
Chicago, Chicago, I will show you around
I love it
Bet your bottom dollar you'll lose the blues
In Chicago, Chicago
The town that Billy Sunday couldn't shut down
On State Street that great street I just want to say
They do things they don't do on Broadway
They have a time, the time of their life
I saw a man, he danced with his wife
In Chicago, Chicago my hometown
Chicago, Chicago, that toddlin' town
Chicago, Chicago, I'll show you around
I love it
Bet your bottom dollar you'll lose the blues
In Chicago, Chicago
The town that Billy Sunday couldn't shut down
On State Street that great street I just want to say
They do things that they don't do on Broadway
They have the time the time of their life
I saw a man and he danced with his wife
In Chicago
Chicago
Chicago, that's my hometown",Chicago,1998
Oscar Peterson,"Every day seems like a year
Sweetheart, when you are not near
All that you claim must be true
For I'm just the same as you

[Chorus]
Sometimes I'm happy, sometimes I'm blue
My disposition depends on you
I never mind the rain from the skies
If I can find the sun in your eyes
Sometimes I love you, sometimes I hate you
But when I hate you, it's 'cause I love you
That's how I am, so what can I do?
I'm happy when I'm with you

Stars are smiling at me from your eyes
Sunbeams now there will be in the skies
Tell me that you will be true
That will all depend on you

[Chorus]",Sometimes I'm Happy,1998
Oscar Peterson,"I must confess what you say is true
I had a rendezvous with somebody new
That's the only one I ever had
Baby, baby, don'cha go away mad

Cheatin' shows and it never goes
You got a reason to be mad I suppose
But she only was a passin' fad
Baby, don't you be mad

Her kind's a dime a dozen
And that's not the kind I want
Who'd ever dream your cousin
Would wander into that restaurant?

I understand that you feel upset
What do you say that you forgive and forget?
Come on and kiss me just to show you're glad
Baby, baby, don'cha go away mad

Now, her kind's a dime a dozen
I should've passed her by
Who'd ever dream your cousin
Would come along and give us the eye?

I understand that you feel upset
What do you say that you forgive and forget?
Come on and kiss me just to show you're glad
Baby, don'cha go away mad

Understand that you're quite upset
What do you say that you forgive and forget?
Come on and kiss me just to show you're glad
Baby, baby, baby, baby, baby, baby, baby
Baby, baby, baby, don'cha go 'way mad
Now, don'cha go away mad",Don'cha Go 'Way Mad,1999
Oscar Peterson,"Hurray, hallelujah
Hurray, hallelujah
And I hope you're satisfied, you rascal you

So you met someone who set you back on your heels, goody goody
You met someone and now you know how it feels, goody goody
You gave her your heart too, just as I gave mine to you
And she broke it in little pieces; now how do you do?

So you lie awake just singin' the blues all night, goody goody
You think that love's a barrel of dynamite
Hurray and hallelujah, you had it comin' to ya
Goody goody for her, goody goody for me
And I hope you're satisfied, you rascal you

You gave her your heart too, just as I gave mine to you
And she stuck it in her collection, section ninety-two
So you lie awake just singin' the blues all night, goody goody

You think that love's a barrel of dynamite
Hurray and hallelujah, you had it comin' to ya
Goody goody for her, goody goody for me
And I hope you're satisfied, you rascal you",Goody Goody,1999
Oscar Peterson,"Your lips were like a red and ruby chalice, warmer than the summer night
The clouds were like an alabaster palace rising to a snowy height.
Each star it's own aurora borealis, suddenly you held me tight,
I could see the midnight sun.

I can't explain the silver rain that found me--or was that a moonlight veil?
The music of the universe around me, or was that a nightingale?
And then your arms miraculously found me,suddenly the sky turned pale,
I could see the midnight sun.

Was there such a night, it's a thrill i still don't quite believe,
But after you were gone, there was still some stardust on my sleeve.

The flame of it may dwindle to an ember, and the stars forget to shine,
And we may see the meadow in december, icy white and crystalline.
But oh my darling always i'll remember when your lips were close to mine,
And we saw the midnight sun.",Midnight Sun,1999
Oscar Peterson,"This can't be love
Because I feel so well
No sobs, no sorrows, no sighs
This can't be love

I get no dizzy spells
My head is not in the skies
My heart does not stand still
Just hear it beat

This is too sweet to be love
This can't be love
Because I feel so well

I love to look in your eyes
I love to look in your eyes
This can't be love
Because I feel so well

No sobs, no sorrows, no sighs
This can't be love
I get no dizzy spells

My head is not in the skies
My heart does not stand still
Just hear it beat
This is too sweet to be love

This can't be love
Because I feel so well
I love to look in your eyes
I love to look in your eyes",This Can't Be Love,1999
Oscar Peterson,"You're bound to fall for the bugle call;
You're gonna brag 'bout the Bugle Call Rag.
Thin or fat, young or old;
Shake their shoulders bold.
You're bound to fall for the bugle call;
You're gonna brag 'bout the Bugle Call Rag.
Hold me baby; Let's syncopate to that blue melody;
Just hesitate while a break they take Shh!
While we're dancing please hold me tight; step lively don't lag.
 

",Bugle Call Rag,1999
Oscar Peterson,"Everybody look at me, 
Happy girlie, you will see, 
I've got someone nice, oh, gee! 
Oh, joy, what bliss! 

Just the treasure that I need, 
Pure as gold and guaranteed, 
Is he handsome? Yes, indeed! 
Let me tell you this: 

I found a new baby, 
A sweet honey boy, 
My fashion-plate baby 
Has thrilled me with joy! 

His new way of lovin' 
Has made me his slave, 
His sweet turtle dovin' 
Is all that I crave! 

Sweetest kiss, what a kiss, full of bliss, can't resist, somehow! 
Tells me lies, but he's wise, naughty eyes mesmerize, I vow and how! 

I don't mean maybe, 
I just had to fall, 
I found a new baby, 
A new baby, that's all! 

I found a new baby, 
A sweet honey boy, 
My fashion-plate baby 
Has thrilled me with joy! 

His new way of lovin' 
Has made me his slave, 
His sweet turtle dovin' 
Is all that I crave! 

Sweetest kiss, what a kiss, full of bliss, can't resist, somehow! 
Tells me lies, but he's wise, naughty eyes mesmerize, I vow and how! 

I don't mean maybe, 
I just had to fall, 
I found a new baby, 
A new baby, that's all!",I've Found A New Baby,1999
Oscar Peterson,"I'm blue every Monday
Thinking only of Sunday
That's one day when I'm with you
It seems I sigh all day Tuesday
I cry all day Wednesday
Oh my how I long for you
And then comes Thursday, gee it's long it never goes by
Friday makes me feel like I'm gonna die
But after payday it's my fun day
I shine all day Sunday
That's one day when I'm with you
Want to see you next Sunday!",Sunday,1999
Oscar Peterson,"Love is funny or it's sad, 
Or it's quiet or it's mad;
It's a good thing or it's bad,
But beautiful!

Beautiful to take a chance
And if you fall, you fall,
And I'm thinking I wouldn't mind at all.
Love is tearful or it's gay.
It's a problem or it's play,
It's a heartache either way,
But beautiful!

And I'm thinking if you were mine
I'd never let you go,
And that would be but beautiful I know.",But Beautiful,1999
Oscar Peterson,"I was a stranger in the city
Out of town were the people I knew
I had that feeling of self-pity
What to do, what to do, what to do
The outlook was decidedly blue

But as I walked through the foggy streets alone
It turned out to be the luckiest day I've known

A foggy day, in London town
Had me low, had me down
I viewed the morning, with much alarm
British Museum, had lost its charm

How long I wondered,
Could this thing last
But the age of miracles, hadn't past
For suddenly, I saw you there
And through foggy London town,
The sun was shining everywhere

For suddenly, I saw you there
And through foggy London town,
The sun was shining everywhere

Everywhere
Everywhere
Everywhere","A Foggy Day, Pt. 1",1999
Oscar Peterson,"I was a stranger in the city
Out of town were the people I knew
I had that feeling of self-pity
What to do, what to do, what to do
The outlook was decidedly blue

But as I walked through the foggy streets alone
It turned out to be the luckiest day I've known

A foggy day, in London town
Had me low, had me down
I viewed the morning, with much alarm
British Museum, had lost its charm

How long I wondered,
Could this thing last
But the age of miracles, hadn't past
For suddenly, I saw you there
And through foggy London town,
The sun was shining everywhere

For suddenly, I saw you there
And through foggy London town,
The sun was shining everywhere

Everywhere
Everywhere
Everywhere","A Foggy Day, Pt. 2",1999
Oscar Peterson,"Old black magic has me in its spell
Old black magic that you weave so well 
Those icy fingers up and down my spine
The same old witch craft when your eyes meet mine
Same old tingle that I feel inside
Then the elevator starts it ride

Down and down I go
Round and round I go
Like a leaf caught in a tide
I should stay away but what can I do 
I hear your name and I'm a flame

Flame, flame of desire 
Only your kiss can put out the fire 
Oh you're the lover I have waiting for 
Your the mate that fate had me created for 
And every time your lips meet mine

Down and down I go 
Round and round I go 
In a spin, lovin' the spin I'm in 
Under the old black magic called love
In a spin lovin' the spin I'm in 
Under the old black magic called love
In a spin lovin' the spin I'm in 
Under the old black magic called love
I should stay away but what can I do 
I hear your name and I'm a flame

Flame, flame of desire 
Only your kiss can put out the fire 
Oh you are the lover I have waited for
Your the mate that fate had me created for 
And every time your lips meet mine

Down and down I go 
Round and round I go 
In a spin, lovin' the spin I'm in 
Under the old black magic called love","That Old Black Magic, Pt. 1",1999
Oscar Peterson,"Old black magic has me in its spell
Old black magic that you weave so well 
Those icy fingers up and down my spine
The same old witch craft when your eyes meet mine
Same old tingle that I feel inside
Then the elevator starts it ride

Down and down I go
Round and round I go
Like a leaf caught in a tide
I should stay away but what can I do 
I hear your name and I'm a flame

Flame, flame of desire 
Only your kiss can put out the fire 
Oh you're the lover I have waiting for 
Your the mate that fate had me created for 
And every time your lips meet mine

Down and down I go 
Round and round I go 
In a spin, lovin' the spin I'm in 
Under the old black magic called love
In a spin lovin' the spin I'm in 
Under the old black magic called love
In a spin lovin' the spin I'm in 
Under the old black magic called love
I should stay away but what can I do 
I hear your name and I'm a flame

Flame, flame of desire 
Only your kiss can put out the fire 
Oh you are the lover I have waited for
Your the mate that fate had me created for 
And every time your lips meet mine

Down and down I go 
Round and round I go 
In a spin, lovin' the spin I'm in 
Under the old black magic called love","That Old Black Magic, Pt. 2",1999
Oscar Peterson,"Did you say that I've got a lot to learn?
Well, don't think I'm trying not to learn 
Since this is the perfect spot to learn 
Teach me tonight 

Starting with the A-B-C of it 
Getting right down to the X-Y-Z of it 
Help me solve the mystery of it 
Teach me tonight 

The sky's a blackboard high above you 
And if a shooting star goes by 
I'll use that star to write ""I love you"" 
A thousand times across the sky 

One thing isn't very clear, my love 
Teachers shouldn't stand so near, my love 
Graduation's almost here, my love 
You'd better teach me tonight 

I've played loves scenes in a flick or two 
And I've also met a chick or two 
But I still can learn a trick or two 
Hey, teach me tonight 

I who thought I knew the score of it 
Kind of think I should know much more of it 
Off the wall, the bed, the floor of it 
Hey, teach me tonight 

The midnight hours come slowly creeping 
When there's no one there but you 
There must be more to life than sleeping 
Single in a bed for two 

What I need most is post graduate 
What I feel is hard to articulate 
If you want me to matriculate 
You'd better teach me tonight 

What do you get for lessons?
Teach me
Come on and teach me
Teach me tonight",Teach Me Tonight,1999
Oscar Peterson,"We might have been meant for each other
To be or not to be, let our hearts discover

I have a feeling, it's a feeling I'm concealing - I don't know why
It's just a mental, incidental, sentimental alibi
But I adore you, so strong for you
Why go on stalling? I am falling; love is calling; why be shy?

Let's fall in love
Why shouldn't we fall in love?
Our hearts are made of it; let's take a chance
Why be afraid of it?

Let's close our eyes
And make our own paradise
Little we know of it; still we can try
To make a go of it

We might have been meant for each other
To be or not to be; let our hearts discover

Let's fall in love
Why shouldn't we fall in love?
Now is the time for it, while we are young
Let's fall in love",Let's Fall in Love [#],1999
Oscar Peterson,"A buzzard took the monkey for a ride in the air
The monkey thought that ev'rything was on the square
The buzzard tried to throw the monkey off his back
But the monkey grabbed his neck and said, ""now, listen, jack

Straighten up and fly right, straighten up and fly right
Straighten up and fly right, cool down papa, don't you blow your top
Ain't no use in divin'
What's the use of divin'? 
Straighten up and fly right, cool down papa, don't you blow your top""

The buzzard told the monkey, you're choking me
Release your hold and I'll set you free
The monkey looked the buzzard right dead in the eye and said
Your story's touching, but is sounds like a lie

Straighten up and fly right, straighten up and stay right
Straighten up and fly right, cool down papa, don't you blow your top

The buzzard told the monkey, you're choking me
Release your hold and I'll set you free
The monkey looked the buzzard right dead in the eye and said
Your story's touching, but is sounds like a lie

Straighten up and fly right, straighten up and stay right
Straighten up and fly right, cool down papa, don't you blow your top

Straighten up and fly right, straighten up and stay right
Straighten up and fly right, cool down papa, don't you blow your top",Straighten up and Fly Right,2000
Oscar Peterson,"Why can't you behave?
Oh, why can't you behave?
After all the things you told me,
And the promises that you gave,
Oh, why can't you behave?

Why, why, why can't you be good?

I was faithful and true but what good will it do

And do, do just as you should?

Yes you had the right touch but I was askin' too much
Won't you turn that new leaf over,
So your baby can be your slave?
Oh, why can't you behave?

There's a farm I know near my old home town,
Where we two can go and try settling down.
There I'll care for you forever,
'Cause you're all in this world I crave.
Oh, why can't you behave?
Why can't you behave?",Why Can't You Behave,2000
Oscar Peterson,"Night and stars above that shine so bright 
The myst'ry of their fading light 
That shines upon our caravan 
 
Sleep upon my shoulder as we creep 
Across the sand so I may keep 
The mem'ry of our caravan 
 
This is so exciting 
You are so inviting 
Resting in my arms 
As I thrill to the magic charms 
Of you beside me here beneath the blue 
My dream of love is coming true 
Within our desert caravan",On a Clear Day You Can See Forever,
Oscar Peterson,"Young and foolish
Why is it wrong to be
Young and foolish
We haven't long to be

Soon enough the carefree days
The sunlit days go by
Soon enough the bluebird has to fly

We were foolish
One day we fell in love
Now we wonder
What were we dreaming of

Smiling in the sunlight
Laughing in the rain
I wish that we were
Young and foolish again

Smiling in the sunlight
Laughing in the rain
I wish that we were
Young and foolish again",Young and Foolish,2000
Oscar Peterson,"When it happened, Something Snapped inside me
Made me wanna hide
All on my own, all on my own
I stood up on the stand my eyes shut tight

Didn't wanna see anybody
Feeling alright, having a good time heh
Doing alright, doing alright
Doing alright, doing alright

I saw into the dancing crowd
Felt like screaming out loud
I saw you standing there
Saw your long, your long hair yeah

Opened up my eyes baby
You made me realize what I wanna do now
I wanna do now babe, looking at you
Looking at you babe, looking at you
Looking at you, looking at you baby

You baby (x6)

Yeah yeah

(repeat verse 2) (with 9 extra ""you baby"" s)",Looking at You,2001
Oscar Peterson,"Thou swell, thou witty
Thou sweet, thou grand
Wouldst kiss me pretty
Wouldst hold my hand

Both thine eyes are cute too
What they do to me?
Hear me holler I choose
A sweet lollapaloosa in thee

I'd feel so rich
In a hut for two
Two rooms and kitchen
I'm sure would do

Give me just a plot of
Not a lot of land
And thou swell, thou witty
Thou grand

Thou swell, thou witty
Thou sweet, thou grand
Wouldst kiss me pretty
Wouldst hold my hand

Both thine eyes are cute too
What they do to me?
Hear me holler I choose
A sweet lollapaloosa in thee

I'd feel so rich
In a hut for two
Two rooms and kitchen
I'm sure would do

Give me just a plot of
Not a lot of land
And thou swell, thou witty
Thou grand",Thou Swell,2001
Oscar Peterson,"Maybe I can't live to love you as long as I want to.
Life isn't long enough baby, but I can love you as long as I live.

Maybe I can't give you diamonds and things like I want to,
But I can promise you, baby, I'm gonna want to as long as I live.

I never cared, but now I'm scared, I won't live long enough.
That's why I wear my rubbers when it rains and eat an apple every day then see
the doctor anyway.

What if I can't live to love you as long as I want to.
Long as I promise you, baby, I'm gonna love you as long I live.

I'll even wear long underwear, when winter breezes blow
I'm gonna take good care of me because, a sneeze or two might mean the flu,
And that would never never do

What if I can't live to love you as long as I want to.
Long as I promise you, baby, I'm gonna love you as long I live.",As Long as I Live,2001
Oscar Peterson,"My mama done tol' me
When I was in pigtails
My mama done tol' me
A man's gonna sweet-talk and give you the big eyes
But when the sweet-talking's done
A man is a two-face, a worrisome thing 
Who'll leave you to sing the blues in the night

Now the rain's a-fallin'
Hear the train a-callin, ""whoo-ee!""
My mama done tol' me
Hear that lonesome whistle blowin' 'cross the trestle, ""whoo-ee!""
My mama done tol' me
A-whooee-ah-whooee ol' clickety-clack's
A-echoin' back the blues in the night

The evenin' breeze'll start the trees to cryin'
And the moon'll hide it's light
When you get the blues in the night
Take my word, the mockingbird'll sing the saddest kind of song
He knows things are wrong, and he's right

From Natchez to mobile
From Memphis to St. Joe
Wherever the four winds blow
I been in some big towns
And heard me some big talk
But there is one thing I know
A man's a two-face, a worrisome thing
Who'll leave you to sing the blues in the night

The evenin' breeze'll start the trees to cryin'
And the moon'll hide it's light
When you get the blues in the night
Take my word, the mockingbird'll sing the saddest kind of song
He knows things are wrong, and he's right

From Natchez to mobile
From Memphis to St. Joe
Wherever the four winds blow
I been in some big towns
And heard me some big talk
But there is one thing I know
A man's a two-face, a worrisome thing
Who'll leave ya to sing the blues in the night
Yes, the lonely, lonely blues in the night",Blues in the Night,2001
Oscar Peterson,"The moon was all aglow
But heaven was in your eyes
The night that you told me
Those little white lies

The stars all seemed to know
You didn't mean all those sighs
The night that you told me
Those little white lies

I try, but there's no forgetting
When evenin' appears
I sigh but there's no regretting
In spite of my tears

Who wouldn't believe those lips
Who wouldn't believe those eyes
The night that you told me
Those little white lies

I try, but there's no forgetting
When evenin' appears
I sigh but there's no regretting
In spite of my tears

The Devil was in your heart
But Heaven was in your eyes
The night that you told me
Those little white lies
Those lies
Teeny-weeny little white lies",Little White Lies,2002
Oscar Peterson,"The sky was blue
And high above
The moon was new
And so was love
This eager heart of mine was singing
Lover where can you be
You came at last
Love had its day
That day is past
You've gone away
This aching heart of mine is singing
Lover come back to me

When I remember every little thing
You used to do
I'm so lonely
Every road I walk along
I walk along with you
No wonder I am lonely
The sky is blue
The night is cold
The moon is new
But love is old
And while I'm waiting here
This heart of mine is singing
Lover come back to me

When I remember every little thing
You used to do
I grow lonely
Every road I walk along
I walk along with you
No wonder I am lonely
The sky is blue
The night is cold
The moon is new
But love is old
And while I'm waiting here
This heart of mine is singing
Lover come back to me",Lover Come Back to Me,2002
