Band,Lyrics,Song,Year
Elaine Paige,"Long ago
In someone else's lifetime
Someone with my name
Who looked a lot like me
Came to know
A girl and made a promise
She only had to say
And that's where she would be
Lately
Although the feelings run just as deep
The promise she made has grown impossible to keep
And yet I wish it wasn't so
Will she miss me if I go?

In a way
It's someone else's story
I don't see myself
As taking part at all
Yesterday
A girl that I was fond of
Finally could see
The writing on the wall
Sadly
She realized she'd left him behind
And sadder than that she knew he wouldn't even mind
And though there's nothing left to say
Would she listen if I stay?

It's all very well to say you fool it's now or never
I could be choosing
No choices whatsoever.

I could be
In someone else's story
In someone else's life
And she could be in mine
I don't see
A reason to be lonely
I could take my chances
Further down the line
And if
That boy I knew should ask my advice
Oh I wouldn't hesitate he needn't ask me twice
Go now!
I'd tell him that for free
Trouble is, the boy is me
The story is, the boy is me.",Someone Else's Story [From Chess],2006
Elaine Paige,"Where do we go from here?
This isn't where we intended to be
We had it all, you believed in me
I believed in you

Certainties disappear
What do we do for our dream to survive?
How do we keep all our passions alive, 
As we used to do?

Deep in my heart I'm concealing
Things that I'm longing to say

Scared to confess what I'm feeling
Frightened you'll slip away

You must love me
You must love me

Why are you at my side?
How can I be any use to you now?
Give me a chance and I'll let you see how
Nothing has changed

Deep in my heart I'm concealing
Things that I'm longing to say

Scared to confess what I'm feeling
Frightened you'll slip away

You must love me
You must love me

Why are you at my side?
How can I be any use to you now?
Give me a chance and I'll let you see how
Nothing has changed

You must love me",You Must Love Me [From Evita],2006
Elaine Paige,"There again I've more to do
Than simply get the message through
I haven't started
Let's get this show on the road
Let's make it obvious
Peron is off and rolling

Eyes, hair, mouth, figure
Dress, voice, style, movement
Hands, magic, rings, glamour
Face, diamonds, excitement, image

I came from the people, they need to adore me
So Christian Dior me from my head to my toes
I need to be dazzling, I want to be rainbow high
They must have excitement, and so must I

Eyes, hair, mouth, figure
Dress, voice, style, image

I'm their product, it's vital you sell me
So machiavell me, make an argentine rose
I need to be thrilling, I want to be rainbow high
They need their escape, and so do I

Eyes, hair, mouth, figure
Dress, voice, style, movement
Hands, magic, rings, glamour
Face, diamonds, excitement, image

All my descamisados expect me to outshine the enemy
I won't disappoint them
I'm their savior, that's what they call me
So Lauren Bacall me, anything goes
To make me fantastic, I have to be rainbow high
In magical colors

You're not decorating a girl for a night on the town
And I'm not a second-rate queen getting kicks with a crown

Next stop will be Europe
The rainbow's gonna tour, dressed up, somewhere to go
We'll put on a show

Look out, mighty Europe
Because you oughta know whatcha gonna get in me
Just a little touch of
Just a little touch of
Argentina's brand of star quality","Rainbow High, song (for the musical Evita)",2006
Elaine Paige,"She's out of my life
She's out of my life
And I don't know whether to laugh or cry
I don't know whether to live or die
And it cuts like a knife
She's out of my life

It's out of my hands
It's out of my hands
To think for two years she was here
And I took her for granted I was so cavalier
Now the way that it stands
She's out of my hands

So I've learned that love's not possession
And I've learned that love won't wait
Now I've learned that love needs expression
But I learned too late

And she's out of my life
She's out of my life
Damned indecision and cursed pride
Kept my love for her locked deep inside
And it cuts like a knife
She's out of my life",He's Out of My Life,2007
Elaine Paige,"We said we'd try again
But trying's not enough
Acting like strangers
Ain't no way of making love
It's never gonna work
It's time we stop pretending
It's time to turn the page
All stories need an ending

It makes no sense to stay
Livin' my life in yesterday
I'm leaving, I'm leaving
And I'm begging you

Heart, don't change my mind
Oh, heart be strong this time and try
To help me tell him goodbye
It'll only bring pain for us to stay
Oh, heart it's hard for you I know
Let me, let him go

Don't let me think about
How good it was before
I know you'd try anything
To keep me from that door
It's hard to leave him
When you've loved him for so long now
How can I walk away
If you're still holding on now?

I've finally found the strength
Look at me, I can finally say
It's over, it's over
So, I'm begging you

Heart, don't change my mind
Oh, heart be strong this time and try
To help me tell him goodbye
It'll only bring pain for us to stay
Oh, heart it's hard for you I know
Let me, let him go

It makes no sense to stay
Sad that it has to end this way
It's over, it's over

Heart, don't change my mind
Oh, heart be strong this time and try
To help me tell him goodbye
It'll only bring pain for us to stay
Oh, heart it's hard for you I know
Let me, let him go

Heart, don't change my mind
Oh, heart it's hard for you I know
Let me, let him go
Let me, let him go",Heart Don't Change My Mind,2007
Elaine Paige,"Nothing is so good it lasts eternally,
Perfect situations must go wrong,
But this has never yet prevented me,
Wanting far too much,
For far too long,

Looking back,
I could have played it differently,
Won a few more moments,
Who can tell,
But it took time to understand the man,
Now at least I know
I know him well

Wasn't it good?
(Oh so good)
Wasn't he fine?
(Oh so fine)
Isn't it madness,
He can't be mine?
But in the end
He needs a little bit
More than me,
More security,
He needs his fantasy and freedom,
I know him so well

No-one in your life is with you constantly,
No-one is completely on your side,
And though I'd move my world to be with him,
Still the gap between us is too wide,

Looking back,
(Looking back)
I could have played it differently,
(I could have played it some other way),
Learned about the man,
Before I fell
(I was just a little careless)
But I was ever so much younger then,
(Maybe, so much younger then)
Now at least I know
I know him well

Wasn't it good?
(Oh so good)
Wasn't he fine?
(Oh so fine)
Isn't it madness,
He won't be mine?

Didn't I know?
How it would go,
If I knew from the start,
Why am I falling apart?

Wasn't it good
Wasn't he fine?
Isn't it madness,
He won't be mine?

But in the end,
He needs a little bit
More than me,
More security,
He needs his fantasy and freedom,
I know him so well,
It took time to understand him,

I know him so well.",I Know Him So Well [Live],2007
Elaine Paige,"I don't know how to love him
What to do, how to move him
I've been changed, yes really changed
In these past few days, when I've seen myself
I seem like someone else

I don't know how to take this
I don't see why he moves me
He's a man. He's just a man
And I've had so many men before
In very many ways
He's just one more

Should I bring him down?
Should I scream and shout?
Should I speak of love
Let my feelings out?
I never thought I'd come to this
What's it all about?

Don't you think it's rather funny
I should be in this position
I'm the one who's always been
So calm, so cool, no lover's fool
Running every show
He scares me so

I never thought I'd come to this
What's it all about?
Yet, if he said he loved me
I'd be lost. I'd be frightened
I couldn't cope, just couldn't cope

I'd turn my head, I'd back away
I wouldn't want to know
He scares me so
I want him so

I love him so","One Night Only [From ""Dream Girls""]",2014
Elaine Paige,"(Eva:)
There again I've more to do
Than simply get the message through
I haven't started
Let's get this show on the road
Let's make it obvious
Peron is off and rolling

[Chorus:]
(Eva's dressers:)
Eyes, hair, mouth, figure
Dress, voice, style, movement
Hands, magic, rings, glamour
Face, diamonds, excitement, image

(Eva:)
I came from the people, they need to adore me
So christian dior me from my head to my toes
I need to be dazzling, I want to be rainbow high
They must have excitement, and so must I

(Eva's dressers:)
Eyes, hair, mouth, figure
Dress, voice, style, image

(Eva:)
I'm their product, it's vital you sell me
So machiavell me, make an argentine rose
I need to be thrilling, I want to be rainbow high
They need their escape, and so do I

[Chorus]

(Eva:)
All my descamisados expect me to outshine the enemy
I won't disappoint them
I'm their savior, that's what they call me
So Lauren Bacall me, anything goes
To make me fantastic, I have to be rainbow high
In magical colors

You're not decorating a girl for a night on the town
And I'm not a second-rate queen getting kicks with a crown

Next stop will be Europe
The rainbow's gonna tour, dressed up, somewhere to go
We'll put on a show

Look out, mighty Europe
Because you oughta know whatcha gonna get in me
Just a little touch of
Just a little touch of
Argentina's brand of star quality",Rainbow High,2018
Elaine Paige & Barbara Dickson,"Nothing it so good it lasts eternally.
Perfect situations must go wrong.
But this has never yet prevented me,
Wanting far too much for far too long.

Looking back, I could have played it differently,
Learned about the man before I fell,
But it took time to understand the man,
Now at least I know I know him well.

Wasn't it good
(Oh so good)
Wasn't it fine
(Oh so fine)
Isn't it madness
He can't be mine.
But in the end he needs a little bit more than me
(More security)
He needs his fantasies and freedom
I know him so well.

No one in your life is with you constantly
No one is completely on your side,
And though I move my world to be with him,
Still the gap between him is too much.

Looking back I could have played it differently,
One or a few more who can tell,
But I was ever so much younger then,
Now at least I know I know him well.

Wasn't it good
(Oh so good)
Wasn't it fine
(Oh so fine)
Isn't it madness
He can't be mine.

Didn't I know,
How it would go from the start If I knew,
Why am I falling apart.

Wasn't it good
Wasn't it fine
Isn't it madness,
He can't be mine.
But in the end he needs a little bit more than me.
(More security)
He needs his fantasies and freedom.
I know him so well.

It took time to understand him.
I know him so well",I Know Him So Well,1999
Elaine Silver,"Ain't she sweet? See her walking down that street.
Yes I ask you very confidentially, ain't she sweet?
Ain't she nice? Look her over once or twice.
Yes I ask you very confidentially, ain't she nice?
Just cast an eye in her direction, oh me oh my, ain't that perfection?
Oh I repeat, well, don't you think that's kinda neat?
Yes I ask you very confidentially, ain't she sweet?

Ain't she sweet? See her walking down that street.
Yes I ask you very confidentially, ain't she sweet?
Ain't she nice? Look her over once or twice.
Yes I ask you very confidentially, ain't she nice?
Just cast an eye in her direction, oh me oh my, ain't that perfection?
Oh I repeat, well, don't you think that's kinda neat?
Yes I ask you very confidentially, ain't she sweet?

Oh I repeat, well, don't you think that's kinda neat?
Yes I ask you very confidentially, ain't she sweet?

Oh I repeat, well, don't you think that's kinda neat?
Yes I ask you very confidentially, ain't she sweet?",Ain't She Sweet,2006
Elaine Silver,"Oh my love for the first time in my life
My eyes are wide open
Oh my love for the first time in my life
My eyes can see

I see the wind
Oh, I see the trees
Everything is clear in my heart
I see the clouds
Oh, I see the sky
Everything is clear in our world

Oh my love for the first time in my life
My mind is wide open
Oh my lover for the first time in my life
My mind can feel

I feel the sorrow
Oh, I feel dreams
Everything is clear in my heart
I feel life
Oh, I feel love
Everything is clear in our world",Oh My Love,2006
Elaine St. George,"Give me a kiss to build on and my imagination will thrive upon that kiss
Sweetheart I ask no more than this, a kiss to build a dream on
 
Give me a kiss before you leave me and my 
Imagination will feed my hungry heart
Leave me one thing before we part, a kiss to build a dream on
When I'm alone with my fancies, I'll be with you 
Weaving romances, making believe they're true
 
Give me your lips for just a moment and my 
Imagination will make that moment live
Give me what you alone can give, a kiss to build a dream on",A Kiss to Build a Dream On,1998
Elaine St. George,"Beautiful miracle, pardon my lyrical rhapsody,
But can't you see, you've captured me.
Being so glamorous, can't you be amorous just with me?
Make it soon, take a look at the moon.

Love is just around the corner, any cozy little corner.
Love is just around the corner when I'm around you.
I'm a sentimental mourner, and I couldn't be forlorner,
When you keep me in a corner just waiting for you.
Venus de Milo was noted for her charms,
But strictly between us, you're cuter than Venus,
And what's more you got arms.
So cuddle in a corner, any cozy corner,
Love is just around the corner and I'm around you.",Love Is Just Around the Corner,1998
Elaine St. George,"You look at me and wonder, you look at me and doubt,
Darling your eyes are asking, ""Will the flame burn out?""
Well, no one is sure of sun shine, no one is sure of dawn,
But I am sure my love will live on and  on.
I'll be tired of you  when stars are tired of gleaming
When I am tired of dreaming, then I'll be tired of  you.
This I know is true, when winds are tired of blowing,
When grass is tired of growing, then I'll be tired  of you.

Beyond the years, 
'Til day is night, 'til wrong is right,
'Til birds refuse to sing,
Beyond the years, the echo of my only love 
Will still be whispering, whispering.
And if my throbbing heart should ever start repeating 
That it is tired of beating, then I'll be tired of you.",Then I'll Be Tired of You,1998
Elaine St. George,"Darling, je vous aime beaucoup
Je ne sais pas what to do
You know you`ve completely
Stolen my heart

Morning, noon and night-time too
Toujours, wondering what to do
That`s the way I`ve felt
Right from the start

Ah, Cherie!
My love for you is tr¨¨s, tr¨¨s fort
Wish my French were good enough
I`d tell you so much more

But I hope that you compree
All the things you mean to me
Darling, je vous aime beaucoup
I love you, yes I do

Wish my French were good enough
I`d tell you so much more
But I hope that you compree
All the things you mean to me

Darling, je vous aime beaucoup
I love you, yes I do
(Darling, je vous aime beaucoup)
I love you, yes I do","Darling, Je Vous Aime Beaucoup",2005
Elaine St. George,"I am not such a clever one
About the latest fads
I admit I was never one
Adored by local lads
Not that I ever try to be a saint
I'm the type that they classify as quaint
I'm old fashioned
I love the moonlight
I love the old fashioned things
The sound of rain
Upon a window pane
The starry song that April sings
This year's fancies
Are passing fancies
But sighing sighs holding hands
These my heart understands
I know I'm old fashioned
But I don't mind it
That's how I want to be
As long as you agree
To stay old fashioned with me

I'm old fashioned
But I don't mind it
That's how I want to be
As long as you agree
To stay old fashioned with me
Oh won't you stay old fashioned with me
Oh please stay old fashioned with me",I'm Old-Fashioned,2005
Elaine St. George,"Got that old fashioned love in my heart
And there it will always remain
Like an ivy clinging vine clinging closer all the time
Through these years and these tears just the same

Got that old fashioned fate in my heart
And nothing can tear us apart
Dry land may turn to sea but there'll be no change in me
Got that old fashioned love in my heart

Got that old fashioned love",Old-Fashioned Love,2005
Elaine St. George,"Everything under the sun 
Going to hell 
In an episode of SNL 
Watch it on the TV 
You ugly girl 
You can not sing 
Can't even lip sync 
Apparently money 
Can even buy you dignity 
Never wanna forget 
In a couple of days 
It doesn't matter 
What they say in the press 
I guess I'm not the only one 
Feeling the itch 
'Cause they're given away the billboard award 
To some phony little
 
So what would you know 
About how your song goes 
Just let that table roll 

So many faces 
Of so many people 
Are covered in stupid 
And all they wanna do is get in 
I know that your parents 
Are brother and sister 
It's idiot season 
So let the Hunting begin' 
Let the hunting begin 
Let the hunting begin 
Let the hunting begin 

Since practice wasn't on the list 
Clearly talent doesn't exist 
Maybe joking of buying you 
A set of bigger tits 
Apologize to the world 
And admit that you were wrong 
Who's dick you'd have to suck to 
Get the number one song 

So what would you know 
About how your song goes 
Just let that table roll 

So many faces 
Of so many people 
Are covered in stupid 
And all they wanna do is get in 
I know that your parents 
Are brother and sister 
It's idiot season 
So let the Hunting begin' 
Let the hunting begin 
Let the hunting begin 
Let the hunting begin 

Well 
Who's this little girl 
Who's got my elbow in her mouth 
To keep herself from coming out 
Said you're daddy's little girl 
Nobody knows 
What we all know 

So many faces 
Of so many people 
Are covered in stupid 
And all they wanna do is get in 
I know that your parents 
Are brother and sister 
It's idiot season 
So let the hunting begin 
I know that your parents 
Are brother and sister 
It's idiot season 
So let the hunting begin 
So many faces 
Of so many people 
Are covered in stupid 
And all they wanna do is get in 
I know that your parents 
Are brother and sister 
It's idiot season 
So let the hunting begin",So Many People,2005
Elaine St. George,"You'd be so nice to come home to
You'd be so nice by the fire
While the breeze on high sang a lullaby
You'd be all that I could desire

Under stars chilled by the winter
Under an August moon burning above
You'd be so nice, you'd be paradise
To come home to and love

Under stars chilled by the winter
Under an August moon burning above
You'd be so nice, you'd be paradise
To come home to and love",So Nice to Come Home To/Easy to Love,2005
Elaine Stepter,"This here's a tail for all the fellas
Tryin' to do what those ladies tell us
Get shot down cause ya over-zealous
Play hard to get females get jealous
Okay smarty go to a party
Girls are scantily clad and showin' body
A chick walks by you wish you could sex her
But you're standing on the wall like you was Poindexter
Next days function high class luncheon
Food is served and you're stone-cold munchin'
Music comes on people start to dance
But then you ate so much you nearly split your pants
A girl starts walking guys start gawking
Sits down next to you and starts talking
Says she wants to dance cause she likes to groove
So come on fatso and just bust a move

You're on a mission and your wishin'
Someone could cure your lonely condition
Lookin' for love in all the wrong places
No fine girls just ugly faces
From frustration first inclination
Is to become a monk and leave the situation
But every dark tunnel has a light of hope
So don't hang yourself, with a celibate rope
Your movie's showin', so you're goin'
Could care less about the five you're blowin'
Theater gets dark just to start the show
Then ya spot a fine woman sittin' in your row
She's dressed in yellow, she says ""Hello,
come sit next to me you fine fellow.""
You run over there without a second to lose
And what comes next hey bust a move

In this city ladies look pretty
Guys tell jokes so they can seem witty
Tell a funny joke just to get some play
Then you try to make a move and she says, ""No way""
Girls are fakin' goodness sakin'
They want the man who brings home the bacon
Got no money and you got no car
Then you got no women and there you are
Some girls are sadistic, materialistic
Lookin' for a man makes them opportunistic
They're lyin' on a beach perpetrating a tan
So a brother with the money can be their man
So on the beach you're strollin' real high rollin'
Everything you have is yours and not stolen
A girl runs up with somethin' to prove
So don't just stand there bust a move

Your best friend Harry has a brother Larry
In five days from now he's gonna marry
He's hopin' you can make it there if you can
Cause in the ceremony you'll be the best man
You say neat-o, check your libido
And roll to the church in your new tuxedo
The bride walks down just to start the wedding
And there's one more girl you won't be getting
So you start thinkin' then you start blinking
The bridesmaid looks and thinks that you're winking
She thinks your kinda cute so she winks back
And now your feelin' really fine cause the girl is stacked
Reception's jumpin' bass is pumpin'
You look at the girl and your heart starts thumpin'
Says she wants to dance to a different groove
Now you know what to do G bust a move",Bust a Move [The Y2K Mix],2000
Elaine Stratos,"As a tot, when I trotted in little velvet panties,
I was kissed by my sisters, my cousins, and my aunties.
Sad to tell, it was hell, an inferno worse than Dante's.

So my dear I swore,
""Never, never more !""
On my list, I insisted that kissing must be crossed out.
Now, I find I was blind, and oh my! How I lost out!

I could cry salty tears,
Where have I been all these years?
Little wow, tell me now,
How long has this been going on?

There were chills up my spine,
And some thrills I can't define.
Listen, sweet, I repeat,
How long has this been going on?

Oh, I feel that I could melt,
Into Heaven I'm hurled!
I know how Columbus felt,
Finding another world.

Kiss me once, then once more.
What a dunce I was before.
What a break! For Heaven's sake!
How long has this been going on?

Dear, when in your arms I creep,
That divine rendezvous,
Don't wake me, if I'm asleep,
Let me dream that it's true!

Kiss me twice, then once more.
That makes thrice, let's make it four!
What a break! For Heaven's sake!
How long has this been going on?
How long has this, been going on?",How Long Has This Been Going On,2008
Elaine Stratos,"You'll never get away from me
You can climb the tallest tree, I'll be there somehow
True, you could say, ""Hey, here's your hat""
But a little thing like that couldn't stop me now

I couldn't get away from you
Even if you told me to, so go on and try
Just try and you're gonna see
How you're gonna not at all get away from me

Rose, I love you, but don't count your chickens
Come dance with me
I warn you, that I'm no Boy Scout
Relax awhile, come dance with me

So don't think that I'm easy pickin', the music's so nice
Rose, 'cause I just may some day pick up and pack out
Oh, no you won't, no, not a chance
No arguments, shut up and dance

You'll never get away from me
You can climb the tallest tree, I'll be there somehow
True, you could say, ""Hey, here's your hat""
But a little thing like that couldn't stop me now

I couldn't get away from you
Even if I wanted to well, go on and try, just try
Ah, Rose and you're gonna see
Ah, Rose how you're gonna not at all
Get away from me",You'll Never Get Away from Me,2008
Elaine Stratos,"From the island of Manhattan to the coast of gold
From north to south, from east to west
You are the love, I love the best
You`re the dreamboat in the sweetest story ever told

A dream I sought, both night and day
For years through all, the U.S.A.
The star I hitched my wagon to
Is very obviously you

Of thee I sing, baby
Summer, autumn, winter, spring, baby.
You`re my silver lining,
You`re my sky of blue
There`s a lovelight shining
Just because of you.

Of thee I sing, baby,
You have got that certain thing, baby
Shining star and inspiration
Worthy of a mighty nation,
Of thee I sing.

Of thee I sing, baby,
You have got that certain thing, baby
Shining star and inspiration
Worthy of a mighty nation,
Of thee I sing.",Gershwin Medley,2008
