Band,Lyrics,Song,Year
Head Automatica,"You scream louder than fiction and get down on your knees
And tear open your heart so I can love you and your disease
Lick the hand that feeds you and kis the blade that cuts
I want to fuck you in your god's hands when you praying bites the dust

CHORUS
Please
Let me anoint the lust inside you
Please
Let me devalue what's inside you
Hollywood at night hanging around
If this is a must then dying is a must right now
Hollywood at night hanging around
If this is a must then dying is a must right now

Beg for pride, And I'l deny you
Fact or fiction? Fact or fiction?
It's a mission to survive and learn to want you
When I hate, when I hate, what's all inside

CHORUS",Please Please Please (Young Hollywood),2004
Head Automatica,"This is television, late night television, scripted with precision
A corner store pulp fiction sits where your heart isn't
And with your eyes so green, and your pinkish theme
You made an old friend seem rather dead to me
Alas, the weapon sex can be

Your body is a weapon and you're afraid it could get out
A friend of the devil and you're afraid it could get out

Don't say I don't cut when I do, I do, I do
Don't say I'm lying when I'm true, I'm true, I'm true
The razor

You rub of suspicious, so vile and aniscious, with a heart so vicious
And dare you ask what this is, this is so delicious
To eat the best of you like the others do 
We take your pride from you
The drive-in, the embassy, the jets, it's all the same to me

Your body is a weapon and you're afraid it could get out
A friend of the devil and you're afraid it could get out

Don't say I don't cut when I do, I do, I do
Don't say I'm lying when I'm true, I'm true, I'm true
The razor (the razor)
Don't say we're healing when it's just not what we do

So many suitors, I don't even have a suit to wear
So many influential fingers running through your hair
I am the razor in the hands of your heart
And I am the razor in the hands of god

Don't say I don't cut when I do, I do, I do (i do, I do)
Don't say I'm lying when I'm true, I'm true, I'm true (i do,I do)
The razor (the razor)
Don't say we're healing when it's just not what we do (the razor)[Repeat: x1]
Don't say we're healing when it's just not what we do",The Razor,2004
Head Automatica,"Look closely every moment every movement that she makes is 
What the angels do, the angels do 
I can see her crossing her perfection with deception 
Like the angels do, the angels do 

I 
See it in her eyes 
Soon enough I'll lie 
By myself 
And I 
See it in her eyes 
Soon enough I'll lie 
By myself 
And I fell in love in hell 
I fell in love in hell 
I fell in love in hell 
And it is simply so distressing 
I fell in love in hell 
I fell in love in hell 
I fell in love in hell 
And it is simply so distressing 

Slowly I surrender to the serpent her agenda 
Is what the devils do, the devils do 
Merely with a smile she begins to set the fire 
Like the devils do, the devils do 

I see it in her eyes 
Soon enough I'll lie 
By myself 
And I 
See it in her eyes 
Soon enough I'll lie 
By myself 
And I fell in love in hell 
I fell in love in hell 
I fell in love in hell 
And it is simply so distressing 
I fell in love in hell 
I fell in love in hell 
I fell in love in hell 
And it is simply so distressing",Solid Gold Telephone,2004
Head Automatica,"She told me all the things she knew 
You give her one she'd reach for two 
The cold four on the sofa is getting closer 
And she's the hardest thing to do 
When the mantis in her preys on you 
An appetite fit for a king in a love 

I don't wanna bore you, but here I go again 
Cannibal Girl 
You've been eating me alive 
I don't wanna bore you, but here I go again 
Cannibal Girl 

So lately I've been meaning to 
Say a few things to you 
She gets all the good attention 
And I get honored with the mention 
And she's the hardest thing to do 
When the mantis in her preys on you 
An appetite fit for the kids you love 

I don't wanna bore you, but here I go again 
Cannibal girl 
You've been eating me alive 
I don't wanna bore you, but here I go again 
Cannibal girl 

And that's what hearts are for 
You give her one she breaks more 
Its the changing of the guard 
And now the last one to know 
When it's all just for show 
And I'm trying to be so hard 

I don't wanna bore you, but here I go again 
Cannibal girl 
You've been eating me alive 
I don't wanna bore you, but here I go again 
Cannibal girl 
You've been eating me alive 

I don't wanna bore you here I go again 
Cannibal girl 
You've been eating me alive 
I don't wanna bore you here I go again 
Cannibal girl",Cannibal Girl,2006
Head Automatica,"Speaking of heaven
She looked like a god on earth
It was something I could not understand or explain
And I mean you don't know
The things I do for you
While you are out cold
The things I do for you
Will lead for my breakdown

And I'm still curious
I'm curious
I'm still curious
Yeah

My baby kisses like a heart attack
Running like that
Squeezing till my face turned black
She pulled me under
She pulled me under
Girl, I mean you gotta know
The things I do for you
While you are out cold
The things I do for you
Will lead to my breakdown

And I'm still curious
I'm curious
I'm still curious
Yeah

Breakdown
Breakdown
My breakdown
Breakdown, yeah

Curious
I'm curious
I'm still curious
Yeah
'Cause I'm still curious",Curious,2006
Head Automatica,"Egyptian Musk
Egyptian Musk
When the village came with fire, you were hiding on the right
I knew you might
The blood of Christ
I tell you lies, I have found
I've seen a million religions on the ground
There's a suicidal Taliban for talent on the cusp
Egyptian Musk
Egyptian Musk

Is that your love down on the ground?
I see forever coming down
Look around look around
It makes everything okay

So celebrate the ignorance
And drizzle it in violence
And may you pledge a sore allegiance with every auto and appliance
Because they win if we don't go about life like we should
I knew you would
They knew you would
I'll tell you lies, I have found
I've seen a million religions on the ground
There's a suicidal Taliban for talent on the cusp
Egyptian Musk
Egyptian Musk

Is that your love down on the ground?
I see forever coming down
Look around look around
It makes everything okay

Is that your love down on the ground?
I see forever coming down
Look around look around
It makes everything okay

Where does your High School stand?
Where does your High School stand?
Where does your High School stand?
Where does your High School stand?

Lies, I've seen a few
I've seen a million in a nation in a feud
So if happiness is knowing, the knowledge I have not
We knew you'd pop
Your head went ""pop""

Is that your love down on the ground?
I see forever coming down
Look around look around
It makes everything okay

Is that your love down on the ground?
I see forever coming down
Look around look around
It makes everything okay",Egyptian Musk,2006
Head Automatica,"I got a question, let me ask you
Can you explain your reasoning to me
It ain't a matter if my heart of magma(??)
When there is no luck in it for me

I'm not the type of guy to hold a grudge 
Against something that I can hardly see
But to say that there's no reason for everything
Leaves me doubtful and in dreams to say the least

God you don't want to answer me
But if you do, you better agree
God you've got the strangest sense of humor
Your to funny to be so heavenly

I got your number and you only show me 
Just a little common decency
I knew before you
When you bless me test me
And answer with this plague inside of me

I'm not the type of guy to 
Bleed with the sky above
Over the demon under me
But to say that there's a reason for everything
Leaves me doubtful and in dreams to say the least

God you don't want to answer me
But if you do, you better agree
God you've got the strangest sense of humor
God you don't want to answer me
But if you do, you better agree
God you've got the strangest sense of humor
Your to funny to be so heaven
Your to funny to be so heavenly
Your to funny to be so heavenly",God,2006
Head Automatica,"So much fun is in a broken bottle
On the drive at night
So daddy froze froze froze on an old stool
I'm cryin' in the corner at 5
Well I've seen black
And I've seen blue
But fine line's I don't see
And just because I am in misery
It don't mean a thing

That I wanna know
That I wanna know

[Chorus]
Graduation Day, Graduation Day
We take back everything we said about you

September thought that she remembers
They don't teach humility
And just because they're always signaling Mayday
It don't mean a thing
That she's faired love 
And she's seen war
But fairness she don't see
And just because she is in misery
It don't mean a thing

That she wants to know
That she wants to know

[Chorus]

Graduation Day, Graduation Day
We take back everything we said too.

But comroderie old
Doin' what I'm told
And everybody knows 
This is getting out of hand

Everybody is dying for
The chance to be heard, not ignored
And everybody knows
This is getting out of hand

(Chorus)

Graduation Day, Graduation Day
We take back everything we said too

I'm not gonna
I'm not gonna
I ain't goin' to school

I'm not gonna
I'm not gonna
I'm not goin' to school",Graduation Day,2006
Head Automatica,"Answer me.
Body why do you ache me?
To keep ambition alive?
Relentlessly, it's you forsaking me.
But you'll never eat me alive.

You're never gonna see anything like me.

Breathlessly I ran from a seething sheik.
Two rats at odds for the prize.
Believe you me, the cancer which you speak will never eat me alive.

You're never gonna see anything like me.

It's a thousand to one.
Two hands on one gun.
Socialize, dollar prize
Yelling onward
Telling lies.
Then you've got a thousand to one.

You've seen a thousand to one.
I seen a fuck-fest in the sun.
It's American surprise:
Side of Islam.
Side of lies.
Then you've got a thousand to one right here.

You'll never take me alive.
You'll never eat me alive.

You're never gonna see anything like me.

It's been a crazy winter.
It's gonna be a crazy summer.

This is the legend of Christian Palco",K Horse,2006
Head Automatica,"Welcoming you to Cardboard City
Where I think they're laughing at your band
Did you have a clue?
That is was pretty on the gritty bottom of the van...

I'm feeling sorry for your band
Like really sorry about your band
Whoa

[Chorus]
You don't got a a clue
They're laughing at you
Laughing yes it's true
You don't even see they're laughing at you
Laughing at you to me

Your following is fleeting
Watch what you're reading
You might start believing what they're saying about 
You and who you know
I'm talking shameless in the thick of that
You can't get rid of that

Desperation is calling you
Desperation is calling you
Whoa

[Chorus: x2]

There are some things you gotta know
They whisper 'bout you when you go
And they will steal your ""Heaven's toll""

[Chorus]

You don't got a a clue
They're laughing at you
At everything you do
You don't even see they're laughing at you
Laughing at you to me

I'm feeling sorry for your band
Like really sorry about your band
I'm feeling sorry for your band
Like really sorry about your band",Laughing at You,2006
Head Automatica,"Everybody knows you're a liar
Why don't I?
I just heard about your lovin on the side
You're tellin tall tales girl
Spinning webs to big to climb

Everybody knows you're a liar
Why don't I?
I always knew you were a
I always knew you were a
I always knew you were a fraud

You're You're You're
Lying through your teeth
You're not at all
Not at all what you seem
You're lying through your ta ta ta teeth
You're not at all
Not at all what you seem

Girl your love's so cheap
We've been passing you around
There's cheating on your lips
And you've been the talk of my town
Fix your mess girl
It's crooked on the sides

Everybody knows you're a liar
Why don't I?
I always knew you were a
I always knew you were a
I always knew you were a fraud

You're You're You're
Lying through your teeth
You're not at all
Not at all what you seem
You're lying through your ta ta ta teeth
You're not at all
Not at all what you seem

Everybody knows you are a liar
Why don't I?
I just heard about 
Your lovin on the side
Fix your mess girl
It's crooked in the side

Everybody knows you're a liar
Why don't I?
I always knew you were a
I always knew you were a
I always knew you were a fraud

You're You're You're
Lying through your teeth
You're not at all
Not at all what you seem
You're lying through your teeth
You're not at all
Not at all what you seem
You're lyin through your teeth
You're not at all
Not at all what you seem
You're lying through your ta ta ta teeth",Lying Through Your Teeth,2006
Head Automatica,"You came and went
Too much time was spent
In the throes of the runaway holiday
But you came before me
And now you can't afford me
Oh, I can't be believe I'm responsible
If you even care let me know
I love you so
But I was too proud to go

Now you're asking me
Asking me

Who made the million dollar decision
I made it deep inside my heart

If you see a man
With his head in his hands
That's the portrait of a runaway
There before you're making your demands
You came before me
Now you can't afford me
Oh I can't believe I'm responsible
If you even care let me know
I love you so
But I was too proud to go

Now you're asking me
Asking me

Who made the million dollar decision
I made it deep inside my heart

Who made the million dollar decision
I pay for it when we're apart

You're falling to your death
Forgiven what you'll get
You took the floor
You're falling to your death
And now you're asking me
You're asking me
You're falling to your death
Forgiven what you'll get
You're falling to the floor
You're falling to your death
And now you're asking me
Asking me

Who made the million dollar decision
I made it deep inside my heart

Try to get the best of me
??? the man who's next to me
I pay for it when we're apart
I made it deep inside my heart...",Million Dollar Decision,2006
Head Automatica,"I needed just a hit, one hit
It's a very little hit, I'm sure I won't like it
I needed to be hurt, one hit will send me flying

I got away with murder last night in the parking lot
In cold blood I have murdered parts of us that we forgot

I walked into a kiss, one kiss
From the very lovely miss who lives to fulfill my wish
I needed to be hurt, one kiss will send me flying

I got away with murder last night in the parking lot
In cold blood I have murdered parts of us that we forgot

I will be goin' nowhere,
I will be goin' nowhere
I will be going nowhere, nowhere fast
I will be going no,
I will be going no,
I will be going no,
I will be going no,
I will be going nowhere, nowhere fast

I had to write a hit, one hit
It's a very little hit, I'm sure you won't like it
I needed to be hurt, one hit will send me flying

I got away with murder last night in the parking lot
In cold blood I have murdered parts of us that we forgot
And in the end I grant you
A farewell and final kiss
I got away with murder, who's the next to make the list

I will be goin' nowhere,
I will be goin' nowhere
I will be going nowhere, nowhere fast
I will be going no,
I will be going no,
I will be going no,
I will be going no,
I will be going nowhere, nowhere fast",Nowhere Fast,2006
Head Automatica,"You ain't loved me right for awhile
For your hand and glove
I drove a mile
For all that I know
For all that I know
For all that I know
You're still scandalous

You're so scandalous
You're so scandalous
You're so scandalous
I just can't handle it

You ain't loved me right for awhile
For all that I know
For all that I know
For all that I know
You're still scandalous

You're so scandalous
You're so scandalous
You're so scandalous
I just can't handle it

You're so scandalous
You're so scandalous
You're so scandalous
I just can't handle it

Grin and bear it
I will wear it
My crown of thorns
It better be pointed
They gotta be pointed

No mercy, no mercy
My crown of thorns
I gotta be hated
I gotta be hated

You're so scandalous
You're so scandalous
You're so scandalous
I just can't handle it...

Oooh oooh oooh",Scandalous,2006
Head Automatica,"She's not it
She's really not it
She ain't it
She's really not it

You know I'm glad that she's not alive
She quit her job when she was 45
This kind of drama hits me every day
She got a job I got a salary
But you know me
I will do what I gotta do
In spite of you
And you will me patiently
Dreaming of me
In spite of you
Miserably

She's not it
She's really not it
She ain't it
She's really not it

I got a couple things I really need to say
One of 'em is funny and the other is passe
Walk the plank
She had me swimmin' in the whole damn tank
Yeah, but you know me
I will do what I gotta do
In spite of you
Then will me patiently
Dreaming of me
In spite of you
In misery

She's not it
She's really not it
She ain't it
She's really not it

'Cause I'm leavin'
I'm leavin'
And I just can't help these
Just can't help these 
Feelings

I'm still breathin'
No more deceivin'
And I just can't help these
Just can't help these
Feelings

She's not it (no she's not it)
She's really not it (no she's not it)
She ain't it (no she's not it)
She's really not it (no she's not it)
She's not it (no she's not it)
She's really not it (no she's not it)
She ain't it (no she's not it)
She's really not it (no she's not it)",She's Not It,2006
Head Automatica,"Now am I just creative
Or was I meant to be a killer
Killing lovers in the street
Sometimes the most unlikely
Prove themselves to be a liar
Everything you said to me

I, I'm glad I'm alive
There is no way 
I'm touching ground again

I saw a blind man shackled
By his hands and feet, escaping
When his face hit the concrete
And the same way you play vicious
That's the same way you agree
Endearing
An endearing empathy

I, I'm glad I'm alive
There is no way 
I'm touching ground again

I'd be shot in the back
By my fears
Whoa, shot in the back
By my fears
Shot in the back
By my fears
I'd be shot in the back
By my fears

I'm telling you
I'm glad I'm alive
There is no way
I'm touching ground again

Uh-huh",Shot in the Back (The Platypus),2006
Head Candy,"Wake up, Maggie,
I think I got something to say to you.
It's late September and
I really should be back at school.
I know I keep you amused,
But I feel I'm being used.
Oh, Maggie, I couldn't have tried any more.
You led me away from home
Just to save you from being alone.
You stole my heart, and that's what really hurts.

The morning sun, when it's in your face,
Really shows your age.
But that don't worry me none.
In my eyes, you're everything.
I laughed at all of your jokes.
My love you didn't need to coax.
Oh, Maggie, I couldn't have tried any more.
You led me away from home
Just to save you from being alone.
You stole my soul, and that's a pain I can do without.

All I needed was a friend
To lend a guiding hand.
But you turned into a lover, and, mother, what a lover!
You wore me out.
All you did was wreck my bed,
And, in the morning, kick me in the head
Oh, Maggie, I couldn't have tried any more.
You led me away from home
'Cause you didn't want to be alone.
You stole my heart. I couldn't leave you if I tried.

I suppose I could collect my books
And get on back to school.
Or steal my daddy's cue
And make a living out of playing pool.
Or find myself a rock 'n' roll band
That needs a helping hand.
Oh, Maggie, I wish I'd never seen your face.
You made a first-class fool out of me.
But I'm as blind as a fool can be.
You stole my heart, but I love you anyway.",Maggie May,1992
Head East,"Hey brother Jacob
I trust you're well today
You've been dealin' with the devil
And cast your soul away

Ol' brother Jacob lived 93 years
Not a second of it on his knees
He lived in a little wood shanty
Down the road a little piece

All he ever seemed to care about
Was his money that he saved so long
Always tryin' to get a few dollars
Any way, right or wrong

Hey brother Jacob
I trust you're well today
You've been dealin' with the devil
And cast your soul away

The only part that you have to doubt
Is where it says you don't have to pay
Ol' brother Jacob gambled and lost
When he sold his soul today

The story came down from the mountain town
Brother Jacob was called away
They say that the devil came for him
And they swear it to this very day

Then again, there's another tale
That's told around the town
Says Brother Jacob is still alive
And livin' underground

Hey brother Jacob
I trust you're well today
You've been dealin' with the devil
And cast your soul away

Hey brother Jacob
I trust you're well today
You've been dealin' with the devil
And cast your soul away
",Brother Jacob,1975
Head East,".When I was young, I was told
That there was a city
Made out of gold, solid gold
And now I'm askin' you
Do you think that those stories are true?
And if you say that you do
Would you like to go and
Look for the city with me?

Sometimes I feel that it's got to be real
About the city, that's made out of gold, solid gold
And now I'm askin' you
Do you think that those stories are true?
And if you say that you do
Would you like to go and
Look for the city with me?

I believe there's a city
Way up in the sky
It's made out of solid gold
Invisible to the eye
Don't ask me why 
I believe what I believe
Oohh, oohh",City of Gold,1975
Head East,"You're tellin' me that you ain't no fly by night lady
But I've seen you goin' down
When you thought nobody else was around
Well all your runnin' round is goin' to drive you crazy
You better learn to keep your feet on the ground

Fly by night lady, hey woman of the night
Do you think that it's alright, hey lady
When the darkness takes the night
You can fly by the night

You say you don't understand what's goin' on around you
But I know that what you say isn't really in your brain
You're out late at night, always looking around behind you
Since you've been flying by the night, you're just not the same

Fly by night lady, hey woman of the night
Do you think that it's alright, hey lady
When the darkness takes the night
You can fly by the night

Hey woman of the night
Do you think that it's alright, hey lady
When the darkness takes the light
You can fly by the night
",Fly by Night Lady,1975
Head East,"I remember the first time
Yeah, down at Jefftown Creek
You and me and a bottle of wine
And the night that smelled so sweet

Came up Sunday morning 
First day of the week
And I found that I had changed
Down at Jefftown Creek

I know that I'm not the same anymore
Well can't you see it's true
Find all the answers and pass'em along
Hope that it's me and you

When I found all the answers and words
But could not speak
But I knew that I had changed
Down at Jefftown Creek

When I found all the answers and words
But could not speak
But I knew that I had changed
Down at Jefftown Creek

I remember the first time
Yeah, down at Jefftown Creek
You and me and a bottle of wine
And the night that smelled so sweet

Came up Sunday morning
First day of the week
And I found that I changed
Down at Jefftown creek

Came up Sunday morning
First day of the week
And I found that I had changed
Down at Jefftown Creek
Down at Jefftown Creek
Down at Jefftown Creek
Jefftown Creek",Jefftown Creek,1975
Head East,"Drive two hundred miles
To a place I've never seen
One more bar, back to the car
And I'm gone before I even know where I've been - yeah

Now I don't know where you come from
I'll probably never see your face again
It really don't matter what your name is
But it's so nice to make another friend

But I don't know where you've been
And I don't know who you've had in
But I know you've got exactly what I need
It don't mean too much to me
What you do or who you see
I'll be leavin' here at three
So love me tonight

Well I've been gone a long time
I really haven't been any place at all
Two more days the same old way
Well it really doesn't matter at all - no

But you could make a difference
In the way I feel today
We'll have some fun, but I gotta run
If I'm gonna live I gotta play

But I don't know where you've been
And I don't know who you've had in
But I know you've got exactly what I need
It don't mean too much to me
What you do or who you see
I'll be leavin' here at three
So love me tonight

Love me tonight, don't talk about tomorrow
Love me tonight, don't feed me any sorrow
One night's all we got and then I'm gone yeah
Love me tonight, don't ever try to stop it
Love me tonight, I'll be gone before you know it
Maybe I'll be back before too long

Love me tonight, don't talk about tomorrow
Love me tonight, don't feed me any sorrow
One night's all we got and then I'm gone yeah
Love me tonight, don't ever try to stop it
Love me tonight, I'll be gone before you know it
Maybe I'll be back before too long

But I don't know where you've been
And I don't know who you've had in
But I know you've got exactly what I need
It don't mean too much to me
What you do or who you see
I'll be leavin' here at three
So love me tonight

I believe in you and me
So love me tonight",Love Me Tonight,1975
