Band,Lyrics,Song,Year
Ben Light,"I want to take you to a little room
A little room where all the roses bloom
I want to lead you into Nature's hall
Where ev'ry year the roses give a ball
They have an orchestra up in the trees
For their musicians are the birds and bees
And they will sing us a song
As we are strolling along
 
In sunny Roseland, where summer breezes are playing
Where the honey bees are ""A-Maying""
There all the roses are swaying
Dancing while the meadow brook flows
The moon when shining is more than ever designing
For 'tis ever then I am pining
Pining to be sweetly reclining
Somewhere in Roseland
Beside a beautiful rose
 
The ball is over and tulips meet
Their little kisses are so short and sweet
The lilies nod to the forget-me-nots
When they're departing in their flower pots
But all the roses with their spirits high
Remain to love until they droop and die
And dear, why shouldn't it be
Just so with you and with me
 
In sunny Roseland, where summer breezes are playing
Where the honey bees are ""A-Maying""
There all the roses are swaying
Dancing while the meadow brook flows
The moon when shining is more than ever designing
For 'tis ever then I am pining
Pining to be sweetly reclining
Somewhere in Roseland
Beside a beautiful rose
",Rose Room,2005
Ben Light,"Oh, it's a long, long while from May to December
But the days grow short when you reach September
When the autumn weather turns the leaves to flame
One hasn't got time for the waiting game

Oh, the days dwindle down to a precious few
September, November
And these few precious days I'll spend with you
These precious days I'll spend with you",September Song,2005
Ben Light,"Wouldn't it be a change for you and me to stay at home once ina while?
We'd babaret until the break of day
I'll bet we've danced many a mile
I'll like to see a movie once more
They don't keep people staying up until four

Wouldn't it be a pleasant novelty to tumble in early once more?

Sleepy time gal, you're turning night into day
Sleepy time gal, you've danced the ev'ning away
Before each silvery star fades out of sight
Please give me one little kiss
Then let us whisper 'goodnight' 
It's getting' lat and dear your pillow's waitin'

Sleepy time gal, when all your dancin' is through
Sleepy time gal I'll find a cottage for you
You'll learn to cook and to sew
What's more you'll love it I know
When you're a stay-at-home , play-at-home
Eight o'clock sleepy time gal.

Wouldn't it be a pleasant sight to see a kitchenette only for you?
Wouldn't it be a pleasant sight to see a table set only for two?
I'd get a big victrola and then
We'll start in dancing ev'ry new dance again
Then it will be a pleasant novelty to tumble in just about ten.

Sleepy time gal, you're turning night into day
Sleepy time gal, you've danced the ev'ning away
Before each silvery star fades out of sight
Please give me one little kiss
Then let us whisper 'goodnight' 
It's getting' lat and dear your pillow's waitin'

Sleepy time gal, when all your dancin' is through
Sleepy time gal I'll find a cottage for you
You'll learn to cook and to sew
What's more you'll love it I know
When you're a stay-at-home , play-at-home
Eight o'clock sleepy time gal.
",Sleepy Time Gal,2005
Ben Light,"Toot, toot, Tootsie, good-bye!
Toot, toot, Tootsie, don't cry
The choo choo train that takes me
Away from you no words can tell how sad it makes me
Kiss me, Tootsie, and then
Do it over again, watch for the mail, I'll never fail
If you don't get a letter then you'll know I'm in jail
Toot, toot, Tootsie don't cry
Toot, toot, Tootsie, good-bye
 
Toot, toot, Tootsie, good-bye!
Toot, toot, Tootsie, don't cry
The choo choo train that takes me
Away from you no words can tell how sad it makes me
Kiss me, Tootsie, and then
Do it over again, watch for the mail, I'll never fail
If you don't get a letter then you'll know I'm in jail
Toot, toot, Tootsie don't cry
Toot, toot, Tootsie, good-bye",Toot Toot Tootsie,2005
Ben Light,"Don't worry I'm not looking at you
Gorgeous and dressed in blue
Don't worry I'm not looking at you
Gorgeous and dressed in blue
I know it drives you crazy
When I pretend you don't exist
When I'd like to lean in close
And run my hands against your lips
Though we haven't even spoken
Still I sense there's a rapport
So whisper me your number
I'll call you up at home
Whisper me your number
I'll call you up at home
Don't worry I'm not looking at you 
Don't worry I'm not looking at you
Gorgeous and dressed in blue
Don't worry I'm not looking at you
I know you see me see you
As you see me walk on past
When there's nothing more I'd like to do
Then come in close and hear you laugh
Though we haven't even spoken
Still I sense there's a rapport
So whisper me your number
I'll call you up at home
Yea whisper me your number
I'll call you up at home
Whisper me your number
I'll call you up at home
Hmm whisper me your number
I'll call you up at home",Whispering,2005
Ben Loeb,"
 

I'm going as far as I can go  away from here  
Away from you  Jake  and the hole you've sunk me into. 
I wish that I could belong here  with you  and just be  
But that's not all that I'm about. 
Your life is built on accidents  like meeting me. 
You write everything down in your grocery list   people do this. 
Even insects buzz like airplanes  why can't we fly away? 
I'm going as far as I can go. 
Your dad died  cause his heart hurt, arking away his forty-five years, 
Dragging your mom along. 
I don't want that, neither do you. Neither do you. 
If I am not fun, and I am not interesting, 
Perhaps I am not interested in you, neither are you. 
You can't stand in front of an oven, cause it's warm, 
And the fumes are dangerous. 
I'm going as far as I can go. 
Away from here, away from you, Jake, 
And the hole you've sunk me into. 
I wish that I could belong here, with you, and just be. 
But that's not all that I'm about to do. 

",Jake,1997
Ben Lovett,"I am just a poor boy
Though my story's seldom told
I have squandered my resistance
For a pocketful of mumbles
Such are promises
All lies and jests
Still a man hears what he wants to hear
And disregards the rest

When I left my home and my family
I was no more than a boy
In the company of strangers
In the quiet of the railway station
Running scared
Laying low, seeking out the poorer quarters
Where the ragged people go
Looking for the places only they would know

Lie la lie...

Asking only workman's wages
I come looking for a job
But I get no offers
Just a come-on from the whores on Seventh Avenue
I do declare, there were times when I was so lonesome
I took some comfort there

Lie la lie...

Then I'm laying out my winter clothes
And wishing I was gone
Going home
Where the New York City winters aren't bleeding me,
Leading me, going home.

In the clearing stands a boxer
And a fighter by his trade
And he carries the reminders
Of every glove that laid him down
Or cut him till he cried out
In his anger and his shame
""I am leaving, I am leaving""
But the fighter still remains

Lie la lie",The Boxer [*],2012
Ben Lyon,"I'd like to get away, Junior
Somewhere alone with you
It could be oh, so gay, Junior
You need a laugh
Or two

A certain place I know, Frankie
Where funny people can have fun
That's where the two will go,
Darling

Before you can count up
One, two, three. 
For there's a small hotel
With a wishing well

I wish that we were there together
There's a bridal suite
One room bright and neat
Complete for us to
Share together

Looking through the window
You can see a distant steeple
Not a sign of people who
Wants people?
When the steeple bell says,
""Good night, sleep well,""
We'll thank the small hotel
Together

We'll creep into our little shell
And we will thank the small hotel together",There's a Small Hotel,1998
Ben Marafino Jr.,"I've got you under my skin.
I've got you deep in the heart of me.
So deep in my heart that you're really a part of me.
I've got you under my skin.
I'd tried so not to give in.
I said to myself, this affair never will go so well.
But why should I try to resist when, baby, I know down well
I've got you under my skin?

I'd sacrifice anything come what might
For the sake of havin' you near
In spite of a warnin' voice that comes in the night
And repeats, repeats in my ear,
Don't you know, you fool, you never can win?
Use your mentality, wake up to reality.
But each time that I do just the thought of you
Makes me stop before I begin
Cause I've got you under my skin.

I would sacrifice anything come what might
For the sake of havin' you near
In spite of the warning voice that comes in the night
And repeats, how it yells in my ear,
Don't you know, you fool, ain't no chance to win
Why not use your mentality, get up, wake up to reality?
And each time I do just the thought of you
Makes me stop just before I begin
Cause I've got you under my skin.
And I like you under my skin.",I've Got You Under My Skin [C],2008
Ben Markley,"Love is funny or it's sad, 
Or it's quiet or it's mad,
It's a good thing or it's bad,
But beautiful!

Beautiful to take a chance
And if you fall, you fall,
And I'm thinking I wouldn't mind at all.
Love is tearful or it's gay.
It's a problem or it's play,
It's a heartache either way,
But beautiful!

And I'm thinking if you were mine
I'd never let you go,
And that would be but beautiful I know.",But Beautiful,2009
Ben Martin,"Asking me discretely, when she can come meet me, later on tonight 
Talking super softly, how we both look gothy, but it's alright 
Don't tell me what you're doing to me 
I don't want to look sleazy, but you make it seem so easy 

Anna, please get off the phone now 
I've got to let you know now, it's time for you to take me home 
Anna, please get off the phone now 
I've got to let you know now, how much you mean to me 

Kissing me so slowly, shouldn't be this lucky, like we're in a movie 
Smiling at me in the moonlight, wish this could be everynight 
And everynight and everynight again 
Don't tell me what you're doing to me 
I don't want to look sleazy, but you make it seem so easy 

Anna, please get off the phone now 
I've got to let you know now, it's time for you to take me home 
Anna, please get off the phone now 
I've got to let you know now, how much you mean to me 

And I'd still be waiting, when all this starts fading It's true 
You don't even know how much I need you 

Anna, please get off the phone now 
I've got to let you know now, it's time for you to take me home 
Anna, please get off the phone now 
I've got to let you know now, how much you mean to me",Take Me Home,2007
Ben Marvin,"Open up your eyes because it's a long way down.
Wake up and turn this hatred around.
Racial insanity, trafficking of slaves.
These crimes you will take to your graves.
Your souls are like one another;
Your veins are similar in colour.
This land wasn't yours to keep,
So listen now and hear me speak:

The stars look down and witness.
Erase the spreading sickness.

You can't see it with your eyes because they are rolling back.
You're about to have a heart attack.
Human depravity, suffering and torture.
Co-existence maimed at the slaughter.
Your souls are like one another;
Your veins are similar in colour.
This land wasn't yours to keep.
Wake up fools from your ignorant sleep.

The stars look down and witness.
Erase the spreading sickness.
You're so far gone that you can't see
Your place in hell is guaranteed.

I stand tall, feet firmly planted on the solid ground.
Separation now leaves you to sink and slowly drown.
Unmarked graves for those who have disgraced our name.
Devastate? Eradicate? The human race is the same in every way.

I stand tall, feet firmly planted on the solid ground.
Separation now leaves you to sink and slowly drown.

Separation will never advance us.
Discriminate, you will never rebuild trust.
We're born the same over time. Your open mind changed.
We're all brothers, so you need to look upon others in the same light.
Just 'cause you're white doesn't mean you can excuse this ignorant fight.
And the same if you're black no racist attack is justified.
Supremacy, just a lie.

Does it matter about the colour of skin?
Stop wasting your time.You're fighting a fight that you won't win.
Diminish this ignorance and get a grip. Settle in.
You're controlled by the hype, abusive and threatening
Towards another brother that wants to be here and fit in.
Grown up around mixed-race kids, we see no difference,
So why discriminate him? Hatred based on appearance.
You need to erase this spreading sickness.

The stars look down and witness.
Erase the spreading sickness.
You're so far gone that you can't see
Your place in hell is guaranteed.",Erase,2015
Ben Mazué,"J'suis pas vraiment jaloux, non mais
Il a la vie plus facile que moi
J'suis pas vraiment jaloux, non mais
(Lui il a tout) et moi j'ai quoi ?

J'ai, non, j'ai  pas vraiment pensé à tout ça
Moi j'avais mordu a l'hameçon
On m'avait dit tu va voir, la rate pas celle-là
C'est la meilleure des saisons
L'été c'est comme une douceur permanente et
Le soleil pour combustion
Chauffera tes envies naissantes
Et propulsera ta vie c'est bon
Alors me voilà le cul posé dans le sable en juillet
Le torse plus blanc qu'une écorce dans la chair de coco
Corps dodu d'ado habitué
Aux gros manteaux et à la ville bitumée
Alors que lui je le vois sortir de l'eau
Son air ravi...
La peau tirée par le sel, brunie par le soleil
Les cheuveux blond caramel
Toujours décolorés en somme
Au bout toujours jaune
Pour dire c'est la mer qui m'a fait
Pas les chromosomes !
Lui il claque un sourire
Y a déjà six filles dans son lit
Entre Hossegor, la Gwada, Maurice et puis Bali
Il m'a même pas calculé
Et toutes mes copines sont scotchées
Les yeux collés au V. de son ventre et de son dos
Pendant que je passe une fois de plus
De la crème sur ma peau

J'suis pas vraiment jaloux
Il a la vie plus facile que moi
J'suis pas vraiment jaloux
Lui il a tout, et moi j'ai quoi ?

C'est l'hiver et le froid vient toquer à mes pompes
Je subis
On peut rien faire contre ça
Dire que j'ai attendu vingt ans
Pour connaître ce climat
C'est l'hiver et ma case vit au rythme du vent
J'aurais juré qu'il n'y a pas si longtemps
Remplie à craquer tout l'été elle rassemblait
Au son de la musique et maintenant
Tout seul dans le brouillard des idées
J'écoute le son, les cils baissés sur mon crayon
Les premiers mots qui me viennent, c'est...

Sometimes Love can bring you down
But I'll be lovin' you so much...

Alors que lui,
Je le vois sortir ses mots
Son air ravi...
Il raconte les histoires
De ses amours perdus
Le temps d'un soir
Dans un Paris suspendu
Il déroute et dévie
Et moi je l'écoute et je l'envie
Je laisse mes cahiers sur le lit
J'irai écrire cette aprés-midi
Je laisse mes cahiers sur le lit
Tant pis...

J'suis pas vraiment jaloux
Il a la vie plus facile que moi
J'suis pas vraiment jaloux
Lui il a tout, et moi j'ai quoi ?",Je Suis Pas Vraiment Jaloux,2008
Ben Mazué,"14 ans, limite 15
Ce soir elle a de grands projets
14 ans mais très bientôt 15
Ce soir, elle abordera le grand sujet

Comme elle a une grande sœur, elle sait qu'avec l'âge viennent les excès
Et prendre de l'âge à 14 piges c'est
Comme un gage de qualité
Elle s'était coiffée 17 ans, sapée genre meuf qui 17 ans,
Maquillée je te, non,je te raconte pas comment

Pendant que de l'autre côté de la scène un type collégien
14 ans comme elle, vient de..partir la rejoindre
Quelques mois qu'ils se pratiquent, qu'ils se connaissent
Par milliers, ils s'en laissent des messages, trempés dans le sucre

Pratiquent ce numéro pour déverser l'amour
Quand des flots d'hormones inondées et
En un quart de tour
Brûle en comique
Parfois quand ils s'enflamment pour quelques heures 
Quand pour quelqu'un que tu connais pas,
Tu donnerais ta mère et ta sœur

L'amour adolescent, adossé dans les sens
Virevoltant, déhanchant des innocences et dans le sens
C'est toujours dans mes pensées, c'est tellement beau,puissant
Si tu le sais pas, elle te rappellera que Roméo avait 16 ans

Alors le voilà dévalant l'avenue du 11 novembre
La voilà l'attendant, docile et tendre
Elle aime qu'il l'aime, il aime grandir, 
Il aime qu'elle vienne de loin juste pour le voir sourire

Qu'elle dit à ces mains qui traînent
Presque au dessus des fesses
Il tremble comme une feuille à chaque caresse
C'est pas le stress,non, c'est pas l'excitation, c'est juste un test
Allez vas y mon garçon

Mais rien n'y fait, rien ne s'estompe
Un peu plus tard, pour réduire les effets
Il se cachera pour faire des pompes
On lui a tellement dit, faut pas forcer la main des filles, il faut les protéger
Qu'a l'heure de faire l'amour il réalise qu'en fait, c'est lui l'objet?

Alors toujours bouche contre bouche, 
Touche contre coucher et elle se débrouille 
Pour que ses yeux sur ses seins viennent loucher
Elle retire son soutien-gorge
Après qu'il est tout tenté
Tout entier dévoué à une seule cause

Il regrettera le temps des toges parce que là, c'est compliqué
De retirer à une seule main ce genre de chose
Les chaussettes aussi, c'est vrai, c'est le passage délicat,
Elle y arrive qu'avec les pieds
Mais lui, il arrive pas

C'est l'aventure et c'est laborieux
Mais c'est le temps et sa cambrure
Qu'ils tiennent dans leur petit jeu
Maintenant qu'on en est là, sous les draps, le reste n'est qu'animal
Elle sera courageuse, il fera tout pour qu'elle n'est pas mal

Il a les yeux plus ouvert que jamais, pourtant c'est le noir complet
Deux fois en dessous, trois fois au dessus
Elle pense a sa sœur qu'il l'a fait
Elle se dit qu'elle, ça y est

Elle constate qu'il ne tremble plus.",14 Ans,2014
Ben Mazué,"En soirée appart', y'a deux types de dragueuse
Celles des salons, les danseuses
Et celles des cuisines et des balcons, les parleuses
Elle, c'était une parleuse

Elle avait de la bouteille,
C'était très agréable d'ailleurs de parler avec elle
Le genre elle était jamais vraiment loin de toi
Pendant toute la soirée
C'est la coïncidence heureuse des filles
Qui provoquent l'occasion sans trop la provoquer
Abordent sans déborder
D'une façon prudente et silencieuse

Et tout s'accélère quand elle parle
C'est comme un appât qu'elle vous tendait avec ses cils
Elle vous a ferré et son arme réside dans sa manière de vous relancer
Sa cible, vous séduire
En commençant par vous faire rire
Quelques naïves confessions vous permettent de penser
Qu'elle n'est pas maladroite en talons compensés comme simple tenue
Et que vous seriez sûrement très bien tous nus
Et même si c'est déjà vendu,
Même si l'évidence est rendue,
On traîne souvent longtemps sur le palier de la séduction 
Avant de se hisser vers un enlacement salivaire
Quand on est une dragueuse de cuisine et de balcon, on préfère

Les danseuses, elles, sont plus franches du collier
On se séduit, d'accord, mais pour vite s'embrasser
Et là je sais qui y'aura rien
Jusqu'à ce qu'en trois minutes j'ai entre mes mains ses seins
Et au bout de ma langue, cht
Elle connaît tout le monde, elle a quelques rires, vagabonde
Le corps joliment dessiné, elle est bien habillée,
Elle a 35 ans, elle me l'a dit mais ça se voyait,
J'ai pas été surpris
35 ans ça fait 10 ans de plus que moi
10 ans de plus
Imagine, moi, si je draguais 10 ans de moins que moi?
N'importe quoi

J'ai pas de passion pour les filles plus vieilles en particulier,
Loin de moi l'idée de penser que c'est un défi ou une case à cocher
Mais elle n'a d'âge que l'expérience en plus, elle a pas changé de vie,
Pas de marmots en bas-âge, de maison dans le Vaucluse, et, surtout, pas de mari
Donc ça me fait une raison de plus de pas reculer alors vas-y continue de parler, continue
Je n'ai qu'une seule et même idée

La soirée se finit
Et la soirée continue, rejoins-moi tu m'as dit,
Et j'ai pas répondu
Mais je te garantis
Que c'est marché conclus",25 Ans,2014
Ben Mazué,"Allô? C'est lui-même, ouais. Oui, je veux bien, ouais, j'ai le temps
Oh, vous savez, moi, je suis à la retraite depuis vingt ans donc, euh
Euh oui, oui, je regarde la télé l'après midi
J'allais dire, c'est de mon âge, hein
Je regarde les séries pourries avec les pubs
Pour les fauteuils électriques qui permettent de monter à l'étage. Voilà
Trois heures par jour à peu près, je sais pas, je compte pas hein non plus
Il m'arrive de rester longtemps dehors, surtout l'été
Je profite mieux qu'à la fenêtre
À l'affût d'un événement qui me sorte d'un quotidien pas trop dégueu du reste
Moi, j'ai pas peur là, comme vous, les jeunes
De tomber, de me planter, de l'avenir et du reste
J'ai fait ce qu'il fallait quand il fallait
Et ce qu'il manquait, je l'ai digéré depuis des lustres, alors!
Sans ceinture de sécurité, sans casque!
Sans souci de la ""biodiversité""
On a su tenir. On avait d'autres problèmes
Et pas moins gros d'ailleurs mais j'ai le souvenir que quand même 'fin bon
Ce qui est sûr, c'est que là, entre vous et moi, le plus près de la fin
C'est pas le moins serein
Et vous avouerez que c'est bizarre
Ok, j'ai plus rien à prouver mais c'est pas la perte d'un emploi
qui m'attend au bout du couloir là
C'est la Mort, connard, et je te le dis franchement, je l'attends
J'en ai moins peur depuis quelque temps et, si jamais ""au delà"" il y a
y'aura plus de potes là-bas que dans mon appartement
Ça va, la vie, je l'aime bien quand même, hein!
J'irai pas me foutre en l'air volontairement
J'apprécie pas grand chose mais c'est devenu beaucoup parce que
Des pas grands choses, dans la vie, y'en a plus que des gros coups
Un café, un peu de soleil, sérieux, c'est juste ça
Je m’émerveille, sobrement, mais je m'émerveille
Voilà, j'ai gagné cette série T avec des épreuves, mon petit, t'as pas idée
Si je te les raconte, je te donne pas trois minutes pour décrocher!
Et raccrocher

Pourtant, je suis pas de l'époque des grandes guerres
Moi, c'est les Trente Glorieuses et le plein emploi!
Et je te garantie qu'on avait de quoi se faire de la bile
Alors écoute un peu le vieillard et lâche un peu la bride
Je suis pas de l'époque des grandes guerres, moi
C'est les Trente Glorieuses et puis le plein emploi
Mais je te garantie qu'on avait de quoi se faire de la bile
Alors écoute un peu le vieillard et lâche un peu la bride

L'occident décline, la croissance recule? C'est vrai
Mais, sans croissance, pas de perspectives
Sans perspectives, des jeunes comme vous, désœuvrés
Maintenant, peut-être qu'on a arrêté de croître parce qu'on est déjà très haut
Et il serait temps d'inventer, je sais pas moi, des trucs nouveaux!
Le monde de demain, tiens!
Parce qu'on va pas sans cesse compter sur le fait de grossir
C'est pas la peine
Il est mort dans l’œuf
Le rêve qu'on finisse tous par atteindre la classe moyenne américaine
Mais tant pis, vous, au lieu de dire ""venez, on invente""
Vous dites ""venez, on reproduit""!
J'ai rarement vu moins rebelle que votre génération d'abrutis
D'individus individualistes, vaguement divisés sur des sujets futiles et vains
Mais unis comme jamais dans la peur du lendemain
Ce qu'il vous faut? Je vais vous le dire ce qu'il vous faut
Pépère, ce qu'il vous faut
C'est une bonne guerre",73 Ans,2014
Ben Mazué,"Ça doit être la 700,000ème fois
Que je te voie t'habiller
Choisir cette culotte ou celle-là
Que je te vois t'abîmer
On n'a pas vraiment vieilli
Parce qu’on se sent capable de tout encore mais
On a gagné quelques plis sur le corps

Mais si la vie par malchance me fait louper quelques rendez-vous
Pour cause de mollesse
Négligence de jeunesse
Et même si ensemble finalement
On devait pas aller au bout
Ça fait dix ans que t'es passée devant mes yeux, dix ans que j'me dit que
C'est c'qui m'est arrivé de mieux

On se l'est tellement dit que ce serait pour longtemps
Que finalement dix piges ça paraît pas tant
C'est pas si épatant, ça rafraîchit l'odyssée
Même si l'on contemple plus que l'on agit
Plus que l'on réussit, on essaie
On essaie

Mais si la vie par malchance me fait louper quelques rendez-vous
(Ce que je sais) pour cause de mollesse
Négligence de jeunesse
Même si ensemble finalement on devait pas aller au bout (ce que je sais)
Ça fait dix ans que t'es passée devant mes yeux, dix ans que j'me dit que
C'est c'qui m'est arrivé de mieux

Oh, mais si à l'avenir on passe à côté
Si on n'exige pas au moins aussi bien que c'qui vient de se passer
Moi j'ai encore nos débuts en mémoire, nos espoirs et je rougis pas de c'qu'on est devenu
Deux enfants plus tard

Dix ans de nous, dix ans de nous
Est-ce que je tresse pas trop tôt des lauriers?
Dix ans de nous, dix ans de nous
Est-ce que je tresse pas trop tôt des lauriers?
Dix ans de nous, dix ans de nous
À deux doigts d'oublier qu'on s'est déjà perdus
Dix ans de nous
J'attends pas de toi tout (dix ans de nous) 
Mais j'attends de nous ça
Mais j'attends de nous tout
Dix ans de douceurs, de souffrances, de coups d'peur
De tourments de lose et de tournants
Des souffleurs de crise et des bonheurs qui se brisent
Mais qu'on sait ranimer
Ce sera ça aimer
Pour nous c'est ça",10 ans de nous,2017
