Band,Lyrics,Song,Year
Stan Getz,"Whether you are here or yonder, 
Whether you are false or true
Whether you remain or wander, 
I'm growing fonder of you
Even though your friends forsake you, 
Even though you don't succeed
Wouldn't I be glad to take you, 
Give you the break you need

More than you know, more than you know
Girl of my heart, I love you so
Lately I find you're on my mind
More than you know

Whether you're right, whether you're wrong
Girl of my heart, I'll string along
You need me so
Much more than you'll ever know (ever know)        
Loving you the way that I do      
  
There's nothing I can do about it        
Loving may be all you can give        
But baby I can't live without it
Oh, how I'd cry, oh, how I'd cry
If you got tired and said ""Good-bye""

More than I'd show
More than you'd ever know",More Than You Know,1957
Stan Getz,"Love was blown away by the night wind
And the dream we shared fell apart
Now I'm all alone in the night wind
Wind that brought the blues to my heart

Yesterday my arms were around you
And your lips revealed you were mine
Then the angry wind came and found you
Came to end the moment divine

Oh the night wind seems to haunt me
Seems to taunt me now that you don't want me
Why is lover's lane filled with shadows
Stars no longer shine up above

I'll be waiting there in the shadows
'Til the night wind brings back our love
Oh the night wind seems to haunt me
Seems to taunt me now that you don't, you don't want me

Why is lover's lane filled with shadows
Stars no longer shine up above
I'll be waiting there in the shadows
'Til the night wind brings back our love

I'll be waiting there, let you know I care
'Til that night wind brings back our love",Night Wind,1957
Stan Getz,"What is so rare as a day in June?
'Till now we have never been told
The old question's answered by one that is new
What is so rare, dear, as you?
 
So rare, you're like the fragrance of blossoms fair
Sweet as a breath of air
Fresh with the morning dew
So rare You're like the sparkle of old champagne
Orchids in cellophane 
Couldn't compare to you 
You are perfection you're my idea 
Of angels singing the Ave Maria
For you're an angel, I breathe and live you
With every beat of the heart that I give you 
So rare, This is a heaven on earth we share
Caring the way we care
Ours is a love so rare
 
So rare, You have the warmth of a Schubert air
Charming and debonaire
Those are the words for you
So rare You have a way that's beyond compare
That ""one in a million"" air
In everything you do
You have that something, that certain manner
You thrill me more than the ""Star Spangled Banner""
You stage a love scene, so sweetly tender
And in that love scene I gladly surrender
So rare, to have a future like yours to share
Sweetheart the way we care
",So Rare,1957
Stan Getz,"You look at me and wonder
You look at me and doubt
Darling, your eyes are asking
""Will the flame burn out?""

No one is sure of sunshine
No one is sure of dawn
But I am sure
My love will live on and on

I'll be tired of you
When stars are tired of gleaming
When I am tired of dreaming
Then I'll be tired of you

This I know is true
When winds are tired of blowing
When grass is tired of growing
Then I'll be tired of you

Beyond the years till day is night
Till wrong is right, till birds refuse to sing
Beyond the years the echo of my only love
Will still be whispering, whispering

If my throbbing heart
Should ever start repeating
That it is tired of beating
Then I'll be tired of you",Then I'll Be Tired of You,1957
Stan Getz,"I'm trying to explain to friends, dear
The reasons we two are apart
I know what to tell our friends, dear
But what can I tell my heart?

It's easy to say to strangers
That we played the game from the start
It's easy to lie to strangers
But what will I tell my heart?

When I smile to hide all the tears inside
What an ache it will be bring
Then I'll wander home to a telephone
That forgot how to ring, ring, ring

I'm telling you'll soon be back, dear
To fool the whole town may be smart
I'll tell them you'll soon be back, dear
But what will I tell my heart?


I could say that you'll soon be back, dear
To fool the whole town may be smart
I'll tell them you'll soon be back, dear
But what will I tell my heart?",What Will I Tell My Heart?,1957
Stan Getz,"Don't worry 'bout me
I'll get along
Forget about me
Just be happy my love

Let's say that our little show is over
And so the story ends
Why not call it a day the sensible way
And still be friends

Look out for yourself
That should be the rule
Give your heart and your love
To whomever you love
Darlin' don't be a fool

Why do we cling to this old faded thing
That used to be
So if you can forget
Then don't worry 'bout me

Why should we cling to some old faded thing
That used to be
So if you can forget
Then you don't worry 'bout me",Don't Worry 'Bout Me,1957
Stan Getz,"When I was a young man courting the girls
I played me a waiting game
If a maid refused me with tossing curls
I'd let the old Earth take a couple of whirls
While I plied her with tears in lieu of pearls
And as time came around she came my way
As time came around, she came

When you meet with the young girls early in the Spring
You court them in song and rhyme
They answer with words and a clover ring
But if you could examine the goods they bring
They have little to offer but the songs they sing
And the plentiful waste of time of day
A plentiful waste of time

Oh, it's a long, long while from May to December
But the days grow short when you reach September
When the autumn weather turns the leaves to flame
One hasn't got time for the waiting game

Oh, the days dwindle down to a precious few
September, November
And these few precious days I'll spend with you
These precious days I'll spend with you",Ballad Medley: I'm Thru With Love/Without a Word of Warning/Sweet Lorra,1957
Stan Getz,"Somewhere, someday
Well be close together, wait and see
Oh by the way,
This time the dreams on me

You take my hand
And you look at me adoringly
But as things stand
This time the dreams on me

It would be fun
To be certain that I'm the one
To know that I, at least, supply the shoulder you cry upon

To see you through
Till you're everything you want to be
It can't be true, but
This time the dreams on me

It would be fun
To be certain that I'm the one
To know that I, at least, supply the shoulder you cry upon

To see you through
Till you're everything you want to be
It can't be true, but
This time the dreams on me",Ballad Medley: On the Alamo/Stompin' at the Savoy/This Time the Dreams,1957
Stan Getz,"Your my funny Valentine, sweet comic Valentine, 
You make me smile with my heart, 
Your looks are laughable, un-photo-graphical, 
Yet youÃ‚Â´re my favorite work of art 
 
Is your figure less than Greek? 
Is your mouth a little weak? 
When you open it to speak, are you smiling? 
But donÃ‚Â´t change a hair for me, 
Not if you care for me. 
Stay little valentine, stay! 
Each day is ValentineÃ‚Â´s Day 
 
Each day is ValentineÃ‚Â´s Day",My Funny Valentine,1957
Stan Getz,"Yesterdays, yesterdays
Days I knew as happy
Sweet sequester days
Olden days, golden days
Days of mad romance and love

Then gay youth was mine, truth was mine
Joyous free and flaming life
Forsooth, was mine
Sad am I, glad am I
For today Iâ€™m dreaming of yesterdays

Yesterdays, yesterdays
Days I knew as happy
Sweet sequester days
Olden days, golden days
Days of mad romance and love

Then gay youth was mine, truth was mine
Joyous free and flaming life
Forsooth, was mine
Sad am I, glad am I
For today Iâ€™m dreaming of yesterdays

Yesterdays, yesterdays
Days I knew as happy
Sweet sequester days
Olden days, golden days
Days of mad romance and love

Then gay youth was mine, truth was mine
Joyous free and flaming life
Forsooth, was mine
Sad am I, glad am I
For today Iâ€™m dreaming of yesterdays
Yesterdays",Yesterdays,1957
Stan Getz,"It's very clear, our love is here to stay
Not for a year but ever and a day
The radio and the telephone and the movies that we know
May just be passing fancies and in time may go

But oh, my dear, our love is here to stay
Together we're going a long, long way
In time the Rockies may crumble, Gibraltar may tumble
They're only made of clay
But our love is here to stay

In time the Rockies may crumble, Gibraltar may tumble
They're only made of clay
But our love is here to stay",Love Is Here to Stay,1957
Stan Getz,"When I hear that Serenade in blue
I'm somewhere in another world, alone with you
Sharing all the joys we used to know
Many moons ago

Once again your face comes back to me
Just like the theme of some forgotten melody
In the album of my memory
Serenade in blue

It seems like only yesterday
The small cafe, a crowded floor
And as we danced the night away
I hear you say forever more
And then the song became a sigh
Forever more became goodbye
Cause you remained in my heart, but

Tell me darling in there still a spark?
Or only lonely ashes of the flame we knew
Should I go on whistling in the dark,
Serenade in blue",Serenade in Blue,1957
Stan Getz,"Flamingo, like a flame in the sky
Flying over the island
To my lover nearby

Flamingo, with your tropical hue
For it's you I rely on
And the love that is true

The wind sings a song to you as you go
The song that I hear below
The murmuring heart

Flamingo, when the sun meets the sea
Say farewell to my lover
And hasten to me

Ah, oh, ah, oh, oh, oh
Flamingo
Flamingo

Flamingo, when the sun meets the sea
Say farewell to my lover
And hasten to me

Ah, oh, oh, oh, oh, ah",Flamingo,1957
Stan Getz,"I'm a very ordinary man
Trying to work out life's happy plan
Doing unto others as I'd like to have them doing unto me

When I find a very lonely soul
Soon be-kinda-comes my only goal
I feel so much better when I tell them my philosophy

I want to be happy
But I won't be happy
Till I make you happy too.

Life's really worth living
When we are mirth giving
Why can't I give some to you

When skies are gray and you say you are blue
I'll send the sun smiling through

I want to be happy
But I won't be happy
Till I make you happy too.

When skies are gray and you say you are blue
I'll send the sun smiling through

I want to be happy
But I won't be happy
Till I make you happy too.",I Want to Be Happy,1957
Stan Getz,"I got a big surprise when I saw you smile
I never dreamed that it could be
But now I realize since I saw you smile
There's only happiness for me
So 
Bye bye blues
Bye bye blues

Bells ring
Birds sing
Sun is shining
No more pining
Just we two
Smiling thru
Don't sigh
Don't cry
Bye bye blues
Blues",Bye Bye Blues,1957
Stan Getz,"For all we know
We may never meet again
Before we go
Make this moment live again
We won't say goodbye
Until the last minute
I'll hold out my hand
And my heart will be in it

For all we know
This might only be a dream
We come and we go
Like the ripples, like the ripples in the stream
So baby, love me, love me tonight
Tomorrow was made for some
Oh, but tomorrow
But tomorrow may never, never come
For all we know
Yes, tomorrow may never, never come
For all we know",For All We Know,1958
Stan Getz,"Some say that love is sweet as a rose,
Some say it's honey and the bee,
Well sit right down and let me tell you
What my love is to me.

""Candy""
I call my sugar ""Candy""
Because I'm sweet on ""Candy""
And ""Candy"" is sweet on me

He/She understands me,
My understanding ""Candy""
And ""Candy""'s always handy
When I need sympathy
I wish that there were four of him/her
So I could love much more of him/her

He/She has taken my complete heart,
Got a sweet tooth for my sweetheart
""Candy""
Its gonna be just dandy
The day I take my ""Candy""
And make him mine all mine
Mine",Candy,1958
Stan Getz,"What good is the scheming, the planning and dreaming
That comes with each new love affair
The dreams that we cherish so often might perish
And leaves you with castles in air

When you're alone, who cares for starlit skies?
When you're alone, the magic moonlight dies
At break of dawn there is no sunrise
When your lover has gone

What lonely hours the evening shadows bring
What lonely hours with memories lingering
Like faded flowers, life can't mean anything
When your lover has gone",When Your Lover Has Gone,1958
Stan Getz,"This lovely day will lengthen into evening
We'll sigh goodbye to all we ever had
Alone where we have walked together
I'll remember April and be glad

I'll be content you loved me once in April
Your lips were warm and love and spring were new
I'm not afraid of autumn and her sorrow
For I'll remember April and you

The fire will dwindle into glowing ashes
For flames live such a little while
I won't forget but I won't be lonely
I'll remember April and smile",I'll Remember April,1958
Stan Getz,"It begins to tell
'Round midnight, midnight
I do pretty well, till after sundown
Suppertime I'm feelin' sad
But it really gets bad
'Round midnight

Memories always start 'round midnight
Haven't got the heart to stand those memories
When my heart is still with you
And ol' midnight knows it, too
When a quarrel we had needs mending
Does it mean that our love is ending
Darlin' I need you, lately I find
You're out of my heart
And I'm out of my mind

Let our hearts take wings'
'Round midnight, midnight
Let the angels sing
For your returning
Till our love is safe and sound
And old midnight comes around
Feelin' sad
Really gets bad
Round, Round, Round Midnight",'Round Midnight,1960
Stan Getz,"Once I laughed when I heard you saying
That I'd be playing solitaire
Uneasy in my easy chair
It never entered my mind

And once you told me I was mistaken
That I'd awaken with the sun
And ordered orange juice for one
It never entered my mind
You had what I lack, myself
Now I even have to scratch my back myself

Once you warned me that if you scorned me
I'd say a lonely prayer again
And wish that you were there again
To get into my hair again
It never entered my mind

Once you warned me that if you scorned me
I'd say a lonely prayer again
And wish that you were there again
To get into my hair again
It never entered my mind",It Never Entered My Mind,1960
Stan Getz,"If ever I would leave you, it wouldn't be in summer.
Seeing you in summer I never would go.
Your hair streaked with sun-light, your lips red as flame, your face with a luster.
That puts gold to shame.

But if I'd ever leave you, it couldn't be in autumn.
How I'd leave in autumn I never will know.
I've seen how you sparkle, when fall nips the air.
I know you in autumn, and I must be there.

And could I leave you running merrily through the snow
Or on a wintry evening when you catch the fire's glow

If ever I would leave you, how could it be in spring-time
Knowing how in spring I'm bewitched by you so
Oh, no! not in spring-time.
Summer, winter or fall.
No, never could I leave you at all.

No, never could I leave you at all.",If Ever I Would Leave You [*],1960
Stan Getz,"In A Sentimental Mood 
I can see the stars come thru my room
While your loving attitude
Is like a flame that lights the gloom
On the wings of ev'ry kiss 
Drift a melody so strange and sweet
In this sentimental bliss you make my 
Paradise complete
Rose pearls seem to fall
It's all like a dream to call you mine
My heart's lighter thing 
Since you made me this night a thing divine
In A Sentimental Mood 
I'm within a world so heavenly
For I never dreamt 
That you'd be loving sentimental me
In A Sentimental Mood 
I can see the stars come thru my room
While your loving attitude 
Is like a flame that lights the gloom
On the wings of ev'ry kiss 
Drift a melody so strange and sweet
In this sentimental bliss you make my 
Paradise complete
Rose pearls seem to fall
It's all like a dream to call you mine
My heart's lighter thing 
Since you made me this night a thing divine
In A Sentimental Mood 
I'm within a world so heavenly
For I never dreamt 
That you'd be loving sentimental me",In a Sentimental Mood,1960
Stan Getz,"Younger than springtime are you
Softer than starlight are you
Warmer than winds of June
Are the gentle lips you gave me

Gayer than laughter are you
Sweeter than music are you
Sunlight and moon beans
Heaven and earth
Are you to give me
And when your youth and joy
Invade my soul
And fill my heart
As now they do, then

Younger than springtime am I
Gayer than laughter am I
Sunlight and moon beans
Heaven and earth
Am I with you",Younger Than Springtime,1961
Stan Getz,"The man who only lives for making money
Lives a life that isn't necessarily sunny
Likewise the man who works for fame

There's no guarantee that time won't erase his name
The fact is, the only work that really brings enjoyment
Is the kind that is for girl and boy meant
Fall in love and you won't regret it
That's the best work of all, if you can get it
Holding hands at midnight

'Neath a starry sky
Nice work if you can get it
And you can get it if you try
Strolling with the one girl
Sighing sigh after sigh
Nice work if you can get it
And you can get it if you try

Just imagine someone
Waiting at the cottage door
Where two hearts become one
Who could ask for anything more?
Loving one who loves you
And then taking that vow
It's nice work if you can get it
And if you get it, won't you tell me how?""

Just imagine someone
Waiting at the cottage door
Where two hearts become one
Who could ask for anything more?
Loving one who loves you
And then taking that vow
Nice work if you can get it
And if you get it, won't you tell me how?""",Nice Work If You Can Get It,1961
Stan Getz,"Girl flower, girl flower, girl flower, Girl flower, girl flower, girl flower Woman, girl flower, love, first love, This odespertar of a song That ha sleeps sky in the heart, and today fair love to arrive, to amorcantar Woman, girl flower, love, first love, This despertarde a song that ha sleeps sky in the heart, and today fair love to arrive, amorcantar
",Menina Flor,1963
Stan Getz,"This is just a little samba
Built upon a single note
Other notes are bound to follow
But the root is still that note

Now this new note is the consequence
Of the one we've just been through
As I'm bound to be
The unavoidable consequence of you

There's so many people
Who can talk and talk, and talk
And just say nothing
Or nearly nothing

I have used up all the scale
I know and at the end
I've come to nothing
I mean nothing

So I come back to my first note

As I come back to you
I will pour into that one note
All the love I feel for you

Any one who wants the whole show
Re mi fa so la ci do
He will find himself with no show
Better play the note you know

So I come back to my first note
As I come back to you
I will pour into that one note
All the love I feel for you

Any one who wants the whole show
Re mi fa so la ci do
He will find himself with no show
Better play the note you know",One Note Samba,1964
Stan Getz,"Podem me chamar e me pedir e me rogar
E podem mesmo falar mal, ficar de mal que nÃ£o faz mal

Podem preparar milhÃµes de festas ao luar
Que eu nÃ£o vou ir, melhor nem pedir, que eu nÃ£o vou ir, nÃ£o quero ir
E tambÃ©m podem me intrigar e atÃ© sorrir e atÃ© chorar
E podem mesmo imaginar o que melhor lhes parecer

Podem espalhar que estou cansado de viver
E que Ã© uma pena para quem me conheceu
Eu sou mais vocÃª e eu

Podem espalhar que estou cansado de viver
E que Ã© uma pena para quem me conheceu
Eu sou mais vocÃª e eu",Eu E Voce (Me and You),1964
Stan Getz,"Bim bom bim bim bom bom
Bim bom bim bim bom bim bom
Bim bom bim bim bom bom
Bim bom bim bim bom bim bim

Ã‰ sÃ³ isso o meu baiÃ£o
E nÃ£o tem mais nada nÃ£o
O meu coraÃ§Ã£o pediu assim, sÃ³

Bim bom bim bim bom bom
Bim bom bim bim bom bim bom
Bim bom bim bim bom bom
Bim bom bim bim bom bim bim

Ã‰ sÃ³ isso o meu baiÃ£o
Que nÃ£o tem mais nada nÃ£o
O meu coraÃ§Ã£o pediu assim, sÃ³

Bim bom bim bim bom bom
Bim bom bim bim bom bom

SÃ³ Bim bom, bim bom, bim bim",Bim Bom,1964
Stan Getz,"Um cantinho e um violÃ£o
Este amor, uma canÃ§Ã£o
Pra fazer feliz a quem se ama

Muita calma pra pensar
E ter tempo pra sonhar

Da janela vÃª-se o Corcovado
O Redentor que lindo

Quero a vida sempre assim com vocÃª perto de mim
AtÃ© o apagar da velha chama

E eu que era triste
Descrente deste mundo
Ao encontrar vocÃª eu conheci
O que Ã© felicidade meu amor

O que Ã© felicidade, o que Ã© felicidade",Corcovado (Quiet Nights of Quite Stars) [*],1964
Stan Getz,"Olha que coisa mais linda
Mais cheia de graÃ§a
Ã‰ ela, menina
Que vem e que passa
Num doce balanÃ§o
A caminho do mar

MoÃ§a do corpo dourado
Do sol de Ipanema
O seu balanÃ§ado Ã© mais que um poema
Ã‰ a coisa mais linda que eu jÃ¡ vi passar

Ah, por que estou tÃ£o sozinho?
Ah, por que tudo Ã© tÃ£o triste?
Ah, a beleza que existe
A beleza que nÃ£o Ã© sÃ³ minha
Que tambÃ©m passa sozinha

Ah, se ela soubesse
Que quando ela passa
O mundo inteirinho se enche de graÃ§a
E fica mais lindo
Por causa do amor

Tall and tan and young and lovely
The girl from Ipanema goes walking
And when she passes, each one she passes goes ah

When she walks, she's like a samba
That swings so cool and sways so gentle
That when she passes, each one she passes goes ooh

(Ooh) But I watch her so sadly
How can I tell her I love her
Yes I would give my heart gladly
But each day, when she walks to the sea
She looks straight ahead, not at me

Tall, (and) tan, (and) young, (and) lovely
The girl from Ipanema goes walking
And when she passes, I smile but she doesn't see (doesn't see)
(She just doesn't see, she never sees me)",GarÃ´ta de Ipanema (The Girl from Ipanema) [*],1964
Stan Getz,"[Instrumental]

",Meditation (MeditaÃ§Ã£o),1964
Stan Getz,"Quiet nights of quiet stars  
quiet chords from my guitar  
floating on the silence that surrounds us 
  
Quiet thoughts and quiet dreams 
Quiet walks by quiet streams 
and a window that looks out on Corcovado 
Oh, how lovely 


Um cantihno, Um violÃ£o         A sweet song, a guitar  
Este amor, Uma canÃ§Ã£o         This love, A song  
P'ra fazer feliz a quem se ama         To make happy whom is loved.  
   
Muita calma p'ra pensar         Much calm to think  
E ter tempo p'ra sonhar         And have time to dream  
Da janela vÃª-se o Corcovado         From the window, Corcovado can be seen  
O Redentor, que lindo!         The Redeemer, how beautifull!  
   
Quero a vida sempre assim         I want life to always be like this.  
Com vocÃ© perto de mim         With you right next to me  
atÃ© o apagar da velha chama.         'till the love ends.  
   
E eu que era triste         And I who was sad  
Descrente deste mundo         Having lost faith in this world  
Ao encontra vocÃª eu conheci         I found you and then I knew  
o que Ã© felicidade, meu amor         what happiness is, my love  
",Corcovado (Quiet Nights of Quiet Stars) [45 rpm Reissue],1964
Stan Getz,"When we played our charade
We were like children posing
Playing at games, acting out names
Guessing the parts we played

Oh what a hit we made
We came on next to closing
Best on the bill, lovers until
Love left the masquerade

Fate seemed to pull the strings
I turned and you were gone
While from the darkened wings
That music box played on

Sad little serenade
Song of my heart's composing
I hear it still, I always will
Best on the bill
Charade",Charade,1964
Stan Getz,"Just picture a penthouse way up in the sky
With hinges on chimneys for stars to go by
A sweet slice of Heaven for just you and I
When we're alone.

From all of society we'll stay aloof
And live in propriety there on the roof.
Two heavenly hermits we will be in truth
When we're alone.

We'll see life's mad pattern
As we view old Manhattan
Then we can thank our lucky stars
That we're living as we are.

In our little penthouse we'll always contrive
To keep love and romance forever alive
In view of the Hudson just over the drive,
When we're alone.

We can thank our lucky stars
That we're living as we are.

In our little penthouse we'll always contrive
To keep love and romance forever alive
In view of the Hudson just over the drive,
When we're alone.",Penthouse Serenade (When We're Alone),1964
