Band,Lyrics,Song,Year
Steve Lawrence,"I was serenely independent
And content before we met.
Surely I could always be that way again - and yet,
I've grown accustomed to her look,
Accustomed to her voice,
Accustomed to her face.

Marry Freddy. What an infantile idea. What a heartless,
wicked, brainless thing to do. But she'll regret it. It's
doomed before they even take the vow.

I can see her now, Mrs. Freddy Eynsford-Hill,
In a wretched little flat above a store.
I can see her now, not a penny in the till,
And a bill collector beating at the door.
She'll try to teach the things I taught her,
And end up selling flowers instead.
Begging for her bread and water,
While her husband has his breakfast in bed.

In a year or so, when she's prematurely grey,
And the blossom in her cheek has turned to chalk,
She'll come home and lo,
He'll have upped and run away,
With a social-climbing heiress from New York.
Poor Eliza. How simply frightful!
How humiliating! How delightful!

How poignant it'll be on that inevitable night
When she hammers on my door in tears and rags.
Miserable and lonely, repentant and contrite,
Will I take her in or hurl her to the walls?
Give her kindness or the treatment she deserves?
Will I take her back or throw the baggage out?

But, I'm a most forgiving man,
The sort who never could, never would,
Take a position and staunchly never budge.
A most forgiving man.

But I shall never take take her back
If she were even crawling on her knees.
Let her promise to atone,
Let her shiver, let her moan,
I'll slam the door and let the hell-cat freeze!

Marry Freddy, HA!

But I'm so used to hear her day,
""Good morning"" every day.
Her joys, her woes,
Her highs, her lows,
Are second nature to me now,
Like breathing out and breathing in.

I'm very grateful she's a woman,
And so easy to forget, rather like a habit
One can always break - and yet,
I've grown accustomed to the trace,
Of something in the air,
Accustomed to her face.",I've Grown Accustomed to Her Face,2003
Steve Lawrence,"Whether you are here or yonder
Whether you are false or true
Whether you remain or wander
I'm growing fonder of you

Even though your friends forsake you
Even though you don't succeed
Wouldn't I be glad to take you
And give you the break you need

More than you know, more than you know
Girl of my heart I love you so
Lately I find you're on my mind
More than you know

Whether you're right, whether you're wrong
Girl of my heart, I'll string along
I need you so
More than you'll ever know

Loving you the way that I do
There's nothing I can do about it
Loving may be all you can give
But, honey, I can't live without it

Oh, how I'd cry, oh how I'd cry
If you got tired and said Goodbye
More than I'd show
More than you'll ever know

More than you'll ever know",More Than You Know,2003
Steve Lawrence,"Love is lovelier the second time around
Just as wonderful with both feet on the ground
It's that second time you hear your love song sung
Makes you think perhaps that love, like youth, is wasted on the young
Love's more comfortable the second time you fall
Like a friendly home the second time you call
Who can say what brought us to this miracle we've found?
There are those who'll bet  love comes but once, and yet
I'm oh, so glad we met the second time around
Who can say what brought us to this miracle we've found?
There are those who'll bet  love comes but once, and yet
I'm oh, so glad we met the second time around",Second Time Around,2003
Steve Lawrence,"You're nobody till somebody loves you
You're nobody till somebody cares
You might be king, you might possess, the world and its gold
But gold won't bring you happiness, when you're growing old

The world still is the same
You'll never change it
As sure as the stars shine above
You're nobody till somebody loves you
So find yourself somebody to love",You're Nobody Till Somebody Loves You,2003
Steve Lawrence,"Try to think that love's not around
Still it's uncomfortably near
My own heart ain't gainin' no ground
Because my angel eyes ain't here

Angel eyes that old devil sent
They glow unbearably bright
Need I say that my love's misspent
Misspent with angel eyes tonight

So drink up, drink up all you people
And order anything you see
Have fun you happy people
The drink, and the laugh's, on me

Pardon me, but I gotta run
The fact's uncommonly clear
I gotta find who's now number one
And why my angel eyes ain't here.

I gotta find who's now the number one
And why my angel eyes ain't here.
'Scuse me while I disappear.",Angel Eyes,2003
Steve Lawrence,"Out of the tree of life I just picked me a plum
You came along and everything's startin' to hum
Still, it's a real good bet, the best is yet to come
Best is yet to come and babe, won't that be fine?
You think you've seen the sun, but you ain't seen it shine
Wait till the warm-up's underway
Wait till our lips have met
And wait till you see that sunshine day
You ain't seen nothin' yet
The best is yet to come and babe, won't it be fine?
Best is yet to come, come the day you're mine
Come the day you're mine
I'm gonna teach you to fly
We've only tasted the wine
We're gonna drain the cup dry
Wait till your charms are right for these arms to surround
You think you've flown before, but baby, you ain't left the ground
Wait till you're locked in my embrace
Wait till I draw you near
Wait till you see that sunshine place
Ain't nothin' like it here
The best is yet to come and babe, won't it be fine?
The best is yet to come, come the day you're mine
Come the day you're mine
And you're gonna be mine",The Best Is Yet to Come,2003
Steve Lawrence,"I'm gonna love you like nobody's loved you, 
Come rain or come shine. 
High as a mountain and deep as a river, 
Come rain or come shine. 
I guess when you met me 
It was just one of those things, 
But don't ever bet me, 
""Cause I'm gonna be true if you let me. 
You're gonna love me like nobody's loved me, 
Come rain or come shine. 
Happy together, unhappy together 
And won't it be fine. 
Days may be cloudy or sunny, 
We're in or we're out of the money, 
But I'm with you always, 
I'm with you rain or shine.",Come Rain or Come Shine,2003
Steve Lawrence,"For once in my life I have someone who needs me
Someone I’ve needed so long
For once unafraid I can go where life leads me and somehow I know I’ll be strong

For once I can touch what my heart used to dream of
Long before I knew
Someone warm like you
Who have my dreams come true

For once in my life I won't let sorrow hurt me
Not like it's hurt me before

For once I have someone I know won't desert me
I’m not alone anymore

For once I can say 
This is mine you can’t take it
As long as I know I have love I can make it
For once in my life I have someone who needs me

For once I can say
This is mine you can’t take it

As long as I know I have love we can make it
For once in my life I have someone who needs me",For Once in My Life,2003
Steve Lawrence,"She gets too hungry for dinner at eight 
She likes the theater and never comes late 
She never bothers with people she'd hate 
That's why the lady is a tramp 

Doesn't like crap games with barons or earls 
Won't go to Harlem in ermine and pearls 
Won't dish the dirt with the rest of the girls 
That's why the lady is a tramp 

She likes the free, fresh wind in her hair 
Life without care 
She's broke, and it's okay 

Hates California, it's cold and it's damp 
That's why the lady is a tramp 

She gets too hungry to wait for dinner at eight 
She loves the theater but never comes late 
She'd never bother with people she'd hate 
That's why the lady is a tramp 

She'll have no crap games with sharpies and frauds 
And she won't go to Harlem in Lincolns or Fords 
And she won't dish the dirt with the rest of the broads 
That's why the lady is a tramp 

She'd love the free, fresh wind in her hair 
Life without care 
She's broke, but it's okay 

Hates California, it's so cold and so damp 
That's why the lady 
That's why the lady 
That's why the lady is a tramp",The Lady Is a Tramp,2003
Steve Lawrence,"I took one look at you
That's all I meant to do
And then my heart stood still

My feet could step and walk
My lips could move and talk
And yet my heart stood still

Though not a single word was spoken
I could tell you knew
That unfelt clasp of hands
Told me so well you knew
I never lived at all
Until the thrill of that moment
When my heart stood still

I took one look at you
That's all I meant to do
And then my heart stopped right there

My feet could step and walk
My lips could move and talk
And yet my heart stood still

Though not a single word was spoken
I could tell you knew
That unfelt claps of hands
Told me so well you knew
I never lived at all
Until the thrill of that moment
When my heart stood still",My Heart Stood Still,2003
Steve Lawrence,"What now my love
Now that you left me
How can I live through another day
Watching my dreams turn into ashes
And all my hopes into bits of clay
Once I could see, once I could feel
Now I am numb
I've become unreal

I walk the night, oh, without a goal
Stripped of my heart, my soul
What now my love
Now that it's over
I feel the world closing in on me
Here come the stars
Tumbling around me
And there's the sky where the sea should be

What now my love
Now that you're gone
I'd be a fool to go on and on
No one would care, no one would cry
If I should live or die

What now my love
Now there is nothing
Only my last goodbye
Only my last goodbye",What Now My Love,2003
Steve Lawrence,"You make me feel so young
You make me feel as though spring has sprung
And every time I see you grin
I'm such a happy in-div-dual

The moment that you speak 
I wanna go play hide and seek
I wanna go and bounce the moon
Just like a toy balloon

You and I are just like a couple of tots 
Runnin' across the meadow 
Pickin' up lots of forget me nots

You make me feel so young 
You make me feel there are 
Songs to be sung 
Bells to be rung 
And a wonderful spring to be sprung
And even when I'm old and gray 
I'm gonna feel the way I do today
'Cause you make me feel so young",You Make Me Feel So Young,2003
Steve Lawrence,"A fine romance, with no kisses.
A fine romance, my friend, this is.
We should be like a couple of hot tomatoes.
But you're as cold as yesterday's mashed potatoes.
A fine romance, you won't nestle.
A fine romance, you won't wrestle.
I've never mussed a crease in your blue serge pants.
I never had the chance.
This is a fine romance. 
A fine romance, my good fellow.
You take romance. I'll take jello.
You calmer than the seals in the Arctic Ocean.
At least they flap their fins to express emotion.
A fine romance, with no quarrels,
With no insults, and all the morals.
You're just as hard to land as the Ile de France.
I never get the chance.
This is a fine romance.

A fine romance, with no kisses.
A fine romance, my friend, this is.
True love should have the thrills that a healthy crime has.
We don't have half the thrills that ""The March of Time"" has.
A fine romance, with no clinches.
A fine romance, with no pinches.
You never give the orchids I send a glance.
No, you like cactus plants.
This is a fine romance.",A Fine Romance,2004
Steve Lawrence,"Only last Saturday,
Or was it yesterday?
I was rehearsing a speech,
Really, I think it's a peach!
Hope you don't think it's a breach
Of recognized etiquette,
(I'm from Connecticut!)
You see the state I'm in,
I mean I'm in a mess!
What was that speech?
Oh yes, yes!

I like the likes of you,
I like the things you do,
I mean I like the likes of you!

I like you're eyes of blue,
I think they're blue, don't you?
I mean I like your eyes of blue!

Oh dear, if I could only say what I mean,
I mean if I could mean what I say,
That is, I mean to say that I mean to say that,

I like the likes of you,
You're looks are pure de-luxe,
Looks like I like the likes of you!

Oh dear, if I could only say what I mean,
I mean if I could mean what I say,
That is, I mean to say that I mean to say that,

I like the likes of you,
You're looks are pure de-luxe,
Looks like I like the likes of you!",I Like the Likes of You,2004
Steve Lawrence,"When hearts are passing in the night, in the lonely night
Then they must hold each other tight, oh, so very tight
And take a chance that in the light, in tomorrow's light
They'll stay together, so much in love

And in the silence of a mist, of a morning mist
When lips are waiting to be kissed, longing to be kissed
Where is the reason to resist and deny a kiss
That holds a promise of happiness?

Though yesterday still surrounds you with a warm and 
precious memory
Maybe for tomorrow we can build a new dream for you and me

This glow we feel is something rare, something really rare
So come and say you want to share, want to really share
The beauty waiting for us there, calling for us there
That only loving can give the heart

When life is passing in the night, in the rushing night
A man, a woman in the night, in the lonely night
Must take a chance that in the light, in tomorrow's light
They'll be together, so much in love
Together, so much in love

So tell me

You're not afraid to take a chance, really take a chance
Let your heart begin to dance, let it sing and dance
To the music of a glance, of a fleeting glance
To the music of romance, of a new romance
Take a chance",A Man and a Woman,2004
Steve Lawrence,"When Madam Pompadour was on a ballroom floor
Said all the gentlemen ""Obviously,""
""The madam has the cutest personality""

And think of all the books about Du Barry's looks
What was it made her the toast of Paree?
She had a well-developed personality

(What did Romeo see in Juliet?)
(Or Figaro in Figarette?)
(Or Jupiter in Juno?)
You know!

And when Salome danced and had the boys entranced
No doubt it must have been easy to see
That she knew how to use her personality

(A girl can learn to spell and take dictation well)
(And never sit on the boss's left knee)
(Unless she's got a perfect personality)

(A girl can get somewhere in spite of stringy hair)
(Or even just a bit bowed at the knee)
(If she can show a faultless personality)

Why are certain girls offered certain things
Like sable coats and wedding rings?
By men who wear their spats right?
(That's right!)

(So don'tcha say ""I'm smart and have the kindest heart""
(Or ""what a wonderful sister I'd be"")
Just tell me how you like my
""Rufff!!
(Personality)

Baby, you've got the cutest
Personality!!",Personality,2004
Steve Lawrence,"Here we are, out of cigarettes, 
Holding hands and yawning; look how late it gets, 
Two sleepy people, by dawn's early light, 
Too much in love to say good-night. 

Say, here we are, in this cozy chair, 
Picking on a wishbone from the Frigidaire, 
Two sleepy people, with nothing to say, 
Much to much in love to break away. 

Do you the remember the nights we used to linger in the hall? 
Papa didn't like you at all, 
But I was crazy 'bout you, baby! 
Do you remember the reason why we married in the Fall? 
To rent this little nest, and get a bit of rest! 

Well, here we are, just about the same, 
Gawky little fellow, dizzy little dame, 
Two sleepy people, by dawn's early light, 
Much to much in love to say good-night. 

Good-night!",Two Sleepy People,2004
Steve Lawrence,"Let someone start believing in you
Let him hold out his hand
Let him touch you and watch what happens

One someone who can look in your eyes
And see into your heart
Let him find you and watch what happens

Cold, no I won't believe your heart is cold
Maybe just afraid to be broken again

Let someone with a deep love to give
Give that deep love to you
And what magic you'll see

Let someone with a deep love to give
Give that deep love to you
And what magic you'll see

Let someone give his heart
Someone who cares like me

Let someone give his heart
Someone who cares like me",Watch What Happens,2004
Steve Lawrence,"Now won't you listen honey, while I say, 
How could you tell me that you're goin' away? 
Don't say that we must part, 
Don't break your baby's heart 

You know I've loved you for these many years, 
Loved you night and day,
Oh! honey baby, can't you see my tears? 
Listen while I say

After you've gone and left me cryin'
After you've gone there's no denyin'
You'll feel blue, you'll feel sad
You'll miss the dearest pal you've ever had

There'll come a time, now don't forget it
There'll come a time when you'll regret it
Someday, when you grow lonely
Your heart will break like mine and you'll want me only
After you've gone, after you've gone away

After you've gone and left me cryin'
After you've gone there's no denyin'
You're gonna feel blue, and you're gonna feel sad
You're gonna feel bad
And you'll miss, and you'll miss,
And you'll miss the bestest pal you ever had

There'll come a time, now don't forget it
There'll come a time when you'll regret it
But baby, think what you're doin'
I'm gonna haunt you so, I'm gonna taunt you so
It's gonna drive you to ruin
After you've gone, after you've gone away.",After You've Gone,2004
Steve Lawrence,"You're walking along the street, or you're at a party
Or else you're alone and then you suddenly dig
You're looking in someone's eyes
You suddenly realize
That this could be the start of something big

You're lunching at ""21"", you're watching your diet
Declining a charlotte russe, accepting a fig
When out of a clear blue sky
It's suddenly gal and guy
And this could be the start of something big

There's no controlling the unrolling of your fate, my friend
Who knows what's written in the magic book
But when a lover you discover at the gate, my friend
Invite her in without a second look

You're up in an aeroplane or dining at Sardi's
Or lying at Malibu, alone on the sand
You suddenly hear a bell
And right away you can tell
That this could be the start of something grand

This could be the start of something very big
Why don't you play your part
Please give your heart to me, and see
This could be the start of something wonderful
Why don't you take a chance
And try romance with me, and see

You're watching the sun come up or counting your money
Or else in a dim cafe, you're ordering wine
Then suddenly there he is
And you want to be where he is
And this must be the start of something
This could be the heart of something
This could be the start of something... big!",This Could Be the Start of Something,2004
Steve Lawrence,"Be Wise,be smart, behave my heart,
Don't upset your cart 
When she's (he's) so close.
Be soft, be sweet, but be discreet,
Don't go off your beat ,
She's (he's) too close for comfort,
Too close, too close for comfort,
Please not again.
Too close, too close to know just
When to say ?when?
Be firm, be fair, be sure,
Beware, on your guard, take care
While there's such temptation.
One thing leads to another,
Too late to run for cover,
She's (he's) Too close for comfort now.",Too Close for Comfort,2004
Steve Lawrence,"You light up my life 
like sunrise in the morning
You make me believe anything is possible
I didn't have a dream to my name
Darkness was mine, it was such a shame
But you came to light up my life
You brought me faith, and hope, 
and love, and light

With your tender smile 
you brought me top the promise
Of life outside a world of nine to five
and Sunday
I didn't know how rich I could be
Until you gave your love to me
Don't you see, you light up my life
You give me faith, and hope, 
and love, and light

You brought your sweet understanding
Like sun rays in my hazy sky
If you hadn't opened up my eyes
Love would have passed me right on by

I never knew how good I could feel
Loving you's left me with nothing to conceal
Yeah.you really light up my life
You give me faith, and hope,
and love, and light
",You Light Up My Life,2004
Steve Lawrence,"I was at a dance when he caught my eye
Standin' all alone lookin' sad and shy
We began to dance, swaying' to and fro
And soon I knew I'd never let him go

Blame it on the bossa nova with its magic spell
Blame it on the bossa nova that he did so well
Oh, it all began with just one little dance
But then it ended up a big romance
Blame it on the bossa nova
The dance of love

(Now was it the moon?)
No, no, the bossa nova
(Or the stars above?)
No, no, the bossa nova
(Now was it the tune?)
Yeah, yeah, the bossa nova
(The dance of love)

Now I'm glad to say I'm his bride to be
And we're gonna raise a family
And when our kids ask how it came about
I'm gonna say to them without a doubt

Blame it on the bossa nova with its magic spell
Blame it on the bossa nova that he did so well
Oh, it all began with just one little dance
But then it ended up a big romance
Blame it on the bossa nova
The dance of love

(Now was it the moon?)
No, no, the bossa nova
(Or the stars above?)
No, no, the bossa nova
(Now was it the tune? )
Yeah, yeah, the bossa nova
(The dance of love)

(Now was it the moon?)
No, no, the bossa nova
(Or the stars above ?)
No, no, the bossa nova",Blame It On the Bossa Nova,2004
Steve Lawrence,"Whether I'm right, whether I'm wrong
Whether I find a place in this world or never belong
I've gotta be me, I've gotta be me
What else can I be but what I am?

I want to live, not merely survive
And I won't give up this dream of life
That keeps me alive
I've gotta be me, I've gotta be me
The dream that I see makes me what I am

That faraway prize, a world of success
Is waiting for me if I heed the call
I won't settle down or settle for less
As long as there's half a chance that I can have it all

I'll go it alone, that's how it must be
I can't be right for somebody else if I'm not right for me
I've gotta be me, I've gotta be me
Daring to try to do it or die, I've gotta be me

I can't be right for somebody else if I'm not right for me
I've gotta be me, I've gotta be me
Daring to try to do it or die,
I've gotta be me",I Gotta Be Me,2004
Steve Lawrence,"Is this the little girl I carried?
Is this the little boy at play?
I don't remember growing older,
When did they?
When did she get to be a beauty?
When did he grow to be so tall?
Wasn't it yesterday when they were small?
Sunrise, sunset.  Sunrise, sunset, 
Swiftly flow the days.
Seedlings turn overnight to sunflowers,
Blossoming even as we gaze.
Sunrise, sunset.  Sunrise, sunset,
Swiftly fly the years.
One season following another,
Laden with happiness and tears.

What words of wisdom can I give them?
How can I help to ease their way?
Now they must learn from one another,
Day by day.
They look so natural together,
Just like two newlyweds should be.
Is there a canopy in store for me?
Sunrise, sunset.  Sunrise, sunset, 
Swiftly fly the years.
One season following another,
Laden with happiness and tears.","Sunrise, Sunset",2004
Steve Lawrence,"Kiss the day goodbye
The sweetness and the sorrow
We did what we had to do
And I can't regret what I did for love, what I did for love

Look my eyes are dry
And towards always tomorrow
It's as if we always knew
But I won't forget what I did for love, what I did for love

Gone, love is never gone
And we cary on, love's what we'll remember

Kiss the day goodbye
And point me toward tomorrow
And wish me luck, the same to you
Won't regret, can't forget what I did for love

What I did for love
What I did for love",What I Did for Love,2004
Steve Lawrence,"You know I love you so,
I'll never let you go,
And darling, I'll be true,
For all my love belongs to you.

You set my world on fire,
You are my one desire,
Tell me you love me too,
For all my love belongs to you.

That's why I want you to know
I could never let you go,
Our love was meant to be.
It would be oh, so thrilling
To know that you were willing
To spend your life with me:

So make your answer, ""Yes!"",
You are my happiness,
And darling, say you do,
For all my love belongs to you.",All My Love Belongs to You,2005
Steve Lawrence,"Bewitched, Bewitched,
You've got me in your spell.
Bewitched, Bewitched,
You know your craft so well.
Before I knew what I was doing
I looked in your eyes
That brand of woo you've been brewin'
Took me by surprise.

You witch, you witch,
One thing is for sure.
That stuff you pitch
Just hasn't got a cure.
My heart was under lock and key,
But somehow it got unhitched.
I never thought that I could be had
But now I'm caught and I'm kinda glad
To be Bewitched.",Bewitched,2005
Steve Lawrence,"When somebody loves you
It's no good unless he loves you, all the way
Happy to be near you 
When you need someone to cheer you, all the way

Taller than the tallest tree is
That's how it's got to feel
Deeper than the deep blue see is
That's how deep it goes, if its real

When somebody needs you
It's no good unless he needs you, all the way
Through the good or lean years
And for all the in between years, come what may

Who know where the road will lead us
Only a fool would say
But if you'll let me love you
It's for sure I'm gonna love you, all the way
All the way","All the Way [From ""The Joker Is Wild""]",2005
