Band,Lyrics,Song,Year
Heart,"Forgive me I can't stay here anymore
I'm leaving with the tide
This evening another breeze blew 'round my door and stirred me up inside
I'm breaking out of this tired old spell
I played it out long and so well
And the phoenix flies straight and high back to Avalon
Now I'm on my way back where I belong

Gonna go down with the sun
Back to Avalon
Where I'm going all my demons disappear
I'm leaving them behind
I'm travelling way up on the atmosphere
'Cause I made up my mind
Gonna find my love
Gonna find my life
Gonna look them so deep in the eye
And the phoenix flies straight and high back to Avalon
Now I'm on my way back where I belong

Gonna go down with the sun
Back to Avalon
Nobody knows what's inside my head or down this road
Oh I know I'm going home
And the phoenix flies straight and high back to Avalon
Now I'm on my way back where I belong

Gonna go down with the sun
And the phoenix flies straight and high back to Avalon
Now I'm on my way back where I belong

Gonna go down with the sun
Back to Avalon",Back to Avalon,1993
Heart,"You're gone from mean street
Each time our eyes meet, I want to touch you
Sudden attraction, such strange reaction
Hold me to you, then you push me away

I want to make you, make you
Make you want to stay
So let me take you, take you
Take you baby all the way

'Cause I feel that desire
You're the flame that feeds my fire
Will you take me higher?
Give me that love that I desire

Learned all that you want, babe
Then why don't you show, babe, don't play with me baby
'Cause I'll find somebody who knows how to love me
So if you want it, you better take it right now

I want to make you, make you
Make you want to stay
So let me take you, take you
Take you baby all the way

'Cause I feel that desire
You're the flame that feeds my fire
Will you take me higher?
Give me that love that I desire

Come on and take me through the night
You know I won't put up a fight
Just wrap your arms around me tight
Tonight, tonight, tonight

Wondered when you make me
It might make you want to stay
If you don't take me
Life might never take me back this way

I feel that desire
You're the flame that feeds my fire
Will you take me higher?
Give me that love that I desire

I feel that desire
You're the flame that feeds my fire
Will you take me higher?
Give me that love that I desire

Desire
Desire
Desire
",Desire,1993
Heart,"Stand at the window
Pull back the lace
I feel the night wind on my face
All that I long for - all that I crave
Am I master, Am I slave?
The night's so still 
I feel the lovers out in the hills
The breathing of young girls lying in bed
Visions of love in their heads
Desire walks on
Desire walks on
A beautiful boy gazed in a pool
His eyes looking back like jewels
The call of the mirror - too strong to resist
The call of the water - the call of a kiss
Desire walks on
Desire walks on
It wants to be held - possessed
It wants consummation
It moves on obsessed
Bloodstream through pipes
Singing in the wires
Heat - motion - control 
Desire walks on
Stand at the window
The world is so still
Calling you back by force of will
Where did you go?
I don't know why
Too much longing inside
You wrapped me in nighttime sexual disguise
I was the love in your eyes
You took me over
My innocence cracked
You own my passion
I want you back
Desire walks on
Desire walks on",Desire Walks On,1993
Heart,"The night is falling like an angel on your memory
And we are well acquainted
We are sworn enemies
And the lonely beating of my heart tonight is only one more thing
I gotta fight

Well I think about you baby, days of heaven that we had
Then I get to thinking maybe, maybe too much thinking's bad
Well, my mind takes no prisoners, pities no one
Spares not even me till the harm is done

Here I go again
The night just walked in
In walks the night
In walks my fantasy
Darkness all around me
And I'm dying for the light

I reach down for a little strength deep inside
Well I know I love my freedom, but lonely feelings come and go
And night time is a season
Feel the cold wind blow

And I toss and I turn and I walk the floor
I don't want to cry don't want to cry no more
Here I go again the night just walked in
In walks the night

In walks my fantasy
Darkness all around me
And I'm dying for the light I reach down for a little strength deep inside
I reach down for my sanity
If only these eyes could see through all the emptiness I found around me
In walks the night

I can almost feel you in the darkness all around
Still I'm waiting for the break of day
Waiting for a miracle a dream that won't wander away
Well my mind takes no prisoners pities no one
It spares not even me till the harm is done

Here I go again
The night just walked in
In walks the night
In walks my fantasy
Darkness all around me
And I'm dying for the light

I reach down for a little strength deep inside
I reach down for my sanity
If only these eyes would see through all the emptiness I found around me

In walks the night
The night just walked in
In walks the night
The night just walked in
Maybe I'll be all right
In walks the night",In Walks the Night,1993
Heart,"I keep my secrets locked up tight
I keep my emotions out of sight
But you got me memorized
What's in my heart, what's behind my eyes

You hold me tight, you hold me fast
Won't let go until the storm has passed
When I finally break down I'm so in love
I ain't afraid to ask, I am not afraid, no

Baby, love me out, love me out of this world
No alibis, no more regrets
You're my wayward angel
You're my saving grace
Sanctify my crazy head

You're there inside me, in my dreams
Sexy poems, cinematic scenes
Shattered lullabies unfold
Sweet suggestions I have never known

Pull down the shade, turn off the light
Oh, my love were all alone tonight
Shadow dancing in slow-mo
For your eyes I will let it show
You can feel me glow

Oh, baby, love me out, love me out of this world
No alibis, no more regrets
You're my wayward angel
You're my saving grace
Sanctify my crazy head

Maybe it's heaven or your sweet suggestion
Holding me in your sway
Carried away in the arms of an angel
You are my saving grace

Baby, love me out, love me out of this world
No alibis, no more regrets, oh
You're my wayward angel
You're my saving grace
Sanctify my crazy head

Oh, baby, love me out now, love me out of this world
No alibis, no more regrets, no more regrets
You're my wayward angel
You're my saving grace
Sanctify my crazy head, oh, ooh",My Crazy Head,1993
Heart,"Hands on the wheel gridlock and steel dogs are barking out in the street
It's a neighborhood war better lock that door
Flesh and blood and cold concrete
Baby can't make it. Baby can't make it
Standing in line at the tabloid shrine in the middle of the public night
Addict consumers consuming the rumors with a killer, killer appetite
RAGE!
Amphetamine vapor on glass in the paper underneath fluorescent night
In the catacombs of Styrofoam out of mind and out of sight
Baby can't make it! Baby can't make it!
RAGE!
Where is the heartbeat?
Not up elite street beating down the little guy
The madness mounts the judge lost count, lost inside a technical lie!
RAGE!",Rage,1993
Heart,"Ring them bells yea heathen 
From the city that dreams
Ring them bells from the sanctuaries 
Cross the valleys and streams
For they're deep and they're wide
And the world's on it's side
And time is running backwards and so is the bride
Ring them bells
Ring them bells
Ring them bells
Ring them bells!

Ring them bells Saint Peter 
Where the four winds blow
Ring them bells with an iron hand so the people will know
That the rush hour is now on the wheel 
And the plow and the sun is going down
Upon the sacred cow
Ring them bells
Ring them bells
Ring them bells
Ring them bells

Ring them bells Saint Martha for the poor man's son
Ring them bells so the world will know that God is one
For the shepherd is asleep where the willows weep
And the mountains are filled with little lost sheep
Ring them bells for the blind and the deaf
Ring them bells for all of us who are left
Ring them bells for the chosen few 
Who would judge the many when the game is through
Ring them bells for the time that flies, 
For the child that cries when
Innocence dies
Ring them bells Saint Catherine 
From the top of the room
Ring them bells from the fortress 
From the lilies that bloom
For the lines they are long 
And the fighting is strong
And they're breaking down the distance 
Between right and wrong

Ring them bells
Ring them bells
Ring them bells
Ring them bells!",Ring Them Bells,1993
Heart,"You haunt my room in the dead of night
I see your face in the firelight
Your hungry kiss I can't forget
But I won't give it to you yet
You got moves make a good girl sweat
You won't catch me in your net
You work your magic on my blues
But I ain't no slave for you to use
I won't beg and I won't crawl
I won't be your voodoo doll
Baby I won't be your voodoo doll
Stirring up a potion of colors
Making me crazy
You got something I can't leave alone
Shaking me
Tremble...you're calling me baby
Heaven help me turn my heart to stone
Hey moon man - don't shine on me
You are dnagerous company
I got treasure in my chest
And the price is high for all the rest
Ain't no snake inside my wall
I won't be your voodoo doll
Baby I won't be your voodoo doll
",Voodoo Doll,1993
Heart,"I´m lying beside you just thinking about us
Too tired to go to sleep and too much in love
I know I´m crazy but I can´t close my eyes
I´m scared you won´t be there in the morning when I rise
Will you be there?
Who do you dream about are you alone in your sleep?
To who will you reach out?
Oh, let it be me
Oh baby, you´re my obsession, my addiction, my drug
Don´t want to be without you when I wake up
Will you be there in the morning, will you be there when I want you?
Will you be there when I wake up, Oh I need you to be there in the morning
Will you be there?

Well, you´re so close to me but I feel so alone
The more I touch you the more I want
Don´t know what to do about me loving you but I pray to God that you feel it too
You´re my obsession, my addiction, my drug, so let the candle grow into a great fire of love
Will you be there in the morning, will you be there when I want you?
Will you be there when I wake up?
I need you to be there in the morning!
I want to love you forever,
Don´t want a love that´s now or never
Can´t you see you got me down on the floor.
I want more, more!

Will you be there in the morning, will you be there when I want you?
Will you be there when I wake up?
Will you be there in the morning?
Will you be there?",Will You Be There (In the Morning),1993
Heart,"Dancing close feeling restless
It`s a slow and sultry night
It`ll take a lifetime till sunrise if you won`t stay with me tonight
Feel your breath caress my shoulder as your heart reads my mind

You don`t have to tell me anything
I can see everything in your eyes
It`s so easy with you
I don`t need an excuse to be the woman in me
It`s so hard to believe that I`m feeling so free to be the woman in me
Baby there`s so much no man has ever touched of the woman in me

I might be trembling but I`m not scared
Just my desire breaking free
I`ve never had a chance like this before to unlock all the doors to be the woman in me
It`s so hard to believe that I`m feeling so free to be the woman in me
Baby there`s so much no man has even touched of the woman in me

Like the dark side of the full moon
I`ve never shown what I`m showing to you
It`s so easy with you I don`t need an excuse to be the woman in me
It`s so hard to believe that I`m feeling so free to be the woman in me
It`s so easy with you. I don`t need an excuse to be the woman in me
It`s so hard to believe that I`m felling so free to be the woman in me",The Woman in Me,1993
Heart,"So this ain't the end, I saw you again, today
I had to turn my heart away
Smiled like the sun, kisses for everyone
And tales, it never fails

You lying so low in the weeds
I bet you gonna ambush me
You'd have me down, down, down on my knees
Now wouldn't you, Barracuda? Oh

Back over time we were all trying for free
You met the porpoise and me
No right, no wrong you're selling a song, a name
Whisper game

If the real thing don't do the trick
You better make up something quick
You gonna burn, burn, burn, burn, burn to the wick
Oooo, Barracuda, oh yeah

""Sell me, sell you"" the porpoise said
Dive down deep to save my head
You, I think you got the blues too

All that night and all the next
Swam without looking back
Made for the western pools, silly, silly fools

If the real thing don't do the trick, no
You better make up something quick
You gonna burn, burn, burn, burn, burn it to the wick
Oooo, barra-barracuda",Barracuda,1995
Heart,"Poor little dreamer
Stand inside the door
You can't find the easy rhymes
Of time you had before

It hurts my heart so bad
Seeing you sigh and shake
Broken down so low, so sad
I can't let you break

Cry to me, cry to me
You better not hide it
Let it come, let it bleed
I ain't laughing, reach in and get it
And set it free
Cry to me, cry to me

The glass is empty and the wine
Is bitter on your tongue
People don't seen wild and fine
Like when you were young

You're lonesome over a stormy ocean
Lost in the rain and wind
We can clear these clouds away
And feel the sun again",Cry to Me,1995
Heart,"Wayfaring warrior Soul, still wild
The archer stands
Arrow measured to the goal, sing of
Strong and living man
In his mind there is a vision wand'ring
Through the forest town
Telling of riches only given if through
The woods the way is found

Crying ""ah! Beautiful dancers wake up
From your sleep!
Ah gentle romancers drink of Love
So sweet!""

Treasure glowing in their eyes, forest
Deepens dark their dream
""Keep to the pathway"" he advise ""the woods
Are more than they might seem""
""Heed you now the apparition bending never
Ending sounds
Call you into her mystery, are your eyes
Not sparkling now?""

Sighing ""ah! Take you no warning,
Make no foolish fight
Ah, think not of morning, lie here
Through the Night!""

""Beauty take us!"" they call ""In my arms!""
They hear her say
Silken web falls, mist illusion rips away
""Helpless! Helpless!"" now they scream
Helpless on the path he stands
And awakens from his dream singing string
Beneath his hand

Gentle archer ages old, release the aim
Free the goal
Roll your arrow to my Soul, release the aim
Free the goal",Dream of the Archer,1995
Heart,"Out of the street, get on home
Tail shaking filly running on her own
They say she got loose on the night
She was born
Cranking it up in a school zone

""Kick it out, kick it out"", she said
""kick out your motor and drive
While you're still alive, kick it out!""

Sitting in a bar in a seaside town
Sweet little love getting high getting down
Sailors see her running along the beach
Laugh and jump out of reach

Wild music blowing in her mane
She needs a bareback rider won't give her
No pain
A hard racy game of give and take
Leaves them dazed, half crazed, in her wake

""Kick it out, kick it out"", she said
""kick out your motor and drive
While you're still alive, kick it out!""",Kick It Out,1995
Heart,"Sweet darlin'
You saved me
I'm hummin'
From the lovin'
You gave me
You went so far
Where my feelings are
Breathing heaven fire
Sweet darlin'

I know you
You stopped running
You knew I had something
To show you
The fever tamed
Like an angel came
Made music of my name
Sweet darlin'

Early that morning we knew I had to fly
Engines were screaming and still I was asking myself why
High on the wind I was feeling my sweet darlin' cry
My heart was breaking
I closed my eyes
Darlin'
Can you hear me
We can't be wrong
The night's song
Pulls you near me
Time just falls
Distance small
I feel you all
Sweet darlin'",Sweet Darlin' [Live],1995
Heart,"Love hurts, love scars
Love wounds and mars
Any heart not tough
Or strong enough
Take a lot of pain
Take a lot of pain
Love is like a cloud
And it holds a lot of rain
Love hurts, (oh), love hurts

You're young, I know
Baby, what's so
I know a thing or two
Oh honey, I learned from you
I really learned a lot
I really learned a lot
Love is like a stove
It burns you when it's hot
Love hurts, (oh), love hurts

Some fools rave, of happiness
Of blissfulness, togetherness
Oh, some fools,
They fool themselves, I guess
They're not fooling me
And I know it isn't true
God, I know it isn't true
Love is just a lie and it's
Made to make you blue
Love hurts, (oh) love hurts
(Oh), love hurts

And I know it isn't true
Oh, I know it isn't true
Love is just a lie and it's
Made to make you blue
Cause love hurts
Early in the morning you hurt,
Love hurts, (oh), love hurts",Love Hurts,1995
Heart,"One heart can make a difference 
One choice can change it all 
One voice can travel the distance 
And be heard all around the world 

Would you make a sacrifice 
If you knew that it was right? 
Well the answers there if you look inside 
Will you run and hide or will you fight the fight? 

Cause there's a power inside you 
And there's a battle to be won 
And every victory has a beginning 
The way it always has begun 
With the power of one 

Yeah yeah yeah yeah 

One day, you'll realize it 
That one hope is all you need 
One dream that we can all share 
One dream we all believe 

And we will make that sacrifice 
Just becasue we know it's right 
And we will face the answer that's there inside 
We won't run and hide 
We're gonna fight the fight 

There's a power inside you (inside you) 
There's a battle to be won (be won, be won) 
Every victory has a beginning 
The way it always has begun 
With the power of one 
With the power of one 

Yeah 

We'll look inside 
We won't run and hide 
No, we'll fight the fight 

There's a power inside you (can you feel the power, 
can you feel it, feel it) 
There's a battle to be one (battle to be won) 
Every victory has a beginning 
The way it always has begun 
With the power of one
",Seasons,1995
Heart,"You'd rather have wine than gin
Only the finest by your skin
Always running after Time, catching
You're fancy with rhyme
Shining on the front page again

Hot on the presses today, little queen
Making your passion play, little queen
Nobody knows your melancholy mind,
Little queen

Away from the sellers, the papers said
Your crown was tight and heavy on your head
Still you danced and you sang, all night
The telephone rang
Music kept on playing from your pen.

Hot on the presses today, little queen
Making your passion play, little queen
Nobody knows your melancholy mind,
Little queen

Raining Raining- he knows your Soul ain't free
Raining Raining- he feels you little queen

Slipping away with your gypsy band
Hot on your music and playing a winning hand
He was standing in the line, thinking how you
Moved his mind
Feeling like he held you in his hand",Little Queen,1996
Heart,"The sky was dark this morning
When I raised my head
I stood at the window 
Darkness was my bane

Suddenly a sunbeam arch
Thrilled me to my weary heart
It was the prettiest thing I'd ever seen

I knew I had to keep my love
Keep my love alive
Keep my love keep my love live

Baby I want you to roll me
Hold me in your love
No more habits, promises and jive
Ever since I was a baby girl
Wanted one thing most in this world
It was to keep my love 
Keep my love alive

I want to keep my love 
Keep my love alive
Keep my love keep my love alive

You're up there under the spotlight
Your silver trophy shines
With all you got, my Lord
You must get high
You need a whole lot more than money
You need more than to survive
You gotta keep your love
Keep your love alive",Love Alive,1996
Heart,"The dust is gathering where I stand
Now I know there's a crack in this plan
After a while there just ain't no more
Magic, man

I got a need
I got to know
Give me the truth who is running my show
Tell them I'm sorry but I just had to go

My patience ran out
I gotta run
Out of a habit that used to be fun

I just wanna break
Shake it, shake it, shake it off
Take off, break it off
Break, break

Break me outta here
You know what it's about
Let me out, get me out
Break

I go no more respect for the big man
Pulling me down to what he understands
He can't get his mind around no bigger plans
No one is going to tie me to this machine
Giving me formula force fed dreams
Getting more hold on me than it seems

My patience ran out
I gotta run
Out of a habit
That used to be fun

I just gotta break
Shake it, shake it, shake it off
Take off, break it off
Break, break

Break me out of here
You know what it's about
Let me out, get me out
Break",Break,1997
Heart,"Please don't fight me baby
This silence has got to stop
You used to want to know my mind
But now I even hate to bring that up
You get so down
Down on me

All these nights I rocked you
Didn't I lay it on you enough
I always give you something wild
And sweet
But it's hard to keep it up
When you get so down
Down on me

Gently I want to dance you darlin'
Breathin', breathe it in slowly groovin'
Wrapped around in sweet, sweet chains
Feel the romance when we move

You know I can't resist
I got a need for you
Please baby reach into your kindest mind
Tell me what I am going to do
If it all comes down
Down on me",Down on Me,1997
Heart,"Go on cry
Go on cry
Go on cry
Cry cry cry cry

Go on cry, cry, cry
Go on cry
Cry cry cry
",Go on Cry,1997
Heart,"I just found out
It's been too long now
The word is out
Time before didn't they take us hook and punker?
Their ""jive alive"" lines
They were funk
They were hijinx, hijinx, hijinx tonight
We all know better but we just might

Pullin' this off it's gonna take some
Big time schemin'
A fast tap dance, our feet'll be steamin'
Hijinx, hijinx, hijinx, alright
Hi, hi, hijinx, yeah, yeah

You never know, behind the lines
Who's gonna show
Scandal high's been buzzin' through the mayhem
Tonight the word, we heard is
It might be them.
They were hijinx, hijinx, hijinx tonight
They all know better, but we just might

Pullin' this off, it's gonna take some
Big time schemin'
A fast tap dance, our feet'll be steamin'

Hijinx, hijinx, hijinx, alright
Hi, hi, hijinx yeah, yeah
Who's who?
Who's who?
Hi, hi, hijinx, yeah, yeah, yeah
Who's who?
Who's who?",Hijinx,1997
Heart,"Doesn't it look good for flying
Can't wait for high noon to fall into night
Put out my arms the air just takes me
Rising moon calls me into the sky

Up, up I go
Searching on my radio

Pilot through time
Spirit flying
Move with mine
Out of time

Pilot I fell through
From the blue
I just flew
Into you

If the air is high and I hear the moon
I'll find you alright
Wherever you're hiding in the night
I know it won't be long
Your signal's getting strong

Pilot through time
Spirit flying 
Move with mine
Out of time

Pilot I fell through
From the blue
I just flew
Into you",Pilot,1997
Heart,"You are the only ones
You save me from myself
My company shows on me
I've been raised on you

And when it just ain't fair
Nothing's left to do
But sit down here
And have a beer
Whatever the world wants to choose

Don't let it fade
Don't trade love away
Just keep a sweet dream true
Let's go tell the world
To quit turning cold
Just let me be raised on you

We don't have to change just now
We can laugh about the load
I can see us later
Lighted eyes
Likely be laughing
Down the road",Raised on You,1997
Heart,"Step into the light
Your on
Hook into the night
That look from eye to eye
A flash gets passed around
A band of wild angels
Rockin' heaven down

Roll, roll, roll
Roll out the soul
You get that feel
And everybody knows
You're moving their minds
Moving their minds around
Rockin' heaven
Rockin' heaven down

You step into the night
On your way back home
What a scene it was tonight
I'm so glad I'm not alone

That look in your eye
Makes me come unwound
Come on baby let's go
Rockin' heaven down

Roll, roll, roll
Roll out the soul
You get that feel
and everybody knows

You're moving their minds
Moving around
Rockin' heaven down
Rockin' heaven down

Rock me home
Rock me home",Rockin' Heaven Down,1997
Heart,"I'd like to know when you will say hello
When will it be I'd like to see you know
When will you change your mind and say hello?

Something is sending all sensations high
Someone is calling clearly to you now
Look for the one who will not say good-bye

Say Hello
Say Hello

Say Hello to all your secret light inside
Build up your Fire, take a ride I know
There'll be a night when you won't want to hide

Say Hello
Say Hello",Say Hello,1997
