Band,Lyrics,Song,Year
Electric Light Orchestra,"Down, down, you can see them all
Rising gaily to the top
Keep on rising babe, you know you got a long drop
You better cling 'cos it's the done thing

Down, down at the Policeman's ball
They're all dancing in a line
Keep on gruntin' boys, you know you're doin' fine
Come quickly, I've been strangled

Down, down at the Military, yeah
They're all marching round and round, oh
Keep them boots shined and that stiff upper lip down, yeah
Ablution revolution

Down, down at the launching pad
Giant phallus stands erect
Ten thousand tons of waste throb then eject
Look out space, we're gonna change our place

Down, down in old England town
There was air and now there's smoke
Let's build more cars and drive away before we choke
Suddenly it's always night time

Down, down at that nice Trade Fair
All the money gone astray
Let's inflate this price and float away
Just you and me and everyone

",In Old England Town (Boogie #2),1971
Electric Light Orchestra,"Hello Mr. Radio, your friendly station
So glad I am your company, your morning music

My wife she ran away, she left our home
And though you´re here with me, I´m on my own

Hello Mr. Radio, You friendly speaker
You played my request today, request to see her

Your voice comes riding home, across the air
You travel ´round the world, but still you´re here

I heard on the news today, the world is (no) good
But if she returned today, mine could be so good

I look into the sky, your waves rush by
The weather man has lied, it makes me cry

Hello Mr. Radio, do I disturb you
Sometimes, I forget my place, I seem to know you

I miss you when you close, you´ll never know
And when your programmers go, I´m om my own",Mr Radio,1971
Electric Light Orchestra,"Queen of the hours, lies 
Waiting for the wind, 
To blow away the veil of time 
Slowly now the threads of age

Are starting to unwind
*Queen of the hours, 
Along, along, along the path of time, of time 
She is still, the clock shall tell, 
The tale when all is well, is well

Black was the night that 
Came in from the east 
And caused the land to sleep 
Riding on a storm it carved 
A message in the Isabella Creek.

*Repeat
Dawn is the death wish 
Night has passed away 
It left a sacred flower 
Open up the grave and bowed it´s life 
Unto the Queen of the hours.

*Repeat",Queen of the Hours [Quad Mix],1971
Electric Light Orchestra,"Love my baby in the afternoon
But she's cryin'
She's cryin'

Told my baby in the afternoon
But she don't like it
She don't like it
Baby used to love me so.

[Chorus:]
Baby I apologise
For tellin' them dirty lies
I've had my fun
But now it's gone
Baby I apologise.

Loved her in the mornin'
In the evenin' too
But she won't do, what I want to

Kicked me out of my own front room
For my lyin'
My dirty lyin'
Baby you do say

[Chorus]

(Spoken)
You know my darlin'
I was a broken man
And my dreams had fell apart
And then a voice from above
Told me the truth of the world below
And my darlin'
I'd just like to say one more time
Please come back.

[Chorus]

Loved her in the mornin'
In the evenin' too
But she won't do, what I want to

Kicked me out of my own front room
For my lyin'
My dirty lyin'
Baby used to love me so

[Chorus]

[Chorus]",Baby I Apologise [Session Outtake][*],1973
Electric Light Orchestra,"Listen to me sister, i got news from the governor,
And he's heard people shouting from the towers in the city
While their babies grow in test tubes over night

Run and fetch the priest 'cause there's a light on in the building
And there's sounds blowin out in the music of the night
And we should try to get the people out alive

Movin 'cross the ocean with the flag of death a'flyin
The demon butcher pointin out the message on the tide
And the demon light a'sailin at his side

Stormin down the airwaves comes the protest and the prayin
And the love that shone down from the sun to world
No longer could support the life it gave",From the Sun to the World (Boogie No. 1),1973
Electric Light Orchestra,"Listen to me sister, I got news from the Governor
And he's heard people shoutin' from the towers in the city
While their babies grow in test tubes over night

Run and fetch the priest 'cos there's a light on in the building
And there's sounds blowin' out in the music of the night
And we should try to get the people out alive

Movin' 'cross the ocean with the flag of death a'flyin
And the demon butcher pointin' out the message on the tide
And the demon light a'sailin at his side

Stormin' down the airwaves comes the protest and the prayin'
And the love that shone down from the sun to world
No longer could support the life it gave

",From the Sun to the World (Boogie #1),1973
Electric Light Orchestra,"Little darlin' of my life
You keep movin' cross my mind
You gave me a sunny day
Now it looks as if I'll pay

[Chorus:]
Why do they say, bluebird is dead
I can still see her, touch her, my bluebird
The love that she gave, I don't believe, no, no, I don't believe

Bluebird came to me tonight
Waiting patiently for light
She said I know that you will grieve
But my darlin' I must leave

[Chorus]

Bluebird say it is not so
Please I cannot hear you speak
It must be that you're so tired
In the darkness of the night

[Chorus]",Bluebird Is Dead,1973
Electric Light Orchestra,"Saviour of the night came slowly on the silent river
And the lord of life came following, his sins to be forgiven
While the world sat back and laughed away the hours
Till the dawning of the daybreak

I heard them laugh I heard them cry
I saw them praying to the sky
I heard the wind howl in the trees
Down there on bended knee
And I see the light
But I know I must be dreaming

Feel the soul, quiet emotion
Sail on by, helpless devotion
If that's how it feels, it better be real

Take care of your woman
Or you'll never ever see the light
Take heed of the warnin'
Or you know it's gonna be too late

Here, there, everywhere
They keep on movin' without fear
They look me up, they look me down
They press my body to the ground
But I see the light, see the light it's comin' shinin'

And on a summers day
When thoughts are drifting far away
And life is good and real to see
My world is saved and I am free
But in the night
Still I know I must be dreaming",Dreaming of 4000,1973
Electric Light Orchestra,"New Dawn, smiling down the old blue world
Can you feel it, like the first of Spring
The bells are ringing out a little tune for you

Daylight, everyone hears the sound
Hey, Good mornin', how you doin', well I'm doin' fine
It's nearly nine I must be gone
	
I see no sorrow now
Nobody has a care

Hey there, why don't you join me I'll be glad to know you
Take some time out, would you like to work or play
Or wander slowly through this bright new day
Everyone laughs, can't believe what's goin' on round here
New World Risin', everybody kicked their blues away
Not for today but evermore

I see no sorrow now
Nobody has a care

New Day, smiling down on the world
Can you feel it, like the first of Spring
The bells are ringing out a little tune for you",New World Rising/Ocean Breakup (Reprise),1973
Electric Light Orchestra,"Susan spent the weekend at her stately home
Crying at the lions on the garden wall
And then she'd sigh - sneak away
Look at her style - free the day

Oh no not me - I wouldn't
Oh no not me - I couldn't
That's all she says, her money and her place
They just don't mean a thing

Susan met the lords and dukes of everywhere
Smiling kissing wishing that they'd go to hell
And then she'd laugh - wonder why
Take a nap - sit and cry

Oh no not me - I wouldn't
Oh no not me - I couldn't
That's all she says, her money and her place
They just don't mean a thing",Oh No Not Susan,1973
Electric Light Orchestra,"She cried to the Southern wind
About a love that was sure to end
Every dream in her heart was gone
Heading for a showdown

Bad dreamer, what's your name?
Looks like we're riding on the same train
Looks as though there'll be more pain
There's gonna be a showdown

And it's raining, all over the world
It's raining, all over the world
Tonight, the longest night

She came to me like a friend
She blew in on the Southern wind
Now my heart is turned to stone again
There's gonna be a showdown

Save me, oh save me
It's unreal, the suffering
There's gonna be a showdown

And it's raining, all over the world
Raining, all over the world
Tonight, the longest night

Raining, raining
Raining, raining

Raining, all over the world
Raining, all over the world
The longest night

And it's raining, all over the world
Raining, all over the world
Tonight, the longest night

You gotta save me, girl
Well, I'm ready for saving
I'm a fool for you
Ya know I'm ready, yeah
Come on and save me

Can't you feel what you're doing to me, now?
I'm on the run again
Gotta save me",Showdown,1973
Electric Light Orchestra,"Here it comes another lonely day.
Playing the game, I'll sail away
On a voyage of no return to see
If eternal life is meant to be,
And if I find the key, to the eternal dream.
The painted ladies of the Avalon.
Play in the sun, take to the road
To the north there lies the chills of cold, 
To the south there lies, the tales
untold,
But in between their lies, the place
to close your eyes.

And I will stay, I'll not be back, 
Eldorado,
I will be free, of the world
Eldorado

Say goodbye the city's heroes sing
Bird on the wind,
Feel, feel so free
Through the life upon the rooftop
haze,
All the cheating and the broken days,
So through it all I see,
There's nothing left for me.

And I will stay, I'll not be back, 
Eldorado,
I will be free, of the world
Eldorado

Sitting here on top of everywhere,
What do I care,
Days never end.
I know the voyage's end will soon 
be here,
No eternal life is here for me,
And now I found the key,
To the eternal dream.

Then I will stay, I'll not be back,
Eldorado.
I will be free, of the world,
Eldorado
",Eldorado,1974
Electric Light Orchestra,"The dreamer, the unwoken fool, 
High on a hill in Eldorado",Eldorado Finale,1974
Electric Light Orchestra,"The dreamer, the unwoken fool, 
In dreams, no pain will kiss the brow. 
The love of ages fills the head. 
The days that linger there in prey of emptiness, 
Of burned out dreams. 
The minutes calling through the years. 
The universal dreamer rises up above his earthly burden. 
Journey to the dead of night. 
High on a hill in Eldorado.",Eldorado Overture,1974
Electric Light Orchestra,"On the seven seas there was aphantom ship acoming, 
Shinin' in the dead of night, 
I heard the crew a hummin' 
Tunes that sounded like the Rolling Stones and Leonard Cohen. 
But they didn't know the words, 
So I assumed that they was foreign.

But I heard them just the same doctor let me teach 'em, 
I just want to please 'em, doctor let me teach 'em.

I looked up in the sky there was a phantom plane a comin', 
Shinin' in the dead of night, 
I heard the pilot saying, 
Poems that were written by John Keats and Robert Browning. 
But he didn't know the words so, 
I suppose that it was nothing.

But I heard them just the same doctor let me teach 'em, 
I just want to please 'em, doctor let me teach 'em.

Doctor please believe me, I know you won't decieve me, 
But do these things I'm seein', have any hidden meaning. 
It's all good entertainment and it doesn't cost a penny. 
So please doc, let me teach 'em, if I could only reach 'em.

But I heard them just the same doctor let me teach 'em, 
I just want to please 'em, doctor let me teach 'em.",Illusions in G Major,1974
Electric Light Orchestra,"Summer days, where did you go, 
You've let me down so bad, 
Clouds fill the sky, 
Gone is the dream 
My happy hunting ground. 
Wild buffalo played and I never saw a rainy day. 
But it looks like summer days ain't coming back.

March April May, June and July, 
You took me for a fall. 
Big chief he lie, 
Cold wind blows cool, so cold to make you die. 
Mountain breeze, ocean bay and I never saw a rainy day. 
But it looks like them summer days ain't coming back.

Laredo Tornado, 
Adios amigos 
What can you do, when your dream world is gone. 
And your friends and lovers too.

West Winter Street under the ground, 
The air that makes you choke, 
Towers of concrete, hellish go-round, 
Were there when I awoke 
City sky, pouring down with rain 
That can never hope to ease the pain. 
And it looks like summer days ain't coming back.

Laredo Tornado 
Adios amigos. 
Laredo Tornado 
Adios amigos.",Laredo Tornado,1974
Electric Light Orchestra,"Daylight comes to those who live,
But those who die - they never see the sun come.
Shining through their window pane,
They pass away.
Silly girl to be a fool;
You didn't play the golden rule.
'Cause once you're done with one world,
There's another waiting there.

[Chorus]
Help me.  Such a lonely soul,
In dreams,
To leave behind the world.
Mr. Kingdom, help me please,
To find the rainbow's end.
Looking from this empty room;
The corridors of endless gloom
Go crawling through the night,
To meet the dawn that's on the way.
Oh, to sleep, perchance to dream,
To live again those joyous scenes.
The laughter, and the follies
That are locked inside my head

[Chorus x 2]

I can dream of flying high
Above the city's cares, and never be afraid of anyone,
'Cause there ain't no one there.

[Chorus x 3]",Mister Kingdom,1974
Electric Light Orchestra,"Painted lady, stop that closin' in on me, 
Painted lady, you're supposed to be a dream, 
Painted lady, you better stay away from me.

Painted lady, why you loosinin' my tie, 
Painted lady, what's that twinkle in your eye, 
Painted lady, you better stay away from me.

Painted lady, with your jewels and your beads, 
Painted lady, don't you do these dirty deeds, 
Painted lady, you better stay here with me.

Nobody's child til I saw the light of your smile. 
Painted lady, nobody's child, you have set me free.

Nobody's child, you came in and stayed for a while. 
Painted lady, nobody's child, you have set me free.",Nobody's Child,1974
Electric Light Orchestra,"Me I'm just a poor boy, from across the far southland, 
And I've traveled many days to reach this place to mke my stand, 
I fell in with a merry band, and drank away the hours.

Rollin' on, I've been rollin' on, 
And my head is high, from the battle won, 
Laid down my life for the Greenwood

The city boys, and the country boys, they come from miles around, 
To defy their king and country, save the poor folks from the hand, 
Of the thieving dukes and abbotts, and the gentry of the land.

Rollin' on, I've been rollin' on, 
And my head is high, from the battle won, 
Laid down my life for the Greenwood

Sweet Maid Marion, don't you do me no wrong, 
Stay on the right side, the Greenwood is your home, 
The dancing girls and the open fires, the wine that flows like water.

Rollin' on, I've been rollin' on, 
And my head is high, from the battle won, 
Laid down my life for the Greenwood",Poor Boy (The Greenwood),1974
Electric Light Orchestra,"Did you see your friend, crying from his eyes today? 
Did you see him run through the streets and far way?

Did you see him run? Did you see him fall? 
Did his life flash by on the bedroom door?

Did you hear the news came across the air today?
Someone has been found on the rocks down in the bay

Did you see him hide? Did you see him crawl? 
Does his life mean more than it did before

Did you see that man running through the streets today? 
Did you catch his face, was it 10538?",10538 Overture [Long Version],1974
Electric Light Orchestra,"Listen to me sister, I got news from the governor, 
And he´s heard people shouting from the towers in the city, 
While their babies grow in test tubes over night.

Run and fetch the priest 'cause there´s a light on in the building, 
And there´s sounds blowin out in the music of the night, 
And we should try to get the people out alive.

Movin´ cross the ocean with the flag of death a'flyin', 
The demon butcher pointin' out the message on the tide, 
And the demons light a´sailin' at his side.

Stormin' down the airwaves comes the protest and the prayin', 
And the love that shone down from the sun to the world, 
No longer could support the life it gave.","From the Sun to the World (Boogie, No. 1)",1974
Electric Light Orchestra,"Down, down, you can see them all
Rising gaily to the top
Keep on rising babe you know you got a long drop
You better cling cos it's the done thing

Down, down, at the Policeman's Ball
They're all dancing in a line
Keep on gruntin' boys you know you're doin' fine
Come quickly I've been strangled

Down, down, at the Military
They're all marching round and round
Keep them boots shined and that still upper lip down
Ablution Revolution

Down, down, at the launching pad
Giant phallus stands erect
Ten thousand tons of waste throb then eject
Look out space, we're gonna change our place

Down, down, in old England Town
There was air and now there's smoke
Let's build more cars and drive away before we choke
Suddenly it's always night time

Down, down, at that nice Trade Fair
All the money gone astray
Let's inflate this price and float away
Just you and me and everyone","In Old England Town (Boogie, No. 2)",1974
Electric Light Orchestra,"Queen of the hours, lies 
Waiting for the wind, 
To blow away the veil of time 
Slowly now the threads of age

Are starting to unwind
Queen of the hours, 
Along, along, along the path of time, of time 
She is still, the clock shall tell, 
The tale when all is well, is well

Black was the night that 
Came in from the east 
And caused the land to sleep 
Riding on a storm it carved 
A message in the Isabella Creek.

Dawn is the death wish 
Night has passed away 
It left a sacred flower 
Open up the grave and bowed it´s life 
Unto the Queen of the hours.",Queen of the Hours,1974
Electric Light Orchestra,"Gonna write a little letter, gonna mail it to my local DJ
It's a jumping little record I want my jockey to play
Roll over Beethoven
Gotta hear it again today

My temperature's rising, the juke box's blowing a fuse
My heart's beating a rhythm, singing out rhythm and blues
Roll over Beethoven
Rocking in two by two

Well, if you feel you like it
Go get your lover and reel and rock it
Roll it over and move on up now
Go for cover and reel and rock it
Roll it over
Roll over Beethoven, tell Tchaikovsky the news

Early in the morning I'm giving you my warning
Don't you step on my blue suede shoes
Hey, diddle diddle, gonna play my fiddle
I ain't got nothing to lose
Roll over Beethoven, tell Tchaikovsky the news

She wiggles like a glow worm, dances like a spinning top
She got a crazy partner, you should of seen her reel and rock 
Long as she got a dime
The music will never stop

Roll over Beethoven, roll over Beethoven
Roll over Beethoven, roll over Beethoven
Roll over Beethoven, dig these rhythm and blues?

Roll over Beethoven, roll over Beethoven
Roll over Beethoven, roll over Beethoven
Roll over Beethoven, dig these rhythm and blues?

Roll over Beethoven, roll over Beethoven
Roll over Beethoven, roll over Beethoven
Roll over Beethoven, roll over Beethoven
Roll over Beethoven",Roll Over Beethoven [Long Version],1974
Electric Light Orchestra,"Whisper in the night
Over silent evening air
Angel's gown shines white
All at once you're glad she's there
Daughter of your dream shine a guiding light for me
For I'll be here till light
Whisper in the night
Till she has forgiven me

Night turns into gold
So the tide may turn today
Though God gave the world
It's not mine to throw away
Daughter of your dream shine a guiding light for me
For I'll be here till light
Whisper in the night
Till she has forgiven me
La da da - da
Whisper in the night
Till she has forgiven me

Help to face what the day may bring
Angels sing
You were sent to make the night be kind
What will I find

Snowflake bird she came
Taking grey clouds from your door
Face the midnight sun
You have something to live for
Daughter of your dream shine a guiding light for me
For I'll be here till light
Whisper in the night
Till she has forgiven me
La da da - da
Whisper in the night
Till she has forgiven me",Whisper in the Night,1974
Electric Light Orchestra,"Got a good reason
For taking the easy way out
Got a good reason
For taking the easy way out now
She was a day tripper
One way ticket, yeah
It took me so long to find out
And I found out

She's a big teaser
She took me half the way there
She's a big teaser
She took me half the way there, now
She was a day tripper
One way ticket, yeah
It took me so long to find out
And I found out
Ah, ah, ah, ah, ah, ah

Tried to please her
She only played one night stand
Tried to please her
She only played one night stand, now
She was a day tripper
Sunday driver, yeah
It took me so long to find out
And I found out

Day tripper, day tripper, yeah
Day tripper, day tripper, yeah
Day tripper, day tripper, yeah",Day Tripper,1974
Electric Light Orchestra,"You made a fool of me
But them broken dreams have got to end

Hey, woman, you got the blues
'Cause you ain't got no one else to use
There's an open road that leads nowhere
So just make some miles between here and there
There's a hole in my head where the rain comes in
You took my body and played to win
Ha, ha, woman, it's a cryin' shame
But you ain't got nobody else to blame

Evil woman
Evil woman
Evil woman
Evil woman

Rolled in from another town
Hit some gold, too hard to settle down
But a fool and his money soon go separate ways
And you found a fool lyin' in a daze
Ha, ha, woman, what you gonna do
You destroyed all the virtues that the Lord gave you
It's so good that you're feelin' pain
But you better get your face on board the very next train

Evil woman
Evil woman
Evil woman
Evil woman (hey hey hey)

Evil woman
Evil woman
Evil woman
Evil woman

Evil woman, how you done me wrong
But now you're tryin' to wail a diff'rent song
Ha, ha, funny, how you broke me up
You made the wine, now you drink a cup
I came runnin' ev'ry time you cried
Thought I saw love smilin' in your eyes
Ha, ha, very nice to know
That you ain't got no place left to go

Evil woman
Evil woman
Evil woman (evil woman)
Evil woman

Evil woman (what an evil woman)
Evil woman (such an evil woman)
Evil woman (what an evil woman)
Evil woman (such an evil woman)

Evil woman (what an evil woman)
Evil woman (such an evil woman)
Evil woman (what an evil woman)
Evil woman (such an evil woman)",Evil Woman,1975
Electric Light Orchestra,"You're sailing softly through the sun
In a broken stone age dawn
You fly so high

I get a strange magic
Oh, what a strange magic
Oh, it's a strange magic
Got a strange magic
Got a strange magic

You're walking meadows in my mind
Making waves across my time
Oh no, oh no

I get a strange magic
Oh, what a strange magic
Oh, it's a strange magic
Got a strange magic
Got a strange magic

Oh, I'm never gonna be the same again
Now I've seen the way it's got to end
Sweet dream, sweet dream

Strange magic
Oh, what a strange magic
Oh, it's a strange magic
Got a strange magic
Got a strange magic

It's magic, it's magic, it's magic
Strange magic
Oh, what a strange magic
Oh, it's a strange magic
Got a strange magic
Strange magic
Oh, it's a strange magic
Oh, it's a strange magic

Got a strange magic
Strange magic
Oh, what a strange magic
Oh, it's a strange magic

Got a strange magic
Strange magic
You know I got a strange magic
Yeah I got a strange magic
Strange magic",Strange Magic [U. S. Single Edit][*],1975
Electric Light Orchestra,"Caught in the heat of the night.
There when things ain't goin right
No, no, no, you will remember me...

I came along to see your face,
But the only thing I got from you,
Was telling me it's fantasy,
That you would always be with me,
I can tell you that it's true
I'm waiting here,
But it's alright
It's alright with me,
You better believe me now.

I guess it's like a mountain side,
You gotta climb it to the top,
Floating in a sea of dreams
The only thing that you can see
Is the view above the clouds.	
I'm waiting here,
But it's alright,
Still it's alright with me,
You better believe me now.",Above the Clouds,1976
Electric Light Orchestra,"Sailin' away on the crest of a wave
It's like magic
Oh, rollin' and ridin' and slippin' and slidin'
It's magic

And you, and your sweet desire
You took me higher and higher, baby
It's a livin' thing
It's a terrible thing to lose
It's a given thing
What a terrible thing to lose

Making believe this is what you conceived
From your worst day
Moving in line then you look back in time
To the first day

And you, and your sweet desire
Don't you do it, don't you do it
You took me, oh higher and higher, baby
It's a livin' thing
It's a terrible thing to lose
It's a given thing
What a terrible thing to lose

Takin' a dive 'cos you can't halt the slide 
Floating downstream
So let her go don't start spoiling the show
It's a bad dream

And you, and your sweet desire
You took me higher and higher, baby
It's a livin' thing
It's a terrible thing to lose
It's a given thing
What a terrible thing to lose

It's a livin' thing
It's a terrible thing to lose",Livin' Thing,1976
