Band,Lyrics,Song,Year
Heartless Bastards,"Went out walking on the cloudless night
Down the canyon the moon is so bright
I'm in a fire go in threw my bones
I'm out here and on my own

And the hour is getting late
And the hour is getting late

As I lay underneath this sky
Take all my pain away with the night
Align my way, align my heart
Help me find my way through these parts

And the hour is getting late
And the hour is getting late

All of this time we never saw the sun
And now I'm back here again
All of this time we never saw the sun
And now I'm back here again

And left all I will be all tomorrow
And left all I will be all tomorrow
And all I have one less ghost in my heart
And things are turning round again
And all I have one less ghost in my heart
And it feels like I would never allowed you to let go
And now I, I will be all tomorrow
And now I, I will be all tomorrow",Down in the Canyon,2012
Heartless Bastards,"[Chorus]
And I know whenever you are feeling down
You gotta have, gotta have, you gotta have rock and roll
I know that if you even pick me up
When you gotta have, gotta have, you gotta have rock and roll

Someday when you ever break free
Feeling so down, feeling so down!
Well I know our love is always,
Heading for the wind, heading for the wind!

[Chorus]

Someday when you ever break free
Feeling so down, feeling so down!
Well I know our love is always,
Heading for the wind, heading for the wind!
And no, I never knew oh, oh. 
I know I never knew, oh, oh, oh",Got to Have Rock and Roll,2012
Heartless Bastards,"Oh I know this feeling
From where we've been
No summer season start again
But it isn't top stranger and familiar land
And starting to be candle again

I ain't got this feeling in my heart
I love you like no other
I ain't got this feeling in my heart though

Late in the night
Late in the night
Late in the night

Oh I know this feeling
It's on my mind
Every each other feeling candle light
And this echo through my mind
All this echo is through my mind

Oh I love this feeling in my heart
I love you like no other
I love this feeling in my other no loving

Late in the night
Late in the night
Late int he night

I know how much you were my mind
Oh I ? on my mind
Oh I ? of my mind
Oh I nutch you of my mind
Oh I nutch you of my mind
Oh oh oh, oh oh",Late in the Night,2012
Heartless Bastards,"Well I left my home and started to roll
I knew the beginning here out on my own
? in the sun so woman I skin
Things are observing around the ?

Before a along time I've been on the ?
And I don't need no woman to sing
I'm ? up with all my future is bright
And give me some sunshine give me some shine

I've waited so long, waiting so long
I'm getting used to feeling alone
I'm getting used to out on my own
Before a long while
I thought I would pray
But I know that ? change so wild

I'm low low low, low low low,
Low low low low low low
Low low low low low low


And I open my
And I struggle my fears I can't lie
And it's been so long long time
And it's been such a long time
Down the ?

I'm low low low, low low low,
Low low low low low low
Low low low low low low..

I, I left my home and started to roll
I knew the beginning here out on my own",Low Low Low,2012
Heartless Bastards,"Staring out at the city skylights
A marathon is going down the street
And we're all racing for our own reasons
And sometimes in the middle we all meet

On this long raid home
On this long race home

Into another fork in the road
That's where we decided to part
And no one said anything for hours
We were under the same familiar stars

On this long road home
On this long road home

And went out want to belong

To something more than 
More than our soul
Cause you can't always
Do it alone
Sometimes you just need a 
Need a little help

On this long way home
On this long way home

And oh I ventured so far
That I forgotten what I was running from
And time it takes you so far
And I am longing to be back home

On this long way home
On this long way home
On this long way home

I'm on my way
I'm on my way
I'm on my way
I'm on my way
I'm on my way",Marathon,2012
Heartless Bastards,"Been a while since I felt this way about
Someone that really really like to know you
More I know you, more
All your eyes sing the song to me
And I really really like to move to it
Oh oh ? oh

And ? me oh
Open my ? 
And now we I only for you

All your eyes spending on my head
And all, all this ? of sorrow uh yeah for ? 
Yeah all your eyes spending on my head
And I ? spend of sorrow uh yeah for.

And now I'm ? open my heart
And I only oh only for you
And now I'm just gone don't know what to do
My head is such a cloud if you
And I'm just gone now what to do
My head is such a cloud if you so ? 
I'm tryin uh uh uh
And now I'm just gone don't know what to do
My head is such a cloud if you

All your eyes spending on my head
And all, all this ? of sorrow uh yeah for ? 
Yeah all your eyes spending on my head
And I ? spend of sorrow uh yeah for.

And now I'm ? open my heart
And I only oh only for you",Only for You,2012
Heartless Bastards,"And the wind it blows through the atmosphere 
And the air filled with dust 
Such a far collection within every direction 
Some places I've already been 
And no, drive slow, 
Loneliness too many things have changed 

And no, I just don't look at things the same way now 
Since we parted ways 
Out in the space, I'm alone with 
The only hum of the wheels, they are carrying me 

On to a wild space to breathe in, 
Oh I need it, a wild space to breathe in, whole 
And the sun went down in this little ghost town 
Near the valley of the rio grande 
I need a little bit of whiskey and a little bit of time 
To ease my troubled mind 
Lost love and loneliness, so many things have changed 
And no, I just don't look at things the same way now 
Since we parted ways out in the space, 
I'm alone with the only hum of the wheels, 
They are carrying me on to a wild space to breathe in, 
Oh on to a wild place to breathe in, 
Whole out in the space, 
I'm alone with the with the only hum of the wheels, 
They are carrying me on to a wild space to breathe in, 
Oh on to a wild place to breathe in, 
Whole out in the space.",Parted Ways,2012
Heartless Bastards,"Gone through the window, in the town down ?
The ancients see the ? lead, to the vision that I roam
Into way you never feel or want to know when you are near
Shopping needs the pain that's got ? blowing through my mind
Into way you never feel or want to know when you are near
The simple feeling, simple feeling, the simple feeling
The simple feeling, simple feeling, the simple feeling love

Gone through the window, in the town down ?
The ancients see the ? lead, to the vision that I roam
Into way you never feel or want to know when you are near
And now you walk by, now you walk by ? now you walk by
The simple feeling, simple feeling, the simple feeling
The simple feeling, simple feeling, the simple feeling love

Gone through the window, in the town down ?
The ancients see the ? lead, to the vision that I roam
Into way you never feel or want to know when you are near
And now you walk by, now you walk by, ? now you walk by
The simple feeling, simple feeling, the simple feeling
The simple feeling, simple feeling, the simple feeling love",Simple Feeling,2012
Heartless Bastards,"Spent my time here as a child,
And now I'm passing through here and it's all coming back again.
Dilapidated buildings down on Main.
This small town was crumbling down, it was hard for me to stay.

And, oh, I, I find after all this time,
I am back here filled with all these memories.
Bittersweet, my home skin and bone.
This rust has worn through tearing up beneath the seams.

Driving down Salem Avenue.
It's all so familiar now, but so many things have changed.
And the rain came down all around.
Washed away the industry, washed it to the sea.

And, oh, I, I find after all this time,
I am back here filled with all these memories.
Bittersweet, my home skin and bone.
This rust has worn through tearing up beneath the seams.
And, oh, I want it to be like when I was young.
Oh, I want it to be like when I was young.

Ooh, ooh, ooh.",Skin and Bone,2012
Heartless Bastards,"I have awoken
The spell it has been broken
Went through the cold, cold wind of the eastern snow

Oh, there was a silence comfortable
There is nothing left to say, to say

Oh, we opened up the gates of dawn
Oh yeah, through the gates of dawn
Oh, what the heat that living size
Oh yeah, straight into the sun

I have awoken
The footsteps sound of thunder
I'm such a heavy load
Seven years of slumber

Oh, there was a silence comfortable
There is nothing left to say, to say

Oh, we opened up the gates of dawn
Oh yeah, through the gates of dawn
Oh, what the heat that living size
Oh yeah, straight into the sun

I go out to the sun
And I go on
Sky meets a city
[?] volcano
And I go down
Sky meets a city
Oh I, made it to the sun
Oh I, made it to the sun
Oh, underneath the million skies
Oh I, made it to the sun",Gates of Dawn,2015
Heartless Bastards,"Oh well I'm remembering when
We were so young and innocent oh, oh
So young and free
The smell of pine on my mind
Running through some drudges oh, oh
On the hi-line
Oh it's all the time
So I want to be home

Without you here
Here in my life
I'm so lost
Without you here
Here in my life
It looks like all night

It's been so long without you here
Trying to look out of steer oh, oh
Since you've been gone
Smell of pine on my mind
Running through some drudges oh, oh
On the hi-line
Oh it's all the time
So I want to be home

Without you here
Here in my life
I'm so lost
Without you here
Here in my life
It looks like all night

Oh, it's all the time
So I want to be home

Without you here
Here in my life
I'm so lost
Without you here
Here in my life
It looks like all night",Hi-Line,2015
Heartlight School Singers & Dancers,"Now I've had the time of my life
No, I never felt like this before
Yes I swear it's the truth
And I owe it all to you

'Cause I've had the time of my life
And I owe it all to you

I've been waiting for so long
Now I've finally found someone to stand by me
We saw the writing on the wall 
And we felt this magical fantasy
Now with passion in our eyes 
There's no way we could disguise it secretly
So we take each others hand 
'Cause we seem to understand the urgency
 
Just remember
You're the one thing 
I can't get enough of
So I'll tell you something
This could be love

Because I've had the time of my life
No, I never felt this way before
Yes I swear it's the truth
And I owe it all to you
'Cause I've had the time of my life
And I've searched through every open door 
Till I found the truth
And I owe it all to you

Hey baby, oh yeah yeah yeah

With my body and soul 
I want you more than you'll ever know
So we'll just let it go
Don't be afraid to lose control, no
 
Yes, I know what's on your mind when you say
""Stay with me tonight"" (stay with me)
And remember
You're the one thing 
I can't get enough of
So I'll tell you something
This could be love 

Because I've had the time of my life
No, I never felt this way before
Yes I swear it's the truth
And I owe it all to you
'Cause I've had the time of my life
And I've searched through every open door 
(Never felt this way)
Till I found the truth
And I owe it all to you

Yeah, yeah, yeah, yeah 
Oh, whoa, oh, oh

Now I've had the time of my life
No, I never felt this way before (never felt this way)
Yes I swear it's the truth
And I owe it all to you

I've had the time of my life
No, I never felt this way before (never felt this way)
Yes I swear it's the truth
And I owe it all to you
'Cause now I've had the time of my life
And I've searched through every open door 
Till I found the truth
And I owe it all to you",(I've Had) The Time of My Life,2006
Hearts,"There is something different in the way you're looking at me lately
I'm trying to figure out the riddle, why won't you save me?
Can't seem to get through to you, no, Lord knows I've tried
It's not my decision to keep the distance
Could it be that I have

Tried, tried, tried
One too many times

Don't you know that love ain't used like a riddle?
Na-na-na-na-na-na
Hold me down, just a little
Can we meet in the middle?
'Cause love ain't used like a riddle
Na-na-na-na-na-na
Let me know if you in it
'Cause I can't tell just what the hell you want

Love, na-na-na-na-na, yay
'Cause love ain't used like a riddle
Love, na-na-na-na-na, yay
'Cause I can't tell just what the hell you want

How's this situation's your creation, why so complicated?
It's safe to say that I'm impatient, I've grown tired of waiting
Can't seem to get through to you, no, Lord knows I've tried
Every conversation sounds the same now
Could it be that I have

Tried, tried, tried
One too many times

Don't you know that love ain't used like a riddle?
Na-na-na-na-na-na
Hold me down, just a little
Can we meet in the middle?
'Cause love ain't used like a riddle
Na-na-na-na-na-na
Let me know if you in it
'Cause I can't tell just what the hell you want

Love, na-na-na-na-na, yay
'Cause love ain't used like a riddle
Love, na-na-na-na-na, yay
'Cause I can't tell just what the hell you want

I don't get it, I don't get it, what you want?
I don't get it, I don't get it, what you want?
I don't get it, I don't get it, what you want?
What you want?

'Cause baby, love ain't used like a riddle
Na-na-na-na-na-na
Hold me down, just a little
Can we meet in the middle?
'Cause love ain't used like a riddle
Na-na-na-na-na-na
Let me know if you in it
'Cause I can't tell just what the hell you want

What do you want? (love) na-na-na-na-na, yay
'Cause love ain't used like a riddle
Love, na-na-na-na-na, yay
'Cause I can't tell just what the hell you want",Like a Riddle,2017
Hearts,"I must be a lucky man
I wasn't ready, now I am
Maybe we're part of a bigger plan
I got a plan of loving, loving you

Don't even know what you do
Turned this boy into a fool
I'm a fool for you, fool for ya

How did I turn into somebody that you want, want, want?
I don't even get it how you love me so
I just really gotta let you know
Dude, you deserve so much better, better than me
Got me tripping on my words, I gotta bite my tongue
Don't know what I did to be the lucky one
I just really gotta let you know
Dude, you deserve so much better, better than me
Call me the lucky man, baby, that's all I am

Must be a lucky man
'Cause you turned out a ten
We started out as friends
Then spent a week in bed
Like, are you twenty-one?
When are you twenty-one?
I had a couple too many
And now there's only one

You don't even know what you do
Turned this boy into a fool
I'm a fool for you, fool for ya

How did I turn into somebody that you want, want, want?
I don't even get it how you love me so
I just really gotta let you know
Dude, you deserve so much better, better than me
Got me tripping on my words, I gotta bite my tongue
Don't know what I did to be the lucky one
I just really gotta let you know
Dude, you deserve so much better, better than me
Call me the lucky man (I must be a lucky man) 
Baby, that's all I am (I must be a lucky man)

(I must be a lucky man), I must be a lucky man, oh
(I must be a lucky man), oh yeah, yeah
(I must be a lucky man), I must be a lucky man, oh yeah, yeah
(I must be a lucky man), I must be a lucky man

How did I turn into somebody that you want, want, want?
I don't even get it how you love me so
I just really gotta let you know, babe
Dude, you deserve so much better, better than me
Got me tripping on my words, I gotta bite my tongue
Don't know what I did to be the lucky one
I just really gotta let you know
Dude, you deserve so much better, better than me
Call me the lucky man (I must be a lucky man) 
Baby, that's all I am (I must be a lucky man)
Call me the lucky man (I must be a lucky man) 
Baby, that's all I am (I must be a lucky man)",Lucky Man,
Hearts,"Why do we
Keep pretendin' like there's nothing in between us?
We both know
That the chemistry we feel is so damn obvious, oh

'Cause we get drunk on the weekend, kissin' at the back of the party
It ain't a lot, but wakin' up in the mornin' sayin' we're sorry
Why do we
Keep pretendin' like there's nothin' in between us

Baby, I got too many friends, not enough lovers
I got too many friends, not enough lovers
Baby, I got too many friends, not enough lovers
I got too many friends, too many friends

Baby, I got too many friends, not enough lovers
Stoned in my bed, under my covers
Too many friends, not enough lovers
Baby, I got too many friends, not enough lovers
Stoned in my bed, under my covers
Too many friends (not enough lovers)
Too many friends

They say
That we're just two people looking for a letdown
It's too late
Once we cross that line, there ain't no turning back, no

'Cause we get drunk on the weekend kissin' in the back at the party
It ain't a lot but wakin' up in the mornin' sayin' we're sorry

Baby, I got too many friends, not enough lovers
Stoned in my bed, under my covers
Too many friends, not enough lovers
Baby, I got too many friends, not enough lovers
Stoned in my bed, under my covers
Too many friends (not enough lovers)
Too many friends

Too many friends (not enough lovers)
Too many friends
(Not enough lovers)
(Not enough lovers)

Baby, I got too many friends, not enough lovers
Stoned in my bed, under my covers
Too many friends, not enough lovers
Baby, I got too many friends, not enough lovers
Stoned in my bed, under my covers
Too many friends (not enough lovers)
(Too many friends)

Uh oh, well it's half the fantasy
I don't know, it's not the same to me
Too many friends (not enough lovers)
Too many friends",Too Many Friends,2018
Hearts,"I don't know what you're smoking
But there's a cloud round you
And I can smell your fragrance
Yeah, it's a sweet perfume

And you can tell I'm shaking
But baby, shake it too
'Cause yeah my hands are sweaty
I wanna sweat with you

Yeah, I should leave but that's not what I wanna do

I wanna drown instead
Rather make love in your waterbed
I'm into too deep, over my head
Baby, let's dive into your waterbed

Oh and if you want my heart
You'll find it in the ocean, at the deepest part
I'm in too deep, over my head
Baby, let's dive into your waterbed

I've got some bad intentions
I know you feel them too
Maybe your lips are heaven
Taste like fountain of our youth
So darling, let's get drinking
A Hennessy or two
Until the room is spinning
And I'm alone with you

I wanna drown instead
Rather make love in your waterbed
I'm into too deep, over my head
Baby, let's dive into your waterbed

Oh and if you want my heart
You'll find it in the ocean, at the deepest part
I'm in too deep, over my head
Baby, let's dive into your waterbed

We got a choice, it's whatever you wanna do baby
We're making noise, there ain't no neighbours here to complain and
All night long, no lights on
It's whatever you wanna do

I wanna drown instead
Rather make love in your waterbed
I'm in too deep, over my head
Baby, let's dive into your waterbed

Oh and if you want my heart
You'll find it in the ocean, at the deepest part
I'm in too deep, over my head
Baby, let's dive into your waterbed",Waterbed,2018
Hearts Grow,"ユラユラと歪んだ空へ
君の元へ飛んでゆけ
こんなにも近くに感じてる
ふたつの想い

ずっと側にいたから
空いた隙間大きすぎて
生意気な君の素直な返事
「またね...」が淋しい
見慣れない街で泣いてるなら
側にいなくても笑顔は届けたい
ユラユラと歪んだ空へ
君の元へ飛んでゆけ
こんなにも近くに感じてる
ふたつの想い

ひとり掛けのソファー
真ん中を取りあったね
いつまでも向き合っているために
ふたりは頑張れる
見上げた夜空は 雲が晴れて
夢に向かってる 瞳は変わらない
キラキラと輝く星は
今も君を照らしている
出会った日と変わらぬ空の下
ひとつの誓い
話すときに髪を触るくせが
うつっている
ひとりきりで眠る
胸の痛みさえ きっと絆

ユラユラと歪んだ空へ
君の元へ飛んでゆけ
こんなにも近くに感じてる
ふたつの想い
キラキラと輝く星が
いつもふたり映してる
出会った日と変わらぬ空の下
ひとつの誓い",[Untranslated],2008
Hearts Like Lions,"Don't mind anything that anyone's
Ever said about you
'Cause you got this and they
Know better to mess with you

There's a lot going on and
It's all coming down to you
So what are you gonna do
When it falls on you?

I need to get this through
Get this through
(Do what you do, do what you do)
There's so many things I've wanted
To say to you

The normal is not normal and there's
No such thing you know
Don't blame yourself for what
You can't control

There's a message you're not receiving
And you'll lose all self control
Think of all the good things
And remember you have hope

I need to get this through
Get this through
(Do what you do, do what you do)
There's so many things I've wanted
To say to you
You wanna know what I've been through?
I wanna know, what do you do?
You need to get you through, get you through
Do what you do

You've had about everything
Happen to you now
So what's it like, yeah
Knowing there's a message
You're not receiving?
You're still searching for your soul
Did you find it?
It seems so easy
Oh there you go

I need to get this through
Get this through
There's so many things I've wanted
To say to you
You wanna know what I've been through?
I wanna know, what do you do?
You need to get you through, get you through
Do what you do",Get This Through,2017
Hearts Like Lions,"All I said was
That you better not be afraid
And what it was, was
All these people who were in our way
And now we know that
Regardless it's gonna be okay
Even if we run into another one
We're gonna get right out
You've got to stop this now
It's okay

You thought that you could be just like them whoo ooh whoo ooh
It's just a pretty little phase
It's just a pretty little phase

Just be yourself
You've gotten so far
And now all you want is
To be someone else
You want it, you got it, you had it
Now what's it feel like
Knowing that you
Are trying to be someone else

You thought that you could be just like them whoo ooh whoo ooh
It's just a pretty little phase
It's just a pretty little phase

You thought that you could be just like them whoo ooh whoo ooh
It's just a pretty little phase
It's just a pretty little phase

Whoo ooh whoo ooh
Whoo ooh whoo ooh

Whoo ooh whoo ooh
Whoo ooh whoo ooh

And you thought that you could be just like them whoo ooh whoo ooh
It's just a pretty little phase
It's just a pretty little phase

It's just a pretty little phase
It's just a pretty little phase",Pretty Little Phase,2017
Hearts of Stone,"One day, you'll be on your own
You won't have a shout any more
One day, you'll be in the ground
You're over and out, and
You've missed the last tube home

One day, you'll be on your own
You won't have a shout any more
One day, you'll be in the ground
You're over and out, and
You've missed the last tube home

Woke up this morning, heard someone snoring
Knobheads going on about modern life is boring
Bears have their own music, no-one can prove it
Just like I'm a guy of guys
You think I'm gonna move it

One day, you'll be on your own
You won't have a shout any more
One day, you'll be in the ground
You're over and out, and
You've missed the last tube home

Sum up together, nobody's the wiser
It's life in the sunshine, that's what I would advise her
?

One day, you'll be on your own
You won't have a shout any more
One day, you'll be in the ground
You're over and out, and
You've missed the last tube home

One day, you'll be on your own
You won't have a shout any more
One day, you'll be in the ground
You're over and out, and
You've missed the last tube home

Woooooo!
Yeeeh-haaa!

One day, you'll be on your own
You won't have a shout any more
One day, you'll be in the ground
You're over and out, and
You've missed the last tube home

[Repeat x3]",One Day,1970
Hearts of Stone,"Hoverin' by my suitcase
Tryin' to find a warm place to spend the night
A heavy rain a fallin'
Seems I hear your voice callin'
""It's all right""

A rainy night in Georgia
A rainy night in Georgia
I believe it's rainin' all over the world

Neon signs a flashin'
Taxi cabs and busses passin' through the night
The distant moanin' of a train
Seems to play a sad refrain to the night

A rainy night in Georgia
A rainy night in Georgia
I believe it's rainin' all over the world

How many times I've wondered
It still comes out the same
No matter how you look at it, think of it
You just got to do your own thing

I find me a place in a box car
So I take out my guitar to pass some time
Late at night when it's hard to rest
I hold your picture to my chest
And I'm all right

A rainy night in Georgia
A rainy night in Georgia
I believe it's rainin' all over the world",Rainy Night in Georgia,1970
