Band,Lyrics,Song,Year
Tommy Dorsey & the Pied Pipers,"Never thought I'd fall,
But now I hear love call,
I'm getting sentimental over you

Things you say and do,
Just thrill me through and through,
I'm getting sentimental over you.

I thought I was happy,
I could live without love
Now I must admit,
Love is all I'm thinking of

Won't you please be kind,
And just make up your mind
That you'll be sweet & gentle,
Be gentle with me
Because I'm sentimental over you
",I'm Getting Sentimental over You,1992
Tommy Dorsey & the Pied Pipers,"Let's take a boat to Bermuda
Let's take a plane to Saint Paul
Let's take a kayak to Quincy or Nyack
Let's get away from it all

Let's take a trip in a trailer
No need to come back at all
Let's take a powder to Boston for chowder
Let's get away from it all

We'll travel 'round from town to town
We'll visit ev'ry state
I'll repeat, I love you sweet
In all the forty eight

Let's go again to Niag'ra
This time we'll look at the fall
Let's leave our hut, dear
Get out of our rut, dear
Let's get away from it all",Let's Get Away from It All,1992
Tommy Dorsey & the Pied Pipers,"Marie, Marie, Marie

Marie, the dawn is breaking
Marie, (ooh, Marie) you'll soon be waking
To find you heart is aching
And tears, (and tears) will fall, (will fall) as you recall
The moon in all its splendor
A kiss, (ooh, a kiss) so very tender
The words, ""Will you surrender
To me, (Marie), Marie, (Marie)?""

Marie, you'll soon be waking
To find you heart is aching
And tears, (and tears) will fall, (will fall) as you recall
The moon in all its splendor
A kiss, (ooh, a kiss) so very tender
The words, ""Will you surrender
To me, (Marie), Marie, (Marie) Marie (Marie)?""",Marie,1992
Tommy Dorsey & the Pied Pipers,"I'm not the guy who cared about love
And I'm not the guy who cared about fortunes and such
I never cared much
Oh, look at me now!

I never knew the technique of kissing
I never knew the thrill I could get from your touch
I never knew much
Oh, look at me now!

I'm a new man better than casanova at his best
With a new heart and a brand new start
Why I'm so proud I'm bustin' my vest

So I'm the guy who turned out a lover
Yes I'm the guy who laughed at those blue diamond rings
One of those things
Oh, look at me now!

I'm not the guy who cared about love
And I'm not the guy who cared about fortunes and such
I never cared much
Oh, look at me now!

And I never knew the technique of kissing
I never knew the thrill I could get form your touch
I never knew much
Oh, look at me now!

I'm a new man better than casanova at his very best
With a new heart and a brand new start
I'm so proud I'm bustin' my vest

So I'm the guy who turned out a lover
Yes I'm the guy who laughed at those blue diamond rings
One of those things
Oh, look at me now!
Look at me now!",Oh! Look at Me Now,1992
Tommy Dorsey & the Pied Pipers,"A country dance was being held in a garden
I felt a bump and heard an ""Oh, beg your pardon""
Suddenly I saw polka dots and moonbeams
All around a pug-nosed dream

The music started and was I the perplexed one
I held my breath and said ""May I have the next one?""
In my frightened arms, polka dots and moonbeams
Sparkled on a pug-nosed dream

There were questions in the eyes of other dancers
As we floated over the floor
There were questions but my heart knew all the answers
And perhaps a few things more

Now in a cottage built of lilacs and laughter
I know the meaning of the words ""Ever after""
And I'll always see polka dots and moonbeams
When I kiss the pug-nosed dream",Polka Dots and Moonbeams,1992
Tommy Dorsey & the Pied Pipers,"Don't worry I'm not looking at you
Gorgeous and dressed in blue
Don't worry I'm not looking at you
Gorgeous and dressed in blue
I know it drives you crazy
When I pretend you don't exist
When I'd like to lean in close
And run my hands against your lips
Though we haven't even spoken
Still I sense there's a rapport
So whisper me your number
I'll call you up at home
Whisper me your number
I'll call you up at home
Don't worry I'm not looking at you 
Don't worry I'm not looking at you
Gorgeous and dressed in blue
Don't worry I'm not looking at you
I know you see me see you
As you see me walk on past
When there's nothing more I'd like to do
Then come in close and hear you laugh
Though we haven't even spoken
Still I sense there's a rapport
So whisper me your number
I'll call you up at home
Yea whisper me your number
I'll call you up at home
Whisper me your number
I'll call you up at home
Hmm whisper me your number
I'll call you up at home",Whispering,1998
Tommy Dorsey & the Pied Pipers,"In the still of the night
As I gaze out of my window
At the moon in it's flight
My thoughts all stray, stray to you

In the still of the night
While the world lies in slumber
Oh the times without number
When I say to you

Do you love me
Just like I love you
Are you my life to be
That dream come true
Or will this dream of mine
Will it fade way out of sight

Just like that moon growing dim
Way out on the rim of the hill
In the still of the night",In the Still of the Night,1999
Tommy Dorsey & the Pied Pipers,"Here I go again, I hear those trumpets blow again.
All aglow again, takin' a chance on love.
Here I slide again, about to take that ride again.
Starry-eyed again, takin' a chance on love.

I thought that cards were a frame-up, I never would try.
Now I'm taking that game up and the ace of hearts is high.
Things are mending now, I see a rainbow blending now.
We'll have a happy ending now, takin' a chance on love.

Here I slip again, about to take that trip again.
I got that grip again, takin' a chance on love.
Now I prove again that I can make life move again.
Um - I'm in the groove again, takin' a chance on love.

I walk around with a horse shoe, in clover I lie.
And brother rabbit of course you better kiss your, foot good-bye.
On that ball again I'm ridin' for a fall again.
I'm gonna give my all again takin' a chance on love.",Taking a Chance on Love,2001
Tommy Dorsey Band,"Marie, the dawn is breaking
Marie you'll soon be waking
To find you heart is aching
And tears will fall as you recall
The moon in all its splendor
Your kiss so very tender
The words, will you surrender
To me Marie?",Marie,2010
Tommy Dorsey Orchestra,"Have you met Dolores? She's queen of the forest
Have you met Olivia? Her I'd gladly give ya
Have you met the queen, the rulah, Tallulah
For that gal Tallulah I would fight a duela,
I would climb a hillah, I'll paddle to Priscilla,
But this is getting sillah, I'm getting lots of thrillah, Tallulah
When she starts to lock on to a man to love she wants to fricassee
No one doing the hula, can do what Tallulah can do to me.
I have met Fatima (Fatima is a schemma)
I have met Marquita (Marquita is a cheeta)
I have met Jemima, she's a social climba
I have met Ophelia, she will double deal ya,
Just one girl is Trullah, I'll take Tallulah",I'll Take Tallulah,
Tommy Dorsey Orchestra,"You are the promised kiss of springtime
That makes the lonely winter seem long
You are the breathless hush of evening
That trembles on the brink of a lovely song

You are the angel glow that lights a star
The dearest things I know are what you are
Some day my happy arms will hold you
And some day I'll know that moment divine
When all the things you are, are mine",All the Things You Are,
Tommy Dorsey Orchestra,"Somewhere over the rainbow, way up high
There's a land that I've heard of once in a lullaby.
Somewhere over the rainbow, skies are blue
And the dreams that you dare to dream,
Really do come true.

Someday I'll wish upon a star
And wake up where the clouds are far behind me.
Where troubles melt like lemon drops,
High above the chimney tops,
That's where you'll find me.

Somewhere over the rainbow, blue birds fly
Birds fly over the rainbow
Why then, oh why can't I?
If happy little bluebirds fly beyond the rainbow
Why, oh why can't I?",Over the Rainbow,
Tommy Dorsey Orchestra,"Amapola
My pretty little poppy
You're like that lovely flower, so sweet and heavenly
Since I found you
My heart is wrapped around you
And loving you it seems to beat a rhapsody
Amapola
The pretty little poppy
Must copy its endearing charm from you
Amapola, Amapola
How I long to hear you say, ""I love you.""",Amapola,
Tommy Dorsey Orchestra,"Night and stars above that shine so bright 
The myst'ry of their fading light 
That shines upon our caravan 
 
Sleep upon my shoulder as we creep 
Across the sand so I may keep 
The mem'ry of our caravan 
 
This is so exciting 
You are so inviting 
Resting in my arms 
As I thrill to the magic charms 
Of you beside me here beneath the blue 
My dream of love is coming true 
Within our desert caravan",Caravan,
Tommy Dorsey Orchestra,"Me and my wife live all alone 
In a little log hut we're all our own
She loves gin and I love rum
And don't we have a lot of fun

Ha, ha, ha, you and me
Little brown jug, don't I love thee
Ha, ha, ha, you and me
Little brown jug, don't I love thee
When I go toiling on the farm 
I take the little jug under my arm

Place it under a shady tree
Little brown jug, 'tis you and me
'Tis you that makes me friends and foes
'Tis you that makes me wear old clothes
But, seeing you're so near my nose
Tip her up and down she goes

If all the folks in Adam's race 
Were gathered together in one place
Then I'd prepare to shed a tear
(I'd let them go without a tear) 
Before I'd part from you, my dear

If I'd a cow that gave such milk
I'd dress her in the finest silk
Feed her up on oats and hay
And milk her twenty times a day

I bought a cow from Farmer Jones
And she was nothing but skin and bones
I fed her up as fine as silk
She jumped the fence and strained her milk

And when I die don't bury me at all
Just pickle my bones in alcohol
I'ut a bottle o' booze at my head and feet 
And then I know that I will keep

The rose is red, my nose is too
The violet's blue and so are you
And yet, I guess, before I stop
We'd better take another drop",Little Brown Jug,
Tommy Dorsey Orchestra,"Sing, sing, sing, sing everybody start to sing like dee dee dee, bah bah bah dah
Now you're singin' with a swing
Sing sing sing, sing, everybody start to sing like dee dee dee, bah bah bah dah
Now you're singin' with a swing.

When the music goes around,
Everybody's goes go to town.
But here is one thing you should know
Sing sing sing sing everybody start to sing like dee dee dee, bah bah bah dah
Now you're singin with a swing

Swing swing swing swing, listen to the trumpet swing
Blow blow blow blow, listen to the trombones go

When the music goes around,
Everybody's goes go to town.
But here is one thing you should know
Sing sing sing sing everybody start to sing like dee dee dee, bah bah bah dah
Everybody go!

Sing sing sing sing everybody start to sing like dee dee dee, bah bah bah dah
Now you're singin with a swing
Sing sing sing sing everybody start to sing like dee dee dee, bah bah bah dah
Now you're singin with a swing

Swing swing swing, everybody start to swing
Now your swingin while you sing
When the music goes around, everybody goes to town
Just relax and take is slow

SIng sing
Start singing, keep swinging
Now you're singing with a swing",Sing Sing Sing,
Tommy Dorsey Orchestra,"And now the purple dusk of twilight time
Steals across the meadows of my heart
High up in the sky the little stars climb
Always reminding me that we're apart
You wander down the lane and far away
Leaving me a song that will not die
Love is now the stardust of yesterday
The music of the years gone by.
 
Sometimes I wonder, how I spend
The lonely nights
Dreaming of a song
The melody 
Haunts my reverie
And I am once again with you
When our love was new 
And each kiss an inspiration
But that was long ago
And now my consolation is in the stardust of a song

Besides the garden wall, when stars are bright
You are in my arms
The nightingale 
Tells his fairytale
Of paradise, where roses grew
Though I dream in vain
In my heart it will remain
My stardust melody
The memory of love's refrain.",Star Dust,
Tommy Dorsey Orchestra,"Carolina 
Gave me Dinah; 
I'm the proudest one 
Beneath the Dixie sun. 

News is spreadin' 
'Bout our weddin'; 
I hear church bells ringin', 
Here's the song my heart keeps singin': 

Dinah, 
Is there anyone finer 
In the state of Carolina? 
If there is and you know her, 
Show her! 

Dinah, 
With her Dixie eyes blazin', 
How I love to sit and gaze in 
To the eyes of Dinah Lee! 

Yet, every night, 
My, how I shake with fright, 
Because my Dinah might, 
Change her mind about me! 

But if Dinah, 
Ever wandered to China, 
I would hop an ocean liner, 
Just to be with Dinah Lee! 

Dinah, 
Is there anyone finer 
In the state of Carolina? 
If there is and you know her, 
Show her! 

Dinah, 
With her Dixie eyes blazin', 
How I love to sit and gaze in 
To the eyes of Dinah Lee! 

Yet, every night, 
My, how I shake with fright, 
Because my Dinah might, 
Change her mind about me! 

But if Dinah, 
Ever wandered to China, 
I would hop an ocean!, 
Just to be with Dinah Lee! 
",Dinah [Cha Cha],1958
Tommy Dorsey Orchestra,"""I'm the Sheik of Araby, 
Your love belongs to me.
At night when you're asleep 
Into your tent I'll creep.
The stars that shine above,
Will light our way to love.
You'll rule this land with me;",The Sheik of Araby [Cha Cha],1958
Tommy Dorsey Orchestra,"I'll never smile again 
Until I smile at you 
I'll never laugh again 
What good would it do 

For tears would fill my eyes 
My heart would realize 
That our romance is through 
I'll never love again 
I'm so in love with you 
I'll never thrill again 

To somebody new 
Within my heart 
I know I would never start 
To smile again 
Until I smile at you 
Within my heart 
I know I would never start 
To smile again 

Until I smile at you 
Until I smile at you",I'll Never Smile Again,1994
Tommy Dorsey Orchestra,"Walked with no one and talked with no one
And I had nothing but shadows
Then one morning you passed
And I brightened at last
Now I greet the day and complete the day
With the sun in my heart
All my worry blew away
When you taught me how to say

Grab your coat and get your hat
Leave your worry on the doorstep
Just direct your feet
To the sunny side of the street
Can't you hear a pitter-pat?
And that happy tune is your step
Life can be so sweet
On the sunny side of the street

I used to walk in the shade
With those blues on parade
But I'm not afraid
This Rover crossed over

If I never have a cent
I'd be rich as Rockefeller
Gold dust at my feet
On the sunny side of the street
Grab your street",On the Sunny Side of the Street,1994
Tommy Dorsey Orchestra,"In her sweet little Alice blue gown
When she first wandered down into town
She was both proud and shy as she felt every eye
And in every shop window she primp, passing by

Then in manner of fashion, she'd frown
And the world seemed to smile all around
Till it wilted she wore it, she'll always adore it
Her sweet little Alice blue gown",Alice Blue Gown,2004
Tommy Dorsey Orchestra,"You better get up and do it now, you better get up, my friend, and how,
The land that you love the best, is asking you to invest,
With a personal request from mr. morgenthau.
Dig down deep, to buy the bonds that buy the tanks,
Palmers for our fighting yanks, dig down deep.
Dig down deep to buy the bonds that keep us free, supply the sky, the land and sea,
Dig down deep. put your hand on your gismo, citizen, everybody must do his part,
It's the easiest piece that the citizen to show the world we finish what we start,
Dig down deep, the boys are giving all for you, so the least that you can do,
Is dig down deep.
",Dig Down Deep,2004
Tommy Dorsey Orchestra,"East of the sun and west of the moon,
We'll build a dream house so lovely
Near to the sun in a day, near to the moon at night,
We'll live in a lovely way dear

Living our love in memory
Just you and I, forever and a day,
Love will not die, we'll keep it that way,
Up among the stars we'll find

A harmony of life, too lovely tune
East of the sun and west of the moon, dear,
East of the sun and west of the moon.",East of the Sun,2004
Tommy Dorsey Orchestra,"I'll wake each morning, and I'll promise to laugh
I'll say good morning to your old photograph
And I'll speak to you, dear
(Just as though you were here)

When purple shadows start to welcome the dark
I'll take the same old stroll we took through the park
And I'll cling to you, dear
(Just as though you were here)

(Oh, don't be afraid that distance and time)
Will finally tear us apart
(The farther you go, the longer you stay)
(The deeper you grow in my heart)

Each night before I wander off into sleep
I'll bring to light the tears I've buried so deep
Then I'll kiss you, my dear
(Just as though you were here)

Each night before I wander off into sleep
I'll bring to light the tears I've buried so deep
Then I'll kiss you, my dear
And though you're gone, my love for you goes on, darling
(Just as though you were here)",Just as Though You Were Here,2004
Tommy Dorsey Orchestra,"The moment has come, I hear a drum
Or is it my heart dear, beating this way
There's work to be done, done with a gun
There goes the bugle, I hear it say

It's the last call for love, time to say Fare thee well
Let the taps tell you all that my heart dare not tell

[Chorus:]
With your eyes in the stars of Old Glory
Can I help but be faithful to you
Till we meet on the day we're dreaming of
It's the last call for love

[Chorus]

It's the last call for love, sweetheart",The Last Call for Love,2004
Tommy Dorsey Orchestra,"Let's take a boat to Bermuda
Let's take a plane to Saint Paul
Let's take a kayak to Quincy or Nyack
Let's get away from it all

Let's take a trip in a trailer
No need to come back at all
Let's take a powder to Boston for chowder
Let's get away from it all

We'll travel 'round from town to town
We'll visit ev'ry state
I'll repeat, I love you sweet
In all the forty eight

Let's go again to Niag'ra
This time we'll look at the fall
Let's leave our hut, dear
Get out of our rut, dear
Let's get away from it all",Let's Get Away From It All,2004
Tommy Dorsey Orchestra,"When days are long and nights are lonely
And all my daydreams have gone astray
I think about the one and only
Who's bound to find me some golden day

The one I love is coming along some day
And I'll have none except the one I love
He/She may be near or ever so far away
But I'll have none except the one I love

And though our meeting is left to chance
Until our meeting 
I still will have my dream romance
And through the night I pray to the moon above
To please be kind and find the one I love",The One I Love (Belongs to Somebody Else),2004
Tommy Dorsey Orchestra,"Say it over and over again, 
Over and over again, 
Never stop saying you're mine.
Say it, 
Ever and ever so sweet, 
Ever and ever so sweet just like an old valentine.
When you say I love you, 
The same old I love you, 
They whisper in stories and plays,
You can change I love you, 
The same old I love you, 
To oh such a heavenly phrase.
So say it, 
Softly and gently and then, 
Over and over again, 
Never stop saying you're mine.",Say It,2004
Tommy Dorsey Orchestra,"This love of mine goes on and on
Though life is empty since you have gone
You're always on my mind, though out of sight
It's lonesome through the day
But oh, the night
I cry my heart out, it's bound to break
Since nothing matters, let it break
I ask the sun and the moon
The stars that shine
What's to become of it
This love of mine

I ask the sun and the moon
The stars that shine
What's to become of it
This love of mine
This love of mine goes on and on",This Love of Mine,2004
Tommy Dorsey Orchestra,"Here was I, a gypsy, 
Looking for a world to roam in,
Now the world is in my arms.
No more endless searching for a place to feel at home in,

For the world is in my arms.
Mexican hill flower the sky, 
Sappoco see here in your eye
When I see you smile, 

I see the sunset of Geneva, 
What's that magic in your charms,
When I hold you, 
I hold the world right here in my arms.",The World Is in My Arms,2004
Tommy Dorsey Orchestra,"We use to say our love will stay until the cows come home,
And then the cows came home, do you know why?
We use to say we'll love this way, till Hades freezes over,
And then it just froze over, do you know why?

We thought we had a future dancing a jig for us,
Do you suppose our little dream got too big for us
We use to say our love will stay,
Forever and a night, and now forevers gone,
Darling, do you know why? Neither do I.",Do You Know Why?,2011
Tommy Dorsey Orchestra,"I'm not the guy who cared about love
And I'm not the guy who cared about fortunes and such
I never cared much
Oh, look at me now!

I never knew the technique of kissing
I never knew the thrill I could get from your touch
I never knew much
Oh, look at me now!

I'm a new man better than casanova at his best
With a new heart and a brand new start
Why I'm so proud I'm bustin' my vest

So I'm the guy who turned out a lover
Yes I'm the guy who laughed at those blue diamond rings
One of those things
Oh, look at me now!

I'm not the guy who cared about love
And I'm not the guy who cared about fortunes and such
I never cared much
Oh, look at me now!

And I never knew the technique of kissing
I never knew the thrill I could get form your touch
I never knew much
Oh, look at me now!

I'm a new man better than casanova at his very best
With a new heart and a brand new start
I'm so proud I'm bustin' my vest

So I'm the guy who turned out a lover
Yes I'm the guy who laughed at those blue diamond rings
One of those things
Oh, look at me now!
Look at me now!",Oh! Look At Me Now,2012
Tommy Dorsey Orchestra,"Fools rush in
Where angels fear to tread
And so I come to you my love
My heart above my head

Though I see
The danger there
If there's a chance for me
Then I don't care

Fools rush in
Where wise men never go
But wise men never fall in love
So how are they to know

When we met
I felt my life begin
So open up your heart and let
This fool rush in",Fools Rush In (Where Angels Fear to Tread),2013
Tommy Dorsey Orchestra,"There never was a gal I could love, like I love my Josephine
She's a flirt, she's a scamp, she's the vampiest vamp I've ever seen
It seems to me she's always flirting with the fellows passing by
But when I say she winks, then she tells me she thinks
There's a cinder in her eye
I believe it would be better if I'd leave her and forget
Everybody says it would be wise
But each time that I go out to dance with somebody else
I find myself dancing with tears in my eyes
For there's nobody quite so nice who can be quite so mean 
As my gal, what a gal, Josephine
 
There never was a gal I could love, like I love my Josephine
She's a flirt, she's a scamp, she's the vampiest vamp I've ever seen
It seems to me she's always flirting with the fellows passing by
But when I say she winks, then she tells me she thinks
There's a cinder in her eye
I believe it would be better if I'd leave her and forget
Everybody says it would be wise
But each time that I go out to dance with somebody else
I find myself dancing with tears in my eyes
For there's nobody quite so nice who can be quite so mean 
As my gal, what a gal, Josephine
",Josephine,2013
Tommy Dorsey Orchestra,"Like the beat, beat, beat of the tom tom
When the jungle shadows fall
Like the tick, tick, tock of the stately clock
As it stands against the wall
Like the drip, drip, drip of the raindrops
When the summer show'are is through
So a voice within me keeps repeating
You, you, you.

Night and day
You are the one
Only you beneath the moon 
And under the sun
Whether near to me or far
No matter, darling Where you are
I think of you
Night and day

Day and night
Why it is so
That this longing for you 
Follows wherever I go.
In the roarin' traffic's boom
In the silence of my lonely room
I think of you
Night and day

Night and day
Under the hide of me
There's an oh such a hungry 
Yearnin' burnin' inside of me
And its torment won't be through
'Til you let me spend my life 
Making love to you
Day and night
Night and day",Night and Day,2013
Tommy Dorsey Orchestra,"Don't worry I'm not looking at you
Gorgeous and dressed in blue
Don't worry I'm not looking at you
Gorgeous and dressed in blue
I know it drives you crazy
When I pretend you don't exist
When I'd like to lean in close
And run my hands against your lips
Though we haven't even spoken
Still I sense there's a rapport
So whisper me your number
I'll call you up at home
Whisper me your number
I'll call you up at home
Don't worry I'm not looking at you 
Don't worry I'm not looking at you
Gorgeous and dressed in blue
Don't worry I'm not looking at you
I know you see me see you
As you see me walk on past
When there's nothing more I'd like to do
Then come in close and hear you laugh
Though we haven't even spoken
Still I sense there's a rapport
So whisper me your number
I'll call you up at home
Yea whisper me your number
I'll call you up at home
Whisper me your number
I'll call you up at home
Hmm whisper me your number
I'll call you up at home",Whispering,2013
