Band,Lyrics,Song,Year
Tommy Dorsey,"How much do I love you?
I'll tell you no lie
How deep is the ocean?
How high is the sky?

How many times a day do I think of you?
How many roses are sprinkled with dew?

How far would I travel
To be where you are?
How far is the journey
From here to a star?

And if I ever lost you, how much would I cry?
How deep is the ocean?
How high is the sky?

How far would I travel
To be where you are?
How far is the journey
From here to a star?

And if I ever lost you, how much would I cry?
How deep is the ocean?
How high is the sky?
How high is the sky?",How Deep is the Ocean,2015
Tommy Dorsey,"Sweetheart if you should stray a million miles away
I'll always be in love with you.
Although you find more fish in someone else's dish
I'll always be in love with you.

I can't do any more, I tried so hard to please
But let me thank you for those tender memories

I wish you happiness, as for me sweetheart I guess
I'll always be in love with you.",I’Ll Always Be In Love With You,2015
Tommy Dorsey,"Love Somebody
Doris Day and Buddy Clark
Written by Joan Whitney and Alex Kramer
Peaked at # 1 in 1948
DORIS: Love somebody, yes, I do
Love somebody, yes, I do
Love somebody, yes, I do
I love somebody but I won't say who
Handsome face, six feet tall and his picture's on my wall
Love to be his baby doll
If he kissed me I
wouldn't mind at all
BUDDY: I love somebody, yes, I do
Love somebody, yes, I do
Love somebody, yes, I do
Love somebody but I won't say who
Don't know why she acts so shy, she oughta know I wouldn't dream of even hurtin' a
fly
Hope she doesn't pass me by 'cause if she did I'd die, I know I'd die
BOTH: I love somebody, yes, I do
Love somebody, yes, I do
BUDDY: Love somebody, yes, I do
BOTH: Love somebody but I won't say who
DORIS: He's big and strong
BUDDY Wouldja like to feel my muscle?
BRDORIS: Bold and gay
BRBUDDY: I never once lost a tussle
BRDORIS: At the moment he's not very far away
BRBUDDY: Why don'tcha say who's ""they"" already?
BRDORIS: I'd want to marry him today
BRBUDDY: But you don't say who
BRDORIS: That I cannot do
BRBUDDY: Happen to be me?
BRDORIS: Possibility
BR
BRBUDDY Won'tcha tell me who ya love?
BRDORIS: Love somebody
BRBUDDY: Tell me true
BRDORIS: Yes, I do
BRBUDDY: Yes, you do
BRDORIS: Love somebody
BRBUDDY: I do, too
BRDORIS: And I do
BRBUDDY: Maybe me
BRDORIS: Love somebody
BRBUDDY: I hope it's me
BRBOTH: Love somebody but I won't *say* who
BR
BR
BRBUDDY: see'mon confess
BRDORIS: Why don'tcha try and guess?
BRBOTH: Do tell. Let's tell.
BRDORIS: You promise not to breathe a word?
BRBUDDY: Doris, don't be absurd
BRDORIS: Strictly entre-nous?
BRBUDDY: Oui, oui!! We two
BRDORIS: Well
BRBUDDY: Confidentially
BRDORIS: Between you and me
BRBOTH: Confidentially
BRDORIS: I love somebody
BRBUDDY: I've got news for you
BRDORIS: Love somebody
BRBUDDY: I feel that way, too
BRDORIS: Love somebody
BRBUDDY: Glad it's true
BRBOTH: That somebody that I love is you
BR
BR
BRTRANSCRIBER'S NOTE: *say* One of the singers messed up here. Doris sings ""won't say who""
BRbut Buddy sings ""won't TELL who""
BR
",Love Somebody,2015
Tommy Dorsey,"LULLABY OF BROADWAY
Dorsey Brothers Orchestra

Come on along and listen to, the lullaby of Broadway
The hip hooray and ballyhoo, the lullaby of Broadway
The rumble of a subway train, the rattle of the taxis
The daffydils who entertain, at Angelo's and Maxi's
When a Broadway baby says good night, it's early in the morning
Manhattan babies don't sleep tight until the dawn:

Good night, baby
Good night, milkman's on his way
Sleep tight, baby
Sleep tight, let's call it a day. Hey!

Come on along and listen to, the lullaby of Broadway
The hi-dee-hi and boop-a-doo, the lullaby of Broadway
The band begins to go to town, and everyone goes crazy
You rock-a-bye your baby round, 'til everything gets hazy
Hush-a-bye I'll buy you this and that, you hear a daddy saying
And baby goes home to her flat, to sleep all day:

Good night, baby
Good night, milkman's on his way
Sleep tight, baby
Sleep tight,
Let's call it a day - - -
Listen to the lullaby of old Broadway
",Lullaby of Broadway,2018
Tommy Dorsey & His Orchestra,"[INTRO:]
You're completely unaware, dear, that my heart is in your hand
So for love's sake won't you listen and try to understand?


I dream of you more than you dream I do
How can I prove to you this love is real?
You mean to me more than you mean to be
You just can't seem to see the way I feel

	When I am close to you the world is far away
	The words that fill my heart my lips can't seem to say

I want you so more than you'll ever know
More than you dream I do, I dream of you

I want you so more than you'll ever know
More than you dream I do,         I    dream    of you",I Dream of You,
Tommy Dorsey & His Orchestra,"I should care, I should go around weeping
I should care, I should go without sleeping
Strangely enough, I sleep well
Except for a dream or two
But then I count my sheep well
Funny how sheep can lull you to sleep

So I should care, I should let it upset me
I should care but it just doesn't get me
Maybe I won't find someone as lovely as you
But I should care and I do

I should care but it just doesn't get me
Maybe I won't find someone as lovely as you
But I should care and I do

And I do",I Should Care,
Tommy Dorsey & His Orchestra,"Melancholy serenade every time I hear it played
Right out of space your haunting face appears

There were other serenades broken promises we made
Why must I pay day after day with tears

Alone in my room I watch the ghost of you
Alone in the gloom once more I'm close to you

Melancholy serenade as the music starts to fade
I feel your kiss and then you disappear

Alone in the gloom once more I'm close to you

Melancholy serenade as the music starts to fade
I feel your kiss and then you disappear",Melancholy Serenade,
Tommy Dorsey & His Orchestra,"April showers, overhead offer me a chance
To protect her from the rain and cultivate romance
It's an opportunity, something to enjoy
Helter, skelter fly for shelter I'm a lucky boy
 
Rain, let us cuddle while the rain pitter-patters 
On the pane and we're alone
A chance to while away a dreamy afternoon
A lovely peaceful afternoon 
No one can see us
Rain It's so cozy in the rain
There's no reason to complain she'll wait for you
To hold her hand and then it's ten to one
You kiss her in the rain, rain, rain
 
Rain, let us cuddle while the rain pitter-patters 
On the pane and we're alone
A chance to while away a dreamy afternoon
A lovely peaceful afternoon 
No one can see us
Rain It's so cozy in the rain
There's no reason to complain she'll wait for you
To hold her hand and then it's ten to one
You kiss her in the rain, rain, rain
",Rain,
Tommy Dorsey & His Orchestra,"This love of mine goes on and on,
Though life is empty since you have gone.
You're always on my mind, though out of sight,
It's lonesome through the day,
But oh! the night.
I cry my heart out, it's bound to break,
Since nothing matters, let it break.
I ask the sun and the moon,
The stars that shine,
What's to become of it,
This love of mine.",This Love of Mine,
Tommy Dorsey & His Orchestra,"When they met, the way they smiled, I saw that I was through
Oh, you crazy moon, what did you do?
And when they kissed, 
They tried to say that it was just in fun
Oh, you crazy moon, look what you've done

Once you promised me, you know, that it would never end
You should be ashamed to show your funny face, my friend

There they are, they fell in love, 
I guess you think that you're smart
Oh, you crazy moon, you broke my heart

Once you promised me, you know, that it would never end
You should be ashamed to show your funny face, my friend

And there they are, they fell in love, 
I guess you think that you're smart
Oh, you crazy moon, you broke my heart","Oh, You Crazy Moon",
Tommy Dorsey & His Orchestra,"The man who only lives for making money
Lives a life that isn't necessarily sunny
Likewise the man who works for fame

There's no guarantee that time won't erase his name
The fact is, the only work that really brings enjoyment
Is the kind that is for girl and boy meant
Fall in love and you won't regret it
That's the best work of all, if you can get it
Holding hands at midnight

'Neath a starry sky
Nice work if you can get it
And you can get it if you try
Strolling with the one girl
Sighing sigh after sigh
Nice work if you can get it
And you can get it if you try

Just imagine someone
Waiting at the cottage door
Where two hearts become one
Who could ask for anything more?
Loving one who loves you
And then taking that vow
It's nice work if you can get it
And if you get it, won't you tell me how?""

Just imagine someone
Waiting at the cottage door
Where two hearts become one
Who could ask for anything more?
Loving one who loves you
And then taking that vow
Nice work if you can get it
And if you get it, won't you tell me how?""",Nice Work If You Can Get It,
Tommy Dorsey & His Orchestra,"It's very clear, our love is here to stay
Not for a year but ever and a day
The radio and the telephone and the movies that we know
May just be passing fancies and in time may go

But oh, my dear, our love is here to stay
Together we're going a long, long way
In time the Rockies may crumble, Gibraltar may tumble
They're only made of clay
But our love is here to stay

In time the Rockies may crumble, Gibraltar may tumble
They're only made of clay
But our love is here to stay",Love is Here to Stay,
Tommy Dorsey & His Orchestra,"Lately, I find myself out gazing at stars, 
Hearing guitars like someone in love.
Sometimes the things I do astound me, 
Mostly whenever you're around me.
Lately I seem to walk as though I had wings, 
Bump into things like someone in love.
Each time I look at you, 
I'm limp as a glove, 
And feeling like someone in love.",Like Someone in Love,
Tommy Dorsey & His Orchestra,"There was a moon out in space
But a cloud drifted over it's face
You kissed me and went on your way
The height we called it a day

I heard the song of the spheres
Like a minor lament In my ears
I hadn't the heart left to pray
The night we called it a day

Soft through the the dark
A hoot of an owl in the sky
Sad though his song
No sadder was he than I

The moon went down stars were gone
But the sun didn't rise with the dawn
There wasn't a thing left to say
The night we called it a day",The Night We Called It a Day,
Tommy Dorsey & His Orchestra,"Grab your coat 
Don't forget your hat
But leave your worries
Leave 'em on the doorstep
Just direct your feet
To the sun sunny side of the street

Pitter-pat
You know that happy tune is my step
Life sorry
If you dig that beat 
On the sun sunny side of the street

Used to walk in the shade
With those blues on parade
What a drag old man
Getting stuck in my shade
Get hip

Don't be afraid
Move it on over
Kill yourself in the clover

Only here for a cent
I'd be rich as Rockefeller
Can't be beat
Gold dust round my feet
On the sunny sunny side of the street",On the Sunny Side of the Street,
Tommy Dorsey & His Orchestra,"Somebody loves me, I wonder who
I wonder who he can be
Somebody loves me, I wish I knew
Who can he be worries me

For every boy who passes me, I shout 'Hey, maybe'
You were meant to be my loving baby, baby, oh
Somebody loves me, I wonder who
Maybe it's you

For every boy who passes me, I shout 'Hey, maybe'
You were meant to be my loving baby, baby

Somebody loves me, I wonder who
Maybe, it's
Baby, it's
Maybe, baby, that somebody is you",Somebody Loves Me,
Tommy Dorsey & His Orchestra,"Oh, how am I to know?
If its really love that found its grave here
Oh, how am I to know?
Will it linger on and leave me there

I dare not guess at this strange happiness
Oh, how am I to know?
Can it be that love has come to stay here

","April Played the Fiddle [From ""If I Had My Way""]",1975
Tommy Dorsey & His Orchestra,"Daybreak, another new day
The mist on the meadow is drifting away
For it's daybreak, the sun's in the sky now
And flowers break through their blanket of dew
Sunrise, how lovely it seems
To see from my window a sky full of dreams
As the white clouds sail on through the blue
At daybreak I did dream of you","Daybreak [Based on ""Mardi Gras"" From Mississippi Suite]",1975
Tommy Dorsey & His Orchestra,"By a country road wild roses grow that need my special care,
So I haven't time to be a millionaire
And a cheerful brook on a mountainside is sad when I'm not there,
So I haven't time to be a millionaire

And a friendly gang of robins are peeved when I forget
That I'm the second tenor in their quartet.
So with all the things I have to do, I'm very much aware,
If I wished for wealth it wouldn't be quite fair,
'Cause I haven't time to be a millionaire.","I Haven't Time to Be a Millionaire [From ""If I Had My Way""]",1975
Tommy Dorsey & His Orchestra,"Some say that love is sweet as a rose,
Some say it's honey and the bee,
Well sit right down and let me tell you
What my love is to me.

""Candy""
I call my sugar ""Candy""
Because I'm sweet on ""Candy""
And ""Candy"" is sweet on me

He/She understands me,
My understanding ""Candy""
And ""Candy""'s always handy
When I need sympathy
I wish that there were four of him/her
So I could love much more of him/her

He/She has taken my complete heart,
Got a sweet tooth for my sweetheart
""Candy""
Its gonna be just dandy
The day I take my ""Candy""
And make him mine all mine
Mine",Candy,1978
Tommy Dorsey & His Orchestra,"I've got the world on a string, sittin' on a rainbow
Got the string around my finger
What a world, what a life, I'm in love!
I've got a song that I sing

I can make the rain go, anytime I move my finger
Lucky me, can't you see, I'm in love
Life is a beautiful thing, as long as I hold the string
I'd be a silly so and so, if I should ever let go

I've got the world on a string, sittin' on a rainbow
Got the string around my finger
What a world, what a life, I'm in love
 
Life is a beautiful thing, as long as I hold the string
I'd be a silly so and so, if I should ever let go
I've got the world on a string, sittin' on a rainbow
Got the string around my finger
What a world
Man this is the life 
And now I'm so in love!",I've Got the World on a String,1978
Tommy Dorsey & His Orchestra,"If you hear
A song in blue
Like a flower crying
For the dew
That was my heart serenading you
My prelude to a kiss

If you hear a song that grows
From my tender sentimental woes
That was my heart trying to compose
A prelude to a kiss

Though it's just a simple melody
With nothing fancy
Nothing much
You could turn it to a symphony
A Shubert tune with a Gershwin touch

Oh how my love song gently cries
For the tenderness within your eyes
My love is a prelude that never dies
A prelude to a kiss

Though it's just a simple melody
With nothing fancy
Nothing much
You could turn it to a symphony
A Shubert tune with a Gershwin touch

Oh how my love song so gently cries
For the tenderness within your eyes
My love is a prelude that never dies
A prelude to a kiss",Prelude to a Kiss,1985
Tommy Dorsey & His Orchestra,"Way down upon the Swanee River,
Far, far away
That's where my heart is yearning ever,
Home where the old folks stay

Way down upon the Swanee River,
Far, far away-hey
Whoa, that's where my heart is yearning ever,
Home where the old folks stay

All up and down the whole creation,
Sadly I roam
I'm a still a-longin' for the old plantation,
Oh, for the old folks at home

Ah-oh-oh!

Oh, my my!

Well, way down upon the Swanee River,
Far, far away-hey.
Whoa, that's where my heart is yearning ever,
Home where the old folks stay.

All up and down the whole creation,
Sadly I roam.
I'm still a-longin' for the old plantation,
And for the old folks at home.

All the world is sad and dreary,
Ev'rywhere I roam
Oh, darkies, how my heart grows weary,
Far from the old folks at home
Far from the old folks at home
Far from the old folks at home
Far from the old folks at home",Swanee River,1987
Tommy Dorsey & His Orchestra,"Be careful, it's my heart,
It's not my watch you're holding, it's my heart.
It's not the note that I sent you that you quickly burn,
It's not a book I lent you that you never return.
Remember, it's my heart.
The heart with which so willingly I part
It's yours to take, to keep or break,
But please, before you start,
Be careful, it's my heart.","Be Careful, It's My Heart",1987
Tommy Dorsey & His Orchestra,"Stars in the sky were dancing
One night perfect for romancing,
The night a sinner kissed an angel,
He wanted thrills, she wanted love,

Oh but his sighs were tender
As he begged her to surrender,
The night a sinner kissed an angel,
And she believed that it was love.

How was she to know that every lovely vow
Was part of the game he was playing,
But to his surprise he realized
Somehow he meant every word he was saying.

Yes, miracles can happen,
I know ´cause I saw what happened
That night a sinner kissed an angel,
That was the night I fell in love.",A Sinner Kissed an Angel,1987
Tommy Dorsey & His Orchestra,"There's a sunny little funny little melody
That was started by a native down in Waikiki
He would gather a crowd down beside the sea
And they'd play his gay Hawaiian chant
Soon the other little natives started singin' it
And the hula hula maidens started swingin' it
Like a tropical storm that's the way it hit
Funny little gay Hawaiian Chant
Ow way tah tualan Me big bad fightin' man
Tho it started on an island down Hawaii way
It's as popular in Tennessee or Ioway
If you wander into any cabaret
You will hear this gay Hawaiian Chant",Hawaiian War Chant,1988
Tommy Dorsey & His Orchestra,"A heart that's true
There are such things
A dream for two
There are such things
Someone to whisper darling
You're my guiding star
Not caring what you own
But just what you are

A peaceful sky
There are such things
A rainbow high
Where heaven sings
So have a little faith
And trust in what tomorrow brings
You'll reach a star
Because there are such things

So have a little faith
And trust in what tomorrow brings
You'll reach a star
Because there are such things",There Are Such Things,1989
Tommy Dorsey & His Orchestra,"All the world's great lovers have been glorified
History placed them in a romantic set
In between book covers they are side by side
But the real thing hasn't been written yet

Now it can be told
Told in all its glory
Now that we have met
The world may know the sentimental story

The greatest romance they ever knew
Is waiting to
Unfold

Now it can be told
As an inspiration
Every other tale
Of boy meets girl is just an imitation

The great love story
Has never been told before
But now
Now it can be told",Now It Can Be Told,1990
Tommy Dorsey & His Orchestra,"Verse 
This day and age we're living in 
Gives cause for apprehension, 
With speed and new invention 
And things like fourth dimension. 
Yet we get a trifle weary 
With mr. einstein's theory, 
So we must get down to earth at times: 
Relax, relieve the tension. 
And no matter what the progress 
Or what may yet be proved, 
The simple facts of life are such 
They cannot be removed. 
Refrain 
You must remember this, 
A kiss is still a kiss, 
A sigh is just a sigh; 
The fundamental things apply, 
As time goes by. 

And when two lovers woo, 
They still say, ""I love you,"" 
On that you can rely; 
No matter what the future brings, 
As time goes by. 

Moonlight and love songs never out of date, 
Hearts full of passion, jealousy, and hate; 
Woman needs man and man must have his mate, 
That no one can deny. 

It's still the same old story, 
A fight for love and glory, 
A case of do or die; 
The world will always welcome lovers, 
As time goes by.",As Time Goes By,1990
Tommy Dorsey & His Orchestra,"Gee, but it's tough to be broke, kid.
It's not a joke, kid, it's a curse.
My luck is changing, it's gotten from 
simply rotten to something worse
Who knows, some day I will win too. 
I'll begin to reach my prime.

Now though I see what our end is,
All I can spend is just my time.

I can't give you anything but love, baby.
That's the only thing I've plenty of,baby.

Dream awhile, scheme awhile
We're sure to find

Happiness and I guess
All those things you've always pined for.

Gee I'd like to see you looking swell, baby.
Diamond bracelets Woolworth doesn't sell, baby.

Till that lucky day you know darned well, baby.
I can't give you anything but love.

Rome wasn't built in a day, kid.
You have to pay, kid, for what you get.
But I am willing to wait, dear, 
Your little mate, dear, will not forget.

You have a lifetime before you.
I'll adore you, come what may.

Please don't be blue for the present, 
When it's so pleasant to hear you say

I can't give you anything but love, baby.
That's the only thing I've plenty of,baby.

Dream awhile, scheme awhile
We're sure to find

Happiness and I guess
All those things you've always pined for.

Gee I'd like to see you looking swell, baby.
Diamond bracelets Woolworth doesn't sell, baby.

Till that lucky day you know darned well, baby.
I can't give you anything but love.",I Can't Give You Anything But Love,1990
Tommy Dorsey & His Orchestra,"I'll walk alone because to tell you the truth I'll be lonely,
I don't mind being lonely when my hear tells me you are lonely too.
I'll walk alone, they'll ask me why and Ill tell them I'd rather.
There are dreams I must gather, dreams we fashioned the night you held me tight.

I'll always be near you wherever you are each night in every prayer.
If you call, I'll hear you, no matter how far.
Just close your eyes and I'll be there.
Please walk alone and send your love and your kisses to guide me
Till you're walking beside me, I'll walk alone.",I'll Walk Alone,1990
Tommy Dorsey & His Orchestra,"You went away
I let you
We broke the ties that bind
I wanted to forget you
And leave the past behind
Still, the magic of the night I met you
Seems to stay forever in my mind

The sky was blue
And high above
The moon was new
And so was love
This eager heart of mine was singing
Lover where can you be

You came at last
Love had its day
That day is past
You've gone away
This aching heart of mine is singing
Lover come back to me
When I remember every little thing

You used to do
I'm so lonely
Every road I walk along
I walk along with you
No wonder I am lonely

The sky is blue
The night is cold
The moon is new
But love is old
And while I'm waiting here
This heart of mine is singing
Lover come back to me
When I remember every little thing

You used to do
I grow lonely
Every road I walk along
I walk along with you
No wonder I am lonely

The sky is blue
The  night is cold
The moon is new
But love is old
And while I'm waiting here
This heart of mine is singing
Lover come back to me","Lover, Come Back to Me",1990
Tommy Dorsey & His Orchestra,"Never thought I'd fall,
But now I hear love call,
I'm getting sentimental over you

Things you say and do,
Just thrill me through and through,
I'm getting sentimental over you.

I thought I was happy,
I could live without love
Now I must admit,
Love is all I'm thinking of

Won't you please be kind,
And just make up your mind
That you'll be sweet & gentle,
Be gentle with me
Because I'm sentimental over you
",I'm Getting Sentimental Over You,1990
Tommy Dorsey & His Orchestra,"Darling you and i know the reason why a summer sky is blue
And we know why birds in the trees sing melodies too.
And why love will grow from the first hello until the last goodbye.
So to sweet romance there is but one answer, you and i.",You and I,1990
Tommy Dorsey & His Orchestra,"You are the promised kiss of springtime
That makes the lonely winter seem long
You are the breathless hush of evening
That trembles on the brink of a lovely song

You are the angel glow that lights a star
The dearest things I know are what you are
Some day my happy arms will hold you
And some day I'll know that moment divine
When all the things you are, are mine",All the Things You Are,1990
Tommy Dorsey & His Orchestra,"Alone, alone with a sky of romance above 
Alone, alone on a night that was meant for love 
There must be someone waiting 
Who feels the way I do
Who ever you are, are you, are you
Alone, alone on this night that we two could share
Alone, alone with your kiss that could make me care
And when you come I'll promise to be your very own
Alone, alone with a heart meant for you alone, alone
 
Alone, alone with a sky of romance above 
Alone, alone on a night that was meant for love 
There must be someone waiting 
Who feels the way I do
Who ever you are, are you, are you
Alone, alone on this night that we two could share
Alone, alone with your kiss that could make me care
And when you come I'll promise to be your very own",Alone,1990
Tommy Dorsey & His Orchestra,"In the blue of evening
When you appear close to me, dear one
There in that dusk we'll share a dream reverie
In the blue of evening
While crickets call and stars are falling
There 'neath the midnight sky you'll come to me

In the shadows of the night  we'll stand 
I'll touch your heart and then
Softly as your lovely eyes entreat 
Our lips will meet again

In the blue of evening
Night winds above whisper ""I love you""
Then we will find romance
In the blue of evening",In the Blue of Evening,1990
