Band,Lyrics,Song,Year
Steve Kuhn,"Once she dressed in silks and lace, Owned a Rolls Royce car
Now she seems quite out of place, like a fallen star
Draped around my kitchen sink , Happy as can be
I just have to stop and think, Why she fell for me.

I'm not much to look at, nothing to see
Just glad I'm livin' and lucky to be
I got a woman crazy for me
She's funny that way.

I can't save a dollar, ain't worth a cent
She doesn't holler she'd live in a tent
I got a woman crazy for me
She's funny that way.

Tho' she loves to work and slave for me ev'ry day
She'd be so much better off if I went away.

But why should I leave her, why should I go
She'd be unhappy without me I know
I got a woman crazy for me
She's funny that way.

She should have the very best, Anyone can see
Still she's diff'rent from the rest, satisfied with me.
While I worry plan and scheme, Over what to do
Can't help feeling it's a dream, Too good to be true. 

Never had nothin'; no one to care
That's why I seem to have more than my share,
I got a woman, crazy for me,
She's funny that way.

When I hurt her feelings, once in a while,
Her only answer is one little smile,
I got a woman crazy for me.
She's funny that way.

I can see no other way and no better plan,
End it all and let her go to some better man;
But I'm only human, coward at best
I'm more than certain she'd follow me west,
I got a woman crazy for me,
She's funny that way.",She's Funny That Way,1999
Steve Kuhn,"Speak low when you speak, love,
Our summer day withers away
Too soon, too soon.

Speak low when you speak, love,
Our moment is swift, like ships adrift,
We're swept apart too soon.

Speak low, darling speak low,
Love is a spark lost in the dark,
Too soon, too soon,
I feel wherever I go
That tomorrow is near, tomorrow is here
And always too soon.

Time is so old and love so brief,
Love is pure gold and time a thief.
We're late darling, we're late,
The curtain descends, ev'rything ends
Too soon, too soon,
I wait darling, I wait
Will you speak low to me,
Speak love to me and soon.",Speak Low,1999
Steve Kuhn,"Listen to the melody entrancing
Blending in a soft and sweet refrain
As around the floor, dear, we are dancing
Swaying to a fascinating strain
 
Sweet music soft and mellow
Soothing and slow
Strains of a mellow 'cello
When lights are low 
Dear, we're so close together I love you so 
Why think about the weather 
When lights are low 
Two hearts revealing
Music hath charms 
Life's so appealing
With inspiration, in your arms 
Our lips meeting soft and tender 
Love's all aglow 
Why shouldn't we surrender 
When lights are low
 
Listen how happy hearts are beating
Like the ocean beats upon the sand
And our feet in rhythm keep repeating
Ev'ry little movement of the band
 
Sweet music soft and mellow
Soothing and slow
Strains of a mellow 'cello
When lights are low 
Dear, we're so close together I love you so 
Why think about the weather 
When lights are low
Two hearts revealing
Music hath charms
Life's so appealing
With inspiration, in your arms 
Our lips meeting soft and tender 
Love's all aglow 
Why shouldn't we surrender 
When lights are low
",When Lights Are Low,1999
Steve Kuhn,"Embrace me, my sweet embraceable you!
Embrace me, you irreplaceable you!

Just one look at you
My heart grew tipsy in me,
You and you alone
Bring out the gypsy in me! 

I love all, the many charms about you!
Above all, I want my arms about you! 

Don't be a naughty baby,
Come to papa, come to papa, do!
My sweet embraceable you!",Embraceable You,2002
Steve Kuhn,"The falling leaves drift by the window
The autumn leaves of red and gold
I see your lips, the summer kisses
The sun-burned hands I used to hold

Since you went away the days grow long
And soon I'll hear old winter's song
But I miss you most of all my darling
When autumn leaves start to fall

C'est une chanson, qui nous ressemble
Toi tu m'aimais et je t'aimais
Nous vivions tous deux ensemble
Toi qui m'aimais moi qui t'aimais
Mais la vie separe ceux qui s'aiment
Tout doucement sans faire de bruit
Et la mer efface sur le sable les pas des amants desunis",Autumn Leaves,2003
Steve Kuhn,"Love walked right in and drove the shadows away
Love walked right in and brought my sunniest day
One magic moment and my heart seemed to know that love said hello
Though not a word was spoken

One look, and I forgot the gloom of the past
One look and I had found my future at last
One look and I had found a world completely new
When love walked in with you

One magic moment and my heart seemed to know that love said hello
Though not a word was spoken

One look and I had found a world completely new
When love walked in with you",Love Walked In,2003
Steve Kuhn,"If you hear
A song in blue
Like a flower crying
For the dew
That was my heart serenading you
My prelude to a kiss

If you hear a song that grows
From my tender sentimental woes
That was my heart trying to compose
A prelude to a kiss

Though it's just a simple melody
With nothing fancy
Nothing much
You could turn it to a symphony
A Shubert tune with a Gershwin touch

Oh how my love song gently cries
For the tenderness within your eyes
My love is a prelude that never dies
A prelude to a kiss

Though it's just a simple melody
With nothing fancy
Nothing much
You could turn it to a symphony
A Shubert tune with a Gershwin touch

Oh how my love song so gently cries
For the tenderness within your eyes
My love is a prelude that never dies
A prelude to a kiss",Prelude to a Kiss,2003
Steve Kuhn,"Ask me how do I feel,
Now that we're cosy and clinging,
Well sir, all I can say is
If I were a bell I'd be ringing!

From the moment we kissed goodnight,
That's the way I just gotta behave,
And if I were a lamp I'd light,
Or if I were a banner I'd wave!

Ask me how do I feel,
Little me with my quiet upbringing,
Well sir, all I can say is
If I were a gate I'd be swinging!

And if I were a watch,
I'd start popping my spring,
Oh, and if I were a bell
I'd go ""Ding dong ding dong ding!"".

Ask me how do I feel
From this chemistry lesson I'm learning,
Well sir, all I can say is
If I were a bridge I'd be burning!

Well, I knew my moral would crack
From the wonderful way you looked,
Boy, if I were a duck I'd quack,
Or if I were a goose I'd be cooked!

Ask me how do I feel
Now that we're fondly caressing,
And if I were a salad,
I know I'd be splashing my dressing!

Or if I were a season,
I'd surely be Spring,
Yes, and if I were a bell,
Say, if I were a bell,
If I were a bell
I'd go ""Ding dong ding dong ding!"".",If I Were a Bell,2007
Steve Kuhn,"When we played our charade
We were like children posing
Playing at games, acting out names
Guessing the parts we played

Oh what a hit we made
We came on next to closing
Best on the bill, lovers until
Love left the masquerade

Fate seemed to pull the strings
I turned and you were gone
While from the darkened wings
That music box played on

Sad little serenade
Song of my heart's composing
I hear it still, I always will
Best on the bill
Charade",Charade,2007
Steve Kuhn Trio,"Ask me how do I feel,
Now that we're cosy and clinging,
Well sir, all I can say is
If I were a bell I'd be ringing!

From the moment we kissed goodnight,
That's the way I just gotta behave,
And if I were a lamp I'd light,
Or if I were a banner I'd wave!

Ask me how do I feel,
Little me with my quiet upbringing,
Well sir, all I can say is
If I were a gate I'd be swinging!

And if I were a watch,
I'd start popping my spring,
Oh, and if I were a bell
I'd go ""Ding dong ding dong ding!"".

Ask me how do I feel
From this chemistry lesson I'm learning,
Well sir, all I can say is
If I were a bridge I'd be burning!

Well, I knew my moral would crack
From the wonderful way you looked,
Boy, if I were a duck I'd quack,
Or if I were a goose I'd be cooked!

Ask me how do I feel
Now that we're fondly caressing,
And if I were a salad,
I know I'd be splashing my dressing!

Or if I were a season,
I'd surely be Spring,
Yes, and if I were a bell,
Say, if I were a bell,
If I were a bell
I'd go ""Ding dong ding dong ding!"".",If I Were a Bell,2007
Steve Kuhn Trio,"There's a story the gypsies know is true
That when your love wears golden earrings,
She belongs to you.
An old love story that's known to very few,
But if you wear those golden earrings,
Love will come to you.

By the burning fire,they will glow with ev'ry coal.
You will hear desire whisper low inside your soul.
So be my gypsy,
Make love your guiding light,
And let that pair of golden earrings
Cast their spell tonight.",Golden Earrings,2008
Steve Kuhn Trio,"I wish I knew someone like you could love me
I wish I knew you place no one above me
Did I mistake this for a real romance?
I wish I knew, but only you can answer.

If you don't care, why let me hop[e and pray so
Don't lead me on, if I'm a fool just say so,
Should I keep dreaming on, or just forget you?
What shall I do, I wish I knew",I Wish I Knew,2008
Steve Lacy,"I know too well that I'm just wasting precious time
In thinking such a thing could be
That you could ever care for me
I'm sure you hate to hear
That I adore you, dear
But grant me

Just the same
I'm not entirely to blame
For love
You'd be so easy to love
So easy to idolize
All others above
So worth the yearning for
So swell to keep every home fire burning for

We'd be so grand at the game
So carefree together
That it does seem a shame
That you can't see
Your future with me
Cause you'd be oh, so easy to love",Easy to Love,1957
Steve Lacy,"It begins to tell,
'round midnight, midnight.
I do pretty well, till after sundown,
Suppertime I'm feelin' sad;
But it really gets bad,
'round midnight.

Memories always start 'round midnight
Haven't got the heart to stand those memories,
When my heart is still with you,
And ol' midnight knows it, too.
When a quarrel we had needs mending,
Does it mean that our love is ending.
Darlin' I need you, lately I find
You're out of my heart,
And I'm out of my mind.

Let our hearts take wings'
'round midnight, midnight
Let the angels sing,
for your returning.
Till our love is safe and sound.
And old midnight comes around.
Feelin' sad,
really gets bad
Round, Round, Round Midnight",'Round About Midnight,1986
Steve Lacy,"You know the feeling of something half remembered
Of something that never happened, yet you recall it well
You know the feeling of recognizing someone
That you've never met as far as you could tell, well

Laura is the face in the misty light
Footsteps that you hear down the hall
The laugh that floats on a summer night
That you can never quite recall
And you see Laura on the train that is passing through
Those eyes, how familiar they seem
She gave your very first kiss to you
That was Laura but she's only a dream",Laura,1986
Steve Lacy,"Listen to my tale of woe, 
It's terribly sad but true, 
All dressed up, no place to go 
Each evening I'm awfully blue. 

I must win some handsome guy 
Can't go on like this, 
I could blossom out I know, 
With somebody just like you. So

Oh, sweet and lovely lady, be good 
Oh, lady, be good to me 
I am so awfully misunderstood 
So lady, be good to me 
Oh, please have some pity 
I'm all-alone in this big city 
I tell you I'm just a lonesome babe in the wood, 
So lady be good to me. 

Oh, please have some pity 
I'm all alone in this big city 
I tell you I'm just a lonesome babe in the wood, 
So lady be good to me. 
Oh lady be good to me.","Oh, Lady Be Good",1986
Steve Lacy,"In my solitude
You haunt me
With dreadful ease
Of days gone by

In my solitude
You taunt me
With memories
That never die

I sit in my chair
And filled with despair
There's no one could be so sad
With gloom everywhere
I sit and I stare
I know that I'll soon go mad

In my solitude
I'm afraid
Dear Lord above
Send back my love
I sit in my chair

Filled with despair
There's no one, no one
No onecould be so sad
With gloom everywhere
I sit and I stare
I know that I'll soon go mad

In my solitude
I'm afraid
Dear Lord above
Send back my love
",Solitude,1986
Steve Lacy,"Listen to the melody entrancing
Blending in a soft and sweet refrain
As around the floor, dear, we are dancing
Swaying to a fascinating strain
 
Sweet music soft and mellow
Soothing and slow
Strains of a mellow 'cello
When lights are low 
Dear, we're so close together I love you so 
Why think about the weather 
When lights are low 
Two hearts revealing
Music hath charms 
Life's so appealing
With inspiration, in your arms 
Our lips meeting soft and tender 
Love's all aglow 
Why shouldn't we surrender 
When lights are low
 
Listen how happy hearts are beating
Like the ocean beats upon the sand
And our feet in rhythm keep repeating
Ev'ry little movement of the band
 
Sweet music soft and mellow
Soothing and slow
Strains of a mellow 'cello
When lights are low 
Dear, we're so close together I love you so 
Why think about the weather 
When lights are low
Two hearts revealing
Music hath charms
Life's so appealing
With inspiration, in your arms 
Our lips meeting soft and tender 
Love's all aglow 
Why shouldn't we surrender 
When lights are low
",When Lights Are Low,1986
Steve Lacy,"Driftin' Dreamin'
In an Azure mood,
Stardust gleamin' 
Thru my solitude:
Here in my seclusion, 
You're a blue illusion 
While I'm in this Azure interlude.
I'm not wanted I'm so all alone;
Always haunted
By the dreams I own;
But, though Im tormented
I must be contented 
Driftin' Dreamin' 
In an Azure mood!
Driftin' Dreamin'
In an Azure mood,
Star dust gleamin'
Thru my solitude:
Here in my seclusion, 
You're a blue illusion
While I'm in this Azure interlude!
",Azure,1986
Steve Lacy,"If you hear
A song in blue
Like a flower crying
For the dew
That was my heart serenading you
My prelude to a kiss

If you hear a song that grows
From my tender sentimental woes
That was my heart trying to compose
A prelude to a kiss

Though it's just a simple melody
With nothing fancy
Nothing much
You could turn it to a symphony
A Shubert tune with a Gershwin touch

Oh how my love song gently cries
For the tenderness within your eyes
My love is a prelude that never dies
A prelude to a kiss

Though it's just a simple melody
With nothing fancy
Nothing much
You could turn it to a symphony
A Shubert tune with a Gershwin touch

Oh how my love song so gently cries
For the tenderness within your eyes
My love is a prelude that never dies
A prelude to a kiss",Prelude to a Kiss,1986
Steve Lacy,"In A Sentimental Mood 
I can see the stars come thru my room
While your loving attitude
Is like a flame that lights the gloom
On the wings of ev'ry kiss 
Drift a melody so strange and sweet
In this sentimental bliss you make my 
Paradise complete
Rose pearls seem to fall
It's all like a dream to call you mine
My heart's lighter thing 
Since you made me this night a thing divine
In A Sentimental Mood 
I'm within a world so heavenly
For I never dreamt 
That you'd be loving sentimental me
In A Sentimental Mood 
I can see the stars come thru my room
While your loving attitude 
Is like a flame that lights the gloom
On the wings of ev'ry kiss 
Drift a melody so strange and sweet
In this sentimental bliss you make my 
Paradise complete
Rose pearls seem to fall
It's all like a dream to call you mine
My heart's lighter thing 
Since you made me this night a thing divine
In A Sentimental Mood 
I'm within a world so heavenly
For I never dreamt 
That you'd be loving sentimental me",In a Sentimental Mood [Live],1993
Steve Lacy,"Ain't she sweet? See her walking down that street.
Yes I ask you very confidentially, ain't she sweet?
Ain't she nice? Look her over once or twice.
Yes I ask you very confidentially, ain't she nice?
Just cast an eye in her direction, oh me oh my, ain't that perfection?
Oh I repeat, well, don't you think that's kinda neat?
Yes I ask you very confidentially, ain't she sweet?

Ain't she sweet? See her walking down that street.
Yes I ask you very confidentially, ain't she sweet?
Ain't she nice? Look her over once or twice.
Yes I ask you very confidentially, ain't she nice?
Just cast an eye in her direction, oh me oh my, ain't that perfection?
Oh I repeat, well, don't you think that's kinda neat?
Yes I ask you very confidentially, ain't she sweet?

Oh I repeat, well, don't you think that's kinda neat?
Yes I ask you very confidentially, ain't she sweet?

Oh I repeat, well, don't you think that's kinda neat?
Yes I ask you very confidentially, ain't she sweet?",Ain't She Sweet?,1994
Steve Lacy,"I hate to see that evening sun go down
I hate to see that evening sun go down
Cause my baby, he's gone left this town

Feelin' tomorrow like I feel today
If I'm feelin' tomorrow like I feel today
I'll pack my truck and make my give-a-way

St. Louis woman with her diamond ring
Pulls that man around by her, if it wasn't for her and her
That man I love would have gone nowhere, nowhere

I got the St. Louis blues, blues as I can be
That man's got a heart like a rock cast in the sea
Or else he wouldn't have gone so far from me

I love my baby like a school boy loves his pie
Like a Kentucky colonel loves his mint 'n rye
I love my man till the day I die",St. Louis Blues,1995
Steve Lacy,"I was a stranger in the city
Out of town were the people I knew
I had that feeling of self-pity
What to do, what to do, what to do
The outlook was decidedly blue

But as I walked through the foggy streets alone
It turned out to be the luckiest day I've known

A foggy day, in London town
Had me low, had me down
I viewed the morning, with much alarm
British Museum, had lost its charm

How long I wondered,
Could this thing last
But the age of miracles, hadn't past
For suddenly, I saw you there
And through foggy London town,
The sun was shining everywhere

For suddenly, I saw you there
And through foggy London town,
The sun was shining everywhere

Everywhere
Everywhere
Everywhere",A Foggy Day,2004
Steve Lacy,"When a girl meets boy
Life can be a joy
But the note they end on
Will depend on 
Little pleasures they will share
So let us compare

I like New York in June, how about you?
I like a Gershwin tune, how about you?
I love a fireside when a storm is due.
I like potato chips, moonlight and motor trips,
How about you?
I'm mad about good books, can't get my fill,
And Franklin Roosevelt's looks give me a thrill.
Holding hands at the movie show,
When all the lights are low
May not be new, but I like it,
How about you?

I like Jack Benny's jokes.
To a degree.
I love the common folks.
That includes me.
I like to window shop on 5th Avenue.
I like banana splits, late supper at the Ritz,
How about you?
I love to dream of fame, maybe I'll shine.
I'd love to see your name right beside mine.
I can see we're in harmony,
Looks like we both agree
On what to do,
And I like it, how about you?",How About You,2004
Steve Lacy,"Love me or leave me and let me be lonely
You won't believe me that I love you only
I'd rather be lonely than happy with somebody else

You might find the night time the right time for kissing
But night time is my time for just reminiscing
Regretting instead of forgetting with somebody else
There'll be no else unless that someone is you, you, you

I intend to be independently blue
I want your love but I don't want to borrow
I have it today and give back tomorrow
For my love is your love but there's no love for nobody else",Love Me or Leave Me,2004
Steve Lacy,"Peg o'my heart
I love you, don't let us part
I love you, I always knew it would be you
Since I heard your lilting laughter
It's your Irish heart I'm after
Peg o'my heart
Your glances make my heart say ""How's chances?""
Come, be my own, come make your home in my heart
",Peg O' My Heart,2004
Steve Lacy,"I let a song go out of my heart
It was the sweetest melody
I know I lost heaven 'cause you were the song

Since you and I have drifted apart
Life doesn't mean a thing to me
Please come back, sweet music, I know I was wrong

Am I too late to make amends?
You know that we were meant to be more than just friends, just friends

I let a song go out of my heart
Believe me, darlin', when I say
I won't know sweet music until you return some day

I let a song go out of my heart
Believe me, darlin', when I say
I won't know sweet music until you return some day",I Let a Song Go Out of My Heart,2004
Steve Lacy,"Once in a while will you try to give
One little thought to me
Though someone else may be
Nearer your heart?

Once in a while will you dream
Of the moments I shared with you
Moments before we two
Drifted apart?

In love's smoldering ember
One spark may remain
If love still can remember
That spark may burn again

I know that I'll be contented
With yesterday's memory
Knowing you think of me
Once in a while

In love's smoldering ember
One spark may remain
If love still can remember
The spark may burn again

I know that I'll be contented
With yesterday's memory
Knowing you think of me
Once in a while",Once in a While,2004
Steve Lacy,"Somewhere over the rainbow, way up high
There's a land that I've heard of once in a lullaby.
Somewhere over the rainbow, skies are blue
And the dreams that you dare to dream,
Really do come true.

Someday I'll wish upon a star
And wake up where the clouds are far behind me.
Where troubles melt like lemon drops,
High above the chimney tops,
That's where you'll find me.

Somewhere over the rainbow, blue birds fly
Birds fly over the rainbow
Why then, oh why can't I?
If happy little bluebirds fly beyond the rainbow
Why, oh why can't I?

Somewhere over the rainbow, way up high
There's a land that I've heard of once in a lullaby.
Somewhere over the rainbow, skies are blue
And the dreams that you dare to dream,
Really do come true.

Someday I'll wish upon a star
And wake up where the clouds are far behind me.
Where troubles melt like lemon drops,
High above the chimney tops,
That's where you'll find me.

Somewhere over the rainbow, blue birds fly
Birds fly over the rainbow
Why then, oh why can't I?
If happy little bluebirds fly beyond the rainbow
Why, oh why can't I?",Over the Rainbow,2004
Steve Lacy,"You stepped out of a dream
You are too wonderful to be what you seem!
Could there be eyes like yours, 
Could there be lips like yours
Could there be smiles like yours, 
Honest and truly?
You stepped out of a cloud
I want to take you away, away from the crowd
And have you all to myself, 
Alone and apart out of a dream, 
Safe in my heart
 
You stepped out of a dream
You are too wonderful to be what you seem!
Could there be eyes like yours, 
Could there be lips like yours
Could there be smiles like yours, 
Honest and truly?
You stepped out of a cloud
I want to take you away, away from the crowd
And have you all to myself, 
Alone and apart out of a dream, 
Safe in my heart",You Stepped Out of a Dream,2004
