Band,Lyrics,Song,Year
Stalley,"DJ EFN
Crazier productions
Putting it down
Straight like that
Who's crazy?

DJ EFN
Crazier productions
Putting it down
Straight like that
Who's crazy?

All black, Nike sweatsuit on
I'm not hoop on, I'm about to get my shoot on
Niggas violate, it's only right we demonstrate
A fool ain't a fool, we eat them up like dinner plates
Over paper, pull the plastic
Feather-hair trigger when I blast it
Another bird ass nigga son turned bastard
Said it ain't serious, to me, shit's drastic
I'm from a crazy hood, my reaction be crazier
Won't explain to ya, just run down and bang on ya
Two to the chest, one to the head
Don't blame the shooter, fault the motherfucker that's dead
Like, what did he do to deserve all that?
Funeral service, mom's in the church all black
Nine out of ten times, they the cause and the reason
I don't make the rules, I just play harder err' season

DJ EFN
Crazier productions
Putting it down
Straight like that
Who's crazy?

DJ EFN
Crazier productions
Putting it down
Straight like that
Who's crazy?

You're blind to what you don't see
Ignorance is blessing
Them niggas gon' be mad as fuck when they wake up
How much of our time will it take us?
It's like the '60s all over
Catch a nigga sleeping, Peter Rolla
Hunted like we're animals and shot dead
It's crazy in the hood but I am not scared
It's evident that the evidence
That was captured on the camera was irrelevant
Get the dogs, get the tanks out
Fuck a nigga, blow his goddamn brains out
Same shit, different city
I'm revealing, that the reason that they're fucking with me
Wise up to the plot
They're targeting the youth and just about to wipe our ass out

DJ EFN
Crazier productions
Putting it down
Straight like that
Who's crazy?

DJ EFN
Crazier productions
Putting it down
Straight like that
Who's crazy?

The law can't save us in our own hood
Walk around hooded down in your own hood
And they run up on you with the pistols out
Should've took a different route, these crackers tryna X us out
But this is home here, we should be able to roam here
With no fear, but it's crazy in the hood
Klan members turn cops, harassing our youth
Got our backs against the wall, hands up, they still shoot
So what we gon' do? Either ride or be quiet
I think there has been peace for too long, let's be violent
Malcolm Stalley mixed with Makaveli in front your precinct 
Middle fingers, Mac-11's pointed at the law
That's what we think, now who's crazy?
And this momma next to me want to know why you shot her baby
Left him cold in the street, not treating him like a human
So ya pigs get the same treatment, every time we see one of y'all
We shooting

EFN
Crazier productions
Putting it down
Straight like that
Who's crazy?

DJ EFN
Crazier productions
Putting it down
Straight like that
Who's crazy?",Who's Crazy?,2015
Stalley,"Rolls Royces, on my 4th Ferrari
I got everything a dope boy ever wanted
I got everything a dope boy ever wanted
I got everything a dope boy ever wanted

I got everything a dope boy ever wanted
I smoke on that gas, I fly from California
Bumpinâ€™ that new Stanley, Ty Dolla Iâ€™m on it
Forbes, cash king, real nigga persona, huh
Smokinâ€™ with my niggas, my shawty a roller
Biker gang tatted, really a Tommy Mottola
Niggas losinâ€™ touch but they tweetinâ€™ more
I only feel a rush when we eatinâ€™ more, huh
Hustle hard before my seeds deseed more
Swear to the lord the less, why did I had with three floors?
Roll a blunt with the ladies, playmates of the month
We out the country in Dallas
Itâ€™s sad son, Iâ€™m what they want
We the money team, Mayweather and Ricky now
No more trickinâ€™ itâ€™s time to put some real pimpinâ€™ down
We the heaviest even if it was featherweight
If itâ€™s on me, itâ€™s deejee K, or itâ€™s tailor made
Cribs in Atlanta, out in Vegas too
Out in Ohio itâ€™s Stanley, Manzelli kept it true
Lebron know the play, get your checks nigga
Busy gettinâ€™ mine, canâ€™t worry â€™bout the next nigga

October 27th, Ohio
My nigga Stalley, itâ€™s a long way my nigga
But it feels good to know, dreams come true

I got everything a dope boy ever wanted
â€™87 monte, with the rallies on it
Ridinâ€™, Iphone 6 fully charged
Aux plug connected bumpinâ€™ Elvis Presley blvd
Couple hard niggas with me playing body guard
So if you reach, get your body scarred, 12 Gauge shotty squad
95 Percent of these niggas ainâ€™t really down to squab
The other 5 percent, playing â€œgod, oh lordâ€
The games comical, all I can do is laugh now
And all that beefinâ€™ gonâ€™ turn me into a cash cow
And for that money, broad daylight, Iâ€™ll pull that mask down
Rozay got me out that basement, for him Iâ€™ll lay that ass down
And I ainâ€™t hollerinâ€™, just smooth talk over beat Billi
Itâ€™s double m to the grave, free meek Milly
Dreams worth more than money, the album bout nothinâ€™
Bcg this our year, tell em stop frontinâ€™
In the hood billionaire got whatever on it
This the crown in Ohio, I sit on that throne
And welcome back Lebron, but Stalley been home

Yeah, BCG, MMG
Yâ€™all niggas act like I donâ€™t be rappinâ€™
Like I ainâ€™t one of the nicest out here
Like I ainâ€™t got Ohio and the Midwest on my back
Yâ€™all better pay attention
October 27th. My debut album, Ohio
Man, itâ€™s gonna be a problem
And thatâ€™s all Iâ€™ma say
Rozay, what up?
You unleashed a monster my nigga",Everything a Dope Boy Ever Wanted,2015
Stalley,"Chain smokin' in my chain (Bang) (Aye)
Chain smokin' in my chain (Mang) (Aye)
I'm chain smokin' in my chain
(I'm smokin' man, I'm smokin' man, I'm smokin')
Chain smokin' in my chain
(I'm smokin' man, I'm smokin' man, I'm smokin')
Chain smokin' in my chain

I be picking through the stickiest of greenery
28 grams on my Cuban link
Riding shirtless in the Trans Am bumpin' Cuban links
Cardies on my face, diamonds in my pinkie ring
Midwest nigga from the streets to the kitchen sink
Grape Swisher Sweets and a box of Middletons
I go straight to my connect, I don't need a middle man
A zip of blue dream and platinum cookies
This is big dog smoke school, we don't toke with rookies
And my jewels give you that 1989 feel
All solid 24k from David and Will
Forgiato grill on my '76 Chevelle
Ridin' slow through the hills
Of Beverly, one toke, two tokes
Got me feeling heavenly
Top down riding around chain smokin'
Chain pokin' for all of y'all to see
And my nigga Gunplay tell em bring some more weed

Chain smokin' in my chain (Bang) (Aye)
Chain smokin' in my chain (Mang) (Aye)
I'm chain smokin' in my chain
(I'm smokin' man, I'm smokin' man, I'm smokin')
Chain smokin' in my chain
(I'm smokin' man, I'm smokin' man, I'm smokin')
Chain smokin' in my chain

Niggas try to sound like grime lipe
Faded get high like the one in the bubblegum blue '52
Bel Air at the fair, rollin' gold shoes
Whole shoes, fans fair
Very rare, you find an ounce of this shit anywhere
'Cause you incredibly square
Nobody trust you, you actin' like the feds
Smokin' to my head
'Cause the one that I wanna pass the doobie to dead
My momma and my girlfriend scared, 'cause I be outside
But don't worry baby, I know how to play it
Watching while I'm blazin', all my jewelry on
OG in the bomb space station, home bases
From the club to the food spot
We all racing, we got paper
We all make it fast as we can spend it
Take a new hundred, roll that weed in it

Chain smokin' in my chain (Bang) (Aye)
Chain smokin' in my chain (Mang) (Aye)
I'm chain smokin' in my chain
(I'm smokin' man, I'm smokin' man, I'm smokin')
Chain smokin' in my chain
(I'm smokin' man, I'm smokin' man, I'm smokin')
Chain smokin' in my chain

Countin' tokens, chain smokin'
In a seven trey Chevrolet, everyday chokin'
And the paint like white cocaine
My dog say match one, I'm like ""okay""
Fresh taper, Raw paper
Trippy stick, kush or
The color syrup maple
All vapor
To the crib, this bad bitch
I'm gon' take her, then wife her, then break up
Leather seats
My Swisher forever sweet
Fresh off probation let's celebr-eat
They be tardy for the party but I'm never late
Put the fire to the tip 'til I levitate
Four strands, loud as four bands
Tryna hold smoke, she tryna hold hands
This shit fire like I'm rolling up a sun
On a back to back run
Coughing up a lung

Chain smokin' in my chain (Bang) (Aye)
Chain smokin' in my chain (Mang) (Aye)
I'm chain smokin' in my chain
(I'm smokin' man, I'm smokin' man, I'm smokin')
Chain smokin' in my chain
(I'm smokin' man, I'm smokin' man, I'm smokin')
Chain smokin' in my chain",Chain Smokin,2015
Stalmann,"HÃ¶rst du den Klang, wie der Amboss heut' singt
Und wie im Feuer meine SÃ¼nde verglimmt
Siehst du den KÃ¶rper, der den KÃ¶rper erschafft
Mit seiner Manneskraft

Und so schmiede ich die Seele hinein zu mir

Ich bin ein Mann aus Stahl
Kann nichts mehr fÃ¼hlen
Mein Leid wurd' mir zur Qual
Und wo das Herz mal frÃ¼her war
Ist heut' ein Platz aus Stahl
Kann nichts mehr fÃ¼hlen
Mann aus Stahl

Ich gieÃŸ' die Glut auf die brennende Haut
Und auf die Narben, denn so fÃ¼ll' ich sie auf
Sie sind so schÃ¶n und ich streiche sie glatt
Und weihe sie mit Gottes Macht",Adrenalin,2013
Stalmann,"Ich schau' in die Nacht und es geht hinab
Ich hÃ¶re deine Liebe wie sie lacht
Ich weiÃŸ genau, es ist vorbei
Ich weiÃŸ genau, ich bin wieder allein
Ich hab' immer geschworen, dass du mich nicht rÃ¼hrst
Habe geschworen, dass der Himmel mich fÃ¼hrt

Doch die Angst vergeht nicht
Angst versteht nicht, Angst beginnt wieder von vorn
Sag, kennst du das GefÃ¼hl, wenn man verliert

DÃ¤monin der Nacht
HÃ¶rst du mein Flehen
SpÃ¼rst du die Macht, in mein Herz zu sehen
DÃ¤monin der Nacht
Tanze mit mir
Und lass mich in deinem Arm
In deinem Arm erfrieren

OK, ich geb' auf und dir den Verstand
Ich habe verloren, es zu spÃ¤t erkannt
Ich weiÃŸ genau, es ist geschehen
Ja, ich weiÃŸ genau, es wird schon gehen
Ich hab alles gegeben, alles verschenkt
Ich habe gehofft, mich zu oft verrenkt",DÃ¤monin,2013
Stalmann,"HÃ¶rst du den Klang, wie der Amboss heut' singt
Und wie im Feuer meine SÃ¼nde verglimmt
Siehst du den KÃ¶rper, der den KÃ¶rper erschafft
Mit seiner Manneskraft

Und so schmiede ich die Seele hinein zu mir

Ich bin ein Mann aus Stahl
Kann nichts mehr fÃ¼hlen
Mein Leid wurd' mir zur Qual
Und wo das Herz mal frÃ¼her war
Ist heut' ein Platz aus Stahl
Kann nichts mehr fÃ¼hlen
Mann aus Stahl

Ich gieÃŸ' die Glut auf die brennende Haut
Und auf die Narben, denn so fÃ¼ll' ich sie auf
Sie sind so schÃ¶n und ich streiche sie glatt
Und weihe sie mit Gottes Macht",Der Schmied,2013
Stalmann,"Mein Herz schlÃ¤gt langsam, ErlÃ¶sung ist nah
Mit meiner Haut zerschneide ich die Qual
Die Seele rÃ¼hrt sich, der Himmel vergeht
In deiner Liebe und nun ist es zu spÃ¤t
Das Licht geht aus, die Seele vergeht
Sei hier willkommen im Paradies

Und die Welt verbrennt am Ende der Zeit
Ja die Seele sie brennt fÃ¼r dich
Und zieht die Spur durch das Leid

Der Tod ist einsam, die Liebe erwacht
In meinem Dunkel, tief in der Nacht, ja
Ich hÃ¶re Lieder von Tiefe und Qual
Und kalter Liebe, das Ende ist nah
Ich schlieÃŸ' die Augen, ein letztes Mal mit dir
Sei hier willkommen im Paradies

Und die Welt verbrennt am Ende der Zeit

Mein Herz bei dir",Die Welt Verbrennt,2013
Stalmann,"Ich leb' in deiner Wunde
In meiner ganzen Pracht
Ganz tief in deinem KÃ¶rper
Hab dir was mitgebracht

Ich leb' in deinen Venen
Ganz tief in deinem Blut
Ich bin dein kaltes Beben
Und deine Glut

Adrenalin

Ich lebe dort ganz unten
Jage dir durch die Haut
Ich bin dir stets verbunden
Ich bin dir angetraut

Ich kÃ¼sse deine Wunden
Wenn dich die Angst berÃ¼hrt
Ich bin die frohe Kunde
Die dich verfÃ¼hrt

Adrenalin
Adrenalin
Ich bin dein Adrenalin
Adrenalin

Hier leb' ich
Hier schaff ich
Hier bin ich was ich bin

Hier leb' ich
Hier schaff ich
Dein pures Adrenalin

Ich kenne deinen Schwachpunkt
Ich weiÃŸ, dass du verlierst
Ich weiÃŸ, dass deine kalte Lust
In dir explodiert

Ich fÃ¼hle wie du atmest
Ich fÃ¼hle wie du bebst
Ich kenne deinen KÃ¶rper
Ich spÃ¼re, dass du lebst",Leuchtfeuer,2013
Stalmann,"Dein Puls schlÃ¤gt langsam und bedÃ¤chtig auf mich ein
Dein sÃ¼ÃŸer Duft umschlingt mich
und deine KÃ¼sse lassen mich sein
Ein kalter Schauer fÃ¤ngt mich, leitet mich zu dir
Und die weiÃŸe Haut so endlos, schmiegt sich sanft an mir

Mein Puls jagt hoch zum Himmel
Und die Lust erwacht in mir
Ein Kuss der tiefen Sinne trifft mich
Ich werd' verlieren

Ich will dich nackt
Unter mir spÃ¼ren
Ich will dich nackt
Und untergehen mit dir
Ich will dich nackt

Dein SchweiÃŸ belebt mich
Zeichnet meine Haut
Und dein sÃ¼ÃŸer Arsch bewegt sich
Und deine Augen fressen mich auf

Deine NÃ¤gel schreiben Lieder
Tief hinein ins Fleisch
Ich will dich jetzt und immer wieder spÃ¼ren
Denn gleich bist du so weit

Ich will dich nackt
Unter mir spÃ¼ren
Ich will dich nackt
Und untergehen mit dir
Ich will dich nackt
SpÃ¼ren

Mein Herz schlÃ¤gt langsam
Es ist vollbracht
Doch du kleines Luder sagst nur
Gib mir mehr heut' Nacht",Nackt,2013
Stalmann,"Meine SÃ¼nde ruft
Keine Antwort
Keine Rettung in Sicht
Meine Seele schreit
Verflucht dich
Und die Hoffnung erlischt
Meine Seele schreit ein letztes Wort
TrÃ¤gt dich hoch an jenen Ort
Hoch hinaus ins Paradies
Zu mir
Willst du mich

Willst du mit mir die SÃ¼nde sein
Dann tanz mit mir durchs Paradies
Willst du mit mir den Schmerz befreien
Dann tanz mit mir durchs Paradies
Willst du mit mir nach ErlÃ¶sung schreien
Und auch nur einmal Sieger sein
Willst du mit mir die SÃ¼nde sein
Dann sei willkommen im Paradies

Keine Liebe mehr
Die mich finden wird
Nur noch Glaube, der stirbt
Meine Wunden sind verblendet
Und meine Seele zerstÃ¶rt
Das Spiel beginnt heut' Nacht von vorn
Holt mich ein, wird neu geboren
Und trÃ¤gt mein Herz ganz nah zu dir
Ins Paradies
Nimm meinen Schmerz

Willst du mit mir heut' untergehen
Willst du mit mir die SÃ¼nden zÃ¤hlen
Willst du mit mir am Ende sein
Dann komm mit mir
Ins Paradies",Paradies,2013
Stalmann,"Schwarz, schwarz ist alles was ich habe
Schwarz, schwarz ist alles was ich bin
Darum lieb ich alles, was so schwarz ist
Denn mein Schatz ist des Teufels Kind

Nenn mir die Farbe
Nenn mir dein Leid
Nenn mir den letzten Hauch der Unendlichkeit

Nenn mir die Farbe
Die am Ende Ã¼berlebt
Nenn mir die Farbe
Die in dir lebt

Schwarz, schwarz sind alle meine Kleider
Schwarz, schwarz ist alles was ich bin
Darum lieb ich alles, was so schwarz ist
Denn mein Schatz ist des Teufels Kind

Nenn mir die Farbe
Nenn mir dein Leid
Zeig mir den letzten Weg durch die Dunkelheit

Nenn mir die Farbe
Die keine Farbe ist
Verdeck die Narben mit ihrer List

Wir sind schwarz, wie die Hand die dich fÃ¼hrt
Wir sind schwarz, wie die Nacht die dich ziert

So schwarz, schwarz sind alle meine Kleider
Schwarz, schwarz ist alles was ich bin
Darum lieb ich alles, was so schwarz ist
Denn mein Schatz ist des Teufels Kind

Ich bin schwarz, so schwarz",Schwarz,2013
Stalmann,"SÃ¼chtig
Ich bin sÃ¼chtig
SÃ¼chtig nach dir

Ihre roten Lippen geleckt
Arrogant und so perfekt
So steht sie da, schaut mich an
Und zeigt mir was ein Luder kann

Sie ist so schwarz, so kÃ¼hl, so schÃ¶n
Die Haut so weich, der Blick obszÃ¶n
Sie ist das Luder das mich schafft
In jeder Nacht

Ich bin sÃ¼chtig
SÃ¼chtig nach dir
Ich bin sÃ¼chtig
So schÃ¶n, obszÃ¶n
SÃ¼chtig nach dir

Ihre roten Lippen geleckt
Effizient, auf Lust gecheckt
Sie ist verdorben, hÃ¤lt mich wach
Und ich bin sÃ¼chtig wenn sie's macht

Sie ist versaut, wild und frei
So eloquent, voll dabei
Sie ist das MiststÃ¼ck das mich schafft
In jeder Nacht",SÃ¼chtig,2013
Stalmann,"Die Zeit kriecht langsam
Die Lust erwacht
Ein Kuss der kalten Sinne
Ich bin erwacht
Ich roll mich ein, leg mich zu dir
Vergess' die Narben, die mich zieren
Dein KÃ¶rper leblos, doch so wunderschÃ¶n

Im Tempel der Lust
SchlÃ¤gt mein Herz heut' Nacht mit dir
Im Tempel der Lust
Werd' ich heut' mein Herz verlieren
Im Tempel der Lust
Will ich sein
Und meine SÃ¼nden mit dir teilen
Im Tempel der Lust
Wird die Sehnsucht nach ErlÃ¶sung mit dir schreien

Dein Mund berÃ¼hrt mich
Mein Leid verrinnt
Mein alter KÃ¶rper regt sich
Das Spiel beginnt
Ich schlieÃŸ' die Augen
FÃ¼hl' den Schmerz
Vergess' die Sorgen und mein Herz
Und fahr hinab in deiner Sinnlichkeit",Tempel der Lust,2013
Stamina MC,"We like it, I like it, you like it too
Staring our MC's on wack support the movement crew
See all I know is this tune, tears of lovin' you
So anytime we're around this is what we do

It's the way
That we play this sound
It's the way
That we bring this sound to you
It's the way
That we play this sound
It's the way
That we bring this sound to you

Eh yo
This is the way that I can best connect to you
Don't let nobody ever your feelings
We all get times when we just don't know what to do
There ain't a day when I don't get that feelin'
But about tonight, the vibe is right
Am I'm damned if I can hold it any longer either
Just for tonight, the vibe is right
Am I'm damned if I can hold it any

Because it's the way
That we play this sound
It's the way
That we bring this sound to you
It's the way
That we play this sound
It's the way
That we bring this sound to you

Now as I'm singin the party's swinging
My DJ is bringing it loud
Feelin' energy from people in the crowd
And I,
You know we got it like this baby
And I,
You know we got it like that baby

Now as I'm singin the party's swinging
My DJ is bringing it loud
Feelin energy from people in the crowd
And I,
You know we got it like this baby
And I,
You know we got it like that
Rough track

It's the way
That we play this sound
It's the way
That we bring this sound to you
It's the way
That we play this sound
It's the way
That we bring this sound
Eh yo",LK,2004
Stamina MC,"All we need is you there and we'll all get through it, 
Truly free in a way that we always knew it

I cant get enough, I cant get enough, I cant get enough, I cant get enough
I cant get enough, I cant get enough, I cant get enough, I cant get enough

You don't know what you mean to me, 
I'm too proud to beg on my knees, 
Guess you know that ill cave in deep 
'Cause you got the thing I need. 

I am caught between the cold and the fire, 
I am caught between the chasm and the wire, 

All we need is you, baby. 

All we need is you there and we'll all get through it 
Truly free in the way that we always knew it 
All we need is you there and we'll all get through it 
Truly free in the way that we always knew it 

You got something inside worth giving, 
Now look at the life I'm living, 
I am hooked on your hypercaine feeling, 
I can't put my finger on the vibe that's winning. 

I am caught between the river and the ocean, 
I am caught between the dark and deep emotion, 
Its the only thing to keep me moving, 
I can't tire, I'm on the wire. 

Gotta keep moving on, gotta keep moving on, gotta keep moving on
Moving on, moving on, moving on, moving on, 
Moving on, moving on, moving on, moving on

You should know what you mean to me, 
No I wont beg on my knees, 
Can't live without you with me, 
This town is dead, its time to break free 

I guess we put it in the spotlight, oh yeah, 
All we need is you, babe. 

All we need is you there and we'll all get through it 
Truly free in the way that we always knew it 
All we need is you there and we'll all get through it 
Truly free in the way that we always knew it 

All we need is you there and we'll all get through it 
Truly free in the way that we always knew it 
All we need is you there and we'll all get through it 
Truly free in the way that we always knew it 

He got you in the hypercaine",Hypercaine,2010
Stampead,"Like a bird on the wire,
Like a drunk in a midnight choir
I have tried in my way to be free.
Like a worm on a hook,
Like a knight from some old fashioned book
I have saved all my ribbons for thee.
If I, if I have been unkind,
I hope that you can just let it go by.
If I, if I have been untrue
I hope you know it was never to you.

Like a baby, stillborn,
Like a beast with his horn
I have torn everyone who reached out for me.
But I swear by this song
And by all that I have done wrong
I will make it all up to thee.
I saw a beggar leaning on his wooden crutch,
He said to me, ""You must not ask for so much.""
And a pretty woman leaning in her darkened door,
She cried to me, ""Hey, why not ask for more?""

Oh like a bird on the wire,
Like a drunk in a midnight choir
I have tried in my way to be free.",Bird on the Wire,2004
Stampley Boys,"Oh Lord speak into my life
I am a living sacrifice
Your word says live and not die
Oh Lord speak into my life

[Chorus]
Oh Lord speak into my life
(I am)
I am a living sacrifice
(your word)
Your word says live and not die
Oh Lord speak into my life

One word I'm living this moment on a word
Not just any word but a word from your hope
A word that says I'm healed delivered and set free
There are no more change hold in me
Could have belonged on that rocky road
If I would have kept my eyes on the problem
I would have surely fell
I heard a voice say who's report do you believe
I said oh Lord one word's all I need
Come on and help my say oh Lord!

[Chorus]

One word, one word, one word, one word is all I need (repeat)

Your word says live and not die
Oh Lord speak into my life (repeat 4x)",Speak into My Life [Snippet][*],2008
Stan,"When I was young, Mama bought me a guitar
A microphone and she said I'd go far
She said, ""Just keep it raw, the lyrics hardcore""
Listen to my talk and get up, I'm on the corner with my

Hey kids, gather around, it's Wyclef and Melky Sedeck
I got a story to tell, here we go

Sit right back and hear a tale of a hustler 'round my way
He used to clock around the block from where my grandma stayed
Black BMW with rims to match, windows bulletproof
One night, he jumped out the car
And caught a bullet in his bubblegoose
He caught a bullet in his bubblegoose
He caught a bullet in his bubblegoose
You can be at the party gettin' loose
But you can catch a bullet in your bubblegoose

Hey yo, hey yo, my pen's in my hand, OK, what should I write next?
Oh yeah, and if you don't know, success brings stress
I'm vexed, my phone rings, collect caller from Jeff
The operator say, ""If you accept, say yes""
""Yes, what's the deal, son?""
""Yo, I got bad news""
Yo, by the tone of his voice, I heard the I'll street blues
""The friends will make you, them too can break you
They plan an execution like Fu Manchu""
""Who?""
""You know the character from channel 5 kung-fu (wahoo)""
""Slow down, man, Jeff, I'm losin' you""
""Hey yo, your cousin Rohann...""
""Uh-huh""
""Who used to sell bang""
""Uh-huh""
""DT's found his hand in the back of Bennigans""
""What?""
""In a plastic bag with a note attached""
""Saying what?""
""A million and a half or he won't be back""
""So meet me by the Brooklyn Bridge, 12:00 sharp""
""If not, at the funeral, you gotta play the harp""
Yo, why they wanna start and make me play my part?
Don't they know like Sting, I can turn this murder into art?
I jumped into my car, there's gotta be a joke
Traffic's backed up, who's in town, the Pope?
S-s-s-s-someone blew the horn, I turned and looked left
To my surprise, it was my sis, Melky Sedeck

Sit right back and hear a tale of a hustler 'round my way
He used to clock around the block from where my grandma stayed
Black BMW with rims to match, windows bulletproof
One night, he jumped out the car
And caught a bullet in his bubblegoose
He caught a bullet in his bubblegoose
He caught a bullet in his bubblegoose
You can be at the party gettin' loose
But you can catch a bullet in your bubblegoose

You're shootin' in the opposite position
I'm thinkin', ""Should I fire or hold back on ammunition
On your wig transition?""
My mission, like Take 6, is to spread love
But all you screwed mugs got me wearin' black gloves
You up in my face, I see the fear in your eyes
You gonna feel the pain like a grown man gettin' circumcised
Shalom, shalom, pardon my left
But my right hand's on your throat, massaging you to death
You provoke the cycle, call Michael
You're lookin' in the mirror, well, I'm in your window, oh oh
You hear me Urkel, your blood will turn purple
Like the color, you holler, bawlin' for your mother
No-one hears you even though you knock
You used to walk around the block with the daily rock
Things done changed since your spark got hot
Now you got your knot wocked with your very own Glock

Sit right back and hear a tale of a hustler 'round my way
He used to clock around the block from where my grandma stayed
Black BMW with rims to match, windows bulletproof
One night, he jumped out the car
And caught a bullet in his bubblegoose
He caught a bullet in his bubblegoose
He caught a bullet in his bubblegoose
You can be witcha girl gettin' loose
But you can catch a bullet in your goose
He caught a bullet in his bubblegoose
He caught a bullet in his bubblegoose
You can be at the party gettin' loose
But you can catch a bullet in your goose",Bubblegoose,1998
