Band,Lyrics,Song,Year
Victor Young & His Orchestra,"Heaven, I'm in Heaven  
And my heart beats so that I can hardly speak
And I seem to find the happiness I seek
When we're out together dancing, cheek to cheek

Heaven, I'm in Heaven
And the cares that hang around me thro' the week
Seem to vanish like a gambler's lucky streak
When we're out together dancing, cheek to cheek

Oh! I love to climb a mountain
And to reach the highest peak
But it doesn't thrill me half as much
As dancing cheek to cheek

Oh! I love to go out fishing 
In a river or a creek
But I don't enjoy it half as much
As dancing cheek to cheek

Dance with me
I want my arm about you
The charm about you
Will carry me thro' to Heaven

I'm in Heaven
And my heart beats so that I can hardly speak
And I seem to find the happiness I seek
When we're out together dancing cheek to cheek",Cheek to Cheek [From Top Hat],1999
Victor Young & His Orchestra,"Maybe you'll never be the love of my life,
Maybe I'm not the boy of you dreams,
But isn't it kinda fun to look in each others eyes,
Swapping romantic gleams!

Maybe you're not the girl to have and to hold,
Maybe I'm not a boy who would stay,
But isn't it kinda fun carousing around the town
Dancing the night away!

Isn't it kinda fun holding hands,
According to a sweet and corny custom.
Isn't it kinda fun makin' vows,
Admitting that we both intend to bust 'em!

Maybe we're out for laughs, a girl and a boy
Kiddin' across a table for two!
But haven't you got a hunch that this is the real McCoy,
And all the things we tell each other are true?

Oh, isn't it kinda fun holding hands,
According to a sweet and corny custom.
Isn't it kinda fun makin' vows,
Admitting that we both intend to bust 'em!

Maybe we're out for laughs, a girl and a boy
Kiddin' across a table for two!
But haven't you got a hunch that this is the real McCoy,
And all the things we tell each other are true?",Isn't It Kinda Fun,1999
Victor Young & His Orchestra,"A country dance was being held in a garden
I felt a bump and heard an ""Oh, beg your pardon""
Suddenly I saw polka dots and moonbeams
All around a pug-nosed dream

The music started and was I the perplexed one
I held my breath and said ""May I have the next one?""
In my frightened arms, polka dots and moonbeams
Sparkled on a pug-nosed dream

There were questions in the eyes of other dancers
As we floated over the floor
There were questions but my heart knew all the answers
And perhaps a few things more

Now in a cottage built of lilacs and laughter
I know the meaning of the words ""Ever after""
And I'll always see polka dots and moonbeams
When I kiss the pug-nosed dream",Polka Dots and Moonbeams,1999
Victor Young & His Orchestra,"Dinner is ended, the music is grand,
Softly the lanterns gleam.
Isn't it splendid to sit hand in hand,
Silently lost in a dream?

Hands across the table
While the lights are low,
Tho' you hush your lips,
Your fingertips
Tell me all I want to know.
Hands across the table
Meet so tenderly,
And they say in their little way 
That you belong to me

Silence is golden, so do not reply,
And I shall understand.
All can be told in a look of your eye,
And in a touch of your hand.

Hand across the table
While the lights are low,
Tho' you hush your lips,
Your fingertips
Tell me all I want to know.
Hands across the table
Meet so tenderly,
And they say in their little way 
That you belong to me",Hands Across the Table [Take B],1999
Victor Young & His Orchestra,"Darling, je vous aime beaucoup
Je ne sais pas what to do
You know you've completely
Stolen my heart

Morning, noon and night-time too
Toujours, wondering what to do
That's the way I've felt
Right from the start

Ah, Cherie!
My love for you is tres, tres fort
Wish my French were good enough
I'd tell you so much more

But I hope that you compris
All the things you mean to me
Darling, je vous aime beaucoup 
I love you, yes I do

Wish my French were good enough
I'd tell you so much more

But I hope that you compris
All the things you mean to me
Darling, je vous aime beaucoup
I love you, yes I do

(Darling, je vous aime beaucoup)
I love you, yes I do","Darling, Je Vous Aime Beaucoup",1999
Victor Young & His Orchestra,"Blue moon you saw me standing alone
Without a dream in my heart
Without a love of my own
Blue moon, you knew just what I was there for
You heard me saying a prayer for 
Someone I really could care for
And then there suddenly appeared before me
The only one my arms will ever hold
I heard somebody whisper ""Please adore me""
And when I looked, the moon had turned to gold!
Blue moon! 
Now I'm no longer alone
Without a dream in my heart
Without a love of my own",Blue Moon [Dodge Show],1999
Victor Young & His Orchestra,"You're all I want for Christmas
All I want my whole life through
Each day is just like Christmas
Anytime that I with you

You're all I want for Christmas
And if all my dreams come true
Then I'll awake on Christmas mornin'
And find my stocking filled with you

(You're all I want for Christmas)
(All I want my whole life through)
Each day is just like Christmas
Anytime that I with you

(You're all I want for Christmas)
(And if all my dreams come true)
Then I'll awake on Christmas mornin'
And find my stocking filled with you
(And find my stocking filled with you)",You're All I Want for Christmas,2000
Victor Young & His Orchestra,"You stepped out of a dream
You are too wonderful to be what you seem!
Could there be eyes like yours, 
Could there be lips like yours
Could there be smiles like yours, 
Honest and truly?
You stepped out of a cloud
I want to take you away, away from the crowd
And have you all to myself, 
Alone and apart out of a dream, 
Safe in my heart
 
You stepped out of a dream
You are too wonderful to be what you seem!
Could there be eyes like yours, 
Could there be lips like yours
Could there be smiles like yours, 
Honest and truly?
You stepped out of a cloud
I want to take you away, away from the crowd
And have you all to myself, 
Alone and apart out of a dream, 
Safe in my heart",You Stepped Out of a Dream,2000
Victor Young & His Orchestra,"La-la-la-la-la-la
La-la-la-la-la-la-la-la-la-la
La-la-la-la-la-la
La-la-la-la-la-la-la-la-la-la

We're busy doin' nothin'
Workin' the whole day through
Tryin' to find lots of things not to do
We're busy goin' nowhere
Isn't it just a crime
We'd like to be unhappy, but
We never do have the time

I have to watch the river
To see that it doesn't stop
And stick around the rosebuds
So they'll know when to pop
And keep the crickets cheerful
They're really a solemn bunch
Hustle, bustle
And only an hour for lunch

La-la-la-la-la-la
La-la-la-la-la-la-la-la-la-la
La-la-la-la-la-la
La-la-la-la-la-la-la-la-la-la

We're busy doin' nothin'
Workin' the whole day through
Tryin' to find lots of things not to do
We're busy goin' nowhere
Isn't it just a crime
We'd like to be unhappy, but
We never do have the time

I have to wake the Sun up
He's liable to sleep all day
And then inspect the rainbows
So they'll be bright and gay
I must rehearse the songbirds
To see that they sing in key
Hustle, bustle
And never a moment free

We're busy doin' nothin'
Workin' the whole day through
Tryin' to find lots of things not to do
We're busy going nowhere
Isn't it just a crime
We'd like to be unhappy, but
We never do have the time

I have to meet a turtle
I'm teachin' him how to swim
Then I have to shine the dewdrops
You know they're looking rather dim
I told my friend, the robin
I'd buy him a brand new vest
Hustle, bustle
We never do have
We never do have
We never do, never do
Never do, never do, never do have the time
Never do have the time",Busy Doing Nothing,2000
Victor Young & His Orchestra,"Have some pittie on an easterner,
Show a little sympathy
No one could possible could be steerner
Than you have been with me,

A.. there's a job that I'm applying for
Let me put it to ya thus
There's a partner ship I'm dien' for
Mr. and Mrs. us

So before you file it on the shelf,
Let me tell you of myself

Oh I'm the chapie to make ya happy
I'll tie your shoesies, and chase you bluesies
Oh lady would ya, could ya use me

Now I'd shake the mat out
And let the cat out
I'll clean the garret
And feed the parrot
Oh lady would ya, oh tell me could ya use me?

Do ya realize what a good man your getting in me?
I'm no elker mason or woodman who gets home at three
The girls that see me grow soft and dreamy
But I'm a gander that wont falander
Oh could ya use me, cause I certainly could use you

There's a chap I know in Mexico
Who's as strong as he can be
Eating nails and drinking Texaco
He is the type for me

There is one I California
More romantic far than you
When he sings ha cha cha chornia
I often think he'll do

But as for you sir, I'm afraid
You will never make the grade

For your no cowboy, your soft, and how, boy
I feel no mussel that's fit for tussle
I must refuse you, I cannot use you

'scuse me

No night life for the
Birds would bore youthe cows wont know you,
A horse would throw you,
You silly man you
To ask me, can you use me?

Ha

Though at love you may be a wizard, I'm wanting to know
Could you warm me up in a blizzard
Say, forty below
Your ties are freakish
Your knees are weakish
Your not a zender, you elbow bender
Though you can use me
I most certainly cant use you",Could You Use Me?,2000
Victor Young & His Orchestra,"Falling in love again
Never wanted to
What am I to do?
I can't help it

Love's always been my game
Play it how I may
I was made that way
I can't help it

Men cluster to me like moths around a flame
And if their wings burn, I know I'm not to blame

Falling in love again
Never wanted to
What am I to do?
I can't help it

Men cluster to me like moths around a flame
And if their wings burn, I know I'm not to blame

Falling in love again
Never wanted to
What am I to do?
I can't help it",Falling in Love Again,2000
Victor Young & His Orchestra,"It was just a neighborhood dance
That's all that it was
But, oh, what it seemed to be

It was like a masquerade ball
With costumes and all
'Cause you were at the dance with me

It was just a ride on a train
That's all that it was
But, oh, what it seemed to be

It was like a trip to the stars
To Venus and mars
'Cause you were on the train with me

And when I kissed you, Darling
It was more than just a thrill for me
It was the promise, Darling
Of the things that fate had willed for me

It was just a wedding in June
That's all that it was
But, oh, what it seemed to be

It was like a royal affair
With everyone there
'Cause you said ""Yes, I do"" to me",Oh! What It Seemed to Be,2000
Victor Young & His Orchestra,"Long ago and far away
I dreamed a dream one day
And now that dream is here beside me
Long the skies were overcast
But now the clouds have passed
You're here at last
Chills run up and down my spine
Aladdin's lamp is mine
The dream I dreamed was not denied me
Just one look and then I knew
That all I longed for long ago was you

Long ago and far away
I dreamed a dream one day
And now that dream is here beside me
Long the skies were overcast
But now the clouds have passed
You're here at last
Chills run up and down my spine
Aladdin's lamp is mine
The dream I dreamed was not denied me
Just one look and then I knew
That all I longed for long ago was you

Just one look and then I knew
(Him, with her humming along)
That all I longed for long ago

Was you",Long Ago (And Far Away),2000
Victor Young & His Orchestra,"Tubby (Tim Hauser)
Alone am I, me and I together.
If I went away from me, 
How unhappy I would be,
Me and I, oh my.

Bullfrog (Alan Paul)
Bug-Gup! Bug-Gup!
Lovely evening!
Bug-Gup! Bug-Gup!
I said. ""lovely evening!""
Clunk! Clunk! Clunk!
I said, ""Bee-oo-tiful evening!""
Hello! Bug-Gup!
Hello! Bug-Gup!
Hello!",Tubby the Tuba,2000
Victor Young & His Orchestra,"[Darkies work on de Mississippi,
Darkies work while de white folks play,
Pullin' dose boats from de dawn to sunset,
Gittin' no rest till de judgement day.
or musical part]

Don't look up
An' don't look down,
You don' dast make
De white boss frown.
Bend your knees
An'bow your head,
An' pull date rope
Until you' dead.)

Let me go 'way from the Mississippi,
Let me go 'way from de white man boss;
Show me dat stream called de river Jordan,
Dat's de ol' stream dat I long to cross.

O' man river,
Dat ol' man river,
He mus'know sumpin'
But don't say nuthin'
He jes' keeps rollin'
He keeps on rollin' along.

Long ol' river forever keeps rollin' on...

He don' plant tater,
He don' plant cotton,
An' dem dat plants 'em
Is soon forgotten,
but ol' man river,
He jes' keeps rollin' along.

Long ol' river keeps hearing dat song.
You an' me, we sweat an' strain,
Body all achin an' racked wid pain.
Tote dat barge!
Lif' dat bale!
Git a little drunk
An' you land in jail.

Ah, gits weary
An' sick of tryin'
Ah'm tired of livin'
An' skeered of dyin',
But ol' man river,
He jes'keeps rollin' along!
",Ol' Man River [From Show Boat],2001
Victor Young & His Orchestra,"Oh, it's a long, long while from May to December
But the days grow short when you reach September
When the autumn weather turns the leaves to flame
One hasn't got time for the waiting game

Oh, the days dwindle down to a precious few
September, November
And these few precious days I'll spend with you
These precious days I'll spend with you",September Song [From Knickerbocker Holiday],2001
Victor Young & His Orchestra,"Got a little rhythm, a rhythm, a rhythm 
That pit-a-pats through my brain; 
So darn persistent, 
The day isn't distant 

When it'll drive me insane. 
Comes in the morning 
Without any warning, 
And hangs around me all day. 

I'll have to sneak up to it 
Someday, and speak up to it. 
I hope it listens when I say: 

Fascinating Rhythm, 
You've got me on the go! 
Fascinating Rhythm, 
I'm all a-quiver. 

When a mess you're making! 
The neighbours want to know 
Why I'm always shaking 
Just like a flivver. 

Each morning I get up with the sun
Start a-hopping, 
Never stopping 
To find at night no work has been done. 

I know that 
Once it didn't matter
But now you're doing wrong; 
When you start to patter 

I'm so unhappy. 
Won't you take a day off? 
Decide to run along 
Somewhere far away off

And make it snappy! 
Oh, how I long to be the man I used to be! 
Fascinating rhythm, 
Oh won't you stop picking on me?",Fascinating Rhythm,2001
Victor Young & His Orchestra,"Love can be a moment's madness
Love can be insane
Love can be a life of sadness and pain

Love can be a summer shower
Love can be the sun
Love can be two hearts that flower as one

It can be, fine and free
But that kind
Is not so very easy to find

Love can be a dying ember
Love can be a flame
Love pledged in September
May be dead in December
You may not even remember it came

Love can be a joy forever
Or an empty name
Love is almost never ever the same

Love can be an evil-doer
Love can be a fog
Love can make you feel like you were a dog

Love can be a snow-capped mountain
Love can be the truth
Love can be an endless fountain of youth

It can be ecstasy
But it's true
It doesn't always happen to you

Love can be a four-score failure
Love can bring you fame
Love fresh as the morning
May be wild when it's 'borning
And then without any warning, it's tame

Oh love can be a sweet endeavor
Or a dirty shame
Love is almost never ever, the same!",Love,2001
Victor Young & His Orchestra,"I've been away from you a long time 
I never thought I'd miss you so 
Somehow I feel your love is real
Near you I long to be

The birds are singing, it is song time 
The banjos strummin' soft and low 
I know that you 
Yearn for me too
Swanee, you're calling me

Swanee
How I love you, how I love you 
My dear old Swanee! 
I'd give the world to be among the folks in 
D-I-X-I
Even now my mammy's waiting for me 
Praying for me, down by the Swanee

The folks up north will see me no more 
When I go to the Swanee shore! 

Swanee! Swanee!
I'm coming back to Swanee 
Mammy, mammy
I love the old folks at home!

Swanee!
How I love you, how I love you 
My dear old Swanee! 
I'd give the world to be among the folks in 
D-I-X-I
Even now my mammy's waiting for me
Praying for me, down by the Swanee

The folks up north will see me no more 
When I go to the Swanee shore!",Swanee,2001
Victor Young & His Orchestra,"Lullaby and good night
In the sky stars are bright
'Round your head
Flowers gay
Set you slumbers till day

Lullaby and good night
In the sky stars are bright
'Round your head
Flowers gay
Set you slumbers till day

Close your eyes
Now and rest
May these hours
Be blessed

Close your eyes
Now and rest
May these hours
Be blessed

Bonne nuit cher enfant
Dans tes langes blancs
Repose joyeux
En revant des cieux

Good night dear child 
In your white sheets 
Rest happy 
Dreaming of Heaven
Quand le jour reviendra
Tu te reveilleras
Quand le jour reviendra
Tu te reveilleras

When day will be back 
You'll wake up again 
When day will be back 
You'll wake up again
Lullaby and good night
In the sky stars are bright
'Round your head
Flowers gay
Set you slumbers till day","Lullaby [From ""Jocelyn""]",2001
Victor Young & His Orchestra,"We ought to bake a sunshine cake
It does more good than a big thick steak

Start with a tablespoon of trouble
Then add a smile and let it bubble up
We ought to bake a sunshine cake
It isn't really so hard to make
Fresh tears, a pound or two of pleasure
Kind words you needn't use a measure cup

It's not from a recipe book
You don't have to be a good cook
Or run to the oven and look

With such a simple dish, all you do is wish
So why not bake a sunshine cake
Of course it may keep your dreams awake
FRANK:
Friends say there's nothing like the flavor
Don't wait to do your friends a favor
And for goodness sake, let's bake a sunshine cake

It's got vitamins A, vitamins B
Vitamins L-O-V-E
If you're fat, it's for that
If you're thin, stuff it in

What's wrong if you get a double grin
We ought to bake a sunshine cake

It's not from a recipe book
You don't have to be a good cook

Or run to the oven and look
With such a simple dish, all you do is wish
So why not bake a sunshine cake
Of course it may keep your dreams awake
Friends say there ain't nothing like the flavor
Don't wait to do your friends a favor
And for goodness sake, let's bake a sunshine cake",Sunshine Cake,2001
Victor Young & His Orchestra,"I hate to see that evening sun go down
I hate to see that evening sun go down
Cause my baby, he's gone left this town

Feelin' tomorrow like I feel today
If I'm feelin' tomorrow like I feel today
I'll pack my truck and make my give-a-way

St. Louis woman with her diamond ring
Pulls that man around by her, if it wasn't for her and her
That man I love would have gone nowhere, nowhere

I got the St. Louis blues, blues as I can be
That man's got a heart like a rock cast in the sea
Or else he wouldn't have gone so far from me

I love my baby like a school boy loves his pie
Like a Kentucky colonel loves his mint 'n rye
I love my man till the day I die",St. Louis Blues,2001
Victor Young & His Orchestra,"Love, oh love, oh careless love
You've fly through my head like wine
You've wrecked the life of a many poor girl
And you nearly spoiled this life of mine

Love, oh love, oh careless love
In your clutches of desire
You've made me break a many true vow
Then you set my very soul on fire

Love, oh love, oh careless love
All my happiness bereft
You've filled my heart with weary old blues
Now I'm walkin', talkin' to myself

Love, oh love, oh careless love
Trusted you now, it's too late
You've made me throw my old friend down
That's why I sing this song of hate

Love, oh love, oh careless love
Night and day, I weep and moan
You brought the wrong man into this life of mine
For my sins, till judgment I'll atone",Careless Love,2001
Victor Young & His Orchestra,"I'll follow my secret heart
My whole life through
I'll keep all my dreams apart
Till one comes true
No matter what price is paid
What stars may fade above
I'll follow my secret heart
Till I find love

I'll keep all my dreams apart
Till one comes true
No matter what price is paid
What stars may fade above
I'll follow my secret heart
Till I find love",I'll Follow My Secret Heart,2001
Victor Young & His Orchestra,"Was down where fisher folk gathered
I wandered far from the throng
I heard a fisher girl singin'
And this refrain was her song

Red sails in the sunset way out on the sea
Oh carry my loved one home safely to me
He sailed at the dawning, all day I've been blue
Red sails in the sunset, I'm trusting in you

Swift wings you must borrow, make straight for the shore
We marry tomorrow and he goes sailing no more
Red sails in the sunset way out on the sea
Oh carry my loved one home safely to me

Swift wings you must borrow, make straight for the shore
We marry tomorrow and he goes sailing no more
Red sails in the sunset way out on the sea
Oh carry my loved one home safely to me",Red Sails in the Sunset,2001
Victor Young & His Orchestra,"Silent night, holy night
All is calm and all is bright
'Round yon Virgin Mother and Child
Holy Infant, so tender and mild
Sleep in heavenly peace
Sleep in heavenly peace

Silent night, holy night
Shepherds quake at the sight
Glories stream from Heaven afar
Heavenly Hosts sing Alleluia
Christ, the Savior, is born
Christ, the Savior, is born

Silent night, holy night
Child of heaven, oh how bright
Thou didst smile when thou wast born
Blessed be that happy morn
Full of heavenly joy
Full of heavenly joy",Silent Night,2001
Victor Young & His Orchestra,"Till the end of time,
Long as stars are in the blue,
Long as there's a spring, a bird to sing,
I'll go on loving you.

Till the end of time,
Long as roses bloom in May,
My love for you will grow deeper,
With every passing day.

Till the wells run dry,
And each mountain disappears,
I'll be there for you, to care for you,
Through laughter and through tears.

So, take my heart in sweet surrender,
And tenderly say that I'm,
The one you love and live for,
Till the end of time.",Till the End of Time,2001
Victor Young & His Orchestra,"[Chorus:]
I've got spurs that jingle jangle jingle
As I go riding merrily along
And they sing, ""oh ain't you glad you're single
And that song ain't so very far from wrong

Oh Maryanne, oh Maryanne
Tho we done some moonlight walkin'
This is why I up and ran
Oh Sally Jane, oh Sally Jane
Tho I'd love to stay forever
This is why I can't remain
Oh Lillybelle, oh Lillybelle
This is why I never fell","(I Got Spurs That) Jingle, Jangle, Jingle",2001
Victor Young & His Orchestra,"When love in to my dreams was creeping 
I gave my heart in to your keeping 
It brought the harvest I am reaping 
And I always wonder now

When summer twilight's gently falling 
I'd love to know if you're recalling 
Your tender words to me enthralling 
And my heart is wond'ring still

When you have another's arms about you, 
Do you ever think of me 
When you whisper ""I can't live without you,"" 
Do you ever think of me 
And when your eyes disguise the same old loving lies, 
You tell so tenderly 
Deep in your heart unfeeling 
When some heart you're stealing 
Do you ever think of me.",Do You Ever Think of Me?,2001
Victor Young & His Orchestra,"You made me love you
I didn't want to do it
I didn't want to do it
You made me want you
And all the time you knew it
I guess you always knew it

You made me happy sometimes
You made me glad
But there were times
You made me feel so bad

You made me cry for
I didn't want to tell you
I didn't want to tell you
I want some love that's true
Yes, I do, 'deed I do
You know I do

Gimme, gimme, gimme, gimme what I cry for
You know you've got the brand of kisses
That I'd die for
You know you made me love you

You made me cry for
I didn't want to tell you
I didn't want to tell you
I want some love that's true
Yes, I do, 'deed I do
You know I do

Gimme, gimme, gimme, gimme what I cry for
You know you've got the brand of kisses
That I'd die for
You know you made me love you",You Made Me Love You,2001
Victor Young & His Orchestra,"Why do I love you I love you not only for what you are
But for what I am when I'm with you
I love you not only for what you've made of yourself
But for what you're making of me
I love you for ignoring the possibilities of the fool in me
And for laying firm hold of the possibilities for good in me
Why do I love you I love you for closing your eyes to the dischords
And for adding to the music in me by worshipful listening
I love you because you're helping to make of the lumber of my life
Not a tavern but a temple
And out of the words of my everyday not a reproach but a song
I love you because you have done more than any creed to make me happy
You have done it without a word without a touch without a sign
You have done it just by being yourself and after all perhaps that's what love means","Why Do I Love You, song (from ""Show Boat"") [From Show Boat]",2001
