Band,Lyrics,Song,Year
Chorus,"Zoom zoom, zoom zoom
The world is in a mess
With politics and taxes
And people grinding axes
There's no happiness

Zoom zoom, zoom zoom
Rhythm lead your ace
The future doesn't fret me
If I can only get me
Someone to slap that bass

Happiness is not a riddle
When I'm listening to that
Big bass fiddle

Slap that bass
Slap it till it's dizzy
Slap that bass
Keep the rhythm busy
Zoom zoom zoom
Misery, you've got to go

Slap that bass
Use it like a tonic
Slap that bass
Keep your Philharmonic
Zoom zoom zoom
And the milk and honey'll flow

Dictators would be better off
If they zoom zoom now and then
Today, you can see that the happiest men
All got rhythm

In which case
If you want a bauble
Slap that bass
Slap away your trouble
Learn to zoom zoom zoom
Slap that bass",Slap That Bass,2000
Chorus,"Partirono le rondini dal mio paese freddo
E senza sole
Cercando primavere di viole
Nidi d'amore e di felicit
La mia piccola rondine part
Senza lasciarmi un bacio
Senza un addio part

Non ti scordar di me
La vita mia legata a te
Io t'amo sempre pi
Nel sogno mio rimani tu
Non ti scordar di me
La vita mia legata a te
C' sempre un nido nel mio cor per te
Non ti scordar di me

Non ti scordar di me! 

Non ti scordar di me
La vita mia legata a te
C' sempre un nido nel mio cor per te
Non ti scordar di me",Non Ti Scordar Di Me,2000
Chorus,"I used to fall in love with all
Those boys who maul refined ladies
But now I tell each young gazelle
To go to hell, I mean, hades

For since I've come to care
For such a sweet millionaire

While tearing off a game of golf
I may make a play for the caddy
But when I do, I don't follow through
'Cause my heart belongs to daddy

If I invite a boy some night
To dine on my fine finnan haddie
I just adore his asking for more
But my heart belongs to daddy

Yes, my heart belongs to daddy
So I simply couldn't be bad
Yes, my heart belongs to daddy
Da da da, da da da, da da da

So I want to warn you, laddie
Though I think you're perfectly swell
That my heart belongs to Daddy
'Cause my Daddy he treats it so well

Yes my heart belongs to daddy
So I simply couldn't be bad
Yes, my heart belongs to daddy
Da da da, da da da, da da da

So I want to warn you, laddie
Though I think you're perfectly swell
That my heart belongs to daddy
'Cause my Daddy he treats it so well

He treats it and treats it and then he repeats it
Yes daddy, he treats it so well",My Heart Belongs to Daddy,2000
Chorus,"You do something to me
Something that simply mystifies me
Tell me, why should it be
You have the power to hypnotize me?

Let me live 'neath your spell
Do do that voodoo that you do so well
Cause you do something to me
That nobody else could do

You do something to me
Something that simply mystifies me
Tell me, why should it be
You got the power to hypnotize me?

Let me live 'neath your spell
Do do that voodoo that you do so well
Cause you do something to me
That nobody else can do
That no one else in the world can do",You Do Something to Me,2000
Chorus,"You are my world my darling
What a wonderful world I see
You are the song I'm singing
You're my beautiful Melody

Darling, we better be going
Look at her isn't she glowing
She looks divine, and you look exquisite
But look at the time
Couldn't be is it

The crew is awaiting your orders
We're sailing away from the borders
Steady boy steady
Ahoy there, they're coming
Trumpeters ready, drummers start drumming

Down to the sea we go
Down to a world I know
There's never been
Not ever before
A child born of sea and shore

Down to the sea we go
Down to the world below
A journey to bless
A princess to be
Under the sun, and under the sea

Ariel is coming, Ariel is coming 
Ariel is coming, Ariel is coming 
Ariel is coming, Ariel is coming 
Ariel is coming, Ariel is coming 
Ariel is coming, Ariel is coming 
Ariel is coming, Ariel is coming 
What's all the big commotion
That's spreading through the ocean
From sea to shining sea
There is no hesitating
Today we're celebrating
Ariel's Melody


Today when Triton's daughter
Comes back here to the water
We're gonna have a spree
The boat is nearer now
I think I hear her now
Ariel's Melody

Lad-da-di-da 
Lad-da-di-da 
Lad-da-di-da 

Up from the sea we rise
Up to the world of skies
There's never been
Not ever before
A child born of sea and shore

Up from the sea we rise
Up to the world of skies
Forever to be
Together as one
Under the sea
And under the sun

This is your world my darling
One world the land and sea
My hope for you for always
Is that your heart will part of me
Down to the sea we go
Down to the world we know
Together we come
Forever to be
Under one sun
The land and the sea",Down to the Sea,2000
Chorus,"Because of you there's a song in my heart
Because of you my romance had its start
Because of you the sun will shine
The moon and stars will say you're mine
Forever and never to part

I only live for your love and your kiss
It's paradise to be near you like this
Because of you my life is now worthwhile
And I can smile
Because of you

[Instrumental Interlude]

I only live for your love and your kiss
It's paradise to be near you like this
Because of you my life is now worthwhile
And I can smile
Because of you",Because of You,2000
Chorus,"I was high and mighty,
How I laughed at love
And the stars above,
Then you came like a gentle flame
And helped me to find my way!
I was high and mighty 
And I told my heart
Where to stop and start,
Now I find that I was blind,
I'm learning it day by day!
Love can change things,
Rearrange things,
Oh, what strange things
Love can do!
I'm not high and mighty
But I have what's worth
All the gold on earth,
I have you and I give my heart
Forever and ever to you, you, you!",The High and the Mighty,2000
Chorus,"Oh, my love, my darling,
I've hungered for your touch a long, lonely time,
Time goes by so slowly and time can do so much.
Are you still mine?
I need your love, I need your love, God speed your love to me.

Lonely rivers flow to the sea, to the sea
To the open arms of the sea
Lonely rivers sigh, ""Wait for me, wait for me""
""I'll be coming home, wait for me!""

Are you still mine?
I need your love, I need your love, God speed your love to me.",Unchained Melody,2000
Chorus,"Come on and hear, come on and hear
Alexander's Ragtime Band
Come on and hear, come on and hear 
It's the best band in the land

They can play a bugle call
Like you never heard before
So natural that you want to go to war

That's just the bestest band what am, Honey Lamb

Come on along, come on along
Let me take you by the hand
Up to the man, up to the man
Who's the leader of the band

And if you want to hear the Swanee River played in ragtime

Come on and hear, come on and hear
Alexander's Ragtime Band",Alexander's Ragtime Band [End Titles],2001
Chorus,"(Baar baar haan, bolo yaar haan
Apni jeet ho, unki haar haan)
Koi humse jeet na paave
Chale chalo, chale chalo
Mit jaave jo takraave, chale chalo
Bhale ghor andheraa chhaave
Chale chalo, chale chalo
Koi raah mein na thaam jaawe, chale chalo
Toot gayi jo ungli utthi
Paanchon mili to ban gaye mutthi
Eka badhta hi jaawe
Chale chalo, chale chalo
Koi kitna bhi bahekaave, chale chalo
Koi humse jeet na paave
Chale chalo, chale chalo
Mit jaave jo takraave, chale chalo

Koi na ab roke tujhe, toke tujhe
Tod de bandhan saare
Mila hai kya hoke tujhe nirbal, tu hi bataa

Kabhi na dukh jhelenge, khelenge
Aise ke dushman haare
Ke ab to le lenge, himmat ka rasta
Dharti hilaa denge, sab ko dikhaa denge
Raja hai kya, parja hai kya, oh oh oh
Hum jag pe chhaayenge, ab yeh bataayenge
Hum logon ka darja hai kya, ho oh oh oh
Baar baar haan, bolo yaar haan
Apni jeet ho, unki haar haan
Ab darr nahin mann mein aave
Chale chalo, chale chalo
Har bedi ab khul jaave, chale chalo

Chalaa hi chal, haanf nahin, kaanp nahin
Raah mein ab to raahi
Thakan ka saanp nahin ab tujhe dasne paaye

Vohi jo tera haaqim hai, jaalim hai
Ki hai jisne tabaahi
Ghar uska pachhim hai, yahan na bas mein paaye
Dharti hilaa denge, sab ko dikhaa denge
Raja hai kya, parja hai kya, oh oh oh
Hum jag pe chhaayenge, ab yeh bataayenge
Hum logon ka darja hai kya, ho oh oh oh
Jo hona hai, ho jaave
Chale chalo, chale chalo
Ab sar na koi jhukaave, chale chalo
Koi humse jeet na paave
Chale chalo, chale chalo
Mit jaave jo takraave, chale chalo
Baar baar haan, bolo yaar haan
Apni jeet ho, unki haar haan
(Toot gayi jo ungli utthi
Paanchon mili to ban gaye mutthi)",Chale Chalo,2001
Chorus,"I'm as corny as Kansas in August,
I'm as normal as blueberry pie.
No more a smart little girl with no heart,
I have found me a wonderful guy!
I am in a conventional dither,
With a conventional star in my eye.
And you will note there's a lump in my throat
When I speak of that wonderful guy!
I'm as trite and as gay as a daisy in May,
A cliche coming true!
I'm bromidic and bright as a moon happy night
Pouring light on the dew!
I'm as corny as Kansas in August,
High as a flag on the Fourth of July!
If you'll excuse an expression I use,
I'm in love, I'm in love,
I'm in love, I'm in love,
I'm in love with a wonderful guy!",A Wonderful Guy,2001
Chorus,"It's a grand night for singing,
The moon is flying high, 
And somewhere a bird 
Who is bound he'll be heard 
Is throwing his heart at the sky! 

It's a grand night for singing,
The stars are bright above.
The earth is a-glow
And to add to the show,
I think I am falling in love! 
Falling, falling in love. 

[Chorus]
It's a grand night for singing,
The moon is flying high,
And somewhere a bird
Who is bound he'll be heard,
Is throwing his heart at the sky!

Maybe it's more than the moon,
Maybe it's more than the birds,
Maybe it's more than sight of the night,
In a light too lovely for words. 

Maybe it's more than the earth
Shiny in silvery blue.
Maybe the reason I'm feeling this way
Has something to do with you! 

[Chorus]

It's a grand night for singing,
The stars are bright above.
The earth is a-glow
And, to add to the show
I think I am falling in love! 
Falling, falling in love! 

Margie and Pat:
It's a grand night for singing,
The moon is flying high,
And somewhere a bird 
Who is bound he'll be heard,
Is throwing his heart at the sky! 

[Chorus]","It's a Grand Night for Singing, song (from film ""State Fair"") [From Sta",2001
Chorus,"When you walk through a storm
Hold your chin up high
And don't be afraid of the dark.
At the end of a storm
Is a golden sky
And the sweet, silver song of a lark.
Walk on, through the wind,
Walk on, through the rain,
Though your dreams be tossed and blown.
Walk on, walk on with hope in your heart,
And you'll never walk alone,
You'll never walk alone.","You'll Never Walk Alone, song (from ""Carousel"") [From Carousel]",2001
Chorus,"I'm gonna wash that man right outa my hair,
I'm gonna wash that man right outa my hair,
I'm gonna wash that man right outa my hair,
And send him on his way.

I'm gonna wave that man right outa my arms,

I'm gonna wave that man right outa my arms,
I'm gonna wave that man right outa my arms,
And send him on his way.

Don't try to patch it up

Tear it up, tear it up!

Wash him out, dry him out,

Push him out, fly him out,

Cancel him and let him go!

Yea, sister!

I'm gonna wash that man right outa my hair,
I'm gonna wash that man right outa my hair,
I'm gonna wash that man right outa my hair,
And send him on his way.

If a man don't understand you,
If you fly on separate beams,
Waste no time, make a change,
Ride that man right off your range.
Rub him out of the roll call
And drum him out of your dreams.

Oho! If you laugh at different comics,
If you root for different teams,
Waste no time, weep no more,
Show him what the door is for.
Rub him out of the roll call
And drum him out of your dreams.

You can't light a fire when the woods are wet,

No!

You can't make a butterfly strong,

Hmm, hmm!

You can't fix an egg when it ain't quite good,

And you can't fix a man when he's wrong!

You can't put back a petal when it falls from a flower,
Or sweeten up a fellow when he starts turnin' sour

Oh no! Oh no!

If his eyes get dull and fishy,
When you look for glints and gleams,
Waste no time,
Make a switch,
Drop him in the nearest ditch!
Rub him out of the roll call,
And drum him out of your dreams
Oho! Oho!

I went to wash that man right outa my hair,
I went to wash that man right outa my hair,
I went to wash that man right outa my hair,
And sent him on his way.

She went to wash that man right outa my hair,
She went to wash that man right outa my hair,
She went to wash that man right outa my hair,

And send him on his way!",Gonna Wash That Man Right Outta My Hair,2001
Chorus,"[Laurey:]
Why should a woman who is healthy and strong
Blubber like a baby if her man goes away
A weeping and a wailing how he's done her wrong?
That's one thing you'll never hear me say

Never gonna think that the man I lose
Is the only man among men
I'll snap my fingers to show I don't care
I'll buy me a brand new dress to wear
I'll scrub my neck and I'll brush my hair
And start all over again

[Chorus:]
Many a new face will please my eye
Many a new love will find me
Never have I once looked back to sigh
Over the romance behind me
Many a new day will dawn
Before I do

Many a light lad may kiss and fly
A kiss gone by is bygone
Never have I asked an August sky
Where has last July gone?
Never have I wandered through the rye
Wondering where has some guy gone
Many a new day will dawn
Before I do

[Together:]

[Chorus]

[Laurey:]
Never have I chased the honeybee
Who carelessly cajoled me
Somebody else just as sweet as he
Cheered me and consoled me
Never have I wept into my tea
Over the deal someone doled me

[Together:]
Many a new day will dawn

[Laurey:]
Many a red sun will set
Many a blue moon will shine
Before I do

[Together:]

[Chorus]

[Laurey:]
Many a red sun will set
Many a blue moon will shine
Before I do",Many a New Day,2001
Chorus,"VAUGHN MONROE AND HIS ORCHESTRA
VOCALS BY VAUGHN MONROE (VM) 
AND CHORUS (CH)
CH   THAT'S MY LOVE FOR YOU, EVERLASTING,
     EVERLASTING.
VM   THERE'S A FLOWER THAT GROWS ON THE SIDE 
     OF THE HILL,
     THE FLOWER THEY CALL 'EVERLASTING'.
     THROUGH THE HEAT OF THE SUMMER, THROUGH
     COLD WINTER'S CHILL,
     THE FLOWER LIVES ON, EVERLASTING.
VM   THAT'S MY,  (CH) THAT'S MY,
VM   LOVE FOR YOU, (CH)LOVE FOR YOU.
VM   EVERLASTING, (CH EVERLASTING,
VM   EVERLASTING, (CH)EVERLASTING.
VM   THAT'S MY,  (CH) THAT'S MY,
VM&CHLOVE FOR YOU, (CH)LOVE FOR YOU,
VM   FOR IT WILL NEVER DIE, (CH) NEVER DIE.
VM   AND IF WE SHOULD BE PARTED,
     I'LL WAIT FOR YOU STILL.
     MY HEART, LIKE A FLOWER, ON THE SIDE 
     OF A HILL,
     FILLED WITH LOVE, FILLED WITH LOVE,
     EVERLASTING, EVERLASTING.
ORCHESTRAL RECAP OF THE SONG. THEN;
VM&CH THAT'S MY LOVE FOR YOU,
      EVERLASTING, EVERLASTING.
      THAT'S MY LOVE FOR YOU,
      FOR IT WILL NEVER DIE.
VM    AND IF WE SHOULD BE PARTED,
      I'LL WAIT FOR YOU STILL,
      MY HEART, LIKE A FLOWER, ON THE 
      SIDE OF A HILL,
      FILLED WITH LOVE, (CH) FILLED WITH LOVE,
VM    FILLED WITH LOVE, (CH) FILLED WITH LOVE,
VM    EVERLASTING,  EVERLASTING.
VM    FILLED WITH LOVE,  (CH) FILLED WITH LOVE,
VM    FILLED WITH LOVE,  (CH) FILLED WITH LOVE,
VM&CH EVERLASTING, EVERLASTING.",Everlasting,2001
Chorus,"ON TOP OF OLD SMOKEY ALL COVERED WITH SNOW
I LOST MY TRUE LOVER FOR COURTING TOO SLOW
FOR COURTING'S A PLEASURE AND PARTING'S A GRIEF
AND A FALSE HEARTED LOVER IS WORSE THAN A THIEF
FOR A THIEF WILL JUST ROB YOU AND TAKE ALL YOU SAVE
BUT A FALSE HEARTED LOVER WILL LEAD YOU TO THE GRAVE
AND THE GRAVE WILL DECAY YOU AND TURN YOU TO DUST
NOT ONE GIRL IN A HUNDRED A POOR BOY CAN TRUST
THEY'LL HUG YOU AND KISS YOU AND TELL YOU MORE LIES
THAN CROSS LINES ON A RAILROAD OR STARS IN THE SKIES
SO COME ALL YOUR MAIDENS AND LISTEN TO ME
NEVER PLACE YOUR AFFECTIONS ON A GREEN WILLOW TREE
FOR THE LEAVES THEY WILL WITHER AND THE ROOTS THEY WILL DIE
YOU'LL ALL BE FORSAKEN AND NEVER KNOW WHY.",On Top of Old Smoky,2001
Chorus,"The night was mighty dark so you could hardly see
For the moon refused to shine
Couple sitting underneath the willow tree
For love, they pined

Little May was kinda 'fraid of darkness
So she says ""I guess I'll go.""
Boy began to sigh, looked up to the sky
Told the sky his little tale of woe

So shine on
Shine on harvest moon
Up in the sky

I ain't had no lovin' since January, February, June or July

Snow time ain't no time to stay outdoors and spoon
So shine on
Shine on harvest moon for me and my gal

Snow time ain't no time to stay outdoors and spoon
So shine on
Shine on harvest moon for me and my gal",Shine on Harvest Moon,2001
Chorus,"To the tables down at Mory's
To the place where Louie dwells
To the dear old Temple bar we love so well
Sing the Whiffenpoofs assembled with their glasses raised on high
And the magic of their singing casts it's spell

Yes, the magic of their singing of the songs we love so well
""Shall I Wasting"" and ""Mavourneen"" and the rest
We will serenade our Louie while life and voice shall last
Then we'll pass and be forgotten with the rest

We're poor little lambs who have lost our way
Baa, baa, baa
We're little black sheep who have gone astray
Baa, baa, baa

Gentleman songsters off on a spree
Doomed from here to eternity
Lord have mercy on such as we
Baa, baa, baa",The Whiffenpoof Song,2001
Chorus,"By the Adriatic waters Venetian sons and daughters
Are strumming a new tune upon their guitars.
It was written by a Latin, a gondolier who sat in
His home out in Brooklyn and gazed at the stars.

He sent his melody across the sea to Italy,
And we know they wrote some words to fit that catchy bit
And christened it the Piccolino.

And we know that it's the reason why
Everyone this season is strumming and humming a new melody.

Come to the Casino and hear them play the Piccolino.
Dance with your bambino to the strains of the catchy Piccolino.
Drink your glass of Vino, and when you've had your plate of Scallopino,
Make them play the Piccolino, the catchy Piccolino.
And dance to the strains of that new melody, the Piccolino.",Piccolino,2001
Chorus,"I have an ear for music, and I have an eye for a maid. 
I like a pretty girlie, with each pretty tune that's played. 
They go together, like sunny weather goes with the month of May. 
I've studied girls and music, so I'm qualified to say 

A pretty girl is like a melody that haunts you night and day, 
Just like the strain of a haunting refrain, 
She'll start up on a marathon and run a-round your brain. 
You can't escape she's in your memory. by morning night and noon. 
She will leave you and then come back a-gain, 
A pretty girl is just like a pretty tune.",A  Pretty Girl Is Like a Melody,2001
Chorus,"I just got an invitation through the mails
""Your presence requested this evening
It's formal, a top hat, a white tie and tails""
Nothing now could take the wind out of my sails
Because I'm invited to step out this evening
With top hat and white tie and tails

I'm puttin' on my top hat
Tyin' up my white tie
Brushin' off my tails
I'm dudin' up my shirt front
Puttin' in the shirt studs
Polishin' my nails
I'm steppin' out, my dear
To breathe an atmosphere 
That simply reeks with class
And I trust that you'll excuse my dust
When I step on the gas
For I'll be there
Puttin' down my top hat
Mussin' up my white tie
Dancin' in my tails

I'm puttin' on my top hat
Tyin' up my white tie
Brushin' off my tails
I'm dudin' up my shirt front
Puttin' in the shirt studs
Polishin' my nails
I'm steppin' out, my dear
To breathe an atmosphere 
That simply reeks with class
And I trust that you'll excuse my dust
When I step on the gas
For I'll be there
Puttin' down my top hat
Mussin' up my white tie
Dancin' in my tails","Top Hat, White Tie and Tails",2001
Chorus,"Don't ask me just how it happened
I wish I knew
I can't believe that it's happened
And still it's true

I got lost in his arms and I had to stay
It was dark in his arms and I lost my way

From the dark came a voice
And it seemed to say
There you go
There you go

How I felt as I fell I just can't recall
But his arms held me fast and it broke the fall

And I said to my heart
As it foolishly kept jumping all around
I got lost but look what I found

(There you go, there you go)

How I felt as I fell I just can't recall
But his arms held me fast and it broke the fall

And I said to my heart
As it foolishly kept jumping all around
I got lost but look what I found",I Got Lost in His Arms,2002
Chorus,"Like the Seminole, Navajo, Kickapoo
Like those Indians
I'm an Indian too
A Sioux
A Sioux
Just like Battle Axe, Hatchet Face, Eagle Nose
Like those Indians
I'm an Indian too
A Sioux
A Sioux
Some Indian summer's day
Without a sound
I may hide away
With Big Chief Hole-in-the-Ground
And I'll have totem poles, tomahawks, pipes of peace
Which will go to prove
I'm an Indian too
A Sioux
A Sioux
With my chief in his teepee
We'll raise an Indian family
And I'll be busy night and day

Looking like a flour sack
With two papooses on my back
And three papooses on the way
Like the Chippewa, Iroquois, Omaha
Like those Indians
I'm an Indian too
A Sioux
A Sioux
Just like Rising Moon, Falling Pants, Running Nose
Like those Indians
I'm an Indian too
A Sioux
A Sioux
Some Indian summer's day
Without a care
I may run away
With Big Chief Son-of-a-Bear
And I'll wear moccasins, wampum beads, feather hats
Which will go to prove
I'm an Indian too
A Sioux
A Sioux","I'm an Indian, Too",2002
Chorus,"Do you hear that playing? 
Yes we hear the playing, 
Do you know who's plying? 
No, who is that playing? 
Why it's Gabriel, Gabriel playing, 
Gabriel Gabriel saying, 
""Will you be ready to go when I blow my horn?"" 
Oh Blow, Gabriel, Blow, 
Go on and Blow Gabriel Blow 
I've been a sinner, I've been a scamp, 
But now I'm willin' to trim my lamp, 
So Blow, Gabriel, Blow 
I was low, Gabriel, low, 
Mighty low, Gabriel, low, 
But now since I have seen the light, 
I'm good by day and I'm good by night, 
So blow, Gabriel, blow, 
Once I was headed for hell, 
Once I was headed for hell, 
But when I got to Satan's door, 
I heard you blowin' on your horn once more 
So I said, ""Satan, farewell"" 
Now your all ready to fly 
Yes to fly higher and higher and higher 
Cause' you got through the brimstone, 
And you've been through the fire 
And you purged your soul, and your heart too 
So climb up the mountain top and start to 
Blow, Gabriel, Blow, 
Go on and Blow, Gabriel, Blow 
I was enjoying your happy band, 
That played all day in the promised land 
So Blow, Gabriel, Blow, 
Blow, Gabriel, Blow, 
Blow, Gabriel, Blow, 
Blow, Gabriel, Blow, 
I want to join your happy band, 
To play all day in the promised land 
So Blow, Gabriel, Blow, 
Blow, Gabriel, Blow, 
Blow, Gabriel, Blow, 
Blow, Gabriel, Blow, 
Blow, Gabriel, Blow 
Blow, Gabriel, Blow 
Blow, Gabriel, Blow!","Blow, Gabriel, Blow",2002
Chorus,"I get no kick from champagne,
Mere alcohol,
Doesn't thrill me at all,
So tell me, why should it be true,
That I get a kick out of you.

Some get a kick from cocaine,
I'm sure that if,
I took even one sniff,
It would bore me terrifically,too,
Yet I get a kick out of you.

I get a kick every time I see you,
Standing there before me,
I get a kick though it's clear to see,
You obviously don't adore me.

Some get a kick in a plane,
Flying too high,
With some gal in the sky,
Is my idea of nothing to do,
But I get a kick out of you.
I get a kick, out of you.",I Get a Kick Out of You,2002
Chorus,"Look out! Look out
Pink elephants on parade
Here they come
Hippety hoppety
They're here and there
Pink elephants everywhere

Look out! Look out!
They're walking around the bed
On their head
Clippety cloppety
Arrayed in braid
Pink elephants on parade

What'll I do
What'll I do
What an unusual view

I can stand the sight of worms
And look at microscopic germs
But technicolor pachyderms is really too much for me

I am not the type to faint
When things are odd or things are quaint
But seeing things you know that ain't
Can certainly give you an awful fright

What a sight!
Chase 'em away! Chase 'em away
I'm afraid, need your aid
Pink elephants on parade
Pink elephants
Pink elephants
Pink elephants",Pink Elephants On Parade [From Dumbo (1941)],2002
Chorus,"I know you
I walked with you once upon a dream
I know you
The gleam in your eyes is so familiar a gleam
Yet I know it's true
That visions are seldom all they seem
But if I know you
I know what you'll do
You'll love me at once
The way you did once
Upon a dream

But if I know you
I know what you'll do
You'll love me at once

The way you did once

Upon a dream

I know you
I walked with you once upon a dream
I know you
The gleam in your eyes is so familiar a gleam

And I know it's true
That visions are seldom all they seem
But if I know you
I know what you'll do
You'll love me at once
The way I did once
Upon a dream",Once Upon a Dream (for Walt Disney's Sleeping Beauty) [From Walt Disney,2002
