Band,Lyrics,Song,Year
Cappadonna,"[Intro: Method Man]
Ain't what you want baby
It's what you need baby
Ain't what you want baby
It's what you neeeeeeeed

[Verse One: RZA]
Yo diamond crystal rings sharp like icicles
Nickel plated pistols, official Wu-Wear covers my physical
Insulated thermal while others drain they co four butt solos
Photographic photo type static great motivated soldier
Or Wu say boulder head flower
You can detect the true and living God from the scorer
Keep your sword straight, maintain your weight
But he ate too much monosodiumglutumate, and polysorbate
And drug rate concentrate, with sodium benzoate
By the chicken thighs and tryglycerides
And this b**** advertised her breast size
Eighty-five didn't realize, til the truth opened up his eyes
Then he became highly civilized
And spent time amongst the wise, went through a garment renaissance
And stopped wearing Benetton
Tommy Hill, Perry Ellis, Nautica, or Liz Claiborne
Ocean Pacific, Fila, Bill Bla** and leave fitted
Quit the Armani sweaters with the Gucci wool knitted
Now all he buys, Kani's, Cross Colours, Shabazz Brothers
Mecca, Pelly Pell, 88, North Q, Bear and a few others
For the new year, strictly Wu-Wear

[Chorus: Method Man]
Ain't what you want baby
It's what you need baby
Ain't what you waaaaaant

[Verse Two: Cappadonna]
Pele egg-head the top dresser
One man catalog the London Fog casual hog
Biere denim with the Cash Wu Nike and Kangol king
Everyday, DLO jacket he gripped with the drawstring
Fila supply big daddy started haveta brown skin derby
Master Tommy Hil Advil
Double button Woolridge, red dickie turtleneck
Mockneck, eighteen carat holdin my twenty-two shine
In this like Macy's or Bloomingdale's
The Century 21 son, the new portfolio dunn
Now it's my time, Asian Wu-Wear, Cap and fleece wear
One wear plaids the Don will hold the best for all wear
Plus blue wear, Wu-Wear, what's going on
We're the best of this year, Wu-Wear and fleece wear

[Verse Three: Method Man]
Ain't what you want baby
It's what you need baby
Just come see me
Satisfaction guaranteed baby
Just hold your own baby
And just rock on baby
I got this wine on my mind
Feelin fine darlin
Now all you see baby
Ain't what you need baby
I want to know just how low
It goes
Official nasty a**es, straight shots in dirty glasses
Wu-Wear fleece for you and your stinkin piece
Hard time and killer tactics

Just hold your own baby
Now just rock on baby
I got this wine on my mind
Feelin fine darlin
Now all you see baby
Ain't what you need baby
I want to know just how low
It go

Just hold your own baby
Now just rock on baby
I got this wine on my mind
Feelin fine darlin
Now all you see baby
Ain't what you need baby
I want to know, how low, it go",Wu-Wear: The Garment Renaissance,1996
Cappadonna,"You know how we do!

Yo, what's the deal Goldilocks?
Ain't nothing I'm just hibernating, love that watch
Pour me some Scotch and cold Courvoisier
No doubt, have a chair Boo lets get to pollying
Who you with? Me and Molly and some trick who's Yugoslavian
What fabric is that? It's only wool and Rayon
Lipstick crayon, fly Fahrenheit spray on
I'm getting tipsy, I hope she read cocks like a gypsy
And transporting bricks stealing many fifties
Fuck negotiating, is you with me is you waiting
Sweet as carrot cake, faking plus you don't eat turkey bacon
I don't get down like that, I don't get down neither
Cuban links skeezer, why you acting like a rap teaser
I'm like the jewelry exchange plus a range
Nigga you small change I only fuck for figaro chains
Analyzing Miss Clairol, Fendi down, mascara on
Assistant manager in Paragon

Socializing, vibing with my eyes on Dot
She this book cover lady that be blowing up the spot
While my heart was racing, like the hands on the clock
I step live I think she see me putting out the pot
Peace Dot, I'm so happy to see you at the rendezvous
How's life today your hands are softer than Camay too
Your hairdo way more class than Halle Berry
Caught visions of me and you riding on the ferry
Plus your daughter Kiki talk to my man Merry
I order me a Sex on the Beach with the cherry
I order her a Vermidi on ice, sounds nice
She elegant, pretty eyes, glasses, intelligent
Whispered in my ear that she's celibate
Whispered back to her ear we don't have to go there
As I grab the hand set her politely in the chair
As we stopped to stare at one another
Black sister to brother
I'm thinking all the time how she could be my lover

What's happening brown sugar? Say you look so good today
Ankle bracelet wrapped around your leg
Here have a seat, complimentary drinks is on me
Bartender, Chevalier Chateau at table three
Luxurious rings, eyes sparkling
What's your name sugar? Juanita Cash Hawkins
Your complexion gives a reflection of
Sometime a black woman just need to be loved
Quiet and shy, baby girl my gift got you high
Made you wanna hit me with the keys to that five?
Just joking baby, I have a sharp sense of humour
Wish I would've bumped into your frame a lot sooner
What's your physical degree, thirty one, thirty three
Half Hawaiian with a slight touch of Chinese
Seen you working at a law firm, on Fifth Avenue
Three blocks from the Gucci spot is where I trapped you
Yo, I'm all into older woman, who's happy living
Love kids and, keep all our business in the crib and
And not afraid to die with me the God on your side
We holding hands til death do us apart and then we slide
Earring in the left side of your nose love my combo
Should have left my Wis' a thousand times maybe tonight though
Yo you sexy motherfucker, damn what's the recipe?
You make a nigga wanna god damn!
Can you cook darling? At the stove you're evolving
Baked macaroni, turkey wings, a nigga starving
Here take my number let me pull the chair from under
I had fun plus your backyard speak with thunder",Camay,1996
Cappadonna,"We are the G, O-D's
And we came to rock, the spot
Like Ironman Starks
They be the illest MC's, in the world today
Cappa Raekwon and the R-Z-A
So listen to them clear, and put the box right near your ear
Light your blunts and down your beers
Cause you could never fuck with Wu-Tang Killer Bees

Say peace to cats who rock mack knowledge
Knowledgists, street astrologists
Light up the mic God, knowledge this
Fly joints that carried your points
Corolla Motorola holder
Play it God, he pack over the shoulder
Chrome tanks, player like Yanks, check the franchise
Front on my guys, my enterprise splash many lives
Rapel on fakes like reflectors
He had sugar in his ear in his last crack career
We can can him, manhandle him, if you wanna
Run in his crib-o, get ditto, skate like a limo
And jet to the flyest estate, relate take a break
Break down an eighth and then wait drop it like Drake
Thugs they be booing and screwing, we canoeing
Claim they doing the same shit we doing, fuck your union
It's the same style, RZA trainable, jump the turn style
On the alley tried to challenge God for the new vials
Especially that, aluminum bat in the act
Relax, lay back, sell a grenade a day, it pays black
The Mac-10 flex white cats like Windex
Index finger be sore, busting these fly scripts
The Wally kid count crazily grands with our plans
Laying with my bitches and my mans in Lex Lands
We losing em, jet to the stash and now Jerusalem
Abusing em, rocking his jewels like we using 'em
Low pro star, seven thick waves rock Polar
Roll with the older God, build with the Son and the Star

All these MC's start realizing
That Ghost got that shit, that'll keep you vibing
The Wu is here to bring, you Shaolin's finest
But if your shields are weak, you better step behind us

Mercury raps is roughed then God just shown like taps
Red and white Wally's that match, bend my baseball hat
Doing forever shit, like pissing out the window on turnpikes
Robbin niggas for leathers, high swiping on dirt bikes
Voice be metal like Von Harper radio bubble
Murder sleep away camp, the fly lady champ
The arsonist, who burn with his pen regardless
Slaying all these earthlings and fake foreigners
In the Philippines, pick herbal beans, bubbling strings
Body chemical cream, we burn kerosene
The conviction of my tape is rape, wicked like Nixon
Long-heads inscriptions with three sixes in
Kiss the pyramid experiment with high explosive
I slap box with Jesus, lick shots at Joseph
Zooming like binoculars, the rap blacksmith
Money's Rolex, with sparkles, Chef ragtop is spotless
I'm Iron Man no cheap cash metal I'm steel alloy
True identity hidden inside secret tabloids
Breathe oxygen both sides of my jaw carry oxes
The track hit like the bangers, in hundred watt boxes
Yo jostling these cats while Little J be deli-ing
Sip Irish Moss out of Widelians

All these MC's start realizing
That Ghost got that shit, that'll keep you vibing
The Wu is here to bring, you Shaolin's finest
But if your shields are weak, you better step behind us

Give me the the fifty thou, small bills
My gold plate, my slang kills
My Benz spills, what up Lils
Murder one Dunn
Killer bee stung, guess who back home Son
My technique of slang camp won, third platoon soon
Cristal bottles, cages of boom, probably wardrobe
The mad-hatter big dick style, beware goons
Smuggle balloons, lord of dooms, in fat pussy wombs
Let the Gods build, pull up the grill
Check out the mad skills
Top secret technique, too hard for you to peep it
And keep it, jiggy style of rap and watching knuckle slang
Sweep it out of order tape recorder can't record my slaughter
Spoil the rotten Don is too good to be forgotten
High top notch, borderline rhymes is handcocked
Ninety-six, my ill sound clash is still hot
Get yourself shot

All these MC's start realizing
That Ghost got that shit, that'll keep you vibing
The Wu is here to bring, you Shaolin's finest
But if your shields are weak, you better step behind us",Daytona 500,1996
Cappadonna,"These are the men who lead the crime families of America
I control 26,000 men. Except for dope, we operate in all aspects
Of organized crime. And if there's one thing I'm sure of
It's that drugs destroy your mind and destroy your home
In the end it'll only lead our country into ruin

We eat fish, toss salads and make rap ballads
The biochemical slanglord'll throw the Arabs
In the dope fiend, vocal chords switch laser beams
My triple sevens broke the slot machines out in Queens
Grey Poupon is Revlon rap, smack pawns, swing like batons
Most my niggas smoke like Hillshire Farms
Check the gummy sole, underneath my shoe lies the tap
That attract bow-legged bitches with wide horse gaps
In steel mills Iron he'll smoke the blow on duns
You run errands, Primatene Mist is afraid of my lungs
Turn my channel, it'll blow your whole bench off the panel
Like eighty roman candles that backfired then slammed you
Every day is like a video shoot, check this shit
I take it back to Playboy, stash guns in whips
Picture afro picks, shish kabobs and dashikis
Thousands civil marched, raised their fists in early sixties

Now check this one, you must have been stupid to miss this one
Donna shogun-ing flip a ton of fashion
Destination be the cash one, I step past one
Don't make me blast one, I'm cold like eskimo flow
Cappa villain stay chillin' take shots of penicillin
Clean out and let the steam out, she fiend to blow out
But I'm equipped with mad white, Morris The Rap got nine lives
I'll take a few hundred thousand dollar dives
And then I still never go down
Until the last round I shine
When RZA do his thing motherfucker, I'mma do mine

Now, where I come from cats be carrying, marrying drug money
Fuck up your wife, get four to life
Cream we handling, Midtown niggas scrambling
Move and examine the fly shit, plus quick to buy shit
Chef, yeah, you know the whole gods astral
Fidel Castro suits plus depositing cash rule
Big time, play it like Canadian wine
RZA's divine now, the sacredness of one's true mind
Now let's get colorful like money green
High roller coaster, Sosa, million dollar nigga roaster
Yeah God, be having my whole steez laced
Now let's rap a taste, connect dots, aim Glocks, train stop
Figaro fly jewelin', tri-color Cubans
Swerving we'll pow with Germans in Suburbans
Twenty-four niggas with vests on, my own restaurant
Dons sending my sons membership forms
And still getting this paper scraper
Fake gators from Jamaica, wizards be passing like Lakers
And it be coming from Lex Louis Rich Liberace
Fetus style and blocking goals like hockey",Fish,1996
Cappadonna,"(What you doin' on our turf, punk?
Got a message for Smokey.
Give it.
You Smokey, man?
Give it!
If you ain't Smokey, it ain't yo' motherfuckin' message
Motherfucker, I said gimme the message!
It's from Willie, in the slam.
Nigga, you been busted?
Yeah, the man picked me up.
Well, I ain't got no fuckin' time to play with you! Now gimme the message.
Willie's in Warwick, doin' 1-3. Told me to tell y'all motherfuckers to
Keep cool. He be out one way or another. Quick. Maybe I could stick
Around for awhile.
Naw, that's out, man. You know? What can we, The Lords, do with a punk like
You?
Kiss my ass, motherfucker! (Burn 'em) Just me and you, motherfucker, just
Me and you. I put trademarks around your fuckin' eye!)

(Portrayin', won't be payin'. Uh huh, Uh huh)
(Yeah, no doubt, no doubt, this Wally champ cat. Yeah, it's on this one)

[Raekwon:]

Yo, Gambino niggas who swipe theirs
Deluxe rap cavaliers
Midgets who steal beers, give 'em theirs

[Chorus: Raekwon]

Sit back jollyin'
My team be gamin' like three card Rolly an'
Drug Somalians pollyin'

[Raekwon]
Many raps they crochetin'
Hey yo Iron, these niggas portrayin'
But haven't been payin'
For real, slide on these niggas like flesh fear
Caesar fade style, usually tough grenade
Throw a blade, fuck gettin' laid
Guzzle this shit like Gatorade
Big-dick Wallies have never half-suede
Connectin' with the hot style is done
Light up a chalis
I run with nothin' but the wildest, foulest
Come on now, long-dick style
Niggas on the hit out, ay yo Iron bite my shit out
Eventually, bust a rap gun mentally
Been doin' this century kid, just meant to be
Get on your knees and bless me with a gem in the Caribbean
Skiin' off by P.M.
Snatch Canadian cream with Scandinavians
Fellatium style, play it like thirty-two Arabians
The greatest lesson is don't owe, you might get stole on
When I go bury me wit Valow on

(They come to me, and understand, just let me get mines first. Then after I
Get mines, y'all can do what y'all wanna do. Fuck 'em up bad)

[Ghostface]
'Sho 'nuff, hit the bank and thrust
Cool Nauticas Jamie Summer got trained on the tour bus
We upgrade, swallow raw eggs, read the label
Hittin' white-label, left the Winnebago unstable
Smooth sailin', walked in, my earth started kneelin'
Started stealin', I'm too ill, see we're bellin' at the parlay
Kicked up, mack, max motion
Michael Bolton magazine call, I'm too potent
Louisville mix pain kill rap, Fuck benadryl
The violin in 'Knowledge God' sounded ill
Tremendously obnoxious, no blotches
My telephone watch'll leave bartenders topless
Dead on the prosecutor, smacked a juror
Me and my girl'll run like Luke and Laura
We sit back on Malayan islands
Sippin' mix drinks out of boat coconut bowls, we whylin'

[Raekwon]
Sit back jollyin', Uh huh, Uh huh
Uh huh, Uh huh, Sit back jollyin'
Uh huh, Uh huh, Uh huh, Uh huh

[Chorus: x2]

Sit back

[Cappadonna]
Deep meditation sound orientated, war the blizzard
Rap para-medical the wizard
Cappadonna, never caterin' to none
My microphone and three verse weigh a ton of slaughter
You oughta five thousand back across the water
My laboratory story keep me flowin' with the glory
Acapella or deep dirty instrumental
I could blow the sky like the stormy wind blew
One gallon of whylin', Park Hill profilin'
I cut your face up rough fifty sure while you're smilin'
For violatin' my position,
I leave you smoked like a crackhead on a mission
Two tokes of mic dope, one stroke of elegance
Rated like the movie graphic told intelligence
Person to person, it'd be hard for you to take a trophy
You better off to get somebody out to try to smoke me
'Cause I'm P-L-O T-K-O every day
Dancehall General, Party Fanatic Colonel
Cappadonna son'a old school just go infernal
Veteran for rappin' with the new set of rule of hard rappin'
Ninety-six jive, I keep the live crowd clappin'
When I bow, all praises due to Staten Isle
I spark the mic and Shaolin spark the methtical
Every evenin', I have a by myself meetin'
Thinkin' who's gonna be the next to catch a beatin'
From my mental slangin', bitchin' rap twist the point of warfare
I brutalize, all competition catch ill hair
Chance him, that's what they said, threw up a ransom
I jacked it, stripped the beat naked and packed it
Gimme my rewards

(The way I, the way I wanna get 'em. I want 'em gotten. 
I want 'em layin' out. I want 'em gotten. 
'Cause niggas need to be gotten. 
He need to be taken off of here. 
That's right.)",Iron Maiden,1996
Cappadonna,"Yes the shit is raw, coming at your door
Start to scream out loud, Wu-Tang's back for more
Yes the hour's four, I told you before
Prepare for mic fights (and plus the cold war)

This rhyme you digest through the RZA console
Ask why I slam nine diagram pole
Raekwon dropped the bomb, Hunchback, Norte Dame
Golden Arms is bronze, buddah palm hit Qu'ran
It blows extreme, mean stream be the theme
Supreme team, America's Cream Team, redeemed
Vidal Sassoon, chrome tones hear the moans of Al Capone
Gun POW to the dome
And split the bone, wig blown off the ledge
By the alledged, full-fledged, sledge RZA edge
One dose of my feroc(ious) handheld trigger cuts
Acapella spitting shell paralyzed when you get touched
And critical mic cords, hanging like umbilical
Cords, dope swords, five star general
Raw be the quote rap style sore throat
Through the fully operational, handheld tote mm-hmm

Yes the shit is raw, coming at your door
Start to scream out loud, Wu-Tang's back for more

A hundred thousand times one, snatch up my styles get done
I hold a title, and here's how my belt was won, check it
Slick majestic, broke mics are left infected
Germs start to spread through your crew through lack of effort
You asked for it, shot up the jams like syringes
My technique alone blows doors straight off the hinges
Masked Avenger, I appear to blow your ear like wind
With a freestyle, sharper than the Indian spear
So sit back and let the king explore
Describe me, the kid's nice and he holds swords
And his name, black attack's the nerve like migraines
With more gains than beggars on trains, livid sharp pains
Poisonous Rebel like Deck, you can't destroy this
You get ambushed, skate, try to avoid this
Side effects of, hot raps and hot tracks
A duffle bag full of guns son, dipped in black
My culture, glides and attacks just like a vulture
Ghostface in Madison Square is on your poster

Yes the shit is raw, coming at your door
Start to scream out loud, Wu-Tang's back for more
Yes the hour's four, I told you before
Prepare for mic fights (and plus the cold war)

Be on the lookout for this mass murderous suspect
That fills more body bags than apartments in projects
And as far as the coroners know
The autopsy show, it was a Shaolin blow
Put on by my family brought to the academy
Of the Wu and learned how to
Fuck up yo' anatomy, steadily, calm and deadly
Spatter-head lyrics I lick through your transmit
MC's submit to the will as I kill your
Juvenile freestyle, civilize the men-tal
Devils worship this like an icon
Bear-hugging mics with the grips of a python

Yes the shit is raw, coming at your door
Start to scream out loud, Wu-Tang's back for more
Yes the hour's four, I told you before
Prepare for mic fights (and plus the cold war)

You heard other raps before but kept waiting
For the Son of Song, I keep dancehalls strong
Beats never worthy of my cause, I prolong
Extravangza, time sits still
No propaganda, be wary of the skill
As I bring forth the music, make love to your eardrum
Dedicated to rap nigga beware of the fearsome
Lebanon Don, Malcolm X beat threat
CD massacre, murder to cassette
I blow the shop up, you ain't seen nothing yet
One man ran, trying to get away from it
Put your bifocal on, watch me a-cometh
Into your chamber like Freddy enter dream
Discombumberate your technique and your scheme
Four course applause, like a black dat to dat
You're stuck on stupid like I'm stuck on the map
Nowhere to go except next show bro
Entertaining motherfuckers can't stop O
In battling, you don't want me to start tattling
All up on the stage cause y'all snakes keep rattling
Bitch, you ain't got nothing on the rich
Every other day my whole dress code switch
So just in case you want to clock me like Sherry
All y'all crab bitches ain't got to worry
Can't get a nigga like Don dime a dozen
Even if I'm smoked out I can't be scoped out
I'm too ill, I represent Park Hill
See my face on the twenty dollar bill
Cash it in, and get ten dollars back
The fat LP with Cappachino on the wax
Pass it in your thing, put valve up to twelve
Put all the other LP's back on the shelf
And smoke a blunt, and dial 9-1-7
1-6-0-4-9-3-11
And you could get long dick Hip Hop affection
I damage any MC who step in my direction
I'm Staten Island's best son fuck what you heard
Niggas still talking that shit is absurd
My repertoire, is U.S.S.R
P.L.O. style got thrown out the car
And ran over, by the Method Man jeep
Divine can't define my style is so deep
Like pussy, my low cut fade stay bushy
Like a porcupine, I part backs like a spine
Gut you like a blunt and reconstruct your design
I know you want to diss me, but I can read your mind
Cos you weak in the knees, like SWV
Trying to get a title like Wu Killa Bee
Kid change your habit, you know I'm friends with the Abbott
Me and RZA Rob name printed in the tablet
Under vets, we paid our debts for mad years
Hibernate the sound, and now we out like bears
In Born Power, born physically, power speaking
The truth in the song be the pro-black teaching",Winter Warz,1996
Cappadonna,"[Featuring you God] 
Yeah ninety six Park Hill style 
Burial ground sound in it forever Dunn 
Politic 
Verse One: Cappadonna/Cappachino 
Here we come right through your eardrum Dunn 
Cherry head catch feel the draft of the aks 
You catch one trying to pretend you could win 
Headlock show the block kid counterattack 
Don of mine stay connect 4th Disciple trife 
Ain't nuthin ice cream, kid you get blown like steam 
Park Hill Projects, the black Idi Amin 
Ninety-six era, not the crossover lever 
chain swinger talk swing, probably wardrobe king 
So what now? Industry kids'll lock it down 
Only two loyal, dustin that find you there for 
You wanted to enter thirty-six in the soil 
My technique is speak have you knocked out weak 
Forever in it, my slang dick goes so deep 
Thirsty for hip-hop, Staten Isle niggaz can't stop 
Runnin wild like a child till we reach the top 
Stapleton, New Bright, and West Brighton the harbor 
Connect, me for vet, Don King and a tech 
Thug cats'll get done up on black man's sun up 
Cap the imperial, bring out new material 
You hold me down, analyze all cherry-head 
Wu is in town, catch the hand-off 
Prepare for my dancehall standoff 
Mercy when I come blow your mic-hand off, sorry I touched him 
Here they come again through customs 
Mad ways to dead the wax one way to bust him 
Chorus: 
If it's alright with you it's alright with me 
We can take this rap game to a higher degree 
We can do this Spike Lee or how you want it to be 
Check it, Golden Arms plus new Cappadon 
Verse Two: you-God, AKA Golden Arms 
These ninety-nine powerful circling swords 
Impact from all the heat dug deep and locked on 
Chip off the bone, hard face and hard fists 
Chop off your option, have you felt a neck twist 
Cassette disc and wrist, meltdown your pistol mist 
Burnt to a crisp, bombarded my pistol grip 
Tongue gripped the nigga, raw tone the jawbone 
Leaning Tower Pisa sounds of the Mars zone 
Chef dropped that bomb, the takeout will still linger 
Twenty crazy christians, to lock in hole and heat up 
Who the finger rap singer with hip layers of phlegm 
Caused by blunt smoke, heart disease plays the friend 
I ran out emotion, my rap style's devotion 
I got hosts for you Soviet peoples across the ocean 
My path releases, volcanic acids 
Engage in the page activity is autographics 
Fraction of my busting microphones start to lust and 
words plays over power practice might bust em 
The black male persuasion known to hunt you for sane 
The Big Apple verbal concert, for the occasion 
The vital snap, now insert my Spinal Tap 
I got forty more swipes to pipe, thirty slapped 
The power from the cram broke the bottom of the pan 
With Earth Wind and Fire, ice water dead grams 
American hustler up and coming with a vengeance 
Makes no magnet charge, plug vivid my extension 
one lesson motivation for my pistol profestation 
Slang person nailed now we move on a motation 
Location, point-blank, on point be the vessel 
Politic the defecit measure, point the decibel 
We're credible, renaissance, eatin off the barrel 
Advanced chemo, Die Hard to my demo 
Chorus",If It's Alright With You,1996
