Band,Lyrics,Song,Year
"Vernell Brown, Jr.","Maybe you'll wanna give me kisses sweet
But only for one night with no repeat.
And maybe you'll go away and never call,
And a taste of honey is worse that none at all.
Oh little girl!

In that case I don't want nobody
I do believe that that would only break my heart
Oh, but if you feel like lovin' me
If you got the notion,
I second that emotion.
So, if you feel like giving me a lifetime of devotion
I second that emotion.

Maybe you'll think that love will tie you down
And you don't have the time to hang around.
Or maybe you'll think that love will make us fools,
And so it makes you wise to break the rules.
Oh little girl!

In that case I don't want nobody
I do believe that that would only break my heart
Oh, but if you feel like lovin' me
If you got the notion,
I second that emotion.
So, if you feel like giving me a lifetime of devotion
I second that emotion.

In that case I don't want nobody
I do believe that that would only break my heart
Oh, but if you feel like lovin' me
If you got the notion,
I second that emotion.
So, if you feel like giving me a lifetime of devotion
I second that emotion.",I Second That Emotion,2006
Vernelle Anders,"What a day this has been!
What a rare mood I'm in!
Why, it's almost like being in love
 
There's a smile on my face
For the whole human race
Why it's almost like being in love
 
All the music of life seems to be
Like a bell that is ringing for me
And from the way that I feel
When the bell starts to peal
I would swear I was falling
I could swear I was falling
It's almost like being in love",Almost Like Being in Love,1996
Vernelle Anders,"At last, my love has come along
my lonely days are over, and life is like a song
At last,the skies above are blue
My heart was wrapped in clover
Every since the night I looked at you

And I found a dream that I could speak to
A dream to call my own
I found a thrill to press my cheek to
A thrill I'd never known
When you smiled, and then the spell was cast
And here we are in Heaven, I found my love at last

I found a dream that I could speak to,
A dream  to call my own
I found a thrill to press my cheek to
A thrill like I had never known
You smiled, when you smiled at me that was how the spell was cast
And here we are in Heaven
I found my love at last",At Last,1996
Vernelle Anders,"Our little dream castle with every dream gone,
Is lonely and silent, the shades are all drawn,
And my heart is heavy as I gaze upon
A cottage for sale

The lawn we were proud of is waving in hay,
Our beautiful garden has withered away,
Where you planted roses,the weeds seem to say,
A cottage for sale.

From every single window, I see your face,
But when I reach a window, there's empty space.
The key's in the mail box the same as before,
But no one is waiting any more,
The end of the story is told on the door.
A cottage for sale.",A Cottage for Sale,1996
Vernelle Anders,"I'm as restless as a willow in a windstorm
I'm as jumpy as a puppet on a string
I'd say that I had Spring fever
But I know it isn't Spring

I am starry-eyed and vaguely discontented
Like a nightingale without a song to sing
Oh, why should I have Spring fever
When it isn't even Spring?

I keep wishing I were somewhere else
Walking down a strange new street
Hearing words that I have never heard
From a girl I've yet to meet

I'm as busy as a spider spinning daydreams
I'm as giddy as a baby on a swing
I haven't seen a crocus or a rosebud or a robin on the wing
But I feel so gay in a melancholy way
That it might as well be Spring

It might as well be Spring",It Might as Well Be Spring,1996
Vernon Brown,"When the wintry winds start blowing
And the snow is starting to fall
Then my eyes turn westward knowing
That's the place that I love best of all

California, I've been blue
Since I've been away from you.
I can't wait till I get going
Even now I'm starting in a call

California, here I come
Right back where I started from
Where bowers are flowers bloom in the spring
Each morning at dawning
Birdies sing and everything
A sun kissed miss said ""Don't be late!""
That's why I can hardly wait,
Open up that Golden Gate! 
California, here I come!

California, here I come, yeah!
Right where I started from
Where bowers are flowers bloom in the spring
Each morning at dawning
Birdies sing and everything
A sun kissed miss said ""Don't be late!""
That's why I can hardly wait
Open up, open up, open up that Golden Gate! 
California, here I come!",California Here I Come,2012
Vernon Burch,"Oh she may be weary
Them young girls they do get wearied
Wearing that same old miniskirt dress
But when she gets weary
You try a little tenderness

Oh man that
Un hunh
I know shes waiting
Just anticipating
The thing that you'll never never possess
No no no
But while she there waiting

Try just a little bit of tenderness
That's all you got to do
Now it might be a little bit sentimental no
But she has her greavs and care
But the soft words they are spoke so gentle
Yeah yeah yeah
And it makes it easier to bear
Oh she wont regret it

No no
Them young girls they don't forget it
Love is their whole happiness
Yeah yeah yeah
But its all so easy
All you got to do is try
Try a little tenderness
Yeah
Damn that hart (hard?)

All you got to do is know how to love her
You've got to
Hold her
Squeeze her
Never leave her
Now get to her
Got got got to try a little tenderness
Yeah yeah
Lord have mercy now

All you got to do is take my advice
You've got to hold her
Don't squeeze her
Never leave her
You've got to hold her
And never
So you got to try a little tenderness
A little tenderness
A little tenderness
A little tenderness

You've got to
Got to got to
You've gotta hold her
Don't squeeze her
Never leaver her
You got
Got got got to
Now now now
Got got got to
Try a little tenderness
Ye",Try a Little Tenderness,1979
Vernon Dalhart,"Oh, I wish I had some-one to love me 
Some-one to call me their own 
Oh, I wish I had some-one to live with 
'Cause I'm ti-red of liv-in' a-lone 

Oh, please meet me to-night in the moon-light 
Please meet me to-night all a-lone 
For I have a sad sto-ry to tell you 
It's a sto-ry that's nev-er been told 

I'll be car-ried to the new jail to-mor-row 
Leav-ing my poor dar-ling all a-lone 
With the cold pris-on bars all a-round me 
And my head on a pil-low of stone 

Now I have a grand ship on the o-cean 
All mount-ed with sil-ver and gold 
And be-fore my poor dar-lin' would suf-fer 
Oh! that ship would be an-chored and sold 

Now if I had wings like an an-gel 
O-ver these pri-son walls I would fly 
And I'd fly to the arms of my poor dar-lin' 
And there I'd be wil-ling to die ",The Prisoner's Song,1994
Vernon Dalhart,"Here is my heart with all my love
They both belong to you;
Year after year I'll love you dear.
No matter what we go through.

[Chorus]
When your hair has turned to silver,
I will love you just the same;
I will only call you sweetheart,
That will always be your name.
Through a garden filled with roses
Down the sunset trail we'll stray.
When your hair has turned to silver
I will love you as today.

Always it seems I've built my dreams
All bound around you dear;
And I'll confess my happiness
Means having you always near.

[Chorus]",When Your Hair Has Turned to Silver,1996
Vernon Garrett,"Well, I'll Be Doggone if I would work all day
And I'll Be Doggone if I would bring you my pay
But if I ever caught you running around,
blowing my money all over this town
Then I wouldn't be doggone 
Hey, Hey!  I'd be long gone.
Then I wouldn't be doggone (Baby!)
I'd be long gone. mm mm
Now, hey, hey, hey!
 
I'll be Doggone if you ain't a pretty thing
And I'll be Doggone if you ain't warm as a breath of spring
And if we live to be a hundred year old,
if you ever let that spring turn cold
Then I wouldn't be doggone
Hey, Hey, Hey!  I'd be long gone.
Oh, I wouldn't be doggone (Baby)
I'd be long gone.  mm mm
Now, did you hear me?
Well, now, what I say oh, believe me.
 
Well, ev'ry woman should try to be whatever her man wants her to be.
And I don't want much, all I want from you is for you to be true to me.
 
I'll be Doggone if love ain't a man's best friend
Oh, baby, And I'll Be Doggone if you ain't the loving end
Though I know you make me feel like nobody could, 
if I ever found out that you're no good 
Then I wouldn't be doggone 
Well, I wouldn't be doggone (Baby!)
I'd be long gone.
I wouldn't be doggone 
(gonna catch me a train)
Naw, baby, I wouldn't be doggone
I wouldn't be doggone 
(gonna catch me a plane)",I'll Be Doggone,1997
Vernon Garrett,"Someone to count on in a world ever changin'.
Here I am, stop where you standin'.
What you need is a lover, someone to take over.
Oh baby don't look any further.

Strange when you think of the chances
that we've both been in a state of mind.
Too cool to be careless. Looking for the right thing.
Oh baby don't look any further.

Tonight (tonight) we're gonna taste a little paradise.
Rockin' all night long. Rockin' all night long.
Daylight (daylight) I'll still be looking in your heavenly eyes.

Oh we rocked on and on and on.

Day o umba day o mambu ji ay o.
Don't look any further. Don't you look no furhter.
Day o umba day o na jam bay um bay o.
Don't look any further.

Someone to count on (someone to count on) in a world ever changin'.
Here I am, stop where you standin'.
What you need is a lover (you need a lover)
to love you all over (love you all over).
Oh baby don't look any further (further).

Tonight (tonight) we're gonna taste a little paradise.
Rock you night long. Rock me all night long.
Daylight (daylight) I'll still be looking in your heavenly eyes.

We'll go on and on and on.

Day o umba day o mambu ji ay o.
Don't look any further. Don't you look no furhter.
Day o umba day o na jam bay um bay o.
Don't look any further.

Day o umba day o mambu ji ay o.
Don't look any further. Don't you look no furhter.
Day o umba day o na jam bay um bay o.
Don't look any further.

Tonight (tonight) we're gonna taste a little paradise.
Rock you night long. Rock me all night long.
Daylight (daylight) I'll still be looking in your heavenly eyes.

We'll go on and on and on.

Day o umba day o mambu ji ay o.
Don't look any further. Don't you look no furhter.
Day o umba day o na jam bay um bay o.
Don't look any further.
",Don't Look Any Further,2000
Vernon Garrett,"If you don't know me by now
You will never never never know me

All the things
That we've been through
You should understand me
Like I understand you
Now girl I know the difference
Between right and wrong
I ain't gonna do nothing
To break up our happy home
Don't get so excited
When I come home
A little late at night
'Cause we only act like children
When we argue fuss and fight

If you don't know me by now
You will never never never know me

We've all got our
Own funny moods
I've got mine,
Woman you've got yours too
Just trust in me like I trust in you
As long as we've been together
It should be so easy to do
Just get yourself together
Or we might as well say goodbye
What good is a love affair
When you can't see eye to eye

If you don't know me by now
You will never
Never never know me",If You Don't Know Me by Now,2002
Vernon Garrett,"How did I ever let you slip away
Never knowing I'd be singing this song some day
And now I'm sinking, sinking to rise no more
Ever since you closed the door

[Chorus]
If I could turn, turn back the hands of time
Then my darlin' you'd still be mine
If I could turn, turn back the hands of time
Then darlin' you, you'd still be mine

Funny, funny how time goes by
And blessings are missed in the wink of an eye
Why oh why oh why should one have to go on suffering
When every day I pray please come back to me

[Chorus]

And you had enough love for the both of us
But I, I, I did you wrong, I admit I did
But now I'm facing the rest of my life alone, whoa

[Chorus]

I'd never hurt you (If I could turn back)
Never do you wrong (If I could turn back)
And never leave your side (If I could turn back)
If I could turn back the hands

There'd be nothing I wouldn't do for you
(If I could turn back)
Forever honest and true to you
(If I could turn back)
If you accept me back in your heart, I love you
(If I could turn back the hands)

(If I could turn back)
That would be my will
(If I could turn back)
Darlin' I'm begging you to take me by the hands
(If I could turn back the hands)

I'm going down, yes I am
(If I could turn back)
Down on my bended knee, yeah
(If I could turn back)
And I'm gonna be right there until you return to me
(If I could turn back the hands)

(If I could turn back)
If I could just turn back that little clock on the wall
(If I could turn back)
Then I'd come to realize how much I love you
Love you love you love you
(If I could turn back the hands)",If I Could Turn Back the Hands of Time,2003
Vernon Garrett,"Let's go get stoned, let's go get stoned
When your baby won't let you in
Got a few pennies, a bottle of gin
Just call your buddy on the telephone
Let's go get stoned

Let's go get stoned, let's go get stoned
When you work so hard all the day long
And every thing you do seems to go wrong
Just drop by my place on your way home
Let's go get stoned

It ain't no harm, you're taking just a taste
But don't blow your cool and start messing up the place
It ain't no harm you're faking just a nip
But make sure you don't fall down bust your lip
Let's go get stoned, let's go get stoned",Let's Go Get Stoned,2009
Vernon Hill,"Verse 1:

I feel joy
I feel peace
All the pressures of the world cant find me

I feel Love
I feel free
I have traded all my sorrows for gladness

Chorus:

In your presence
All the chains are breaking

In your presence
All fear is casted away

In your presence
I find restoration

Everything I need is in your Presence
Everything I need is in your Presence

Vamp:

I'm Here,
Here in Your presence 
Fresh Fire,
Fall down on me, Oh God

Transform,
Me in Your presence
I'm Here, 
To receive",In Your Presence,2013
Vernon Hill,"Chorus 1:
WORTHY, WORTHY
Are you Lord God
Worthy, Worthy You Are

WORTHY, WORTHY
Are you Lord God Almighty
Almighty

WORTHY, WORTHY
Are you Lord God
Worthy, Worthy You Are

WORTHY, WORTHY
Are you Lord God Almighty
Almighty


Chorus 2:
HOLY, HOLY
Are you Lord God 
Holy, Holy You are

HOLY, HOLY
Are you Lord God Almighty
Almighty

HOLY, HOLY
Are you Lord God
Worthy, Worthy You Are

HOLY, HOLY
Are you Lord God Almighty
Almighty

Chorus 3:

HEALER, HEALER
Are you Lord God 
HEALER, HEALER You are

HEALER, HEALER  
Are You Lord God Almighty 
Almighty

FAITHFUL, FAITHFUL
Are You Lord God
Faithful, Faithful You Are

FAITHFUL, FAITHFUL
Are You Lord God Almighty
Almighty

Vamp:
 Lord God Almighty
Almighty
 Lord God Almighty
Almighty
 Lord God Almighty
Almighty",Worthy Almighty,2013
Vernon J. Price,"So you want, to be free
Live your life, the way you want to be
Will you give, if we cry
Will we live yeah, or will we die, oh 

Tainted hearts heal with time
Shoot bad love so we can
Stop the bleeding 

Solitary brother (solitary brother)
Is there still a part of you that wants to live?
Solitary sister (solitary sister)
Is there still a part of you that wants to give?
Solitary brother (solitary brother)
Is there still a part of you that wants to live?
Solitary sister (solitary sister) 
Is there still a part of you that wants to give?

If we try, to live your life
The way we want to be

Yeah, yeah
Solitary brother (solitary brother)
Is there still a part of you that wants to live?
Solitary sister (solitary sister)
Is there still a part of you that wants to give?
Solitary brother (solitary brother) 
Is there still a part of you that wants to live?
Solitary sister (solitary sister)
Is there still a part of you that wants to give?

Racism in future kings can only lead to no good
And besides, all our sons and daughters already know how that feels

Yeah, yeah, yeah
Love, love, love, yeah",Killer,2007
Vernon Maytone,"To have comfortable place of rest, or a nice care to drive,
Anything that you want these days, money is the only problem
Anywhere you go, it's the same cry
Money worries",Money Worries,2004
Vernon Oxford,"I can't hide the way
I feel about you
anymore. Mm hm.
I can't hold the hurt inside,
keep the pain out of my eyes
anymore. Mm hm.

My tears no longer waiting.
My resistance ain't that strong.
My mind keeps recreating
a love with you alone
And I'm tired of pretending
I don't love you anymore.

Let me make one last appeal
to show you how I feel
about you.  Mm hm.
'Cause there's no one else I swear
holds a candle anywhere
next to you.  Mm hm

My heart can't take the beating
not having you to hold.
A small voice keeps repeating
deep inside my soul.
It says I can't keep pretending
I don't love you anymore.

I've got to take the chance
or let it pass by
if I expect to get on with my life.

My tears no longer waiting.
Oh my resistance ain't that strong.
Oh my mind keeps recreating
a love with you alone.
And I'm tired of pretending
I don't love you anymore.
Anymore
Anymore",Anymore,1995
Vernon Oxford,"
Brother Jukebox, Sister Wine, 
Mother Freedom, Father Time.
Since she left me by my self,
you're the only family I've got left.
 
I go down to that same old cafe,
where I try to wash my troubles away.
I'm still down and I'm still alone.
But it means staying home all night long.
 
Brother Jukebox, Sister Wine, 
Mother Freedom, Father Time.
Since she left me by my self,
you're the only family I've got left.
 
I go home and I climb that old stairway
and I tell myself tomorrow's  a new day.
But I know I'll just go out again,
spend my time with my new next of kin.
 
Brother Jukebox, Sister Wine, 
Mother Freedom, Father Time.
Since she left me by my self,
you're the only family I've got left.
 
Brother Jukebox, Sister Wine, 
Mother Freedom, Father Time.
Since she left me by my self,
you're the only family I've got left.
You're the only family I've got left.
You're the only family I've got left.
 
 
 

",Brother Jukebox,1995
Vernon Oxford,"As I was slowly passing 
An orphan's home one day, 
I stopped for just a little while 
To watch the children play. 
Alone a boy was standing 
And when I asked him why, 
He turned with eyes that could not see 
And he began to cry. 

I'm nobody's child, 
I'm nobody's child. 
Just like the flowers 
I'm growing wild. 
I got no mummy's kisses 
I got no daddy's smile. 
Nobody wants me, 
I'm nobody's child. 

No mummy's arms to hold me 
Or sue me when I cry, 
'Cause sometimes I feel so lonesome 
I wish that I could die. 
I'll walk the streets of heaven 
Where all blinds can see. 

And just like for the other kids 
It will be a home for me. 

I'm nobody's child, 
I'm nobody's child. 
Just like the flowers 
I'm growing wild. 
I got no mummy's kisses 
I got no daddy's smile. 
Nobody wants me, 
I'm nobody's child.",Nobody's Child,1995
Vernon Reid,"Everyone
Everyone around here
Everyone is so near
It's holding on
It's holding on

Everyone
Everyone is so near
Everyone has got the fear
It's holding on
It's holding on

It's holding on
It's holding on
It's holding on",Flatbush and Church Revisited,2006
Vernon Reid,"Everyone
Everyone around here
Everyone is so near
It's holding on
It's holding on

Everyone
Everyone is so near
Everyone has got the fear
It's holding on
It's holding on

It's holding on
It's holding on
It's holding on",National Anthem,2006
Vernon Reid,"Everyone
Everyone around here
Everyone is so near
It's holding on
It's holding on

Everyone
Everyone is so near
Everyone has got the fear
It's holding on
It's holding on

It's holding on
It's holding on
It's holding on",Flatbush and Church Revisited,2006
Vernon Reid,"Everyone
Everyone around here
Everyone is so near
It's holding on
It's holding on

Everyone
Everyone is so near
Everyone has got the fear
It's holding on
It's holding on

It's holding on
It's holding on
It's holding on",National Anthem,2006
Vernon Reid,"[Chorus]
We are renegades. This means W.A.R.
16s bust to break unjust laws
Overthrow regimes in the name of the cause
Renegades, never slaves, this means war
100% uncut raw
Fuck limited freedom, nigga we want more
The machine is corrupted down to the core
Rebel army, muthafucka!
This means war

I got a middle finger for mass media mute the news
'Cause when the gun draws received a million views
Which gives me the right to break the rules
Say fuck the radio if the people can't pick and choose
While BET gets screwed by Viacom
The new revolutionary is shyaman
It's not brush fire rap, it's five alarm
Motivational music after I am gone
My inner visions, mysticism call me Mr. Wisdom
They wanna turn the globe into a prison
And being sick is better than being dead
'Cause when you sick and in bed, you're indebted to meds
Cloned chickens walking around without heads
The food is contaminated, the water got lead in it
Population control, make the babies sick
All these 5G chips, are you for 86?
This is a war against consciousness
Controlling your soul, sort of a psychological dictatorship
And we are on the front lines
Guilty as charged if intellect is a crime

[Chorus]

Alhamdulillah's a spiritual calling
My alternate and we are still mourning
It's not a documentary about global warming
This is lunar explosions of global warning
So when the moon leaves you can't tell night from morning
Cities submerged underwater post New Orleans
It's not your average rap recording
this is insane lieutenants taking aim at Mormons
While the American dream remains dead and dormant
My stimuli's supplied by my endorphins
The mind's eye greater than pi and broadband
I break on through to the other side without doormen
It's not The Doors, man
I am equipped with a better memory chip than dolphins
With more keys to open more doors than four foremen
To executive's rooms where they walking on all fours man
Canines standing upright amongst you
Hated by swine, spreading the H1N1 flu
On some rabies shit, are you for 86?
Population control, make the babies sick
This is a war against consciousness
Controlling your soul, sort of a psychological dictatorship
And I am on the front lines
Guilty as charged if intellect is a crime

[Chorus]",W.A.R.,2011
Vernon Reid,"Look in my eyes, what do you see?
The cult of personality
I know your anger, I know your dreams
I've been everything you want to be
I'm the cult of personality
Like Mussolini and Kennedy
I'm the cult of personality
The cult of personality
The cult of personality

Neon lights, a Nobel Prize
Then a mirror speaks, the reflection lies
You don't have to follow me
Only you can set me free
I sell the things you need to be
I'm the smiling face on your T.V.
I'm the cult of personality
I exploit you still you love me

I tell you one and one makes three
I'm the cult of personality
Like Joseph Stalin and Gandhi
I'm the cult of personality
The cult of personality
The cult of personality

Neon lights a Nobel Prize
A leader speaks, that leader dies
You don't have to follow me
Only you can set you free

You gave me fortune
You gave me fame
You gave me power in your own god's name
I'm every person you need to be
Oh, I'm the cult of personality
I'm the cult of, I'm the cult of, I'm the cult of, I'm the cult of
I'm the cult of, I'm the cult of, I'm the cult of, I'm the cult of personality",Cult of Personality,2014
Verny Varela,"Y el pueblo unido
Jams ser vencido
Y el pueblo unido
Jams ser vencido

Sus polticas de corrupcin
Sus mentiras de destruccin
No nos asustan
Todas sus tropas
Sus amenazas
Sus metralletas

Y el pueblo unido
Jams ser vencido
Y el pueblo unido
Jams ser vencido

Respeto, respecta
Nuestro derecho de la vida
Que lo arrebatas, desplazndonos
Invadindonos, acusndonos

Y el pueblo unido
Jams ser vencido

Nuestra patria necesita
De nuestro esfuerzo
De nuestra Lucha
Respeto

Jolnacho no es cuartel
Fuera ejrcito de l
Jolnacho no es cuartel
Fuera ejrcito de l

Nuestro espritu
Esta vivo
Mientras el tuyo
Es corrompido

Y el pueblo unido
Jams ser vencido
Y el pueblo unido
Jamas ser vencido

Y el pueblo unido
Jams ser vencido
Y el pueblo unido
Jams ser vencido

Y el pueblo unido
Jams ser vencido
Y el pueblo unido
Jams ser vencido

Y el pueblo unido
Jams ser vencido",El Pueblo Unido,
Verny Varela,"Amor, no tengas miedo, amor
La vida es dura pero no es cruel
No creas todo lo que t ves
Que slo miedo quieren meter

Mi amor me dice qu debo hacer
Muchas preguntas sin responder
La vida nos pone pruebas
Yo slo se

Todo es producto de un ambicin
Que nunca se saciar

Y si las cosas van mal
No pierdas nunca tu f
Despus de la tormenta viene la calma, t ves

Detrs de esa oscuridad
Siempre hay una claridad,
Esa luz de esperanza que siempre est

No dejes que la intranquilidad
Te quite el sueno, tu libertad,

La vida tiene que continuar
Lo que pasar, slo l sabr

Mi amor me dice cambia ese canal
Muchas tragedias he visto ya
Y la verdad no aparece
Dnde estar?

Todo es producto de un ambicin
Que nunca se saciar

Y si las cosas van mal
No pierdas nunca tu f
Despus de la tormenta viene la calma, t ves

Detrs de esa oscuridad
Siempre hay una claridad,
Esa luz de esperanza que siempre est",Ambicion Eterna,2005
