Band,Lyrics,Song,Year
Vera Lynn,"You wont see any big parade
There wont be any bugle played
Sad to say no war today
'Cause the generals fast asleep

Soldiers bold in a mighty row
Theyve been told they're to fight the foe
Sad to say no war today
'Cause the generals fast asleep

The colonels mad, and the major blue
The captains sad and the sergeant too
Guess this war will have to keep
Its enough to make an army weep

Look oh look at his curly head
Time to take him away to bed
Sad to say no war today
'Cause the generals fast asleep

It seems an awful shame 
That his victory won't go down to fame 
Sandman's here to dim the light 
Little general, good night",The General's Fast Asleep,1997
Vera Lynn,"Goodnight, wherever you are 
May your dreams be pleasant dreams wherever you are
If only one little wish that I wish comes true
I know that the angels will watch over you

Goodnight, wherever you are 
I'll be with you dear no matter how near or far
With all my heart I pray everything is all right
Wherever you are, goodnight
Goodnight","Goodnight, Wherever You Are",1997
Vera Lynn,"I saw the harbor lights
They only told me we were parting
The same old harbor lights that once brought you to me
I watched the harbor lights
How could I help if tears were starting
Goodbye to tender nights beside the silvery sea

I long to hold you near and kiss you just once more
But you were on the ship and I was on the shore

Now I know lonely nights
And all the while my heart is whispering
Some other harbor lights will steal your love from me

I long to hold you near and kiss you just once more
But you were on the ship and I was on the shore

Now I know lonely nights
And all the while my heart is whispering
Some other harbor lights will steal your love from me",Harbor Lights,1997
Vera Lynn,"Christmas comes but once a year for every girl and boy
The laughter and the joy they find in each new toy
I'll tell you of a little boy who lives across the way
This little fella's Christmas is just another day

He's the little boy that Santa Claus forgot
And goodness knows, he didn't want a lot
He sent a note to Santa
For some soldiers and a drum
It broke his little heart
When he found Santa hadn't come

In the street he envied all those lucky boys
Then wandered home to last year's broken toys
I'm so sorry for that laddie
He hasn't got a daddy
The little boy that Santa Claus forgot",The Little Boy That Santa Claus Forgot,1997
Vera Lynn,"More and more this heart of mine confesses
More and more I'm caught in your caresses
Warmed by the breath of your sighs
Cooled by the blue of your eyes

More and more I find it more than thrilling
To share this dream that needed fulfilling
More and more I'm less and less I'm willing
To give up wanting more and more of you

More and more I find it more than thrilling
To share this dream that needed fulfilling
More and more I'm less and less I'm willing
To give up wanting more and more of you",More and More,1997
Vera Lynn,"A star fell out of heaven, right into my arms
A star fell out of heaven, right into my dreams
And since that very moment, life is so divine
I never heard a star speak before
This one said will you be mine?

Then roses fell from heaven to be my bouquet
And dew rained down from heaven to christen the day
A miracle had happened, as they sometimes do
A star fell out of heaven and turned out to be you",A Star Fell Out of Heaven,1997
Vera Lynn,"There's a new world over the skyline
To find it, follow the sun
You'll find it brighter
Your heart much lighter
And you'll have trouble on the run

There's a new song on the horizon
That we'll sing together as one
In the new world over the skyline
Where the skyline meets the sun

Though the night of waiting may seem endless
And the far horizon seemed forlorn
Over the rim
The stars are growing dim
So lift your weary eyes towards the dawn

There's a new world over the skyline
To find it, follow the sun
You'll find it brighter
Your heart much lighter
And you'll have trouble on the run

There's a new song on the horizon
That we'll sing together as one
In the new world over the skyline
Where the skyline meets the sun

There's a new world over the skyline
To find it, follow the sun
You'll find it brighter
Your heart much lighter
And you'll have trouble on the run

There's a new song on the horizon
That we'll sing together as one
In the new world over the skyline
Where the skyline meets the sun",There's a New World Over the Skyline,1997
Vera Lynn,"We three, we're all alone 
Living in a memory 
My echo, my shadow, and me 

We three, we're not a crowd 
We're not even company 
My echo, my shadow, and me 

What good is the moonlight 
The silvery moonlight that shines above? 
I walk with my shadow 
I talk with my echo 
But where is the one I love? 

We three, we'll wait for you 
Even till eternity 
My echo, my shadow, and me 

What good is the moonlight 
The silvery moonlight that shines above? 
I walk with my shadow 
I talk with my echo 
But where is the one I love? 

We three, we'll wait for you 
Even till eternity 
My echo, my shadow, and me","We Three (My Echo, My Shadow and Me)",1997
Vera Lynn,"It seems to me I've heard that song before
It's from an old familiar score I know it well, that melody

It's funny how a theme recalls a favorite dream
Dream that brought you so close to me

I know each word because I've heard that song before
The lyrics said, ""Forevermore"" 
Forevermore's a memory

Please have them play it again
And I'll remember just when I heard that lovely song before

It's funny how a theme recalls a favorite dream
Dream that brought you so close to me

Please have them play it again
And I'll remember just when I heard that lovely song before",I've Heard That Song Before,1998
Vera Lynn,"We'll meet again
Don't know where
Don't know when
But I know we'll meet again some sunny day
Keep smiling through
Just like you always do
'Till the blue skies drive the dark clouds far away

So will you please say hello
To the folks that I know
Tell them I won't be long
They'll be happy to know
That as you saw me go
I was singing this song

We'll meet again
Don't know where
Don't know when
But I know we'll meet again some sunny day

We'll meet again
Don't know where
Don't know when
But I know we'll meet again some sunny day
Keep smiling through
Just like you always do
'Til the blue skies
Drive the dark clouds far away
So will you please say hello
To the folks that I know
Tell them it won't be long
They'll be happy to know
That as you saw me go
I was singin' this song

We'll meet again
Don't know where
Don't know when
But I know we'll meet again some sunny day",We'll Meet Again [From Dr. Strangelove],1999
Vera Lynn,"Wrong
Would it be wrong to kiss
Seeing I feel like this
Would it be wrong to try?

Wrong
Would it be wrong to stay
Here in your arms this way
Under this starry sky?

If it is wrong
Then why were you sent to me
Why am I content to be
With you forever?

So
When I need you so much
And I have waited so long
It must be right
It can't be wrong",It Can't Be Wrong,1999
Vera Lynn,"Just picture a penthouse way up in the sky
With hinges on chimneys for stars to go by
A sweet slice of Heaven for just you and I
When we're alone.

From all of society we'll stay aloof
And live in propriety there on the roof.
Two heavenly hermits we will be in truth
When we're alone.

We'll see life's mad pattern
As we view old Manhattan
Then we can thank our lucky stars
That we're living as we are.

In our little penthouse we'll always contrive
To keep love and romance forever alive
In view of the Hudson just over the drive,
When we're alone.

We can thank our lucky stars
That we're living as we are.

In our little penthouse we'll always contrive
To keep love and romance forever alive
In view of the Hudson just over the drive,
When we're alone.",Penthouse Serenade (When We're Alone),1999
Vera Lynn,"There's nothing left for me of days that used to be
There's just a memory among my souvenirs

Some letters tied in blue, a photograph or two
I see a rose from you among my souvenirs

A few more tokens rest within my treasure chest
And though they do their best to give me consolation

I count them all apart and as the teardrops start
I find a broken heart among my souvenirs

I count them all apart and as the teardrops start
I find a broken heart among my souvenirs",Among My Souvenirs,1999
Vera Lynn,"Goodbye, No use leading with our chins,
This is where our story ends,
Never lovers, ever friends.

Goodbye, Let our hearts call it a day,
But before you walk away,
I sincerely want to say:

I wish you bluebirds in the Spring,
To give your heart a song to sing;
And then a kiss, but more than this I wish you love.

And in July, a lemonade,
To cool you in some leafy glade;
I wish you health and more than wealth, I wish you love.
My breaking heart and I agree
That you and I could never be,
So with my best, my very best, I set you free.

I wish you shelter from the storm,
A cozy fire to keep you warm;
But most of all, when snowflakes fall,
I wish you love.

I wish you bluebirds in the Spring,
To give your heart a song to sing;
And then a kiss, but more than this I wish you love.

And in July, a lemonade,
To cool you in some leafy glade;
I wish you health and more than wealth, I wish you love.
My breaking heart and I agree
That you and I could never be,
So with my best, my very best, I set you free.

I wish you shelter from the storm,
A cozy fire to keep you warm;
But most of all, when snowflakes fall,
I wish you love.",I Wish You Love,1999
Vera Lynn,"London Pride has been handed down to us.
 London Pride is a flower that's free.
 London Pride means our own dear town to us,
 And our pride it for ever will be.
 Woa, Liza,
 See the coster barrows,
 Vegetable marrows
 And the fruit piled high.
 Woa, Liza,
 Little London sparrows,
 Covent Garden Market where the costers cry.
 Cockney feet
 Mark the beat of history.
 Every street
 Pins a memory down.
 Nothing ever can quite replace
 The grace of London Town.
 
 INTERLUDE
 There's a little city flower every spring unfailing
 Growing in the crevices by some London railing,
 Though it has a Latin name, in town and country-side
 We in England call it London Pride.
 
 London Pride has been handed down to us.
 London Pride is a flower that's free.
 London Pride means our own dear town to us,
 And our pride it for ever will be.
 Hey, lady,
 When the day is dawning
 See the policeman yawning
 On his lonely beat.
 Gay lady,
 Mayfair in the morning,
 Hear your footsteps echo in the empty street.
 Early rain
 And the pavement's glistening.
 All Park Lane
 In a shimmering gown.
 Nothing ever could break or harm
 The charm of London Town.
 
 INTERLUDE
 In our city darkened now, street and square and crescent,
 We can feel our living past in our shadowed present,
 Ghosts beside our starlit Thames
 Who lived and loved and died
 Keep throughout the ages London Pride.
 
 London Pride has been handed down to us.
 London Pride is a flower that's free.
 London Pride means our own dear town to us,
 And our pride it for ever will be.
 Grey city
 Stubbornly implanted,
 Taken so for granted
 For a thousand years.
 Stay, city,
 Smokily enchanted,
 Cradle of our memories and hopes and fears.
 Every Blitz
 Your resistance
 Toughening,
 From the Ritz
 To the Anchor and Crown,
 Nothing ever could override
 The pride of London Town.",London Pride,1999
Vera Lynn,"Sweetheart of mine, I've sent you a valentine.
Sweetheart of mine, it's more than a valentine.
Be careful, it's my heart.
It's not my watch you're holding, it's my heart.
It's not the note I sent you that you quickly burned.
It's not the book I lent you that you never returned.
Remember it's my heart.
The heart with which so willingly I part.
It's yours to take to keep or break,
But please, before you start,
Be careful, it's my heart.","Be Careful, It's My Heart",1999
Vera Lynn,"The bells of St. Mary's
Ah! hear they are calling
The young loves, the true loves
Who come from the sea

And so, my beloved
When red leaves are falling
The love bells shall ring out
Ring out for you and me

The bells of St. Mary's
At sweet even time
Shall call me, beloved
To come to your side

And out in the valley
In sound of the sea
I know you'll be waiting
Yes, waiting for me

At the porch of St. Mary's
I'll wait there for you
In your soft wedding dress
With its ribbons of blue

In the church of St. Mary's
Sweet voices shall sing
For you and me, dearest
The wedding bells ring",The Bells of St. Mary's,1999
Vera Lynn,"I don't ever care to rise to power
I would rather be with you an hour
For the things that one can buy
Are not worth a lover's sigh

I don't want to set the world on fire
I just want to start a flame in your heart
In my heart I have but one desire
And that one is you, no other will do

I've lost all ambition for worldly acclaim
I just want to be the one you love
And with your admission that you feel the same
I'll have reached the goal I'm dreaming of, believe me

I don't want to set the world on fire
I just want to start a flame in your heart",I Don't Want to Set the World on Fire,1999
Vera Lynn,"I'm writing you, my dear,
Just to tell you,
In September, you remember
'Neath the old apple tree
You whispered to me
When it blossomed again, you'd be mine.

I've waited until I could claim you,
I hope I've not waited in vain.
For when it's spring in the valley,
I'm coming, my sweetheart, again!

I'll be with you in apple blossom time,
I'll be with you to change your name to mine.

One day in May
I'll come and say:
""Happy the bride the sun shines on today!""

What a wonderful wedding there will be,
What a wonderful day for you and me!
Church bells will chime
You will be mine
In apple blossom time.

I'll be with you in apple blossom time,
I'll be with you to change your name to mine.

One day in May
I'll come and say:
""Happy the bride the sun shines on today!""

What a wonderful wedding there will be,
What a wonderful day for you and me!
Church bells will chime
You will be mine
In apple blossom time.",I'll Be With You in Apple Blossom Time,1999
Vera Lynn,"Maybe you'll think of me
When you are all alone
Maybe the one who is waiting for you will prove untrue
Then what will you do
Maybe you'll sit and sigh
Wishing that I were near, then
Maybe you'll ask me to come back again
And maybe I'll say maybe

May be you'll think of me
When you are all alone
Maybe the one who is waiting for you will prove untrue
Then what will you do
Maybe you'll sit and sigh
Wishing that I were near, then
Maybe you'll ask me to come back again
And maybe I'll say maybe",Maybe,1999
Vera Lynn,"Wish me luck as you wave me goodbye
Cheerio, here I go, on my way
Wish me luck as you wave me goodbye
Not a tear, but a cheer, make it gay
Give me a smile I can keep all the while
In my heart while I'm away
'Till we meet once again, you and I
Wish me luck as you wave me goodbye

Wish me luck as you wave me goodbye
Cheerio, here I go on my way
Wish me luck as you wave me goodbye
Not a tear, but a cheer, make it gay
Give me a smile I can keep all the while
In my heart while I'm away
'Till we meet once again, you and I
Wish me luck as you wave me goodbye

Wish me luck as you wave me goodbye
Cheerio, here I go, on my way
Wish me luck as you wave me goodbye
Not a tear, but a cheer, make it gay
Give me a smile I can keep all the while
In my heart while I'm away
'Till we meet once again, you and I
Wish me luck as you wave me goodbye

Wish me luck as you wave me goodbye
Cheerio, here I go, on my way
Wish me luck as you wave me goodbye
Not a tear, but a cheer, make it gay
Give me a smile I can keep all the while
In my heart while I'm away
'Till we meet once again you and I
Wish me luck as you wave me goodbye

Goodbye everybody, I'll do my best for ye",Wish Me Luck As You Wave Me Goodbye,1999
Vera Lynn,"Wishing will make it so
Just keep on wishing and care will go
Dreamers tell us dreams come true
It's no mistake
Wishes are the dreams we dream
When we're awake

The curtain of night will part
If you are certain within your heart
So if you wish long enough wish strong enough
You will come to know
Wishing will make it so

Just imagine that you are
Back in childhood days
Wishing on the evening star
For a load of hay
It worked wonders for you then
Who knows why or how
Though you're older try again
It can help you now

Wishing will make it so
Just keep on wishing and care will go
Dreamers tell us dreams come true
It's no mistake 
Wishes are the dreams we dream when we're awake
The curtain of night will pass
If you are certain within your heart
So if you wish long enough wish strong enough
You will come to know
Wishing will make it so",Wishing,1999
Vera Lynn,"The bells of St. Mary's
Ah! hear they are calling
The young loves, the true loves
Who come from the sea

And so, my beloved
When red leaves are falling
The love bells shall ring out
Ring out for you and me

The bells of St. Mary's
At sweet even time
Shall call me, beloved
To come to your side

And out in the valley
In sound of the sea
I know you'll be waiting
Yes, waiting for me

At the porch of St. Mary's
I'll wait there for you
In your soft wedding dress
With its ribbons of blue

In the church of St. Mary's
Sweet voices shall sing
For you and me, dearest
The wedding bells ring",The Bells of St Mary's,1999
Vera Lynn,"Long ago and far away
I dreamed a dream one day
And now that dream is here beside me
Long the skies were overcast
But now the clouds have passed
You're here at last
Chills run up and down my spine
Aladdin's lamp is mine
The dream I dreamed was not denied me
Just one look and then I knew
That all I longed for long ago was you

Long ago and far away
I dreamed a dream one day
And now that dream is here beside me
Long the skies were overcast
But now the clouds have passed
You're here at last
Chills run up and down my spine
Aladdin's lamp is mine
The dream I dreamed was not denied me
Just one look and then I knew
That all I longed for long ago was you

Just one look and then I knew
(Him, with her humming along)
That all I longed for long ago

Was you",Long Ago (And Far Away),1999
Vera Lynn,"I saw the harbor lights
They only told me we were parting
The same old harbor lights that once brought you to me
I watched the harbor lights
How could I help if tears were starting
Goodbye to tender nights beside the silvery sea

I long to hold you near and kiss you just once more
But you were on the ship and I was on the shore

Now I know lonely nights
For all the while my heart is whispering
Some other harbor lights will steal your love from me

I long to hold you near and kiss you just once more
But you were on the ship and I was on the shore

Now I know lonely nights
For all the while my heart is whispering
Some other harbor lights will steal your love from me",There'll Come Another Day,2000
Vera Lynn,"A house with love in it is rich indeed
Although there are a thousand things that house may need
The carpet may be old, the room so plain and bare
And yet it's beautiful somehow, when love is living there
A house with love in it just seems to bloom
As though the month of May were filling every room
So, darling, through the years with all my heart I'll pray
A house with love in it is where we'll stay

A house with love in it just seems to bloom 
As though the month of May were filling every room
So darling, through the years with all my heart I'll pray
A house with love in it is where we'll stay",A House with Love in It,2000
Vera Lynn,"Everybody loves somebody sometime
Everybody falls in love somehow
Something in your kiss just told me
That sometime is now

Everybody finds somebody someplace 
There's no telling where love may appear
Something in my heart keeps saying
My someplace is here

If I had it in my power
I'd arrange for every girl to have you charms
Then every minute, every hour
Everybody would find what I found in your arms

Everybody loves somebody sometime
And though my dreams were overdue
Your love made it all worth waiting
For someone like you

If I had it in my power
I'd arrange for every girl to have you charms
Then every minute, every hour
Everybody would find what I found in your arms

Everybody loves somebody sometime
And though my dreams were overdue
Your love made it all worth waiting
For someone like you",Everybody Loves Somebody,2000
Vera Lynn,"If it takes forever I will wait for you
For a thousand summers I will wait for you
Till you're back beside me, till I'm holding you
Till I hear you sigh here in my arms
 
Anywhere you wander, anywhere you go
Every day remember how I love you so
In your heart believe what in my heart I know
That forevermore I will wait for you
 
The clock will tick away the hours one by one
Then the time will come when all the waiting's done
The time when you return and find me here and run
Straight to my waiting arms 

If it takes forever I will wait for you
For a thousand summers I will wait for you
Till you're here beside me, till I'm touching you
And forevermore sharing your love",I Will Wait for You,2000
Vera Lynn,"It had to be you, it had to be you.
I wandered around and finally found the somebody who
Could make me be true, could make me feel blue,
And even be glad just to be sad thinkin' of you.

Some others I've seen might never be mean
Might never be cross or try to be boss,
But they wouldn't do.
For nobody else gave me a thrill.
With all your faults, I love you still,
It had to be you, wonderful you,
It had to be you.

It had to be you, it had to be you.
I wandered around and finally found somebody who
Could make me be true, could make me be blue,
And even be glad just to be sad thinkin' of you.

Some others I've seen might never be mean
Might never be cross or try to be boss,
But they wouldn't do.

For nobody else gave me a thrill.
With all your faults, I love you still.

It had to be you, wonderful you

It had to be you.",It Had to Be You,2000
Vera Lynn,"Land of hope and glory, mother of the free
How shall we extol thee, who are born of thee?
Wider still and wider shall thy bounds be set
God, who made thee mighty, make thee mightier yet
God, who made thee mighty, make thee mightier yet

Land of hope and glory, mother of the free
How shall we extol thee, who are born of thee?
Wider still and wider shall thy bounds be set
God, who made thee mighty, make thee mightier yet
God, who made thee mighty, make thee mightier yet",Land of Hope and Glory,2000
Vera Lynn,"The look of love
Is in your eyes
A look your smile can't 
disguise

The look of love
Is saying so much more than
Just words could every say
And what my heart has heard
Well it takes my breath away

[Chorus]
I can hardly wait to hold you
Feel my arms around you
How long I have waited
Waited just to love you
Now that I have found you

You've got the look of love
It's on your face
A look that time can't erase
Baby be mine, tonight

Let this be just the start of 
So many nights like this
Let's take a lovers vow
And seal it with a kiss

[Chorus]

Don't ever go
Don't ever go
I love you so
The look of love

Let this be just the start of
So many nights like this
Let's take a lover's vow
And baby we'll seal it with a kiss

[Chorus]",The Look of Love,2000
Vera Lynn,"Sunset glow fades in the west, 
Night o'er the valley is creeping! 
Birds cuddle down in their nest, 
Soon all the world will be sleeping

And now is the hour when we must say goodbye, 
Soon you'll be sailing far across the sea, 
While you're away, o, then remember me, 
When you return, you'll find me waiting here

True lovers often must part, 
Kiss me, then leave me to sorrow! 
Here love, I give you my heart, 
You will return some glad morrow

But now is the hour when we must say goodbye, 
Soon you'll be sailing far across the sea, 
While you're away, o, then remember me, 
When you return, you'll find me waiting here.",Now Is the Hour,2000
Vera Lynn,"Put your hand in the hand of the man
Who stilled the water
Put your hand in the hand of the man
Who calmed the sea
Take a look at yourself
And you can look at others differently
Put your hand in the hand of the man
From Galilee

My momma taught me how to pray
Before I reached the age of seven
When I'm down on my knees
That's when I'm closest to heaven
Daddy lived his life, two kids and a wife
Well you do what you must do
But he showed me enough of what it takes
To get me through, oh yeh!

Put your hand in the hand of the man
Who stilled the water
Put your hand in the hand of the man
Who calmed the sea
Take a look at yourself
And you can look at others differently
Put your hand in the hand of the man
From Galilee
Oh yeh!

Put your hand in the hand of the man
Who stilled the water
Put your hand in the hand of the man
Who calmed the sea
Take a look at yourself
And you can look at others differently
Put your hand in the hand of the man
From Galilee
Oh yeh!

Put your hand in the hand of the man
Who stilled the water
Put your hand in the hand of the man
Who calmed the sea
Take a look at yourself
And you can look at others differently
Put your hand in the hand of the man
From Galilee
Oh yeh!
Put your hand in the hand of the man from Galilee
Put your hand in the hand of the man from Galilee, Oh yeh!",Put Your Hand in the Hand,2000
