Band,Lyrics,Song,Year
Tommy Dorsey & His Orchestra,"My mama done told me when I was in knee-pants
My mama done told me, she said Son
A woman will sweet-talk ya, she'll give you the big eye
But when that sweet talkin' is done

A woman's a two-face, a worrisome thing
Who'll leave ya to sing the blues in the night
Now the rain's a fallin', hear the train a callin', oooo-ee
Hear the lonesome whistle blowin' 'cross the trestle, oooo-ee

Oooo-ee-a-oooo-ee, ol' clickety-clack
Comes echoing back the blues in the night
The evening breeze will start the trees to cryin'
And the moonlight will hide its light

When you get the blues in the night
Take my word, the mockingbird
He will sing the saddest kind of song
He knows things are wrong and he's right

From Natchez to Mobile
From Memphis to St. Joe
Wherever the four winds seem to blow
I've been in some big towns and I've heard me some big talkin'

But there is one thing I know
A woman's a two-face
She's a worrisome thing
Who'll leave you to sing the blues in the night

Got a case of the blues in the night
Don't know what to do
Blues every night
It's all because of you
[Repeat: x 2]",Blues in the Night,1998
Tommy Dorsey & His Orchestra,"No one to talk with
All by myself
No one to walk with
But I'm happy on the shelf
Ain't misbehavin'
I'm savin' my love for you

I know for certain
The one I love
I'm through with flirtin'
It's just you I'm thinkin' of
Ain't misbehavin'
I'm savin' my love for you

Like Jack Horner
In the corner
Don't go nowhere
What do I care?
Your kisses are worth waitin' for
Believe me

I don't stay out late
Don't care to go
I'm home about eight
Just me and my radio
Ain't misbehavin'
I'm savin' my love for you

Like Jack Horner
In the corner
Don't go nowhere
What do I care?
Your kisses are worth waitin' for
Believe me

I don't stay out late
Don't care to go
I'm home about eight
Just me and my radio
Ain't misbehavin'
I'm savin' my love for you",Ain't Misbehavin',1998
Tommy Dorsey & His Orchestra,"Yes, indeed!

[Chorus:]	

Yes, indeed!
	
Yes, indeed!

Get to  making with the jive, boy 
You'll shout when it hits you 
Yes indeed
Yes yes
Yes you'll shout when it hits you 
Yes indeed

When the spirit moves you you'll shout hallelujah
I mean 
When it it hits you you'll holler
Yes indeed
Yes yes

It comes out if it's in you, yes indeed
Yes indeed
Makes you shout, Jack, it sends you
Yes indeed
Well let me hit you

When the jive starts jumping you'll shout
Let me in there
Well all right now
When it hits you you'll holler
Yes indeed
Yes indeed","Yes, Indeed!",1998
Tommy Dorsey & His Orchestra,"A moment after dark around the park
An old-fashion gent comes parading
Dressed in funny clothes but singing as he goes
The Lamplighter's Serenade

The old boy loves to talk with couples on the walk
But when it's half after love time
He reaches for his sticks and from his bag of tricks
He lights every star in the sky

And if a lady or a beau should answer no
He sprinkles their hearts with his magic
Then he steals away to sing another day
The Lamplighter's Serenade

The old boy loves to talk with the couples on the walk
But when it's half after love time
He reaches for his sticks and from his bag of tricks
He lights every star in the sky

And if a lady or a beau should answer no
He sprinkles their hearts with his magic
Then he steals away to sing another day
The Lamplighter's Serenade
",The Lamplighter's Serenade,1998
Tommy Dorsey & His Orchestra,"I hear music when I look at you
A beautiful theme of every dream I ever knew
Down deep in my heart I hear it play
I can feel it start, then melts away

I hear music when I touch your hand
A beautiful melody from some enchanted land
Down deep in my heart, I hear it say
""Is this the day?""

I alone have heard this lovely strain
I alone have heard this glad refrain
Must it be forever inside of me?
Why can't I let it go? Why can´t I let you know?

Why can't I let you know the song my heart would sing?
That beautiful rhapsody of love and youth and spring
The music is sweet, the words are true
The song is you

Why can't I let you know the song my heart would sing?
That beautiful rhapsody of love, and youth and spring
The music is sweet, the words are true
The song is you",The Song Is You,1998
Tommy Dorsey & His Orchestra,"Midnight, you heavy laden, it's midnight
Come on and trade in your old dreams for new
Your new dreams for old
I know where they're bought
I know where they're sold
Midnight, you've got to get there at midnight
And you'll be met there by others like you
Brothers as blue
Smiling on the street of dreams
 
Love laughs at a king
Kings don't mean a thing
On the street of dreams
Dreams broken in two can be made like new 
On the street of dreams
Gold, sliver and gold
All you can hold is in the moonbeams
Poor, no one is poor
Long as love is sure
On the street of dreams
 
Midnight, look at the steeple, it's midnight
Unhappy people, it's ringing with joy
It's ringing with cheer
'Cause yesterday's gone
Tomorrow is near
Midnight, the heart is lighter at midnight
Things will be brighter the moment you find
More of your kind
Smiling on the street of dreams
 
Love laughs at a king
Kings don't mean a thing
On the street of dreams
Dreams broken in two can be made like new 
On the street of dreams
Gold, sliver and gold
All you can hold is in the moonbeams
Poor, no one is poor
Long as love is sure
On the street of dreams
",Street of Dreams,1998
Tommy Dorsey & His Orchestra,"Two in love can face the world together, 
Hearts that cuddle up will muddle through,
The world may rock and rumble, 
Crowds may groan and grumble,
Thrones may even tumble too,
Darling, two in love can face the stormy weather, 
Laugh aloud at every cloud above,
And so we'll show them all what love can do, 
For you and I are two in love.",Two in Love,1998
Tommy Dorsey & His Orchestra,"I hadn't anyone till you,
I was a lonely one 'til you,
I used to lie awake and wonder if there could be
A someone in the wide world just made for me,
Now I see

I had to save my love for you, (I saved my love for you)
I never gave my love 'til you, (I saved it all for you)
And through my lonely heart demanding it,
Cupid took a hand in it,
I hadn't anyone till you.

I kept my love in secrecy,
I put it under lock and key,
I had to save my love for you!
I never gave my love away,
I waited for that lucky day
When I could give it to you

And through my lonely heart demanding it,
Cupid took a hand in it,
I hadn't anyone till you.",I Hadn't Anyone Till You,1998
Tommy Dorsey & His Orchestra,"There never was a gal I could love, like I love my Josephine
She's a flirt, she's a scamp, she's the vampiest vamp I've ever seen
It seems to me she's always flirting with the fellows passing by
But when I say she winks, then she tells me she thinks
There's a cinder in her eye
I believe it would be better if I'd leave her and forget
Everybody says it would be wise
But each time that I go out to dance with somebody else
I find myself dancing with tears in my eyes
For there's nobody quite so nice who can be quite so mean 
As my gal, what a gal, Josephine
 
There never was a gal I could love, like I love my Josephine
She's a flirt, she's a scamp, she's the vampiest vamp I've ever seen
It seems to me she's always flirting with the fellows passing by
But when I say she winks, then she tells me she thinks
There's a cinder in her eye
I believe it would be better if I'd leave her and forget
Everybody says it would be wise
But each time that I go out to dance with somebody else
I find myself dancing with tears in my eyes
For there's nobody quite so nice who can be quite so mean 
As my gal, what a gal, Josephine
",Josephine,1998
Tommy Dorsey & His Orchestra,"Dream beside me in the midnight glow, the lamp Is low
Dream and watch the shadows came and go, the lamp Is low
While you linger in my arms, my lips will sigh ""I love you so"" 
Dream the sweetest dream will ever know
Tonight the moon is high, the lamp Is low
 
Dream beside me in the midnight glow, the lamp Is low
Dream and watch the shadows came and go, the lamp Is low
While you linger in my arms, my lips will sigh ""I love you so"" 
Dream the sweetest dream will ever know
Tonight the moon is high, the lamp Is low
",The Lamp Is Low,1998
Tommy Dorsey & His Orchestra,"Light a candle in the chapel
At the closing of each day
Keep it burning while you're yearning
For the one who went away
Say a pray'r and ask the angel
To guide and to watch from above

Light a candle in the chapel
For the one you love

Say a pray'are and ask the angel
To guide and to watch from above
Light a candle in the chapel
For the one you love",Light a Candle in the Chapel,1998
Tommy Dorsey & His Orchestra,"Dear face that holds no sweeter smile for me,
Were you not mine, how dark the world would be
I know no light above that could replace
Love's radiant sunshine in your dear face.

Give me your smile, the love light in your eyes,
I could not hold a fairer paradise
Give me the right to love you all the while,
My world forever, the sunshine of your smile",The Sunshine of Your Smile,1998
Tommy Dorsey & His Orchestra,"I should care, I should go around weeping
I should care, I should go without sleeping
Strangely enough, I sleep well
Except for a dream or two
But then I count my sheep well
Funny how sheep can lull you to sleep

So I should care, I should let it upset me
I should care but it just doesn't get me
Maybe I won't find someone as lovely as you
But I should care and I do

I should care but it just doesn't get me
Maybe I won't find someone as lovely as you
But I should care and I do

And I do",I Should Care [From Thrill of a Romance][#],1998
Tommy Dorsey & His Orchestra,"I could show the world how to smile
I could be glad all of the while
I could change the grey skies to blues 
If I had you
I could leave the old days behind
Leave all my pals, I'd never mind
I could start my life all a new 
If I had you
I could climb the snow capped mountains
Sail the mighty ocean wide
I could cross the burning desert
If I had you by my side
I could be a king, dear, uncrowned
Humble or poor, rich or renowned
There is nothing I couldn't do 
If I had you
 
I could show the world how to smile
I could be glad all of the while
I could change the grey skies to blues 
If I had you
I could leave the old days behind
Leave all my pals, I'd never mind
I could start my life all a new 
If I had you
I could climb the snow capped mountains
Sail the mighty ocean wide
I could cross the burning desert
If I had you by my side
I could be a king, dear, uncrowned
Humble or poor, rich or renowned
There is nothing I couldn't do",If I Had You [From Thrill of a Romance][#],1998
Tommy Dorsey & His Orchestra,"I'm not the guy who cared about love,
And I'm not the guy who cared about fortunes and such,
I never cared much,
But look at me now!

And I never knew technique of kissin',
I never knew thrill I could get from your touch,
Never knew much,
Oh! look at me now!

And I'm a new man,
Better than
Casanova at his best;
with a new heart,
a brand new start,
I'm so proud I'm bustin' my vest!

So, I'm the guy who turned down a lover.
So I'm the guy who laughed at those blue diamond rings
One o' those things,
Oh! look at me now!

Oh! look at me now!

I'm a new man,
Better than
Casanova at his best;
with a new heart,
a brand new start,
I'm so proud I'm bustin' my vest!

So, I'm the guy who turned down a lover.
So I'm the guy who laughed at those blue diamond rings
One o' those things,
Oh! look at me now!
Oh! look at me now!
Oh! look at me - now!",Look at Me Now,1998
Tommy Dorsey & His Orchestra,"Have you got any castles
That you want me to build baby
Have you got any dragons
That you want to have killed, baby?
I'll get into my seven league boots
I'll get into my bulletproof suits
I'll get out my revolver that shoots
And rat-a-tat-tat-tat-at
Down they'll go
Have you got any mortgages
You want to have paid, baby?
Have you got any villains
That you want to have laid to rest?
After all my adventures are through
And I bring home a dragon or two
You can tell all the papers
That I did it because I love you","Have You Got Any Castles, Baby?",1999
Tommy Dorsey & His Orchestra,"I may be wrong but I think you're wonderful
I may be wrong but I think you're swell
I like your style say, I think it's marvelous
I'm always wrong so how can I tell

Deuces to me are all aces
Life is to me just a bore
Faces are all open spaces
You might be John Barrymore
You came along say I think you're wonderful
I think you're grand but I may be wrong

I may be wrong but I think you're wonderful
I may be wrong but I think you're swell
I like your style say, I really think it's marvelous
I'm always wrong so how can I tell

Deuces to me are all aces
Life is to me just a bore
Faces are all open spaces
You might be John Barrymore
You came along say I think you're wonderful
I think you're grand but I may be wrong

You said that Edison would never make that light
You laughed at Mr. Franklin with his key and kite
The point of the song is I'm always wrong
But with you baby I'm oh so right.",I May Be Wrong (But I Think You're Wonderful),1999
Tommy Dorsey & His Orchestra,"Sometimes I wonder why I spend
The lonely night dreaming of a song
The melody haunts my reverie
And I am once again with you

When our love was new
And each kiss an inspiration
But that was long ago
And now my consolation
Is in the stardust of a song

And beside a garden wall
When stars were bright
You are in my arms
The nightingale told his fairy tale
A paradise where roses bloom

Though I dream in vain
In my heart it always will remain
My stardust melody
The memory of love's refrain

Though I dream in vain
In my heart it always will remain
My stardust melody
The memory of love's refrain

The memory of love's refrain",Stardust on the Moon,1999
Tommy Dorsey & His Orchestra,"You and I know love has found us 
Why does my heart beat now?
Why is the world sweet now?
You and I know 

There is a glow all around us,
Like a new dawn breaking 
Is it romance waking?
You and I know

Oh! This ecstasy, that makes me cry 
It will stay with me until I die 
Easy to see we were fated never to be lonely 
Love such as this only you and I know",You and I Know,1999
Tommy Dorsey & His Orchestra,"I was a hum-drum person
Leading a life apart
When love flew in through my window wide
And quickened my hum-drum heart
Love flew in through my window
I was so happy then
But after love had stayed a little while
Love flew out again

What is this thing called love?
This funny thing called love?
Just who can solve its mystery?
Why should it make a fool of me?
I saw you there one wonderful day
You took my heart and threw my heart away
That's why I ask the Lawd up in Heaven above
What is this thing called love?

You gave me days of sunshine
You gave me nights of cheer
You made my life an enchanted dream
'Til somebody else came near
Somebody else came near you
I felt the winter's chill
And now I sit and wonder night and day
Why I love you still",What Is This Thing Called Love?,1999
Tommy Dorsey & His Orchestra,"Once in a while will you try to give
One little thought to me
Though someone else may be
Nearer your heart?

Once in a while will you dream
Of the moments I shared with you
Moments before we two
Drifted apart?

In love's smoldering ember
One spark may remain
If love still can remember
That spark may burn again

I know that I'll be contented
With yesterday's memory
Knowing you think of me
Once in a while

In love's smoldering ember
One spark may remain
If love still can remember
The spark may burn again

I know that I'll be contented
With yesterday's memory
Knowing you think of me
Once in a while",Love is the Sweetest Thing,1999
Tommy Dorsey & His Orchestra,"Be careful, it's my heart,
It's not my watch you're holding, it's my heart.
It's not the note that I sent you that you quickly burn,
It's not a book I lent you that you never return.
Remember, it's my heart.
The heart with which so willingly I part
It's yours to take, to keep or break,
But please, before you start,
Be careful, it's my heart.","Be Careful, It's My Heart [#]",1999
Tommy Dorsey & His Orchestra,"It all comes back to me now, 
A starry summer sky,
A laughing you and I, alone.
It all comes back to me now, 
A sea of midnight blue,
Your face uplifted to my own.

We called it a thrill of the moment, 
And blamed the moon up above,
We didn't know what the glow meant,
We never dreamed it might be love.
It all comes back to me now, 
The love I threw away,
And now each lonely night I pray, 
That it will all come back to me someday.",It All Comes Back to Me Now [#],1999
Tommy Dorsey & His Orchestra,"It's all so new to me to have you care
A lifetime of romance and joy that we can share
It's all so new to me, I can't believe
That this is love that lasts, enchanting and unsurpassed

Sapphire skies of blue and nights alone with you
The sun shines through the darkest day and finds us happy, oh so gay
It's all so new to me, it's such a thrill
To know that you belong to me and always will

It's all so new to me to have you care
Makes a lifetime of romance and joy that we can share
It's all so new to me, I can't believe
Oh that this is love at last, enchanting and unsurpassed

Sapphire skies of blue and nights alone with you
The sunshine through the darkest day and finds us happy, oh so gay
It's all so new to me, it's such a thrill
To know that you belong to me and always will",It's All so New to Me [#],1999
Tommy Dorsey & His Orchestra,"There I go, leading with my heart again
And there I go, acting not so smart again
But though it's unwise, I can't disguise my love.
Though I know too much love may curb the fire
There I go, led astray by my desire
There's no golden rule to guide a fool in love.
I tell my heart, ""Be careful, or you'll find that you dream alone.""
I'm wise it's true, what good does it do?
My heart has a mind of its own.
There I go, spilling all the dreams I knew
And there I go thrillingly in love with you.
Don't know if you care, darling, but there I go.",There I Go [#],1999
Tommy Dorsey & His Orchestra,"Blue moon you saw me standing alone
Without a dream in my heart
Without a love of my own
Blue moon, you knew just what I was there for
You heard me saying a prayer for 
Someone I really could care for

And then there suddenly appeared before me
The only one my arms will hold
I heard somebody whisper ""Please adore me""
And when I looked, the moon had turned to gold!

Blue moon! 
Now I'm no longer alone
Without a dream in my heart
Without a love of my own

And then there suddenly appeared before me
The only one my arms will ever hold
I heard somebody whisper ""please adore me""
And when I looked, the moon had turned to gold!

Blue moon! 
Now I'm no longer alone
Without a dream in my heart
Without a love of my own

Blue moon! 
Now I'm no longer alone
Without a dream in my heart
Without a love of my own",Blue Moon [#],1999
Tommy Dorsey & His Orchestra,"Deep night, stars in the sky above
Moonlight, lighting our place of love
Night winds seem to have gone to rest
Two eyes, brightly with love are gleaming
Come to my arms, my darling, my sweetheart, my own
Vow that you'll love me always, be mine alone

Deep night, whispering trees above
Kind night, bringing you nearer, dearer and dearer
Deep night, deep in the arms of love

Come to my arms, my darling, my sweetheart, my own
Vow that you'll love me always, and be mine alone

Deep night, whispering trees above
Kind night, bringing you nearer, dearer and dearer
Deep night, deep in the arms of love",Deep Night [#],1999
Tommy Dorsey & His Orchestra,"I've got my eyes on you,
So best beware where you roam.
I've got my eyes on you,
So don't stray too far from home.
Incidentally
I've set my spies on you,
I'm checking all you do
From a to zee.
So, darling, just be wise,
Keep your eyes on me.",I've Got My Eyes on You [#],1999
Tommy Dorsey & His Orchestra,"Marie, Marie, Marie

Marie, the dawn is breaking
Marie, (ooh, Marie) you'll soon be waking
To find you heart is aching
And tears, (and tears) will fall, (will fall) as you recall
The moon in all its splendor
A kiss, (ooh, a kiss) so very tender
The words, ""Will you surrender
To me, (Marie), Marie, (Marie)?""

Marie, you'll soon be waking
To find you heart is aching
And tears, (and tears) will fall, (will fall) as you recall
The moon in all its splendor
A kiss, (ooh, a kiss) so very tender
The words, ""Will you surrender
To me, (Marie), Marie, (Marie) Marie (Marie)?""",Marie [#],1999
Tommy Dorsey & His Orchestra,"Got a little rhythm, a rhythm, a rhythm
That pit-apats through my brain;
So darn persistent,
The day isn't distant
When it'll drive me insane.

Comes in the morning
Without any warning,
And hangs around me all day.
I'll have to sneak up to it
Someday, and speak up to it.
I hope it listens when I say

Fascinating Rhythm,
You've got me on the go!
Fascinating Rhythm, 
I'm all a-quiver.

What a mess you're making!
The neighbors want to know
Why I'm always shaking
Just like a flivver.
Each morning I get up with the sun 
Start a-hopping,
Never stopping 
O find at night no work has been done.

I know that
Once it didn't matter 
But now you're doing wrong
When you start to patter
I'm so unhappy.
Won't you take a day off?
Decide to run along
Somewhere far away off 
And make it snappy!

Oh, how I long to be the man I used to be!
Fascinating Rhythm,
Oh, won't you stop picking on me?",Fascinating Rhythm,1999
Tommy Dorsey & His Orchestra,"Days can be sunny, with never a sigh
Don't need what money can buy
Birds in the trees sing their day full of song
Why shouldn't we sing along?

I'm chipper all the day, happy with my lot
How do I get that way? Look at what I've got

I got rhythm, I got music
I got my man
Who could ask for anything more?
I got daisies, in green pastures
I got my man
Who could ask for anything more?

Old man trouble
I don't mind him
You won't find him 'round my door
I got starlight
I got sweet dreams
I got my man
Who could ask for anything more ?

Old man trouble
I don't mind him
You won't find him, 'round my door
I got starlight
I got sweet dreams
I got my man
Who could ask for anything more ?

I got rhythm, I got music
I got daisies, in green pastures
I got starlight
I got sweet dreams
I got my man
Who could ask for anything more ?",I Got Rhythm,1999
Tommy Dorsey & His Orchestra,"Have you met Dolores? She's queen of the forest
Have you met Olivia? Her I'd gladly give ya
Have you met the queen, the rulah, Tallulah
For that gal Tallulah I would fight a duela,
I would climb a hillah, I'll paddle to Priscilla,
But this is getting sillah, I'm getting lots of thrillah, Tallulah
When she starts to lock on to a man to love she wants to fricassee
No one doing the hula, can do what Tallulah can do to me.
I have met Fatima (Fatima is a schemma)
I have met Marquita (Marquita is a cheeta)
I have met Jemima, she's a social climba
I have met Ophelia, she will double deal ya,
Just one girl is Trullah, I'll take Tallulah",I'll Take Tallulah,1999
Tommy Dorsey & His Orchestra,"The moment has come, I hear a drum
Or is it my heart dear, beating this way
There's work to be done, done with a gun
There goes the bugle, I hear it say

It's the last call for love, time to say Fare thee well
Let the taps tell you all that my heart dare not tell

[Chorus:]
With your eyes in the stars of Old Glory
Can I help but be faithful to you
Till we meet on the day we're dreaming of
It's the last call for love

[Chorus]

It's the last call for love, sweetheart",The Last Call for Love (Reprise),1999
Tommy Dorsey & His Orchestra,"Poor you, I'm sorry you're not me, for you will never know what loving you can be.
Poor you, you'll never know your charms,
You'll never feel your warmth, you're never in your arms.
When it is you I'm kissing, I pity you constantly,
You don't know what you're missing, 'cause you're only kissing poor me.
Poor you, you live your whole life through,
And yet you'll never know the thrill of loving you.",Poor You,1999
Tommy Dorsey & His Orchestra,"Without my walking stick, I'd go insane
I can't look my best I feel undressed without my cane.
Must have my walking stick 'cause it may rain
When it pours can't be outdoors without my cane.

If I ever left my house without my walking stick
Well it would be something I could never explain
Oh the thing that makes me click, on lovers lane
Would go for naught if I were caught without my cane.

Be-bop-bop-de-la-dum
Be-bop-a-da-bum
Re-bop-be-a
Rop-a-de-bop
Rump-a-de-dum
Ra-da-da-de

Re-bop-bop-la-da-dum
Re-bop-be-de-a
Rop-a-de-bum
Rop-a-de-bum
Deet-de-de-a
Ra-da-da-dum

If I ever left my house without my walking stick
Well it would be something I could never explain
Oh the thing that makes me click on lovers lane
Would go for naught if I were caught without my cane.",My Walking Stick,1999
