Band,Lyrics,Song,Year
Flotsam & Jetsam,"The downhill slope I'm standing on is starting to hurt my feet
My neck gets stiff from staring up at the world
I'd show you all my self esteem
But I lost it somewhere down the road

Why is it everywhere I stand
Is a foot shorter than the space next to me
I can't see the action due to the crowd
There is never a horizon in my view

Like walking through knee high water
My steps through life are slow and hard
And I never seem to get all the way to shore
The longer I stand, the deeper I sink

Why is it everywhere I stand
Is a foot shorter than the space next to me
I can't see the action due to the crowd
There is never a horizon in my view

I don't know if I'm down in the dumps
But it sure smells like
Trash to me
I don't know if I'm down in the dumps
But it sure smells like
Trash to me

Why is it everywhere I stand
Is a foot shorter than the space next to me
I can't see the action due to the crowd
There is never a horizon in my view

I don't know if I'm down in the dumps
But it sure smells like
Trash to me
I don't know if I'm down in the dumps
But it sure smells like
Trash to me
I don't know if I'm down in the dumps
But it sure smells like
Trash to me",Trash,2001
Flotsam & Jetsam,"Knowledge alone is not what's consuming me
No one at home, even when I'm not asleep
Demons are chasing me
Knowing that I can't run

Teasing and taunting me
Round in my mind
Knowledge alone is not what's consuming
Bleed the mind

Drain to see what's inside
What will you find
Something you can't explain
Bleed the mind

Empty the thoughts from there
Asleep inside
Brain activity, rare
Demons are chasing me

Knowing that I can't run
Teasing and taunting me
Round in my mind
Bleed the mind

Until the head is turned
Search the soul, can't find morality
No one at home, lost deep inside my sleep
Search the soul, look past the hollow stare

Find my soul
Demons are chasing me
Knowing that I can't run
Teasing and taunting me

Round in my mind
Bleed the mind
Until the head is
Until the head is turned",Bleed,2005
Flotsam & Jetsam,"I can see pieces of memory spitting
Like sparks from a gun that's been fired and hitting
The skull of the soul who was so unsuspecting
And the look in his eye as he's feeling the burn
I can hear flesh as it's being infected
From hot burning lead that's been flying so fast
The sound of the sting as it melts through the skin
And the intake of air that just may be his last
It's happening again
The sleep in my eye is dry blood
It's happening again
I can't hold it back

Hold me
Hold me closer
Tell me
That everything will be fine
Hold me
Hold me closer
Tell me

That I'm not outta my mind
Went to a priest to see what he could tell me
Bout all of the evil that swims in my head
Well I think that his voice had been very relaxing
Cause I fell asleep - now the Father is dead
I started to worry bout what's up ahead
Will I knock on the door of Heaven when I'm dead
Will they know it's not me that I'm not a killer
I don't even know what I did while I'm out
It's happening again
The sleep in my eye is dry blood
It's happening again
I can't hold it back
Show me
Show me reasons
Tell me
Why it's wrong to take lives
Show me
Show me more
Tell me
Why I'm not outta my mind
 
Show me
Show me reasons
Tell me
Why it's wrong to take lives
Show me
Show me more
Tell me
Why I'm not outta my mind",Out of Mind,2005
Flotsam & Jetsam,"Waking from another nightmare
It's so hard to tell
Dreams are turning real and there's a blood bath
Straight to hell

I can see what's happening
I know almost everything
I can tell when I'm imagining
Why can't I remember anything?

Waking from another nightmare
It's so hard to tell
Dreams are turning real and there's a blood bath
Straight to hell

I'm told I'm a psycopath
? I'll be in a paper ?
Killing somehow clears my mind
Willing to do a little more each time

Waking from another nightmare
It's so hard to tell
Dreams are turning real and there's a blood bath
Straight to hell

Never knowing if I'm really in reality
Never can tell if I am still asleep
Never knowing if I'm really in reality
Never can tell if I am still asleep

Never knowing if I need to blame
Never to feel remorse or shame
I never can remember what I do
I can't stop coming after you

Waking from another nightmare
It's so hard to tell
Dreams are turning real and there's a blood bath
Straight to hell

Waking from another nightmare
It's so hard to tell
Dreams are turning real and there's a blood bath
Straight to hell",Straight to Hell,2005
Flotsam and Jetsam,"Is this real or just a test?
Attitude learned from the best

Is this real or just a test?
Attitude learned from the best
Showed the cross but never blessed
Been sleeping long without rest

Is this real or just a test?
Attitude learned from the best
Showed the cross but never blessed
Been sleeping long without rest

Is this real or just a test?
Attitude learned from the best
Showed the cross but never blessed
Been sleeping long without rest",(Ain't Nothing Gonna) Save This World,1992
Flotsam and Jetsam,"Passage through time
Leave this place time to erase
My link to myself
Leads me astray 
The whole world in my way
Out of my body, out of my mind
Out of luck and out of time

Sift through the remains 
Enter this cage-disengage
Once it was easy
My best foot forward
As I trip through the same daily non-existing life I call hell

Bloodless, pale
Another empty shell 
Captured mind details
As I loath myself
Can't you see, can't you tell
Safely assumed, I'm not well
Cradle me now, teach me how
Teach me how, cradle me now

Make life not your victim
Resume your identity but don't overload
Seek the riches
Hungry for change, I've got to explore
Hidden recesses, lost in my mind
Trapped forever doing time

Bloodless, pale
Another empty shell 
Captured mind details
As I loath myself
Can't you see, can't you tell
Safely assumed, I'm not well
Cradle me now, teach me how
Teach me how, cradle me now

Bloodless, pale
Another empty shell 
Captured mind details
As I loath myself
Can't you see, can't you tell
Safely assumed, I'm not well
Cradle me now, teach me how
Teach me how, cradle me now

Bloodless, pale
Another empty shell 
Captured mind details
As I loath myself
Can't you see, can't you tell
Safely assumed, I'm not well
Cradle me now, teach me how
Teach me how, cradle me now",Cradle Me Now,1992
Flotsam and Jetsam,"Wolves devour
The full moon heart
Screams bloodless howls
And starves for the dawn
As teeth and jaw
Sink in like needles
There's no love lost
For a helpless pawn

Taking care of business
Selling rock candy and suicide
The message
In the battle of the colors
Eyes for eyes, brothers for brothers

Taking care of business
Selling rock candy and suicide
Buying low and selling high
Business booms when cold lead flies
The message
Delivered every day
The message
Tribal, primal, criminal

Old men backing out of heart attacks
Send the young ones back to do a man's job
To the fire and water
The best man's daughter weds the wings of the dragonfly

Taking care of business
Selling rock candy and suicide
Buying low and selling high
Business booms when cold lead flies
The message
Delivered every day
The message
Tribal, primal, criminal

The message
Delivered every day
The message
Tribal, primal, criminal",The Message,1992
Flotsam and Jetsam,"Play heed this take of the prince of darkness,
Whom we're taught to fear from day number one.
The beguiling serpent, king of the underworld,
Betrayer and mocker of heaven's chosen one.
Evil and wicked dreamer, creator of sins,
Ultimate deceiver; longing to take you in.
He promises earthly glory, if you play his game;
""I won't let the firebombs hurt you, just
Number your head and take my name.""

Belial begins his scheming, treacherous plan,
Turns brother on brother, toys with the leaders of man.
He creates before them illusions of broken truce,
A wicked plot of deception, that commanders cannot refuse.
In a short time he has control,
USA, Russia, chaos from pole to pole.
Mankind's worst nightmare, it's too late to pray,
Hold tight and take your last breath,
The missiles are on their way...DOOMSDAY!

All over the earth the horror begins,
This time there's no second chance.
Firebombs...deathly flash, vapors spread so fast,
In a moment the world is ash.
There in the midst stands the deceiver
Bearing a brooding smile.
Surrounded by his marked believers,
The masses of unscarred.

Evil's reign, called by the prophets,
Under a darkened sky,
Ghastly sins everywhere, unmarked survivors
Sacrificed as demons dance.
Suddenly, the hordes are silenced,
By the rumbling planed, metalbeast soon to appear,
To challenge the enemy, to deal his doom,
To write the devil's dirge...Doomsday!

The scorched ground opens, the beast of metal appears,
Satan and his army show no sign of fear.
Across desert plains, through city streets,
In the hills evil meets defeat.
Covens one by on fall by metal's hand,
As the dark forces weaken.
The monster rages through the battles,
To confront the master of sin.

As the night falls, the beasts, they meet
And the existing numbered line along the street.
The air is charged with power metal,
Flotzilla's eyes glow as he feeds.
The clash begins, a fight 'til death,
Such power never seen before.
Thrashing jaws, slashing claws,
Dealing the darkside's fate;
The deceiver's doom this day...DOOMSDAY!
",Doomsday For the Deceiver,2008
Flotsam and Jetsam,"I lie here awake.
My lifeless body that's cold feeling the pain.
That's a cry far away.
Why is this prolonged, I've already lived, what's to fear.

Now kill the power, become partners of sin.
Alone in our decision to unlock the door,
And escape from within.
For only death is my life.
Escape from within.

From terminal living, cutting me, low in my prime.
Contract of death, silent screams beg to be signed.
You'll live the life of a saint as you decide,
Mercy kill to turn the tide.

Now kill the power, become partners of sin.
Alone in our decision to unlock the door,
And escape from within.
For only death is my life.
Escape from within.
Escape from within.

From terminal living, through the years I've laid alone.
Tubes through my body, there's no will to carry on.
You'll live the life of a saint as you decide,
Mercy kill to turn the tide.

Now kill the power, become partners of sin.
Alone in our decision to unlock the door,
And escape from within.
For only death is my life.
Escape from within.
Escape from within.
Escape from within.
",Escape From Within,2008
Flotsam and Jetsam,"A fork is a cold shiny tool
To pierce, tear and ingest
Whoever has the fork in hand
Controls the meal of its choice
We're told the first few punctures
They're for our own good
Better carved up in pieces
Than blown up in the oven

Agh! Agh! Agh!
Forkboy
Flies by night on stolen fuel
To Santa Rosa, CA
Opens a fake employment office
""Want a job? Go get me drugs""
People desperate for work
Return to quite a surprise
Busted for intent to sell
Cops pay him a bounty
Forkboy skips town

Agh! Agh! Agh! Agh!
We came
We peed
We conquered
You bleed

The choice:
Fork Boy
Or Finger Food

Ugly joy
What does it replace?
Why wait
When you can eat yourself alive today

Junk bondage takeover glutton
Ready to bore in
Unfold his rotary blades inside
Pull the guts out and resell them
Buys out his next target
With the last one's pension funds
Thousands more thrown out of work
So Leona won't have to settle for a mint

Forkboy
Picked by the FBI
To be the black pied piper
After Dr. King died
Watches soap operas on TV
While 6 billion's disappears from HUD
Who are you working for
What did you hope to gain
Why do you hate your past
So much you destroy the ones you love

Forkboy!
",Fork Boy,2008
Flotsam and Jetsam,"Hello, how are you? Ready tonight?
I'm here to show you.
I know your kind, I like you just fine,
Anyway I choose.
Hammerhead baby in plainsight, in lace and leather.
She wants me to feel just right,
Wants to get together.

Come on now lady, show me how you rock,
I want to get to know you.
I'm hot, so give me what you've got,
My turn to go you.
Faster than the speed of light,
Wham bam! I thank you, or...
All night pounding away, with more ways to please me.

CHORUS
Love for the taking, she talks with her eyes,
Wants me to give her a ride.
Spellbound she takes me way deep inside,
Hammerhead baby tonight...Hold tight!

We're all alone, my love has grown,
My time to show you.
You're on your knees, you're ready to please,
Give me the Hammer...Head.

REPEAT VERSE I
CHORUS
",Hammerhead,2008
Flotsam and Jetsam,"Does it teach? Can it learn? Are you sure it's right?
One that's young sees the circled ""are"", does he buy it?
What the fuck! Can't he buy what he wants to hear?
You muzzle us, we'll muscle you! You'll live in demented fear.

Is it good for us or harmful? Does it enlighten or repress?
Our children need to know what's going on and that our world is a mess.
What the fuck! Can't we say what we think anymore?
Clean up the world, and we'll be singing praises forever more...

chorus: 
Can't you see, you're ripping away our independence,
No one cares but you.
There's never a way to stop the music,
If you're hard on us, we're gonna be hard on you, H.O.Y!
Can't you see, you're ripping away our independence,
No one cares but you.
There's never a way to stop the music,
If you're hard on us, we're gonna be hard on you, H.O.Y!

You say teach the children right, who's to say we're wrong?
If your committee is so damn right, why did we write this song?
What the fuck! Can we write what we feel or not?
You muzzle us, we'll kick your ass! You'll see that we can't be bought!

(repeat chorus)
",Hard On You,2008
Flotsam and Jetsam,"Your life passes you by, I live, you die.
The arena is mine, I live, you die.

Entry of the gladiators, 264 B.C.
The emperors and nobles have made a pawn of me.
I battle slaves end free men and wild blood thirsty beasts.
The red sand surrounds me, so they can't see them bleed.

chorus: 
Your life passes you by (I live you die).
The Reaper is near.
Again the arena is mine (I live you die).
I live you die.

Sword drawn and battle ready, Trajan in command.
Fight 'till death 100 days, corpses of 2000 men.
The masses they decide the fate of a fallen men.
Thumbs down in drunken haste, life's taker and giver I am.

(repeat chorus)
Innocent children dressed like the sacred lamb,
Taken for Nero's-slaughter, as the people look away,
To the pit dogs they are prey, the people look away... they look away...

I live, you die!
Persecuted Christians in the blood soaked ring.
Many over many lose their lives, peace to their soul it brings.
The thrills from the kills, those that I have slain,
Are keeping my heart pounding, I live another day.

Your live passes you by (I live you die).
The Reaper is near.
Again the arena is mine (I live you die).
I live again.
Your live passes you by (I live you die).
The Reaper is near.
Again the arena is mine (I live you die).
I live you die.
Die! Die! Die!
",I Live You Die,2008
Flotsam and Jetsam,"Far to the east ruled the Samurai, mystic warrior class,
Honorable brave, bark armoured man, donning hideous mask.
700 years of reigning Japan, the masters of attack,
Dominators of the isle of dragons, fearsom military caste.

In battle no prisoners for the enemy, noble self-sacrifice,
Crooked crowns sentenced to die, pay the bloody price.
Sacred rites held close by the fighters, no place for disgrace,
Taught to stand with dignity while staring in death's face.

chorus: 
Honor even in death, soldiers glorified,
The dagger plunges deep, slashes side to side.
Honor even in death, digrace is defied,
The end they never fear, give their life before their pride.
Honor even in death, soldiers glorified,
The dagger plunges deep, slashes side to side.
Honor even in death, digrace is defied,
The end they never fear, give their life before their pride.

Gracefully, with steady hand,
He takes the dagger that lays before him.
Collects his thoughts for the last time,
And plunges the dirge from left to right.
No sign of pain on his face,
With the final cut withdraws the blade.
Loyal companion by his side,
Lifts the sword to help him die.
Lightning flash, one swift blow,
Honor is done, warriors head rolls.

In a mans glory, his spirit is stored, his very being inside,
Dignity respected, courage is shown by his ritual suicide.
No room for dishonor in hari kari's dagger gashing side to side,
Under the rising sun the core is exposed, to reveal a new life.

(repeat chorus)
",No Place For Disgrace,2008
Flow,"All I want is a little respect
All I need is a little respect
Ha Oh
Ohhh

Have you ever had a girl to call up your man
Better tell her
Step back
Step back

She claimin' that your man is her man
Gonna get her wig knocked way back
But you gotta act right and not let it lack now
I'm a lover

Not a fighter
But if she keep on disrespectin' I might just
She violate 
I got the right to strike her

Yeah
Come up out of these heels (Heels)
Take it pull my hair back (My hair back)
I know I need to chill 

All I want is a little respect (Respect)
Ladies know how it feels (Oh, oh)
When another girl violates that (That's right)
No when it's my man yawl
You better tell that girl to step

Step back
Step back
Step back
Step back
Tell that girl to step 
Step back
Step back
Step back
Step back

You know them type of chicks that walk by
Better tell her keep on walkin'
Twist to the side to catch your mans eye
Turn around to see if he watchin'

Those them type of girls you set straight
If you don't they will keep walkin'
But you better shut her down before it's to late now (Come on)
Tell her she don't want no problems

Yeah (Yeah)
Come up out of these heels (Heels)
Take it pull my hair back (My hair back)
I know I need to chill

All I want is a little respect (Respect)
Ladies know how it feels (All my ladies know how it feels)
When another girl violates that
No when it's my man yawl
You better tell that girl to step (Say what)

I am not the one to be played with
Tell that girl to step (Step back)
I ain't got no time for the bull shhh (Come on)
You should learn some respect (I think you need to learn some respect)

'Cause if a girl came clockin' your man
You wouldn't like that (Oh no, oh)
I'm not one to go and start fights
I'm not the type

You gotta cop your own
'Cause this one is mine
Whoa, whoa, whoa

Yeah
Come up out of these heels (Oh no)
Take it pull my hair back (Oh no)
I know I need to chill

All I want is a little respect (Some respect)
Ladies know how it feels (Hey)
When another girl violates that (What, what)
No when it's my man yawl
You better tell that girl to step (You better tell that girl Oh, oh)

Yeah
Come up out of these heels (Heels)
Take it pull my hair back (Oh)
I know I need to chill

All I want is a little respect (All I want is a little respect)
Ladies know how it feels
When another girl violates that (Hey, oh)
No when it's my man yawl
You better tell that girl to step

All I want is a little respect (What)
Step back
Step back
Tell that girl to step

All I need is a little respect 
Step back
Step back
All I want
You better tell that girl to step

All I want is a little respect (Whoa, you better)
Step back
Step back
Tell that girl to step

All I need is a little respect (Step, come on)
Step back
Step back

You better tell that girl to step
To step
To step
To step",Step,2005
Flow,"[Intro]

Turn on the faucet...mm-hmm
Uh-huh (x5)
You and you throw your hands up
If you in the back come on, throw your hands up
If you in the front, you can throw your hands up
If you on the side, you can throw your hands up
Wave 'em in the sky, you can throw your hands up
Yo its aiight if you want to throw your hands up
You and you and you could throw your hands up
Cause its the be	-double-ooh
be	-double-oh, this is how we do
On the regular oh-ooh, you know who
Uh-huh (x3)

[Buckshot]

Yo there used to be a rumor about BDI
I wouldn't come back, I tell you no lie
But when I listen to the radio I think
Whenever I'm back, I'm bound to make a link
With the music that used to make me jam and jump
Thump while the bass bump
Tellin BJ throw on the wax that's playin the Therapy mix
You said it was aiight, we made a remix
Licks after licks take ticks
Of the time clock
be	-D-Buck a shot, uh, take it to the top
See I'm bound to make your body pop
One nation under a groove, so my beat'll never stop
When I heard about the beef between the East and the West coast
Called my nigga Kurupt, I knew it was boast
They hope a nigga in the music with this bomb
So I prepare load my arms
And wait, cause its the last time

Chorus [F.L.O.W.]

This is the last time i will
Ever struggle
This is the last time i will
Ever fall

[BJ Swan]

My moms gotta take in second-hand bum smoke 
Just to keep from breakin, goin broke
And if you read my diary it'd break your heart
Cause I been losin like a mutherfucka from the start
Excuse me--but that's the only way that I can express
My life feelin like a bunch of bullets racin through my chest
Time after time i felt the feelin that you feel when you lose
Sittin on my stoop cryin blues
Seekin refuge from these hard-time skits
Remembering days when I was literally penniless
And have to watch my people do it alone
I said it was the last time but this time I swear
I'll make it happen if I have to to lose all my hair 
For real

Chorus (x2)

[Steele]

Eyes watch as I make moves
Livin proof that the struggle still continues
Who's out to gain for fame?
Let him not remain vain
Time will tell who fell
And who maintained
Finding my purpose in this life
Cause I ain't sure that we all promised paradise
Precisely I'm just like the seed
Planted in the Earth to bring forth new breed
Shall I proceed to manifest destiny
Surely me and all of my be	 and see
Will find our time on the line of history
Faithfully as G-O-D watchin over we
Created we so I satnd in my God Body
Hardly moved by those crews that try to charge me falsely
It won't be the first time and it won't be the last time 
I'm sure

[F.L.O.W.]

No more strugglin
No more pain
Only good times after this
I pray  
(repeats until end)

Chorus (repeats until end)

All you gotta do is believe in me...",Last Time,1997
Flow,"We are fighting dreamers takami wo mezashite
Fighting dreamers narifuri kamawazu
Fighting dreamers shinjiru ga mama ni
Oli oli oli oh-! just go my way!

Right here right now (bang!)
Buppanase like a dangan liner!
Right here right now (burn!)
Buttakitteku ze get the fire!

Right here right now (bang!)
Buppanase like a dangan liner!
Right here right now (burn!)

Kewashii shura no michi no naka hito no chizu wo hirogete doko e yuku?
Gokusaishoku no karasu ga sore wo ubaitotte yaburisuteta

Saa kokoro no me mihiraite shika to ima wo mikiwamero! (yeah!)
Ushinau mono nante nai sa iza mairou!

We are fighting dreamers takami wo mezashite
Fighting dreamers narifuri kamawazu
Fighting dreamers shinjiru ga mama ni
Oli oli oli oh-! just go my way!

Right here right now (bang!)
Buppanase like a dangan liner!
Right here right now (burn!)

Oto wo tatezu shinobiyoru kage ga itsumo bokura wo madowaseru
Yuugenjikkou ooki na kaze ga uneri wo agete fukiareru

Kazashita surudoi katana de onore no asu kirihirake! (yeah!)
Hoshou nante doko ni mo nai sa naa sou daro!?

We are fighting dreamers takami wo mezashite
Fighting dreamers narifuri kamawazu
Fighting dreamers shinjiru ga mama ni
Oli oli oli oh-! just go my way!

Right here right now (bang!)
Buppanase like a dangan liner!
Right here right now (burn!)
Buttakitteku ze get the fire!
Right here right now (bang!)
Buppanase like a dangan liner!
Right here right now (burn!)
Buttakitteku ze get the fire!

We are fighting dreamers kono nakama-tachi to
Fighting dreamers subete wo makikomi
Fighting dreamers kokorozashi takaku
Oli oli oli oh-!

We are fighting dreamers takami wo mezashite
Fighting dreamers narifuri kamawazu
Fighting dreamers shinjiru ga mama ni
Oli oli oli oh-! just go my way!

(don't forget your first impulse ever)
(let's keep your adventurous ever)

Right here right now (bang!)
Buppanase like a dangan liner!
Right here right now (burn!)
Buttakitteku ze get the fire!
Right here right now (bang!)
Buppanase like a dangan liner!
Right here right now (burn!)
Buttakitteku ze get the fire!
",Go!!!,2004
