Band,Lyrics,Song,Year
Capone,"Oh! Millitainment Oh!
Millitainment Oh! Millitainment Come on
Millitainment Oh! Millitainment This one is the hot one!
Millitainment Aiyyo! Millitainment

Homeboy, I came to party (ohh!)
Yo' girl was lookin at me (ohh!)
She's a haggler naw I'm not taggin her (ohh!)
But you don't want them boys to come over and start askin ya (ohh!)
What you wanna do, nigga? (Nothin')
What you tryin to do, nigga? (Nothin')
What you wanna do, nigga? (Nothin')
What you tryin to do

Yo, yo, yo..
Yo N-O-R papi, say what?  That nigga's the man
With his manager Chris and the label that Jams
Still flossin, showin your rocks
Ain't you dudes heard ""Grimey"" man we stoled your watch
It goes indian style, knees bent in dashiki
Strapped with the veritek baby tec B.T.
True she at the bar lookin good in the brown dress
Four to six shots and them things ain't around yet
Persona all thugged out loud and clear
Sayin fuck the straight Henny, just grab me a beer
You see I'm reppin now, and my mami's I got a weapon now
Shoot at them clowns at they feet, they high steppin now
Left that wack label cause I don't like pricks
I'm like a hammer that you hold on your hand, I make hits
At the white boy club while I'm buyin the bar
They like, ""Hey now, you're an all star,"" it go

Homeboy, I came to party (ohh!)
Yo' girl was lookin at me (ohh!)
She's a haggler naw I'm not taggin her (ohh!)
But you don't want them boys to come over and start askin ya (ohh!)
What you wanna do, nigga? (Nothin')
What you tryin to do, nigga? (Nothin')
What you wanna do, nigga? (Nothin')
What you tryin to do

I spit mack millimeter rhymes, kill a liter in line
My nigga Peter got a heater of mines
Niggaz still lyin, in they wack ass bars
Only time they seen jail, when they watchin ""Oz""
I'm in the club pissy drunk like, ""Ahhhdadidaaaaa!!!!!!""
And mami took it proper like, ""Dadadidaaaaa!!!!!!""
Adios kill your soul, then we body your ghost
They call me gordo, I sip the champagne that's importo
Playin ""Capicu"" (Man you ain't nappy too!!!)
I like when chocha be nappy too
I treat life like a fast car, lower my speed
I try and chill, and sell more records than Creed
Been a hustler (What? What?) Way before ""Melvin Flynt""
A criminal, don't leave no prints
These dudes gave me a brick and they ain't seen me since
Caught up wit 'em, had them dudes straight hoppin the fence, it go

Homeboy, I came to party (ohh!)
Yo' girl was lookin at me (ohh!)
She's a haggler naw I'm not taggin her (ohh!)
But you don't want them boys to come over and start askin ya (ohh!)
What you wanna do, nigga? (Nothin')
What you tryin to do, nigga? (Nothin')
What you wanna do, nigga? (Nothin')
What you tryin to do

La la la la la la la la la (ohh!)
La la la la la la la la la (ohh!)
La la la la la la la la la (ohh!)
La la la la la la la la la (ohh!)
La la la la la la la la la (ohh!)
La la la la la la la la la (ohh!)
La la la la la la la la la (ohh!)
La la la la la la la la la (ohh!)

Yo, yo, yo..
Yo oops, I done done it again, I got another one
I keep it hid in my pocket I got another one
""Fast and Furious,"" dunn dunn dunn tudunn
Still be in, Miami and jet skiing
In the ocean where the sharks be at, just O.D.'n
Adebesi, want a brick you pay double easy
I got them things that'll move easy
And I told the lawyer, I sold blow to old Goya
I'm half spanish, you see I cook coke for Goya
I'm half spanish, all day arroz con polla
Recognize, when I'm runnin the game, before me
Chickens wasn't even messin with brain, because me
Now you started gettin head on the westside highway
So recognize my nigga you did it my way
Ice rockin, brick choppin and gun shoppin
I did it all beat cases without Cochran

Homeboy, I came to party (ohh!)
Yo' girl was lookin at me (ohh!)
She's a haggler naw I'm not taggin her (ohh!)
But you don't want them boys to come over and start askin ya (ohh!)
What you wanna do, nigga? (Nothin')
What you tryin to do, nigga? (Nothin')
What you wanna do, nigga? (Nothin')
What you tryin to do

La la la la la la la la la (ohh!)
La la la la la la la la la (ohh!)
La la la la la la la la la (ohh!)
La la la la la la la la la (ohh!)
La la la la la la la la la (ohh!)
La la la la la la la la la (ohh!)
La la la la la la la la la (ohh!)
La la la la la la la la la (ohh!)
",Nothin' [Remix],2002
Capone,"If you looked in my life
And see what I've seen...
If you looked in my life
And see what I've seen...
If you looked in my life
And see what I've seen...
If you looked in my life
And see what I've seen...

Life can be only what you make it
When you're feelin down
You should never fake it
Say what's on your mind
And you'll find in time
That all the negative energy
It would all cease

And you'll be at peace with yourself
You won't really need no one else
Except for the man up above
Because He'll give you love

If you looked in my life
And see what I've seen...
If you looked in my life
And see what I've seen...
If you looked in my life
And see what I've seen...
If you looked in my life
And see what I've seen...

Take your time
Baby don't you rush a thing
Don't you know, I know
We all are struggling
I know it is hard
But we will get by
And if you don't believe in me
Just believe in ""He""

Cause He'll give you peace of mind
Yes He will
And you'll see the sunshine
For real, yes you would
And you'll get to free your mind
And things will turn out fine
Oh, I know that things will turn out fine
Yes they would, yes they would

If you looked in my life
And see what I've seen...
If you looked in my life
And see what I've seen...
If you looked in my life
And see what I've seen...
If you looked in my life
And see what I've seen...

All you gotta do is take your time,
One day at a time
It's all on you
what you gonna do?

Oh you will see I'm so down and out
Cryin' every day
Don't know what to do or to say",My Life [Remix],2002
Capone,"[Capone:] You gone too far now nigga!

[Wayne Wonder:]
They gone too far now Nore, they gone too far now Capone ([Lexxus:] Wicked!)
They gone too far now Wayne, they gone too far now Lexx
CNN (CNN) ([N.O.R.E:] What!)
([Capone:] Yeah!)
Lexxus (Lexxus) Wayne Wonder (Wayne Wonder)
([N.O.R.E.:] Wayne Wonder what's up?!)
For the gangsters, for the gangsters

[Verse 1: Wayne Wonder]
Anything goes when we ride (When we ride)
Even with my little shorty by my side
Gallang so nuh bag a noise (Nuh bag a noise)
Burn up I'll pop and hit them by surprise
You better not move, when I say freeze
Because we nuh fraid fi pop off and squeeze
Bout you a bawl, and beg man fi ease
And we nuh bomb pon a fool like bees

[Chorus: Wayne Wonder]
So you want to take my life ([Lexxus:] Come on!) so you want to hurt my wife
You just a wolf in disguise right a now you never seem surprised
([N.O.R.E.:] CNN we listenin!!!)
So you want to take my life ([Lexxus:] Come on!) so you want to hurt my wife
You just a wolf in disguise right a now you never seem surprised

[Verse 2: CNN (Capone N N.O.R.E.) & Lexxus]
[N:] So fuck you sound boy
[C:] Kill a snitch boy
[N:] Kill a batty boy
[C:] In the yard
[N:] Got to play it hard like we Gotti boy
[L:] CNN soldiers
[C:] We rep till it's over
[N:] We rep when we drunk
[C:] And we rep when we sober
[N:] (Oh!) Look at that fatty at ten
[C:] (Oh!) Lick a shot we back at it again
[N:] It's Millitainment move over gotta move on my own
[C:] We murder them a mercenary made man Capone (Wayne Wonder)

[Chorus: Wayne Wonder]
So you want to take my life ([Lexxus:] Come on!) so you want to hurt my wife
You just a wolf in disguise right a now you never seem surprised
([N.O.R.E.:] CNN we listenin!!!)
So you want to take my life ([Lexxus:] Come on!) so you want to hurt my wife
You just a wolf in disguise right a now you never seem surprised

[Verse 3: Lexxus]
Yuh waan fi bet mi money yuh fret and sweat like yuh a preacher
Any choice yuh set it's like a jet yuh haffi leave yah
Inna di party di bwoy dem start it like dem a creature
Mi and shorty rollin hotty wah dis we achieve yah
Mi haffi pop and buss it inna dem direction
Bwoy nah stop down like pop down erection
Car a crash, brain a splash, inna di intersection
Caught dem by surprise they never know mi have extension
So tell dem

[Chorus: Wayne Wonder]
So you want to take my life ([Lexxus:] Come on!) so you want to hurt my wife
You just a wolf in disguise right a now you never seem surprised
([N.O.R.E.:] CNN we listenin!!!)
So you want to take my life ([Lexxus:] Come on!) so you want to hurt my wife
You just a wolf in disguise right a now you never seem surprised

[Verse 4: CNN (Capone N N.O.R.E.)]
[C:] I need a hot girl
[N:] So I could drive in my hot car
[C:] I'm not a pop star
[N:] Take you to the Shark Bar
[C:] So we could feast love amd just skip in
[N:] You see a nigga made a dollar out of just five cent
[C:] Now we ride through Tivoli
[N:] Slide through Kennedy
[C:] Usually we right in the club
[N:] That's where the women be
[C:] Laid back lightin some bud
[N:] Sippin on Hennesy
[C:] Everybody drink show love
[N:] That's where my nigga be, OH!

[Chorus: Wayne Wonder]
So you want to take my life ([Lexxus:] Come on!) so you want to hurt my wife
You just a wolf in disguise right a now you never seem surprised
([N.O.R.E.:] CNN we listenin!!!)
So you want to take my life ([Lexxus:] Come on!) so you want to hurt my wife
You just a wolf in disguise right a now you never seem surprised

[Verse 5: Lexxus]
It's been a long time comin, hear we are
Mr. Lex and Wayne Wonder who? superstar
CNN dem got we back, yo we and dem par
We nah leff it cause we ever have it inna we car
So wah bring it, sling it if you think you have this ting
But if not mek mi do my ting
Cause Lex got di whole world clingin to di style dat I bring
Nore and Capone rap and Wayne sing
Cha ching cha ching!!!!

[Chorus: Wayne Wonder]
So you want to take my life ([Lexxus:] Come on!) so you want to hurt my wife
You just a wolf in disguise right a now you never seem surprised
([N.O.R.E.:] CNN we listenin!!!)
So you want to take my life ([Lexxus:] Come on!) so you want to hurt my wife
You just a wolf in disguise right a now you never seem surprised",Anything Goes,2003
Capone,"We got that green stuff, Big Tite
Lil Flip the Leprechaun, Slim Thug the Boss Hogg
Fin to put it all in why'all face

I got too much money, too much cash
I bought a new Lac and put it on chrome, without touching my stash
Like Lil Flip I can do that, Excursion candy blue tha?
Twenty two that, pounds of dro I done blew that
You should of knew that, the Slim Thug gon' shine
My ear rings cost a dime, I read Rolex Times
I'm top of the line, you can tell when I open my mouth
I bet nobody got mo' princess cut teeth, than the Boss
Open your mouth up you lost, I'm blinding these boys
I'm joining rocks in your blocks, in candy blue toys
Talking noise, 'cause I ain't old enough to drank
But I got mo' cash to last, than your daddy in the bank
I'm top rank, Slim Thug gon' talk the talk
Walk the walk, we can bet ball for ball
We some paid young G's, with too much cash
Too much flow and do', talking too much trash ha

[Chorus: Repeat 2X]
Too much money, too much cash
All why'all haters, can kiss our ass
We got too much money, too much cash
All why'all haters, can kiss our ass

Too much money is what I got, like Scarface I rap a lot
S-Type Jag straight off the lot, believe me dog I'm really hot
I'm swanging four's and thinking thoed, banging hoes and changing clothes
Smoking dro and doing shows, paper stack can never fold
I bought the car and I bought the house, I represent the Dirty South
Got more syrup than Waffle House, run through hoes like Marshall Faulk
I talk the talk and walk the walk, 'cause nigga I'm a G
Lil Flip is who I be, I know your gal know me
'Cause I wear a Roley, that look like a snowman
And I push a Jag, you just gotta see it man
I'm sitting on Dubs, kinda like a blank tape
You see them rocks in my teeth, ain't none of em fake
Give me a break, you think I'm lying or something
I'm at the mall with your hoe, and she buying me something
I'm a young pimp, with a whole lot of cash
And why'all haters, why'all can kiss our ass

[Chorus: Repeat 2X]

I got too much M-O-N-E-why
Anything I S-E-E, I be	-you-why
Pull a Bentley off the lot, and ran that thang in the wall
We throw Crys in the air laugh, and watch it fall
Watch me ball, as the Dub spin like a top
I got crunk when I stopped, and made my pop trunk wop
Girls bop, automatic cause I'm top of the line
I cut my beep past six, and I raise the top of your spine
I'ma shine, Sucka Free, Boss Hogg in a row
You can catch me fresh and braided, or rugged and fro
You see the Spre's on the car, I bet you my people like the rock
When girls see Tite, Flip and Slim they say... pulling cameras out
Damn I'm hot, when I hit the club I'm bound to line to the bar
And for the first hundred people, I'm insuring they car
Attracting your star, cause nigga my piece attracting your car
We got too much green, and that's real by far

[Chorus: Repeat 2X]",Freestyle,2003
Capone,"I just had to say that right there, Rae
I just have to say you my nigga, understand?
It don't get no realer than this, man
Let's slow the fuck down
You gettin' like a hundred worth for real, man

Eh yo, thug niggas know the code, lock and load
Hit 'em in the head, watch a nigga brain explode
Yo, from Y.O. to Q.B., they bang this shit
Shaolin' boys, they bang them fifths

Thug niggas know the code, lock and load
Hit 'em in the head, watch a nigga brain explode
Yo from Y.O. to Q.B., they bang this shit
Shaolin' boys, they bang them fifths

Eh yo, late night, candle light, fiend with a crack pipe
It's only right, feelin' higher than an airplane, right?
I'm tryin' to get this money, right? So I move cautiously
No more frauds, you see? I'ma live bossy

Way out on Fantasy Island with Mr. Roth. be
I gotta play the ghetto, everyday the hood endorse me
I'm destined for triple, left hand crippled and the right hand fury
Will block the shots, that's simple, I dented a tomb for style
A toast to the death of my foes, respect violence, the criminal codes

Hammer smack a nigga out his five senses
Leave him dumb, deaf and blind, I ride on rinses
Interest so tight, strobe lights follow my grace
Bang bullets by the gates, might hollow ya face
Me and Chef smark massive murder, kill 'em
I scramble anywhere in Shaolin, right in Castalano buildin'

Eh yo, real niggas get up, live niggas, what up?
We don't give a fiduck, you faggots'll get hit up
Q.B., what up? Y.O., what up?
Shaolin, get up or get yo' ass hit up

Real niggas get up, live niggas, what up?
We don't give a fiduck, you faggots'll get hit up
Q.B., what up? Y.O., what up?
Shaolin, get up or get yo' ass hit up

Eh yo, I'm a motherfuckin' nigga wit an attitude
Heavy gun play, cock back, niggas is screwed
Stomach wounds make it hard for you to swallow ya food
Throw them Purple Tape off for me to get in the mood

Sheek Louch, who fuckin' wit' that kid?
I'm sick in the head, they need to make a throwback straight jacket
White tee on, a light G. on
These bitches you wife and the God try pee on

I don't care if it's a gram or brick
I'ma make it sell, get off my dick
Pump or the Desert E., take your pick
Money too long, the case won't stick

D-Block niggas fuck with Rae
Nigga act hard and get hit up in the middle of day
Tough guys and all that but I know that you pay
And I don't give a fuck, niggas, better watch what they say

Eh yo, real niggas, get up, live niggas, what up?
We don't give a fiduck, you faggots'll get hit up
Q.B., what up? Y.O., what up?
Shaolin, get up or get yo' ass hit up

Real niggas get up, live niggas, what up?
We don't give a fiduck, you faggots'll get hit up
Q.B., what up? Y.O., what up?
Shaolin, get up or get yo' ass hit up

Body specialist, full cam F50 with vans
A pull up, do it to ya mans, yo scrams
If you take niggas ears, niggas ain't really queers
Listen, it's grown men in the town, niggas is their's

Fluck niggas, I cut niggas, stuck niggas
Come up, pluck niggas, pop niggas in chucks, it's business
You in this? We non shoulder style, son, relentless
They four lettered me Chef, nigga get down

Drop you, piss on you, get this, it's official on you
Yo, twist the clips hits, yo, this was on you
I'm just a business head ridin' with visual
Don't force me to put out ya head

One for the money, two for the crime round up
Peep it, all major niggas holdin' they ground, get up
Let's form an army millennia, Ice Water
From Q.B. to Y.O. with Shaolin, I'm feelin' you

Eh yo, real niggas, get up, live niggas, what up?
We don't give a fiduck, you faggots'll get hit up
Q.B., what up? Y.O., what up?
Shaolin, get up or get yo' ass hit up

Real niggas, get up, live niggas, what up?
We don't give a fiduck, you faggots'll get hit up
Q.B., what up? Y.O., what up?
Shaolin, get up or get yo' ass hit up

We gon' ride for our team
(Yeah, ride for my motherfuckin' team, nigga)
My niggas'll kill you
(My niggas kill you, nigga)

We gon' ride for our team
(Y'all niggas want war? Nigga pop up)
My niggas'll kill you
(Yeah, ride for ya motherfuckin' team, nigga)
(Death before dishonor, you heard me?)

We gon' ride for our team
(The motherfuckin' Lex Diamond Story)
(Y'all niggas better wake the fuck up)
My niggas'll kill you
(Yeah, Ice Water Inc., you heard me?)
D-Block, what up?

We gon' ride for our team
(Pain, time and glory, word, you heard?)
My niggas'll kill you
(Yeah, yeah, my niggas'll kill you, nigga)
(Bitch ass niggas)",Planet of the Apes,2003
Capone,"Bounce wit me, bounce, bounce, bounce
Bounce wit me, bounce, bounce, bounce
Yeah Yeah 
Yeah Yeah 
Oh Oh No No 
Oh Oh No No 
WHAT WHAT WHAT 
WHAT WHAT WHAT

I bust to the scening cuss to the scening 
I admit a little bit I lust for the crideam
Everytime you see me see me biggin up my teaming
on the dream of winning trying to make crideam
Thugged out even when you catch me in the cuisine
my clan mad dirty yall too cliddean (clean)
Hennessey and Smirnoff make a nigga middean (mean)
I need two more like I was a fiddean (fiend)
Drinks galore everytime I'm in the citting (city)
0 to 60 didn't want a sixteening
You see it in my coats or you see it in my jizzeans (jeans)
you can't tell you should know the way I lizzean (lean)
Water so clear I think I'm in Carribbing (Carribbean)
everybody gone like we straight clipping
you better watch out when we start flipping
seen you fuckin and you know we're not slipping

Ohh Oh No No WHAT WHAT WHAT
Ohh Oh No NO WHAT WHAT WHAT
Ohh Oh No No WHAT WHAT WHAT
Ohh Oh No NO WHAT WHAT WHAT

Ayo verse 2 coming with my Heineken brew
N O R putting people back in I C U
You ain't even thiddink that I need a driddink
hit you up quick before you could even bliddink
Give you a splitting cut you up with the shiddank
tell your accountant to go and just check the biddank
I damn near broke you and I ain't even thiddink
I gotta churrda lurrda girls like Shabba Riddanks
Guaranteed to be there just like Fed Ex
We write our own rhymes kid you can check the credits
me and Nature stay fuckin with grimlettes
yo the hood baddest the bitches pussy is the fattest
Smack Smack Smack Smack peep Gladys
if you don't know yo then I don't know
I'm gonna get me some head right after the show
you can meet me at the room shit 664

Oh Oh No No WHAT WHAT WHAT
Oh Oh No No WHAT WHAT WHAT

I told yall flippers all of yall quitters 
don't be contemplating my figgas
Cuz I hang with go getters straight flow spitters
crys and mo sippers carry yo niggas

I told yall flippers all of yall quitters 
don't be contemplating my figgas
Cuz I hang with go getters straight flow spitters
crys and mo sippers carry yo niggas

It's all goodnud do my songs for the hoodnud
platinum nigga while yall thangs go woodnud
Yo you try to dis me ya man told you that you shouldnud
I blew over you and I told you that I couldnud
Me and Drag pack it Neptunes on the wheels
he sneakin in at tables and he's sneakin in feels
People walkin in my section that I don't even know
I'm like get lost yo you stay ya ass home
You a frizzeak always see you in the strizzeet
walkin walkin til you get widdeak
You on the E train 7 train plus the bus
I don't even like you cuz you can't be trust
You need to get up out my face ain't nuttin to discuss
you don't like me then cool yo I don't care
but if you get up in my face yo I don't care
it's a dirty game and both of us ain't playin it fair

Oh Oh No No WHAT WHAT WHAT
Oh Oh No No WHAT WHAT WHAT
Oh Oh No No WHAT WHAT WHAT
Oh Oh No No WHAT WHAT WHAT

I told yall flippers all of yall quitters 
don't be contemplating my figgas
Cuz I hang with go getters straight flow spitters
crys and mo sippers carry yo niggas

I told yall flippers all of yall quitters 
don't be contemplating my figgas
Cuz I hang with go getters straight flow spitters
crys and mo sippers carry yo niggas
",Oh No [Remix Dirty][*],2004
Capone,"[Lil' Wayne]
They call me the youngest headbuster walkin'
Thugged out in all black, calicole sparklin'
A guerilla till I die bless me when I'm dead
But for the bread I bring ya anybody head
That's how I play it I don't hold back
I tote gats be on the spot were ya sold crack
Nigga feel played then ya fuckin get blown back
I burn 'em twice with a black rusty old mac
Now BLOCKA nigga get off me

[Juvenile]
Get some off that cocky weed and roll that bitch up
Won't play with me like I'ma choke that bitch up
Keep it on the turf I might be killin' to get mine
New prints on the back I make a million in big time
I'll always be a thug until I'm crippled and crazy
I'ma always stay close with Suga Slim, Wayne and Baby
Runnin' with a team off cut-throats and backshots
All day bullshittin neglagince and homicides

[Noreaga]
Cash Money niggas they don't play that shit
Thugged Out niggas we don't play that shit

[Noreaga]
Thugged Out, Cash Money ha
B.G Juvenile ain't funny ha
We try to, get that paper like Bugs Bunny ha
Yo we in the projects with my little honey ha
Yo what up Kiko it gets real check it
We got's this chicks to slauve that right out of Kansas
Heyyo these countless bitches
We used to fuck 'em on campus
You my roley ha ha
I'm your roley ha ha
Fuck with us we leave you nigga fuckin' holy ha
Semi-Latin cruise down to Baton Rouge
Then I got a Hummer that's sittin on 32's
But for the hood we got the eastcoast locked
Magnolia and Iraq now that's my spots
Come anywhere near there and still be shot
Prat Niggas shot Niggas shot Niggas shot Niggas
Shot shot

[Chorus]
From N-why to N-O Thugged Out and Cash Money
I'm a thug be	 how you gonna stop hungry
We eatin' pop bubbley in beef we pop dummies
Run up in hood honey's it's all good sonney
Throw your sets up nigga
Throw your side up nigga
Ride or die young nigga
Get high young nigga
Stay fly young nigga
Do what you gotta survive young nigga

[Maze]
Live we fly down in New Orleans
Get it purpulatin
You smell me keep that fire green circulating
Thugged Out with Cash Money
Thugs we stash your arms
Weeds get blazed from your face till feet
With us all we stay deep got beef we're surroundin
My Niggas cock back Macs from here to some 'the houses
Get rocked or get it on if you bout it
Cause boy you're in the zone
You take routes quick like Roy Jones

[Chorus]

Play that shit, play that shit, play that shit",Play That Shit [Video Dirty][*],2004
