Band,Lyrics,Song,Year
Oscar Peterson,"I took one look at you
That's all I meant to do
And then my heart stood still

My feet could step and walk
My lips could move and talk
And yet my heart stood still

Though not a single word was spoken
I could tell you knew
That unfelt clasp of hands
Told me so well you knew
I never lived at all
Until the thrill of that moment
When my heart stood still

I took one look at you
That's all I meant to do
And then my heart stopped right there

My feet could step and walk
My lips could move and talk
And yet my heart stood still

Though not a single word was spoken
I could tell you knew
That unfelt claps of hands
Told me so well you knew
I never lived at all
Until the thrill of that moment
When my heart stood still",My Heart Stood Still,1963
Oscar Peterson,"The very thought of you makes my heart sing
Like an April breeze on the wings of spring,
And you appear in all your splendor,
My one and only love.

The shadows fall and spread their mystic charms
In the hush of night while you're in my arms.
I feel your lips, so warm and tender,
My one and only love.

The touch of your hand is like heaven,
A heaven that I've never known.
The blush on your cheek whenever I speak
Tells me that you are my own.

You fill my eager heart with such desire.
Ev'ry kiss you give sets my soul on fire.
I give myself in sweet surrender,
My one and only love.",My One and Only Love,1964
Oscar Peterson,"I don't know why, I made you cry
I'm sorry sweetheart and yet
Though you shouldn't be lenient with me
I hope you'll forgive and forget
 
What can I say, dear, after I say I'm sorry?
What can I do to prove it to you, I'm sorry?
I didn't mean to ever be mean to you
If I didn't care I wouldn't feel like I do
I was all wrong but right or wrong I don't blame you
Why should I take somebody like you and shame you
I know that I made you cry, and I'm so sorry dear
So what can I say, dear, after I say I'm sorry?
 
You made me glad, I made you sad
I made you lonesome and blue
And who ever knew 
Who'd ever think that I would be crying to you
 
What can I say, dear, after I say I'm sorry?
What can I do to prove it to you, I'm sorry?
I didn't mean to ever be mean to you
If I didn't care I wouldn't feel like I do
I was all wrong but right or wrong I don't blame you
Why should I take somebody like you and shame you
I know that I made you cry, and I'm so sorry dear
So what can I say, dear, after I say I'm sorry?
",(What Can I Say) After I Say I'm Sorry?,1965
Oscar Peterson,"Wa-oo-oo, wa-oo-oo, 
Wa-oo wa-oo wa-oo wa-ay
Wa-oo-oo, wa-oo-oo, 
Wa-oo wa-oo wa-oo wa-ay

Sittin' by de ocean 
Me heart, she feel so sad, 
Sittin' by de ocean, 
Me heart, she feel so sad... 
Don't got de money 
To take me back to Trinidad. 

Fine calypso woman, 
She cook me shrimp and rice, 
Fine calypso woman, 
She cook me shrimp and rice
Dese yankee hot dogs 
Don't treat me stomach very nice.

In Trinidad, one dollar buy 
Papaya juice, banana pie, 
Six coconut, one female goat, 
An' plenty fish to fill de boat. 
One bushel bread, one barrel wine, 
An' all de town, she come to dine. 

But here is bad, one dollar buy 
Cup of coffee, ham on rye. 
Me throat she sick from necktie, 
Me feet hurt from shoes. 
Me pocket full of empty, 
I got Calypso blues.

Dese yankee girl give me big scare, 
Is black de root, is blonde de hair. 
Her eyelash false, her face is paint, 
And pads are where de girl she ain't

She jitterbug when she should waltz, 
I even think her name is false. 
But calypso girl is good a lot, 
Is what you see, is what she got. 

Sittin' by de ocean 
Me heart, she feel so sad, 
Sittin' by de ocean, 
Me heart, she feel so sad
Don't got de money 
To take me back to Trinidad. 

Wa-oo-oo, wa-oo-oo, 
Wa-oo wa-oo wa-oo wa-ay
Wa-oo-oo, wa-oo-oo, 
Wa-oo wa-oo wa-oo wa-ay",Calypso Blues,1965
Oscar Peterson,"Love makes me treat you

The way that I do
Gee baby, ain't I good to you

There's nothing in this whole world too good
For a boy so sweet and true
Gee, baby ain't I good to you

Bought you a fur coat for Christmas
Diamond ring
Big Cadillac car and everything
What makes me treat you
The way that I do
Gee baby, ain't I good to you","Gee Baby, Ain't I Good to You",1965
Oscar Peterson,"A day in the life of a fool
A sad and a long, lonely day
I walk the avenue hoping I'll run into
The lovely sight of you coming my way

I stop right across from your door
But you don't see me anymore
So back to my room I go with a gloom
And I cry tears of goodbye

A day in the life of a fool
A sad and a long, lonely day
I walk the avenue hoping that I'll run into
The lovely sight of you coming my way

And I stop just across from your door
But you don't see me anymore
So back to my room I go with a gloom
And I cry tears of goodbye

Tears of goodbye",Samba de Orfeu,1966
Oscar Peterson,"Whenever skies look gray to me
And trouble begins to brew,
Whenever the Winter winds become too strong,
I concentrate on you.

When fortune cries ""Nay! Nay!"" to me
And people declare ""You're through!"",
Whenever the blues become my only song,
I concentrate on you.

On your smile so sweet, so tender,
When at first your kiss I decline.
On the light in your eyes when I surrender,
And once again our arms intertwine

And so, when wise men say to me
That love's young dream never comes true,
To prove that even wise men can be wrong,
I concentrate on you.",I Concentrate On You/Moon River [Medley],1968
Oscar Peterson,"No one here can love or understand me
Oh, what hard luck stories they all hand me
Pack up all my cares and woe, here I go, winging low
Bye, bye, blackbird

Where somebody waits for me
Sugar's sweet, so is she
Bye, bye, blackbird

No one here can love or understand me
Oh, what hard luck stories they all hand me
Make my bed and light the light, I'll arrive late tonight
Blackbird, bye, bye

Bye, bye, blackbird
Where somebody waits for me
Sugar's sweet, so is she
Bye, bye, blackbird

No one here can love or understand me
Oh what hard luck stories they all hand me
Make my bed and light the light, I'll arrive late tonight
Blackbird, bye, bye",Bye Bye Blackbird,1968
Oscar Peterson,"Where's that careless chambermaid?
Where'd she put my razor blade?
She mislaid it, I'm afraid,
It's gotta be foun'!
Ask her when she cleaned my room
What she did with my perfume;
I just can't lose it,
I've gotta use it,
'Cause Lulu's back in town.

Gotta get my old tuxedo pressed,
Gotta sew a button on my vest,
'Cause tonight I've gotta look my best,
Lulu's back in town.
Gotta get a half a buck somewhere,
Gotta shine my shoes and slick my hair,
Gotta get myself a boutonniere,
Lulu's back in town.
You can tell all my pets,
All my Harlem coquettes;
Mister Otis regrets
That he won't be aroun'.
You can tell the mailman not to call,
I ain't comin' home until the fall,
And I might not get back home at all,
Lulu's back in town.

You can bet I've got it bad,
Best complaint I've ever had;
We'll be stepping out tonight,
An' struttin', an' how.
We're in for the swellest time,
Finish up without a dime;
Look here, you fellers,
I'll make you jealous,
My Lulu, she's a wow.

Gotta get my old tuxedo pressed,
Gotta sew a button on my vest,
'Cause tonight I've gotta look my best,
Lulu's back in town.
Gotta get a half a buck somewhere,
Gotta shine my shoes and slick my hair,
Gotta get myself a boutonniere,
Lulu's back in town.
You can tell all my pets,
All my blondes and brunettes;
Mister Otis regrets
That he won't be aroun'.
You can tell the mailman not to call,
I ain't comin' home until the fall,
And I might not get back home at all,
Lulu's back in town.",Lulu's Back in Town,1968
Oscar Peterson,"Perdido,
I look for my heart
It`s perdido
I lost it way down in Torito
The day the fiesta started

Bolero,
I sway that they play the Bolero
I kissed me the listing sombrero
And that`s when my heart departed

High, was the sun when I held him close
Low, was the moon when we said, ""Adios""

Perdido
My heart ever since is Perdido
I know I must go to Torito
To find what I lost Perdido

High, was the sun when I held him close
Low, was the moon when we said, ""Adios""

Perdido
Goodnight perdido
I lost perdido",Perdido,1968
Oscar Peterson,"You must take the ""A"" train
To go to Sugar Hill way up in Harlem
If you miss the ""A"" train
You`ll find you missed the quickest way to Harlem
Hurry, get on, now it`s coming
Listen to those rails a-thrumming
All aboard, get on the ""A"" train
Soon you will be on Sugar Hill in Harlem","Take the ""A"" Train",1968
Oscar Peterson,"You see this girl, this girl's in love with you
Yes, I'm in love, who looks at you the way I do?
When you smile I can tell we know each other very well
How can I show you that I'm glad I got to know you?

Cause I've heard some talk, they say you think I'm fine
This girl's in love and what I'd do to make you mine?
Tell me now is it so? Don't let me be the last to know
My hands are shaking, don't let my heart keep breaking

Cause I need your love, I want your love
Say you're in love and you'll be my guy
If not I'll just die

Tell me now is it so? Don't let me be the last to know
My hands are shaking, don't let my heart keep breaking

Cause I need your love, I want your love
Say you're in love and you'll be my guy
If not I'll just die",This Guy's in Love with You,1969
Oscar Peterson,"I'm in the mood for love
Simply because you're near me.
Funny, but when you're near me
I'm in the mood for love.

Heaven is in your eyes
Bright as the stars we're under
Oh! Is it any wonder
I'm in the mood for love?

Why stop to think of whether
This little dream might fade?
We've put our hearts together
Now we are one, I'm not afraid!

If there's a cloud above
If it should rain we'll let it
But for tonight, forget it!
I'm in the mood for love",I'm in the Mood for Love,1969
Oscar Peterson,"You've heard all about your raggy melody
Everything from opera down to harmony
But I've a little song that I will sing to you
It's gonna win you through and through
There ain't much to the words but the music is grand
And you'll be a-singing it to beat the band
You've heard of the tisket and tasket it's true
But give a little listen to this will you?
 
Ja-Da, Ja-Da, Ja-Da, Ja-Da
Jing, Jing, Jing
Ja-Da, Ja-Da, Ja-Da, Ja-Da
Jing, Jing, Jing
That's a funny little bit of melody
It's so soothing and appealing to me
It goes Ja-Da, Ja-Da, Ja-Da, Ja-Da
Jing, Jing, Jing
 
Our bands have been digging back for tunes to be sung
Operas and nursery rhymes have been overdone
I dug a little deeper and I found this thing
It's ragtime but it still can swing
It ain't a turkeytrot or a shimmey onestep
But when grandma danced to it
She thought she was hep
It still is a ditty 
I'm sure you will find
Will keep a runnin' 'round and around your mind
 
Ja-Da, Ja-Da, Ja-Da, Ja-Da
Jing, Jing, Jing
Ja-Da, Ja-Da, Ja-Da, Ja-Da
Jing, Jing, Jing
That's a funny little bit of melody
It's so soothing and appealing to me
It goes Ja-Da, Ja-Da, Ja-Da, Ja-Da
Jing, Jing, Jing",Ja-Da,1970
Oscar Peterson,"I don't believe in frettin' and grievin',
Why mess around with strife?
I never was cut out to step and strut out.
Give me the simple life.

Some find it pleasant dining on pheasant.
Those things roll off my knife,
Just serve me tomatoes, and mashed potatoes,
Give me the simple life.

A cottage small is all I'm after,
Not one that's spacious and wide.
A house that rings with joy and laughter
And the ones you love inside.

Some like the high road, I like the low road,
Free from the care and strife.
Sounds corny and seedy, but yes, indeed-y,
Give me the simple life.",Give Me the Simple Life,1970
Oscar Peterson,"Once I was young
Yesterday, perhaps
Danced with Jim and Paul
And kissed some other chaps

Once I was young
But never was naive
I thought I had a trick or two
Up my imaginary sleeve
And now I know I was naive

I didn't know what time it was
Then I met you
Oh, what a lovely time it was
How sublime it was too

I didn't know what day it was
You held my hand
Warm like the month of May it was
And I'll say it was grand

Grand to be alive, to be young
To be mad, to be yours alone
Grand to see your face, feel your touch
Hear your voice say, ""I'm all your own""

I didn't know what year it was
Life was no prize
I wanted love and here it was
Shining out of your eyes
I'm wise and I know what time it is now

Grand to be alive, to be young
To be mad, to be yours alone
Grand to see your face, feel your touch
Hear your voice say, ""I'm all your own""

I didn't know what year it was
Life was no prize
I wanted love and here it was
Shining out of your eyes
I'm wise and I know what time it is now",I Didn't Know What Time It Was,1970
Oscar Peterson,"I am not such a clever one
About the latest fads
I admit I was never one
Adored by local lads
Not that I ever try to be a saint
I'm the type that they classify as quaint
I'm old fashioned
I love the moonlight
I love the old fashioned things
The sound of rain
Upon a window pane
The starry song that April sings
This year's fancies
Are passing fancies
But sighing sighs holding hands
These my heart understands
I know I'm old fashioned
But I don't mind it
That's how I want to be
As long as you agree
To stay old fashioned with me

I'm old fashioned
But I don't mind it
That's how I want to be
As long as you agree
To stay old fashioned with me
Oh won't you stay old fashioned with me
Oh please stay old fashioned with me",I'm Old Fashioned,1970
Oscar Peterson,"Round like a circle in a spiral, like a wheel within a wheel
Never ending or beginning on an ever spinning reel
Like a snowball down a mountain, or a carnival balloon
Like a carousel that's turning running rings around the moon
Like a clock whose hands are sweeping past the minutes of its face
And the world is like an apple whirling silently in space
Like the circles that you find in the windmills of your mind!
 
Like a tunnel that you follow to a tunnel of its own
Down a hollow to a cavern where the sun has never shone
Like a door that keeps revolving in a half forgotten dream
Or the ripples from a pebble someone tosses in a stream
Like a clock whose hands are sweeping past the minutes of its face
And the world is like an apple whirling silently in space
Like the circles that you find in the windmills of your mind!
 
Keys that jingle in your pocket, words that jangle in your head
Why did summer go so quickly, was it something that you said?
Lovers walking along a shore and leave their footprints in the sand
Is the sound of distant drumming just the fingers of your hand?
Pictures hanging in a hallway and the fragment of a song
Half remembered names and faces, but to whom do they belong?
When you knew that it was over you were suddenly aware
That the autumn leaves were turning to the color of her hair!
Like a circle in a spiral, like a wheel within a wheel
Never ending or beginning on an ever spinning reel
As the images unwind, like the circles that you find 
In the windmills of your mind!",Windmills of Your Mind,1970
Oscar Peterson,"When you're in love
Some things you take for granted
Until someone pulls it apart
And leaves you with half of your heart
How do I trade 
The best I had for less
Without giving up
Should I slowly accept that we'll be no more than just friends

How do I know
When to let go
I know what I'm feeling inside
But part of me still wants to try

So tell me
Where do we go from here
Why's my heart filled with so much fear
When all that you are
Is all I need and more

There's no winning bets
The battle's just begun
I know it's over
But I still feel the same
You'll always remain number one

'Cause letting go
More and so much
I know what I'm feeling inside
But part of me still wants to try

So tell me
Where do we go from here
Why's my heart filled with so much fear
When all that you are
Is all I need and more

So tell me
Where do we go from here
Why's my heart filled with so much fear
When all that you are
Is all I need and more

Letting go
More and so much
I know what I'm feeling inside
But part of me still wants to try

So tell me
Where do we go from here
Why's my heart filled with so much fear
When all that you are
Is all I need and more

So tell me
Where do we go from here
Why's my heart filled with so much fear
When all that you are
Is all I need and more

So tell me
Where do we go from here
Why's my heart filled with so much fear
When all that you are
Is all I need and more

So tell me
Where do we go from here
Why's my heart filled with so much fear
When all that you are
Is all I need and more",Where Do I Go from Here?,1971
Oscar Peterson,"I hear music, mighty fine music
The murmur of a morning breeze up there
The rattle of the milkman on the stair

Sure that's music, mighty fine music
The singing of a sparrow in the sky
The perking of the coffee right nearby

That's my favorite melody
You, my angel, phoning me

I hear music, mighty fine music
And anytime I think my world is wrong
I get me out of bed and sing this song

That's my favorite melody
You, my angel, phoning me

I hear music, mighty fine music
And anytime I think my world is wrong
I get me out of bed and sing this crazy song",I Hear Music,1971
Oscar Peterson,"I want to see your face in every kind of light
In fields of dawn and forests of the night
And when you stand before the candles on a cake
Oh, let me be the one to hear the silent wish you make

What are you doing the rest of your life?
North and South and East and West of your life
I have only one request of your life
That you spend it all with me

All the seasons and the times of your days
All the nickels and the dimes of your days
Let the reasons and the rhymes of your days
All begin and end with me

I want to see your face in every kind of light
In the fields of dawn and the forests of the night
And when you stand before the candles on a cake
Oh, let me be the one to hear the silent wish you make

Those tomorrows waiting deep in your eyes
In the world of love that you keep in your eyes
I'll awaken what's asleep in your eyes
It may take a kiss or two

Through all of my life
Summer, Winter, Spring, and Fall of my life
All I ever will recall of my life
Is all of my life with you
",What Are You Doing the Rest of Your Life?,1971
Oscar Peterson,"Somewhere waiting for me
There is someone I'm longing to see
Someone I simply can't help but adore
Someone who'll thrill me forever
Some day my prince will come
Some day I'll find my love
And how thrilling that moment will be
When the prince of my dreams comes to me
He'll whisper, I love you,
And steal a kiss or two
Though he's far away,
I'll find my love some day
Some day when my dreams come true
Some day I'll find my love
Someone to call my own
And I'll know her the moment we meet
For my heart will start skipping a beat
Some day we'll say and do
Things we've been longing to
Though she's far away
I'll find my love some day
Some day when my dreams come true",Someday My Prince Will Come,1971
Oscar Peterson,"Someday we'll build a home on a hilltop high 
You and I, shiny and new 
Cottage that two can fill 
And we'll be pleased to be called 
The folks who live on the hill 

Someday we may be adding a wing or two 
A thing or two 
We will make changes, as any family will 
But we will always be called 
The folks who live on the hill 

Our verandah will command a view of meadows green 
The sort of view that seems to want to be seen 
And when our kids grow up and leave us 
We sit and look at that same old view 
Just we two, Darby and Joan 
Who used to be Jack and Jill 
The folks who like to be called 
What they have always been called 
The folks who live on the hill",The Folks Who Live on the Hill,1973
Oscar Peterson,"I was just minding my business
Life was a beautiful song
Didn't have a care nor worry
Then you had to come along
I fell in love with you first time
I looked into them there eyes
You've got a certain lil' cute way of flirtin'
With them there eyes
They make me feel happy, they make me blue
No stallin'
I'm fallin'
Going in a big way for sweet little you
My heart is jumpin'
You sure started somethin'
With them there eyes
You'd better watch them if you're wise
They sparkle, they bubble
They're gonna get you in a whole lot of trouble
You're overworkin' 'em
There's danger lurkin' in
Them there eyes
Maybe you think I'm just flirtin'
Maybe you think I'm all lies
Just because I get romantic when I gaze in
Them there eyes
I fell in love with you first time
I looked into them there eyes
You've got a certain lil' cute way of flirtin'
With them there eyes
They make me feel happy, they make me blue
No stallin'
I'm fallin'
Going in a big way for sweet little you
My heart is jumpin'
You sure started somethin'
With them there eyes
You'd better watch them if you're wise
They sparkle
They bubble
They're gonna get you in a whole lot of trouble
You're overworkin' 'em
There's danger lurkin' in
Them there eyes",Them There Eyes,1973
Oscar Peterson,"Once I had a secret love,
That lived within the heart of me
All too soon my secret love,
Became impatient to be free

So I told a friendly star,
The way that dreamers often do
Just how wonderful you are,
And why I'm so in love with you

Now, I shout it from the highest hills
Even told the golden daffodils
At last my hearts an open door,
And my secret love's
No secret anymore.",Secret Love,1973
Oscar Peterson,"I never knew the charm of spring
I never met it face to face
I never new my heart could sing
I never missed a warm embrace

Till April in Paris, chestnuts in blossom
Holiday tables under the trees
April in Paris, this is a feeling

That no one can ever reprise
I never knew the charm of spring
I never met it face to face
I never new my heart could sing
I never missed a warm embrace

Till April in Paris
Whom can I run to
What have you done to my heart",April in Paris,1974
Oscar Peterson,"Midnight, you heavy laden, it's midnight
Come on and trade in your old dreams for new
Your new dreams for old
I know where they're bought
I know where they're sold
Midnight, you've got to get there at midnight
And you'll be met there by others like you
Brothers as blue
Smiling on the street of dreams
 
Love laughs at a king
Kings don't mean a thing
On the street of dreams
Dreams broken in two can be made like new 
On the street of dreams
Gold, sliver and gold
All you can hold is in the moonbeams
Poor, no one is poor
Long as love is sure
On the street of dreams
 
Midnight, look at the steeple, it's midnight
Unhappy people, it's ringing with joy
It's ringing with cheer
'Cause yesterday's gone
Tomorrow is near
Midnight, the heart is lighter at midnight
Things will be brighter the moment you find
More of your kind
Smiling on the street of dreams
 
Love laughs at a king
Kings don't mean a thing
On the street of dreams
Dreams broken in two can be made like new 
On the street of dreams
Gold, sliver and gold
All you can hold is in the moonbeams
Poor, no one is poor
Long as love is sure
On the street of dreams
",Street of Dreams,1974
Oscar Peterson,"Oh, there's a lull in my life 
It's just a void and empty space 
When you are not in my embrace
Oh, there's a lull In my life 
The moment that you go away 
There is no night, there is no day
The clock stops ticking
The world stops turning
Everything stops but the flame in my heart 
That keeps burning, burning
Oh, oh, oh
There's a lull In my life 
No matter how I may pretend
I know that you alone can end",There's a Lull in My Life,1974
Oscar Peterson,"'Neath the stars, at bazaars
Often I've had to caress men
Five or ten, dollars then, I'd collect from all those yes-men
Don't be sad, I must add, that they meant no more than chess-men

Darling, can't you see?
'Twas for charity?
Though these lips have made slips, it was never really serious
Who'd have thought, I'd be brought to a state that's so delirious?

I could cry salty tears
Where have I been all these years?
Little wow, tell me now
How long has this been goin' on?

There were chills up my spine
And some thrills I can't define
Listen sweet, I repeat
How long has this been goin' on?

Oh, I feel that I could melt
Into heaven I'm hurled
I know how columbus felt
Finding another world

Kiss me once, then once more
What a dunce I was before
What a break, for heaven's sake
How long has this been goin' on?

Kiss me twice, once more, thrice, make it four

What a break, for heaven's sake
How long has this been goin' on?",How Long Has This Been Going On? [Take 5] [#][*][Take],1974
