Band,Lyrics,Song,Year
Chord Overstreet,"Help, I need somebody
Help, not just anybody
Help, you know, I need someone
Help 

(When)
When I was younger, so much younger than today (I never needed)
I never needed anybody's help in any way (now)
But now these days are gone, I'm not so self assured (and now I find)
Now I find, I've changed my mind, I've opened up the doors 

Help me if you can, I'm feeling down
And I do appreciate you being 'round
Help me get my feet back on the ground
Won't you, please, please help me? 

(Now)
And now my life has changed in, oh, so many ways (my independence)
My independence seems to vanish in the haze (but)
But every now and then I feel so insecure (I know that I)
I know that I just need you like I've never done before 

Help me if you can, I'm feeling down
And I do appreciate you being 'round
Help me get my feet back on the ground
Won't you, please, please help me? 

When I was younger, so much younger than today
I never needed anybody's help in any way (now)
But now these days are gone, I'm not so self assured (and now I find)
Now I find, I've changed my mind, I've opened up the doors 

Help me if you can, I'm feeling down
And I do appreciate you being 'round
Help me get my feet back on the ground
Won't you, please, please help me?
Help me, help me",Help,2013
Chord Overstreet,"Hey Jude, don't make it bad
Take a sad song and make it better
Remember to let her into your heart
Then you can start to make it better

Hey Jude, don't be afraid
You were made to go out and get her
The minute you let her under your skin
Then you begin to make it better

And anytime you feel the pain, hey Jude, refrain
Don't carry the world upon your shoulders
For well you know that it's a fool who plays it cool
By making his world a little colder
Nah nah nah nah nah nah nah nah nah

Hey Jude, don't let me down
You have found her, now go and get her
Remember to let her into your heart
Then you can start to make it better

So let it out and let it in, hey Jude, begin
You're waiting for someone to perform with
And don't you know that it's just you, hey Jude, you'll do
The movement you need is on your shoulder
Nah nah nah nah nah nah nah nah nah yeah

Hey Jude, don't make it bad
Take a sad song and make it better
Remember to let her under your skin
Then you'll begin to make it
Better better better better better better, oh

Nah nah nah nah nah nah, nah nah nah, hey Jude
Nah nah nah nah nah nah, nah nah nah, hey Jude
Nah nah nah nah nah nah, nah nah nah, hey Jude
Nah nah nah nah nah nah, nah nah nah, hey Jude
Nah nah nah nah nah nah, nah nah nah, hey Jude
Nah nah nah nah nah nah, nah nah nah, hey Jude
Nah nah nah nah nah nah, nah nah nah, hey Jude
Nah nah nah nah nah nah, nah nah nah, hey Jude
Nah nah nah nah nah nah, nah nah nah, hey Jude
Nah nah nah nah nah nah, nah nah nah, hey Jude
Nah nah nah nah nah nah, nah nah nah, hey Jude
Nah nah nah nah nah nah, nah nah nah, hey Jude
Nah nah nah nah nah nah, nah nah nah, hey Jude
Nah nah nah nah nah nah, nah nah nah, hey Jude
Nah nah nah nah nah nah, nah nah nah, hey Jude
Nah nah nah nah nah nah, nah nah nah, hey Jude",Hey Jude,2013
Chord Overstreet,"Well she was just seventeen
You know what I mean
And the way she looked
Was way beyond compare
So how could I dance with another,
Oh, when I saw her standing there

Well she looked at me
And I, I could see
That before too long
I'd fall in love with her
She wouldn't dance with another
Oh, when I saw her standing there

Well my heart went boom
When I crossed that room
And I held her hand in mine

Oh we danced through the night
And we held each other tight
And before too long
I fell in love with her
Now I'll never dance with another
Oh, when I saw her standing there

Well my heart went boom
When I crossed that room
And I held her hand in mine

Oh we danced through the night
And we held each other tight
And before too long
I fell in love with her
Now I'll never dance with another
Oh, when I saw her standing there
Oh, since I saw her standing there
Yeah, well since I saw her standing there",I Saw Her Standing There,2013
Chord Overstreet,"Loving and fighting
Accusing, uniting
I can't imagine a world with you gone
The joy and the chaos, the demons we're made of
I'd be so lost if you left me alone

You locked yourself in the bathroom
Lying on the floor when I break through
I pull you in to feel your heartbeat
Can you hear me screaming ""please don't leave me""

Hold on, I still want you
Come back, I still need you
Let me take your hand, I'll make it right
I swear to love you all my life
Hold on, I still need you

A long endless highway, you're silent beside me
Drivin' a nightmare I can't escape from
Helplessly praying, the light isn't fadin'
Hiding in the shock and the chill in my bones

They took you away on a table
I pace back and forth as you lay still
I pull you in to feel your heartbeat
Can you hear me screaming, ""please don't leave me""

Hold on, I still want you
Come back, I still need you
Let me take your hand, I'll make it right
I swear to love you all my life
Hold on, I still need you

I don't wanna let go
I know I'm not that strong
I just wanna hear you
Saying baby, let's go home
Let's go home
Yeah, I just wanna take you home

Hold on, I still want you
Come back, I still need you",Hold On,2017
Chorus,"Oh, we're gonna hit the Big Boss for a raise!
Yeah, we're gonna hit the Big Boss for a raise!
Oh, we're gonna get more money, 'cause we know that we're funny
Oh, we're gonna hit the Big Boss for a raise!",Clown Song,1941
Chorus,"Look out! Look out!
Pink elephants on parade
Here they come!
Hippety hoppety
They're here and there
Pink elephants ev'rywhere

Look out! Look out!
They're walking around the bed
On their head
Clippety cloppety
Arrayed in braid
Pink elephants on parade

What'll I do? What'll I do
What an unusual view!

I could stand the sight of worms
And look at microscopic germs
But technicolor pachyderms
Is really much for me
I am not the type to faint
When things are odd or things are quaint
But seeing things you know that ain't
Can certainly give you an awful fright
What a sight
Chase 'em away
Chase 'em away
I'm afraid need your aid
Pink elephants on parade

Pink elephants
Pink elephants
Pink elephants",Hiccups/Firewater/Bubbles/Did You See That?/Pink Elephants on Parade [M,1941
Chorus,"Casey Junior's coming down the track
Coming down the track
With a smoky stack
Hear him puffing, coming round the hill
Casey's here to thrill
Every Jack and Jill

Every time his funny little whistle sounds
Everybody hurries to the circus grounds
Time for lemonade and Cracker Jacks
Casey Junior's back
Casey Junior's back",Loading the Train/Casey Junior/Stork On a Cloud/Straight From Heaven/Mo,1941
Chorus,"Look out for Mr. Stork
That persevering chap
He'll come along and drop
A bundle in your lap
You may be poor or rich
It doesn't matter which
Millionaires, they get theirs
Like the butcher and the baker
So look out for Mr. Stork
And let me tell you, friend
Don't try to get away
He'll find you in the end
He'll spot you out in China or he'll fly to County Cork
So you better look out for Mr. Stork

Look out for Mr. Stork
He's got you on his list
And when he comes around
It's useless to resist
Remember those quintuplets and the woman in the shoe
Maybe he's got his eye on you",Look Out For Mister Stork,1941
Chorus,"Hike! Ugh! Hike! Ugh! Hike! Ugh! Hike!
We work all day, we work all night
We never learned to read or write
We're happy-hearted roustabouts
Hike! Ugh! Hike! Ugh! Hike! Ugh! Hike!
When other folks have gone to bed
We slave until we're almost dead
We're happy-hearted roustabouts
Hike! Ugh! Hike! Ugh! Hike! Ugh! Hike!
We don't know when we get our pay
And when we do, we throw our pay away
We get our pay when children say
With happy hearts, ""It's circus day today""

Muscles achin'
Back near breaking
Eggs and bacon what we need (Yes, sir!)
Boss man houndin'
Keep on poundin'
For your bed and feed
There ain't no let up
Must get set up
Pull that canvas! Drive that stake!
Want to doze off
Get them clothes off
But must keep awake

Hep! Heave! Hep! Heave! Hep! Heave!
Hep! Heave! Hep! Heave! Hep! Heave!
Hep! Heave! Hep!

Swing that sledge! Sing that song!
Work and laugh the whole night long
You happy-hearted roustabouts!
Pullin', poundin', tryin', groundin'
Big top roundin' into shape
Keep on working!
Stop that shirking!
Grab that rope, you hairy ape!
Poundin'! poundin'! poundin'! poundin'!
Oh",Song of the Roustabouts,1941
Chorus,"I love you
Hums an april breeze
I love you
Echo the hills

I love you
The golden dawn agrees
As once more she sees
Daffodils

It's spring again
And birds on the wing again
Start to sing again
The old melodies

I love you
That's the song of songs
And it all belongs
To you and me

I love you
Hums an april breeze
I love you
Echo the hills

I love you
The golden dawn agrees
As once more she sees
Daffodils

It's spring again
And birds on the wing again
Start to sing again
The old melodies (mellow melodies)

I love you
That's the song of songs
And it all belongs
To you and me
And it all belongs
To you and me",Act 2. Scenes 3 & 4. I Love You (Ich Liebe Dich),1945
Chorus,"Before Lord God made the sea and the land
He held all the stars in the palm of his hand
And they ran through his fingers like grains of sand
And one little star fell alone

Then the Lord God hunted through the wide night air 
For the little dark star on the wind down there 
And he stated and promised he'd take special care 
So it wouldn't get lost again

Now a man don't mind if the stars grow dim 
And the clouds blow over and darken him
So long as the Lord God's watching over them
Keeping track of how it all goes on

But I've been walking all the night and the day
Till my eyes get weary and my head turns gray
And sometimes it seems maybe God's gone away
And we're lost out here in the stars

Little stars, big stars, blowing through the night
And we're lost out here in the stars
Little stars, big stars, blowing through the night
And we're lost out here in the stars",Hills of Ixopo,1949
Chorus,"Please let me say from the start
I don't pretend to be smart
I just suggest what I think best
Having your interest at heart

I only want what's the best thing for you
And the best thing for you would be me
I've been convinced after thinking it through
That the best thing for you would be me

Every day
To myself I say
Point the way
What will it be

I ask myself what's the best thing for you
And myself and I seem to agree
That the best thing for you would be me",The Best Thing for You,1950
Chorus,"It's an old-fashioned idea, marryin' for love,
And that old fashioned idea's what I'm thinkin' of!
Where there's love, poets have said two can live as one,
That's an old-fashioned idea, but it's been done!

If she must have gold, let it be in her hair;
Rubies, let 'em be in her lips;
Diamonds, let 'em shine in her eyes.

Just an old-fashioned romance with the moon above,
A romance, one that will end marryin' for love.
That's the kind of love that I'm thinkin' of.

If she must have gold, let it be in her hair;
Rubies, let 'em be in her lips;
Diamonds, let 'em shine in her eyes.

Just an old-fashioned romance with the moon above,
A romance, one that will end marryin' for love.
That's the kind of love that I'm thinkin' of.",Marrying for Love,1950
Chorus,"i'm not a millionaire, but i don't have time to care
got no future,  got no plan
still i guess i'm a lucky man

Got no mansion, got no yacht,
Still I'm happy with what I got.
I've got the sun in the morning 
And the moon at night.
Sunshine gives me a lovely day,
Moonlight gives me the Milky Way.

Got no checkbooks, got no banks,
Still, I'd like to express my thanks
I've got the sun in the morning 
And the moon at night.

And with the sun in the morning
And the moon in the evening
I'm alright!

And with the sun in the morning
And the moon in the evening
and i know, that everything's alright",I Got the Sun in the Morning,1950
Chorus,"Come on along and take a ride and look at life from the cheery side
Howdy neighbor, happy harvest
May your forty acres soon be fields of clover
Yes indeed and plant a wish with every seed and by and by
The sun and rain will make an etching 
Of a million little green fingers stretching to the sky
Howdy neighbor, happy harvest
Get your rocking chairs for all your cares are over
Clap your hands and lick your chops your bumper crops are on the climb
Hey we're gonna roll in plenty spend a $5 or $10 or $20
And those happy harvest bells are gonna chime
Remember neighbor when you work for Mother Nature
You get paid by Father Time
Chicks are gonna cackle
And every burlap sack'll be full of 'tatoes and tobaccos
And dozens of different good and healthy greens
And if the weather man won't upset us
Mister you can bet us they'll be lots of crispy lettuce in your jeans
If you're into livin' find out just what livin' means
Howdy neighbor, happy harvest
May your forty acres soon be fields of clover
Go on puff your corn cob pipes
And no more gripes and no more groans
No mortgages or loans 
And you won't see a trace of worrying on the face of Farmer Jones
Howdy neighbor, happy harvest
Get your rocking chairs for all your cares are over
Clap your hands and lick your chops your bumper crops are on the climb
Hey we're gonna roll in plenty spend a $5 or $10 or $20
And those happy harvest bells are gonna chime
Remember neighbor when you work for Mother Nature
You get paid by Father Time",(Howdy Neighbor) Happy Harvest (Finale),1950
Chorus,"I don't want to sound like I'm preachin' a sermon,
But I've heard people say:
The early bird catches the worm;
'N there's a lot of good logic in that old cliche.
There are certain obligations you just can't shirk,
You've got to put the heat on to make the kettle perk;
And if you want it to be a good day,
You've got to do a good day's work.

Chorus 1:

You've gotta dig, dig, dig, dig for your dinner,
Nothin's what you get for free.
You've gotta dig, dig, dig, dig for your dinner,
Never was a money tree.
And furthermore, my friends, I must repeat,
Nobody's livin' down on Easy Street;
And if you want to owe for groceries,
You're gonna get an awful lot of ""No sir-ee's.""
You've gotta dig, dig, dig, dig for a dollar,
'Taint as simple as you think.
You can't purloin a sirloin
Or the butcher will put you in the clink.
You just can't be a lazy bird,
You've gotta get off o' your twig;
So you can afford your room and your board,
And it's nice to have the price of a ""cig.""
Say, you've gotta pay the fiddler man
If you want to do a jig.
You've gotta be as busy as a bee
To be a Mister B. I. G.
And if you want some dig-dig-dignity,
You've gotta dig, dig, dig, dig, dig for your dinner,
Dig, dig, dig, dig, dig.

Chorus 2:

You've gotta dig, dig, dig, dig for your dinner,
Nothin's what you get for free.
You've gotta dig, dig, dig, dig for your dinner,
Never was a money tree.
And furthermore, my friends, I must repeat,
Nobody's livin' down on Easy Street;
And if you want to owe for groceries,
You're gonna get an awful lot of ""No sir-ee's.""
You've gotta dig, dig, dig, dig for a dollar,
'Taint as simple as you think.
You can't purloin a sirloin
Or the butcher will put you in the clink.
You just can't be a lazy bird,
You've gotta get off o' your twig;
So you can afford your room and your board,
And it's nice to have the price of a ""cig.""
Say, you've gotta pay the fiddler man
If you want to do a jig.
You've gotta be as busy as a bee
To be a Mister B. I. G.
And if you want some dig-dig-dignity,
You've gotta dig, dig, dig, dig, dig for your dinner,
Dig, dig, dig, dig, dig.
(Spoken:) Right!

Movie version:

Verse:

(Kelly (spoken):) I don't want to sound like I'm preachin' a sermon
(Silvers (spoken):) Oh, preach to me, preach!
(Kelly (sung):) But I've heard people say:
(Silvers (spoken:) What did they say?
(Kelly (spoken:) They said, uh...
(Kelly (sung):) The early bird catches the worm...
'N there's a lot of good logic in that old cliche.
(Silvers (spoken:) You know he's right, listen to him children, he's right!
(Kelly (sung):) There are certain obligations you just can't shirk.
You've got to put the heat on to make the kettle perk.
(Silvers (spoken):) Now ain't dat da troo...?
Are ya list'nin' to da man?
Dis is da man who saved me...
I was wicked,
I was mad,
But dis is de man who showed me da way,
Dis is da man who took me by da han' up to da glory room,
Dis is da man who showed me da light,
Dis man here, dis is da man who gave me da beat,
Dis is da man who made me be righteous,
Dis man...
(Kelly (sung):) And if you want it to be a good day,
You've gotta do a good day's work;

Chorus:

You've gotta dig, dig, dig, dig for your dinner,
Nothin's what you get for free.
You've gotta dig, dig, dig, dig for your dinner,
Never was a money tree.
And furthermore, my friends, I must repeat,
Nobody's livin' down on Easy Street;
And if you want to owe for groceries,
You're gonna get an awful lot of ""No sir-ee's.""
You've gotta dig, dig, dig, dig for a dollar,
'Taint as simple as you think.
You can't purloin a sirloin
Or the butcher will put you in the clink.
You just can't be a lazy bird,
You've gotta get off o' your twig;
So you can afford your room and your board,
And it's nice to have the price of a ""cig.""
Say, you've gotta pay the fiddler man
If you want to do a jig.
You've gotta be as busy as a bee
To be a Mister B. I. G.
And if you want some dig-dig-dignity,
You've gotta dig, dig, dig, dig, dig for your dinner,
Dig, dig, dig, dig, dig.
",Dig-Dig-Dig for Your Dinner,1950
Chorus,"What am I here for?
It's time you knew
Here's what I'm here for
I'm here for you

Can you forgive me?
Am I too late?
All the years that I've wandered
And pondered were squandered

My heart insisted
I seek you out
That you existed
My heart had no doubt

To share a journey
That leads to heaven's door
You'll find is what I'm here for

What am I here for?
It's time you knew
Here's what I'm here for
I'm here for you

Can you forgive me?
Am I too late?
All the years that I've wandered
And pondered were squandered

My heart insisted
I seek you out
That you existed
My heart had no doubt

To share a journey
That leads to heaven's door
You'll find is what I'm here for

To share a journey
That leads to heaven's door
You'll find is what I'm here for, I'm here for",Here's What I'm Here For,1954
Chorus,"Joyfully now to our princess we come
Bringing gifts and all good wishes too
We pledge our loyalty anew
Hail to the Princess Aurora
All of her subjects adore her

Hail to the King, hail to the Queen
Hail to the Princess Aurora

Health to the Princess
Wealth to the Princess
Long live the Princess Aurora
Hail Aurora, hail Aurora
Health to the Princess
Wealth to the Princess
Long live the Princess Aurora

Hail to the King, hail to the Queen
Hail to the Princess Aurora!",Hail to the Princess Aurora,1958
Chorus,"I know you
I walked with you
Once Upon a dream
I know you

That gleam in your eyes
Is so familiar a gleam
Yet I know it's true
That visions are seldom what they seem

But if I know you
I know what you do
You'll love me at once
The way you did once upon a dream

La da la da la ahahahahah
But if I know you
I know what you do
You'll love me at once

The way you did once upon a dream
I know you
I walked with you
Once Upon a dream

I know you
That gleam in your eyes
Is so familiar a gleam
Yet I know it's true

That visions are seldom what they seem
But if I know you
I know what you do
You'll love me at once",Main Title: Once upon a Dream/Prologue,1958
Chorus,"Love me tender, love me sweet;
Never let me go.

You have made my life complete,
And I love you so.

Love me tender, love me true;
All my dreams fulfill,

For, my darling, I love you
And I always will.

Love me tender, love me long;
Take me to your heart,

For it's there that I belong,
And we'll never part.

Love me tender, love me true;

All my dreams fulfill,

For, my darling, I love you
And I always will.

Love me tender, love me dear;
Tell me you are mine.

I'll be yours through all the years,
Till the end of time.

Love me tender, love me true;
All my dreams fulfill,

For, my darling, I love you
And I always will.",Love Me Tender,1961
Chorus,"The sweet sweet memories you gave-a me
You can't beat the memories you gave-a me
 
Take one fresh and tender kiss
(The sweet sweet memories you gave-a me
You can't beat the memories you gave-a me)
Add one stolen night of bliss
(The sweet sweet memories you gave-a me
You can't beat the memories you gave-a me)
One girl, one boy; some grief, some joy
(I was rover, but now it's over  
It was a happy day when you came my way to tell me)
Memories are made of this
(of the sweet sweet memories you gave-a me
You can't beat the memories you gave-a me)
Don't forget a small moon beam
(The sweet sweet memories you gave-a me
You can't beat the memories you gave-a me)
Fold in lightly with a dream
Your lips and mine, two sips of wine
(The sweet sweet memories you gave-a me
You can't beat the memories you gave-a me)
Memories are made of this
(I was rover, but now it's over 
It was a happy day when you came my way to tell me)
Then add the wedding bells, one house where lovers dwell 
Three little kids for the flavor, stir carefully through the days
See how the flavor stays These are the dreams you will savor
With His blessings from above
(The sweet sweet memories you gave-a me
You can't beat the memories you gave-a me)
Serve it generously with love
(The sweet sweet memories you gave-a me
You can't beat the memories you gave-a me)
One man, one wife, on love through life
(I was rover, but now it's over
It was a happy day when you came my way to tell me)
Memories are made of this
(of the sweet sweet memories you gave-a me
You can't beat the memories you gave-a me)
Memories are made of this
(The sweet sweet memories you gave-a me)
 
Take one fresh and tender kiss
(The sweet sweet memories you gave-a me
You can't beat the memories you gave-a me)
Add one stolen night of bliss
(The sweet sweet memories you gave-a me
You can't beat the memories you gave-a me)
One girl, one boy, some grief, some joy
(I was rover, but now it's over
It was a happy day when you came my way to tell me)
Memories are made of this
(of the sweet sweet memories you gave-a me
You can't beat the memories you gave-a me)
Don't forget a small moon beam
(The sweet sweet memories you gave-a me
You can't beat the memories you gave-a me)
Fold in lightly with a dream
Your lips and mine, two sips of wine
(The sweet sweet memories you gave-a me
You can't beat the memories you gave-a me)
Memories are made of this
(I was rover, but now it's over
It was a happy day when you came my way to tell me)
Then add the wedding bells, one house where lovers dwell 
Three little kids for the flavor. stir carefully through the days
See how the flavor stays 
These are the dreams you will savor
With His blessings from above
(The sweet sweet memories you gave-a me
You can't beat the memories you gave-a me)
Serve it generously with love
(The sweet sweet memories you gave-a me
You can't beat the memories you gave-a me)
One man, one wife, on love through life
(I was rover, but now it's over
It was a happy day when you came my way to tell me)
Memories are made of this
(of the sweet sweet memories you gave-a me
You can't beat the memories you gave-a me)
Memories are made of this
(The sweet sweet memories you gave-a me)",Memories Are Made of This,1961
Chorus,"The night is like a lovely tune
Beware my foolish heart
How white the ever constant moon
Take care my foolish heart

There's a line between love and fascination
That's hard to see, how many names such as this
For they both have the very same sensation
When you're locked in the magic of a kiss

Her lips are much too close to mine
Beware my foolish heart
But should our eager lips combine
Then let the fire start

For this time it isn't fascination
Or a dream that will fade and fall apart
It's love, this time it's love
My foolish heart",My Foolish Heart,1961
Chorus,"Only you can make this world seem right
Only you can make the darkness bright
Only you and you alone can thrill me like you do
And fill my heart with love for only you

Only you can make this change in me
For it's true, you are my destiny
When you hold my hand I understand
The magic that you do

You're my dream come true, my one and only you.

Only you can make this change in me
For it's true, you are my destiny
When you hold my hand I understand
The magic that you do
You're my dream come true, my one and only you
You're my dream come true, my one and only you",Only You (And You Alone),1961
Chorus,"A dream that will need
All the love you can give
Everyday of your life
For as long as you live

Climb ev'ry mountain
Ford ev'ry stream
Follow ev'ry rainbow
Till you find your dream",Climb Ev'ry Mountain (Reprise),1965
