Band,Lyrics,Song,Year
Diane Schuur,"Are you getting the spirit in the dark
Are you getting the spirit in the dark
People moving, ah, tell me we`re grooving
Just getting the spirit in the dark
Tell me, sisters, how do you feel
Tell me, my brothers, my brothers
How do you feel
(Do you feel like dancing)
Get up there and let`s start dancing
(Get up and let`s start dancing)
Start getting in the spirit
Oh, getting in the dark
(Spirit in the dark)
Just like Sally Walker
Sitting in a saucer
That`s how you do it
Just go on, get on up to it
Ride, Sally, ride
Put your hands on your hips
Cover your eyes, and move
(Come on get it)
Get in the spirit
(Move with the spirit)
Come on and move, get in the spirit
(Darling, move, move with the spirit)
Oh move, get in the spirit
Help me move 
(Move)
With the spirit 
(Spirit)
Are you getting the spirit
(Spirit in the dark)
I want to know, are you getting the spirit
(Getting the spirit)
Getting it in the spirit
Are you getting the spirit
(Getting the spirit)
Keep moving
Oh hey, we`re rocking and grooving
Just getting in the spirit
(Getting the spirit)
Oh in the dark
We`re gonna do it one more time
It`s just like Sally Walker
Sitting in that great big flying saucer
Hey, that`s how you do it
Get down and get on up to it
(Come on and get it)
Ride, Sally, ride
Put your hands on your hips
Cover your eyes, and move
(Move, move on)
Move with the spirit
I`m telling you to groove
(Groove on)
Groove with the spirit
(On and on)
Go on and move
(Move)
With the spirit
(Spirit)
Come on and groove
(Move it)
Groove with the spirit
(Move on)
On and on 
(Yeah)
Help me, help me, help me
Help me move, move, move, move
Move, move, move, move
Move, move, move, move
Move, move, move, move
Give it up, give it up
Give it up, give it up
Give it up, give it up
Give it up, give it up
(You got it, you got it)
(You got the spirit)
Spirit 
Feel it 
I feel it, baby.
You know what I mean, baby?
Yes, I do.
Oh baby. You gotta feel the motivation.
I feel it, honey, I feel it.
Feel the spirit 
In the dark 
Get ready",Spirit in the Dark,1994
Diane Schuur,"Oh she may be weary
Them young girls they do get wearied
Wearing that same old miniskirt dress
But when she gets weary
You try a little tenderness

Oh man that
Un hunh
I know shes waiting
Just anticipating
The thing that you'll never never possess
No no no
But while she there waiting

Try just a little bit of tenderness
That's all you got to do
Now it might be a little bit sentimental no
But she has her greavs and care
But the soft words they are spoke so gentle
Yeah yeah yeah
And it makes it easier to bear
Oh she wont regret it

No no
Them young girls they don't forget it
Love is their whole happiness
Yeah yeah yeah
But its all so easy
All you got to do is try
Try a little tenderness
Yeah
Damn that hart (hard?)

All you got to do is know how to love her
You've got to
Hold her
Squeeze her
Never leave her
Now get to her
Got got got to try a little tenderness
Yeah yeah
Lord have mercy now

All you got to do is take my advice
You've got to hold her
Don't squeeze her
Never leave her
You've got to hold her
And never
So you got to try a little tenderness
A little tenderness
A little tenderness
A little tenderness

You've got to
Got to got to
You've gotta hold her
Don't squeeze her
Never leaver her
You got
Got got got to
Now now now
Got got got to
Try a little tenderness
Ye",Try a Little Tenderness,1994
Diane Schuur,"You give your hand to me
Then you say hello
I can hardly speak
My heart is beating so
And anyone can tell
You think you know me well
But you don't know me

No, you don't know the one
Who dreams of you at night
And longs to kiss your lips
And longs to hold you tight
Oh I'm just a friend
That's all I've ever been
'Cause you don't know me

I never knew
The art of making love
Though my heart aches
With love for you
Afraid and shy
I've let my chance to go by
The chance that you might
Love me, too

You give your hand to me
And then you say good-bye
I watch you walk away
Beside the lucky guy
You'll never never know
The one who loves you so
Well, you don't know me

You give your hand to me, baby
Then you say good-bye
I watch you walk away
Beside the lucky guy
No, no, you'll never ever know
The one who loves you so
Well, you don't know me",You Don't Know Me,1994
Diane Schuur,"How much do I love you? 
I'll tell you no lie
How deep is the ocean? 
How high is the sky? 
How many times in a day
Do I think of you? 
How many roses are
Sprinkled with dew? 

How far would I travel
Just to be where you are? 
How far is the journey
From here to a star? 
And if I ever lost you
How much would I cry? 
How deep is the ocean? 
How high is the sky?",How Deep Is the Ocean?,1995
Diane Schuur,"I wanna be loved with inspiration
I wanna be loved starting tonight
Instead of merely holding conversation
Hold me tight

I wanna be kissed until I tingle
I wanna be kissed starting tonight
Embrace until our heartbeats intermingle
Wrong or right

I feel like acting my age
I'm past the stage of merely turtledoving
(be careful, be careful what you do)
I'm in no mood to resist
And I insist the world owes me a loving

I wanna be thrilled to desperation
I wanna be thrilled starting tonight
(love me, love me, love me)
With every kind of wonderful sensation
I wanna be loved

I feel like acting my age
I'm past the stage of merely turtledoving
I'm in no mood to resist
And I insist the world owes me a loving

I wanna be thrilled to desperation
I wanna be thrilled starting tonight
With every kind of wonderful sensation
I wanna be loved 
",I Wanna Be Loved,1995
Diane Schuur,"Love walked right in and drove the shadows away
Love walked right in and brought my sunniest day
One magic moment and my heart seemed to know that love said hello
Though not a word was spoken

One look, and I forgot the gloom of the past
One look and I had found my future at last
One look and I had found a world completely new
When love walked in with you

One magic moment and my heart seemed to know that love said hello
Though not a word was spoken

One look and I had found a world completely new
When love walked in with you",Love Walked In,1995
Diane Schuur,"Say it isn?t so,

Say it isn?t so,
Everyone is saying
You don?t love me,
Say it isn?t so.

Everywhere I go,
Everyone I know,

Whispers that you?re growing tired of me,
Say it isn?t so.
People say that you,

Found somebody new,
And it won?t be long
Before you leave me,
Say it isn?t true,

Say that everything is still okay,
That?s all I want to know,

And what they?re saying,
Say it isn?t so.

",Say It Isn't So,1995
Diane Schuur,"I want a Sunday kind of love 
A love to last past Saturday night 
And I?d like to know it?s more than love at first sight 
And I want a Sunday kind of love 
Oh yea yea

I want a a love that?s on the square 
Can?t seem to find somebody 
Someone to care 
And I?m on a lonely road that leads to no where 
I need a Sunday kind of love

I do my Sunday dreaming, Oh yea 
And all my Sunday scheming 
Every minute, every hour, every day

Oh I?m hoping to discover 
A certain kind of lover 
Who will show me the way 

And my arms need someone 
Someone to enfold 
To keep me warm when Mondays and Tuesdays grow cold 
Love for all my life to have and to hold 
Oh and I want a Sunday kind of love 
Oh yea yea yea

I don?t want a Monday, Tuesday, or Wednesday, or Thursday, Friday or Saturday 
Oh nothing but Sunday oh yea 
I want a Sunday Sunday 
I want a Sunday kind of love 
Oh yea 
Sunday, Sunday, Sunday kind of loooove 
",A Sunday Kind of Love,1995
Diane Schuur,"What good are words I say to you? 
They can't convey to you what's in my heart
If you could hear instead
The things I've left unsaid

Time after time
I tell myself that i'm
So lucky to be loving you

So lucky to be
The one you run to see
In the evening, when the day is through

I only know what I know
The passing years will show
You've kept my love so young, so new

And time after time
You'll hear me say that i'm
So lucky to be loving you",Time After Time,1995
Diane Schuur,"Words of praise
in a well turned phrase 
never seem to spring
from my heart,
I'm never one who reaches
for sentimental speeches;
I'm not versed and I'm not rehearsed 
in the kind of words that are smart,
Still I can speak sincerely
and tell you just as clearly.

You're a sweetheart
if there ever was one,
If there ever was one it's you.
Life without you 
was an incomplete dream,
You are every sweet dream come true.
My search was such a blind one
and I was all at sea,
I never thought I'd find one 
quite so perfect for me,
You're a sweetheart if there ever was one,
If there ever was one it's you",You're a Sweetheart,1995
Diane Schuur,"Somewhere over the rainbow, way up high
There's a land that I've heard of once in a lullaby.
Somewhere over the rainbow, skies are blue
And the dreams that you dare to dream,
Really do come true.

Someday I'll wish upon a star
And wake up where the clouds are far behind me.
Where troubles melt like lemon drops,
High above the chimney tops,
That's where you'll find me.

Somewhere over the rainbow, blue birds fly
Birds fly over the rainbow
Why then, oh why can't I?
If happy little bluebirds fly beyond the rainbow
Why, oh why can't I?

Somewhere over the rainbow, way up high
There's a land that I've heard of once in a lullaby.
Somewhere over the rainbow, skies are blue
And the dreams that you dare to dream,
Really do come true.

Someday I'll wish upon a star
And wake up where the clouds are far behind me.
Where troubles melt like lemon drops,
High above the chimney tops,
That's where you'll find me.

Somewhere over the rainbow, blue birds fly
Birds fly over the rainbow
Why then, oh why can't I?
If happy little bluebirds fly beyond the rainbow
Why, oh why can't I?",Over the Rainbow,1996
Diane Schuur,"They call it stormy Monday, but Tuesday's just as bad
They call it stormy Monday, but Tuesday's just as bad
Wednesday's worse, and Thursday's also sad

Yes the eagle flies on Friday, and Saturday I go out to play
Eagle flies on Friday, and Saturday I go out to play
Sunday I go to church, then I kneel down and pray

Lord have mercy, Lord have mercy on me
Lord have mercy, my heart's in misery
Crazy about my baby, yes, send her home to me",Stormy Monday Blues,1997
Diane Schuur,"I used to dream about angels But then I never knew
That I'd ever meet one And such a sweet one
Till I met you

When did you leave heaven? How could they let you go?
How's ev'ry thing in Heaven? I'd like to know
Why did you trade Heaven for all these earthly things
Where di you hide your Halo?

Where did you lose your wings?
Have they missed you?
Can you get back in?

If Ikissed you would it be a sin?
I amonly human but you are so divine
When did you leave Heave, angel mine?

When did you leave heaven? How could they let you go?
How's ev'ry thing in Heaven? I'd like to know
Why did you trade Heaven for all these earthly things
Where di you hide your Halo?

Where did you lose your wings?
Have they missed you?
Can you get back in?

If Ikissed you would it be a sin?
I amonly human but you are so divine
When did you leave Heave, angel mine?
",When Did You Leave Heaven?,1997
Diane Schuur,"I'll be home for Christmas
You can plan on me
Please have snow and mistletoe
And presents on the tree

Christmas Eve will find me
Where the lovelight gleams
I'll be home for Christmas
If only in my dreams

I'll be home for Christmas
You can plan on me
Please have snow and mistletoe
And presents on the tree

Christmas Eve will find me
Where the lovelight gleams
I'll be home for Christmas
If only in my dreams",I'll Be Home for Christmas,1997
Diane Schuur,"[1st verse:]
Too long I held you close to my heart
Too much I loved you right from the start
Too soon you vanished out of my dreams
Too late to start all over it seems
[Refrain:]
It's over, all over
And soon somebody else
Will make a fuss about you
But how about me?
It's over, all over
And soon somebody else
Will tell his friends about you
But how about me?
You'll find somebody new
But what am I to do?
I'll still remember you
When you have forgotten
And maybe a baby
Will climb upon your knee
And put its arms about you
But how about me?
[2nd verse:]
Moonlight was beaming down from the skies
Lovelight was gleaming deep in your eyes
Sunlight for just a moment and then
Twilight and I was lonely again
[Alternate line:]
Will tell the world about you",How About Me?,1997
Diane Schuur,"She's a fool and don't I know it
But a fool can have her charms
I'm in love and don't I show it
Like a babe in arms

Love's the same old situation
Lately I've not slept a wink
Since this crazy situation
Has me on the blink

I'm wild again, beguiled again
A whimpering, simpering child again
Bewitched, bothered and bewildered, am I

Couldn't sleep, wouldn't sleep
Love came and told me, shouldn't sleep
Bewitched, bothered and bewildered, am I

I lost my heart, but what of it
She is cold I agree
She might laugh, but I love it
Although the laugh's on me

I'll sing to her, bring spring to her
And long, for the day when I'll cling to her
Bewitched, bothered and bewildered, am I","Bewitched, Bothered and Bewildered",1999
Diane Schuur,"My love must be a kind of blind love
I can't see anyone but you
Sha bop sha bop

Are the stars out tonight
I don't know if it's cloudy or bright
I only have eyes for you dear

The moon may be high
But I can't see a thing in the sky
I only have eyes for you

I don't know if we're in a garden
Or on a crowded avenue

You are here and so am I
Maybe millions of people go by
But they all disappear from view
And I only have eyes for you",I Only Have Eyes for You,1999
Diane Schuur,"If you could see me now, you'd know how blue I've been
One look is all you'd need to see the mood I'm in.
Perhaps then you'd realize I'm still in love with you.
If you could see me now, you'd find me being brave
And trying awfully hard to make my tears behave
But that's quite impossible, I'm still in love with you.
 
You'll happen my way on some mem'rable day
And the month will be May for a while.
I'll try to smile but can I play the part
Without my heart behind the smile?
 
The way I feel for you I never could disguise
The look of love is written plainly in my eyes.
I think you'd be mine again if you could see me now.",If You Could See Me Now,1999
Diane Schuur,"Don't even go to a movie show
If you're not by my side,
I stay home by my radio,
But I'm satisfied!
All my flirtin' days are gone,
On the level from now on!

Don't go for any excitement now,
Books are my best company.
All my opinions have changed somehow,
Old-fashioned as can be!
When you really learn to care,
There's a thrill in solitaire!

Keepin' ou of mischief now,
Really am in love, and how!
I'm through playing with fire,
It's you whom I desire!

All the world can plainly see
You're the only one for me!
I've told them in advance
They can't break up our romance!
Living up to every vow,
I'm keepin' out of mischief now!

All the world can plainly see
That you're the only one for me!
Say I've told them, told them in advance
That they can't break up our romance!
Living up to every vow,
I'm keepin', keepin' out of mischief now!",Keepin' Out of Mischief Now,1999
Diane Schuur,"You'd be so nice to come home to
You'd be so nice by the fire
While the breeze on high sang a lullaby
You'd be all that I could desire

Under stars chilled by the winter
Under an August moon burning above
You'd be so nice, you'd be paradise
To come home to and love

Under stars chilled by the winter
Under an August moon burning above
You'd be so nice, you'd be paradise
To come home to and love",You'd Be So Nice to Come Home To,1999
Diane Schuur,"How much do I love you?
I'll tell you no lie
How deep is the ocean?
How high is the sky?

How many times a day do I think of you?
How many roses are sprinkled with dew?

How far would I travel
To be where you are?
How far is the journey
From here to a star?

And if I ever lost you, how much would I cry?
How deep is the ocean?
How high is the sky?

How far would I travel
To be where you are?
How far is the journey
From here to a star?

And if I ever lost you, how much would I cry?
How deep is the ocean?
How high is the sky?
How high is the sky?",How Deep Is the Ocean,1999
Diane Schuur,"Living for you is easy living
It's easy to live when you're in love
And I'm so in love
There is nothing in life but you

I never regret the years that I'm giving
They're easy to give when you're in love
I'm happy to do whatever I do for you

For you maybe I'm a fool
But it's fun
People say you rule me with one wave of your hand
Darling, it's grand
They just don't understand

Living for you is easy living
It's easy to live when you're in love
And I'm so in love
There's nothing in life but you

",Easy Living,2000
Diane Schuur,"For the first time in a long time
There is love in my life
For the first time in a long time
Everything is alright

I don't know just how it all came to be
Can't believe that it could happen to me
But it's you I was always dreaming of
And for the first time in a long time I'm in love

For the first time in a long time I believe in myself
And it makes it all so easy to love somebody else

When we met my heart was heavy with care
But with you I'm feeling lighter than air
I could fly to the moon and stars above
'Cause for the first time in a long time I'm in love

They say the world is made for those who love
And now I know it's true

For the first time in a long time
I'm truly alive
I've been waiting for a long time
Now I know I'm alive

I don't know how it all came to me
Can't believe that it could happen to me
But it's you I was always dreaming of
And for the first time in a long time
This is my time and I'm falling in love

",For the First Time,2000
Diane Schuur,"No New Year's Day to celebrate
No chocolate covered candy hearts to give away
No first of spring
No song to sing
In fact here's just another ordinary day
No April rain
No flowers bloom
No wedding Saturday within the month of June
But what it is, is something true
Made up of these three words that I must say to you
I just called to say I love you
I just called to say how much I care
I just called to say I love you
And I mean it from the bottom of my heart
No summer's high
No warm July
No harvest moon to light one tender August night
No autumn breeze
No falling leaves
Not even time for birds to fly to southern skies
No Libra sun
No Halloween
No giving thanks to all the Christmas joy you bring
But what it is, though old so new
To fill your heart like no three words could ever do
I just called to say I love you
I just called to say how much I care, I do
I just called to say I love you
And I mean it from the bottom of my heart
I just called to say I love you
I just called to say how much I care, I do
I just called to say I love you
And I mean it from the bottom of my heart, of my heart, of my heart
I just called to say I love you
I just called to say how much I care, I do
I just called to say I love you
And I mean it from the bottom of my heart, of my heart, baby of my heart",I Just Called to Say I Love You [Live],2000
Diane Schuur,"Time, I've been passing time
Watching trains go by.
All of my life, 
Lying on the sand watching seabirds fly.
Wishing there would be
Someone waiting home for me.

Something's telling me it might be you
It's telling me it might be you
All of my life...

Looking back as lovers go walking past
All of my life,
Wondering how they met and what makes it last.

If I found the place,
Would I recognize the face?
Something's telling me it might be you.
Yeah, it's telling me it might be you.

So many quiet walks to take
So many dreams to wake
And we've so much love to make

I think we're gonna need some time
Maybe all we need is time
And it's telling me it might be you
All of my life

I've been saving love songs and lullabies
And there's so much more
No one's ever heard before

Something's telling me it might be you
Yeah, it's telling me it must be you
And I'm feeling it'll just be you
All of my life
It's you
It's you
I've been waiting for all of my life

(Maybe) It's you (It's you) 
(Maybe) It's you  (It's you)
I've been waiting for all of my life

(Maybe) It's you (It's you)
(Maybe) It's you (It's you)
I've been waiting for all of my life

(Maybe) It's you (It's you)
(Maybe) It's you (It's you)
I've been waiting for all of my life",It Might Be You,2000
Diane Schuur,"I know you
You're the one I always turn to
When I'm down
You were made for me

A tender heartbeat away
When I feel this close
I don't know what to say

Me and my car broke down



So I'm going to take a
Red Cab to Manhattan
I'll be heading out my door
Got some friends who want to see me
Don't know what I'm living for
Gonna take a Red Cab to Manhattan

""Insincere,"" you say
Well I'm right here beside you
And I'm a million miles away

I'm listening to the O'Jays sing
Don't lose your heart
Don't lose your heart
'Til you're sure that she's the one

Me and my car broke down



So I'm gonna take a Red Cab to Manhattan
See ""It's a Wonderful Life""
Take Jimmy Stewart out to dinner
Buy some postcards for his wife
gonna take a Red Cab to Manhattan

Oh, it's too late to make fun of it
Oh, she's given you the best of it ",Red Cab to Manhattan,2000
Diane Schuur,"No New Year's Day to celebrate
No chocolate covered candy hearts to give away
No first of spring
No song to sing
In fact here's just another ordinary day
No April rain
No flowers bloom
No wedding Saturday within the month of June
But what it is, is something true
Made up of these three words that I must say to you
I just called to say I love you
I just called to say how much I care
I just called to say I love you
And I mean it from the bottom of my heart
No summer's high
No warm July
No harvest moon to light one tender August night
No autumn breeze
No falling leaves
Not even time for birds to fly to southern skies
No Libra sun
No Halloween
No giving thanks to all the Christmas joy you bring
But what it is, though old so new
To fill your heart like no three words could ever do
I just called to say I love you
I just called to say how much I care, I do
I just called to say I love you
And I mean it from the bottom of my heart
I just called to say I love you
I just called to say how much I care, I do
I just called to say I love you
And I mean it from the bottom of my heart, of my heart, of my heart
I just called to say I love you
I just called to say how much I care, I do
I just called to say I love you
And I mean it from the bottom of my heart, of my heart, baby of my heart","I Just Called to Say I Love You [Live From Washington, D.C., 1999]",2000
Diane Schuur,"It had to be you. 
It had to be you.
I've wandered around,
Finally found somebody who,
Could make me be true.
Whoa whoa whoa could make me be blue.
And, even be glad just to be sad thinkin' of you

Some others I've seen, might never be mean.
Might never be cross. 
Or, try to be boss.
But, they wouldn't do.
For nobody else gave me a thrill.
With all your faults I love you still.
It had to be you. 
Wonderful you.
It had to be you

'Cause nobody else gave me a thrill.
With all yo' faults
I love you still now.
And it had to be you. 
It just had to be you.
It had to be you","It Had to Be You [Live From Miami, 1998]",2000
Diane Schuur,"The falling leaves drift by the window
The autumn leaves of red and gold
I see your lips, the summer kisses
The sun-burned hands I used to hold

Since you went away the days grow long
And soon I'll hear old winter's song
But I miss you most of all my darling
When autumn leaves start to fall

C'est une chanson, qui nous ressemble
Toi tu m'aimais et je t'aimais
Nous vivions tous deux ensemble
Toi qui m'aimais moi qui t'aimais
Mais la vie separe ceux qui s'aiment
Tout doucement sans faire de bruit
Et la mer efface sur le sable les pas des amants desunis",Autumn Leaves,2001
Diane Schuur,"Woo, 
Wo-o-oo-wo-wo, 
Wo-o-oo-wo-wo, 
Wo-o-oo-wo-wo
When the deep purple falls
Over sleepy garden walls
And the stars begin to twinkle in the night
In the mist of a memory
You wander all back to me
Breathing my name with a sigh

In the still of the night
Once again I hold you tight
Tho' you're gone your love lives on when light beams
And as long as my heart will beat
Sweet lover, we'll always meet
Here in my deep purple dreams

When the deep purple falls
Over sleepy garden walls
And the stars begin to twinkle
In the night
In the mist of a memory
You wander all back to me
Breathing my name with a sigh

In the still of the night 
Once again I hold you tight
Tho' you're gone your love lives on when moonlight beams
And as long as my heart will beat
Sweet lover, we'll always meet
Here in my deep purple dreams
And as long as my heart will beat
Sweet lover, we'll always meet
Here in my deep purple dreams
Wo-o-oo-wo-wo, 
Wo-o-oo-wo-wo, 
Wo-o-oo-wo-wo",Deep Purple,2001
