Band,Lyrics,Song,Year
Dick Cary,"Yesterday you came my way,
And when you smiled at me,
In my heart I felt a thrill you see,
That it was love at sight and
I was right to love you as I do.
Still I never dreamed that you could love me too.

Your eyes of blue, your kisses too,
I never knew what they could do.
I can't believe that you're in love with me.

You're telling ev'ry one I know
I'm on your mind each place we go
They can't believe that you're in love with me.

I have always placed you far above me.
I just can't imagine that you love me.
And after all is said and done,
To think that I'm the lucky one.
I can't believe that you're in love with me.

Skies are gray. I'm blue each day
When you are not around.
Ev'ry thing goes wrong, my dear I've found
But when you're by my side I fill with pride
For I'm so proud of you
It all seems too good to me to all be true

Your eyes of blue, your kisses too,
I never knew what they could do.
I can't believe that you're in love with me.

You're telling ev'ry one I know
I'm on your mind each place we go
They can't believe that you're in love with me.

I have always placed you far above me.
I just can't imagine that you love me.
And after all is said and done,
To think that I'm the lucky one.
I can't believe that you're in love with me.",I Can't Believe That You're in Love With Me,2005
Dick Cary,"In A Sentimental Mood 
I can see the stars come thru my room
While your loving attitude
Is like a flame that lights the gloom
On the wings of ev'ry kiss 
Drift a melody so strange and sweet
In this sentimental bliss you make my 
Paradise complete
Rose pearls seem to fall
It's all like a dream to call you mine
My heart's lighter thing 
Since you made me this night a thing divine
In A Sentimental Mood 
I'm within a world so heavenly
For I never dreamt 
That you'd be loving sentimental me
In A Sentimental Mood 
I can see the stars come thru my room
While your loving attitude 
Is like a flame that lights the gloom
On the wings of ev'ry kiss 
Drift a melody so strange and sweet
In this sentimental bliss you make my 
Paradise complete
Rose pearls seem to fall
It's all like a dream to call you mine
My heart's lighter thing 
Since you made me this night a thing divine
In A Sentimental Mood 
I'm within a world so heavenly
For I never dreamt 
That you'd be loving sentimental me",In a Sentimental Mood,2005
Dick Cary  & His Dixieland Doodlers,"Well, I came down there with my hat caved in
Oh I'll go back home with my pocket full of tin oh doo-dah day
Goin' to run all night, goin' to run all day
I'll bet my money on the bobtail nag, somebody bet on the bay.

Well, the Camptown ladies sing this song doodah doodah
Ah the Camptown race track's five miles long oh doo-dah day
Goin' to run all night, goin' to run all day
I'll bet my money on the bobtail nag, somebody bet on the bay.",Camptown Races,2001
Dick Cary  & His Dixieland Doodlers,"There's a time each year
That we always hold dear
Good old summertime
With the birds and the trees'es
And sweet scented breezes
Good old summertime
When your day's work is over
Then you are in clover
And life is one beautiful rhyme
No trouble annoying
Each one is enjoying
The good old summertime

In the good old summertime
In the good old summertime
Strolling through a shady lane
With your baby mine
You hold her hand and she holds yours
And that's a very good sign
That she's your tootsey-wootsey
In the good, old summertime

Oh, to swim in the pool
You'd play hooky from school
Good old summertime
You'd play ""ring-a-rosie""
With Jim, Kate and Josie
Good old summertime
Those days full of pleasure
We now fondly treasure
When we never thought it a crime
To go stealing cherries
With faces brown as berries
In good old summertime

In the good old summertime
In the good old summertime
Strolling through a shady lane
With your baby mine
You hold her hand and she holds yours
And that's a very good sign
That she's your tootsey-wootsey
In the good, old summertime",In the Good Old Summertime,2001
Dick Cary's Tuesday Night Friends,"Saints and sinners, come one, come all
Have a little revival
Losers, winners, answer my call
Cause right now the tent's up
Really it is
The word's out
Truly it is
An'  has been since the dawn
Hear me tell y'
The call's out
Really it is
An' we're 'bout
Tendin' t' biz
To git this meetin' on,hear me tellin' you
Brothers' n' sisters who want to repent
That's right
You'll find what you been lookin' for
Right here in this tent
Lend an ear and you'll see
Cause when it comes t' needin' savin'
Ain' nobody knows it better than me
I was so low that I know
That only a miracle like this
Is the only way t' heavenly bliss
It's really the truth, lawdy, I know it
I know it 'cause I been taken through it
Now the spirits in me an' allowed the Lord
T' win me, I can testify to it
Sweet sweet the angel's song
Sweet the feelin' I been searchin' for
For ever so long
I never again imagine livin' life
Like I was livin' when I lived wrong
Get ready
Swing
Here they come the choir's all set
Be steady
Sway 
See the people fillin' them pews
Be willin'
All 
To announce without a regret
It's thrillin' !
Day
Tell the world the wonderful news
Folks' re troopin' in from farther 'n' near
F' news that they can hardly wait to hear
They're nearly starved cause they're waitin'
For food for the soul, yeah
Starved cause they're waitin' for
What will not grow old
Preacher's openin' up the book
He gonna pause awhile an' take a look
'N' then he'll start tellin' everyone
Just how t' do, yeah
Sister Emmy Lou done gone t'  shoutin'
An' jumpin' cause she feels the spirit
The congregation's stompin' its feet 
An' everybody's movin' outta their seat
They really gonna get this meetin' on
An' praise the Lord until the dawn
Yeah--hear that preacher spread the word 
Cause it's the greatest word
You've ever heard
When he says
""I'm callin' sinners right now you hear
I'm callin' sinners right to me
When ol' Satan grabs your soul 
It takes the Lord's true word to break his hold
So I say you got to listen mostly to me
You got to listen closely""
Don't let the devil catch y' nappin'
Gotta keep the vigil every minute
Or the devil gonna surely git you
""Watch your step 'n' how you act
Mister Scratch is here, an' that's a fact
If anyone can stop him, I can
That's why I'm the preacher man""
We hear the word 
We hear your voice
We know there really isn't any other choice 
Head f' heaven t' day
We're on the gospel train
We can show you the way
Relieve all strain
Leave your cares and your woes
Yes!
Heaven knows
Yes!
Y' dodge that devil in his fine fancy clothes yes!
Come git aboard
We still got space
Hear the word of the Lord
We saved your place
Save your soul while y' can
Yes!
Sinner man
Yes!
Git on as fast as you can
You've heard the sermon sublime
Down south camp meetin' time!
",Down South Camp Meeting,2001
Dick Cary's Tuesday Night Friends,"It don't mean a thing
If it ain't got that swing
(doo wah, doo wah, doo wah, doo wah
Doo wah, doo wah, doo wah, doo wah)
It don't mean a thing
All you got to do is sing
(doo wah, doo wah, doo wah, doo wah
Doo wah, doo wah, doo wah, doo wah)
It makes no diff'rence 
If it's sweet or hot
Just give that rhythm 
Ev'rything you got
Oh, it don't mean a thing
If it ain't got that swing
(doo wah, doo wah, doo wah, doo wah
Doo wah, doo wah, doo wah, doo wah)",It Don't Mean a Thing (If It Ain't Got That Swing),2001
Dick Cary's Tuesday Night Friends,"Sweet and lovely
Sweeter than the roses in May
Sweet and lovely
Heaven must have sent him my way

Skies above me
Never were as blue as his eyes
And he loves me
Who would want a sweeter surprise?

When he nestles in my arms so tenderly
There's a thrill that words cannot express
In my heart a song of love is taunting me
Melody haunting me

Sweet and lovely
Sweeter than the roses in May
And he loves me
There is nothing more I can say

When he nestles in my arms so tenderly
There's a thrill that words cannot express
In my heart a song of love is taunting me
Melody haunting me

Sweet and lovely
Sweeter than the roses in May
And he loves me
There is nothing more I can say

There is nothing more I can say
There is nothing more I can say
There is nothing more I can say
There is nothing more I can say",Sweet and Lovely,2001
Dick Charlesworth,"Cold empty bed, springs hard as lead
Pains in my head, feel like old Ned
What did I do to be so black and blue?
 
No joys for me, no company
Even the mouse ran from my house
All my life through I've been so black and blue
 
I'm white inside, but that don't help my case
Cause I can't hide what is on my face
I'm so forlorn. Life's just a thorn
My heart is torn. Why was I born?
What did I do to be so black and blue?
 
I'm hurt inside, but that don't help my case
Cause I can't hide what is on my face
How will it end? Ain't got a friend
My only sin is in my skin
What did I do to be so black and blue?
Tell me, what did I do?
What did I do?  What did I do?
What did I do?  What did I do?
What did I do?  What did I do?
What did I do? Tell me, what did I do to be so black and blue?
What did I do to be so black and blue?",Black and Blue,1999
Dick Charlesworth,"I'm walking on air
For I left all my blue days behind
I've learned how
And there's love, really love, on my mind

I'm the world's most happy creature
Tell me what can worry be?
I'm crazy 'bout my baby
Baby is crazy 'bout me

Mr. Cupid was our teacher
That's the reason we agree
I'm crazy 'bout my baby
Baby is crazy 'bout me

Papa get that book out
Ready in your hand
Keep a steady look out
So you can understand

It's an A-one combination
With a perfect he and she
I'm crazy 'bout my baby
Baby is crazy 'bout me

",I'm Crazy 'Bout My Baby,1999
Dick Clark,"Some time ago
I wandered down into old Mexico
While I was there
I felt romance everywhere
Moon was shining bright
And I could hear laughing voices in the night
Everyone was gay
This was the start of their holiday
It was fiesta down in Mexico
And so I stopped a while to see the show
I knew that frenes meant ""Please love me""
And I could say frenes
A lovely seorita caught my eye
I stood enchanted as she wandered by
And never knowing that it come from me
I gently sighed frenes
She stopped and raised her eyes to mine
Her lips just pleaded to be kissed
Her eyes were soft as candle-shine
So how was I to resist?
And now without a heart to call my own
A greater happiness I've never known
Because her kisses are for me alone
Who wouldn't say frenes?

Bsame tu a m
Bsame igual que mi boca te bes
Dame el frenes
Qui mi locura te di
Quien si no fui yo
Pudo ensearte el camino del amor
Muerto mi altivez
Cuando mi orgullo rodo a tus pies
Quiero que vivas solo para m
Why que tu vayas por donde yo voy
Para que mi alma sea no mas de ti
Bsame con frenes
Dame la luz que tiene tu mirar
Why la ansiedad que entre tus labios vi
Esa locura de vivir why amar
Que es mas que amor frenes
Hay en el beso que te di
Alma, piedad, corazn
Dime que sabes tu sentir
Lo mismo que siento yo
Quiero que vivas solo para m
Why que tu vayas por donde yo voy
Para que mi alma sea no mas de ti
Bsame con frenes",Frenesi,2001
Dick Clark,"Lately, I find myself out gazing at stars, 
Hearing guitars like someone in love.
Sometimes the things I do astound me, 
Mostly whenever you're around me.
Lately I seem to walk as though I had wings, 
Bump into things like someone in love.
Each time I look at you, 
I'm limp as a glove, 
And feeling like someone in love.",Like Someone in Love [Live],2005
Dick Collins,"I'll never be the same
Stars have lost their meaning for me
I'll never be the same
Nothing's what it once use to be
And when the songbirds that sing
Tell me it's spring 
I can't believe their song
Once love was king but kings can be wrong
I'll never be the same
There is such an ache in my heart
Never be the same since we're apart
Though there's a lot that a smile may hide
I know down deep inside
I'll never be the same never be the same again
 
I'll never be the same
Stars have lost their meaning for me
I'll never be the same
Nothing's what it once use to be
And when the songbirds that sing
Tell me it's spring 
I can't believe their song
Once love was king but kings can be wrong
I'll never be the same
There is such an ache in my heart
Never be the same since we're apart
Though there's a lot that a smile may hide
I know down deep inside",I'll Never Be the Same,1955
Dick Collins,"Don't even go to a movie show
If you're not by my side,
I stay home by my radio,
But I'm satisfied!
All my flirtin' days are gone,
On the level from now on!

Don't go for any excitement now,
Books are my best company.
All my opinions have changed somehow,
Old-fashioned as can be!
When you really learn to care,
There's a thrill in solitaire!

Keepin' ou of mischief now,
Really am in love, and how!
I'm through playing with fire,
It's you whom I desire!

All the world can plainly see
You're the only one for me!
I've told them in advance
They can't break up our romance!
Living up to every vow,
I'm keepin' out of mischief now!

All the world can plainly see
That you're the only one for me!
Say I've told them, told them in advance
That they can't break up our romance!
Living up to every vow,
I'm keepin', keepin' out of mischief now!",Keepin' Out of Mischief Now,1955
Dick Collins,"Some day, when I'm awfully low,
When the world is cold,
I will feel a glow just thinking of you
And the way you look tonight.

Yes you're lovely, with your smile so warm
And your cheeks so soft,
There is nothing for me but to love you,
And the way you look tonight.

With each word your tenderness grows,
Tearing my fear apart
And that laugh that wrinkles your nose,
It touches my foolish heart.

Lovely, never, ever change.
Keep that breathless charm.
Won't you please arrange it?
Cause I love you 
Just the way you look tonight.

Mm, mm, mm, mm,
Just the way you look tonight",The Way You Look Tonight,2010
Dick Conte,"Never thought I'd fall,
But now I hear love call,
I'm getting sentimental over you

Things you say and do,
Just thrill me through and through,
I'm getting sentimental over you.

I thought I was happy,
I could live without love
Now I must admit,
Love is all I'm thinking of

Won't you please be kind,
And just make up your mind
That you'll be sweet & gentle,
Be gentle with me
Because I'm sentimental over you
",I'm Getting Sentimental over You,1995
Dick Conte,"You don't know what love is
'Til you've learned the meaning of the blues
Until you've loved a love you've had  to lose,
You don't know what love  is.

You don't know how lips hurt
Until you've kissed and had to pay the cost,
Until you've flipped your heart and you have lost,
You don't know what love is.

Do you know how a lost heart fears
At the thought of reminiscing,
And how lips that taste of tears
Lose their taste for kissing?
You don't know how hearts burn
For love that can, not live yet never dies.
Until you've faced each dawn with sleepless eyes,
You don't know what love is.",You Don't Know What Love Is,1995
Dick Conte,"Just friends, lovers no more
Just friends, but not like before
To think of what we've been and not to kiss again
Seems like pretending it isn't the ending
Two friends drifting apart
Two friends, but one broken heart
We loved, we laughed, we cried, and suddenly love died",Just Friends,2006
Dick Conte Trio,"Sweet and lovely
Sweeter than the roses in May
Sweet and lovely
Heaven must have sent him my way

Skies above me
Never were as blue as his eyes
And he loves me
Who would want a sweeter surprise?

When he nestles in my arms so tenderly
There's a thrill that words cannot express
In my heart a song of love is taunting me
Melody haunting me

Sweet and lovely
Sweeter than the roses in May
And he loves me
There is nothing more I can say

When he nestles in my arms so tenderly
There's a thrill that words cannot express
In my heart a song of love is taunting me
Melody haunting me

Sweet and lovely
Sweeter than the roses in May
And he loves me
There is nothing more I can say

There is nothing more I can say
There is nothing more I can say
There is nothing more I can say
There is nothing more I can say",Sweet and Lovely,2008
Dick Contino,"It's been a hard day's night, and I been working like a dog
It's been a hard day's night, I should be sleeping like a log
But when I get home to you I find the things that you do
Will make me feel alright

You know I work all day to get you money to buy you things
And it's worth it just to hear you say you're going to give me everything
So why on earth should I moan, 'cause when I get you alone
You know I feel OK

When I'm home everything seems to be right
When I'm home feeling you holding me tight, tight

It's been a hard day's night, and I been working like a dog
It's been a hard day's night, I should be sleeping like a log
But when I get home to you I find the things that you do
Will make me feel alright, ow

So why on earth should I moan, 'cause when I get you alone
You know I feel OK

When I'm home everything seems to be right
When I'm home feeling you holding me tight, tight

It's been a hard day's night, and I been working like a dog
It's been a hard day's night, I should be sleeping like a log
But when I get home to you I find the things that you do
Will make me feel alright
You know I feel alright
You know I feel alright",A Hard Day's Night,
Dick Curless,"There's been a sayin' goin' round
And I begin to think it's true
It's awful hard to love someone
When they don't care about you

Once I had a lovin' gal
The sweetest little thing in town
But now she's gone and left me
She done turn me down

Now I ain't got nobody, and nobody cares for me!
That's why I'm sad and lonely,
Won't somebody come and take a chance with me?

I'll sing you love songs, honey, all the time,
If you'll only say you'll be sweet gal of mine,
Oh, I ain't got nobody, nobody cares for me!

I'll sing you love songs, honey, all the time,
If you'll only say you'll be sweet gal of mine,
Oh, I ain't got nobody, nobody cares for me!",I Ain't Got Nobody (And Nobody Cares for Me),1966
Dick Curless,"What a beautiful thought I am thinking
Concerning a great speckled bird
Remember her name is recorded
On the pages of God's Holy Word.

All the other birds are flocking 'round her
And she is despised by the squad
But the great speckled bird in the Bible
Is one with the great church of God.

All the other churches are against her
They envy her glory and fame
They hate her because she is chosen
And has not denied Jesus' name.

Desiring to lower her standard
They watch every move that she makes
They long to find fault with her teachings
But really they find no mistake.

She is spreading her wings for a journey
She's going to leave by and by
When the trumpet shall sound in the morning
She'll rise and go up in the sky.

In the presence of all her despisers
With a song never uttered before
She will rise and be gone in a moment
Till the great tribulation is o'er.

I am glad I have learned of her meekness
I am proud that my name is on her book
For I want to be one never fearing
The face of my Savior to look.

When He cometh descending from heaven
On the cloud that He writes in His Word
I'll be joyfully carried to meet Him
On the wings of that great speckled bird.",Great Speckled Bird,1979
Dick Curless,"
I'm in love,
I'm in love,
I'm in love with a girl,
That's what's the matter with me  
I'm in love, 
I'm in love, with a beautiful girl, 
But she don't give a darn about me
to make her love me I tried,
How I sighed and I cried 
But she just refused 
And ever since she's gone away,
I've got those lovesick blues
 
Got the feeling called the ""blue hoo's,"" 
since my sweetie said ""Good Bye""
Seems I don't know what to ""Do Hoo""
All day long I sit and cry
That last long day we spent alone 
I'm yearning for it yet 
She thrilled me, filled me,
with a kind of lovin',
I never will forget, the way she called me sweet daddy"" 
Twas just a beautiful dream
 
I hate to think that it's all over I lost my heart  it seems
I got so used to her somehow
But I'm no body's baby 
Now, gee it's awful when you're lonesome 
and get those lovesick blue-oo-oo-oo-oo's 
 
Got the feeling called the ""blue hoo's,"" 
since my sweetie said ""Good Bye""
Seems I don't know what to ""Do Hoo""
All day long I sit and cry
That last long day we spent alone 
I'm yearning for it yet 
She thrilled me, filled me,
with a kind of lovin',
I never will forget, the way she called me sweet daddy
Twas just a beautiful dream
 
I hate to think that it's all over I lost my heart  it seems
i got so used to her somehow
But I'm no body's baby 
Now, gee it's awful when you're lonesome 
and get those lovesick blue-oo-oo-oo-oo's 
 
 
 
 
 
 
 
 
 
 
 
 
 
 
 
 





",Lovesick Blues,1987
Dick Curless,"Oh, oh, oh how I miss you so
Mmm, I need you so
I, I, I'd give this heart of mine
If I could see you just one time

If I could see you just one time
Oh, how it'd ease my troubled mind
If I could hold you just one time
And then pretend that you're still mine

Oh, oh, oh how I miss you so
Mmm, I need you so
I, I, I'd give this heart of mine
If I could see you just one time

Wish I could really one more time
Turn back the pages, in there I'd find
That same old love that once was mine
Wish I could see you just one time

Oh, oh, oh how I miss you so
Mmm, I need you so
I, I, I'd give this heart of mine
If I could see you just one time

Oh, oh, oh how I miss you so
Mmm, I need you so
I, I, I'd give this heart of mine
If I could see you just one time

",Just One Time,1995
Dick Curless,"The ceremony was over
A lad stood alone in tears
For he had just said goodbye
To the one he had loved through the years.
He stood all alone with his head bowed down
As though his heart would break
Then the parson came over and took his hand
And to him these words he did say.

When God comes and gathers his jewels
All his treasures of diamonds and gold
You'll meet her up there in heaven so fair
When God comes and gathers his jewels.

Each night when the pale moon is shining
You can see this lad all alone
With his eyes lifted to'ard heaven
He's repeating these words he was told.

When God comes and gathers his jewels
All his treasures of diamonds and gold
I'll meet her up there in heaven so fair
When God comes and gathers his jewels.",When God Comes and Gathers His Jewels,1995
Dick Curless,"I am a pilgrim and a stranger
Traveling through this wearisome land
And I've got a home in that yonder city, good Lord
And it's not (good Lordy it's not) not made by hand

I got a mother, a sister and a brother
Who have gone to that sweet home
And I am determined to go and see them, good Lord
Over on (good Lordy over on) that distant shore

As I go down to that river Jordan
Just to bathe my weary soul
If I could touch but just the hem of His garment, good Lord
I believe (good Lordy I believe) that it would make me whole

Now when I'm dead, laying in my coffin
All of my friends all gather round
They can say that he's just laying there sleeping, good Lord
Sweet peace (Lordy sweet peace) his soul is found",Careless Love,1996
Dick Curless,"Oh, give me land, lots of land under starry skies above
Don't fence me in
Let me ride through the wide open country that I love
Don't fence me in

Let me be by myself in the evenin' breeze
And listen to the murmur of the cottonwood trees
Send me off forever but I ask you please
Don't fence me in

Just turn me loose, let me straddle my old saddle
Underneath the western skies
On my cayuse, let me wander over yonder
Till I see the mountains rise

I want to ride to the ridge where the west commences
And gaze at the moon till I lose my senses
I can't look at hobbles and I can't stand fences
Don't fence me in

Wilcat Kelly, back in town again
Was standin' by his Sweetheart's side
And when his Sweetheart said, ""Come on, let's settle down""
Wildcat raised his head and cried

Oh, give me land, lots of land under starry skies
Don't fence me in
Let me ride through the wide open country that I love
Don't fence me in

Let me be by myself in the evenin' breeze
And listen to the murmur of the cottonwood trees
Send me off forever but I ask you please
Don't fence me in

Just turn me loose, let me straddle my old saddle
Underneath the western skies
On my Cayuse, let me wander over yonder
Till I see the mountains rise

I want to ride to the ridge where the west commences
And gaze at the moon till I lose my senses
I can't look at hobbles and I can't stand fences
Don't fence me in",Don't Fence Me In,1996
