Band,Lyrics,Song,Year
Elbow,"I walked with the river in a kind of a dream
Hand in hand the all knowing river and me
To the clamour of rushes and deeply bowing trees
And drunk making blossom that blushed to be seen

I told him my sorrows and broken down dreams
Confessed every lie
Replayed every scene
He openly wept as he listened to me

And then with the sun in the west
He showed me the sea",The River,2011
Elbow,"Best intentions bring joyless droughts
Pack your hacksaw come push me out
When your dentures prevent your smile
These adventures will fill your eyes
With love
With love

You been goin' see through, could do with a little sun
I give my liver to see you, abide and ride shotgun
A Bacchian scandal awaits me, just can't do it alone
Your sweetheart probably hates me, but I'll send you home your dome filled up
With love
With love
Fill your eyes with love
With love

Love will find you out
Be sure love will find you out
Love will find you out
Be sure love will find you out
Love will find you out
Be sure love will find you out
Love will find you out
Be sure love will find you out",With Love,2011
Elbow,"buffalo ghosts
hurtle slow on blue
the journey makes me taller
the journey brings me you",Buffalo Ghosts,2011
Elbow,"it's cooler now
an opening of the senses
she's snowy wise
lined and kind
pen in her mouth
hair in pencils

it's cooler now
an opening of the senses
it's cooler now
it's cooler now

and every bit the little girl
every bit the little girl
every bit the little girl

sunsets in her eyes

it's cooler now
an opening of the senses
she's snowy wise
lined and kind

and every bit the little girl
every bit the little girl
every bit the little girl",Every Bit the Little Girl,2012
Elbow,"the borrowed air a baby breathes
a falling helicopter seed
i forget which tree

advice from friends less drunk than me
a falling helicopter seed
i forget which tree

the borrowed air a baby yawns
a kiss that doesn't wake you up

the borrowed air a baby breathes
a falling helicopter seed
i forget which tree",Gentle As,2012
Elbow,"Paper cup of a boat
Heaving chest of the sea
Carry both of us
Carry her, carry me

From the place we were born
To the land of the free
Carry both of us
Carry her, carry me

The ocean
That bears us from our home
Could save us
Or take us for its own
The danger
That life should lead us here
My angel
Could I have steered us clear? 

Gone, the light from her eyes
With the lives that we made
Just the two of us
In the night on the waves

Moving silent her lips
By the moon's only light
Sewing silver prayers
In the blanket of night

The ocean
That bears us from our home
Could sail us
Or take us for its own
The danger
That life should lead us here
My angel
Could I have steered us clear? 

Paper cup of a boat
Heaving chest of the sea
Carry both of us
Or, swallow her, swallow me",The Blanket of Night,2014
Elbow,"All clear
Good Lord
Did well to be ignored
Your falling temperature
Like cooling kisses
All through your head
A made-up water’s edge
A summer gone on tabling fabled blisses

I’d love to see you waving
From the far side of the swim
Gathered in by a waiting troop of the open-hearted
Where colour field meets canvas
And the picture breathes you in
Where all the stories meant for you have already started

Bright girl, dead town
Walking tall but blown around
The secret chainmail gown of your father’s blessing
Bright girl, dead town
Open mouths for miles around
I still see you keeping those dough boys guessing

I’d love to see you waving
From the far side of the swim
Gathered in by a waiting troop of the open- hearted
Where colour field meets canvas
And the picture breathes you in
Where all the stories meant for you have already started

Bright girl, dead town
Bright girl, dead town
Bright girl, dead town
Open mouths for miles around
Bright girl, dead town
Bright girl, dead town
Bright girl, dead town
Bright girl, dead town
Open mouths for miles around
Bright girl, dead town",Colour Fields,2014
Elbow,"I live and die by the hot and cold in strangers' eyes
But danger lies behind the tape across my door
I know a place where angels lace the lemonade
And I cannot stay where all the broken plans were made

Broken devotion
Can I jump in the gun
And fly over the ocean
Can I jump in the gun

And string up a net across Lafayette
And sing of my deeds while I'm gone
And I'll spin some lies to tell you upon
My return from the ends of the earth

She and I would death defy and promenade
She and I were profligate as de rigeur
She and I were for a Burton Taylor made
She and I won't find another me and her

Broken devotion
Can I jump in the gun
And fly over the ocean
Can I jump in the gun

And string up a net across Lafayette
And sing of my deeds while I'm gone
And I'll spin some lies to tell you upon
My return from the ends of the earth

Oh, love, like a sundown harbor
Oh, love, like a falling bomb
Oh, my love, give her wings and armour
Oh, my love, gotta be long gone

Broken devotion
Can I jump in the gun
And fly over the ocean
Can I jump in the gun

And string up a net across Lafayette
And sing of my deeds while I'm gone
And I'll spin some lies to tell you upon
My return from the ends of the earth",Honey Sun,2014
Elbow,"I'm running out of miracles
Oh my soul
And the streets alive with one-man shows
Oh my soul
Corner boys were moved along
Oh my soul
We're plummeting like crippled crows
Oh my soul

Oh, long before
You and I were born
Others beat these benches with their empty cups
To the night and its stars
To be here, and now, and who we are

Another sunrise with my sad captains
With who I choose to lose my mind
And if it's all we only pass this way but once
What a perfect waste of time

The BMX apothecary
Oh my soul
The architect of infamy
Oh my soul
For each and every train we miss
Oh my soul
A bitter little Eucharist
Oh my soul

Oh, long before
You and I were born
Others beat these benches with their empty cups
To the night and its stars
To be here, and now, and who we are

Another sunrise with my sad captains
With who I choose to lose my mind
And if it's all we only come this way but once
What a perfect waste of time

Another sunrise with my sad captains
With who I choose to lose my mind
And if it's all we only pass this way but once
What a perfect waste of time

Another sunrise with my sad captains
With who I choose to lose my mind
And if it's all we only pass this way but once
What a perfect waste of time

What a perfect waste of time",My Sad Captains,2014
Elbow,"You have the time-worn shimmer of tarantella on a Tuscan plain
Patiently listen as dull reminiscences fall from my jaws in a jumble again
You hold a lamp to my slumber
I resurface just to do a new number on you

You kiss the wrist of the hand that has twisted itself all into your hair
You close the blinds and doors behind me and clear all obstacles on the stair
You are an open book
I’m on the bathroom floor
Yours is an open door
I’m throwing ballast overboard

You are a genius teetering
Hurricane wild be calm as the deep
Every living thing needs watering
I miss loving you
Actually loving you
Words on my bedroom wall
Speak of my stone cold care

A prayer to the take off and landing of everything
Leaving your lips as we took to the sky
And a prayer to the take off and landing of everything
I’ll say for you and I will for all time
Wrote on my bedroom wall
Spoke of your deep true care
Over my shoulder and just as I leave
I see you slipping the world up your sleeve
Well take it and run
Go on, go on
That’s why it’s there

In a prayer to the take off and landing of everything
To the take off and landing of everything
To the take off and landing of everything good
In a prayer to the take off and landing of everything
To the take off and landing of everything
To the take off and landing of everything good

In a prayer to the take off and landing of everything
To the take off and landing of everything
To the take off and landing of everything good
In a prayer to the take off and landing of everything
To the take off and landing of everything
To the take off and landing of everything good

In a prayer to the take off and landing of everything
To the take off and landing of everything
To the take off and landing of everything good
In a prayer to the take off and landing of everything
To the take off and landing of everything
To the take off and landing of everything good

In a prayer to the take off and landing of everything
To the take off and landing of everything
To the take off and landing of everything good
In a prayer to the take off and landing of everything
To the take off and landing of everything
To the take off and landing of everything good",The Take Off and Landing of Everything,2014
Elbow,"This blue world and her countless sisters
And all that came before that day
Our atoms straining to align
Was the universe in rehearsal for us

When all the world is sucking on its sleeve
You'll hear an urgent morse in the gentle rain
And if you plot your course on the windowpane
You'll see the coldest star in the arms of the oldest tree
And you'll know to come to me

In the back of a broken car
When the blizzard blossom flew
Reading aloud with our fingers
What we both already knew

And the blizzard blossom flew
And the blizzard blossom flew

When all the world is sucking on its sleeve
You'll hear an urgent morse in the gentle rain
And if you plot your course on the windowpane
You'll see the coldest star in the arms of the oldest tree
And you'll know to come to me

A sober midnight wish flies over the roofs and down through the years
Hope that you and yours are sleeping
Safe and warm in size formation
While three chambers of my heart beat true and strong with love for another
The fourth, the fourth is yours forever",This Blue World,2014
Elbow,"I am electric with a bottle in me
Got a bottle in me
And glory be, these fuckers are ignoring me
I'm from another century

I am a preacher when I've got it on me
And I've got it on me
And glory be these fuckers are ignoring me
We never learn from history

Hey, I am the beau who loved her so in every song
And I designed that little mystery on your tongue
I've broken jaws protecting laws to keep you free
I've made your day so take a seat by me

I am an old tree, gonna talk my jaw free
Someone come and get me
Another night beside myself would finish me
Give us G&T and sympathy

I am the die hard with an empty dance card propping up a young bar
I'm pouring oil in double time upon the troubled rising tide inside of me
Upon my history

Hey, I am the beau who loved her so in every song
And I design that little mystery on your tongue
I've broken jaws protecting laws to keep you free
I made your day so take a seat by me

Hey
Hey
Hey
Hey

Hey, I am the boy who loved her so in every song
And I design that little mystery on your tongue
I've broken jaws protecting laws to keep you free
I've made your day so take a seat by me",Charge,2014
Elbow,"It's a lethal ballet
Air traffic congestion
I'm having a baby
Second thoughts, scotch, dinner
And someone's dancing on the box
A former MP
And no one was watching

My oldest friends are a serious habit
Fly boy blue, so bring your faces home
To my sweet trampoline
And acres of crash site love

Someone's dancing on the box
A former MP
And no one was watching
My oldest friends are a serious habit
Fly boy blue, so bring your faces home
To my sweet trampoline
And acres of crash site love

Presidential delays
Suppose I'm just lucky
I'm having a shindig
Me, Red Bob and The Ivory Host
And someone's shouting on the box
A chinless prefect gone Godzilla
My newest friends have forgotten my name
But so have I, so far so good and home
You and me trampoline and oceans of crash site love

What can be said of the cigarettes smoked
A prop for a joke or a mark on the clock
If I stopped would the bus ever come
Would the dawn ever kiss me, forgiven me, knowing what's done
Would the drivel make scribble make sense and then song
Would the woodbines denied like the northern man's thumbs
Perverse as it may sound I sometimes believe
The tip to my lips just reminds me to breathe

What can be said of the whiskey and wine
Random abandon or ballast for joy
That was scuppered with trust, little more than a boy
And besides I'm in excellent company
I'm reaching the age when decisions are made
On life and living and I'm sure last ditch
That'll I'll ask for more time
But mother forgive me
I'll still want a bottle of good Irish whiskey and a bundle of smokes in my grave

But there isn't words yet for the comfort I get
From the gentle lunette at the top of the nape of the neck that I wake to

And where are the words for the leap in my chest
When mischief appears either side of the scar on your nose
Made by a rose thorn, so you claim
By a rose thorn",Fly Boy Blue/Lunette,2014
Elbow,"The first to put a simple truth in words
Binds the world in a feeling all familiar
'Cause everybody owns the great ideas
And it feels like there's a big one round the corner

Antenna up and out into New York
Somewhere in all that talk is all the answers
And oh, my giddy aunt, New York can talk
It's the modern Rome where folk are nice to Yoko

Every bone of rivet steel, each corner stone and angle
Jenga jut and rusty water tower, pillar, post and sign
Every painted line and battered ladder building in this town
Sings a life of proud endeavor and the best that man can be

Me, I see a city and I hear a million voices
Planning, drilling, welding, carrying their fingers to the nub
Reaching down into the ground, stretching up into the sky
Why? Because they can, they did and do so you and I could live together

Oh my God, New York can talk
Somewhere in all that talk is all the answers
Everybody owns the great ideas
And it feels like there's a big one round the corner

Oh my God, New York can talk
Somewhere in all that talk is all the answers
Everybody owns the great ideas
And it feels like there's a big one round the corner

Oh my God, New York can talk
Somewhere in all that talk is all the answers
Everybody owns the great ideas
And it feels like there's a big one round the corner

The desire to part sure symphony
The desire like a distant storm
For love, be good for me
And it feels like there's a big one round the corner

Oh my God, New York, you talk
Somewhere in all that talk is all the answers
Everybody owns the greats ideas
And it feels like there's a big one round the corner

The way the day begins
Decides the shade of everything
But the way it ends depends on if you're home
For every soul, a pillow at a window, please
In a modern Rome where folk are nice to Yoko",New York Morning,2014
Elbow,"If you wake in the quake and the roll of the heartbroken
Pounding the ground in a sawn off ballet
Bring us in an indigo dawn with the lovelorn and renegade

You always found peace in the grip of the beat, darling
Time alone with the pounding of your heart
As it starts to heal you'll find a better mirror in another

You have never known dumbfounded
So out of reach and hollowed through
Blue and white the light and sound surrounding
As the music pulls you through
And on that hallelujah morning
In the arms of new love, the peace that you feel's real life

Go straight to the place where you first lost your balance
And find your feet with the people that you love
And bring us in an indigo dawn with the lovelorn and renegade
Yes you with the eyes ever met not forgotten
Get hold of the night that rises in your blood
Focus on your pulse, focus on your breath, know that we're never far away

You have never known dumbfounded
So out of reach and hollowed through
Blue and white the light and sound surrounding
As the music pulls you through
And on that hallelujah morning
In the arms of new love, the peace that you feel's real life

Angel
Angel
Angel
Angel

You with the eyes ever met not forgotten
You with the arms for the lonely whoever
You with the laugh that could bring down a tenement
Talking your way through the heart of the citadel
Up on the tables, or shouldering strangers, or
Under my arms we add to the waterfall
My little sister with brothers in common
You never need fear a thing in this world while
I have a breath in me, blood in my veins
You never need fear thing in this world while
I have a breath in me, blood in my veins
You never need fear a thing in this blue world

You have never known dumbfounded
So out of reach and hollowed through
Blue and white the light and sound surrounding
As the music pulls you through
And on that hallelujah morning
In the arms of new love, the peace that you feel's real life

Angel
Angel",Real Life (Angel),2014
Elbow,"Angels freezing
Inner city rose garden
Click their way back home
 
You’d done your leaving
Livid in your splendour
And alone
I kissed the stillness
 
And it snowed
 
The teeth of this town
Left holes in the ground
Brimming with sound
And spiralling down
Singing their lies
And rationing praise
The friends that I'd find
On this of all days
 
But it snowed",And It Snowed,2015
Elbow,"I’m easy to read
Hands of a coal miner
Trunk of a tree
Treat myself worse than my worst enemy
Looking for someone to tangle with me
Searching the earth like a lost worker bee

Out in the world 
I know that somewhere
A hard drinking girl
With kindness in reservoirs
Looks to the sea
Or scours the underground looking for me
Come be the queen to my lost worker bee

All these promises of gold but where is my soul
Overseas in England I know

I’m bust at the seams 
Plastered in Paris
Or hanging my dreams
From the wind farms of Lancashire
Throw me a line
I’ll give you my everyday
Read me the scene
The scene with the queen 
And the lost worker bee",Lost Worker Bee,2015
Elbow,"Roll Call
Run to rent the empty air

I’m not digging deep tonight
The street’s alive with one man shows
Should have stayed in the Dutchman’s place
That’s the last I trust my nose

Unsurprising dashed advances
Way too fucked to be flinging woo
And I’m mountain high and fizzing with fantasy blue
Trying to find you 

Circumnavigate the plaza
Hermit crab men do the swerve
Murder Maid and Abdominal Showman
Find the romance they deserve

God of taxi laughing at me
Bonhomie flowing down the drain
And the river deep singing you’re never sleeping again
And I’m trying to find you

When I’m lost at sea
On the crested white tops
My cavalry
With arms for forever
Come scooping me up
Like a kid in a bath towel
Smoothing my feathers
With arms for forever",Roll Call,2015
Elbow,"Hotel in my hometown
The saddest room I ever woke in
“Try to enjoy yourself out there”
The saddest words you've ever spoken
The jangle in the taxi cab
Usually bright so hollow
The saddest journey ever made
Begins today and ends tomorrow

Ten miles a minute click 
Sadly through the avionics
At thirty thousand feet
The saddest gins 
The saddest tonics
The fella next to me up there 
An Eton educated broker
The happiest man you'll ever meet
Sadly I’m not even joking",Usually Bright,2015
Elbow,"What time do you call this?
What time do you call this?
What time do you call this?
What time do you call this?

What time do you call this?
I've been craning, bewildered all my days
To now find your face
Shining out of the crowd

Love was just a word
That friends didn't mention
'Cause love was just a joke
'Til it battered me senseless

Oh, shrink with me, tower with me
Wither with me, flower with me
Endlessly follow me
Chew me up and swallow me

Stay at least for now with me
Drink and dance and row with me
Tell me when I go too far
Stay precisely where you are

(What time do you call this?)
Call me out on all my lies
Halt my ticker with those eyes
(What time do you call this?)
Weather every winter while
Check my spelling, ring my bell
(What time do you call this?)
Don't expect endless sex
Check my spelling, ring my neck
(What time do you call this?)
Separate me from my breath
Kiss me nearly half to death, oh
(What time do you call this?)

What time do you call this?
What time do you call this?
What time do you call this?
What time do you call this?
What time do you call this?

What time do you call this?
What time do you call this?
What time do you call this?
What time do you call this?
What time do you call this?
What time do you call this?
What time do you call this?
What time do you call this?
What time do you call this?
What time do you call this?
What time do you call this?
What time do you call this?
What time do you call this?
What time do you call this?
What time do you call this?
What time do you call this?
What time do you call this?
What time do you call this?",What Time Do You Call This?,2015
Elbow,"This is where
This is where the bottle lands
Where all the biggest questions meet
With little feet stood in the sand

And this is where
The echoes swell to nothing on the tide
And where a tiny pair of hands
Finds a sea-worn piece of glass
And sets it as a sapphire in her mind

And there she stands
Throwing both her arms around the world
The world that doesn't even know
How much it needs this little girl

It's all gonna be magnificent, she says
It's all gonna be magnificent

This is where it all began
To light your mother's cigarette
And to go to touch her hand
And my heart
There defrosting in a gaze
Wasn't built to be that way
Suddenly I understand

There on the sand
Throwing both her arms around the world
The world that doesn't even know
How much it needs this little girl

It's all gonna be magnificent, she says
It's all gonna be magnificent
She says
It's all gonna be magnificent
She says, it's all gonna be magnificent

The echoes slow
The bottle lands
The echoes slow
And there she stands",Magnificent [She Says],2016
Elbow,"Once there was a way
To get back homeward
Once there was a way
To get back home

Sleep, pretty darling, do not cry
And I will sing a lullaby

Golden slumbers fill your eyes
Smiles awake you when you rise
Sleep, pretty darling, do not cry
And I will sing a lullaby
And I will sing a lullaby

Once there was a way
To get back homeward
Once there was a way
To get back home

Sleep, pretty darling, do not cry
And I will sing a lullaby

Golden slumbers fill your eyes
Smiles awake you when you rise
Sleep, pretty darling, do not cry
And I will sing a lullaby",Golden Slumbers,2017
Elbow,"Had a circular saw blade
Where I should have had a heart
(You kept your boat afloat for so long)
I was trusted, I adored her
And I tore it all apart
(I saw you try and stop the sunset on your own)

Twin moons on a millpond
From a tumbledown barn
(Are forever wrought in ancient silver gravity)
I can still taste the heat of the sun on her skin in my arms

I could fold to the cold of these
January streets
(Keep a hand around the fickle flame of morning after)
But your smile in the half-light is
Pure pillow print cheek
(An angel tangled in the very cloths of heaven)
We'll be far away for a while
But my heart’s staying put
Warming and guarding and guiding
The one that I love

The silence and the waiting and the rush of all aboard
Fifty souls to a carriage I’m trying hard to be ignored
Then my telephone shakes into life and I see your name
And the wheat fields explode into gold either side of the train
And the wheat fields explode into gold either side of the train
And the wheat fields explode into gold",Kindling (Fickle Flame),2017
Elbow,"(Who am I to tell you to care less)
(Wish I'd have met you, never forget)

Young man with a bruised old soul
One snap to bring you back
Hands black with smudging the night into day
There's lemon and thyme in the alley, you could slip away
But there are still fences to squeeze through
And I'll reach you, spirits decanted

Come to the river son
Let your obsession go
What does it prove if you die for a tune
It's really all disco
Everything
Everything

Let's join the yellow eyed snuck flies
Rejoicing in choices they made
Let's be the burned laughing at not having learned
Let's be a hundred and five you and I
And sing out a tune of regret to the moon
Perverted old-timers
I'll feed you one-liners

Come to the river son
Let the obsession go
What does it prove if you die for a tune
It's really all disco
What does it prove if you die for a tune
Don't you know it's all disco
Everything

I can hear how deep you're going
Pull the cord
I can feel your tempo slowing
Pull the cord

Come to the river son
Let your obsession go
What does it prove if you die for a tune
It's really all disco
What does it prove if you die for a tune
Don't you know it's all disco
Everything
Everything",All Disco,2017
