Band,Lyrics,Song,Year
Victoria Hart,"Tax man's taken all my dough
And left me in my stately home
Lazing on a sunny afternoon
And I can't sail my yacht
He's taken everything I've got
And all I've got's this sunny afternoon

Save me, save me, save me from this squeeze
I gotta big fat mama tryin' to break me
But I love to live so pleasantly, live this life of luxury
Lazing on a sunny afternoon
In the summertime, in the summertime

My boyfriend's run off with my car
And gone back to his ma and pa
Telling tales of drunkenness and cruelty
I am sitting here, sipping on my ice cold beer
Lazing on a sunny afternoon

Help me, help me, help me sail away
Oh, give me two good reasons why I oughta stay
'Cause I love to live so pleasantly, live this life of luxury
Lazing on a sunny afternoon
In the summertime, in the summertime

Save me, save me, save me from this squeeze
I gotta big fat mama tryin', oh tryin' to break me
'Cause I love to live so pleasantly, live this life of luxury
Lazing on a sunny afternoon, yeah
In the summertime, in the summertime
In the summertime, in the summertime

In the summertime, in the summertime
In the, in the, in the summertime
In the summertime

",Sunny Afternoon,2007
Victoria Horn,"Under my soul, I hide, chasing emotions
Can't you see?
If I let it go, will we reveal a sign of devotion?
All you feel

Sometimes there's a moment
Sometimes we don't see
Now we stand to frighten, scared to believe

Now I wait for you
Till you wake me, from my sleep
And I'll wait for you
Let my voice be, yours to keep

The touch of your hand, on me
A night everlasting, comes too deep
Don't make me wait, for what I need
This passion is burning, deep in me

Sometimes there's a moment
Sometimes we don't see
Now we stand to frighten, scared to believe

Now I wait for you
Till you wake me, from my sleep
And I'll wait for you
Let my voice be, yours to keep

Now I wait for you
Till you wake me, from my sleep
And I'll wait for you
Let my voice be, yours to keep

Wait for you
Wait for you

",Wait for You (Song for the Ocean),2003
Victoria Horne,"The dark is filled with dreams
So many dreams, which one is mine?
One must be right for me

Which dream of all the dreams
When there's a dream for every star
And there are oh so many stars, so many stars

The wind is filled with songs
So many songs, which one is mine?
One must be right for me

Which song of all the songs
When there's a song for every star
And there are oh so many stars, so many stars

Along the countless days, the endless nights
That I have searched so many eyes
So many hearts, so many smiles

Which one to choose, which way to go?
How can I tell, how will I know out of
Oh, so many stars, so many stars?

Along the countless days, the endless nights
That I have searched so many eyes
So many hearts, so many smiles

Which one to choose, which way to go?
How can I tell, how will I know out of
Oh, so many stars, so many stars?
So many stars, so many stars, so many stars",So Many Stars,2005
Victoria Jackson,"Listen, big boy
Now that you got me made
Goodness, but I'm afraid
Somethin's gonna happen to you

Listen, big boy
You gotta be hooked, and how
I would die if I should lose you now

Button up your overcoat
When the wind is free
Take good care of yourself
You belong to me

Eat an apple every day
Get to bed by three
Oh, take good care of yourself
You belong to me

Be careful crossing streets, ooh, ooh
Cut out sweets, ooh, ooh
Lay off meat, ooh, ooh
You'll get a pain and ruin your tum-tum

Wear your flannel underwear
When you climb a tree
Oh, take good care of yourself
You belong to me

Button up your overcoat
When the wind is free
Oh, take good care of yourself
You belong to me
Boop-boop-a-doop

When you sass a traffic cop
Use diplomacy
Just take good care of yourself
You belong to me

Beware of frozen funds, ooh, ooh
Stocks and bonds, ooh, ooh
Dockside thugs, ooh, ooh
You'll get a pain and ruin your bankroll

Keep the spoon out of your cup
When you're drinking tea
Oh, take good care of yourself
You belong to me

Don't sit on hornet's tails, ooh, ooh
Or on nails, ooh, ooh
Or third rails, ooh, ooh
You'll get a pain and ruin your tum-tum

Keep away from bootleg hooch
When you're on a spree
Oh, take good care of yourself
You belong to me",Button up Your Overcoat,1995
Victoria Justice,"Are you listening? Hear me talk, hear me sing
Open up the door, easy less, easy more
When you tell me to beware, are you here? Are you there?
Is it something I should know? Easy come, easy go

Nodding your head, don't hear a word I said
Can't communicate, when you wait, don't relate
I try to talk to you but you never even knew
So what's it gonna be, tell me, can you hear me?
(Hear me, can you hear me?)

I'm so sick of it, your attention deficit
Never listen, you never listen
I'm so sick of it, so I'm throwing on a fit
Never listen, you never listen

I scream your name, it always stays the same
I scream and shout
So what I'm gonna do now is freak the freak out, hey
Whoa oh oh, whoa oh oh, whoa oh oh, whoa oh oh oh

Patience running thin, running thin, come again
Tell me what I get opposite, opposite
Show me what is real, if it breaks does it heal?
Open up your ear, why you think that I'm here?
Keep me in the dark are you even thinking of me?

And someone else above me gotta know, gotta know
What am I gonna do? 'Cause I can't get through to you
So what's it gonna be
Tell me, can you hear me?

I'm so sick of it, your attention deficit
Never listen, you never listen
I'm so sick of it so I'll throw another fit
Never listen, you never listen

I scream your name, it always stays the same
I scream and shout
So what I'm gonna do now is freak the freak out, hey
Whoa oh oh, whoa oh oh, whoa oh oh, whoa oh oh oh

Easy come, easy go
Easy come, easy go
(Can you hear me?)

I scream your name, it always stays the same
I scream and shout
So what I'm gonna do now is freak the freak out, hey
Whoa oh oh, whoa oh oh, whoa oh oh, whoa oh oh oh

I scream your name but you never listen
No, you never listen but you never listen",Freak the Freak Out,2010
Victoria Justice,"I thought that dreams belonged to other men
'Cause each time I got close they'd fall apart again
I feared my heart would be in secrecy
I faced the nights alone
Oh how could I have known
That all my life I only needed you?

Oh, almost paradise
We're knocking on heaven's door
Almost paradise
How could we ask for more?
I swear that I can see forever in your eyes
Paradise, yeah it's paradise

It seems like perfect love's so hard to find
I'd almost given up, you must've read my mind
And all these dreams I saved for a rainy day
They're finally coming true
you know, I'll share them all with you
'Cause now we hold the future in our hands

oh, oh almost paradise we're knocking on heaven's door
Almost paradise
How could we ask for more?
I swear that I can see forever in your eyes
Paradise, oh paradise

And in your arms salvation's not so far away
It's getting closer, closer every day
Almost paradise
We're knocking on heaven's door
Almost paradise
How could we ask for more?
I swear that I can see forever in your eyes
Paradise, oh it's paradise

Paradise, yes it's paradise
Paradise",Almost Paradise,2011
Victoria Justice,"I feel delirious, come let's get out of here
We're so anonymous but it's all coming clear
We're heading for the sky
And we'll get lost in it 'cause
All I want, all I want, all I want
Is everything

And I will pose if I wanna
And I will vogue like Madonna
I might not dance like M.J, R.I.P.
But I will give the best of me

All I want is everything
Yes everything too much is not enough
I'm sick of settling for in between
And I'm not givin' up
As long as it feels right
At least we know that we're alive
All I want is everything, yes everything, yeah
Whoa-oh, whoa-oh

We don't ever stop
Let's watch the sun come up
We'll sleep when we're dead 'cause
Halfway kinda sucks
We're heading for the sky
And we'll get lost in it 'cause
All I want, all I want, all I want is everything

And I will pose if I wanna
And I will vogue like Madonna
I might not dance like M.J, R.I.P.
But I will give the best of me

All I want is everything
Yes everything too much is not enough
I'm sick of settling for in between
And I'm not givin' up
As long as it feels right
At least we know that we're alive
All I want is everything, yes everything, yeah
Whoa-oh, whoa-oh

Hold on to me
And I'll hold on to you (oh, oh)
Don't over think
What have we got to lose
It's me and you,
Me and you no matter what
Whoa oh ah oh whoa oh oh whoa

We're heading for the sky
And we'll get lost in it 'cause
All I want, all I want, all I want is everything

And I will pose if I wanna
And I will vogue like Madonna
I might not dance like M.J, R.I.P.
But I will give the best of me

All I want is everything
Yes everything too much is not enough
I'm sick of settling for in between
And I'm not givin' up
As long as it feels right
At least we know that we're alive
All I want is everything, yes everything, yeah
Whoa-oh, whoa-oh",All I Want Is Everything,2011
Victoria Justice,"You had it all
The day you told me
Told me you want me
I had it all
But let you fool me
Fool me completely

Yeah I was so stupid
To give you all my attention
'Cause the way you played me
Exposed your true intention

'Cause one day
I'll have you beggin' on your knees for me
Yeah one day
I'll have you crawling like a centipede
You mess with me
I'll mess with her
So I'll make sure you get what you deserve
Yeah one day
You'll be beggin' on your knees for me

So watch your back
'Cause you don't know when or where I could get you
I've set the trap and when I am done
Then you'll know what I've been through
So oh mister player do you feel like the man now
And I bet you're nervous 'cause this song makes you freak out

'Cause one day
I'll have you beggin' on your knees for me
Yeah one day
I'll have you crawling like a centipede
You mess with me
I'll mess with her
So I'll make sure you get what you deserve
Yeah one day
You'll be beggin' on your knees for me

I know I'm being bitter
But I'mma drive you under
'Cause you just don't, don't deserve happy ever after
But what you did to me, after you told me
You never felt that way it was only just a game

You had it all
And one day

And one day
I'll have you beggin' on your knees for me
(Beggin' on your knees for me)
Yeah one day
I'll have you crawling like a centipede
(Crawling like a centipede)
You mess with me
I'll mess with her
So I'll make sure you get what you deserve
Yeah one day
You'll be beggin' on your knees for me",Beggin' on Your Knees,2011
Victoria Justice,"I call you up when I know he's at home,
I jump out of my skin when he picks up the phone
Why can I tell if he's looking at me?
Should I give him a smile?
Should I get up and leave?

I know it's strange, I don't know what I'm thinking
But is it wrong if I see him this weekend?
I really hope I can get him alone
I just don't, don't want her to know

Yeah-eeh, yeah-eeh, yeah-eeh, yeah yeah
My best friend's brother is the one for me
Yeah-eeh, yeah-eeh, yeah-eeh, yeah yeah
A punk rock drummer and he's six foot three
I don't want to but I want to
'Cause I just can't get him out of my mind, and
Yeah-eeh, yeah-eeh, yeah-eeh, yeah yeah
My best friend's brother is the one for me
B-F-B, B-F-B
My best friend's brother, my best friend's brother

I kinda think that I might be his type
'Cause when you're not around
He's not acting too shy
Sometimes I feel like he might make a move
Is this all in my head?
I don't know what to do

I know it's strange, I don't know what he's thinking
But it is wrong if I see him this weekend
I really hope I can get him alone
I just don't, don't want her to know

Yeah-eeh, yeah-eeh, yeah-eeh, yeah yeah
My best friend's brother is the one for me
Yeah-eeh, yeah-eeh, yeah-eeh, yeah yeah
A punk rock drummer and he's six foot three
I don't want to but I want to
'Cause I just can't get him out of my mind, and
Yeah-eeh, yeah-eeh, yeah-eeh, yeah yeah
My best friend's brother is the one for me
B-F-B, B-F-B
My best friend's brother, my best friend's brother
B-F-B, B-F-B
My best friend's brother, my best friend's brother

'Cause he's such a dream, yeah
And you'd know what I mean
If you weren't related

Yeah-eeh, yeah-eeh, yeah-eeh, yeah yeah
My best friend's brother is the one for me
Yeah-eeh, yeah-eeh, yeah-eeh, yeah yeah
A punk rock drummer and he's six foot three
I don't want to but I want to
'Cause I just can't get him out of my mind, and
Yeah-eeh, yeah-eeh, yeah-eeh, yeah yeah
My best friend's brother is the one for me
B-F-B, B-F-B
My best friend's brother, my best friend's brother
B-F-B, B-F-B
My best friend's brother, my best friend's brother",Best Friend's Brother,2011
Victoria Justice,"Suddenly, my choice is clear
I knew when only you and I were standing here

Well that money isn't worth a thing
If you didn't earn it, you don't deserve it
True love doesn't cost a thing
And if you try to buy it, you can't return it

No no no oh oh

Your friends are doing all the same things
And my friends say look at what you're wasting
Well it doesn't matter if we change their minds
Suddenly I can see what I didn't before
And I don't care what they say anymore
'Cause I'm falling, falling
Finally falling, falling

I don't need all the finer things
Diamond rings and nothing so show me something
'Cause love is all I need, all I ever wanted
And now I've got it (Yeah yeah yeah yeah yeah)

And my friends are wondering what you're thinking
And your friends probably think the same thing
But it doesn't matter if we change their minds

Suddenly I can see what I didn't before
And I don't care what they say anymore
'Cause I'm falling, falling
Finally falling, falling

If you can't find love when you're in it
Just forget it
It would change your mind once you get it
Don't you get it, 'cause we did it
Yeah we did it, well we did it

Suddenly I can see what I didn't before
And I don't care what they say anymore
'Cause I'm falling, falling
Finally falling, falling

Suddenly I can see what I didn't before
And I don't care what they say anymore
'Cause I'm falling, falling
Finally falling, falling
Finally falling, falling
Finally falling, falling",Finally Falling,2011
Victoria Justice,"Oh ho whoa oh
Let me tell ya now

When I had you to myself
I didn't want you around
Those pretty faces always made you stand out in a crowd
But someone picked you from the bunch
One glance was all it took
Now it's much too late for me to take a second look

Oh baby give me one more chance
(Show you that I love you)
Won't you please let me
(Back in your heart)
Oh darlin' I was blind to let you go
(Let you go baby)
But now since I see you in his arms
(I want you back)
Yes I do now
(I want you back)
Ooh ooh baby
(I want you back)
Ya ya ya ya
(I want you back)
Na na na na

Tryin' to live without your love
Is one long sleepless night
Let me show you girl
That I know wrong from right
Every street you walk on
I leave tear stains on the ground
Following the girl
I didn't even want to run
Let me tell you now

Oh baby all I need is one more chance
(Show you that I love you)
Won't you please let me
(Back to your heart)
Oh darlin' I was blind to let you go
(Let you go baby)
But now since I see you in his arms
Oh whoa oh

A buh buh buh buh
All I want
A buh buh buh buh
All I need
A buh buh buh buh
All I want
A buh buh buh buh
All I need

Oh just one more chance
To show you that I love you
Baby, baby, baby, baby, baby
Ooh I want you back

Forget what happened then
I want you back
Let me live again

Oh baby I was blind to let you go
But now since I see you in his arms
(I want you back)
Spare me of this cause
(I want you back)
Gimme back what I lost

Oh baby I need one more chance ha
I tell ya that I love you
Now baby, ow, baby, ow, baby
I want you back
I want you back
I want you back
I want you back",I Want You Back,2011
Victoria Justice,"I know, you see
Somehow the world will change for me
And be so wonderful

Here I am
Once again
Feeling lost, but now and then

Live life
Breathe air
I know somehow we're going to get there
And feel so wonderful

When you figure out how
You're lost in the moment, you disappear
It's all for real
I'm telling you just how I feel

You don't have to be afraid to put your dream in action
You're never gonna fade, you'll be the main attraction
Wake up the members of the nation it's your time to be
Not a fantasy (not a fantasy)
Just remember me (just remember me)
When it turns out right (when it turns out right)

'Cause there's no chance unless you take one
And the time you see
Now if you live in your imagination
Tomorrow you'll be everybody's fascination
You see the brighter side of every situation

In my victory (in my victory)
Just remember me
When I make it shine
Leave it all to me
Leave it all to me
When I make it shine
leave it all to me

When you live in your imagination
(Leave it all to me)
When I make it shine

Leave it
Make it
Leave it
Make it
Leave it
Make it
Leave it
All the way

When I make it shine
Just leave it all to me",Leave It All to Shine,2011
Victoria Justice,"Here I am once again
Feeling lost but now and then
I breathe it in to let it go
And you don't know where you are now
What it would come to
If only somebody could hear
When you figure out how
You're lost in the moment
You disappear

You don't have to be afraid to put your dream in action
You're never gonna fade you'll be the main attraction
Not a fantasy, just remember me
When it turns out right

'Cause you know that if you live in your imagination
Tomorrow you'll be everybody's fascination
In my victory just remember me
When I make it shine

Reaching high feeling low
I'm holding on and letting go
I like to shine I'll shine for you
And it's time to show the world how
It's a little bit closer as long as I'm ready to go
All we have is right now
As long as you feel it inside you know

You don't have to be afraid to put your dream in action
Your never gonna fade you'll be the main attraction
Not a fantasy just remember me
When it turns out right

'Cause you know that if you live in your imagination
Tomorrow you'll be everybody's fascination
In my victory just remember me
When I make it shine

Everyone can tell you how it's all been said and done
That harder times will change your mind
And make you wanna run
But you want it and you need it
Like you need to breathe the air
If they doubt you, just believe it
That's enough to get you there

You don't have to be afraid to put your dream in action
Your never gonna fade you'll be the main attraction
Not a fantasy just remember me
When it turns out right

'Cause you know that if you live in your imagination
Tomorrow you'll be everybody's fascination
In my victory just remember me
When I make it shine",Make It Shine (Victorious Theme),2011
Victoria Justice,"Oh yeah yeah
The situation turned around enough to figure out
That someone else has let you down
So many times I don't know why
But I know we can make it as long as you say it

So tell me that you love me yeah
And tell me that I take your breath away
Maybe if you take one more than I would know for sure
There's nothing left to say
Tell me that you love me anyway

So tell me that you love me anyway
Whoa whoa oh oh
Waking up beside yourself and what you feel inside
Is being shared with someone else
Nowhere to hide I don't know why
But I know we can make it
As long as you say it

So tell me that you love me yeah
And tell me that I take your breath away
Maybe if you take one more than I would know for sure
There's nothing left to say
But tell me that you love me anyway

Show me look what we found turn it around every day
I can hear what you say
Now I know why know we can make it
If tell me that you love me yeah
And tell me that I take your breath away
Maybe if you take one more

So tell me that you love me yeah
And tell me that I take your breath away
Maybe if you take one more than I would know for sure
There's nothing left to say
Tell me that you love me anyway",Tell Me That You Love Me,2011
Victoria Justice,"I don't want to make a scene
I don't want to let you down
Try to do my own thing
And I'm starting to figure it out
That it's alright
Keep it together wherever we go
And it's alright, oh well, whatever
Everybody needs to know

You might be crazy
Have I told you lately that I love you?
You're the only reason that I'm not afraid to fly
And it's crazy that someone could change me
Now no matter what it is I have to do, I'm not afraid to try
And you need to know that you're the reason why

I don't even care when they say
You're a little bit off
Look me in the eye, I say
I could never get enough
'Cause it's alright
Keep it together wherever we go
And it's alright, oh well, whatever
Everybody needs to know

You might be crazy
Have I told you lately that I love you?
You're the only reason that I'm not afraid to fly
And it's crazy that someone could change me
Now no matter what it is I have to do, I'm not afraid to try
And you need to know that you're the reason why

If it was raining, you would yell at the sun
Pick up the pieces when the damage is done
You say it's just another day in the shade
But look at what a mess we made

You might be crazy
Have I told you lately that I love you?
You're the only reason that I'm not afraid to fly
And it's crazy that someone could change me
Now no matter what it is I have to do, I'm not afraid to try
And you need to know that you're the reason why

You might be crazy
Have I told you lately that I love you?
You're the only reason that I'm not afraid to fly
And it's crazy that someone could change me
Now no matter what it is I have to do, I'm not afraid to try
And you need to know that you're the reason why",You're the Reason,2011
Victoria Justice,"Carolers singing
Sleigh bells are ringing
It's that time of year
Everyone's toasting
Chestnuts are roasting
Christmas time is near

Something's missing and I'm wishing
Wishing that you knew
How much it would mean to spend this
Christmas time with you
So if you feel it coming
On this special day
Just trust your heart
Don't let your head get in the way

'Cause it's Christmas
And the start of something new
Oh it's Christmas
And I hope you will feel it too

Candy canes and mistletoe
Jack Frost nipping at your nose 
But all of it means nothing
Without you

Just for a minute, you get a feeling.
Look up in the sky.
Santa's here, so get in the spirit.
Just give it a try.
Children beaming and I'm dreaming
Hoping that it's true.
'Cause it would mean so much to spend this Christmas time with you!

So if you feel it comin'
On the special day, just trust your heart 'cause I can't wait to hear you say
That it's Christmas!
And the start of something new.
Well it's Christmas, and I hope you will feel it too.

Everyone together sing.
Silver bells, and golden rings.
But all of it means nothing,
Without you. (No no no)
It's not Christmas without you-you-you [x3]
It's not Christmas without you.",It's Not Christmas Without You,2012
Victoria Justice,"You know I flaunt cha, cause' girl I really want cha
And you looking nice, got me cooler than a bag of ice
Now freeze, freeze, freeze, now go
Drop it fast and move it real slow, oh!
What, you smell so fruity
I'm a pirate and you're my booty (arg)
So move it in close
And let me have my daily dose (uhhh)
Girl, I've been thinking about you, thinking about me
What you think about it?

Five fingers to the face
Five fingers to the face
Five fingers to the face
Five fingers to the face

I love Martina, Vanessa, and Georgina
It's a ladies choice, so Ima' make sure to make some noise (oh)
And now we're sweating, got my turbo engine revving
They stop and stare, all the haters think it's just not fair
That I'm six foot one and I'm tons of fun
And I'm about to put this club in gear
So fellas grab a cup, what
All my ladies you know what's up, yeah
Put your hands to the sky if you're feeling fly, and tell me that you, what
Cause' I'm the man in charge, and ya know I'm living large
I got a big white house and a fancy yacht, and a garage full of classic cars
What you talking bout' boy, oh calm down
I know you don't think you can just come up in here and buy me!
Come on, you know what I got for you

Five fingers to the face
Five fingers to the face
Five fingers to the face
Five fingers to the face
Oh yeah!",5 Fingaz to the Face,2012
