Band,Lyrics,Song,Year
Ben Harper,"I see your mouth moving
But there's a circus coming out
Always busy proving
What the world is all about
It's no use looking you in the eye
I don't believe a word you say

Blame it on hard living
Blame it on the times
Blame it on the victims
All stumbling behind
I don't even need to look you in the eye
I don't believe a word you say

Don't know what to do without you
Don't know what to do with you
Used to look at you with wonder
Now I look at you and wonder
I can't even look you in the eye
I don't believe a word you say",I Don’t Believe a Word You Say,2013
Ben Harper,"It's been a long hard day
And a long hard night
Been a hard year
Its been a hard life
But we're together
And that's all that matters now

Well the time has come
And the time has gone
Maybe I was born to be aloe
But we're together
And that's all that matters now

Been thrown by the wind
Drowned in the rain
I walked through some things
You don't want me to explain
But we're together
And that's all that matters now

I can't get well
There's no cure for life
Let me down easy
At least tonight
We're together
And that's all that matters now",All That Matters Now,2013
Ben Harper,"In the days of love and honor
I was a fool for love
Gave my heart and soul
But it was hardly enough
It ain't love
Unless it brings you to your knees
It ain't salvation
If you're still begging to be free

If your ship hasn't come in
Don't have a problem with the shore
If you're locked out of your house
Don't have a problem with your door
The dice are no mans mistress
Black diamond snake moan
Wake up in the morning
Honey I'll be gone

You know it's bad
When the ceiling says to the floor
I'll trade you places
I can't take it up here no more
I'm a living nervous habit
I tremble and I twitch
Keep on pulling at me
Like I'm some kind of hanging stitch

Be glad your worries ain't like mine
Don't look twice",Don’t Look Twice,2013
Ben Harper,"Don't want no high rise tombstone
Gonna gather up my saints
Don't wanna hear you fussing
If it is or if it ain't
My life needs no witness
And my burden is my own

You gotta answer to somebody
If you didn't learn then you didn't read
Gotta live with it
What's a man to do
Gotta answer to somebody

The death row preacher
Came to the backdoor to greet her
He didn't blame her
For trusting the one armed lion tamer
She stepped in from the storm
She was dry as a bone
The preacher thought to himself
The devil takes care of his own
She said look what your prayers have done to me
What can your prayers do for me
Preacher said careful talking to yourself
Cause you may be listening

I'm in I'm out and I'm gone",I’m in I’m Out and I’m Gone,2013
Ben Harper,"There's a man on the corner
Begging for help
There's a man that walks past him
And he's drowning in wealth
Who doesn't understand
How disappointment destroys the soul

Every look of shame
Is a wound that will never heal
What has he done to deserve this
What have I done to deserve this
It's easy to remember
But it's easier to forget
Life has a way of getting in our way

I don't want to go my way
If you're not going my way
So I guess that means
I'll be going your way
I will lead or follow
Beg steal or borrow
Just for one more day

We can't end this way",We Can’t End This Way,2013
Ben Harper,"Rich man shaking in his shoes
Poor man drowning in his blues
Lovely ladies take their place in line
People on the street yelling ""it's time, it's time""

World boss is coming
World boss is coming

Business man sold everything he owns
Junkie's pretending he ain't never jonesed
Politician sneaking through the crowd
Super savior soldier cries out loud
""everybody have you heard the news?""

World boss is coming
World boss is coming

""Everybody have you heard the news?""",World Boss,2013
Ben Harper,"Was thinking just the other day
Of something I've been trying to say
But I couldn't find the way
To tell you I was born to love you

Some born to lose
Some born to win
They say we're all born into sin
That's a hard way to begin
But I was born to love you

Some come in with a burden
Heavy hearted and hurting
Who's unworthy who's deserving
But I was born to love you

Some made for days some made for nights
Some to stand up for what's right
No matter how hard the fight
I was born to love you

I love you
I live you
I love to live you
I live to love you

I was born to love you",Born to Love You,2014
Ben Harper,"It’s Christmas morning in the psych ward
There’s a flight risk today so a nurse guards the door
There’s a man in the corner who sounds just like me
Rambling on about time square new years eve

If I could only forget what I’m supposed to know
If I could only keep from sinking so low
Strapped me down and into the void I was hurled
With nowhere else to turn in this heavyhearted world

Traded our rage for broken bones
Traded our fear for someplace to call home
Traded a lifetime for one long day
Nothing is more beautiful than to fade away

Fear and the memory of painful youth
It prepared us for the painful truth
So gather only what’s sacred summons all of your courage
And walk with me into this heavyhearted world",Heavyhearted World,2014
Ben Harper,"A house is a home even when it's dark
Even when the grass is overgrown in the yard
Even when the dog is too old to bark
And when you're sitting at the table trying not to starve

A house is a home even when there's ghosts
Even when you gotta run from the ones who love you most
Screen door's broken paint's peeling from the wood
Locals whisper when they gonna leave the neighborhood

A house is a home where the chores are never done
Where you spend your whole life running to and from
And if the life that you live is not the life you choose
Make your child a home and start anew

A house is a home
Even when we've up and gone
Even when you're there alone
A house is a home",A House Is a Home,2014
Ben Harper,"Was so beautiful how could we not believe
So beautiful how could we not believe
We love
We grieve
Then all seek our reprieve 
So beautiful how could we not believe

Was so beautiful we had to stand aside
So beautiful we had to stand aside
We had to stand aside
With our arms open wide
So beautiful we had to stand aside

Was so beautiful we had to close our eyes
So beautiful we had to close our eyes
And listen to the sound
It could be heard miles around
So beautiful we had to close our eyes

So beautiful to be free from my name
So beautiful to be free from my name
To be free from my name
And all those who lay claim
So beautiful to be free from my name

Was so beautiful how could we not believe
So beautiful how could we not believe
How could we not believe
Having lived through times like these
So beautiful how could we not believe
So beautiful how could we not believe
So beautiful how could we not believe",How Could We Not Believe,2014
Ben Harper,"What I've got I don't want
All it does is hover and taunt
Reminding me what I used to be
What I may never be again
Turns out what I'm good at doin
Is making something out of the ruin
Borrow this wasted space that could never be replaced
Learn it all again tomorrow, learn it all again tomorrow
Nothing I have you can borrow or steal
Yes I think we have a deal.
If my wheels were square, but the earth was jagged
I rode along, it'd be no less ragged
And seems to be the day
I'm usually this way
Learn it all again tomorrow, learn it all again tomorrow
Nothing I have you can borrow or steal
Yes I think we have a deal.
I wish every harder day only took an hour
And I'm not just like the people I resent
I wish someday I could truly be a power
Say exactly what it is I meant
All I have that's in abundance
Is my perpetual redundance
It's hard for me to say, I face it everyday
Learn it all again tomorrow, learn it all again tomorrow
Nothing I have you can borrow or steal
Learn it all again tomorrow, learn it all again tomorrow
Nothing I have you can borrow or steal
Yes I think we have a deal.",Learn It All Again Tomorrow,2014
Ben Harper,"Days must be untangled
For years to be revealed
We’ve looked from every angle 
With nothing left concealed

In the winter she wants to be dancer
In springtime she wants to be a scribe
In summer she wants to be a painter
Come autumn the mother of a child

Where the edge of the hill 
Meets the end of the road
We make memories of gold
Our memories of gold
To have and to hold
Our memories of gold",Memories of Gold,2014
Ben Harper,"I got a bad habit slowly sinkin' in
I got a bad habit now slowly sinkin' in
Got me hearin' voices, seein' through my skin

When a man gives you his hat, he's livin' on borrowed time
When a man gives you his hat, he's livin' on borrowed time
The shoe fits so I wore it but I left one lace untied

Just a bad habit now of wantin' what I need
Got a bad habit of wantin' what I need
I may have been born to buy, I ain't never been free

I cry once a day, it's a condition of the heart
Oh, I cry once a day, Lord, it's a condition of the heart
You're like a puzzle in a box but I'm the one comin' all apart

Got a bad habit, you know the one I mean
I got a bad habit now, you know the one I mean
No before, no after, only inbetween

It's a bad habit, buries me in the dark
Got a bad habit now, buryin' me in the dark
'Til the only light is a match that just won't spark
The only light, only light",Bad Habits,2018
Ben Harper,"Sometimes I make choices
Sometimes they make me
Lonesome distance between here
And where you think I should be
Someday we may look back and laugh
At all that could've been
But tonight
The bottle wins again
Tonight the bottle wins again

Broken hearts and broken dreams
Turns out they weigh the same
Passed down through generations
Like the family name
There's a gilded coat of arms
For those who heal from within
Oh, but tonight the bottle
The bottle wins again
Tonight the bottle
The bottle wins again

So meet me in an hour
We'll have just one or two
You pretend to listen
I'll act like I can hear you
I know you'll always be there
Ain't that a true friend?
Oh, tonight the bottle
The bottle wins again
Tonight the bottle wins again
Wins again, wins again",The Bottle Wins Again,2018
Ben Harper,"I found hay in a stack of needles
Four-leaf clover in a mile of weeds
(Found the one) understands my downs
(Found the one) puts up with my needs
Of everybody under the sun
I found the one

If you're gonna gamble
May as well be on love 
(Found the one)
May have had some before 
(Found the one)
But now you can't get enough
Before it's all said and done
I found the one

I found myself in trouble
Found myself waiting in line
(Found the one) Found so many ways
(Found the one) Of wasting my time
No more races to run
I found the one

Now I follow my heart
Wherever the road ends (Found the one)
Most people you see every day (Found the one)
You'll never see them again
Come rain, come sun
Found the one",Found the One,2018
Ben Harper,"The simplest things
Can be the hardest to do
Can't find what you're looking for
Even when it's looking for you
The judge and the criminal
The sinner and the priest
Got something in common
Bring 'em all to their knees
Do what you can
Do what you must
Everybody's crying about
Some love and trust
I walk the line, walk it for us
See me up here trying to find
Some love and trust

Lust ain't nothing
But stealing from a thief
Storm after storm leave you shaking like a leaf
They say broken hearts
Make the world go 'round
But trading headaches for heartbreaks
Gonna get you down
Give it some time, don't try to rush
When you're trying to find yourself
Some love and trust
Do all you can might not be enough
When you're trying to get yourself
Some love and trust

Like a horse in a race
That doesn't want to run
An executioner
Who won't fire his gun
Like a boxer who won't take a swing
Like a prince
Who don't want to be a king
Haven't we suffered
Suffered enough?
Now we're out here fighting about some
Love and trust
Do all you can, just hope it's enough
Everybody's crying about
Some love and trust

Love and trust
Love and trust
Love and trust",Love and Trust,2018
Ben Harper,"Wandering in a poker game
Lost me in a bet
Feeny got the nerve to turn around and get upset
Movin' on, yeah, movin' on
You practice law without a license
Psychology too
But your PHD isn't givin' me the blues
Movin' on
Oh, movin' on

Go to third-world countries
Kickin' three-legged dogs
'Bout three p.m you're living high on the hog
Held out for so long, movin' on

You may have learned to hustle
But you never learned to dance
When you fight the Lord you don't get a second change
I may be right, I may be wrong
Movin' on

You get away with murder
You got a way with words
Speaking in a language that nobody's ever heard
Just singin' that same old song
Movin' on

Ten reasons to stay here
Eleven to leave
Not waitin' around for you to give me a reprieve
No more stringin' us along
Movin', movin' on",Movin' On,2018
Ben Harper,"On the kindness of strangers
I've come to depend
For a shoulder to lean
Or a hand to lend
This world's too hard
To not have someone break my fall
Nothing at all 
Nothing at all
Oh, Lord, nothing at all

We climb this world 
Stone by stone
We love each other
Bone by bone
There are sins for which
One just cannot atone
Nothing at all 
Nothing at all
Oh, nothing at all

There's a price we pay
For the places we lay
For putting it all on the line
So far down the only sound
Is something leaving you behind
Nothing at all 
Nothing at all
Oh, nothing at all

What if we end
Just where we begin
Everywhere we go
We have already been
Would you relive the pain
Or would you call it a draw?
Nothing at all
Nothing at all
All or nothing at all",Nothing At All,2018
Ben Harper,"You can lie awake at night
Pretend not to see
But you can't put that apple back up on its tree
There ain't no worries
You can't drink away
And I trust you
Trust you to dig my grave

Woke up this morning
Poured a cup of the blues
I will always find a way to lose
Give me one reason
A reason I should stay
I trust you
Trust you to dig my grave

Spend your whole life with one woman
Die and leave her your farm
The very next day she's on your best friend's arm
There ain't no worries
You can't drink away
And I trust you
Trust you to dig my grave

I walk but I stumble
I roll but I tumble
I reach but I fumble
I speak but I mumble, comin' and goin'
A hundred different ways
And I trust you
Trust you to dig my grave

Don't want to be your first lover
I just want to be your last
If you promise not to tell, I promise not to ask
There ain't no worries
You can't drink away
And I trust you
Trust you to dig my grave
I trust you
Hmm, I trust you
Trust you to dig my grave",Trust You To Dig My Grave,2018
Ben Harper,"When I leave here, when I leave here
I have no place to go
And it's much too late to change my name
I'ma take you with me when I go

I get older but my troubles don't change
Worked so hard with nothin' to show
And it's much too late to change my name
I'ma take you with me when I go

I'm a stranger, just a stranger
Even to the people I know
And I'm goin' to where the winds never change
I'ma take you with me when I go

I get older but my troubles don't change
Worked so hard with nothin' to show
And it's much too late to change my name
I'ma take you with me when I go

I'ma take you with me when I go
Take you with me when I go",When I Go,2018
Ben Harper,"Everybody says ""I love you""
But not everybody lives ""I love you""
Without our past
How will we know it's us?
Love is not enought

I could have hugged you more carefully
And I suppose you could have been there for me
But then again
They say it's meant to be
But love
Is not enough

Choosing not to remember
Is no way to forget
That's just a losing bet
It's so unjust
When love is not enough

These old streets of shame
Will they ever look the same?
Will they remember our name?
Just ask the dust
Love's not enough",When Love Is Not Enough,2018
Ben Harper,"What would be the first thing
You'd say to the Lord?
And the last thing you would dream
If you couldn't dream no more?
Won't you please help me to understand
Is there no mercy in this land?
No mercy in this land?

Followed the river 'til the river ran dry
Followed my lover 'til we said goodbye
Followed you through soldiers
Who fire on command
Is there no mercy in this land?

These days I speak in whispers
Travel only to and from
Come close you'll see the red
Of a well bitten tongue
The righteous and the wretched
The holy and the damned
Is there no mercy in this land?
No mercy in this land?

Father left us down here all alone
My poor mother is under a stone
With an aching heart and trembling hands
Is there no mercy in this land?",No Mercy in This Land,2018
Ben Harper & the Blind Boys of Alabama,"Oh - I sat down upon the church house steps
I sat down upon the church house steps
I sat down upon the church house
Down upon the church house steps

With all my hopes and dreams
All of my regrets

Oh - I sat down upon the church house steps
I sat down upon the church house steps
I sat down
I sat down upon the church house steps

With all I have lost
And with all I have been blessed

Oh - I sat down
Oh - I sat down
Oh - I sat down upon
I sat down upon the church house steps

I reached to the sky
As I hung my head and wept
Oh - I wept

Oh - I sat down
Oh - I sat down
I sat down
Oh - I sat down

If these wings should fail me
(Won't you) meet me with another pair",Church House Steps,2004
Ben Harper & the Blind Boys of Alabama,"We're gonna make it to the church on time
We're gonna make it to the church on time
Put on your Sunday best
I'll put on mine
We're gonna make it to the church on time

We're gonna make it to the church on time
We're gonna make it to the church on time
Need to hear the preacher
Give me a sign
We're gonna make it to the church on time

We're gonna make it to the church on time
We're gonna make it to the church on time
I'm gonna get my soul in line
I'm gonna make it to the church on time

We're gonna make it to the church
We're gonna make it to the church on time
We're gonna leave all of our troubles behind
I'm gonna make it to the church on time

We're gonna make it to the church on time
We're gonna make it to the church on time
You may be rich may not have a dime
We're gonna make it to the church on time

We're gonna make it
Oh - We're gonna make it
Oh - We're gonna make it to the church on time
Trouble at heart - Oh - trouble in mind
We're gonna make it, Lord, to the church on time

Revelation chapter eight
Revelation chapter eight
Seven angels at the gate
You don't want to make them wait

Oh - We're gonna make it
Oh - I'm gonna make it
I'm gonna make it
Oh -I'm gonna make it to the church on time
Oh - To the church
Oh - To the church on time
On your Sunday best
On your Sunday best
Sunday best
I'm gonna put on
I'm gonna put on
I'm gonna put on mine",Church on Time,2004
Ben Harper & the Blind Boys of Alabama,"How sweet and happy seem those days of which I dream
Memories I recall now and then
And with a rapture sweet my weary heart would beat
If I could hear my mother pray again

If I could only hear my mother pray again
If I could hear her tender voice as then
How happy I would be
It would mean so much to me
If I could hear my mother pray again

Around the old home place her cherishing smiling face
Was always bringing comfort joy and cheer
And when she used to sing to her eternal King
It was the sound I loved to hear

If I could only hear my mother pray again
If I could hear her tender voice as then
How happy I would be
It would mean so much to me
If I could hear my mother pray again

If I could hear my mother pray again
If I could hear my mother pray again",Mother Pray,2004
Ben Harper & the Blind Boys of Alabama,"It hangs above my altar
Like they hung him from a cross
I keep one in my wallet
For the times I feel lost
I feel lost
In a wooden frame with splinters
Where my family kneels to pray
And if you listen close
You'll hear the words he used to say

I've got a picture of Jesus
In his arms so many prayers rest
We've got a picture of Jesus
And with him we shall be forever blessed
Forever blessed
Forever blessed

Now it has been spoken
He would come again
But would we recognize
This king among men
There was a man in our time
His words shine bright like the sun
He tried to lift the masses
And was crucified by gun

He was a picture of Jesus
With him so many prayers rest
He is a picture of Jesus
In his arms so many prayers
So many prayers
So many prayers rest
With him we shall be forever blessed
Forever blessed
Forever blessed

Some days have no beginning
And some days have no end
Some roads are straight and narrow
And some roads only bend
So let us say a prayer
For every living thing
Walking towards a light 
From the cross of a king

We long to be a picture of Jesus
Of Jesus
In his arms - In his arms so many prayers rest
I long to be a picture of Jesus
With him we shall be forever blessed
With him we shall
With him we shall be forever blessed
Oh I long
I've got a picture of Jesus
Mmhh",Picture of Jesus,2004
Ben Harper & the Blind Boys of Alabama,"How many times have you heard someone say
""If I had his money I'd do things my way""
But little they know that it's so hard to find
One rich man in ten with a satisfied mind

Once I was waiting in fortune and fame
Everything that I dreamed of to get a start in life's game
Suddenly it happened I lost every dime
But I'm richer by far with a satisfied mind

When my life is over and my time has run out
My friends and my loved ones I'll leave there's no doubt
But one thing is for certain when it comes my time
I'll leave here for certain with a satisfied mind

I got a satisfied mind",Satisfied Mind,2004
Ben Harper & the Blind Boys of Alabama,"Lord I work to serve you
And I hope I've served you well
Oh - I've lived a life to join you
And now only time will tell

Oh - Take my hand when you are worried
Take my hand when you're alone
Take my hand and let me guide you
Take my hand to lead you home

Father dear father
Pulled his car to the side of the road
Looked at his children with tears in his eyes
Said life is too heavy a load

Take my hand when you are worried
Take my hand when you're alone
Take my hand and let me guide you
Take my hand to lead you home

Some days I'm struck with sorrow
Need a place to hide
There's nowhere else you can put life
But way down deep inside

Take my hand and let me guide you
Take my hand when you're alone
Take my hand and let me guide you
Take my hand to lead you home

Take my hand when you are worried
Take my hand to lead you home
Take my hand and let me guide you
Take my hand to lead you home

Take my hand...",Take My Hand,2004
Ben Harper & the Blind Boys of Alabama,"I wish we could live forever
Then melt into the sun
Melt into the sun
Time is gonna change you
Once it gets you on the run
Gets you on the run

There will be
There will be
There will be a light
There will be a light
There will be
There will be
There will be a light
There will be a light

I've been running
Ever since
Ever since I was a child
Some call it free
And some call it wild

There will be
There will be
There will be a light
There will be a light
There will be
There will be
There will be a light
There will be a light

Let the warmth of my love
Dry away all your tears
Fear not for I am with you
I will fear not - fear not - with you here

There will be
There will be
There will be a light
There will be a light
There will be
There will be
There will be a light
There will be a light

There will be
There will be
There will be a light
There will be a light",There Will Be a Light,2004
Ben Harper & the Blind Boys of Alabama,"The man who stole the water will swim forevermore
But he'll never reach the land on that golden shore
That faint white light will haunt his heart
Till he's only a memory lost in the dark

Dig a hole in the ground straight down to hell
Till there ain't no more water in the well, well, well
When you're down on your knees with nothing left to sell
Try diggin a little deeper in the well, well, well
Well, well, well
Well, well, well

Take care of your body like you care for your soul
Don't you dig yourself into a hole
Until you've paid the price you can't know what it's worth
The air and water, the fire and earth

Dig a hole in the ground straight down to hell
Till there ain't no more water in the well, well, well
When you're down on your knees with nothing left to sell
Try diggin a little deeper in the well well well
Well, well, well
Well, well, well",Well Well Well,2004
