Band,Lyrics,Song,Year
Oscar D'León,"Lady Madonna, children at your feet
Wonder how you manage to make ends meet
Who find the money when you pay the rent
Did you think that money was heaven sent

Friday night arrives without a suitcase
Sunday morning creeping like a nun
Monday's child has learned to tie his bootlegs
See how they run

Lady Madonna, baby at your breast
Wonders how you manage to feed the rest
Pa pa pa pa,
See how they run

Lady Madonna lying on the bed
Listen to the music playing in your head

Tuesday afternoon is never ending
Wednesday morning papers didn't come
Thursday night you stocking needed mending
See how they run

Lady Madonna, children at your feet
Wonder how you manage to make ends meet",Lady Madonna,
Oscar D'León,"Mira bien lo que hacemos los dos 
Siempre peleando as?br> Si despu?vamos a sonre?
Besarnos mucho m?

Para que acabar este amor 
Amor que es nuestra vida 
Para que destruir la ilusi??br> Y hacer nuestra separaci??br> 
Sufro yo y t?res tambi?
Por cosas sin raz??br> Y el amor en momentos as?br> Muere un poquito m?

Y al morir sufrimos m?y m?
Llorando as?n esta soledad 
Pues sin amor, ni t?yo 
Vivimos m?

Para que acabar este amor 
Amor que es nuestra vida 
Para que destruir la ilusi??br> Y hacer nuestra separaci??br> 
Sufro yo y t?res tambi?
Por cosas sin raz??br> Y el amor en momentos as?br> Muere un poquito m?

Y al morir sufrimos m?y m?
Llorando as?n esta soledad 
Pues sin amor, ni t?yo 
Vivimos m?

",Peleas,2001
Oscar D'León,"No sé qué tiene tu voz que fascina
No sé que tiene tu voz tan divina
Que en mágico vuelo le traje consuelo 
A mi corazon

No sé qué tiene tu voz que domina
Como embrujo de magia a mi pasión

Tu voz se adentró en mi ser y la tengo presa
Tu voz que es tañer campanas al morir la tarde
Tu voz que es gemir de violines 
En las madrugadas

Es el divino poder 
Que tienes en mi bien para enternecer

Tu voz que es susurro de palmas, ternura de brisa
Tu voz que es trinar cenzonte en la enramada
Tu voz cristalina corriente cual, cual una cascada
Dios te bendiga mi bien, tu gracia y tu ser que me hacen soñar 

Tu voz que es susurro de palmas, ternura de brisa
Tu voz que es trinar de cinzonte en la enramada, tu voz tu voz
Tu voz cristalina corriente cual, cual una cascada
Dios te bendiga mi bien, tu gracia y tu ser que me hacen soñar",Tu Voz,2004
Oscar D'León,"Sé que tú no quieres
Que yo a ti te quiera 
Siempre tú me esquivas 
De alguna manera 

Si te busco por aquí 
Me sales por allá 
Lo único que yo quiero 
No me hagas sufrir más (tú ve')

(Oye, oye bien)
Por tu mal comportamiento, te vas a arrepentir
Bien caro tendrás que pagar todo mi sufrimiento
Llorarás y llorarás sin alguien que te consuele
Así te darás de cuenta que si te engañan duele

(Oye, mira)
Y después vendrás a mí, pidiéndome perdón
Pero ya mi corazón, no se acuerda más de ti
Llorarás y llorarás sin alguien que te consuele
Así te darás de cuenta que si te engañan duele

¡Te lo juro que sí!
¡Bandolera!
¡Ahora el que ríe soy yo!

Llorarás llorarás llorarás (Llorarás)
Como lo sufrí yo (Llorarás)
Oye tú llorarás (Llorarás)
Nadie te comprenderá (Llorarás)
Todo lo malo que hiciste (Llorarás)
Oye mira lo pagarás (Llorarás)
Llorarás Llorarás (Llorarás)
Llorarás Llorarás (Llorarás)
Tú me hiciste sufrir (Llorarás)
Ahora el que ríe soy yo (Llorarás)
Que no, que no, que sí, que sí (Llorarás)
Ahora yo voy a vivir (Llorarás)
Mi vida como yo quiera (Llorarás)
Echa pa'lante que me voy (Llorarás)
En esta navidad mama! (Llorarás)
Llévatela!",Lloraras,2005
Oscar D'León,"O le canto a la luna
Yo le canto a las flores
Le canto a las estrellas
Le canto a los amores

Yo le canto a los sueños
¡Ay! Cuando digo tu nombre

¡Cómo!

Esta canción no será bonita
Esta canción no estará bien hecha
Esta canción no estará en la radio
Esta canción no me hará una estrella

Esta canción no tendrá armonía
Ni melodía ni buena letra
Ni un estribillo de esos que rompen
Pero la canto porque me llena

Porque no parte los corazones
Porque no pide a nadie que vuelva
Y se compuso con mucha guasa
Está compuesta pa' los que sueñan

Y yo la canto y la canto
La sigo cantando cuando estoy sereno
Cuando estoy borracho

Y yo la canto y la canto
La sigo cantando cuando yo me acuesto
Cuando me levanto

Esta canción no llora por nadie
Esta canción no tiene poema
A lo mejor no andará en tu coche
Pero la canto porque me llena

Esta canción no dice, ""Te quiero""
Y nadie va a cortarse las venas
Esta canción habla muy poquito
Y dice más de lo que aparenta

De esta canción no se harán canciones
Esta canción no estará en baratas
Esta canción no será tu agosto
¡Cuanto lo siento Sr. Pirata!

",La Canto,2006
Oscar D'León,"Se ha retrasado más de una hora
¿Qué pasará que no llega?
Y los deseos de tenerla cerca
Hacen más larga la espera

El tiempo corre y no aparece
¿Habrá olvidado la fecha?
Ya son las 12 y me voy a casa
A organizar mi cabeza

¡Te esperé! nunca llegaste
¿Que pasó? De la cita te olvidaste
Me fallaste

Por segunda vez
No me busques, no me llames
Porque no te quiero ver

Yo tan seguro de que vendría
Ya había ordenado la cena
No imaginé que me haría lo mismo
Que idiota, confiando en ella

Tan preocupado por esa cinta
Y preparando su fiesta
No habrá motivos ni contratiempos
Que justifiquen su ausencia

Yo aquí muriendo por verte llegar
Y me pongo a llorar
Porque no te vi
Entro a ese lugar y allá

Me encuentro a Oscar
Me pongo a preguntar
Y a Oscar le pasa lo mismo que a mi

No sé si fue intencional
O será que de mi te quieres burlar
Otra vez que no llegaste

Pero ya no lo vuelvo a hacer
Pero ya no lo vuelvo a hacer
No confío más en ti

Me fallaste mujer
Otra vez que no llegaste, no puede ser
¡Pero soy feliz!

",Me Fallaste,2006
Oscar D'León,"Oye! 
Huye pa alla 
Quien mas? 
El negro 
Tego calderon 
Lloraras y lloraras 
Pero no voy a ser yo 
Quien te consuele 

Se que tu no quieres 
Que yo a ti te quiera 
Siempre tu me esquivas 
De alguna manera 
Si te busco por aquí 
Me sales por allá 
Lo único que yo quiero 
No me hagas sufrir mas 

Te estoy curando 
En tu propia medicina 
No traje flores 
Te tengo espinas 
Catira, monina
Bandida, creída 
Quédate con todo 
El negro no wira 
Todo lo que hiciste 
Lo estas pagando 
Y no soy yo 
La vida te lo esta cobrando 
Con crece 
Como lo que te mereces 
Búscate un cura 
Que te confiese 

Por tu mal comportamiento 
Te vas a arrepentir 
Bien caro tendrás que pagar 
Todo mi sufrimiento 
Lloraras y lloraras 
Sin nadie que te consuele 
Así te darás tu cuenta 
Que si te engañan duele 

Vamo a ver y lloraras 
Otro wil que te consuele 
Cumpliré con mis deberes 
Como se debe 
Recupere 
Hagamoslo con la bebe 
Que se use 
Ma que a los dos nos conviene 
No es culpa de mamita ni papito 
Ambos por igual 
Muy bonita y a su hermanito 
Cuando tu crezcas de toy de calle 
No hay coraje 
Eso es lo que vale 

Y después vendrás a mi 
Pidiéndome perdón 
Pero ya mi corazon 
No se acuerda mas de ti 
Lloraras y lloraras 
Sin nadie que te consuele 
Así te darás tu cuenta 
Que si te engañan duele 

Perdón de que? 
Ni te preocupes 
Yo estoy contento mami 
Pero no abuses 
Te quise mucho 
No siento odio 
Gracias por soportar 
Mi coltio 
La culpa es compartida 
Como la custodia 
Si no tengo a ego 
Pa que la gloria 
Mi niña es mirena 
Yo soy su rey 
No soy como wisin y yanel 
Calle calle 

Se que tu no quieres 
Que yo a ti te quiera 
Siempre tu me esquivas 
De alguna manera 
Si te busco por aquí 
Me sales por allá 
Lo único que yo quiero 
No me hagas sufrir mas 

Con Dj nelson papa 
Quien mas? 
Tego calderón 
Los cardeleros 
Cantando reggaeton 
Para la gente que le gusta el sabor 
Oye tu lloraras 
Nadie te comprendera 
Todo lo malo 
Que hiciste 
Oye mira lo pagaras 
Lloraras 
Lloraras 
Y para que 
Tu vas a ir a otro lado","Llora, Llora",2006
Oscar D'León,"Yo me voy pa' Cali yo también me voy
Oh, oh, oh me voy pa' Cali yo también me voy
Que yo me voy pa' Cali yo también me voy
Yo me voy pa' Cali yo también me voy

Sultana llenas de encanto
Tan aneja y tan bonita
Se va que te cuidan tanto
Como a niña pequeñita

Un brindis va por tu feria
Un golazo en el pascual
Y en el cañaveral lejo'
Un gol de monumental

Que voy me voy pa' Cali yo también me voy
Yo me voy pa' Cali yo también me voy
Yo,yo,yo,yo me voy pa' Cali yo también me voy
Yo me voy pa' Cali yo también me voy

El bayuno es entusiasmo
El bayuno su sabor
Como la cana de azúcar
Que tienes al rededor

Tu paisaje se retrata
Verdees tu lindo suelo
Y el rio arrullando pasa
Al Cali viejo y al nuevo

Que voy me voy pa' Cali yo también me voy
Yo me voy pa' Cali yo también me voy
Yo,yo,yo,yo me voy pa' Cali yo también me voy
Yo me voy pa' Cali yo también me voy

Cali, Cali, Cali me voy pa' buga
Cali, Cali, Cali Cali es calidad
Cali, Cali, Cali me voy pa' Popayán
Cali, Cali, Cali Cali , Cali, Cali
Cali, Cali, Cali pa' Pereira y Yeran
Cali, Cali, Cali mi saludo a barrio obrero
Cali, Cali, Cali te aseguro que ahi, tu ve
Cali, Cali, Cali mi amor sincero
Cali, Cali, Cali ay mira, que yo me voy a aguas Caucas
Cali, Cali, Cali ahí la gente bailando el polvo levanta
Cali, Cali, Cali y si quieres bailar como es
Cali, Cali, Cali ay vete a silde silde
Cali, Cali, Cali

Cali, Cali, yo también me vay pa' Cali
De ahí me voy buenaventura
Voy a gozar, porque ahí, si es que ricura
Cali, Cali, yo también me voy pa' Cali
Siempre me voy a Cali a gozar
En las casetas populares tu ve

Y la gente canta a coro Cali, Cali, Cali
A coro, coro, coro, coro, coro
A coro a coro siempre gozando
En la plaza de toro Cali, Cali, Cali
Cali, Cali, Cali, Cali querido Cali, Cali, Cali",Me Voy Pa'Cali,2006
Oscar D'León,"Dale a tu cuerpo alegria Macarena
Que tu cuerpo es pa' darle alegria y cosa buena
Dale a tu cuerpo alegria, Macarena
Hey Macarena

Dale a tu cuerpo alegria Macarena
Que tu cuerpo es pa' darle alegria y cosa buena
Dale a tu cuerpo alegria, Macarena
Hey Macarena

Macarena tiene un novio que se llama
Que se llama de apellido Vitorino
Que en la jura de bandera el muchacho
Se la dio con dos amigos

Macarena tiene un novio que se llama
Que se llama de apellido Vitorino
Y en la jura de bandera el muchacho
Se la dio con dos amigos

Dale a tu cuerpo alegria Macarena
Que tu cuerpo es pa' darle alegria y cosa buena
Dale a tu cuerpo alegria, Macarena
Hey Macarena

Dale a tu cuerpo alegria Macarena
Que tu cuerpo es pa' darle alegria y cosa buena
Dale a tu cuerpo alegria, Macarena
Hey Macarena

Macarena Macarena Macarena
Que te gustan los veranos de Marbella
Macarena Macarena Macarena
Que te gusta la movida guerrillera

Dale a tu cuerpo alegria Macarena
Que tu cuerpo es pa' darle alegria y cosa buena
Dale a tu cuerpo alegria, Macarena
Hey Macarena

Dale a tu cuerpo alegria Macarena
Que tu cuerpo es pa' darle alegria y cosa buena
Dale a tu cuerpo alegria, Macarena
Hey Macarena

Macarena suena con el Corte Ingles
Y se compra los modelos mas modernos
Le gustaria vivir en Nueva York
Y ligar un novio nuevo

Macarena suena con el Corte Ingles
Y se compra los modelos mas modernos
Le gustaria vivir en Nueva York
Y ligar un novio nuevo

Dale a tu cuerpo alegria Macarena
Que tu cuerpo es pa' darle alegria y cosa buena
Dale a tu cuerpo alegria, Macarena
Hey Macarena

Dale a tu cuerpo alegria Macarena
Que tu cuerpo es pa' darle alegria y cosa buena
Dale a tu cuerpo alegria, Macarena
Hey Macarena

Macarena tiene un novio que se llama
Que se llama de apellido Vitorino
Y en la jura de bandera del muchacho
Se la dio con dos amigos

Macarena tiene un novio que se llama
Que se llama de apellido Vitorino
Y en la jura de bandera del muchacho
Se la dio con dos amigos

Dale a tu cuerpo alegria Macarena
Que tu cuerpo es pa' darle alegria y cosa buena
Dale a tu cuerpo alegria, Macarena
Hey Macarena

Dale a tu cuerpo alegria Macarena
Que tu cuerpo es pa' darle alegria y cosa buena
Dale a tu cuerpo alegria, Macarena
Hey Macarena",Macarena,2008
Oscar D'León,"Sé que tu no quieres, 
que yo a ti te quiera 
siempre tu me esquivas 
de alguna manera 
si te busco por aquí 
me sales por allá 
lo único que yo quiero 
no me hagas sufrir más rumbera

oye bien por tu mal comportamiento, 
te vas a arrepentir 
muy caro tendrás que pagar 
todo mi sufrimiento 
Llorarás y llorarás 
sin alguien que te consuele 
y así te darás de cuenta 
que si te engañan duele 

oye mira y después vendrás a mí, 
pidiéndome perdón 
pero ya mi corazón, 
no se acuerda más de tí 
Llorarás y llorarás 
sin nadie que te consuele 
y así te darás de cuenta 
que si te engañan duele 

CORO: Llorarás, llorarás, llorarás. 
Como lo sufrí yo 
Nadie te comprenderá 
Todo lo mala que has sido 
Mamita, tú lo pagaras. 
Mi vida voy a vivir 
Mi vida como yo quiero 
Echa' pa delante, yo me voy",Lloraras [En Vivo],2008
Oscar D'León,"Sé que tu no quieres
Que yo a ti te quiera 
Siempre tu me esquivas 
De alguna manera 
Si te busco por aquí 
Me sales por allá 
Lo único que yo quiero 
No me hagas sufrir más rumbera

Oye bien por tu mal comportamiento
Te vas a arrepentir 
Muy caro tendrás que pagar 
Todo mi sufrimiento 
Llorarás y llorarás 
Sin alguien que te consuele 
Y así te darás de cuenta 
Que si te engañan duele 

Oye mira y después vendrás a mí
Pidiéndome perdón 
Pero ya mi corazón
No se acuerda más de ti
Llorarás y llorarás 
Sin nadie que te consuele 
Y así te darás de cuenta 
Que si te engañan duele 

Llorarás, llorarás, llorarás
Como lo sufrí yo 
Nadie te comprenderá 
Todo lo mala que has sido 
Mamita, tú lo pagaras
Mi vida voy a vivir 
Mi vida como yo quiero 
Echa' pa delante, yo me voy",Llorarás [En Vivo Desde Nueva York/2000],2008
Oscar D'León,"Que Bonita eres 
Que Bonita eres 
Que Bonita eres mi Venezuela que linda eres

Que Bonita eres 
Que Bonita eres 
Que bonita eres mi Venezuela que linda eres

Desde Pto Rico que es la Islita del Encanto 
Yo te traigo esta canción porque yo te quiero tanto 

Desde que me vistes me acurrucastes en tus Brazos
Tus montañas y tus playas y tu gente que se da a querer

Hoy me quito el sombrero frente a ti, desnudándote mi alma te diré

Que Bonita eres 
Que Bonita eres 
Que bonita eres mi Venezuela que linda eres

Que Bonita eres 
Que Bonita eres 
Que bonita eres mi Venezuela que linda eres

Divina Pastora, la Virgen de Coromoto
La Chinita y la Del Valle con la gaita y el joropo

Al Turpial invito pa' formar tambien la fiesta
En volcanes playa y nieve, en desierto y en la selva
Pabellon criollo no puede faltar y en febrero pa'gozar del carnaval

Que Bonita eres 
Que Bonita eres 
Que bonita eres mi Venezuela que linda eres

Que Bonita eres 
Que Bonita eres 
Que bonita eres mi Venezuela que linda eres

Y yo te quiero, eres linda Venezuela
Tu si que lo tienes todo, talento y mucho amor
P y lo mas lindo que tu tienes es tu gente

Y mas grande el corazon 
Desde mi isla Puerto Rico yo te canto
Aquí esta la Vinotinto, buena gaita y sus bellas mujeres
Venezuela y Pto Rico arrazan con las Coronas pa' que nadie se las lleve
Venezuela
Dios te Bendiga Venezuela",Que Bonita Eres [Merengue],2013
Oscar D'León,"Soy dulce como el melao'
Alegre como el tambor
Llevo el ritmico tumbao'
Llevo el ritmico tumbao'
Que hare que en el corazon

why habia una isla rica
Eclava de una sonrisa
Soy de ayer soy carnaval
Pongo corazon why tierra
Mi sangre es de azucar negra
Es amor why es musica

Azucar azucar negra
Hay cuanto me gusta why me alegra
Azucar azucar negra
Hay cuanto me gusta why me alegra
Azucar azucar negra
Hay cuanto me gusta why me alegra

Azucar azucar negra
Hay cuanto me gusta why me alegra
Azucar azucar negra
Hay cuanto me gusta why me alegra

Que estoy en la lluvia en la hierba
Estoy en la nube why la piedra
Azucar azucar negra
Hay cuanto me gusta why me alegra

Soy dulce como el melao'
Alegre como el tambor
Azucar azucar negra
Hay cuanto me gusta why me alegra

why a la hora de la rumba
En la aguarata yo soy la reina
Azucar azucar negra
Hay cuanto me gusta why me alegra

Soy la caã±a why el cafe
Para mover gua guanco'
Azucar azucar negra
Hay cuanto me gusta why me alegra

Prende tengo marcada la piel
Con la rumba why el mongoi' why el mongoi'
Azucar azucar negra
(Azucar)
Hay cuanto me gusta why me alegra

Azucar azucar negra
Hay cuanto me gusta why me alegra
Yo soy la candela candela why mi cadelai' candela
Azucar azucar negra
Hay cuanto me gusta why me alegra

Azucar azucar negra
Como me gusta why como me alegra
(Azucar)
Azucar azucar negra
Hay cuanto me gusta why me alegra

Azucar azucar negra
",Azucar Negra,2014
Oscar D'León,"Guajira guantanamera
Guantanamera
Guajira guantanamera

Yo soy un hombre sincero
De donde crecen las palmas
Yo soy un hombre sincero
De donde crecen las palmas
Y antes de morir yo quiero
Cantar mis versos del alma

Guantanamera
Cultivo una rosa blanca
En junio como en enero
Cultivo una rosa blanca
En junio como en enero
Para el amigo sincero
Que me da su mano franca
Guantanamera 

Mi verso es de un verde claro
Y de un carmín encendido
Mi verso es de un verde claro
Y de un carmín encendido
Mi verso es un ciervo herido
Que busca en el monte amparo
Guantanamera",Guantanamera,2014
Oscar D'León,"Quimbara quimbara quma quimbamba
Quimbara quimbara quma quimbamba
Quimbara quimbara quma quimbamba
Quimbara quimbara quma quimbamba
Ee mama ee mama
Ee mama ee mama

La rumba me esta llamando bombo
Dile que ya voy
Que me espere un momentico asi
Mientras canto un guaguancó
Dile que no es un desprecio
Pues vive en mi corazónz
Mi vida es tan solo eso
Rumba buena y guaguancó

Ee mama ee mama

¿Cómo? ay dios mio
Pero que lio, y dice
Quimbara quimbara quma quimbamba
Quimbara quimbara quma quimbamba
Ay, si quieres gozar
Quieres bailar
Quimbara quimbara quma quimbamba
Quimbara quimbara quma quimbamba

Pero lo baila teresa y lo baila juanito
Quimbara quimbara quma quimbamba
Quimbara quimbara quma quimbamba

Oye cachin, cachan, cachan, cachumba
Quimbara quimbara quma quimbamba
Quimbara quimbara quma quimbamba

Quimbara quimbara quma quimbamba
Quimbara quimbara quma quimbamba
Pero lo baila teresa y también joseito

¿Cómo? azuca, azuca",Quimbara,2014
Oscar D'León,"Usted abusó, sacó provecho de mí, abusó
Sacó partido de mí abusó
De mi cariño usted abusó
Y me perdona, por seguir con este tema
Yo no sé escribir poema ni tampoco una canción, sin un tema de amor
Cada palabra cada verso me recuerda
El momento que mi amor se te entregó
Que mi amor se te entregó y usted abusó
Usted abusó, de mí cariño usted abusó
Sacó partido de mí abusó, sacó provecho de mí, abusó
Y fue mi mal

Me destruyó el desamor su gran escuela del dolor
Ya no sé si lo maldice o lo bendice el corazón
Cada palabra cada verso me recuerda
El momento que mi amor se te entregó
Cuando te entregué mi amor y usted abusó
Y fue mi mal por que jamás en mi creyó y usted
Sacó provecho de mi abusó
Y me perdona por quererle
Tanto, tanto, tanto y por eso mismo usted
Sacó provecho de mi abusó
No, no, no sé si lo maldice o lo bendice mi corazón

Por que, usted sacó provecho de mí, abusó
Yo no sé lo que pasó, que usted de mi se burló
De mi cariño usted, se burló, me dejó, se rió
Por eso ahora ya yo no vuelvo a querer
Sacó provecho de mí, abusó
Abusó de mí cariño
Ay de mi cariño usted se burló
De mi también abusó, consuélate como yo
He aprendido que en la vida en amor todo es mentira
De mi cariño usted, se burló, me dejó, se rió",Usted Abuso,2014
Oscar D'León,"Todo aquel 
Que piense que la vida es desigual 
Tiene que saber que no es así 
Que la vida es una hermosura 
Hay que vivirla 

Todo aquel 
Que piense que está solo y que está mal 
Tiene que saber que no es así 
Que en la vida no hay nadie solo 
Siempre hay alguien 

Ay, no hay que llorar (No hay que llorar) 
Que la vida es un carnaval 
Que es más bello vivir cantando 
Oh oh oh ay, no hay que llorar (No hay que llorar) 
Que la vida es una carnaval 
Y las penas se van cantando 

Oh oh oh ay, no hay que llorar (No hay que llorar) 
Que la vida es un carnaval 
Que es más bello vivir cantando 
Oh oh oh ay, no hay que llorar (No hay que llorar) 
Que la vida es un carnaval 
Y las penas se van cantado

Todo aquel 
Que piense que la vida siempre es cruel 
Tiene que saber que no es así
Que tan solo hay momentos malos 
Y todo pasa 

Todo aquel 
Que piense que esto nunca va cambiar 
Tiene que saber que no es así
Que al mal tiempo, buena cara 
Y todo cambia 

Ay, no hay que llorar (No hay que llorar) 
Que la vida es un carnaval 
Que es más bello vivir cantando 
Oh oh oh ay, no hay que llorar (No hay que llorar) 
Que la vida es una carnaval 
Y las penas se van cantando 

Oh oh oh ay, no hay que llorar (No hay que llorar) 
Que la vida es un carnaval 
Que es más bello vivir cantando 
Oh oh oh ay, no hay que llorar (No hay que llorar) 
Que la vida es un carnaval 
Y las penas se van cantado

(Carnaval) es para reír 
(No hay que llorar) para gozar 
(Carnaval) para disfrutar 
(Hay que vivir cantando) 
(Carnaval) la vida es un carnaval 
(No hay que llorar) todos podemos cantar 
(Carnaval) ay señores 
(Hay que vivir cantando) 
(Carnaval) todo aquel que piense 
(No hay que llorar) que la vida es cruel 
(Carnaval) nunca estará solo 
(Hay que vivir cantando) Dios está con él 

Para aquellos que se quejan tanto (bua) 
Para aquellos que solo critican (bua) 
Para aquellos que usan las armas (bua) 
Para aquellos que nos contaminen (bua) 
Para aquellos que hacen la guerra (bua) 
Para aquellos que viven pecando (bua) 
Para aquellos que nos maltratan (bua) 
Para aquellos que nos contagian (bua)",La  Vida Es Un Carnaval,2014
Oscar D'León,"Siempre seré, tabaco, rumba y son
La guajira, el danzón y la guaracha
El bolero y el guaguancó

De cuba para el mundo
Celia Cruz

Siempre seré, aguinaldo, bomba & plena
La danza, el seis y el mapeyé

De Puerto Rico para el
Mundo, India

Desde pequeña me gustaron tus canciones
No imaginé que algún día cantaría contigo
Gracias por aceptar mi invitación

Le negra tomasa nos bendice
Eres la voz de la experiencia
Siempre reinando y guarachando

Cuando me invitaste a cantar contigo
Con mucho gusto acepté y ahora tú
Y yó estamos cantando al mundo y a todos los que sienten
Rumba y guaguancó

La, la, le, ole
La, la, le, ola
La, la, le, ola

Porque yo soy como soy, asi me hicieron mar y candela
Para cantarle al mundo
Porque yo soy como soy, asi me hicieron mar y
Candela para cantarle al mundo

Para cantarles con amor y transmitirles mi sabor

Porque yo soy como soy ,asi me hicieron mar y
Candela para cantarle al mundo

Al mundo entero yo le canto
Con alegria y sentimiento

Porque yo soy como soy, asi me hicieron mar y
Candela para cantarle al mundo

Contigo canto con placer
Siento que vuelvo a nacer

Ay Celia que sabroso es el mambo
Azucar, azucar

Dime Celia, como es que se llega

Con profesionalismo, creyendo en uno mismo
Siendo como tu eres con humildad

Dime Celia como es que se llega

No dejes que la fama, se te suba a la cabeza
Se siempre original, nunca vayas a cambiar, uh

La princesa que es La India
Y la reyna que soy, yo okay

Sube por aqui
Sube por aqui, dobla por alla

Por donde?

Quedate arriba
Mantente firme, debes oirme

Tienes que estar en control
Controlate, ten control control
Quedate arriba

Con sacrificio y trabajo, en ti tienes que creer
No te dejes caer

Cuando me invitaste a cantar contigo
Con mucho gusto acepté y ahora tú
Y yó estamos cantando al mundo
Y a todos los que sienten, rumba buena y guaguancó

",La  Vox De la Experiencia,2014
Oscar de la Hoya,"Enseñame a vivir, 
a olvidar que me olvidaste y a seguir, 
a aceptar que nada he sido para ti,
a no necesitarte, a ser como antes fui

Enseñame a confiar 
que otro amor despues del tuyo llenara 
el vacio que ha quedado en tu lugar
a no despertar llorando porque te volvi a encontrar
en mis sueños

*CORO*
Estar sin ti
es no saber a donde voy
es despertar sin ver el sol
es no tener una razon para poder vivir
es renuncair a ser feliz
Estar sin ti es conocer la soledad
es convivir con la ansieda 
de no saber si volveras
es quererse morir y no poderlo conseguir

Enseñame a mentir, 
a esconder mi sufrimienrto y sonreir
a arrancarme tu recuerdo de raiz
a no necesitarte a ser como antes

A no despertar lñorando 
porque te volvi a encontrar
en mis sueños

*CORO*
Estar sin ti
es no saber a donde voy
es despertar sin ver el sol
es no tener una razon para poder vivir
es renuncair a ser feliz
Estar sin ti es conocer la soledad
es convivir con la ansieda 
de no saber si volveras
es quererse morir y no poderlo conseguir
",Estar Sin Ti,2000
