Band,Lyrics,Song,Year
Steve Howe,"Sister bluebird flying high above
Shine your wings forward to the sun
Hide the mysteries of life on your way
Though you've seen them, please don't say a word
What you don't know, I have never heard

Starship trooper, go sailing on by
Catch my soul, catch the very night
Hide the moment from my eager eyes
Though you've seen them, please don't tell a soul
What you can't see, can't be very whole

Speak to me of summer
Long winters longer than time can remember
Setting up of other roads
To travel on in old accustomed ways
I still remember the talks by the water
The proud sons and daughters 
That in the knowledge of the land 
Spoke to me in sweet accustomed ways

Mother life, hold firmly on to me
Catch my knowledge higher than the day
Lose as much as only you can show
Though you've seen them, please don't say a word
What I don't know, I have never shared

Loneliness is a power that we possess to give or take away forever
All I know can be shown by your acceptance of the fact there shown before you
Take what I say in a different way and it's easy to say that this is all confusion
As I see a new day in me, I can also show if you and you may follow

Speak to me of summer
Long winters longer than time can remember
Setting up of other roads
To travel on in old accustomed ways
I still remember the talks by the water
The proud sons and daughters 
That in the knowledge of the land 
Spoke to me in sweet accustomed ways",Starship Trooper: Life Seeker/Disillusion/Würm,1981
Steve Howe,"I awoke this morning
Love laid me down by a river.
Drifting I turned on upstream
Bound for my forgiver.
In the giving of my eyes to see your face.
Sound did silence me
Leaving no trace.
I beg to leave, to hear your wonderous stories.
Beg to hear your wonderous stories.

He spoke of lands not far
Or lands they were in his mind.
Of fusion captured high
Where reason captured his time.
In no time at all he took me to the gate.
In haste I quickly checked the time.
If I was late I had to leave to hear your wonderous stories.
Had to hear your wonderous stories.

Hearing
Hearing
Hearing your wonderous stories.
Hearing your wonderous stories.
It is no lie I can see deeply into the future.
Imagine everything
You're close
And were you there to stand
So cautiously at first and then so high.
As he spoke my spirit climbed into the sky.
I bid it to return
To hear your wonderous stories.
Return to hear your wonderous stories.

Hearing,
Hearing,
Hearing,
Hearing,
Hearing,",Wonderous Stories,1981
Steve Howe,"Yesterday a morning came, a smile upon your face
Caesar's palace, morning glory, silly human race,
On a sailing ship to nowhere, leaving any place,
If the summer change to winter, yours is no disgrace

Battleships confide in me and tell me where you are,
Shining, flying, purple wolfhound, show me where you are,
Lost in summer, morning, winter, travel very far,
Lost in musing circumstances, that's just where you are

Yesterday a morning came, a smile upon your face
Caesar's palace, morning glory, silly human, silly human race,
On a sailing ship to nowhere, leaving any place,
If the summer change to winter, yours is no, 
Yours is no disgrace
Yours is no disgrace
Yours is no disgrace

Death defying, mutilated armies scatter the earth,
Crawling out of dirty holes, their morals, 
Their morals disappear

Yesterday a morning came, a smile upon your face
Caesar's palace, morning glory, silly human, silly human, silly human race,
On a sailing ship to nowhere, leaving any place,
If the summer change to winter, yours is no,
Yours is no disgrace
Yours is no disgrace
Yours is no disgrace

Battleships confide in me and tell me where you are,
Shining, flying, purple wolfhound, show me where you are,
Lost in summer, morning, winter, travel very far,
Lost in musing circumstances, that's just where you are",Yours Is No Disgrace,1981
Steve Howe,"You better leave my kitten all alone, 
You better leave my kitten all alone. 
But I told you big fat bulldog, 
You better leave her alone. 

You better leave my kitten all alone, 
You better leave my kitten all alone. 
This dog is gonna get you 
If you don't leave her alone. 

Well Mr.Dog I'm gonna hit you 
On the top of your head. 
That child is gonna miss you, 
You gonna wish that you were dead. 
If you don't leave my kitten all alone. 
Well I told you big fat bulldog, 
You better leave her alone. 

Well Mr.Dog I'm gonna hit you 
On the top of your head. 
That girl is gonna miss you, 
You gonna wish that you were dead. 
If you don't leave my kitten all alone, oh yeah. 
Well I told you, big fat bulldog, 
You better leave her alone. 

Hey hey you better leave, you better leave, 
You better leave, yeah you better leave, 
You better leave, oh you got to leave",Leave My Kitten Alone,1994
Steve Howe,"My white bicycle, my white bicycle
                                                  
Riding all around the street
Four o'clock and they're all asleep
I'm not tired and it's so late
Moving fast everything looks great.

My white bicycle, my white bicycle

See that man, he's all alone
Looks so happy but he's far from home
Ring my bell, smile at him
Better kick over his garbage bin

My white bicycle, my white bicycle

The rain comes down but I don't care
The wind is blowing in my hair
Seagulls flying in the air

My white bicycle, my white bicycle

Policeman shouts but I don't see him
They're one thing I don't believe in
To find some charge but it's not leavin'

Lift both hands, his head in disgrace
Shines no light upon my face
Through the darkness, we still speed
My white bicycle and me

My white bicycle, my white bicycle
",My White Bicycle,1994
Steve Howe,"I'll be the round about
The words will make you out 'n' out
You change the day  your way
Call it morning driving through the sound and
In and out the valley

The music dance and sing
They make the children really ring
I spend the day your way
Call it morning driving through the sound and
In and out the valley

[Chorus]

In and around the lake
Mountains come out of the sky and they stand there
One mile over we'll be there and we'll see you
Ten true summers we'll be there and laughing too
Twenty four before my love you'll see 
I'll be there with you

I will remember you
Your silhouette will charge the view
Of distance atmosphere
Call it morning driving through the sound and
Even in the valley

[Chorus]

Along the drifting cloud the eagle searching
Down on the land
Catching the swirling wind the sailor sees
The rim of the land
The eagle's dancing wings create as weather
Spins out of hand

Go closer hold the land feel partly no more
Than grains of sand
We stand to lose all time a thousand answers
By in our hand
Nex to your deeper fears we stand
Surrounded by a million years
I'll be the roundabout
The words will make you out 'n' out
I'll be the roundabout
The words will make you out 'n' out

[Chorus]

I'll be the roundabout
The words will make you out 'n' out
I spend the day your way
Call it morning driving through the sound and
In and out the valley

[Chorus]",Roundabout,1994
Steve Howe,"Don't worry I'm not looking at you
Gorgeous and dressed in blue
Don't worry I'm not looking at you
Gorgeous and dressed in blue
I know it drives you crazy
When I pretend you don't exist
When I'd like to lean in close
And run my hands against your lips
Though we haven't even spoken
Still I sense there's a rapport
So whisper me your number
I'll call you up at home
Whisper me your number
I'll call you up at home
Don't worry I'm not looking at you 
Don't worry I'm not looking at you
Gorgeous and dressed in blue
Don't worry I'm not looking at you
I know you see me see you
As you see me walk on past
When there's nothing more I'd like to do
Then come in close and hear you laugh
Though we haven't even spoken
Still I sense there's a rapport
So whisper me your number
I'll call you up at home
Yea whisper me your number
I'll call you up at home
Whisper me your number
I'll call you up at home
Hmm whisper me your number
I'll call you up at home",Whispering,1994
Steve Howe,"Realizing a form out of stone
Set hands moving
Roan shaped his heart
Through his working hands

Work to mold his passion into clay
Like the sun
In his room, his lady
She would dance and sing so completely

So be still, he now cries
I have time, oh let clay transform thee so, love
In the deep cold of night
Winter calls, he cries, don't deny me

For his lady, deep her illness
Time has caught her
And will for all reasons take her
In the still light of dawn, she dies

Helpless hands soul revealing
Like leaves we touch, we learn
We once knew the story
As winter calls he will starve

All but to see the stone be life
Now Roan no more tears
Set to work his strength
So transformed him

Realizing a form out of stone, his work
So absorbed him
Could she hear him
Could she see him

All aglow was his room bathed in this light
He would touch her
He would hold her
Laughing as they danced

Highest colors touching others
Did her eyes at the turn of the century
Tell me plainly
How we meet, how we'll love

Or let life, so transform me
Like leaves we touched, we danced
We once knew the story
As autumn called and we both

Remembered all those many years ago
I'm sure we know
Was the sign with a touch
As I kiss your fingers

We walk hands in the sun
Memories when we're young
Love lingers so
Was it sun through the haze

That made all your looks
Warm as moonlight
As a pearl, deep your eyes
Tears have flown away

All the same light
Did her eyes at the turn of the century
Tell me plainly
When we meet how we'll look

As we smile time will leave me clearly
Like leaves we touch, we search
We will know the story
As autumn calls we will both remember

All those many years ago",Turn of the Century,1995
Steve Howe,"11:59 and it's all going well, the next second could be our last 
This is the moment we've all waited for, to see if the world's gonna' pass 
The seer and the psychic, the prophets of doom, are saying the world is at end 
It's all coming down to the next breath of life, the fear mongers fate is at hand 
Something we've never faced before 
Nothing we've ever seen before 
Will we all make it through the door 
That leads to the next century? 
Y2K was a heartbeat away, still everyone sounds the alarm 
Where did you hide when the digits all turned, did computers and power go down? 
The party's alive in California, in Times Square the clock's ticking on 
All over the world, spinning out of control, Celebration 2000 lives on 
Something we've never faced before 
Nothing we've ever seen before 
But we all made it through the door 
That leads to the next century 
Fear of the unknown causes doubt 
Millennium madness runs about 
The turn of the century rolls on 
The end of the world has come and gone 
Believe what you will but life goes on 
The turn of the century lives on 

Fear of the unknown causes doubt 
Millennium madness runs about 
The turn of the century rolls on 
The end of the world has come and gone 
Believe what you will but life goes on 
The turn of the century lives on 
Fear of the unknown causes doubt 
Millennium madness runs about 
The turn of the century rolls on 
The end of the world has come and gone 
Believe what you will but life goes on 
The turn of the century lives on",Excerpts from 'Turn of the Century',1999
Steve Howe,"Sister bluebird flying high above
Shine your wings forward to the sun
Hide the mysteries of life on your way
Though you've seen them, please don't say a word
What you don't know, I have never heard

Starship trooper, go sailing on by
Catch my soul, catch the very night
Hide the moment from my eager eyes
Though you've seen them, please don't tell a soul
What you can't see, can't be very whole

Speak to me of summer
Long winters longer than time can remember
Setting up of other roads
To travel on in old accustomed ways
I still remember the talks by the water
The proud sons and daughters 
That in the knowledge of the land 
Spoke to me in sweet accustomed ways

Mother life, hold firmly on to me
Catch my knowledge higher than the day
Lose as much as only you can show
Though you've seen them, please don't say a word
What I don't know, I have never shared

Loneliness is a power that we possess to give or take away forever
All I know can be shown by your acceptance of the fact there shown before you
Take what I say in a different way and it's easy to say that this is all confusion
As I see a new day in me, I can also show if you and you may follow

Speak to me of summer
Long winters longer than time can remember
Setting up of other roads
To travel on in old accustomed ways
I still remember the talks by the water
The proud sons and daughters 
That in the knowledge of the land 
Spoke to me in sweet accustomed ways",Disillusion,2001
Steve Howe,"We go sailing down the calming streams
Drifting endlessly by the bridge
To be over
We will see
To be over

Do not suffer through the game of chance that plays
Always doors to lock away your dreams
Think it over
Time will heal your fear
Think it over
Balance the thoughts that release within you

Childlike soul dreamer one journey
One to seek and see in ev'ry light do open
True pathways away

Carrying closer go gently
Holding doors will open everyway
You wander true pathways away

After all your soul will still surrender
After all don't doubt your part
Be ready to be loved",To Be Over,2001
Steve Howe,"I've seen all good people turn their heads each day
so satisfied I'm on my way.
I've seen all good people turn their heads each day
so satisfied I'm on my way.
Take a straight and stronger course to the corner of your life.
Make the white queen run so fast she hasn't got time to make you a wife.
'Cause it's time, it's time in time with your time and its news is captured
For the queen to use.
Move me on to any black square,
Use me any time you want,
Just remember that the goal
'Sfor us to capture all we want, anywhere,
Yea, yea, yea.
Don't surround yourself with yourself,
Move on back two squares,
Send an Instant Karma to me,
Initial it with loving care
Don't surround
Yourself.
'Cause it's time, it's time in time with your time and
its news is captured
For the queen to use.
Diddit diddit diddit diddit diddit diddit diddit didda.
Diddit diddit diddit diddit diddit diddit diddit
Didda.
Don't surround yourself with yourself,
Move on back two squares,
Send an Instant Karma to me,
Initial it with loving care
Don't surround
Yourself with yourself.
Don't surround yourself.
Send an Instant
Karma to me. Don't surround
yourself.
'Cause it's time, it's time in time with your time and its news is captured
For the queen to use.
Diddit diddit diddit diddit diddit diddit diddit didda.
Diddit diddit diddit diddit diddit diddit diddit didda.
Diddit diddit diddit diddit diddit diddit diddit didda.
Diddit diddit diddit diddit diddit diddit diddit didda.
'Cause it's time, it's time in time with your time and its news is captured.
II. All Good People
(Squire)
I've seen all good people turn their heads each day so satisfied I'm on my way.
I've seen all good people turn their heads each day so satisfied I'm on my way.
I've seen all good people turn their heads each day so satisfied I'm on my way.
I've seen all good people turn their heads each day so satisfied I'm on my way.
I've seen all good people turn their heads each day so satisfied I'm on my way.
I've seen all good people turn their heads each day so satisfied I'm on my way.
Yea, yea.
I've seen all good people turn their heads each day so satisfied I'm on my way.
I've seen all good people turn their heads each day so satisfied I'm on my way.
I've seen all good people turn their heads each day so satisfied I'm on my way.
I've seen all good people turn their heads each day so satisfied I'm on my way.",Your Move,2001
Steve Howe,"I was born on a farm out in Ioway
A flaming youth who was bound that he'd fly away
I packed my grip and I grabbed my saxophone
Can't read notes, but I play anything by ear
I made up tunes on the sounds that I used to hear
When I'd start to play folks used to say
""Sounds a little Goofus to me""
 
Cornfed chords appeal to me, I like rustic harmony
Hold that note and change the key, that's called ""Goofus""
Not according to the rules that you learn at music schools
But the folks just dance like fools, they go ""Goofus""
 
Got a job but I just couldn't keep it long
The leader said that I played all the music wrong
So I stepped out with an outfit of my own
Got together a new kind of orchestree
And we all played just the same ""Goofus"" harmony
And I must admit we made a hit
",Goofus,2003
Steve Howe,"Thank heaven for little girls
for little girls get bigger every day

Thank heaven for little girls
they grow up in the most delightful way

Those little eyes so helpless and appealing
one day will flash and send you crashin' thru the ceilin'

Thank heaven for little girls
thank heaven for them all,
no matter where no matter who
for without them, what would little boys do?

Thank heaven, thank heaven
Thank heaven for little girls",Thank Heaven for Little Girls,2003
Steve Howe,"Ok mummy, there's an airplane up in the sky

Ooo oo oo oh
Did you see the frightened ones
Did you hear the falling bombs
Did you ever wonder
Why we had to run for shelter
When the promise of a brave new world
Unfurled beneath a clear blue sky
Ooo oo oo oh
Did you see the frightened ones
Did you hear the falling bombs
The flames are all long gone
But the pain lingers on
Goodbye blue sky
Goodbye blue sky
Goodbye
Goodbye",Goodbye Blue Sky,2006
Steve Howe,"Yes
Close To The Edge

I. The Solid Time Of Change
Anderson/Howe

A seasoned witch could call you from the depths of your disgrace,
And rearrange your liver to the solid mental grace,
And achieve it all with music that came quickly from afar,
Then taste the fruit of man recorded losing all against the hour.
And assessing points to nowhere, leading ev'ry single one.
A dewdrop can exalt us like the music of the sun,
And take away the plain in which we move,
And choose the course you're running.

Down at the edge, round by the corner,
Not right away, not right away.
Close to the edge, down by a river,
Not right away, not right away.

Crossed the line around the changes of the summer,
Reaching to call the color of the sky.
Passed around a moment clothed in mornings faster than we see.
Getting over all the time I had to worry,
Leaving all the changes far from far behind.
We relieve the tension only to find out the master's name.

Down at the end, round by the corner.
Close to the edge, just by a river.
Seasons will pass you by.
I get up, I get down.
Now that it's all over and done,
Now that you find, now that you're whole.

II. Total Mass Retain
Anderson/Squire

My eyes convinced, eclipsed with the younger moon attained with love.
It changed as almost strained amidst clear manna from above.
I crucified my hate and held the word within my hand.
There's you, the time, the logic, or the reasons we don't understand.

Sad courage claimed the victims standing still for all to see,
As armoured movers took approach to overlook the sea.
There since the cord, the license, or the reasons we understood will be.

Down at the edge, close by a river.
Close to the edge, round by the corner.
Close to the end, down by the corner.
Down at the edge, round by the river.

Sudden call shouldn't take away the startled memory.
All in all, the journey takes you all the way.
As apart from any reality that you've ever seen and known.
Guessing problems only to deceive the mention,
Passing paths that climb halfway into the void.
As we cross from side to side, we hear the total mass retain.

Down at the edge, round by the corner.
Close to the end, down by a river.
Seasons will pass you by.
I get up, I get down.

III. I Get Up, I Get Down
Anderson/Howe

In her white lace
You can clearly see the lady sadly looking.
Saying that she'd take the blame
For the crucifixion of her own domain.

I get up, I get down,
I get up, I get down.
Two million people barely satisfy.
Two hundred women watch one woman cry, too late.
The eyes of honesty can achieve.
How many millions do we deceive each day?

[Thru the duty she would coil their said
Amusement of her story asking only interest
Could be laid upon the children of her domain]

I get up, I get down.
I get up, I get down.

In charge of who is there in charge of me.
Do I look on blindly and say I see the way?
The truth is written all along the page.
How old will I be before I come of age for you?
I get up, I get down.
I get up, I get down.
I get up, I get down.

IV. Seasons Of Man
Anderson/Howe

The time between the notes relates the color to the scenes.
A constant vogue of triumphs dislocate man, so it seems.
And space between the focus shape ascend knowledge of love.
As song and chance develop time, lost social temp'rance rules above.
Ah, ah.

Then according to the man who showed his outstretched arm to space,
He turned around and pointed, revealing all the human race.
I shook my head and smiled a whisper, knowing all about the place.
On the hill we viewed the silence of the valley,
Called to witness cycles only of the past.
And we reach all this with movements in between the said remark.

Close to the edge, down by the river.
Down at the end, round by the corner.
Seasons will pass you by,
Now that it's all over and done,
Called to the seed, right to the sun.
Now that you find, now that you're whole.
Seasons will pass you by,
I get up, I get down.
I get up, I get down.
I get up, I get down.


And You And I

I. Cord Of Life
Anderson/Bruford/Howe/Squire

A man conceived a moment's answers to the dream.
Staying the flowers daily, sensing all the themes.
As a foundation left to create the spiral aim,
A movement regained and regarded both the same,
All complete in the sight of seeds of life with you.
Changed only for a sight of sound, the space agreed.
Between the picture of time behind the face of need,
Coming quickly to terms of all expression laid,
Emotion revealed as the ocean maid,
All complete in the sight of seeds of life with you.
Oh.

Coins and crosses

Turn round tailor, assaulting

Never know their fruitless worth;

all the mornings of the interest shown,

presenting one another to the cord,

Cords are broken,

All left dying, rediscovered

Of the door that turned round,

Locked inside the mother earth.

To close the cover, all the

interest shown,

They won't hide, hold, they won't tell you,

To turn one another, to the sign at the time float your climb.

Watching the world, watching all of the world,

Watching us go by.

And you and I climb over the sea to the valley,
And you and I reached out for reasons to call.

II. Eclipse
Anderson/Bruford/Squire

Coming quickly to terms of all expression laid,
Emotion revealed as the ocean maid,
As a movement regained and regarded both the same,
All complete in the side of seeds of life with you.

III. The Preacher the Teacher
Anderson/Bruford/Howe/Squire

Sad preacher nailed upon the coloured door of time;
Insane teacher be there reminded of the rhyme.
There'll be no mutant enemy we shall certify;
Political ends, as sad remains, will die.
Reach out as forward tastes begin to enter you.
Ooh, ooh.

I listened hard but could not see
Life tempo change out and inside me.
The preacher trained in all to lose his name;
The teacher travels, asking to be shown the same.
In the end, we'll agree, we'll accept, we'll immortalize
That the truth of the man maturing in his eyes,
All complete in the sight of seeds of life with you.

Coming quickly to terms of all expression laid,
As a moment regained and regarded both the same,
Emotion revealed as the ocean maid,
A clearer future, morning, evening, nights with you.

IV. Apocalypse
Anderson/Bruford/Howe/Squire

And you and I climb, crossing the shapes of the morning.
And you and I reach over the sun for the river.
And you and I climb, clearer, towards the movement.
And you and I called over valleys of endless seas.


Siberian Khatru
Anderson/Howe/Wakeman

Sing, bird of prey;
Beauty begins at the foot of you. Do you believe the manner?
Gold stainless nail,
Torn through the distance of man
As they regard the summit.

Even Siberia goes through the motions.
Hold out and hold up;
Hold down the window.

Outbound, river,

Hold out the morning that comes into view.

Bluetail, tailfly.

River running right on over my head.

How does she sing?
Who holds the ring? And ring and you will find me coming.
Cold reigning king,
Hold all the secrets from you
As they produce the movement.

Even Siberia goes through the motions.
Hold out and hold up;
Hold down the window.

Outbound, river,

Hold out the morning that comes into view.

Bluetail, tailfly.

River running right over the outboard, river,
Bluetail, tailfly,
Luther, in time.
Dude'ndoodit, dah, d't-d't-dah.

Hold down the window;
Hold out the morning that comes into view.
Warm side, the tower;
Green leaves reveal the heart spoken Khatru.

Gold stainless nail,
Torn through the distance of man as they regard the summit.
Cold reigning king,
Shelter the women that sing
As they produce the movement.
River running right on over my head

Outboard, river.

Bluetail, tailfly,
Luther, in time,
Suntower, asking,
Cover, lover,
June cast, moon fast,
As one changes,
Heart gold, leaver,
Soul mark, mover,
Christian, changer,
Called out, saviour,
Moon gate, climber,
Turn round, glider.

© 1972 Yessongs Ltd., ASCAP
Used by permission. All rights reserved.
",Close To the Edge,2008
