Band,Lyrics,Song,Year
Ben Green,"Oh, it's a cold
Cold stone wall
One hand
One face against the wall
I watch the people and they're 
Each weighing their private losses
And the cold sweet morning air
Surrounds a crop of blank white crosses
I'm reading 
I'm not believing
they're all just names on a wall
They were once living hey were
Once breathing now
they're all just names
Names on a wall
Oh, I press my ear against the wall
I hear a helicopter, a bomb explode
I hear the echoes of a thousand souls
And then one young face
He says to me
Please remember me
I want to set him free
But all I see are
Blank white crosses stretched out to infinity
Chorus
Hey Johnny
Can you hear your momma call?
Hey Johnny
She leaves the light on in the hal
Chorus",Names on a Wall,2002
Ben Green,"I sit at my window watching the rain
Counting the cars on Riverside
I wish we were on a plane in the blue skies baby
Looking down on the clouds and the rain
From the other side

[Chorus]
Take me to paradise
Let’s go away
Take me to paradise

Somewhere someone is taking it slowly 
Someone is lying under the sun
I wish we could get away to those blue skies, baby
Maybe we could forget all the reasons we wanted to run

[Chorus]

I wish we could find a place 
Where you and I would be the only ones
It’s just you and me, It’s just you and me

[Chorus]",Paradise,2002
Ben Green,"Do you think that I would love you if I were famous
How 'bout if somebody made me king
Why can't you say that I already rule the world
And no one else could give me anything

Do you think that I would leave you for somebody better
Do you think that I want someone new
Why can't you see that I've got everything
And I can't go any farther without you

Without you there's no finding joy in sadness
Silver linings don't appear on any clouds
And there ain't no finding any sense in madness
Without you only emptiness surrounds me

Do you think I don't hear you when you're calling
Have I given any reason for concern
Why can't you see that I hear everything
What I don't understand I'll try to learn

Without you I've got nothing to go back on
'Cause this house could never really be a home 
And there ain't no one to light up this darkness
Without you I just stand alone

Just me baby
I only want to give you everything you need
Don't you know when you go that I'm the one who bleeds
Without you there's no finding joy in sadness

Silver linings don't appear on any clouds
And there ain't no finding any sense in madness
Without you only emptiness surrounds me",Without You,2002
Ben Haenow,"I had a dream the other night
About how we only get one life
Woke me up right after two
Stayed awake and stared at you
So I wouldn't lose my mind

And I had the week that came from hell
And yes I know that you can tell
But you're like the net under the ledge
When I go flying off the edge
You go flying off as well
And if we're only here once I wanna live with

You've got something I need
In this world full of people there's one loving me
And if we only here once (hey)
I wanna live with you (you, you, you)
You've got something I need
In this world full of people there's one loving me
And if we only here once (hey)
I wanna live with you (you, you)

Last night I think I drank too much
Call it our temporary crutch
With broken words I've tried to say
Honey don't you be afraid
If we've got nothing we've got us
And if we're only here once I wanna live with

You've got something I need
In this world full of people there's one loving me
And if we only here once (hey)
I wanna live with you (you, you, you)

I know that we're not the same
But I'm so damn glad that we made it
To this time, this time, now

You've got something I need
In this world full of people there's one loving me
And if we only here once
I wanna live with you, yeah

You've got something I need
In this world full of people there's one loving me
And if we only here once (hey)
I wanna live with you (you, you, you)

You've got something I need
In this world full of people there's one loving me
And if we only here once (hey)
I wanna live with you (you, you, you)
And if we only here once (hey)
I wanna live with you
And if we only here once
I wanna live with you",Something I Need,2015
Ben Haggard,"It's a big job just gettin' by with nine kids and a wife
I been a workin' man dang near all my life 
I'll be working long as my two hands are fit to use 
I'll drink my beer in a tavern
Sing a little bit of these working man blues

I keep my nose on the grindstone, I work hard every day
Might get a little tired on the weekend, after I draw my pay
But I'll go back workin', come Monday morning I'm right back with the crew
I'll drink a little beer that evening
Sing a little bit of these working man blues

Hey hey, the working man, the working man like me
I ain't never been on welfare, that's one place I won't be
'Cause I'll be working long as my two hands are fit to use
I drink a little beer in a tavern
Sing a little bit of these working man blues

Sometimes I think about leaving, do a little bummin' around
I want to throw my bills out the window catch a train to another town
But I go back working I gotta buy my kids a brand new pair of shoes
Yeah drink a little beer in a tavern
Cry a little bit of these working man blues

Hey hey, the working man, the working man like me
I ain't never been on welfare, that's one place I won't be
'Cause I'll be working long as my two hands are fit to use
I drink a little beer in a tavern
Sing a little bit of these working man blues
Yeah drink a little beer in a tavern
Cry a little bit of these working man blues",Workin' Man Blues,2011
Ben Haggard,"It's a big job just gettin' by with nine kids and a wife
I been a workin' man dang near all my life 
I'll be working long as my two hands are fit to use 
I'll drink my beer in a tavern, 
Sing a little bit of these working man blues

I keep my nose on the grindstone, I work hard every day
Might get a little tired on the weekend, after I draw my pay
But I'll go back workin, come Monday morning I'm right back with the crew
I'll drink a little beer that evening, 
Sing a little bit of these working man blues

Hey hey, the working man, the working man like me
I ain't never been on welfare, that's one place I won't be
Cause I'll be working long as my two hands are fit to use
I drink a little beer in a tavern
Sing a little bit of these working man blues

Sometimes I think about leaving, do a little bummin' around
I wanna throw my bills out the window catch a train to another town
But I go back working I gotta buy my kids a brand new pair of shoes
Yeah drink a little beer in a tavern,
Cry a little bit of these working man blues

Hey hey, the working man, the working man like me
I ain't never been on welfare, that's one place I won't be
Cause I'll be working long as my two hands are fit to use
I drink a little beer in a tavern
Sing a little bit of these working man blues
Yeah drink a little beer in a tavern,
Cry a little bit of these working man blues",Working Man Blues,2011
Ben Hague,"I know a thing or two about you
And I think you find the best of me
Sometimes in search for high
You take a blow
But nothing can make you complete

The game is up
The truth is out there
Your time is up
Can't take it back

Sometimes in search for high
You take a blow
What we've got
Ain't no stop
Ain't no stoppin' a good thing

Ain't no stoppin' a good thing
Ain't no stoppin' a good thing

Ain't no stop
Ain't no stop
Ain't no stoppin' a good thing

I know a thing or two about you
And I think you find the best of me
Sometimes in search for high
You take a blow
But nothing can make you complete

The game is up
The truth is out there
Your time is up
Can't take it back

Sometimes in search for high
You take a blow
What we've got
Ain't no stop
Ain't no stoppin' a good thing",Ain't No Stoppin',2012
Ben Haist,"Oh,Mickey, you’re so fine
You’re so fine you blow my mind, hey Mickey, (Hey hey)
Hey Mickey (Hey, hey)

Oh, Mickey, you’re so fine (You’re so fine and you’re mine)
I’ll be yours till the end of time
'Cause you make me feel
Yeah, you make me feel
So shiny and new

Like a virgin
Touched for the very first time (Touched for the first time)

Like the one in me
That’s O.K.
Let’s see how you do it
Put up your dukes
Let’s get down to it

Hit me with your best shot
Why don’t you hit me with your best shot
Hit me with your best shot
Fire away

Na na na come on
Na na na na na, come on, come on, come on

'Cause I may be bad but I’m perfectly good at it
Sex in the air, I don’t care I love the smell of it
Sticks and stones may break my bones, but chains and whips excite me
'Cause I may be bad, but I’m perfectly good at it

Sex baby,
Let’s talk about you and me
Let’s talk about all the good things and the bad things that may be
Let’s talk about sex (Alright)
Let’s talk about sex (A little bit, a little bit)
Let’s talk about sex, baby

Baby, all through the night, I’ll make love to you,
Like you want me too

(And I) And I guess it’s just the woman in you,
That brings out the man in me
I know I can’t help myself
You’re all in the world to me

It feels like the first time
It feels like the very first time
It feels like the first time

It’s going down fade to Blackstreet
The homies got at me collab creations bump, like acne
No doubt, I put it down never slouch
As long as my credit could vouch, a dog couldn’t catch me, straight up
Tell me who could stop when Dre making moves, attracting honeys like a magnet
Giving them eargasms with my mellow accent
Still moving this flavour with homies Blackstreet and Teddy
The original rump shakers (Shorty get down)

Good Lord
Baby got them open up all over town
Strictly biz she don’t play around
Cover much ground got game by the pound
Getting paid is her forte
Each and every day, true player way
I can’t get her outta my mind
I think about the girl all the time

I like the way you work it
No diggity, I got to bag it up, baby

(Girl)I like the way you work it,
No diggity, I got to bag it up, baby,

I like the way you work it
No diggity, I got to bag it up, baby

I like the way you work it
No diggity, I got to bag it up

I like the way you work it
No diggity, I got to bag it up , babe

I like the way you work it
No diggity, I got to bag it up
We out",Riff Off: Mickey/Like a Virgin/Hit Me with Your Best Shot/S&M/Let's Tal,2012
Ben Harney,"When I first saw you, I said ""Oh my""
I said ""oh my, that's a dream, that's my dream""
I needed a dream when it all seemed to go bad
Then I found you and I have had the most beautiful dreams
Any man's ever had

When I first saw you, I said ""oh my
Oh my, that's my dream, that's my dream""
I needed a dream to make me strong
You are the only reason I had to go on

You are my dream, all the things I'll never knew
You are my dream who could believe they could ever come true
And who would believe, the world would believe in my dreams too

When I first saw you, I said ""oh my
Oh my, that's my dream",When I First Saw You,1982
Ben Harper,"Everybody talk about it
Burning hell
Ain't no heaven, I know
Ain't no burning hell
Where I die I go
Can't nobody tell

I am going, Deacon Jones
I went down to the church house
I got down on my bended knee
I prayed, I prayed all night, I prayed
Deacon Jones, pray for me

I went down to the church house
I got down on my knee
I begged, Deacon Jones to pray for me
He said, son, here my hand

Ain't no heaven
Ain't no burning hell

Ain't no heaven, ain't no heaven, no burning hell
When I die, where I go, nobody know

No burning hell
Ain't no burning, no burning hell
When I die, in my grave, nobody know where I'm going
Ain't no heaven, ain't no hell
When I die, nobody tell

Hey hey, hey hey
Deacon Jones, pray for me

I don't believe, I don't believe in no heaven
I don't believe in no hell
When I die, where I go, nobody know",Burnin' Hell,1998
Ben Harper,"It takes a hundred miles of love
To heal a mile of pain
I never say goodbye to the sea
I never blow out a flame
And I've got white lies for dark times
And I don't need your crutch
I'm kicking out the stained glass windows
And I'm tender to the touch

Shimmer and shine
We leave it all behind
Shimmer and shine
When you tell me that you're mine
Shimmer and shine, shimmer and shine

Bring me the music for the revolution
It puts my mind at ease to know
We're the problem, we're the solution
The cure and the disease
But life is trying to force me, force me to trust
I've done all I can, I'll do what I must

Shimmer and shine
We leave it all behind
Shimmer and shine
When you tell me that you're mine
We shimmer and shine
Shimmer and shine",Shimmer and Shine,
Ben Harper,"Papa he left home today 
Said he ain't comin' back again 
Said he ain't gonna be nobody's second best 
Just cause mama's got a special kind of friend 

Papa he left home today 
Said he ain't comin' back no more 
Said he ain't gonna take no damn back seat and how could mama do him so low 

But mama's got a girlfriend now boy 
Mama's got a girlfriend 
Now mama's got a girlfriend mama's got a true friend 
Mama's got a girlfriend now 

You see mama don't watch your damn football and your beer drinkin' 
Just won't do you're just stayin' out late and you're preachin' 
The hate and you never have been true 

You see mama she want her 
Somebody who will let her be herself 
so she's leavin' you and your stinky damn ways cause 

She's found somebody else 
And mama's got a girlfriend 
Now boy mama's got a girlfriend 
Now mama's got a girlfriend mama's found a true friend 
Mama's got a girlfriend now 

Papa he left home today 
He was wavin' his hands and cryin' 
You could tell by the sound and the tone in his voice that 
His heart was slowly dyin' 

But mama said ""Boy if I ever catch you 'round here again 
You ain't never gonna have nobody else not a woman or a man"" 

And mama's got a girlfriend 
Now boy mama's got a girlfriend 
Now mama's got a girlfriend mama found a true friend 
Mama's got a girlfriend 
Now mama's got a girlfriend 
Now boy mama's got a girlfriend 
Now mama's got a girlfriend 
Mama's found a true friend 
Mama's got a girlfriend now",Mama's Got a Girlfriend Now,1994
Ben Harper,"You don't believe that I love you
And even if that was true
Why just to keep our unhappy home
I'm gonna try to pretend that I do
But I'm breakin' down
I'm breakin' down
I'm breakin' down
I'm breakin' down
My baby she left me
Said she ain't comin' back around
And I'm breakin' down
I'm breakin' down

And if I thought that it was okay
For a grown man to cry
I would have filled up the whole mighty ocean
When she said goodbye
And I'm breakin' down
I'm breakin' down
I'm breakin' down
I'm breakin' down
You know my baby she left me
Said she ain't comin' back around
And I'm breakin' down
I'm breakin' down

One day you said everything was just right
I don't see how it changed overnight
One day you said everything was so strong
The next day you turn to me and say
It' s been wrong all along

Oh and now you won't even look at me
You pass me by in the street and you won't even speak
I never meant to cause you any harm
How could two people start so close
And end up so far
I'm breakin' down
I'm breakin' down
I'm breakin' down
I'm breakin' down",Breakin' Down,1994
Ben Harper,"You say what's mine is mine
And what's yours is mine too
Now you've got more than you can spend
But all of the money
In the whole wide world
Is not gonna help you in the end
Now while there's still time to be saved
Don't take that attitude to your grave
Might be too late for you I'm afraid
Don't take that attitude to your grave
Don't you take it there

I hear helicopters
Over my house every day
Shining their lights and flying low
Treat a child like a criminal
From the day that he is born
And you're gonna reap just what you sow
Now while there's still time to be saved
Don't take that attitude to your grave
Might be too late for you I'm afraid
Don't take that attitude to your grave
Don't you take it there

So you can move your court case
Way across town
You can move it across the whole wide globe
But it ain't gonna help your court case
Up in the sky
When you go to put on your white robe
Now while there's still time to be saved
Don't take that attitude to your grave
Might be too late for you I'm afraid
They don't want it there
Don't you take it there

And you dare the children
To stay off of drugs
Now I dare you to stop letting them in
And how dare you point your finger
At a gang out on the street
While it's you who is committing the sin
Now while there's still time to be saved
Don't take that attitude to your grave
Might be too late for you I'm afraid
Don't take that attitude to your grave
Don't you take it there
They don't want it there
You know your mother taught you better
Don't take that attitude to your grave",Don't Take That Attitude to Your Grave,1994
Ben Harper,"Not talkin' 'bout a year
No not three or four
I don't want that kind of forever
In my life anymore
Forever always seems
To be around when it begins
But forever never seems
To be around when it ends
So give me your forever
Please your forever
Not a day less will do, from you

People spend so much time
Every single day
Runnin' 'round all over town
Givin' their forever away
But no not me, I won't let my forever roam
And now I hope I can find my forever home
So give me your forever
Please your forever
Not a day less will do, from you

Like a hand-less clock with numbers
An infinite of time
No not the forever found
Only in the mind
Forever always seems
To be around when things begin
But forever never seems
To be around when things end
So give me your forever
Please your forever
Not a day less will do
From you",Forever,1994
Ben Harper,"Exactly how much will have to burn
Before we will look to the past to learn
We walk along this endless path
Which has led us in a circle
So here we are right back
We can't let the future become our past
If we are to change the world
Won't you tell me
Tell me please
How many miles must we march
How many miles must we march

When I was a baby I was not prejudiced
Hey how about you
This was something
That I learned in school
Something they taught us to do
We can't let our future become our past
If we are to change the world
Won't you tell me
Tell me please
How many miles must we march
How many miles must we march

There must come a day
When a box is not somebody's home
The unfinished work of our heroes
Must truly be our own
We can't let the future become our past
If we are to change the world
Won't you tell me
Tell me please
How many miles must we march
How many miles must we march
How many miles must we march
How many miles must we march
How many miles must we march
How many miles must we march",How Many Miles Must We March,1994
Ben Harper,"You may write me down in history
With your bitter twisted lies
You may trod me down in the very dirt
And still like the dust I'll rise
Does my happiness upset you
Why are you best with gloom
Cause I laugh like I've got an oil well
Pumpin' in my living room

So you may shoot me with your words
You may cut me with your eyes
And I'll rise
I'll rise
I'll rise
Out of the shacks of history's shame
Up from a past rooted in pain
I'll rise
I'll rise
I'll rise

Now did you want to see me broken
Bowed head and lowered eyes
Shoulders fallen down like tear drops
Weakened by my soulful cries

Does my confidence upset you
Don't you take it awful hard
Cause I walk like I've got a diamond mine
Breakin up in my front yard

So you may shoot me with your words
You may cut me with your eyes
And I'll rise
I'll rise
I'll rise
Out of the shacks of history's shame
Up from a past rooted in pain
I'll rise
I'll rise
I'll rise

So you may write me down in history
With your bitter twisted lies
You may trod me down in the very dirt
And still like the dust I'll rise

Does my happiness upset you
Why are you best with gloom
Cause I laugh like I've got a goldmine
Diggin' up in my living room

Now you may shoot me with your words
You may cut me with your eyes
And I'll rise
I'll rise
I'll rise
Out of the shacks of history's shame
Up from a past rooted in pain
I'll rise
I'll rise
I'll rise",I'll Rise,1994
Ben Harper,"Well Martin's dream
Has become Rodney's worst
Nightmare
Can't walk the streets
To them we are fair game
Our lives don't mean a thing
Like a king, like a king, like a king
Rodney King, Rodney King, Rodney King
Like a king, like a king, like a king
How I wish you could help us Dr. King
Make sure it's filmed
Shown on national T.V.
They'll have no mercy
A legal lynch mob
Like the days strung up from the tree
The L.A.P.D.
Like a king, like a king, like a king
Rodney King, Rodney King, Rodney King
Like a king, like a king, like a king
How I wish you could help us Dr. King
So if you catch yourself
Thinking it has changed for the best
You better second guess
Cause Martin's dream
Has become Rodney's worst
Nightmare
Like a king, like a king, like a king
Rodney King, Rodney King, Rodney King
Like a king, like a king, like a king
How I wish you could help us Dr. King",Like a King,1994
Ben Harper,"I'm leaving here on the morning train
And I will never see this world again
I've felt pleasure
And I have felt pain
And I know now
That I can never be the same

How I wonder why the world can be so cold
And if only good die young
Then left with me cruel here to grow old
And I felt pleasure
And I felt pain
And I know now
I can never be the same

And if someday I find my peace of mind
I will share my wealth with all of human kind
I've felt pleasure
And I have felt pain
And I know now
That I can never be the same

So if the sun does shine or rain does fall
I give thanks I've had my sight to see through it all
And I've felt pleasure
And I've felt pain
And I know now
That I can never be the same",Pleasure and Pain,1994
Ben Harper,"Waiting on an angel
One to carry me home
Hope you come to see me soon
Cause I don't want to go alone
I don' t want to go alone

Now angel won't you come by me
Angel hear my plea
Take my hand lift me up
So that I can fly with thee
So that I can fly with thee

And I'm waiting on an angel
And I know it won' t be long
To find myself a resting place
In my angel's arms
In my angel's arms

So speak kind to a stranger
Cause you'll never know
It just might be an angel come
Knockin' at your door
Knockin' at your door

And I'm waiting on an angel
And I know it won't be long
To find myself a resting place
In my angel's arms
In my angel's arms

Waiting on an angel
One to carry me home
Hope you come and see me soon
Cause I don' t want to go alone
I don't want to go alone
Don't want to go
I don't want to go alone",Waiting on an Angel,1994
Ben Harper,"Oh no
Here comes that sun again
That means another day
Without you my friend

And it hurts me
To look into the mirror at myself
And it hurts even more
To have to be with somebody else
And it's so hard to do
And so easy to say
But sometimes, sometimes you just have to walk away
Walk away

With so many people
To love in my life
Why do I worry
About one

But you put the ""happy""
In my ""ness""
You put the good times
Into my fun
And it's so hard to do
And so easy to say
But sometimes, sometimes you just have to walk away
Walk away
And head for the door

We've tried the goodbye
So many days
We walk in the same direction
So that we could never stray
They say if you love somebody
Than you have got to set them free
But I would rather be locked to you
Than live in this pain and misery

They say time will
Make all this go away
But it's time that has taken my tomorrows
And turned them into yesterdays
And once again that rising sun is droppin' on down
And once again you my friend are nowhere to be found
And it's so hard to do
And so easy to say
But sometimes, sometimes you just have to walk away
Walk away
And head for the door
You just walk away
Walk away
Walk away
Just walk on, walk on, turn and head for the door, just walk away.",Walk Away,1994
Ben Harper,"Welcome to the cruel world
Hope you find your way
Welcome to the cruel world
Hope you find your way
It's a cruel world
Try to enjoy your stay

Yes it is a cruel world
When you're tryin' to get by
It's a cruel world
When you've seen the look in their eye
Makes life hard living
But I'm so scared to die

Welcome to the cruel world
Welcome
Welcome

Don't know how
We've lasted here so long
There must be more good than bad
Or we'd already be gone
And if you get up to heaven
Before I do
I'm gonna tell ya
It's gonna be cruel there too

You can't hide from this cruel world
Cause there is no place to run
You can't hide from the cruel world
There just is no place to run
It's been cruel from the beginning
It will be cruel when we're done

So when I'm gone
I will gladly say goodbye
When I am gone
I will gladly say goodbye
And if you want to feel me
Put your hands up to the sky

Welcome to the cruel world
Welcome
Welcome
Hope you find your way
Try to enjoy your stay",Welcome to the Cruel World,1994
