Band,Lyrics,Song,Year
Dice Raw,"He said yeah
You better come out with your hands up
We got you surrounded
I'm in the back, changing my outfit
He said blink
We gonna send the hounds in
I said wait
Cause here I come
Here I come
Here I come
You boys get ready
Cause here I come
Here I come
Here I come
He said yeah
You better come out with your hands up
We got you surrounded
I'm in the back, changing my outfit
He said blink
We gonna send the hounds in
I said wait
Cause here I come
Here I come
Here I come
You boys get ready
Cause here I come
Here I come
Here I come

Uh I'm soul brother one hunted
How much charisma could another one stomach?
If I be the prisoner then I wasn't more cunning or wise
If I come outside I'm not running
Stone lone wolf of the pack, the unwanted
I really got nothin to hide, I'm bout cuttin
Go out in a blaze, wouldn't pop one button
I'm a murk half hurt leave the cop dogs huntin
The pretty black one in the group
The smooth villain under fire
Cause I'm pennin the words that move millions
Slide right in front of your eyes true brilliance
It's a new bad moon on the rise, who feelin it
New true skill in it
Y'all the roots still in it
Ready plus willin it's all the true killer shit
You know we got them
Involved
We too diligent
They say the music is strong and too militant

He said yeah
You better come out with your hands up
We got you surrounded
I'm in the back, changing my outfit
He said blink
We gonna send the hounds in
I said wait
Cause here I come
Here I come
Here I come
You boys get ready
Cause here I come
Here I come
Here I come

Black Inc, raw life
In this what-you-might-call-it
Weed smokin junkie alcoholic
One foot in the grave
One foot in the toilet
Still I'm onstage
In front of an audience
Disturbing the peace
And the local ordinance
This pimp shit popping
I need coordinates
My ETA
I'll arrive by morning
Money long like the arms on Alonzo Mourning
Vampire chicks suck blood
Dusk to dawnin
Waitin to catch me sleep
But I'm not yawnin
They in the vip
At the garden
They gon jump me
When I stop performing
I got something for them
Behind the organ
I always roll deep
With my squadron
The sheriff out front
Gonna sic the dogs in
That nigga talkin bout he got warrants

He said yeah
You better come out with your hands up
We got you surrounded
I'm in the back, changing my outfit
He said blink
We gonna send the hounds in
I said wait
Cause here I come
Here I come
Here I come
You boys get ready
Cause here I come
Here I come
Here I come

I'm in the darkness
Heartless
Fuck you regardless
Move with hardness
Y'all just pressin charges
It's often injury
Floss and force my entry
This peninitentiary
Knockin niggas for centuries
It's elementary
Like KRS and evidently
Incidents
They all stress
I'm lawless
That's my problem
Evolve
And never solve them
Chill in Harlem
Bang you
Bring you stardom
You full of boredom
Bastard you been aborted
Bring your neck out
Bring the tec' out
Absorb it
See you check out
And then step out
The orbit
Blow your flesh out
Till I'm fressh out my torment
Street apostle
Pop shit
Preach the Gospel
Still I'm hostile
Sippin a duece When possible
Turn into a monster
Grouchy
Gimme the Oscar
Hit you like vodka
Then screech off in a Mazda

He said yeah
You better come out with your hands up
We got you surrounded
I'm in the back, changing my outfit
He said blink
We gonna send the hounds in
I said wait
Cause here I come
Here I come
Here I come
You boys get ready
Cause here I come
Here I come
Here I come
He said yeah
You better come out with your hands up
We got you surrounded
I'm in the back, changing my outfit
He said blink
We gonna send the hounds in
I said wait
Cause here I come
Here I come
Here I come
You boys get ready
Cause here I come
Here I come
Here I come",Here I Come,2006
Dice Raw,"Look my squad's half mandrill half Mandela
My band bout seventy strong just like fela
Yeah part Melly Mel part Van Halen
And we represent illadel where they still rebellin'
A yo sicko show like mike moore's
My city ain't nothing like your's
Slippin' into darkness like war! night-crawl
With the lights off, you see a lot of life loss for the white horse
Regardless, the charges makin' us all targets
All on the red carpet, guns from the black market
Hey who got the politicians in they back pocket
Pimp slap pump that gimme that profit
When you make contact gimme that gossip
If you break contract you'll be that hostage
They getting busy in the city it's raw
Better deadbolt the door it ain't safe no more

Southside get busy yall
Northside get busy yall
Westside get busy yall
Worldwide get busy yall

Approach with caution be cautious when talking to bosses
I feel I've been through a metamorphosis
I'm mutated by unknown forces
The feelin' of course is something thats hard to describe I'm half dead never felt more alive
Reborn removed the gold coins from my eyes
I've been down but now I'm back up
Bout to act up boy you better back up
When you see me set up shop know to pack up
I crack up when a rapper gets slapped up
Number one reason yall should give rap up
Dice it's mine, I got it all wrapped up
I'm kinda W.E.B. Dubois meets Heavy D and the boys smooth as a Rolls Royce
Built like a tank smoking on dank
I'm walking through the Guggenheim Raw Life Black Ink

Southside get busy yall
Northside get busy yall
Westside get busy yall
Worldwide get busy yall

Now on your mark get set
Go cop everything you ever heard by P.Crack Dice Raw and Black
Fuck the internet buy a baseball bat break a bootlegger
Leg all I listen to is vets, your fresh of the step
I come directly at your OG neck
I'm used to the one two check not the one two step
Um strapped I'll leave every cat among you wet
Now lets go! you know I'm politically incorrect
At the show I start it with a can I get a ho and the hoes go retarded
The popo tape off the stage for caution, its badlands north philly get it in!
Its crack man, used to backspin now I spend stacks in sack's and
Uncle Sam tryin' to tax all my hard earned raps damn!
We makin' yin, pesos, euros, we representin'

Southside get busy yall
Northside get busy yall
Westside get busy yall
Worldwide get busy yall",Get Busy,2008
Dice Raw,"[Chorus: Mercedes Martinez]
I, I, I can't help it, I, I, I can't help it,
I can't help it, I can't help, I can't help it, I can't help it
I, I, I, I can't help it, I, I, I can't help it,
I can't help it, I can't help it, I can't help it, I can't help it

[Malik B]
Live with it, thats how I survive with it,
Talk jive with, you take dive with it,
Connive with it, depart and arrive with it,
Harsh thrive thats why its part I with it
I did it, make rhymes in 5 minutes,
Mind of a dentist, crimes of the diminished,
Press rewind see what you find in my image,
Take you nigga's back to that line of a scrimmage,
Riq you know we pull a freak with the flow,
Talks cheap thats why we speak with the dough,
Ill techniques sure I'm sleek with the flow,
Its cold outside niggas sleep with the snow,
I tweak in the low tone,freak when the o-zone,
I can't help hiding my seat oh its so known,
I only do what got to because its possible,
And climbing over whatevers known as an obstacle.

[Chorus]

(Black Thought)

I can't help it, maybe I'm selfish,
Maybe the way I'm running is becoming a hell freeze,
All I can see is smoke from tortoise shells that sell shit
50's I feel like I'm making a sales pitch,
My head already so heavy its making the scales tip,
I got my own pressure and got everyones elses,
I'm rehabilitating and still feeling rebellious,
Candidate of heart failure more pills than Elvis,
In a layer cake, half chocolate half velvet,
I'm listening to some howe Melvin,
I got so many options theres so many toxins yo,
Didn't really tell what we killing ourselves with,
I lit a cigarette and then held it,
I'm thinking of some rhymes more illa than a threatin' illment,
I'm on some bomb threat in the mail shit,
Because of all things I dealt with, nigga I can't help it

[Chorus]

[Porn]
I never said I'm ready to die, but I accept it,
Never said I""m ready for war, but I'm protected,
I don't even know when its coming but I expect it,
Lost thoughts innocent hopes an now I'm left with
Nervous conditions, addictions, in addition
To prisons that mixed in to the wrong crowd,
My life is on a flight that going down,
My mother had an abortion for the wrong child,
With the time I felt loved, thats gone now,
Thats replaced with purples rays some storm clouds,
Misery love Misery, so why make friends lets make enemies,
An now I got a habit thats wasn't meant for me,
Now I'm in a marriage that wasn't meant to be,
One more reason to change identity,
The cars, the crime, K's, penalties.

[Chorus]

I can't help it, I Can't help it
I can't help it, I Can't help it
I, I, I, I can't help it
I, I, I, I, I can't help it
I, I, I can't help it
I, I, I, I, I can't help it
I can't help it, I, I, I, I, I can't help it
I can't help it, I, I, I, I, I can't help it
I can't help it
I can't help it
I can't help it
I can't help it
I can't help it, I, I, I, I, I can't help it
I can't help it, I, I, I, I, I can't help it
I, I, I, I, I can't help it
I, I, I, I, I can't help it
I, I, I, I, I can't help it
I can't help it, I, I, I, I, I can't help it
I can't help it, I, I, I, I, I can't help it
I, I, I, I, I can't help it
I, I, I, I, I can't help it",I Can't Help It,2008
Dice Raw,"[Chorus: (Dice Raw) Talib Kweli]
(I will not apologize) I will not apologize
(I will not apologize) I will not apologize
This is for all of my peoples who understand and truly recognize
Some won't get it for that I won't
(I will not apologize) I will not apologize
(I will not apologize) I will not apologize
This is for all of my peoples who understand and truly recognize
Some won't get it for that I won't apologize

[P.O.R.N.]
I'm so sick cause I'm infected but but I don't need a medic
Need a liquid anesthetic, let me show you how I get it
I don't got it but I bet it, I don't worry, I don't sweat it
You can bitch, you can dead it, you can take it there like FedEx
Nothing sweet diabetic, big dog can't pet it
Pack an L then I wet it then I fill it till it's pregnant
(Take the high back) face it everybody got a favorite
I embrace it like I date it but my grandma think I chase it
(Like oh yeah) I told her that her baby moving slower
Cause the world is on his shoulders then I woke up out that coma
(And got right back) at it with a little black 'matic
Lay you down craft-matic, then I'm gone, black magic
(To the hideout) you don't want to gamble with the devil
Especially when them chewy bluies got me on another level
Cause my teacher think I'm slow but my momma think I'm special
But even she know I'm coming back like an echo.

[Chorus]

[Dice Raw]
For the statements I'm about to make I will not apologize
Niggas talk a lot of shit, really need to stop the lies
Jewels rented, cars rented, homie that ain't authentic
Acting tough on TV but to me you seem a little timid
Don't blame the nigga, blame America, it's all business
Acting like a monkey is the only way to sell tickets
Shit I can dig it, niggas gossip silly digits
White kids buy it, it's a riot when we talking about pimping
Or sipping on old English brew or whatever they think we do
Spraying double Uzi's cause you know they think we live in zoos
The problem is with this everyone seems to be real confused
The niggas on the streets to the old people that watch the news
And watch BET and the crazy shit they see
They associate with you do the same shit to me
When you look at me you see just a nigga from the projects
But can't understand this nigga's mind set but still

[Chorus]

[Black Thought]
Yo, a revolution's what it's smelling like, it ain't going be televised
Governments is hellified, taking cake and selling pies
I ain't got a crust or crumb, to get some I'd be well obliged
Murder is co-modified, felon for the second time
Never was I into chasing trouble I was followed by
Facing trouble with no alibi, had to swallow pride
Vilified, victimized, penalized, criticized
Ran into some people that's surprised I was still alive
Look into my daughter's eyes, wonder how can I provide
Got to get from A to B but how can I afford to drive?
Messed around, tried to get a job and wasn't qualified
Had to see a pal of mine, got to get the lightning rod
Now I'm in the black Impala looking for the dollar sign
Palms get the itching man I got to get the calamine
Before I fall behind, guess the grind will be my 9 to 5
I will not be conquered by, I will not apologize

[Chorus]",I Will Not Apologize,2008
Dice Raw,"Ladies and gentlemen 
The greatest stage show you've ever witnessed 
Appearing live, from out the 2-1-5, The Roots crew 

Big respect to the Get fresh, yes 
Have you ever seen a show and fellas on the mic 
Make one minute rhymes that don't come out right 
(They bite) Hey yo, they never write (That's not polite) 
Word up, am I lyin? (Nah, you're quite right) 
Well tonight on this very mic you're about to hear 
We swear, the illest star rappers of the year 
So so, cheerio, yell, scream ""Bravo"" 
Also, if you didn't know it's The Roots Show 

Yo Rahzel (whats up?), put your Wallies on 
(Yo 'Riq, I was about to but I need a shoehorn) 
Why's that? (Cos these shoes always hurt my corn) 
Six minutes, six minutes, six minutes Roots crew, you're on 
Uh uh on, uh uh on, uh uh-uh uh-uh uh uh on 
Uh uh on, uh uh on, uh uh-uh uh-uh uh uh on 

Here we go, (here we go), come on, (come on) 
Here we go, (here we go), come on, (come on) 

(Yo 'Riq, where's Malik?) Ayo, the brother is late 
Told him the time, oh, I forgot the date 
(Man, you did it again) Oh no! 
(Here we go), come on 
(Here we go), come on 
(Here we go, did we miss the show?) 
No, no no no no, no we didn't, w-w-w-word 
No no no no no no no, no we didn't, w-w-w-word 
No we didn't, (Well don't get us wrong) 
Excuse but um, excuse but umm, excuse Roots crew you're on 
Uh uh on

Well it, started on-a O'Saints Avenue 
When we came up with the squad that's called The Roots crew 
It was me, Qwest Kemal, Hubbard and my man Malik- 
B, and Rahzel from the NYC 
Who used ta, scratch and sing, make sounds and things 
For example, check out this telephone ring 

(Hello? Hello? Can I speak to Rahzel? 
(No, he's not in right now) 

Well anyway, no more delay 
Just peep out the ill my man display 
But'cha gotta be (fresh), Rahzel'll rock (fresh) 
Like D-O-you-G-I-E (fresh) 
And I'm known for the
And not for the
Rahzel the Godfather, the entertainer 
No other title could fit me plainer 
In the past generation, I am the remainder 
And I'm also known as the beatbox trainer 
Cashin' checks, makin' sound effects 
After I finish rockin', Black Thought is up next 

Well here's a lil' somethin' that needs to be heard 
Rah, I was headin' Uptown, (Word 'Riq), word 
(Chillin') and all alone, no one to be with 
Hopped up on the train headed for 2-5th 
And saw this pretty girl (what?), so I sat beside her 
Then she went like she was Tony the Tiger 
I said ""Oh no, there's been a mistake 
Love, my name is Black Thought, not Frostie Flakes"" 
(Oh, golly wally) Well, she was raisin hell 
She said ""Aah, my name is Maggie but call me Michelle"" 

Check it out, Roots crew and yeah, we rock the house, knah I'm sayin'? 
And when I'm on the mic, there won't be no delayin'
So bust a move, we show and prove 
Yo Rahzel, do that record Jam on the Groove 

As you can see, most definitely 
The Roots are,
Come up Rahzel, come up Illa Del 
Come up ?uestlove, and then come on up Hub 
Come up Malik B, and then behind him D 
Come up Dice Raw, the 5th Dynasty 
And Black Thought sendin' out a shout to the Get Fresh Crew 
And Doug E.",The Show,2008
Dice Raw,"[Chorus:  Dice Raw]
Days are living fast, moves in misery
You got a song you wanna sing for me
Sing a song, singing man
Sing a song, singing man
Sing another song, singing man
Sing another song, singing man
Sing a song for me
Sing a song for me

[P.O.R.N.]
Look, I'm so twisted, so, so twisted
One life to live, and I'm willing to risk it
Terror that the world has never known existed
Left so many clues, now how could they miss it?
Sadistic, ballistic, find a word and pick it
Long as it means the world is on my shit list
Walking time bomb, my mind is on tick-tick
Countdown's on, its too late to nix it
I'm so anxious, so, so anxious
The ones I hate barely know what my name is
Have no clue that I'm armed and dangerous
Willing to spill my blood to be famous
Willing to spill my blood to make changes
Look for a suicide note to explain this
Heinous, inking the ache from my anguish
Sounds insane, you're speaking my language

[Chorus]

[Black Thought]
One for the pressing, two for the cross
Three for the blessing, four for the loss
Kid holding a weapon, walk like a corpse
In the face of transgression, military issue Kalash
Nikova or machete or a pitchfork
He killing cause he feel he got nothing to live for
In a war taking heads from men like Charles Taylor
And never seen the undisclosed foreign arms dealer
13-year-old killer, he look 35
He changed his name to Little No-Man-Survive
When he smoke that leaf, shorty believe he can fly
He loot and terrorize and shoot between the eyes
Who to blame, its a shame, the youth was demonized
Wishing he could see rearrange the truth, to see the lies
And he wouldn't have to raise his barrel to target you
His heart can't give you the years of scar tissue...

[Chorus]

[Truck North]
Uh, what you're witnessing is true dedication
Charged by the call and the cause of the nation
Countdown, minutes away from detonation
A lifetime of grunt work, this is the culmination
My manner, seems patient, inner rage lies
So deep, I can taste it, let's sacrifice lives
Past the first sensation, to paradise I fly
Delusions are lighting up the midday sky
The last days of mine spent in extreme secrecy
Wolves dressed like sheep occur more frequently
Too much faith to be scared, the petrified both fled
Those who live fearing death, might as well be dead
Towers of the occupiers, will soon fall
Martyr or mass murderer? That's your call
Mass transit or a mall? Who can watch them all?
In the name of the merciful, sing me a song

[Chorus]",Singing Man,2008
Dice Raw,"Uh, uh
Uh, uh-huh

Out in the streets where I grew up
First thing they teach us, not to give a fuck
That type of thinking can't get you nowhere
Someone has to care

How I got over where the people come apart
Don't nobody care about you; only thing you got is God
Out here in these streets if you get down on your luck
You can stand out with a hand out, but nobody give a fuck
Out here in these streets every man is for himself
They ain't helpin' no one else; it's a hazard to your health
Livin' life in these cold streets
Hey, who's worryin' 'bout you, babe
When you whylin' out, runnin' 'round in these streets?

Out in the streets where I grew up (how I got over)
First thing they teach us is not to give a fuck (how I got over)
That type of thinking can't get you nowhere (how I got over)
Someone has to care

Yo, when you on the corner, it's too much drama
Livin' with the police right behind ya
It's always more than a slight reminder
We livin' in a war zone like Rwanda
Before I go back to the Heavenly Father
Pray for me if it ain't too much bother
Whatever don't break me or make me stronger
I feel like I can't take too much longer
It's too much lyin' and too much flyin'
I'm all cried out 'cause I grew up cryin'
They all got a sales pitch I ain't buyin'
They tryin' to convince me that I ain't tryin'
We uninspired, we un-admired
And tired and sick of being sick and tired
Of livin' in the hood where the shots are fired
We dyin' to live, so to live we dyin'
You just like I am

Out on the streets where I grew up (how I got over)
First thing they teach us is not to give a fuck (how I got over)
That type of thinking can't get you nowhere (somebody, somewhere)
Someone has to care

Somebody's gotta care
And I swear it isn't fair
In suspended animation, we ain't tryin' to go nowhere
Out here in these streets
We're so young and all alone
We ain't even old enough to realize we're on our own
Livin' life in these hard streets
Where it's like they lost they mind
Is there anyway to find
Are we runnin' out of time out here?
Listen
Hey, who's worryin' 'bout you, babe
When you whylin' out, runnin' 'round in these streets?

Out on the streets where I grew up (how I got over)
First thing they teach us is not to give a fuck (how I got over)
That type of thinking can't get you nowhere (somebody, somewhere)
Someone has to care

Out in the streets where I grew up
First thing they teach us, not to give a fuck
That type of thinking can't get you nowhere
Someone has to care
Out in the streets where I grew up
First thing they teach us, not to give a fuck
That type of thinking can't get you nowhere
Someone has to care
Out in the streets where I grew up
First thing they teach us, not to give a fuck
That type of thinking can't get you nowhere
Someone has to care",How I Got Over,2010
Dice Raw,"[Chorus]
Everything's changing around me
And I wanna change too
It's one thing I know
It ain't cool being no fool
I feel different today
I don't know what else to say
But I'm-a get my shit together
It's now or never
(Now or never, now or never, now or never, now or never)

I'm sick, sick of waiting in vain
Tired of playing the game
Thinking of making a change
Finally breaking the chains
Every phase, every happening craze
When it's said and done
My head is right back in a haze
I'm ready for the next chapter and page
To start acting my age and part ways
With black thought from back in the days
I'm stargazing from the back of the stage
Questioning if who y'all praise is worthy of praise
What's the phrase--bygones is bygones?
Niggas who used to be the underdog is icons
People say the light shines once in a lifetime
Is this mid-life kind of crisis a little bit like mine?
I'm thinking not now, but right now
I need some kinda sign that the future is bright now
I fuck around, do the right thing like Spike now
The quick and the dead--which is my look-a-like now
I'm moving ahead

[Chorus]

Yo, opportunities lost because I blew 'em
On the sunniest days of my life I cried through 'em
Mom's was out the picture and pops I barely knew him
And I would pray to God, but I'm tired of lying to him
Tired of trying to run from the things inside of us
Got a lot of fam' and a lot of admirers
Who tell me that I should aspire to be changed
But when I think of changing, it's like why even try this shit?
My mind hazy and my thoughts they get distorted
I know my good and bad needs both get recorded
You do right so your soul can last
But my role was cast before I even auditioned for it
So I don't really see an end to my vice
It's just false reclamation, no end of my strife
Feel the evil overpowering
You can go ahead throw the towel in
'Cause, nigga, that's the end of the fight
When you can only see the tunnel at the end of the lights
Like (?) it's the end of your life
And I'm out

[Chorus]

When I look into the mirror and see my own image
It feels like there's something else far off in the distance
Something I wanna see, but something that's resistant
And every day the haunting is growing more persistent
I never noticed it before, but now I can't miss it
And the constant pounding's driving me ballistic
I ran from it for years, but it's still next to me
And it's growing stronger take and leaving less of me
I can't fight it now; I know it's just destiny
And I just wonder what's gonna happen when it catches me
Will it leave me face down in (?)
Or will it just start bringing out the best of me?
But is the best of me really just the worst of me?
And if so yesterday could be my anniversary
In sinners' court it's important to have church with me 
I'm trying to get rid of these ghosts that's cursing me
I feel that change is an absolute certainty
'Cause what's going on is a state of emergency

Everything's changing around me
And I wanna change too
It's one thing I know
It ain't cool being no fool
I feel different today
I don't know what else to say
But I'm-a get my shit together
It's now or never
It's now or never",Now or Never,2010
