Band,Lyrics,Song,Year
Venom,"Midnight six sixty six
Torment beastial sex
Mother screaming in pain
Father rules hell's domain
I don't want to be born
I don't want it
Leave me in hell
Danger gold pentagram
Sacrifice full blooded ram
Karma Hell bears its child
Reaper sharpens his scythe
I don't want to be born
I don't want it
Leave me in hell
Hail Satanic Majesties
Sabbath my crucifix
Evil chief satanist
Danger possessed by hell
Master cast me a spell
I don't want to be born
I don't want it
Leave me in hell
",Leave Me in Hell,1982
Venom,"Rising from my deadly tomb I've got
maddened eyes with fright
fingers bleeding fast heart beating
the moons my only light
Ashes to ashes, dust to dust
If God won't have me, then the Devil must

[CHORUS:]
we will raise the dead
we will raise the dead
we will raise the dead
stop at nothing raise the dead
Gaze across the blackened yard
my mind is filled with dread
so give me all the powers of Hell
and I'll raise the dead
Ashes to ashes, dust to dust
The hotter the fire, the greater the lust

[CHORUS:]
I hear the star of the Necromancer
my blood is black and my heart doth bleed
I am infernal and my mind's in torment
I'll raise the dead make the world unclean

Laughing as my legions rise
control the zombies mind
I hold Hell close to my breast
I'm leaving God behind
Ashes to ashes, dust to dust
I'll enter hellfire, I'll break the crust

[CHORUS:]",Raise the Dead,1982
Venom,"Hooded figures, clouded skies
Fires burn within their eyes
Pentagram with baphomet midnight strikes
Goat of mendes lifts his head
Summons up the living dead
Virgin flesh lies tied and bound
Hail satanas


S.A.C.R.I.F.I.C.E.
Scream for mercy cry and repent satan claims your soul
Sacrifice, sacrifice, oh so nice, sacrifice


Candles glow on alters bare
A virgin's death is needed there
Sacrifice to Lucifer my master
Bring the chalice raise the knife
Welcome to my sacrifice
Plunge the dagger in her breast
I insist


S.A.C.R.I.F.I.C.E.
Limbs weaken limbs fly away demons rejoice
Sacrifice, sacrifice, name your price, sacrifice


Death is swift 'neath satan's sword
All the same young and old
Life means nothing to my lord
Drink from chalice warm and sweet
Virgin's heart final beat
Lightning strikes virgin dies
Satan smiles


S.A.C.R.I.F.I.C.E.
The moon is black and the witches dance, heaven is denied
Sacrifice, sacrifice, sacrifice, sacrifice



",Sacrifice,1982
Venom,"Teacher caught me masturbating underneath the desk
She looked at me and winked her eye said ""see you after class""
I heard the school bell ring that told me that the day was done
She called me back and locked the door my lessons just begun
Teachers pet
Teachers wet
Sitting down she crossed her legs her skirt crept up her thigh
Feeling something start to rise my thought began to fly
You've been a naughty boy she said now that you can't conceal
I'll have to punish you the best way that I feel
Teachers pet
Teachers wet
She took my hand and gently placed it in between her thighs
With open legs and heavy breath she slowly closed her eyes
Her flesh was aching and her hands began to stray
On thing that I know for sure I won't forget today
Teachers pet
Teachers wet
Pulled me down forwards her mound teacher tasted sweet sixty-nine
I don't mean lines this was teachers treat
Played hide and seek with teachers mouth her lips were warm and wet
Now today I've had my way and teacher won't forget
",Teacher's Pet,1982
Venom,"I have been to Hell and back - kissed satanic Queen
Traveling at the speed of light - saw thing never seen
Arm in arm with Lucifer - Belial on my back
I have swam the lake of flames - walked forbidden tracks
To Hell - and back
To Hell - and back
I've made love to Lilleth fair - danced the zombies dance
I have shook the reapers hand - broke his deathly trance
Present at ungodly births - mutants writhe in pain
I'm possessed by Hell itself - I'm the man insane
To Hell - and back
To Hell - and back
Ride with me
To Hell - and back
You can take a trip with me - Hell's my final home
If you wish to live at night - watch the demons room
Holding high the Southern Cross - watch the mortals bleed
Drink the blood and feel my wrath - watch the mutants breed
To Hell - and back
To Hell - and back",To Hell and Back,1982
Venom,"You have got everything I neede
You can bring my soul out of me
I'll pay your wicked price
Deliver your merchandise
Gypsy, you'll drive me a dream

Oh Acid Queen
Wild tames the raging beast
Child helps the blind to see
Demon controls my mind
Leaves the real world behind
Mold me a purgatory scene
Acid Queen
Acid Queen

You ain't want to hear no one
Can you hear me?
I said get out of here, you
Oh! Witch, now you've given all you've got
Bitch, thought you'd left me here to rot
You're coming down and fast
You've tripped your very last
I'll take your place and sing
Oh Acid King
You deny","Acid Queen [12"" Version]",1982
Venom,"Whooo - what's going down dudes
Let me guess - that's right - groovy
Whooo
What the fucking hell is all this fucking shit
Get out of here - you fucking bastards
Haw man - get out
Howeh what the...
Aaaaaaaarrghh
Aaaaaaaarrghh
Arm pit arm pit arm pit
Aaaaaaaarrghh
Geet big fucking arm pit
Aaaaaaaarrghh
Smelly fucking arm pits
Aaaaaaaarrghh
Arm pit - aaaaaaaarrghh
Aaaaaaaarrghh
Aaaaaaaarrghh
Aaaaaaaarrghh
Had on-had on - right - hey
Aaaaaaaarrghh-aaaaaaaarrghh
Hold on-what the fuck
Haw man can you not say
Aaaaaaaarrghh properly
Howeh play the cunt properly
Will yu-will yu
Aaaaaaaarrghh
Ah ahh ahhh
Got it
Aaaaaaaarrghh
Arm pit fucking arm pit
Aaaaaaaarrghh
More smelly arm pits
Geet big fucking
Bell ends as well
Aaaaaaaarrghh
Aaaaaaaarrghh
Aaaaaaaarrghh
Fucking aaaaaaaarrghh
More aaaaaaaarrghhs
Than the last time
Aaaaaaaarrghh again
& aaaaaaaarrghh
A fucking gain
Aaaaaaaarrghh
Shaddap - you noisy bastards shaddap
Do as you're told & shut up man
Phugh
",Aaaaargghh,1983
Venom,"Placed in the wilderness, naked and cold
The night draws the warmth from my flesh
Howls in the distance
The wolves they catch my scent
They yearn for my blood warm and fresh

But I 

Cannot run, I cannot hide
I'm moments old, yet terrified
Snarling breath is on my face
I am damned in this place

Morning breaks the evening darkness
Daylight sings so loud
Father holds my in his arms
And laughs for he is proud
'All is well' my mother cries
A kiss for me her child
But at night my heart turns black
And calls me to the wild

In the night where the wolf-bane grows
In the night when the full moon glows

Cry wolf 

Alone in your room
By the light of the moon
Your glory is shining so bright
You prey for the day
Oh show me the way
The devil takes over tonight
It's too late, night is here
The time that you dread
The time when you loose all control

Your bodies in pain
You cry in vein
Satan takes over your soul

Cry wolf 

Even a man who's pure of heart
He says his prayers by night
Bane from a wolf when the wolf bane grows
And the moon's full and bright

I cannot resist their call
It strengthens as I age
To the pack to join the feast
And fear immortal rage
Never can I live the life
Of every normal child
Forever I must answer
To the call of the wild

The call of the wild",Cry Wolf,1983
Venom,"Genocide

Standing in the wings
The reaper waits to play his part
Fear drains the blood
From every pure human heart
The final word is spoken
A lovers last embrace
No distance between life or death
The two are face to face

Take heed the golden dawn

Genocide

Genocide

A prayer from the sinner
For he repents for his soul
Hell becomes his destiny
For heaven is his goal

Sinner, death deceiver
Heathen, disbeliever

Genocide the cure of mankind
Armageddon patiently decides

Death unveils his gown
The place is truly on fire

You'll see no light
With genocide

Life or death it used to be
But now there is no choice
The blackened skies are filled
With cries of every nations voice
The clouds of death are forming
The judgment day is here
No mercy for the innocent
No time for even fear
The golden dawn turns black

Genocide

Genocide

No place to hide

With genocide",Genocide,1983
Venom,"Across infernal wastelands
Many miles of sunburnt Hell
Tribes are scattered limbs
And dust all laying as they fell
Open lies the challenge to all
Warriors now men
Let the spirits guide the winds
Until Manitou ascends

Manitou
Manitou
Manitou
Manitou

Watch the unseen burial
Eclipse the blazing skies
Feast the wings of death
With Manitou the soul shall vie
Distant beats the wardance
Echo screams out liberty
Patience stalks the crow
White man's scalp brings victory

Manitou
Manitou
Manitou
Manitou

Mighty be the powers
Of the old medicine man
Whispers of his raindance
Flow across the desert sands
Guardian of the elder spirit
Summoning the storm
Awaiting his arrival
Manitou of flesh is born

Manitou
Manitou
Manitou
Manitou",Manitou,1983
Venom,"Run like Hell, in Hell
The deadly race begins
Cyanide, suicide
No prayers or foolish whims
Tonight we'll fight
With glory in our veins
Can't stop us now
Our evil always will reign

The master switch is set
And we must guard the only key
Rip ride

Satan's speed, our speed
Incarnate pure alive
Light up the night
Were living on a wire
We choose you loose
Nobody body catches fire
Were free you'll see
We live by our desires

Riding in the air nocturnal
Living free
Rip ride

Rip ride

Run like Hell, in Hell
The deadly race begins
Cyanide, suicide
No prayers or foolish whims
Tonight we'll fight
With glory in our veins
Can't stop us now
Our evil always will reign

The master switch is set
And we must guard the only key
Rip ride",Rip Ride,1983
Venom,"Sorceress of old love potions
Brew an orgy strong
Priestess of the highest order
Light the fires of song
Chime the bell
Raising hell
Nothing can go wrong
Trascend in motion make
The wheels of life revolve

WOMAN

Wicked witch of yesterlands
Bring your spirit here
Tell us of your day of judgement
Reinact your fear
Dance in the flame
Nude without shame
For all to see
I'll take a trip with you
To make your innocence clear

Whore of leisure whore of sin
Name your hourly price
Take me home & give me pleasure
Treat me oh so nice
Legs open wide
Take me inside
I won't throw your dice
I wanna taste the caves of flesh
Within your face





",Woman,1983
Venom,"Stand aside, loose your pride
I'm at the gates alone
Sourcery, blasphemy
All welcome in my home
I'm leaving
But soon I'm coming back
Believe me
I'm hot on your tracks
Through the night
Eagles flight
The Angels kiss my brow
Tempting me with studded heels
The bitch is in heat now
Oh you've got me
That leather smells so sweet
I'm on fire
Breeding sin, breathing lust
Witches spell ohhh...
Women Leather and Hell
Go for it
Come on turn that mother up
Dynamite, is right on time
Sends shivers down my spine
Destiny won't catch me
The choice of death is mine
Salvation is keeping out of sight
Damnation is joining in the fight
",Women Leather and Hell,1983
Venom,"In a dream or a nightmare, where love gives way to hate
The quest begins for the keys to the seven gates
Ride the wings of the locust, see the wizard cast his spell
Search for the keys to the seven gates of hell

On heaven's earth where all evil dwells, and man and beast are one
Concealed to all, revealed to none lie hell's infernal gates
Those damned infernal gates

The seven gates of hell!!!
Hear the cry of the zombie, rid the body of it's soul
The quest for the seven keys have become their goal
Steal the wings of the hydra, and the sword from the sacred shrine
Take the strength of the beastand the sinner's mind

Unveiled in death to the sinner
Written in the ancient book of lies
Hear the demons call fromthe crimson waterfall
As the blood rained from the skies

When reality's a dream and every lie is true
In the day when you are me and the night when I am you

When the flame of life grows cold, I'll chime the silent bell
When the unborn child is old
The seven gates of hell!!!!!

We're going through the gates of hell
In heaven's hell so many died in vain
They never got their taste of death
Night shall find the key to set their spirits free
From the seven gates of hell

The seven gates
The seven gates
The seven gates
The seven gates of hell!!!!","The Seven Gates of Hell [12"" Version][*]",1983
Venom,"Stand aside, loose your pride
I'm at the gates alone
Sourcery, blasphemy
All welcome in my home

I'm leaving
But soon I'm coming back
Believe me
I'm hot on your tracks
Oh yeah...

Through the night
Eagles flight
The Angels kiss my brow
Tempting me with studded heels

The bitch is in heat now
Oh you've got me
That leather smells so sweet
I'm on fire
Breeding sin, breathing lust
Witches spell ohhh...

Women Leather and Hell

Go for it
Come on turn that mother up

Dynamite, is right on time
Sends shivers down my spine
Destiny won't catch me
The choice of death is mine
Salvation is keeping out of sight
Damnation is joining in the fight

Women Leather and Hell",Woman Leather and Hell,1983
Venom,"Venus sheds her skin of gold
Sacrifice her life
Washes out the demon sleep
That hides between her eyes
Walking, watching, wandering out
Of soul she must pursue in death
Will she reach you?
Flytrap
Flytrap
Flytrap
Flytrap
Venus takes the lightning
And her hair becomes a flame
With a guise of innocents
Who learn her unknown game
Dancing, raining, sorcery
He's caught between her heat all year
She's pleased to meet you
Flytrap
Flytrap
Flytrap
Flytrap
Flytrap - demon child
Flytrap - virgins wild
Flytrap - angels death
Flytrap - there's nothing left
Born without mortal care
Joyous of flight
Pleasing to the eye
Deadly delight
Venus arguementor
Torturing my aged soul
Fighting through the ashes
Give me back my skin of gold
Walking, Watching, Wondering
The soul she has persued in life
Will she teach you?
Flytrap
Flytrap
Flytrap
Flytrap
",Fly Trap,1985
Venom,"Children gather round him,
Mystery surrounds him,
What terrible secret does he hide,
An ordinary man,
Doing what he can,
But what goes on inside his mind.

The night draws nigh,
With darkened sky's,
Axe blade shines,
Midnight chimes.

Morning comes around,
Headless bodies found,
Our little friend just sits and smiles ha ha,
Take them home and love them,
Read the bible to them,
Be sure to kiss each one goodnight.

But come the night,
You'll freeze with fright,
Axe drawn high,
Another dies.

Creeping and searching for victims unknowing,
What fate doth await round each corner,
The take in the night,
He's got you in his sight.

Now that I have warned you,
Always look behind you,
You'll never know just who'll be there,
That harmless looking dear,
May be the one to fear,
So never trust those you don't know.

But come the night,
You'll freeze with fright,
Axe drawn high,
The bastards die.",Schizo,1985
Venom,"Warhead - hear the thunder roar
Warhead - unite the lightning whore

Power burning - hell & man
Raging torment - take my hand
Frenzied motions - reach your soul
Dance the warhead - fast or slow

Warhead - hear the thunder roar
Warhead - unite the lightning whore

Born of thunder
Raised by fire
Call the heavens
By desire

Warhead - hear the thunder roar
Warhead - unite the lightning whore

Screaming furnace - death of life
Demons calling - chosen wives
Sabbats charming - out in lust
Chance the warhead - win or bust

Warhead - hear the thunder roar
Warhead - unite the lightning whore
Warhead - engraved on flesh & bone
Warhead - born of mortal stone",Warhead,1985
Venom,"Harmony dies
Demons calling to Hell
Wise ways ye cannot sell
Praying fools light their ways
Night decends shrouds the day
Unveil the hysterskies
Immortal children cry
Question of when and why
Harmony dies
Sacrifice the solstice
Casting out the priestess
Anger lingers in death
Waiting the for the last breath
Hell has no disguise
Just look through Satan's eyes
When dogs of war can fly
Harmony dies
Death is fighting with death
Time shall feed on what's left
Prophets on the altar
Voicing his words of war
Walk through their sacred fires
The halls of souls admire
But as the end grows nigh
Harmony dies
",Harmony Dies,1985
Venom,"Gather round o young ones
Listen to the night
Loud as Hell and black as death
Only men take fright
Sit around my flame bright
Warm your bones and hear
Virgins die and demons cry
Throw away your fears
Suffer not the children
Sleep tight our fathers
Guard our mothers well
Vampires and werewolves
Erupt your dreams our spell
The evening sabbat song
A Longing to be free
Lost children wander waiting
Barefoot in the sea
Suffer not the children
Suffer not the children
Or be deemed a damned disgrace
Blessed be the wench
To which delivers in his grace
Gather around my young ones
We can go away
I'll guide you in the night
Follow me
Tonight we'll find a path
The Hell born sinners trail
Beware! None shall stop us
Innocence guards our way
The amulets of kings
Our voodoo games
We know but never tell
Of our infernal names
Suffer not the children
",Suffer Not the Children,1985
Venom,"Virgin little schoolgirls
Dirty little nurse
Teachers, whores and chambermaids
All lifting up their skirts
Sister's in the bathroom
Getting nice and clean
Telescopic vision
He's bursting at the seams


Posion pleasures, taken by hand
Rapid fire, from his pulsating gland


Neighbours at the window
Trying her new bra
Young and horny lovers
Back seat daddys car
Searching through his bondage
Cindy's in top drawer
Blondes, brunettes and redheads
To satisfy the voyeur


Uncut videos, vibrating eye
Snakes alive, cause he's never shy
He's the voyeur


Leggy traffic wardens
Women of the law
Coming hard on oral
She's begging him for more
Polaroid mistress
Versatile and lean
Fingering her naked flesh
Fuel for his wet dreams


He's had them all
That's what he says
The liar
So little action
But nobody cares
About the voyeur


You meet some strange people in this place...


Voyeur




",Voyeur,1985
Venom,"I preach the ways of Satan
Answer to his calls
I translate manuscripts
On ancient Latin scrolls
In my shrine, my avernus
I see the gates of Hell
Guarded well by Chronozon
Tortured souls do dwell
Satanachist
Satanachist
I mount the virgin Venus
Plague the blackened seas
I am the souls destructor
Marching without fear
The night is filled with souls
In coral exctasy
The saraband of death
Will always follow me
Satanachist
Satanachist
I bear the evil eye
Possess the unbidden
I'll bring your dead alive
And chew your flesh from bone
I stalk through life and death
With Gorgon for my gaze
I breath the immortal pain
Beware the human race
Satanachist
Satanachist
",Satanachist,1986
Venom,"He watches witches weaving wonders
Seeing the future past and present
Of messages the universe sends
Inside their crystal balls of thunder

They summon through the sphere
A child so fair so virgin pure
They summon me my slave
Bring her to their lure

The beauty and the beast
The beauty and the beast

But I can see the blood on your sins
She calls christ in churches crimson

I've got to take her - Leave her - Take her
Tell me the price if I deliver
By one a slave of flesh
In vain wasting their breath
They guide me through the lake
They summon his return

The beauty and the beast
The beauty and the beast

They cast countless conjurations
He didn't sign the pact the fact is
Their screams of failure fade to whispers
Trying to heal their mental blisters

A child so fair so golden pure
They didn't realise
They summon through the sphere
This was the demon's cure
The beauty and the beast
The beauty and the beast




",Beauty and the Beast,1987
Venom,"When the snow turns black
I'll be back - I'll be here
Between the blinking of an eye
Welcome back - Cavalier
When the screams attack
Before the newborn starts to cry
Flaming star or the call of the wild

And it's all in the eyes of a child

The whispers in the breeze
Black Xmas - Devils Eve
Black Xmas - Devil's wine
The river bleeds in time
That's the place - In a dream
Where the red clouds chase

Across the suns hot blazing sky
Where he hides his face
In disgrace - For his queen
He must choose the way she dies

And they say when his eyes turn to green

He'll awake living sin never seen
That's the clue - To believe
Watches over you
Watch his eyes look through
An instant and you're hypnotised
False or true - To deceive
You take his place you're crucified
Black Xmas - Devils Eve

The whispers in the breeze
The river bleeds in time
Black Xmas - Devil's wine
Black XmasBlack Xmas - Devil's wine




",Black Xmas,1987
Venom,"I can smell the fear
Hear the screams of pain
I must kill or be meat
I'll say to you
On this planet of dirt
Number one comes first

This is our place
The last of the human race
Children of disgrace
Now can you all hear me say

There's a calm before the storm
Don't say that you ain't been warned
A calm before the storm
And it's coming for you

Is there life after death
Do you ask yourself

This is our place
The last of the human race
Children of disgrace
Now can you all hear me say

There's a calm before the storm
Don't say that you ain't been warned
A calm before the storm
And it's coming for you

I have smelled the fear
Heard the screams of pain

This is our place
The last of the human race
Children of disgrace
Now can you all hear me say

There's a calm before the storm
Don't say that you ain't been warned
A calm before the storm
And it's coming for you

There's a calm before the storm


",Calm Before the Storm,1987
Venom,"Watch out -
There's a cry from Atlantis
Takes the wind by surprise
Voices so demanding
Thunder swarms the skies
To the north of horizon
Over mountains at east
There's a call to the lost ones
From the elders deceased

We're chanting - They're chanting

It's in a tear - Outside a prayer
Without form it's haunting the air
It's in a kiss - within a bite
It brings the darkness into light

The chanting of the priests
The chanting of the priests

Watch out -
It's a song for Olympus
Cracks the morpheus dream
It oozes the ozone
Heavenly screaems
By the golden waterfall
Through the fog on the ice
There's a voice in the shell call
It's demanding precise

We're chanting - They're chanting
The chanting of the priests

Yells ascend into the sleeping
Screech the hawk relpies
Shudders pound the marching hearts
In reborn synchronize
Held in force the feeding prism
Triangle diaboli
Catalogues the souls inside
The city in the sea

Watch Out -
Where there's life without presence
There's a voice without sound
Deep inside you can't feel it
Yet it's all around
Through the eye of the Pharaoh
To the tombs in the sand
There's a force in the distance
Calls you to the sacred land

The chanting of the priests





",The Chanting of the Priests,1987
Venom,"I lust a princess - A crystal queen
Virginal whiteness is all that I dream
My magic snow - Show me your real
To make a contact - I'm dying to feel
Watch out - You there

She makes you feel good
Don't you care
Inside - Can't fight it
It's a deadline now
You bring your money and be there
For the deadline now

It's a deadline now
For the midnight frost
Give me an angel - Blow me a breeze

It's a deadline
Hunting a killer - It's a jungle disease
Watching in marvel you'll steal her release

You walk on silver - Travel the seas
Watch out - You there
Don't you care
She makes you feel good
Inside - Can't fight it
You bring your money and be there
For the deadline now

For the midnight frost
It's a deadline now
It's a deadline now
It's a deadline now
My mind's in torment - Something's not clear

I take my goddess where nobody hears
She sees right through me - She's in my mind
Mother of madness - Immortals blind

Watch out - You there
She makes you feel good
Don't you care
Inside - Can't fight it
You bring your money and be there
For the deadline now

It's a deadline now
It's a deadline now
For the midnight frost
It's a deadline now
It's a deadline now
It's a deadline now
It's a deadline now



",Deadline,1987
Venom,"Take my hand and we'll be one
You'll belong to the hellion
It's a chance in a million
Don't be scared on our way down

Black your tears dry on me

Friend or foe or liar
Fire - In hell fire - Fire

Hear my tale and walk with me
Answer not to oblivion
Ask your stars your destiny
Shining down on Marillion

Red your eyes look for me
Scream the demon's choir

Don't believe you're a warrior
Search your soul for we're the same
Let me kick your mind insane

Give your services to me
Hell's my unholy abattoir

Burning feeds my buyers
Fire - Fire - Burning in fire - Fire - Hell fire



",Fire,1987
Venom,"Gypsy woman calls me
Caution leads the way
Words or endless stories
Reads from a book of night and day
Crystals in her gaze
Shows me of a place inside a maze
Cities golden splendor

Only life surrender
Candles all around me

Mountains in the sky
Wakes in mortuary
This is the place where life's a lie

Gasping in the air
Wind breathes words - She's not there
Deserts vast and barren
Still the witches jargon
Just my life surrender
Promises of splendor
She's a gypsy

Blinding lights flash at me

I can't believe this place is real
Wake me from this dream
Fires in stormy weather
Silver shields the rain
Her grip so tight that my life drains
Poison messages sent

Nectar from the serpent
Never life surrender

Psylocybin splendor
She's a gypsy



",Gypsy,1987
