Band,Lyrics,Song,Year
Vronique Sanson,"Il est parti comme il tait venu
Sans un mot
Avec un sourire au coin de ses lvres
Et moi
Je rve encore de lui
Toutes les nuits

Juste ses pas sur le tapis carr
Dans la nuit
Ses yeux qui me voient dans l'obscurit
Sa voix
Que j'entends dans mon rve
Triste et belle

Change mon destin
Touche-moi de loin
Je t'appelle pour rien
Mais ce que je crains c'est de passer

Toute une vie sans te voir
C'est a qui me fait mal
C'est a qui me fait vieillir
Toute une vie sans te voir
 seulement t'imaginer
Je suppose
Comme un pauvre prisonnier
Ou bien comme un homme qui donne
Tout

Il est parti comme il tait venu
Sans un mot
Avec une larme coulant sur ses lvres
Et moi
Je rve encore de lui
Toutes les nuits

Je reviens de loin
Et je reviens de tout
Mais ce que je crains
C'est de savoir que je vais passer

Toute une vie sans te voir
C'est a qui me fait mal
C'est a qui me fait vieillir
C'est a qui me fait maudire
Certains choix du hasard
Voil
Le temps passe et passera
J'ai dj des cheveux gris
Et je ne peux plus brler ma vie

Toute ma vie sans te voir
C'est a qui me fait si mal
C'est a qui me fait vieillir
Et j'ai perdu mon me
Quand j'ai perdu ton sourire
Un jour
Quand j'ai tu mon amour
J'ai dj des cheveux gris
Et je ne peux plus brler ma vie

Toute ma vie sans te voir
C'est a qui me fait mal
C'est a qui me fait vieillir
Toute une vie sans histoires
 seulement t'imaginer
Tout seul
Comme un pauvre prisonnier
Ou bien comme un homme qui donne
Et qui donne pour oublier

Toute une vie sans me voir
C'est a qui me fait mal
C'est a qui me fait vieillir
C'est a qui me fait maudire
Certains choix du hasard
Voil
Le temps passe et passera
J'ai dj des cheveux gris
Et je ne peux plus brler ma vie

Toute ma vie sans te voir",Toute une Vie Sans Te Voir,
Vronique Sanson,"Tu as, tu as le son de ma voix
Qui te chante n'importe quoi
Des mots que j'ai dit cent fois
Tu as, mon sourire au bout des lvres
Et mon regard dans tes rves
Et si a ne suffit pas
Mon piano fait des chansons pour toi
Mon piano fait des chansons pour toi
Mon piano fait des chansons pour toi
Mon piano fait des chansons pour toi

Pour toi, pas de promesses dans le cur
Qui te rcitent le bonheur
Mais sans y croire vraiment
Tu as, tu as mes chansons par cur
Celle que tu aimes o te pleures
Et si a ne suffit pas
Mon piano fait des chansons pour toi
Mon piano fait des chansons pour toi
Mon piano fait des chansons pour toi
Mon piano fait des chansons pour toi

ET mme, si tu as peur de ma vie
Si je te parais lointain
Si tu ne me vois que de loin
Et mme si d'autres boucles d'argent
D'autres sourires en diamant
Disent m'aimer passionnment

Tu as, tu as le son de ma voix
Qui te chante n'importe quoi
Des mots que j'ai dit cent fois
Tu as, mon sourire au bout des lvres
Et mon regard dans tes rves
Et si a ne suffit pas
Mon piano fait des chansons pour toi
Mon piano fait des chansons pour toi
Mon piano fait des chansons pour toi
Mon piano fait des chansons pour toi
Juste pour toi",Chanson Pour une Fan,1999
Vronique Sanson,"J'avance tout doucement 
Vers d'autres temps 
Qui m'inspirent confusment 
Qui s'enroulent comme des serpents 
Lentement... 
Il n'y aura plus de soires de bal 
Dans la maison d'Orgeval 
Plus de son de carnaval 
Plus rien... 

Et toi je t'aime encore 
Et mme si tu es loin 
Je dors parce que en rve 
Tu prends ma tte entre tes mains 
Et personne ne peut m'enlever a 
Car tu sais cet amour-l... 
C'est fou, c'est dangereux 
C'est plus mortel qu'une lame de fond 
L'amour qui bat 
C'est fou, c'est mystrieux 
C'est parallle  nos destins 
L'amour qui bat 

Et le temps, le temps qui voile et dvoile tout 
Aurait bientt raison de nous 
Rien n'est jamais hasard... 
J'avance, tout doucement 
Au cours du temps 
Qui m'aspire comme un sable mouvant 
Qui s'enroule comme un serpent 
Lentement... 

Et toi je t'ai encore 
Et mme si je suis loin 
C'est si fort que dans mon rve 
J'ai toute l'eau de ta lumire 
Et personne ne peut m'enlever a 
Car tu sais cet amour-l... 
C'est fou, on l'a en nous 
Comme dans le fond d'un marcage 
Son got qui bat 
C'est fou, c'est mystrieux 
C'est parallle  nos destins 
L'amour qui bat 
Mais c'est fou, c'est dangereux 
C'est plus mortel qu'une lame de fond 
L'amour qui bat",L' Amour Qui Bat,1999
Vronique Sanson,"Les jours de ma vie s'en vont
Sans que j'aie pu retenir une leon
Je sais que l'amour est l
Infiniment troublant, attendant d'tre vu
Quand viennent les coups de grisou
La vie demande tant de vous
Je me demande  quels vents de l'enfer
Une fois, j'ai obi tout bas

J'ai eu des temps de folie
Des temps d'horreur et des nuits d'oubli
Quand on sait l'angoisse l
Infiniment cruelle, attendant la cure

Le monde est doux dehors
Doux, doux, doux dehors
Et fou dedans
Fugitif et lent
Flou d'abord
Doux, doux, doux, dehors
Fou de sang
Vous entrez dedans
Mais jamais, vous n'en sortez comme avant

J'ai regrett d'tre aveugle souvent
Quand l'amour me regardait
Infiniment patient, attendant d'tre vu

La trace de mes poisons
Moi, je la porte sur mon front
Je sais que la vie s'en va
Infiniment plus belle qu'on ne l'imagina

Le monde est doux dehors
Doux, doux, doux dehors
Et fou dedans
Fugitif et lent
Flou d'abord
Doux, doux, doux, dehors
Tout le temps
ternellement

Le monde est doux dehors
Doux, doux, doux dehors
Et fou dedans
Fugitif et lent
Flou d'abord
Doux, doux, doux, dehors
Tout le temps
ternellement

Ah ah ah, ah ah ah
Doux dehors, fou dedans

Ah ah ah, ah ah ah
Doux dehors, fou dedans

Ah ah ah, ah ah ah
Doux dehors, fou dedans

Ah ah ah, ah ah ah
Doux dehors, fou dedans

Doux dehors, fou dedans
Doux dehors, fou dedans","Doux Dehors, Fou Dedans",1999
Vronique Sanson,"Les jours de ma vie s'en vont
Sans que j'aie pu retenir une leon
Je sais que l'amour est l
Infiniment troublant, attendant d'tre vu
Quand viennent les coups de grisou
La vie demande tant de vous
Je me demande  quels vents de l'enfer
Une fois, j'ai obi tout bas

J'ai eu des temps de folie
Des temps d'horreur et des nuits d'oubli
Quand on sait l'angoisse l
Infiniment cruelle, attendant la cure

Le monde est doux dehors
Doux, doux, doux dehors
Et fou dedans
Fugitif et lent
Flou d'abord
Doux, doux, doux, dehors
Fou de sang
Vous entrez dedans
Mais jamais, vous n'en sortez comme avant

J'ai regrett d'tre aveugle souvent
Quand l'amour me regardait
Infiniment patient, attendant d'tre vu

La trace de mes poisons
Moi, je la porte sur mon front
Je sais que la vie s'en va
Infiniment plus belle qu'on ne l'imagina

Le monde est doux dehors
Doux, doux, doux dehors
Et fou dedans
Fugitif et lent
Flou d'abord
Doux, doux, doux, dehors
Tout le temps
ternellement

Le monde est doux dehors
Doux, doux, doux dehors
Et fou dedans
Fugitif et lent
Flou d'abord
Doux, doux, doux, dehors
Tout le temps
ternellement

Ah ah ah, ah ah ah
Doux dehors, fou dedans

Ah ah ah, ah ah ah
Doux dehors, fou dedans

Ah ah ah, ah ah ah
Doux dehors, fou dedans

Ah ah ah, ah ah ah
Doux dehors, fou dedans

Doux dehors, fou dedans
Doux dehors, fou dedans",Doux Dehors Foud Dedans,1999
Vronique Sanson,"Il est quatre heures et je l'attends
J'ai du chagrin
Je vais dans l'appartement
Serrant les poings
J'ai peur
Je vais, je viens dans l'ombre vagabonde
Et puis l, j'entends le bruit des secondes qui fait Ha ! 
Panne de coeur

Il est quatre heures et je l'attends
Toujours en vain
Il y a un accident sur le rond-point

J'ai peur
Et mon coeur a saut comme une bombe :
Mais non, ce n'est qu'une larme qui tombe et qui fait HA ! 
Panne de coeur

Il est quatre heures, il n'est pas l
Mais s'il revient
Je saute dans ses bras car je sais bien :
Je l'aime
Et il restera prs de moi dans l'ombre
Je n'entendrais plus le bruit des secondes qui fait HA ! 
Panne de coeur...",Panne de Coeur,2001
Vronique Sanson,"Quelque part dans la ville 
Tu marches 
Sans pour autant savoir o tu vas
Tu repenses  ta vie 
Dj 
Tu comptes combien de gens tu as dj trahi 
Combien de gens  qui tu as dj menti 
Combien de gens que tu as dj fait souffrir 
Et du fond de ton remords 
Tu laimes encore

Tu es prisonnier de ton secret
Mais ta douleur efface ta faute
Mais ta douleur efface ta faute
Mais ta douleur efface ta faute

Tu es mal dans ta peau
Tu pleures
Sans pour autant tre jamais consol
On rit derrire ton dos
Laisse faire
Tu te sens seul dans celle ville de millionnaires
On rit derrire ton dos
Mais au fond, quest-ce que a peut faire? 
Et tu souris  tout le monde
Tu souris  tout le monde

Tu es prisonnier de ton secret
Mais ta douleur efface ta faute
Mais ta douleur efface ta faute

Mais ta douleur efface ta faute

Pauvre maudit
Comme ta vie doit tre une comdie
Pauvre maudit
Mais comme ta vie doit tre une longue nuit 
Pauvre maudit

Quelque chose dans ta vie sen va 
Dont tu ne sais plus rellement quoi penser
Tu nas plus ltincelle du gnie 
Tu nas plus ltincelle de la vie 
Tu es mal dans ta peau
Ce soir 
Soudain tu naimes plus ton image
Mme si du fond de ta honte 
Tu souris  tout le monde

Tu es prisonnier de ton secret
Mais ta douleur efface ta faute
Mais ta douleur efface ta faute
Mais ta douleur efface ta faute

Pauvre maudit
Comme ta vie doit tre une longue nuit
Pauvre maudit
Mais comme ta vie doit tre une longue nuit 
Pauvre maudit

Mais ta douleur efface ta faute
Mais ta douleur efface ta faute
Mais ta douleur efface ta faute
Mais ta douleur efface ta faute
Mais ta douleur efface ta faute
Mais ta douleur efface ta faute
Mais ta douleur efface ta faute
Mais ta douleur efface ta faute
Mais ta douleur, efface, ta faute",Le Maudit,2004
Vronique Sanson,"Tu lisais des bouquins de Sade lentement tu tournais les pages 
Lente puissance qui cre ta cage tu regardais toutes ces images 
Devant les montagnes les mirages du lac 
D'Annecy Annecy oh oh oh 
Et ses tranges reflets de jade comme y en a par ici par ici 
Et dans ton coeur tu cries ta rage 
Mais ton coeur c'est une marmelade due  tes affreux drapages 
Et tu n'en es jamais malade et tous tes amours d'hiver reviennent au lac 
D'Annecy Annecy oh oh oh 
Mais tu es seul  part entire 
Et je dis dieu merci dieu merci 
Oh mon ange t'as plus de plumes que moi 
Et tu chantes l'envers  l'endroit 
Oh mon ange j'ai mon enclume  moi 
Et on flanche quand tu nous survoles tout bas 
Et dans ton monde de mascarade tu rendrais toutes les choses fades 
Avec les hommes qui t'ont servi 
Faux sentiments pauvre parade 
Et a t'a rendu trop bizarre et tu es fan de lui fan de lui 
Pauvre de lui
a t'a rendu trop bizarre et tu l'es 
Toute la nuit toute la nuit 
Oh mon ange t'as plus de plumes que moi 
Et tu chantes l'envers  l'endroit 
Oh mon ange j'ai mon enclume  moi 
Et on flanche quand tu nous survoles tout bas 
Je pardonnerai tous ses langages 
Avec une haine sans ambages 
Dans une cour qui rit de lui 
Avec une femme qui le maudit 
J'hriterai de tous ses naufrages 
Et je dis allez allons y allons y 
Je partirai sans mes bagages 
Allez allons y allons y 
Devant les montagnes les mirages du lac 
D'Annecy Annecy oh oh oh 
Et ses tranges reflets de jade 
Comme y'en a par ici par ici 
Devant les montagnes les mirages du lac 
D'Annecy Annecy oh oh oh 
Et ses tranges reflets de jade 
Comme y'en a par ici par ici",Annecy,2004
Vronique Sanson,"Je pique et je mords 
Je pique et je mords 
Mais pas trop fort 
Je pique et je mords 
Je pique et je mords 
Mais sans remords 
Les sticks et les clopes 
Les sticks et les clopes 
Images en bloc 
De bric et de broc 
Le fric et le toc 
Toi tu t'en moques 
Mes cliques et mes claques 
Mes cliques et mes claques 
J'en ai la trace 
Les pics et les as 
Les pics et les as 
Je ne les veux pas 
Tu tiques et t'as tort 
Tu tiques et t'as tort
Je suis bien loin 
J'ai pas de remords 
J'ai pas de remords 
Je vais trs bien 
Tes mics et tes macs 
Tes mics et tes macs 
J'en ai ma claque 
Je pique et je mords 
Je pique et je mords 
Mais pas trop fort 
Je pique et je mords 
Je pique et je mords 
Mais sans remords 
Des tics et des tacs 
Des tics et des tacs 
Toi tu t'en tapes 
Tu flippes et tu bloques 
Tu flippes et tu bloques 
Jusqu'au matin 
T'est chic dans tes loques 
Ton sac en breloques 
Moi je ne dirai rien 
Je pique et je mords 
Je pique et je mords 
Mais sans remords",De Bric et de Broc,2004
Vronique Sanson,"Parfois, la nuit quand tout se tait 
Je fais des rves bizarres 
Dans l'ombre grise, mal rveille 
Je chasse les dmons noirs 
Et je pense aux souvenirs 
D'une enfance oublie 
O tous les rires, tous les sourires 
Coulaient comme du lait 

C'est bon, c'est toujours bon 
C'est toujours aussi fort 
La vrit d'un souvenir 
C'est qu'il existe encore 
J'ai oubli mes audaces 
Mais mon cur se rappelle 
La belle confiance dj tenace 
Que m'inspirait un ciel si lourd 
Si lourd 
Je me souviens d'un vieux bonhomme
Qu'on appelait Plum-Patte 
Qui savait voir dans l'avenir 
Nos vies futures et nos dsirs 
Il est mort sans rien nous dire 
On tait bien contents 
J'ai pas voulu savoir d'avance 
Le destin qui m'attend 

Ainsi s'en va la vie 
Dans l'air du temps 
Comme par magie 
Tout parat vident 
Tout vous semble important 

Et le silence dans nos mmoires 
Se brise et disparat 
Faisant place  un miroir 
Que nul ne voudrait voir en vrai 
O personne n'oserait se voir 
De peur d'tre fan 
La lchet de cette histoire 
C'est que tout le monde le sait 

Ainsi s'en va la vie 
Dans l'air du temps 
Et la folie drive doucement 
Vers un monde vanoui 

Petite, va chercher le pain 
Surtout, ne t'arrte pas en chemin 
Rentre avant la nuit 
Va chercher le vin 
Non, pas chez celui-l, chez l'autre, tu sais bien 
L'cole, c'est trs bien 
Il faut avoir un bagage en main 
Il y a toujours un espoir 
Et ta mre et moi, pensons l'avoir pour toi 

Ainsi s'en va la vie 
Dans l'air du temps 
Ainsi se rit la vie 

Je m' demande si j'ai raison 
Ou si la folie 
Est entre dans ma maison 
Comme une litanie 
J' voudrais pas qu'elle vienne maintenant 
Si elle vient vraiment 
Solitude  bon march 
Faudrait pas rver 

Aprs tout, c'est en nous que l'amour est n 
Et c'est en nous qu'il dort 
Il nous a tous hypnotiss 
Et c'est nous qu'il mord 
Avec douceur, avec colre 
Il nous fait faire en l'air 
Tout un tas d' tours imaginaires 
Comme un acrobate 

C'est pas marrant d'tre acrobate 
Quand on sait pas voler 
C'est plus facile d'tre automate 
Qui peut pas penser 
Qu'on peut casser en mille morceaux 
Et puis tout balayer 
Jeter le tout dans l' caniveau 
Et tout recommencer 

Ainsi s'en va la vie 
Ainsi s'en va le temps 
Et la folie 
Drive doucement 
Ainsi s'en va la vie 
Ainsi s'en va le temps",Ainsi S'En Va La Vie,2004
Vronique Sanson,"Prends donc le dernier verre de la saison 
Et laisse tous les enfants  la maison 
Reprends ta valise noire 
Et va-t'en par le dernier train du soir 

Je me demande pourquoi t'aimes pas le monde o tu vis 
Pourquoi tu m' fais la gueule sans raison, dis ? 
Avec un homme comme toi 
C'est bien barr pour qu'on en reste l 

Tu dis qu' la vie c'est dur, c'est difficile 
Qu' c'est moi qui m' fous dedans, pauvre imbcile ! 
Je suis sur ta liste noire 
C'est mal barr pour qu'on n'ait pas d'histoire 

Tu m'observes et tu m'espionnes 
Tu m'coutes toujours quand je tlphone 
Tu critiques mes vieux amours 
Je commence  voir maintenant 
Pourquoi on t'appelle ""Loulou dent-de-loup""
Toujours  souponner un mauvais coup 
J' veux pas d'un homme comme toi 
Qui ternirait ma vie, ah, non pas a ! 

J'aurais tellement pu t'aimer 
Comme jamais on t'aurait aim 
tre douce comme l'eau 
T'envelopper dans la chaleur de ma peau 
Tout chaud, tout chaud 
Te faire des choses 
Qui t' filent la vie dans le bas du dos 

Te donner des baisers, des baisers 
 faire plir tous les badauds 
(Tous les badauds, tous les badauds) 
Avec une femme comme moi 
T'aurais pas vu, la vie, comme elle est noire 

J'aurais tellement pu t'aimer 
Comme jamais on t'aurait aim 
tre douce comme l'eau 
T'envelopper dans la chaleur de ma peau 
C'est pas demain, je te le dis tout de go 

T'aimer  faire plir tous les badauds 
Avec une femme comme moi 
T'aurais pas vu, la vie, comme elle est noire 

Tant pis pour les frissons dans le bas du dos 
Avec un homme comme toi 
C'est pas facile, j' te jure, d'en rester l",Avec un Homme Comme Toi,2004
Vronique Sanson,"C'est bizarre 
C'est bizarre 
C'est pas pareil 
Quand l't demande l'asile au soleil 

C'est trop tard 
C'est trop tard 
L'hiver sommeille 
Prt pour une attaque ventuelle 
Au revoir 
Au revoir 
L't, t'es cuit 
Tout le monde demande l'asile au soleil 

Au revoir 
Au revoir 
L't s'enfuit 
Comme l'amour d'un homme au rveil",C'est Bizarre,2004
Vronique Sanson,"Les gens que l'on rencontre au hasard des files de fils de
vie
Les gens que l'on vous montre qui seront un jour de vos amis

Mfiez-vous des uns, mfiez-vous des liens qui tournent
autour d'eux
Tranquilles, dangereux, subtils, c'est tellement bien

Dans leur esprit mobile
Ils vous disent que tout va bien, tout est bien quand mme
Pour leur amour fragile, vous vendez votre me pour qu'on
vous aime

Pour faire le plein d'amour, pour quand vous serez sous
terre, aveugles
Livides, tout seuls, hlas, le temps fracasse

Et moi, pour qu'on m'aime, je vendrais mon me au plus
offrant
Au diable mme, s'il rayonnait d'un feu mauvais, tout
douceureux et laid

Et j'ai besoin de vous
J'ai besoin de tous les moments qui vous rendent fous
Mon esprit sentinelle ragit toujours quand on l'appelle

Faire le plein d'amour pour quand je serai sous terre,
aveugle
Livide, toute seule, hlas, le temps vous casse

Moi, pour qu'on m'aime, je vendrais mon me au plus offrant
Au diable mme, s'il rayonnait d'un feu mauvais, tout
douceureux et laid

Et j'ai la musique au moins, c'est tout ce qui me restera
demain
Ci-gt mon destin, brl sous ses ailes, vous ne verrez
rien

Car tous nos amours sont comme les falaises qui tombent dans
l'abme
De lumire sublime, des terres o tout le monde sombre
O tout le monde tombe",J'Ai La Musique au Moins,2004
Vronique Sanson,"Il a tout ce que j'aime 
Et il a tout compris 
La couleur de ma peine 
Et l'angoisse de mes nuits 
La violence insense d'un amour bahi 
Il me donne tout a 
Comme a 
D'un seul regard en moi 

Quand je l'ai rencontr, il tait misrable 
Avec l'or patin d'un talent formidable 
Et l'amour dessch d'une pouse pitoyable 
Et d'un seul coup d'il 
Comme a 
J'ai tu mon orgueil 

Faut jamais rester de glace 
Quand on sent un signal 
Faut pas rire de la menace 
Qu'engendre un idal 
Nous, avec nos rves et nos soupirs 
Avec nos haines et nos plaisirs 
On a aim 

Pas de colre 
Pas de peine 
Pas de misre 
Pas de chanes 
Pas de galre 
Pas de scnes 
Et je l'aime comme a 
Pour a 
Le temps n'existe pas 

Y a pas d'alarme qui sonne en moi 
Ni d'autres faux-semblants 
Mes ides volent bien au-del 
Et tournent avec le vent 

C'est pas pour rien que j'ai eu tant d'aventures 
Je sais que jamais rien ne dure 
Et c'est comme a que j'ai forg mon armure 
Avec le temps et les brlures 
Et tout l'espoir que j'ai dans l'avenir 
C'est de rester chez moi et d'viter le pire 
Et d'esprer n'entendre plus jamais 
Le hurlement muet d'une famille dchire 

Il a tout ce que j'aime 
Il n'est pas dmoli 
Par l'usure de son cur 
Et les choses de la vie 
Et je peux voir de loin 
Une petite lumire 
Tout au bout de la terre 
Tout au bout de la terre d'o je viens 

C'est pas pour rien que j'ai eu tant d'aventures 
Je sais que jamais rien ne dure 
Et c'est comme a que j'ai forg mon armure 
Avec le temps et les brlures 
Et tout l'espoir que j'ai dans l'avenir 
C'est de rester chez moi et d'viter le pire 
Et d'esprer n'entendre plus jamais 
Le hurlement muet des familles dchires",a  Tout Ce Que J'Aime,2004
Vronique Sanson,"Tu m'as dit que j'tais faite 
Pour une drle de vie 
J'ai des ides dans la tte 
Et je fais ce que j'ai envie 
Je t'emmne faire le tour 
De ma drle de vie 
Je te verrai tous les jours 

Et si je te pose des questions 
Qu'est-ce que tu diras 
Et si je te rponds 
Qu'est-ce que tu diras 
Si on parle d'amour 
Qu'est-ce que tu diras 

Si je sais que tu mnes 
La vie que tu aimes 
Au fond de moi 
Me donne tous ses emblmes 
Me touche quand mme du bout de ses doigts
Mme si tu as des problmes 
Tu sais que je t'aime 
a t'aidera 
Laisse les autres totems 
Tes drles de pomes 
Et viens avec moi 

On est parti tous les deux 
Pour une drle de vie 
On est toujours amoureux 
Et on fait ce qu'on a envie 
Tu as srement fait le tour 
De ma drle de vie 
Je te demanderai toujours 

Et si je te pose des questions 
Qu'est-ce que tu diras 
Et si je te rponds 
Qu'est-ce que tu diras 
Si on parle d'amour 
Qu'est-ce que tu diras 

Si je sais que tu mnes 
La vie que tu aimes 
Au fond de moi 
Me donne tous ses emblmes 
Me touche quand mme 
Du bout de ses doigts 
Mme si tu as des problmes 
Tu sais que je t'aime 
a t'aidera 
Laisse les autres totems 
Tes drles de pomes 
Et viens avec moi 

Et si je sais que tu mnes 
La vie que tu aimes 
Au fond de moi 
Me donne tous ses emblmes 
Me touche quand mme du bout de ses doigts 
Mme si tu as des problmes 
Tu sais que je t'aime 
a t'aidera 
Laisse les autres totems 
Tes drles de pomes 
Et viens avec moi",Drle de Vie,
Vronique Sanson,"Quand j'n'aurai plus le temps
De trouver tout l'temps du courage
Quand j'aurai mis vingt ans
A voir que tout tait mirage
Je tire ma rvrence
Ma rvrence

Quand mon fils sera grand
Qu'il n'aura plus besoin de moi
Quand les gens qui m'aimaient
Seront emports loin de moi
Je leur tire ma rvrence
Ma rvrence

Et ma vie, endormie, doucement
Et mon cur sera froid
Il ne saura plus s'affoler
Il ne deviendra
Qu'une pauvre horloge  rparer
Il n'aura plus de flamme
Il n'aura plus de flamme
Il n'y aura plus de femmes.

Et mes amis fidles 
Auront disparu un  un
Trouvant que j'tais belle
Que j'aurai bien fait mon chemin
Alors j'aurai honte de mes mains
J'aurai honte de mes mains.

Quand j'n'aurai plus le temps
De trouver tout l'temps du courage
Quand j'aurai mis vingt ans
A voir que tout tai mirage
Alors j'entends au fond de moi
Une petite voix qui sourd et gronde
Que je suis seule au monde.",Ma Reverence,2005
Vronique Sanson,"Au niveau de la pollution
C'est pas la joie (x2)
Au niveau de la tlvision
C'est pas la joie (x2)
Au niveau de la monte des prix
C'est pas la joie (x2)
Au niveau des embarras de Paris
C'est pas la joie (x2)

Y a encore qu'au niveau de l'amour que a marche toujours

Au niveau de l'environnement
C'est pas la joie (x2)
Au niveau de la gueule des passants
C'est pas la joie (x2)
Au niveau de la contestation
C'est pas la joie (x2)
Au niveau des manifestations
C'est pas la joie (x2)

Y a encore qu'au niveau de l'amour que a marche toujours

Au niveau de nos feuilles d'impts
C'est pas la joie (x2)
Au niveau du cinma porno
C'est pas la joie (x2)
Au niveau de la dvaluation
C'est pas la joie (x2)
Au niveau de la surpopulation
C'est pas la joie (x2)

Y a encore qu'au niveau de l'amour que a marche toujours",C'est Pas la Joie,2006
Vronique Sanson,"Il est jamais bien ras 
Il est toujours fatigu 
Il dit toujours oui  un bon verre de vin 
Il cache souvent sa tendresse 
Par pudeur ou par paresse 
Il est sr de n'avoir jamais peur de rien 

Il a toujours voulu les filles 
Et toutes celles qu'il dshabille 
Ne restent jamais le lendemain matin mais s'il a tort, s'il a raison 
C'est vraiment pas la question, n'en parlons pas 

Il n'a pas de frontires 
Et il n'a mme pas de pays 
Et il n'est pas d'ici 
Il n'a pas de pre 
 prvenir de son dpart 
Il n'est de nulle part 

Il a plusieurs paires de lunes 
Qui s'teignent et qui s'allument 

Il voyage dans le vide et dans le temps 
Mais il est toujours prt  rire 
Pour le meilleur et pour le pire 
Je crois bien qu'il rde la nuit de temps en temps 

Il n'a pas de vraie prison 
Il ne voit que l'horizon 
 travers les brumes du petit matin mais s'il a tort, s'il a raison 
C'est vraiment pas la question, n'en parlons pas 

Il n'a pas de frontires 
Et il n'a mme pas de pays 
Et il n'est pas d'ici 

Comme il n'en a pas l'air 
Moi je vous jure qu'il est bizarre 
Il n'est de nulle part 

Il n'a pas de frontires 
Et il n'a mme pas de pays 
Et il n'en a pas l'air 
Mais je vous jure qu'il est bizarre 
Il n'est de nulle part

Il n'a pas de frontires 
Et il n'a mme pas de pays 
Et il n'en a pas l'air 
Mais je vous jure qu'il est bizarre 
Il n'est de nulle part",Bernard's Song,2007
