Band,Lyrics,Song,Year
Floetry,"There is only one for me
You have made that possibility
We can take that step to see
If this is really gonna be

[Chorus]
All you gotta do is say yes
Don't deny what you feel
Let me undress you, baby;
Open up your mind and express
I'm about to let you know you make me
So, so, so,so,so,so,so
You make me
So, so, so,so,so,so,so, ah

Loving you has taken time, taken time
But I always knew you could be mine
I recognize the butterflies, inside me, Uh
Since it's gonna be made tonight, tonight
All you gotta do is say yes

[Chorus]

Don't deny what you feel
Let me undress you baby;
Open up your mind and express
I'm about to let you know
You make me
So, so,so,so, so,so,so
You make me
So,so,so,so,so,so,so
You make me
So,so,so,so,so,so,so
You make me
So,so,so,so,so,so,so

 I'm about to let you know
 ( So,so,so,so)",Say Yes,2002
Floetry,"You know sometimes we ummm, 
We don't recognize our dreams inside
Our reality and uh other times 
We're not aware of exactly
What's real ya know we walk around day dreaming But the sunshine, the sunshine always is, and I

[Chorus]
I just want to see my lovely sunshine(Sunshine)
I just want to bring back all of my blue skies
And if you take away my rainbow I will cry(cry)
Give me back my sunshine

Dreaming my state of being and I see you smiling You're so happy just laughing and standing strong I'm missing you right here 
Listen to my tears I'm waking up to skies so gray
Needing you to brighten up my day

Okay listen catch your breath cool out 
You need to calm down (that's right)
Concentrate don't go making all your time run out
See your okay it looks much worse than it really is,
And you'll pull through come on you know how we be doing this
It's me and you yo, you promised you can't pull out now,
We're friends for life so you can't just sell me out 
We shared a lot but you know we'll see just so much more
Our wedding day and the children that we prayed for

[Chorus]

I used to depend on your rides to show me the way that I should go 
My reality is blurry I'm afraid of being all alone
Your light has been my guide throughout the good and bad 
I wish that I had spent a little more attention to my one and only sunshine

Listen, I'd never leave you yo, 
I swore on my grave
Damn what's that I'm feeling dizzy 
Kinda getting faint
But it ain't nothing 
Didn't sleep that much last night
From watching over you but none less I'm cool I'm fine
I said I'm feeling fine 
So back up off me I'm alright
I'm here to see my friends 
And what's up with that blinding light
Said I don't need to lie down 
I don't need your help right now 
What's up with all the noises all the running round
You've got it wrong I'm not the one 
Who needs the help in here
Yo, what's up with you, 
You're crying I see tears
Yo, what's going on don't leave 
Please don't take her out
Said I don't understand 
I'm kinda feeling scared now
I said it's getting hard to breathe 
Getting hard to see
I'm not too sure anymore what's going on with me
Please bring her back connect me 
Talk just one more time 
But it's too late the last exhale is mine

[Chorus: x2]",Sunshine,2002
Floetry,"Butterflies inside you give me butterflies inside
Butterflies inside you give me butterflies inside 
Butterflies inside you give me butterflies inside 

All you gotta do is just walk away and pass me by 
Don't acknowledge my smile yea when I try to say hello to you 
And all you gotta do is not answer my calls when I'm tryna get through 
To keep me wondering why and all I can do is sigh I just wanna oh

I just want to touch and kiss 
And I wish that I could be with you tonight 
You give me butterflies inside 
Inside and I

All I gotta say is I must be dreaming 
Cant be real 
Your not here with me 
I can feel you near to me 
So I caress you let you taste us 
Just so blissful listen I would give anything 
Make my dream come true baby you give me butterflies 

I just want to touch and kiss 
And I wish that I could be with you tonight 
You give me butterflies inside 
Inside and I

I just want to touch and kiss 
And I wish that I could be with you tonight 
You give me butterflies inside 
Inside and I

If you will take my hand baby i will show you guide you to the light babe 
If you will be my love baby I will love you 
Love you till the end of time 

I just want to touch and kiss 
And I wish that I could be with you tonight 
You give me butterflies inside 
Inside and I

I just want to touch and kiss 
And I wish that I could be with you tonight 
You give me butterflies inside 
Inside and I

I just want to touch and kiss 
And I wish that I could be with you tonight 
You give me butterflies inside 
Inside and I",Butterflies [*][Demo Version],2002
Floetry,"Laundered linen sheets
Touch me their coldness
And thoughts I can't repeat
Shock me with their boldness
Why did my mind and body believe,
That you would never leave them
Now there's parts of me that blame,
Or well they force me to deceive them
So come back and relieve them

Who would steal you?
I still feel you
Now you're gone
These are lies
They're not real
This is more than I can feel
This is wrong, this is wrong, this is wrong

A bath so hot it almost scolds
And I let the warm surround me
I slide down
Till only my face shows
But I feel colder now
Than before you found me
When u used to pin me down
The clarity in your intent
But if you mind was somewhere else
I cant better anything you can invent
I thought you understood how much you meant

Who would steal you?
I still feel you
Now you're gone
And these are lies
It's not real
This is more than I can feel
It's all wrong
Now you're gone
I work hard to carry on
If you could've seen
How I've been
Then you'd know how much you meant

Who would steal you
I feel you
Now you're gone
Now you're gone
Now you're gone
Gone, gone, gone
Don't you know how much you meant?

Who would steal you?
I still feel you
Now you're gone
These are lies
They're not real
This is more than I can feel
This is wrong
This is wrong
This is wrong
This is wrong",Now You're Gone (More Than I Can Feel) [*],2002
Floetry,"Yo, do you feel clever?
No, forget what everyone else has to say
Do you feel clever?

Subliminally, subliminal
Subliminally, subliminal
Subliminally

It's like, I live in whatever like is
Always raining, similar, never the same
See the game don't play that, so I speak maybes and if onlys
Instead of I ams and fallen memories

All that don't feel to good to be
But my genealogy registers adaptability and that bitch
Feels like it's fixed
'Cause my great grandmother spoke of this exact same thing

I use rhyme but I think she used to sing
Or just bring her force to a circle of women
And they be aligning chakrias and meditating
Bad vibe vaccinating, evil energy eliminating
As well as debating on how to raise the children and love the men

But today we're more caught up in Ricki Lakes and Jerry Springer
Becoming Numb, now that's the title of my narrative base, novel of fiction
But still my fascination is loyal to how we manage to stay, we, human
A once civilized nation, or so they told me, yo

Just seeing how we fight to be
Instill it in your sight to be
It's subliminal, subliminally
Subliminal, subliminally

Just seeing how we fight to be
Instill it in your sight to be
It's subliminal, subliminally
Subliminal, subliminally

You see, breast was a blessing so I owe no shit
Obligation is a choice, but this choice I select
Who to share my love with, love me and be in
'Cause I believe that I am leaving with most are submerged in

It's a messed up situation
So stay stationed is the advice that I leave
To those who can't come to those you won't proceed
You can stay right here

And if you ever pass go, do not collect 200, I repeat do not collect
So I'm this disputing being openly happy
When it serves so well to be depressed

Any attempt of smiling needs impeccable timing
Make the suit sweet by allowing them to feel
That they suited the situation to the masses, to the market
Keep them pushing Beemers

My friend I may not be able to deliver a Benz to you
But I can give you piece of mind
Piece of mine

Define ownership, now will your mothership take with it
What you purchased at your outlet
So my friend once again I'll just give you piece of mind

Just seeing how we fight to be
Instill it in your sight to see
It's subliminal, subliminally
It's subliminal, subliminally

Just seeing how we fight to be
Instill it in your sight to see
It's subliminal, subliminally
It's subliminal, subliminally

[Incomprehensible] yes, it's [Incomprehensible]

Just seeing how we fight to be
Instill it in your sight to see
It's subliminal, subliminally
Subliminal, subliminally

Just seeing how we fight to be
Instill it in your sight to see
It's subliminal, subliminally
It's subliminal, subliminally

Just seeing how we fight to be
Instill it in your sight to see
It's subliminal, subliminally
Subliminal, subliminally
",Subliminal,2002
Floetry,"New York City
What's Going On
What you been up too
Yeah I know
Bunch a niggaz nunning around with throw-backs and fitteds on
Niggaz know who started the game man
You know once niggaz start doin you
You got to do something else
Ya know what I'm saying
Do bigger better things
Switch lanes with big and better rings on niggaz
Big nigga shit
Fuck em
Yeah
Aiyyo

Listen, what you pappas read you thinking I ain't getting sleep
Its way past the streets no doubt the shit is getting deep
L-B-N-Y-G your local heat clappers
Pass the pill man I'm fillin ill
I'm sick of all you cheap rappers
Get the mic up kid yo flow is mad trash
The cast got you talking shit man ya mad ass
I put ya bitch niggaz on from the start yo
Plus I am the wizard that gave you your heart so
I bust a few shots off all ya get still
I run this shit motherfuckers you just lives here
Never wanted problems it wasn't necessary
But I'm a bury niggaz quick fast in a hurry
These fuckers think I'm something sweet because I love the women
Ok these niggaz want problems its problems that I'm giving
The crack started us off the hook and don't look for trouble
This lifestyle I live it we give it to you double

[Chorus]
The bank shit official crack stars is who I hang with
Tote my slang with lets give that dude the same shit
The guns pop off of those that come to close to
The fam niggaz track you strike back, yo we supposed to

The bank shit official crack stars is who I hang with
Tote my slang with shit give that dude the same shit
The guns pop off of those that come to close to
The fam niggaz track you strike back yo we supposed to

Aiyyo
These new niggaz run around like they been done it
You just spark enough faggot ass I've been blunted
I gotta team in every borough New York nigga
Watch how you talk, watch where you walk nigga
These jumps wear their steak suits so lets eat 'em up
They ain't worth it because I let our bitches beat 'em up
Fuck the star shit I'm up in the bar with
Cast a hustle of the prove we got muscle man
Before you haters out there that can't see me
Mad because your girlfriend bump my CD
Your read easy live with your corny stash
Or get gun up when we run up on your corny ass
Back up off us nigga you the softest
Actin like you sold crack with coppers and officers
Flash back shell-toe thick strings and jewelery
RIP to Freaky-Tah Mike and Cooly-be	

[Chorus]

[Verse 3]
I keeps a Yankee fitted on tracks is spitted on
I have no problems showing mine we can get it on
Its never hate believe me its strictly fact yo
Your corny rap flow match your corny rap show
Shine ahead niggaz time to get niggaz
How y'all coming with that bullshit you spit niggaz
Take a time out you really not moving nothing
Killing me with your fronting like your moving something
To them so called friends of mine that gayed out
You niggaz played out I'm glad you niggaz stayed out
Fuck the crab shit the best of friends is living well
I know you niggaz see me doing me I'm giving hell
Pass the mic crew never did like you
Getting comfortable niggaz ain't invite you
You lame niggaz I'm as hot as a flame niggaz
You know why I'm in this game niggaz

[Chorus]

[Floetry]
This cowards walking with a complex here
We drop him so quick we from the crib to the film set
Ain't nothing new about the soul or new about your flow
If you want your stripes you got to earn them yo
This goes out to you and you and you
And if you feel it in your heart yo it must be true
Walk how you walk and do what you do
Live while you live we're the proof so we're supposed to

[Chorus]",Supposed To,2003
Floetry,"Big Ben chimes
Big Ben chimes
Big Ben chimes
Big Ben chimes

Songstress, huh yeah

I'm gonna take you on a ride to a lyrical expedition
In vision, imagine this, I be wishing that everybody would listen 
Kissing ass until I was able to step into the arena,
Make an impression and lesson and discovering
I out-smarted mathematicians, blazed through expeditions,
through conditions not envisioned by those who pass predictions
In addition got a mission, a vision, if you would listen
Produce collaboration increasing complications

You understand how my Floetry got you bubblin'
I see you wondering why you hear my name again 
Never the same again, yes we came to win again
And if we fail again then love will conquer pain again
Just take a breath and continue the explanation
Turn off the PlayStation, still in my attention
Did I mention poetic extension, my redemption 
Soul is in suspension at the realization.
With poor libation for ethnic formation 
Empower this position... more come to listen 
(Yo F-L-O-E-T-R-Y get it?) 
Floetry is like a master of chemistry turn your negativity into kinetic energy

You can't test we 
No no you can't test we...see? 
Subtracting abstract messages from within that's what I'm giving 
That's what I'm giving
That's what I'm giving
That's what I'm giving
S-E five, S-E five, S-E five
S-E five, S-E five",Big Ben [DVD][Live],2003
Floetry,"Big Ben chimes
Big Ben chimes
Big Ben chimes
Big Ben chimes

Songstress, huh yeah

I'm gonna take you on a ride to a lyrical expedition
In vision, imagine this, I be wishing that everybody would listen 
Kissing ass until I was able to step into the arena,
Make an impression and lesson and discovering
I out-smarted mathematicians, blazed through expeditions,
through conditions not envisioned by those who pass predictions
In addition got a mission, a vision, if you would listen
Produce collaboration increasing complications

You understand how my Floetry got you bubblin'
I see you wondering why you hear my name again 
Never the same again, yes we came to win again
And if we fail again then love will conquer pain again
Just take a breath and continue the explanation
Turn off the PlayStation, still in my attention
Did I mention poetic extension, my redemption 
Soul is in suspension at the realization.
With poor libation for ethnic formation 
Empower this position... more come to listen 
(Yo F-L-O-E-T-R-Y get it?) 
Floetry is like a master of chemistry turn your negativity into kinetic energy

You can't test we 
No no you can't test we...see? 
Subtracting abstract messages from within that's what I'm giving 
That's what I'm giving
That's what I'm giving
That's what I'm giving
S-E five, S-E five, S-E five
S-E five, S-E five",Big Ben [Live],2003
Floetry,"Remember how you used to, umm
You used to phone up and you wouldn't say your name
You'd just say, uh, ""Hey you""

You know, I see you on my blank sheet
Before I write or form or record this situation, yo
My memories choke me and stain my pillow
As my voice becomes hollow

As I trace tear lines around this space that won't fill, yo
I feel nothing but this way and the emptiness stays
And it's cluttered with a silence that teases me
It leads me on like it's gonna say, like it's gonna say

Hey you, sorry that I have to leave, I'll try to come back, ooh
Hey you, I'm sorry that I have to leave, I'll try to come back one day

You know yesterday I, I stood outside in the rain
In an attempt to dissolve away or just disappear or be gone
Be back or be just, I try to see the point but I only see the pain
You know, my dreams cry when they're slain
I regain consciousness to blurry vision
I try to listen out for whispers of

Hey you, I'm sorry that I have to leave, I'll try to come back, ooh
Hey you, I'm sorry that I have to leave, I'll try to come back one day

Rain drops disguise my tears have gone
And I want you to be here with me, to stand by me
Said I can't help but to be selfish, baby
'Cause I don't wanna be alone

Hey you, I'm sorry that I have to leave, I'll try to come back, ooh
Hey you, I'm sorry that I have to leave, I'll try to come back one day

Did I leave you behind or did you let me go?
All I know is you're not here to say to me those special words
Time was once on our side but now it's against us
It parts us, all I want to hear you say is

Hey you, I'm sorry that I have to leave, I'll try to come back, ooh
Hey you, I'm sorry that I have to leave, I'll try to come home one day

Hey you, I'm sorry that I have to leave
I'll try to come home, I'll try to come home, said that
Hey you, I'm sorry, I said one day, I said one day
Said one day, one day, one day",Hey You [DVD][Live],2003
Floetry,"Remember how you used to
You used to phone up and you wouldn't say your name
You'd just say, uh, ""Hey you""

You know, I see you on my blank sheet
Before I write or form or record this situation, yo
My memories choke me and stain my pillow
As my voice becomes hollow

As I trace tear lines around this space that won't fill, yo
I feel nothing but this way and the emptiness stays
And it's cluttered with a silence that teases me
It leads me on like it's gonna say, like it's gonna say

Hey you, sorry that I have to leave, I'll try to come back, ooh
Hey you, I'm sorry that I have to leave, I'll try to come back one day

You know yesterday I, I stood outside in the rain
In an attempt to dissolve away or just disappear or be gone
Be back or be just, I try to see the point but I only see the pain
You know, my dreams cry when they're slain
I regain consciousness to blurry vision
I try to listen out for whispers of

Hey you, I'm sorry that I have to leave, I'll try to come back, ooh
Hey you, I'm sorry that I have to leave, I'll try to come back one day

Rain drops disguise my tears have gone
And I want you to be here with me, to stand by me
Said I can't help but to be selfish, baby
'Cause I don't wanna be alone

Hey you, I'm sorry that I have to leave, I'll try to come back, ooh
Hey you, I'm sorry that I have to leave, I'll try to come back one day

Did I leave you behind or did you let me go?
All I know is you're not here to say to me those special words
Time was once on our side but now it's against us
It parts us, all I want to hear you say is

Hey you, I'm sorry that I have to leave, I'll try to come back, ooh
Hey you, I'm sorry that I have to leave, I'll try to come home one day

Hey you, I'm sorry that I have to leave
I'll try to come home, I'll try to come home, said that
Hey you, I'm sorry, I said one day, I said one day
Said one day, one day, one day",Hey You [Live],2003
Floetry,"Sometimes blindness finds me and leads me through ignorance
Not allowing us to gain experience so we become lifeless
At other times I cover with self pity or work aimlessly through reality
So occasionally I choose to travel alone

But never fulfill my possibility
So mostly I attempt to achieve balance
By seeking right knowledge and loving and reviewing
And eventually over standing those many lessons of my life

You got me caught in a stormy eyed world that drains
And I beg to see truth and promises you made to me
Now we've come so far but my visions of happiness
With you in my life I'm afraid and confused
If I was a bird I'd fly

If I was a bird I'd fly away, spread my wings so I'd escape
If I was the sky I'd let it rain to wash away the pain
If I was a bird I'd fly away, spread my wings so I'd escape
If I was the sky I'd let it rain to wash away the pain

Now why do I feel so alone knowing I know I have you
And what made you turn around on me what did I do?
And when did love feel this way so much pain and misery
Where's the you I once knew and could you fly with me?

If I was a bird I'd fly away, spread my wings so I'd escape
If I was the sky I'd let it rain to wash away the pain
If I was a bird I'd fly away, spread my wings so I'd escape
If I was the sky I'd let it rain to wash away the pain

Now I can't stay, you won't need me
Set me free and let me fly
Oh fly with me, fly with me me
Fly with me, yeah, fly, oh fly, fly

If I was a bird I'd fly away, spread my wings so I'd escape
If I was the sky I'd let it rain to wash away the pain
If I was a bird I'd fly away, spread my wings so I'd escape
If I was the sky I'd let it rain to wash away the pain

Fly away
If I were the sky I'd let it rain to wash the pain
Fly away
If I were the sky I'd let it rain",If I Was a Bird [Live],2003
Floetry,"We wrote fairy tales
Of how we'll live in castles
Tight like Hansel and Gretel
And grow old and settle

In a town that we'll tighten
With our marry day
We gonna love like that
Like everyday like every way

Like can I stay at yours tonight?
We can hold tight, love bite
And share some soul
We can pick and roll

Lose control and let me take it
Like how I let you break it
Don't forget we could

Get high on each other
And serve time for it
Through the night and back
Into the morning, can't crack the habit

So, you see I'm feeling
I'm needing some more
And you got me grinning like it's
Money that I'm winning

No way is this ending
'Cause you got me feeling purer than thou
You need to show me how you do this thing
'Cause you got me singing like

I'll crown you king of this throne
If you can take me home
Like runs with no stripes
It doesn't have to be tonight

How's about early morning, I'm talking AM
We can beat the dawn
Or just chill through time barriers
Can't help the whispers of I do

But you see through my proper test
Got me making game faces
In London we say lacing you say making sense
This shit's intense ya, I kinda ? offense

'Cause you move me
So I broke my role and I got freaky with it
You chastise me with my own belt
I ain't gonna lie, I felt the universe move

You left me singing like opera
Like Cleopatra or Madam Butterfly
Yo it feels so good you brought tears
To my eyes I was like

Now, was that supposed to happen
All that foot tappin' voice breakin'
Now I'm carving Kamasutra diagrams, y'all
With the headboard

Ignored the buzzer four times
Got up hard telling lies
Even surprised myself
With my conniving ways

I dived in like he meant survival
Like he was christened H-two-O
Like he could make the trees grow
And the clouds spit snow

He laid kisses on my chest
Like his name was Zorro
Had me saying, ""Hell No""
When he said he had to go

I was hiding clothes
And play fighting like children
We were clashing our Titans
Till weight we were losing

I had Slum Village album on repeat
We were knockin' boots to hip hop beats
I even reached my maximum in my sleep
Yo, he had me singing like

Yo, he had me, he had me
He had me like, he had me like",Opera [Live],2003
Floetry,"See I've been watching you for a while your smile and stuff
And I don't know if I can be with you for tonight, alright
Is that alright, baby, baby

There is only one for me
You have made that a possibility
We could take that step to see
If this is really gonna be
All you gotta do is say yes

All you gotta do is say yes
Don't deny what you feel let me undress you, babe
Open up your mind and just rest
I'm about to let you know you make me so

All you gotta do is say yes
Don't deny what you feel let me undress you, babe
Open up your mind and just rest
I'm about to let you know you make me so, so
So, so, so, so, so, so
You make me so, so, so, so, so, so, so, so

Loving you has taken time, take time
But I always knew you could be mine
I recognize the butterflies inside me
Sense is gonna be made tonight, tonight
All you gotta do is say yes

All you gotta do is say yes
Don't deny what you feel let me undress you, babe
Open up your mind and just rest
I'm about to let you know you make me so

Don't deny what you feel let me undress you, babe
Open up your mind and just rest
I'm about to let you know you make me so, so
So, so, so, so, so, so
You make me so, so, so, so, so, so, so, so

You make me so, so, so, so, so, so, so, so
You make me so, so, so, so, so, so, so, so, so, so

All you gotta do, all you gotta do is say yes
Don't deny what you feel let me undress you, baby
Open up your mind and just rest
I'm about to let you know you make me so
All you gotta do is say yes",Say Yes [DVD],2003
