Band,Lyrics,Song,Year
Capital Inicial,"Eu não sei o que eu to fazendo mas tenho que fazer
Naquela noite que eu te conheci eu acho que nunca vou esquecer
Um momento quase perfeito inocente em seus defeitos
Tudo que é bom dura pouco e não acaba cedo

Agora pra sempre
Foi embora mas eu nunca disse adeus
Agora pra sempre
Foi embora mas eu nunca disse

Eu disse vamo embora to meio tonto
Preciso respirar lá fora
Me leve para sua casa
Eu quero dormir onde você mora
Eu passando mal e você ria
Tanto barulho eu não entendia
Mas concordava sem saber
Com tudo que você dizia

Se me pedisse pra pular de um prédio
Eu diria sim
Qualquer coisa pra você gostar de mim

Agora pra sempre
Foi embora mas eu nunca disse adeus
Agora pra sempre
Foi embora mas eu nunca disse

Eu perdi o rumo e comecei a delirar
Acho que prometi até parar de beber e de fumar
De repente a noite acaba e todo mundo some
Eu me lembrei que eu esqueci de perguntar o seu nome
Sem endereço nem direção por onde começar
Qualquer coisa pra poder te encontrar

Agora pra sempre
Foi embora mas eu nunca disse adeus
Agora pra sempre
Foi embora mas eu nunca disse

Agora pra sempre
Foi embora mas eu nunca disse adeus
Agora pra sempre
Foi embora mas eu nunca disse

Eu não como eu não rio
Eu não sei o que é adormecer
Me desculpe se eu fechar os olhos e
Desaparecer

Agora pra sempre
Foi embora mas eu nunca disse adeus
Agora pra sempre
Foi embora mas eu nunca disse",Eu Nunca Disse Adeus,2008
Capital Inicial,"Que mulher ruim
Jogou minhas coisas fora
Disse que em sua cama eu não deito mais não
A casa é minha, você que vá embora
Já pra saia da sua mãe e deixa meu colchão

Ela é pró na arte de pentelhar e aziar
É campeã do mundo
A raiva era tanta que eu nem reparei que a lua diminuía
A doida tá me beijando à horas
Disse que se for sem eu não quer viver mais não
Me diz, Deus, o que é que eu faço agora?
Se me olhando desse jeito ela me tem na mão
Meu filho, aguenta
Quem mandou você gostar
Dessa mulher de fases?

Complicada e perfeitinha
Você me apareceu
Era tudo que eu queria
Estrela da sorte
Quando à noite ela surgia
Meu bem, você cresceu
Meu namoro é na folhinha
Mulher de fases

Põe fermento, põe as bomba
Qualquer coisa que aumente e a deixe bem maior que o sol
Pouca gente sabe que na noite
O frio é quente e arde e eu acendi
Até sem luz dá pra te enxergar no lençol
Fazendo congo-blue
É pena, eu sei, amanhã já vai miar, se aguente
Que lá vem chumbo quente!

Complicada e perfeitinha,
Você me apareceu
Era tudo que eu queria
Estrela da sorte
Quando à noite ela surgia,
Meu bem você cresceu
Meu namoro é na folhinha
Mulher de fases!",Mulher de Fases,2008
Capital Inicial,"Nem tudo é como você quer
Nem tudo pode ser perfeito
Pode ser fácil se você
Ver o mundo de outro jeito

Se o que é errado ficou certo
As coisas são como elas são
Se a inteligência ficou cega
De tanta informação

Se não faz sentido
Discorde comigo
Não é nada demais
São águas passadas
Escolha outra estrada
E não olhe,
Não olhe pra trás

Você quer encontrar a solução
Sem ter nenhum problema
Insistir se preocupar demais
Cada escolha é um dilema

Como sempre estou
Mais do seu lado que você
Siga em frente em linha reta
E não procure o que perder

Se não faz sentido
Descorde comigo
Não é nada demais
São águas passadas
Escolha outra estrada
E não olhe,
Não olhe pra trás

Como sempre estou
Mais do seu lado que você
Siga em frente em linha reta
E não procure o que perder

Se não faz sentido
Discorde comigo
Não é nada demais
São águas passadas
Escolha outra estrada
E não olhe,
Não olhe pra trás


Se não faz sentido
Discorde comigo
Não é nada demais
São águas passadas
Escolha outra estrada
E não olhe,
Não olhe pra trás",Não Olhe Para Trás,2008
Capital Inicial,"Tem dezessete anos e fugiu de casa
Às sete horas na manhã no dia errado
Levou na bolsa umas mentiras pra contar
Deixou pra trás os pais e o namorado

Um passo sem pensar
Um outro dia, um outro lugar

Pelo caminho, garrafas e cigarros
Sem amanhã, por diversão, roubava carros
Era Ana Paula, agora é Natasha
Usa salto quinze e saia de borracha

Um passo sem pensar
Um outro dia, um outro lugar

O mundo vai acabar
E ela só quer dançar
O mundo vai acabar
E ela só quer dançar, dançar, dançar

Pneus de carros cantam
Thuru, thuru, thuru, thururu
Thuru, thuru, thuru, thururu
Thuru, thuru, thuru, thururu
Thuru, thuru, thuru, thururu

Tem sete vidas mas ninguém sabe de nada
Carteira falsa com a idade adulterada
O vento sopra enquanto ela morde
Desaparece antes que alguém acorde

Um passo sem pensar
Um outro dia, um outro lugar

Cabelo verde, tatuagem no pescoço
Um rosto novo, um corpo feito pro pecado
A vida é bela, o paraíso é um comprimido
Qualquer balaco ilegal ou proibido

Um passo sem pensar
Um outro dia, um outro lugar

O mundo vai acabar
E ela só quer dançar
O mundo vai acabar
E ela só quer dançar, dançar, dançar

O mundo vai acabar
E ela só quer dançar
O mundo vai acabar
E ela só quer dançar, dançar, dançar

Pneus de carros cantam
Thuru, thuru, thuru, thururu
Thuru, thuru, thuru, thururu
Thuru, thuru, thuru, thururu
Thuru, thuru, thuru, thururu

Thuru, thuru, thuru, thururu
Thuru, thuru, thuru, thururu
Thuru, thuru, thuru, thururu
Thuru, thuru, thuru, thururu",Natasha,2008
Capital Inicial,"Será que sou assim tão fácil de esquecer
Ou sou algum qualquer pra não te merecer
Eu era seu destino, eu era seu caminho
Tudo o que você dizia que queria ter

Andei na corda bamba caí sem perceber
Estava cego, surdo e tonto e pronto pra perder
Laços fracos são os passos falsos
Feliz aniversário e rosas mortas pra você

Não quero nem pensar no que eu quase fiz 
Fingir o que eu não era pra ver você feliz
Inteiro em sua mão de corpo e coração 
Agora sou passado
Um nome que você não diz

Andei na corda bamba caí sem perceber
Estava cego, surdo e tonto e pronto pra perder
Laços fracos são os passos falsos
Feliz aniversário e rosas mortas pra você

Tudo o que você dizia que queria ter
Tudo o que eu te prometia e você não quis 

Andei na corda bamba cair sem perceber
Estava cego, surdo e tonto e pronto pra perder
Laços fracos são os passos falsos
Feliz aniversário e rosas mortas pra você
Laços fracos são os passos falsos
Feliz aniversário e rosas mortas pra você",Passos Falsos,2008
Capital Inicial,"Meu caminho é cada manhã
Não procure saber onde vou
Meu destino não é de ninguém
E eu não deixo os meu passos no chão
Se você não entende não vê
Se não me vê não entende

Não procure saber onde estou
Se o meu jeito te surpreende
Se o meu corpo virasse sol
Minha mente virasse sol
Mais só chove, chove
Chove, chove

Se um dia eu pudesse ver
Meu passado inteiro
E fizesse parar de chover
Nos primeiros erros ah

Meu corpo viraria sol
Minha mente viraria
Mais só chove, chove
Chove, chove

Se um dia eu pudesse ver
Meu passado inteiro
E fizesse parar de chover
Nos primeiros erros ah

Meu corpo viraria sol
Minha mente viraria
Mais só chove, chove
Chove, chove

Meu corpo viraria sol
Minha mente viraria
Mais só chove, chove
Chove, chove

Meu corpo viraria sol
Minha mente viraria
Mais só chove, chove
Chove, chove

Se um dia eu pudesse ver
Meu passado inteiro
E fizesse parar de chover
Nos primeiros erros ah

Meu corpo viraria sol
Minha mente viraria
Mais só chove, chove
Chove, chove",Primeiros Erros,2008
Capital Inicial,"Nas favelas, no senado
Sujeira pra todo lado
Ninguém respeita a Constituição
Mas todos acreditam no futuro da nação

Que país é esse?
É a porra do Brasil!
Que país é esse?
É a porra do Brasil!
Que país é esse?
É a porra do Brasil!
Que país é esse?

No Amazonas, no Araguaia
E na Baixada Fluminense, Mato Grosso, Minas Gerais
E no Nordeste tudo em paz
Na morte eu descanso
Mas o sangue anda solto
Manchando os papéis
Documentos fiéis
Ao descanso do patrão

Que país é esse? 
Que país é esse?
Que país é esse?
Que país é esse?

Terceiro mundo se for
Piada no exterior
Mas o Brasil vai ficar rico
Vamos faturar um milhão
Quando vendermos todas as almas dos nossos índios em
Um leilão

Que país é esse?
Que país é esse?
Que país é esse?
Que país é esse?",Que Pais é Esse?,2008
Capital Inicial,"Ela dormiu no calor dos meus braços
E eu acordei sem saber se era um sonho
Há um tempo atrás pensei em te dizer
Que eu nunca cai nas suas armadilhas de amor

Naquele amor
A sua maneira
Perdendo o meu tempo a noite inteira

Não mandarei cinzas de rosas
Nem penso em contar os nossos segredos

Naquele amor
A sua maneira
Perdendo o meu tempo a noite inteira

Ela dormiu no calor dos meus braços
E eu acordei sem saber se era um sonho
À um tempo atrás pensei em te dizer
Que eu nunca cai nas suas armadilhas de amor

Naquele amor
A sua maneira
Perdendo o meu tempo a noite inteira

Naquele amor
A sua maneira
Perdendo o meu tempo a noite inteira

A noite inteira
A noite inteira
A noite inteira
A noite inteira
A noite inteira",A  Sua Maneira,2008
Capital Inicial,"Como se sente
De volta ao começo
As falhas, os erros
Tudo tem preço

Como se sente
Na volta por cima
Pensando ao contrário
A vida ensina

Como se sente
Voltando atrás
Aprenda a lição
Nunca diga nunca mais
Como se sente
A falta que faz
O mundo dá voltas
Nunca diga nunca mais

Sempre presente
O medo de falar
Na frente de todos
O que ninguém quer escutar

Às vezes se sente
No vento que sopra
Nas nuvens no céu
O que vem pela frente

Como se sente
Voltando atrás
Aprenda a lição
Nunca diga nunca mais
Como se sente
A falta que faz
O mundo dá voltas
Nunca diga nunca mais

Por mais que se tente
Não dá pra sair
Depois de descobrir
Que não há nada a provar

Como se sente
Voltando atrás
Aprenda a lição
Nunca diga nunca mais
Como se sente
A falta que faz
O mundo dá voltas
Nunca diga nunca mais

Como se sente",Como Se Sente,2010
Capital Inicial,"Dias de verão e noites de inverno
A cidade às vezes é um inferno
Criei então um universo onde tudo era perfeito
E feito para nós dois

Passamos muito tempo sentados na calçada
Falando sobre tudo e não dizendo nada
Seu sorriso vale mais de mil palavras
Deixa que o futuro fica pra depois

Depois da meia noite nós acendemos as luzes da cidade
Nos abraçamos e ficamos juntos até nascer o sol

Noites de verão e dias de inverno
Poucos minutos parecem eternos
Você sabe e eu não sei mentir
Esse mundo perfeito nunca vai existir

Não quero esquecer as noites viradas
Falando sobre o mundo até a madrugada
Nos seus olhos eu vejo a verdade
Faço o que você fizer, diga o que você quiser

Depois da meia noite nós acendemos as luzes da cidade
Nos abraçamos e ficamos juntos até nascer o sol

Por quanto tempo só nós dois?
Por quanto tempo só nós dois?
Por quanto tempo só nós dois?

Depois da meia noite nós acendemos as luzes da cidade
Nos abraçamos e ficamos juntos até nascer o sol
Nos abraçamos e ficamos juntos até nascer o sol",Depois da Meia-Noite,2010
Capital Inicial,"Outra história com um outro rosto
Um outro beijo com o mesmo gosto
Era cedo e não podia dar certo
Lá vem um outro dia frio e encoberto

Agora veja o meu estado
Olhando o futuro e prevendo o passado
Como alguém que não sabe o que quer
Mentindo pra todos enquanto puder

Gritar! Se foi um erro, eu quero errar sempre assim
Gritar! Se teve um começo, que tenha fim

O tempo virou e me deu as costas
Outra pergunta com a mesma resposta
Os dias são sempre iguais
O mesmo filme em todos canais

Eu quero voar mas tenho medo de altura
O céu azul me dá tontura
Eu caio mas não chego ao chão
Estou certo, mas perdi a razão

Gritar! Se foi um erro, eu quero errar sempre assim
Gritar! Se teve um começo, que tenha fim

Vivendo e aprendendo a perder
Vivendo e aprendendo a esquecer

Vivendo e aprendendo a perder
Vivendo e aprendendo a esquecer

Gritar! Se foi um erro, eu quero errar sempre assim
Gritar!

Se teve um começo, que tenha fim

Se teve um começo, que tenha fim

Se teve um começo, que tenha fim",Vivendo e Aprendendo,2010
Capital Inicial,"Cai a noite na cidade
Vinda de lugar nenhum
E o dia vai embora
Indo pra lugar algum
Não sentia fome
Não sentia frio
Sentado num canto
De um quarto vazio

Quando a chuva cai
Nas noites mais solitárias
Lembre-se que sempre

Sombras e pensamentos
De um sonho só esperança
Nas paredes ecoavam

O silêncio e a lembrança
Entre ruas desertas
Ele está só de passagem
Na vertigem e tontura
Surgiam todo tipo de imagens

Quando a chuva cai
Nas noites mais solitárias
Lembre-se que sempre
Estarei aqui

Quando a chuva cai
Nas noites mais solitárias
Lembre-se que sempre

Se virou e alcançou o céu
E a última estrela
Nada deixava passar
Tudo lembrava ela

Quando a chuva cai
Nas noites mais solitárias
Lembre-se que sempre
Estarei aqui

Quando a chuva cai
Nas noites mais solitárias
Lembre-se que sempre

Nasce o dia na cidade
Vindo de lugar nenhum
E a noite vai embora
Indo pra lugar algum",Cai a Noite,2013
Capital Inicial,"Ella durmió al calor de las masas
Y yo desperté queriendo soñarla
Algún tiempo atrás pensé en escribirle
Que nunca sortié las trampas del amor

De aquel amor
De música ligera
Nada nos libra, nada más queda

No le enviaré cenizas de rosas
Ni pienso evitar un roce secreto

De aquel amor
De música ligera
Nada nos libra, nada más queda

Ella durmió al calor de las masas
Y yo desperté queriendo soñarla
Algún tiempo atrás pensé en escribirle
Que nunca sortié las trampas del amor

De aquel amor
De música ligera
Nada nos libra, nada más queda

De aquel amor
De música ligera
Nada nos libra, nada más queda

Nada más queda
Nada más queda
Nada más queda
Nada más queda",De Música Ligera,2013
Capital Inicial,"Uuh você é tão acostumada
A sempre ter razão
Uuh você é tão articulada
Quando fala não pede atenção
O poder de dominar é tentador
Eu já não sinto nada
Sou todo torpor

É tão certo quanto o calor do fogo
É tão certo quanto o calor do fogo
Eu já não tenho escolha
E participo do seu jogo
Eu participo

Não consigo dizer se é bom ou mal
Assim como o ar me parece vital
Onde quer que eu vá
O que quer que eu faça
Sem você, não tem graça

Uuh você sempre surpreende
E eu tento entender
Uuh você nunca se arrepende
Você gosta e sente até prazer

Mas se você me perguntar
Eu digo sim
Eu continuo porque a chuva não cai
Só sobre mim

Vejo os outros, todos estão tentando
E é tão certo quanto o calor do fogo
Eu já não tenho escolha
E participo do seu jogo
Eu participo

Não consigo dizer se é bom ou mal
Assim como o ar me parece vital
Onde quer que eu vá
O que quer que eu faça
Sem você, não tem graça

É tão certo quanto o calor do fogo
É tão certo quanto o calor do fogo
Eu já não tenho escolha
E participo do seu jogo
Eu participo do seu jogo
Do seu jogo",Fogo [Versão Sem Público] [Version],2013
Capital Inicial,"Toda essa curiosidade que você tem pelo que eu faço
Eu não gosto de me explicar, eu não gosto de me explicar
Toda essa intensidade, buscamos identidade
Mas não sabemos explicar, mas não sabemos explicar

Se paro e me pregunto, será que existe alguma razão
Pra viver assim se não estamos de verdade juntos

Procuramos independência
Acreditamos na distância entre nós
Procuramos independência
Acreditamos na distância entre nós

Toda essa meia verdade, o que temos nos conformado
Só conseguimos nos afastar, nós aprendemos a aceitar
Tantas coisas pela metade, como essa imensa vontade
Que não sabemos explicar, que não sabemos assear

Se paro e me pregunto, será que existe alguma razão
Pra viver assim se não estamos de verdade juntos

Procuramos independência
Acreditamos na distância entre nós
Procuramos independência
Acreditamos na distância entre nós

Procuramos independência
Acreditamos na distância entre nós
Procuramos independência
Acreditamos na distância entre nós",Independência [Ao Vivo] [Live],2013
Capital Inicial,"Você que já esteve no céu
Foi tudo divertido pra você
Chega a hora então de provar tudo que existe
Tire agora os sapatos jogue tudo pro alto sinta o chão
Aprender a andar descalço num mundo de asfalto e sem coração
Até que o mundo gire ao seu redor

Obrigado por passar mas estou de saída
Tem alguma coisa nova pra fazer?
Vamos lá então ter um dia diferente
Eu só quero curtir ficar a toa viver numa boa
E você quer respostas exige provas músicas novas
Até que o mundo gire ao seu redor

Vão falar que você não é nada
Vão falar que você não tem casa
Vão falar que você não merece que anda bebendo e está perdido
E não importa o que você dissesse
'Cê seria desmentido
Vão falar que você usa drogas e diz coisas sem sentido
Se eu for ligar para o que é que vão falar, não faço nada

Eu procuro tentar entender
Porque eu sou tão importante pra você
Já que é bem melhor ser importante pra si mesmo
Eu não quero mudar ser mais discreto ser mais esperto
Já cansei de propostas de dar respostas e ter que dar certo
Até que o mundo gire ao meu redor

Vão falar que você não é nada
Vão falar que você não tem casa
Vão falar que você não merece que anda bebendo e está perdido
E não importa o que você dissesse
'Cê seria desmentido
Vão falar que você usa drogas e diz coisas sem sentido
Se eu for ligar para o que é que vão falar, não faço nada

Vão falar que você não é nada
Vão falar que você não tem casa
Vão falar que você não merece que anda bebendo e está perdido
E não importa o que você dissesse
'Cê seria desmentido
Vão falar que você usa drogas e diz coisas sem sentido
Se eu for ligar para o que é que vão falar, não faço nada",O Mundo,2013
Capital Inicial,"Ela dormiu no calor dos meus braços
E eu acordei sem saber se era um sonho
Há um tempo atrás pensei em te dizer
Que eu nunca cai nas suas armadilhas de amor

Naquele amor
A sua maneira
Perdendo o meu tempo a noite inteira

Não mandarei cinzas de rosas
Nem penso em contar os nossos segredos

Naquele amor
A sua maneira
Perdendo o meu tempo a noite inteira

Ela dormiu no calor dos meus braços
E eu acordei sem saber se era um sonho
À um tempo atrás pensei em te dizer
Que eu nunca cai nas suas armadilhas de amor

Naquele amor
A sua maneira
Perdendo o meu tempo a noite inteira

Naquele amor
A sua maneira
Perdendo o meu tempo a noite inteira

A noite inteira
A noite inteira
A noite inteira
A noite inteira",Sua Maneira (De Música Ligera),2013
Capital Jazz Project,"When day is gone and night comes on
Until the dawn what do I do?
I clasp your hand and wander through slumber land
Dream dancing with you

We dance between a sky serene
And fields of green sparkling with dew
It's joy sublime whenever I spend my time
Dream dancing with you

Dream dancing
Oh, what a lucky windfall
Touching you, clutching you
All the night through

So say you love me, dear
And let me make my career
Dream dancing, dream dancing with you

When day is gone and night comes on
Until the dawn what do I do?
I clasp your hand and wander through slumber land
Dream dancing with you

We dance between a sky serene
And fields of green sparkling with dew
It's joy sublime whenever I spend my time
Dream dancing with you

Dream dancing
Oh, what a lucky windfall
Holding you, clutching you
All the night through

So say you love me, dear
And let me make my career
Dream dancing, dream dancing
With you, with you, with you",Dream Dancing,2004
Capital Kings,"I've seen it before
Afraid of what's in store
But, this time I'm ready to go

Break through the laws of man
Into a foreign land
It's the only way to show

Everything we are and what we came to do
I'm feelin' ready
I, I know we're ready
Everything we are and what we're meant to choose
With the lights down low
It's time to let 'em know

I know, I know
We're gonna take it all the way
I know, I know
It doesn't matter what they say
'Cause when the sun shines down and wipes away the grey
I know, I know
We're gonna take it all the way
I know, I know
We're gonna take it all the way
I know, I know
It doesn't matter what they say
'Cause when the sun shines down and wipes away the grey
I know, I know
We're gonna take it all the way

The clock's tickin' down
The eyes are looking now
I think they're ready to know

There's something more to this
Something that can't be missed
No matter which way you go

Everything that lies behind just let it go
I'm feelin' ready
I, I know we're ready
Everything that lies ahead come take control
With the lights down low
It's time to let 'em know

I know, I know
We're gonna take it all the way
I know, I know
It doesn't matter what they say
'Cause when the sun shines down and wipes away the grey
I know, I know
We're gonna take it all the way
I know, I know
We're gonna take it all the way
I know, I know
It doesn't matter what they say
'Cause when the sun shines down and wipes away the grey
I know, I know
We're gonna take it all the way

It's like where, where do I begin
The clock is tickin' down my friend
But no worries like RG III we takin' it
(All The Way)
Yeah
Let this be the sign for you
To open up your mind
'Cause when he comes back next time
He's takin' it
(All The Way)
Takin' it
(All The Way)
Takin' it
(All The Way)

I know, I know
We're gonna take it all the way
I know, I know
It doesn't matter what they say
'Cause when the sun shines down and wipes away the grey
I know, I know
We're gonna take it all the way
I know, I know
We're gonna take it all the way
I know, I know
It doesn't matter what they say
'Cause when the sun shines down and wipes away the grey
I know, I know
We're gonna take it all the way",All the Way,2013
Capital Kings,"I've seen life through the eyes of a different soul
I left my past so my future would be under control
Now I' got nothin' standin' in my way
I gave it all away
I gave it all away
Whoa, I gave it all
You got me livin' how I've wanted all along
Now all my tears are dried away
You got me livin' how I've wanted all along

I feel so alive
Alive
Inside, inside
I'm breaking through the haze
To a brand new day
'Cause my heart has been revived

How was I supposed to survive in this vast sea
I was so scared my own heat would try to abandon me
Now I' got nothin' standin' in my way
I gave it all away
I gave it all away
You got me livin' how I've wanted all along
Now all my fears have run away
You got me livin' how I've wanted all along

I feel so alive
Alive
Inside, inside
I'm breaking through the haze
To a brand new day
'Cause my heart has been revived
I feel so alive
Alive
Inside, inside
I'm breaking through the haze
To a brand new day
'Cause my heart has revived

I feel so alive
(I feel a fire inside)
(It's like a whole new ride)
(I feel a sweet increase)
(Consuming all of me)

I feel so alive
Alive
Inside, inside
I'm breaking through the haze
To a brand new day
'Cause my heart has been revived
I feel so alive
Alive
Inside, inside
I'm breaking through the haze
To a brand new day
'Cause my heart has been revived
I feel so alive",I Feel So Alive,2013
Capital Kings,"(Ready For Home)
(Ready For Home)

Uh yeah
I wish that I could find a way
To hit fast forward just to get through this maze
And to see that day when I'm finally headed home
Forget that feeling and being lost and on the roam

Yeah, I know
I've been out of whack
But, I know
You know how to bring me back
'Cause
Even when I slip and fall
You always got my back through the thick of it all, yeah

Walkin' these circles got me comin' unglued
Gave you my heart and then I stole it from you
My weary head is swimmin' straight for your shore
I feel a calling
From the one I adore

Ready for Home
(So won't you take me there)
Ready for Home
(Out of this atmosphere)
I'm runnin' into your arms
I'm steppin' out of the cold
Ready for Home
I'm Ready for Home

I remember that very day
I said I would be different, that I'd always find a way
To let you know you'd always be the one
I kept my eyes on, but that's not what I've done

'Cause you know
I try to play my part
And you know
I always come up short
I know
I should be forever in debt
But that's something that you said you'd always choose to forget

Walkin' these circles got me comin' unglued
Gave you my heart and then I stole it from you
My weary head is swimmin' straight for your shore
I feel a calling
From the one I adore

Ready for Home
(So won't you take me there)
Ready for Home
(Out of this atmosphere)
I'm runnin' into your arms
I'm steppin' out of the cold
Ready for Home

So if you're
Leavin' with us, sing it out loud
Livin' it right, there ain't no doubt
If you're with us, sing it out loud
We're following the light, yeah
[2x]

(Ready For Home)
(Ready For Home)

(Out of this atmosphere)
I'm runnin' into your arms
I'm steppin' out of the cold
Ready for Home

(I'm Ready for Home)
So if you're
Leavin' with us, sing it out loud
Livin' it right, there ain't no doubt
If you're with us, sing it out loud
We're following the light, yeah
(Ready For Home)
(Ready For Home)",Ready for Home,2013
