"Band","Lyrics","Song","Year"
"Pinmonkey","words and music by michael reynolds well theres a black train a rolling through the hills of tennessee taking my baby so far away from me oh black train my baby s on that black train kiss me goodbye to the lonesome whistle strain then disappear down the line on that black train said she didnt know if she loved me anymore needed some time away to know for sure oh black train my baby s on that black train kiss me goodbye to the lonesome whistle strain then disappear down the line on that black train nobody knows just where my baby went three lonely years oh and i aint seen her since oh black train my baby s on that black train kiss me goodbye to the lonesome whistle strain then disappear down the line on that black train kiss me goodbye to the lonesome whistle strain then disappear down the line on that black train oh black train oh oh oh","Black Train","2002"
"Pinmonkey","she aint no stranger to the smoke and the fire she knows how to stoke a mans desire she lead you down a path of burning coals and shell wind up making ashes of your soul the devils front door the devils front door sweet temptation calling me once more i swore i wouldnt give in like before but here i am knocking on the devils front door some people say that dont believe in the devil at all but i know where she lives at man ive heard her call my name sounds like heaven on her lips but hell aint far from her forbidden kiss the devils front door the devils front door sweet temptation calling me once more i swore i wouldnt give in like before but here i am knocking on the devils front door the devils front door walking up the steps to hell once more i swore i wouldnt give in like before but here i am knocking oh here i am knocking on the devils front door on the devils front door","The Devil's Front Door","2002"
"Pinmonkey","all the leaves are turning colors youre a leaf thats turning too we go in opposite directions yeah yeah yeah yeah yeah yeah for the lack of true affection id like to let you go but my heart cant say goodbye sometimes i just dont know why we keep this love alive why do we keep this love alive when we barely even try give me one good reason why to keep this love oh we use to be together now were just so far apart was it all just a dream yeah yeah yeah yeah yeah yeah cause baby now thats how it seems the seasons of love keep changing i guess weve changed too oh yeah but i never stopped loving you to keep this love","Keep This Love","2002"
"Pinmonkey","love sometimes is like a diamond sometimes its like coal love sometimes is like smoke sometimes its like cold now i dont always know what love is but i know this love is fine this love is fine we ought to get a little a little bit closer love sometimes is like a pillow or a bed of nails love sometimes is like freedom sometimes its like jail now i dont always know what love is but i know this love is fine this love is fine we ought to get a little a little bit closer no i dont always know what love is but it tastes just like wine oh just like wine dont let our love die on the vine yeah a real man wants a woman a woman wants a real man one that understands yeah love sometimes love sometimes oh i know this love is fine this love is fine we ought to get a little a little bit closer now i donaet always know what love is love sometimes but it tastes just like wine oh just like wine dont let our love die on the vine yeah","Love Sometimes","2002"
"Pino d'Angio","lho beccata in discoteca con lo sguardo da serpente io mi sono avvicinato lei gla non capiva niente lho guardata mha guardato e mi sono scatenato fred astaire al mio confronto era statico e imbranato le ho sparato un bacio in bocca uno di quelli che schiocca sulla pista indiavolata li per li lho strapazzata iho lanciata riefferrata senza fiato lho lasciata tre le braccia me cascata era cotta innamorata per i fianchi iho bloccata e ne ho fatto marmellata oh yea si dice cosi no e poi e poi che idea ma quale idea non vedi che lei non ci sta che idea ma quale idea emaliziosa ma sapra tenere a bada un superbullo buffo came te e poi che avresti di speciale che in un altro no non seee che idea ma quale ideaz non vedi che lei non ci sta che idea ma quale idea attento lei lunga la sa lei ti fara girare in tondo senza avere mei le cose che pretendi e scusa in cambio in fondo tu che dai me venuta una pensata nella tana iho portata le ho versato unaranciata lei se fatta una risata al mio whisky s e aggrappata cinque litri se scolata mi sembrava belle andata mha baciato iho baciata ad un tratto iho agganciata dalle braccia me sgusciata mha guardato iho guardata iho bloccata accarezzata sul visino suo di fata ma sembrave una patata lho acchiappata iho frullata e ne ho fatto una frittata oh yea si dice cosi noz e poi che idea ma quale idea non vedi che lei non ci sta che idea ma quale idea non vedi che lei non ci sta","Ma Quale Idea","1994"
"Pino d'Angio","lho beccata in discoteca con lo sguardo da serpente io mi sono avvicinato lei gla non capiva niente lho guardata mha guardato e mi sono scatenato fred astaire al mio confronto era statico e imbranato le ho sparato un bacio in bocca uno di quelli che schiocca sulla pista indiavolata li per li lho strapazzata iho lanciata riefferrata senza fiato lho lasciata tre le braccia me cascata era cotta innamorata per i fianchi iho bloccata e ne ho fatto marmellata oh yea si dice cosi no e poi e poi che idea ma quale idea non vedi che lei non ci sta che idea ma quale idea emaliziosa ma sapra tenere a bada un superbullo buffo came te e poi che avresti di speciale che in un altro no non seee che idea ma quale ideaz non vedi che lei non ci sta che idea ma quale idea attento lei lunga la sa lei ti fara girare in tondo senza avere mei le cose che pretendi e scusa in cambio in fondo tu che dai me venuta una pensata nella tana iho portata le ho versato unaranciata lei se fatta una risata al mio whisky s e aggrappata cinque litri se scolata mi sembrava belle andata mha baciato iho baciata ad un tratto iho agganciata dalle braccia me sgusciata mha guardato iho guardata iho bloccata accarezzata sul visino suo di fata ma sembrave una patata lho acchiappata iho frullata e ne ho fatto una frittata oh yea si dice cosi noz e poi che idea ma quale idea non vedi che lei non ci sta che idea ma quale idea non vedi che lei non ci sta","Ma Quale Idea (Balla)","2000"
"Pino Daniele","chi tene o mare saccorge e tutto chello che succede po sta luntano e te fa sentanot comme coce chi tene o mare o ssaje porta na croce chi tene o mare cammina seea vocca salata chi tene o mare o sape ca a fesso e cuntento chi tene o mare o ssaje nun tene niente","Chi Tene 'O Mare","1979"
"Pino Daniele","donna cuncetta parlate donna cuncetta dicite o tiempo de cerase a gia fernuto dinta stu tuppo niro ci stanno tutte paure e nu popolo ca cammina sotta o muro donna cuncetta cacciate tutte ricordi a mpietto donna cuncetta alluccate pe dispietto e si vulesse dio see you chesta fantasia jettasse tutte cose a mare mo ca so vecchia e dormo nun pozzo cchia1 fa  niente so na pazza mmano a gente e tengo mente ma sje fosse guaglione je fosse capurione e quando votto viento dica mia e sulamente si vulesse dio","Donna Cuncetta","1979"
"Pino Daniele","e cerca e me capanot a tanto tempo che non ti vedevo eppure so cuntento o ssaje mhanno fottuto e viaggi e lautostrada tutto chello seeaggio passato e mo nun credo cchia1 nun credo cchia1 e torno a casa stanco muorto e nun voglio fa  niente sto see you lluocchie apierte e sento e suna  e pruove a veda  see you dinta lluocchie o sole e seeo cazone rutto a parla  e rivoluzione e cride ancora cride ancora e pruove a veda  chi tha attaccato e mmane e nun te pua2 gira  peccha te fanno male e cride ancora cride ancora e cerca e me capanot vorrei strappare mille occasioni e poi fuggir lontano me so scucciato e parla  e dire ogni volta quel che ho dentro e poi star male e poi suonare ma torno a casa stanco muorto e nun voglio fa  niente sto see you lluocchie apierte e sento e canta  e pruove a veda  see you dinta lluocchie o sole e seeo cazone rutto a parla e rivoluzione e cride ancora cride ancora e pruove a veda  chi tha attaccato e mmane e nun te pua2 gira  peccha te fanno male e sona ancora sona ancora","E Cerca 'E Me Capi","1979"
"Pino Daniele","io lo conosco e un uomo stanco seeha acchiappato sempe cauce pe dinto e cianche da bambino giocava sopra i marciapiedi e la gente gli diceva adesso ha la tessera del partito compra il giornale tutti i giorni ma e un uomo finito la mattina va a strillare al collocamento tanto  o sape ca e vennuto pe poco e niente e il mare il mare il mare sta sempe lla tutto spuorco chino e munnezza e nisciuno o vo guarda come bello lavorare sulla tangenziale con le mani rosse che ti fanno male e i ricordi che camminano a duciento allora e ti entrano dentro senza far rumore lasciatelo parlare ha tante cose da dire ha capito che la lotta non deve finire sta alzando le mani verso il sole in cerca di calore e il mare il mare il mare sta sempe lla","Il Mare","1979"
"Pino Daniele","duorme nennella mia fino a che veno juorno duorme nennella mia che a ancora notte e strigneme e dete sempe cchia1 forte si veneo mammone chiudimmo a porta duorme nennella mia fora sta o malotiempo duorme nennella mia meglio ca nun siente ninnna ninnanoa ninnana ninnanoa","Ninnananinnanoe","1979"
"Pino Daniele","e dimme quacchecosa nun me lassa  accussanot stasera sto sballato che voglia e partanot see you ddoje parole mmocca e tanta semplicita putesse essere allero e dimme quacchecosa nun me lassa  accussanot o viento sta passando e je o voglio sentanot affondo e mani dinta terra e cerco e nun guarda  e nun me pare overo putesse essere allero e malluccano dinte recchie e je me sento viecchio putesse essere allero see you mia figlia mbraccia ca me tocca a faccia e nun me fa guarda e dimme quacchecosa nun me lassa  accussanot me sento nu criaturo ca nun po fa  pipanot vulesse arrubba  senza me fa  veda  tutte facce da ggente e dimme quacchecosa nun me lassa  accussanot o viento a gia passato nun pozzo cchia1 sentanot e mha rimasto ncuollo laddore do magna  e nu poco e mare putesse essere allero see you nu spinello mmocca see you  e mmane dinta sacca putesse essere allero see you na parola sola ca me desse calore senza me fa  sunna","Putesse Essere Allero","1979"
"Pino Daniele","ue man where are you going you need a girl tonight come on with me man you will enjoy your time nu poche e dollars to me e me ne faje ie ue man i woudnt cheat you nun te preoccupa come on with me man ca tutte quante hamma campa nu poche e dollars to me e me ne faje ie ue man you really enjoi the girl was good tonight listen to me man give man money for my wine a few cigarettes to me e me ne faje ie ue man if you really enjoi dont worry how much you spend listen to me man i hope you understand nu poche e dollars to me e cerca e me capi","Ue Man","1979"
"Pino Daniele","viento scioscia stanotte trase pe sotta e fatte sentanot viento viento viento nce resta pence ncazza  viento trase dinte piazze rumpe fenestre e nun te ferma  viento viento puorteme e voci  chi vo allucca","Viento","1979"
"Pino Daniele","passa o tiempo e che fa tutto cresce e se ne va passa o tiempo e nun vuo bene cchiu voglio o sole pe masciutt voglio nora pe marricurd alleria pe nu mumento te vuo scurd che hai bisogno dalleria quante sufferto o ssape sulo dio e saglie a voglia dallucc ca nun cazzicche niente tu vulive sulamente da e lalleria se ne va passa o tiempo e che fa se la mia voce cambiera passa o tiempo e nun te cride cchiu no no no e ti resta solo quello che non vuoi e non ti aspetti niente perch lo sai che passa o tiempo ma tu non cresci mai e scaglie ca nun cazzecchi niente tu vulive sulamente da e lalleria se ne va","Alleria","1980"
"Pino Daniele","appocundria me scoppia ogne minuto mpietto pecce passanno forte haje sconcecato o lietto appocundria e chi e sazio e dice ca e diuno appocundria e nisciuno appocundria e nisciuno","Appocundria","1980"
"Pino Daniele","e so cuntento e sta cu te pecche pecche me faje guarda senza vede e mi sopporti pe chello che so forse un po di piu i cu te ce sto buono e tu ma poi del resto taspetterei nun me mporta e chello ca me puo da lassa che vene dimane e tu taccuorge ca nun tappienne cchiu voglio guarda voglio tucca ma io sul io sul io sul nun pozz sta e so cuntento e sta cu te pecche pecche me faje mpara a nun vede e resto in piedi a parlare un po di quello che non va nononono i cu te ce sto buono cca ma poi del resto taspetterei nun me mporta e chello ca me puo da lassa che vene dimane e tu taccuorge ca nun tappienne cchiu voglio guarda voglio tucca ma io sul io sul io sul nun pozz sta ma io sul io sul io sul nun pozz sta","E So' Cuntento 'E Stà'","1980"
"Pino Daniele","i say isto cca membriaco e c aggia fa me giraa capa ma voglio parla i say i sto cca a tristezza se ne va o vino scenne ma poi finira mi muovero toccando quello che non ho sorridero piangendo forse un po ma faccio da me i membriaco pe nun ve vede ma so che sbagliero me sentoa guerra il resto non lo so i say i sto cca ea paura se ne va e si m addormo nterra nun me sceta i say i sto cca ogni tanto s adda fa pe tutto sto burdello ca ce sta mi muovero toccando quello che non ho sorridero piangendo forse un po ma faccio da me i membriaco pe nun ve vede ma so che sbagliero me sentoa guerra il resto non lo so mi muovero toccando quello che non ho sorridero piangendo forse un po ma faccio da me i membriaco pe nun ve vede ma so che sbagliero me sentoa guerra il resto non lo so","I Say I' Sto Ccà","1980"
"Pino Daniele","e fermati un momento e dimmi dove sei io vado controvento e so che non ti aiuterei e prendi un po di pane pero tu mi hai fatto male e prendi anche la frutta e nun fa niente ca si brutto ma con musica musica indietro ti saro con la musica musica posso dirti anche no per la musica musica quanto ho pianto non lo so ma la musica musica e tutto quel che ho e adesso vuoi una sedia ma una sedia elettorale e con i piedi gonfi come hai voglia di votare e poi mi levi luce perche sai che son capace e poi mi levi vino pecche si nu figlio e bucchino ma con musica musica sempre dietro ti saro con la musica musica posso dirti anche no per la musica musica quanto ho pianto non lo so ma la musica musica e tutto quel che ho ma con musica musica indietro ti saro con la musica musica posso dirti anche no per la musica musica quanto ho pianto non lo so ma la musica musica e tutto quel che ho","Musica Musica","1980"
"Pino Daniele","nun me scoccia nun me scoccia cerca di stare almeno unora senza parla nun me scoccia cchiu tanto muore pure tu nun me scoccia nun me scoccia coi tuoi discorsi intellettuali senza onesta nun me scoccia cchiu tanto muore pure tu a che serve sta accussi sempre ncazzati ma po pe chi oggi fa friddo e nun voglio asci a che serve sta accussi sempe ncazzati ma po pe chi fora fa friddo nun me scoccia nun me scoccia statte quieto ca po vene a sete a furia e parla nun me scoccia cchiu tanto muore pure tu tanto muore pure tu","Nun Me Scoccia'","1980"
"Pino Daniele","puozze passa nu guaio po mmale ca me faje pecche me faje fesso e nun pozzo campa puozze passa nu gaio perche mi hai distrutto oggi compro quasi tutto ma nunno voglio fa puozze passa nu guaio lla addo nun coce o sole puozze passa nu guaio perche sei senza cuore di notte fai rumore e nun pozzo durmi puozze passa nu guaio perche mi spogli nudo mi vesti di velluto ma poi me faje spuglia puozze passa nu guaio lla addo nun coce o sole puozze passa nu guaio niro addo nun coce o sole","Puozze Passa Nu Guaio","1980"
"Pino Daniele","quellautostrada e un muro pieno di felicita ed io rimango sveglio cercando qualcuno che vuole fumare a meta e correndo te ne vai chiudi gli occhi e non ci sei e hai voglia di un caffe che ti tiri un po piu su ma che vuo cchiu che vuo cchiu ma che vuoi se tutto non e come sei ma che vuo cchiu ma che vuoi se non respiro mai e non so che giorno e mi sconvolgo sempre un po per gridare qualche nome che ho inventato e non lo so ma che vuo cchiu il feeling e sicuro quello non se ne va lo butti fuori ogni momento e tutta la tua vita e sai di essere un nero a meta mentre il buio se ne va ti ritrovi a testa in giu perche hai dato sempre tanto e adesso nun o tiene cchiu ma che vuo cchiu ma che vuoi se tutto non e come sei ma che vuo cchiu ma che vuoi se non respiro mai e non so che giorno e mi sconvolgo sempre un po per gridare qualche nome che ho inventato e non lo so ma che vuo che vuo cchiu ma che vuo che vuo cchi","A Testa in Glu","1980"
"Pino Daniele","ma che ho dimmi che ho una faccia da indiano e il passato un po piu strano di chi disse tornero maspiette o no che ne saje e chello camma fa pe nun ve senti che ne saje e chello camma fa pe nun ridere cchiu ma che ho dimmi che ho unestate un po piu dura qualche figlio e la paura di chi non resiste piu da orte in giu che ne saje e chello camma fa pe nun ve senti che ne saje e chello camma fa pe nun ridere cchiu ma che guarde a fa levete a miezzo si nun me vuo purta ma che guarde a fa i maccuntento cu poco e niente ma che ho dimmi che ho parlo quasi sempre male di chi non sa quanto vale ma vedrai che smettero nce cride o no segnala testo errato altri testi di pino daniele","Ma Che Ho","1981"
"Pino Daniele","notte che se ne va dinto o rummore e chi fatica a sera notte astretta pe chi vvo durmi chiude luocchie e nun riesce a capi notte e chi fuma sempe pecche o tiempo adda passa notte e chi sarrecrea bussanno e porte dice nun so nisciuno notte e chi fa e cartune de chi a dinto e cchiu crudo notte nun da turmiento a chi se vo mbriaca notte che vene notte che va esce stu juorno a chi amma aspetta notte e chi sta pensanno a dio e chi se venne a vita mia notte e chi o sape gia e chi invece nun ha saputo niente notte e chi saccuntenta ma nun se fa purta notte e chi venne sempe chello ca nun po tucca notte che vene notte che va esce stu juorno a chi amma aspetta notte e chi sta pensanno a dio e chi se venne a vita mia notte che vene notte che va esce stu juorno a chi amma aspetta notte e chi sta pensanno a dio e chi se venne a vita mia segnala testo errato altri testi di pino daniele","Notte Che Se Ne Va","1981"
"Pino Daniele","yes i know my way ma nun e addo maie purtato tu ah yes i know my way mo nun me futte cchiu mo nun me futte cchiu tu vaje deritto e i resto a pere va tu va tantio sbareo ah ah yes i know my way e guaie mie e saccio i ma chi me crede oh yes i know my way ma tu nun puo veni ma tu nun puo veni i marreseco sulo si vale a pena e tenta ah ma po chi mmo ffa fa siente fa accussi nun da retta a nisciuno fatte e fatte tuoie ma si haje suffri caccia a currea siente fa accussi miette e creature o sole pecche hanna sape addo fa friddo e addo fa cchiu calore yes i know my way ma nun e addo maie purtato tu ah yes i know my way mo nun me futte cchiu mo nun me futte cchiu tu vaje deritto e i resto a pere va tu va tantio sbareo siente fa accussi nun da retta a nisciuno fatte e fatte tuoie ma si haje suffri caccia a currea siente fa accussi miette e creature o sole pecche hanna sape addo fa friddo e addo fa cchiu calore yes i know my way yes i know my way my way mo nun me futte cchiu mo nun me futte cchiu oh yes i know my way yes i know my way my way my way","Yes I Know My Way","1981"
"Pino Daniele","o gia2 che voglia e te veda me manca assaje na compagnia mo nun sa2 buono cchia1 a parla e nun conchiure ma i got the blues i got the blues on me o gia2 i forze nun torno cchia1 e cammenate senza dio purtavo o tiempo e ce parlavo acoppa e sotto sotto stevemo bbuono accussanot i got the blues on me i got the blues accussanot","I Got the Blues","1982"
"Pino Daniele","i nun vogl ji america pecche nun ponno capi stamerica e si fosse pe me caccia a capa e nun vede e si fosse pe me mastrignesse pe sape e nun mme puo da tutta nata storia fatta pe suda se venneva lanema a duje passe pe fa sunna tutta nata storia che torna aveni lascia apierto e parlame e quaccosa i nun voglio asci i nun vogl ji america pecche nun vonno capi stamerica e si fosse pe me jesse annanze pe vede e si fosse pe me mastrignesse pe sape e nun mme puo da tutta nata storia fatta pe suffri senza niente ncuollo dint a nuttata mme puo capi e nun mme puo da tutta nata storia ca se po cagna si te ncazze e tragica e nisciuno ce vo penza e pe me resta cielo e notte cu nu filo mmano saspettava o sole e pe me resta solo addore terra cammesca a vita e se ne va i nun voglji america i nun voglji america i nun voglji america i nun voglji america i nun voglji america i nun voglji america i nun voglji america i nun voglji america","Tutta 'Nata Storia","1984"
"Pino Daniele","sara non piangere tienimi chiuso dentro questa stanza rompi i tuoi giochi contro larroganza del mondo che e pieno di cose inutili da fare cose inutili da dire quante cose inutili abbiamo nella testa ma il tuo sorriso resta in the middle of the night 3x sara devi crescere imparerai a guardare il cielo ad inseguire un sogno vero nelle cose della vita cose inutili da fare cose inutili da dire quante cose inutili abbiamo nella testa ma il tuo sorriso resta in the middle of the night ma il tuo sorriso resta in the middle of the night sei cosi fragile sei cosi fragile sara sara sara sara cose inutili da fare cose inutili da dire quante cose inutili abbiamo nella testa ma il tuo sorriso resta in the middle of the night ma il tuo sorriso resta in the middle of the night ma il tuo sorriso resta in the middle of the night sara sara sara sara cose inutili da fare yeah yeah cose inutili da dire quante cose inutili abbiamo nella testa ma il tuo sorriso resta in the middle of the night ma il tuo sorriso resta in the middle of the night ma il tuo sorriso resta in the middle of the night","Sara","1985"
"Pino Daniele","e nuje parlammo ancora guardando fuori senza dire una parola noi che inventiamo ancora chesta felicita ammore mio nce amma perza per ritrovarci poi lontani dai giorni uguali aria oh aria ca ricorda dio e tu ce cride oppure no ce cride oppure no e nuje cantammo ancora aret e llaste ad aspettare unemozione nuje ca chiagnimmo ancora pe chesta libberta ammore mio io o voglio fa troppo difficile cambiare essere normale aria oh aria ca ricorda dio ma tu ce cride oppure no ce cride oppure no aria oh aria ca ricorda dio ma mo nun saccio chi song io aria ca ricorda dio ma tu ce cride oppure no ce cride oppure no","Aria","1987"
"Pino Daniele","ehi boys in the night vorrei fermare il mondo ehi boys in the night perche non ho mai sonno ehi boys in the night andiamo via insieme ehi boys in the night cercando un po di bene ehi boys in the night fai finta di dimenticare cca niente e all right ma a noi ci batte forte ancora il cuore ehi boys in the night non mi toccare ho freddo ehi boys in the night fai finta di dimenticare cca niente e all right ma a noi ci batte forte ancora il cuore terra non pensare grida quello che vuoi tu anche se ti fanno male noi rinasceremo giu e se il vento sara freddo unaltra estate arrivera cerchero di andare a tempo raccontando all ny pain ehi boys in the night gli sguardi un po piu strani ehi boys in the night guidiamo senza mani ehi boys in the night vorrei fermare il mondo ehi boys in the night perche non ho mai sonno ehi boys in the night fai finta di dimenticare cca niente e all right ma a noi ci batte forte ancora il cuore terra non pensare","Boys In the Night","1987"
"Pino Daniele","guaglio guaglio che guard a fa damme na mano si no si no sto ancora cca fin a dimane guaglio guaglio e quanto tiempo puo dura ogge e dimane ma cosa ce su quelle braccia nun vede quanti anni nascondi o pporte ancora tutto in faccia sienta me non sono forse migliore guarda mo guaglio guaglio che guard a fa damme na mano si no si no sto ancora cca fin a dimane guaglio guaglio nc ammm a calma e ttiene e money e quanta sorde puo abbusca dint a semmana ma cosa ce su quelle braccia nun vede quanti anni nascondi o pporte ancora tutto in faccia sienta me non sono forse migliore guarda mo guaglio guaglio che guard a fa damme na mano si no si no sto ancora cca fin a dimane guaglio guaglio nc ammm a calma e quanta sorde puo abbusca dint a semmana ma cosa ce su quelle braccia nun vede quanti anni nascondi o pporte ancora tutto in faccia sienta me non sono forse migliore sona mo","Scrack","1987"
"Pino Daniele","pecche cadda piglia sta gelusia ma quanno chiuro luocchio se ne va non nun dicere che e semp colpa mia nun faccio maje e ccose tanto p e ffa pecche cadda piglia sta gelusia jurnate sane senza ce parla i che so pazzo e po o saccio purio a vita e nu muorzo nun me fa ntusseca ammore scumbinato troppo arrepezzato ammore ca nunnha sunnato cchiu i sto ancora cca stong ancora cca tanto e cose niente pe tramente va pecche cadda piglia sta gelusia ce basta sulo o munno a ce ncazza stasera ascimmo nzieme ammore mio pure si nunne vero mo fatte purta ammore scumbinato troppo arrepezzato ammore ca nunnha sunnato cchiu i sto ancora cca stong ancora cca tanto e cose niente pe tramente va ammore scumbinato ammore ca nunnha sunnato cchiu i sto ancora cca stong ancora cca tanto e cose niente pe tramente va ammore scumbinato troppo arrepezzato ammore ca nunnha sunnato cchiu oh i sto ancora cca tanto e cose niente pe tramente va pe tramente va","Ammore Scumbinato","1989"
