"Band","Lyrics","Song","Year"
"Amel Bent","je vois bien quon sabime les marques avec le temps trahissent la chute comme dans les films pourtant nous sommes tout nous sommes rien rien rien rien on saime en equilibre en attendant que sonne la cloche sur le ring mais face a la fin y a lesquive le voile du panneau corps partira a la devire si on fait rien rien rien et toi tu me dis que plus rien na de sens pourtant tu mattends attends attends tu veux quon se donne encore une enieme chance et moi je lattends attends attends et pour le meilleur ou le pire laisse moi te dire meme si demain tout fini je sais que lun sans lautre nous ne sommes rien rien rien rien rien nous sommes beaucoup nous sommes rien rien rien rien rien mon amour nous ne sommes rien on seffleure on sevite tu ne moffres plus de roses et reves dune autre dans ton lit pourtant lun sans lautre nous ne sommes rien rien rien rien cest comme la peur du vide aucun de nous deux ne lache par instinct de survie mais face a la fin y a la fuite je vois deja ce mind aux vices insipides si on fait rien rien rien et toi tu me dis que plus rien na de sens pourtant tu mattends attends attends tu veux quon se donne encore une enieme chance et moi je lattends attends attends et pour le meilleur ou le pire laisse moi te dire meme si demain tu moublies je sais que lun sans lautre nous ne sommes rien rien rien rien rien nous sommes beaucoup nous sommes rien rien rien rien rien mon amour nous ne sommes rien je fais finir par tout foutre en lair oh non je taime tu me dis que cest secondaire yeah oh non yeah et tu attends des actes tas mille et une rancoeurs je me prepare a limpact on se kiffe a cent a lheure je pense que tu ne maimerais pas si jetais pas si dur sans toi je peux pas mais meme quand tu pleures je garde mon armure battons nous pour notre mariage dansons sous ce gros orage on est pas comme eux ma vie tes mienne jusquau grand voyage tout refaire jy arriverai pas jai beau avoir une fierte malsaine je sais que lun sans lautre nous ne sommes rien rien rien lun sans lautre nous ne sommes rien rien rien rien rien mon amour nous ne sommes rien on saime on se detruit on casse on reconstruit mais bref ca ne bouge pas lun sans lautre nous ne sommes rien ton sourire na pas de prix je ferais la guerre a celui qui te lenlevera mon amour nous ne sommes rien","Rien","2018"
"Amel Larrieux","oh ooh ooh yeah ive been doing my own thing love has always had a way of having bad timing but to my great surprise ever since i looked in your eyes i had one question for you tell me if you want me to give you all my time i want to make it good for you cause you blow my mind i promise boy that ill be true youre the perfect find so tell me if you want me to yeah if you thought id sleep on this boy youre wrong cause all i dream about is our first kiss and youre the first one to make me feel like this and this is one opportunity that i cant resist no no boy you want to know the deal you are wondering if the words im saying are for real cause you got more appeal than any man in this whole world and baby i got to know how you feel sweetheart now its time i let you know i dont want to rush we should take it slow boy i can love you can you help me grow give me a new beginning","Tell Me [Cleve's 122 House Edit][Mix]","1996"
"Amel Larrieux","oooooo la di dumb dum da da dumb dum da da dumb dumb dumb la di dumb da da dumb da da dumb dumb six a m getting out of bed again cant get back in cause sleep aint gonna pay the rent ohh day to day they got you working like a slave taking credit for the work you gave and stealing your raise but i chorus i know youre down but when you gon get up i see youre down but when you gon get up repeat people try to pull the wool over your eyes dont know why they want to profit from your demise oooo they lie to cover up how weak they are inside oh baby baby dont you cry all you gots your pride so i i i i chorus i see youre down mos def hey now im going for mine said even though they trying to hold me down you know im a shine put your hurdles up but still im hopping over the nine i stay ahead of the race because im setting the pace hop on my feet i caught a like im a federal case cause theres incredible stakes brooklyn incredible place for all the seminal waste who make their memorable case who got the measure and grace amongst the pressure and snakes sometimes im still to stay competitive do whatever it takes to all my folk who understand that nyc is the way for overseas or anywhere inside the 50 you stay so if you really know the really really really real ly wave your hands in the space its time to build and create me and my squad is on the job so that the childrens is straight to understand the higher plan and to expand my estates i cant give hardly give up my motivation a must amel larrieux and m o sll make the people get up amel i want you to get get up i want you to get get up i want you to get get up not down not with a frown amel scatting amel after all the work you gave stealing your raise stealing your raise steal ing your raise","Get Up [Album Version]","1999"
"Amel Larrieux","down where im going is down cause you dance me around make me too dizzy to see down boy did you make me down theres a permanent frown where my smile used to be pride has kept me from crawling but sorrow is constantly calling cause you are the man whos not falling for me down im the fool of the town someone send in the clowns that songs about me carelessly i let you saunter in all of the chambers of my heart disguised as a gentleman heartlessly and much to my chagrin you quickened your step as you left and thats where my soliloquy begins down isnt it profound youre the wolf on the bound im a helpless sheep carelessly i let you saunter in and out of the chambers of my heart disguised as a gentleman heartlessly and much to my chagrin you quickened your step as you left and thats where my soliloquy begins down my heart makes not a sound its somewhere on the ground breaking","Down","2000"
"Amel Larrieux","never thought i would find the words that could stand up through any weather something i could say you could hear today but stay with you forever just when i was losing my faith and i was losing my way it came to me as clear as day even if i wake up and find im alone cause the whole worlds turned to stone and my god says its time i take you home ill be happy going knowing that i loved you innocent and mild must be heavens child sent to make me believe make me believe on my darkest night all you have to do is smile and you breathe new life into me just when i was losing my faith and losing my way you came to me as clear as day therell be a time when im gonna have to leave this sweet place behind but baby before i go i gotta make sure you know bout the joy that you bring to my life ill be happy going knowing that i loved you","Even If","2000"
"Amel Larrieux","a little girl i was looking at a magazine wonderin why i could never find to many girls that look like me all i saw was hair so blonde and eyes so very blue and the words under the picture said and you can get this look to they cannot define beautiful to me someone elses eyes dont see what i see followin like im blind just wont do for me god made me just fine thats why i got to be ini ini some people talkin bout when judgment day will come looking down upon those not down with their religion you must believe in all they say and all they do and if you dont then heavens gates are closed to you i do not subscribe to their philosophy i dont think my god wants them judgin me followin like im blind just wont do for me god knows whats in my heart thats why i got to be chorus ini ini","I N I","2000"
"Amel Larrieux","21 oh life has just begun got a temper like a gun pointing it at everyone thats his game and it helps him to get through the day but a voice inside him says how much longer can i play hes got infinite possibilities i can see them now its the unbroken chains of his past by which hes bound hes got infinite possibilities i can feel them now if he chooses well then nothing can tear him down peace of mind is not easy for him to find and hes walkin a thinner line in a place where another man is keeping his time though hes young hes not like everyone he sees what hes become and hed rather be standing in the sun with infinite possibilities infinite possibilities stand in the sun and see","Infinite Possibilities","2000"
"Amel Larrieux","darlin i want you to listen i stayed up all night so i can get this thing right and i dont think theres anything missin cause a person like you made it easy to do ive waitin for so long to sing to you this song cause your eyes are the windows to heaven your smile could heal a million souls your love completes my existence your the other half that makes me whole your the only other half that makes me whole i think the angels are your brothers ya ya they told you about me said your just what she needs and i find myself thanking your mother for giving birth to a saint my spirit flies when i say your name if theres one thats true its that i was born to love you and your eyes are the windows to heaven your smile could heal a million souls your love completes my existence your the other half that makes me whole your the only other half that makes me whole you make my dreams come true over and over again and i honestly truly believe you and me are written in the stars and in my whole life through just given thanks to you cause your eyes are the windows to heaven your smile could heal a million souls your love completes my existence your the other half that makes me whole your the only other half that makes me whole","Make Me Whole","2000"
"Amel Larrieux","once i was happy once i was alive the spirit of my guilty in the mimic of the sky watching lives be taken must be something in\ cause every day is another for my spirit to survive see i was lost oh wheres the key cause this souls simply cramped outside of me somebody tell me where to go searchin for my soul thought it was stayin but now i know searchin for my soul it left an empty space you know searchin for my soul if you should see it send it home i tried to be strong but my strength is getting weak happiness is clearing i hope i have the vision to see im so heavy hearted ive got clearly blues lately i cant even bring myself to watch the news oh i feel the weight of all the world is resting on the shoulders of this girl every time one of us goes down like im looking at my own blood on the ground seems like everybodys lost their minds and i just might be the next one in line searchin for my soul searchin for searchin for searchin for my soul","Searchin' for My Soul","2000"
"Amel Larrieux","i made some decisions detrimental to my life put my trust in some translucent people now i see through them just fine ive come back to the real world and put my bitterness behind cause revenge is not as sweet as my freedom and no ones taking mine promises broken with endless waiting been so many mountains ive had to climb i got this feeling something is waiting destinys changing im about to shine experience has taught me what i need to take me far see i can mingle with my enemies cause now i know who they are im stronger then ive ever been got to be to survive theres a test around the corner trying to bring me down but ill never make the same mistake twice promises broken with endless waiting been so many mountains ive had to climb i got this feeling something is waiting destinys changing im about to shine oh shine oh shine oh shine oh shine promises broken with endless waiting been so many mountains ive had to climb i got this feeling something is waiting destinys changing im about to shine","Shine","2000"
"Amel Larrieux","whenever you awake and find your kingdom life is great can i suggest a simple remedy to make your day open up your windows and then open wide your eyes let the vision peace of cool and golden yellow sunrise you might be aching cause the one you love is far away think it is impossible to make it through another day you can feel better take it from me just look at the colors of the fine autumn leaves let them put you at ease as long as we have the weather the dark skies will find us and the clear day to remind us as long as we have the weather the sunlight will guide us and the rain most surely find us the creators changing seasons like in vain the beauty of the weathers here will sum distraction from our pain let the warm summers mist you let a winter snow fall and tramp you you dont have to pay nothing today let the winter winds blow your pain away let the blue skies be your secret get away i got the anecdote to keep you cool you should listen up because nature has no rules","Weather","2000"
"Amel Larrieux","dedicated to my son thats about to be born so by the time you people hear this record my sonll be born and i gotta teach him about life listen to my little man you can never have too little plans always bring your game direct cut out the middle man life is full of sacrifice for truth you might have to fight someone will bring you down cause they aint livin right be sure to use your mind though look for all the signs yo dont want to make a move too quick and get left behind yo be in command of whatever you encounter appreciate your blessings son youll see what it amounts to obtaining your goals maintainin control self respect helps you to protect your soul never give up always be ready to try walk your own walk and keep your head to the sky little thing now here you are staring at me with those baby eyes all you do is sleep eat and cry but one day youre gonna be askin me why everything i know im gonna tell you about anything i dont youll figure out cause living is learnin and learnin is livin and then you pass it on and to my home boys who clearly understand what it really takes to be a man and what it means to be the head of fam the ups and downs of life plus the choices we make causes to reevaluate directions we take and being up in the club is mad fun til they act dumb and everyone still packs guns whether nines or mac one ones its time now for us to separate the mediocre from the great keep all the jokers from the game ive played my position so why dont you try to play yours ive made my decision plus youre in my prayers my life is changed now plus i got a shorty now mad responsibilities its like im almost forty now all the young girls want to swing my wifey says she wants a ring i wonder what the next days are gonna bring we must live and fight for the right causes and be ready to die i love you kid so keep your head to the sky baby child did you know every since you fell out of the heavens you make me want to grow so ill share with you everything make little girls and boys grow up to be kings and queens","Guidance","2000"
"Amel Larrieux","sophisticated lady tryin to change my ways just because youre caught in your social maze i think its bout time that you realize your money and your powers got you mesmerized pretty lady get back pretty lady yea sophisticated lady put your blue jeans on youre anybodys baby when your mamas gone educated lady with your college degree amazes me why you just cant see learned everything from your books on the shelf but no one ever taught you how to think for yourself pretty lady get back pretty lady yea sweet thing sophisticated lady put your blue jeans on youre anybodys baby when your mamas gone sophisticated lady take a lesson from me i can help you be what you want to be together well see many brighter days if it takes forever gonna change your ways pretty lady get back pretty lady yea sweet thing sophisticated lady put your blue jeans on youre anybodys baby when your mamas gone sophisticated lady put your blue jeans on youre anybodys baby when your mamas gone sophisticated lady put your blue jeans on youre anybodys baby when your mamas gone","Sophisticated Lady","2000"
"Amel Larrieux","i wish i didnt feel it i know it just aint right but it seems to pop up in my head morning noon and night i just cant release it the memory of you mama never told me love would leave me so damn blue and i got misery cause i know loving yous a sin you got me on my knees praying that i dont give in baby you and me never ever could have been so i got misery cause ill love you til the end you said the you loved me that im the only one but what you call monogamy is lying ot everyone well i gave you your freedom but thats not the end of that cause you reach in and stole my heart and now i want it back im so blue cant let go of you im so blue cant stop loving you im so blue cant let go of you im so blue cant stop loving you you give me sweet misery","Sweet Misery [Album Version]","2000"
"Amel Larrieux","you live you die and spend the years in between asking the question why youve been through what you been you lose you win you even pay for other sins but you most always adore the skin you are in i woke up and it was pouring down rain i put my head on it really wasnt no thing one of them days i was feeling immune to the pain threw on alice coltrane smoked and sang and wrote this flame compused to the rhythm of the droplets and went whispering simliar to gossip the kick slapping at the window glass slow down the globe so it dont spin too fast because i been running like a river since the age of my early innocence it just made me ambitious my grams used to tell me man listen if you cant burn dont step into the kitchen you muscle your turn the laws of the land viscious we gotta stick to the plan which is pursuing true riches whether we trade stock or wash dishes throughout setbacks and few glitches the big pictures the focus fuckin being hopeless or helpless we not selfish so we wrote this give it to ya make you feel good know what im talkin about cmon yo from the parquet floors to the fifty foot ceiling i pull the heavy black curtain back now revealing the sun beneath the velvet and like it was mine no one elses embracing the beams yo i felt it and stood there feeling it getting charged turn me loose upon the streets a young poet at large out in the world up against tremendous odds somell let it break em and throw in they cards but my squad remain focus when we goin for ours and we dont do it for chains or do it for cars and we dont do it for lames or do it for broads and we dont do it for fame we do it because its for the young black gifted mind living the story of the most twisted kind turbulent times swirled around they dome like a turban it gets disturbing feelin alone in the urban but maintain ya grip for just a little bit id tell you its all good but thats bullshit lets just try to feel good yeah know what im talkin bout a spirit knows were meant to blow a rose by the seat of your soul you past it all and seeds your soul are destined to grow even after you go","Glitches","2001"
"Amel Larrieux","ever since ive met you girl youve had this crazy way of making me feel dont get me wrong im not here trying to fall in love but something s changing me you laughin acting crazy girl you always put a smile on my face you know just how to chill this thug mentality i put on for others to see something strange is happening to me i dont know what it is but it s feeling so good to me im used to being so cool laid back and in control but whats come over me i dont mean to make it seem like im taking this to seriously but i just want to let you know whats on my mind cant you see what we could be we could be so in love got me buggin oh im sacrificing myself im here singing this to you see i just couldnt face myself knowing that i didnt just tell you the truth something strange is happening to me i dont know what it is but it s feeling so good to me im used to being so cool laid back and in control but whats come over me something strange is happening to me i dont know what it is but it s feeling so good to me im used to being so cool laid back and in control but whats come over me if by chance you should find yourself falling deep in love you know you can count on me just like a thief in the night you come and take away the only way i know how to be you stole my heart from me something strange is happening to me i dont know what it is but it s feeling so good to me im used to being so cool laid back and in control but whats come over me something strange is happening to me i dont know what it is but it s feeling so good to me im used to being so cool laid back and in control but whats come over me yeah yeah yeeah up and down your love but whats come over me i dont know","What's Come Over Me?","2002"
"Amel Larrieux","in a land far away where the sun doesnt spare a soul and a twisted tradition has a girl in a strangle hold lies a desert with the footprints of little girls with a secret of a pain that you and i could never know little feet running fast as they can like a bird in flight through days of sand with a fire in the sky and through indigo nights she runs away from a life spent being witness to other unwilling participants of a pain that you and i will never know youre a bravebird of the rarest kind you may be one of the walking wounded but still you fly your a bravebird you put yourself on the line when you shared your secret with the world you saved another mothers child as she speaks you can tell that the words are not easy to say the hold the power to transport her back to that impossible day but she hasnt any regrets cause she wont become a woman with a secret of a pain that you and i could never know you and i could never know you and i could never know youre a bravebird a bravebird fly high in the sky there you are","Bravebird","2004"
"Amel Larrieux","congo get to get to congo get to get to congo get to get to congo get to get to congo now could we go to the square they call congo i need to go and lay my feet upon the stone where the first of us stood before before before where we sat and played to revive our depleted souls where we went to forget our freedom was not our own where we went to hold onto the memories of way back home now could we now could we now could we go get to cong get to cong congo get to cong get to congo get to cong get to cong congo get to cong get to congo now could we go to the square they call congo i need to go and lay my feet upon the stones where the first of us stood before before before where we made music in remembrance of human bodies sold where the sound of an old pain became a new music of hope where they paved me a road so i could get to congo now could we now could we now could we go get to cong get to cong congo get to cong get to congo get to cong get to cong congo get to cong get to congo get to cong get to cong congo get to cong get to congo get to cong get to cong congo get to cong get to congo and i would not be here today if they had not been so displaced so displaced but still but still they made time to sing and play a song a song in congo get to cong get to cong congo get to cong get to congo get to cong get to cong congo get to cong get to congo get to cong get to cong congo get to cong get to congo get to cong get to cong congo get to cong get to congo get to cong get to cong congo get to cong get to congo get to cong get to cong congo get to cong get to congo","Congo","2004"
"Amel Larrieux","is there nothing sacred anymore when celebrities are deified and were still calling some countries third world and crimes against little ones are punished with little laws and girls are taught to hide their curves as though theyre flaws and other girls are taught to expose them but not own them and boys are taught they can own it all is there nothing sacred anymore in the 21st century and i still get followed round in stores and governments are using our money for reasons other than what they say theyre using it for and small countries fold as their big debt keeps on growing and silent pain is golden under the guise of religion and boys are taught they can own it all is there nothing sacred anymore well maybe there never was at all","Sacred","2004"
"Amel Larrieux","your eyes greeted mine and whispered softly slowly a secret only for me your eyes took their sweet time silently penetrating mine sent a wave through me through me straight through me to me spoke to me softly just to me your eyes the sleepy kind so still and warm i had to dive so deeply deeply to where youd meet me meet me those eyes round and sweet fruit they were and i had a piece and they filled me filled me so full and sweetly spoke to me softly just to me sleepy eyes will we meet again do my eyes make you feel like im feelin","Your Eyes","2004"
