"Band","Lyrics","Song","Year"
"Bill Wyman","its not easy its not easy living on your own its not easy its not easy living on your own and its hard its not easy and its hard its not easy and its a pretty hard thing its not easy its not easy living on your own all of the things that you used to do if theyre done now well theyre done by you it seems a big failing in a man to take his girl for granted if he can and its hard thing its not easy and its hard its not easy and its a pretty hard thing its not easy its not easy livin on your own theres no place where you can call home got me running like a cat in a thunderstorm just a big bed and a telephone like the last remnants of a stately home and its a pretty hard thing its not easy and its hard its not easy well its a pretty hard thing its not easy its not easy livin on your own and its hard its not easy its hard its not easy its a pretty hard thing its not easy its not easy living on your own sit here thinking with your head of fire go think the same thing and never tire imaginin the glow of her long clean hair as she goes to sit on her own high chair and its hard thing its not easy well its a pretty hard thing its not easy well its hard babe its not easy its not easy livin on your own its not easy a pretty tough thing its not easy well life pretty rough its not easy its a hard time baby its not easy its a hard time baby its not easy its a pretty hard life","It's Not Easy","2001"
"Bill Wyman","yes they call me the rocker i can rock you all night long yes they call me the rocker i can rock you all night long i can let you down easy when i think your moneys gone i can rock you easy dont want you to hesitate i can rock you easy dont want you to hesitate i can let you down easy like a like jelly on a plate some twistin and shakin dont mean a thing to me some twistin and the shakes dont mean a thing to me im a hip shakin daddy i can shake like a willow tree they call me the rocker i can really rock a while they call me the rocker i can really rock a while with a real gone mama dont let me fake your style i can rock you easy you dont want to hesitate i can rock you easy you dont want to hesitate i can let you down easy like jelly on a plate","Rockin' Daddy","2003"
"Bill Wyman","just a kiss just a smile hold my hand baby once in a while thats all i need thats all i need and ill be satisfied think of me when youre away call me darling just once a day thats all i need thats all i need and ill be satisfied oh true love came to me when i met you true love makes me know i wont forget you when youre around me it makes me feel that life is worth livin baby love is so forgiving just a kiss just a smile hold my hand baby just once in a while thats all i need thats all i need and ill be no no no no no thats all i need thats all i need and ill be yeah yeah yeah thats all i need thats all i need and ill be so satisfied","I'll Be Satisfied [DVD]","2004"
"Bill Wyman","well ive led an evil life so they say but ill hide from the devil on judgement day i said move hot rod move man move hot rod move man move hot rod move me on down the the line oh yeah well me and the devil at a stop light he started rollin i was out of sight i said move hot rod move man move hot rod move man move hot rod move me on down the the line oh yeah well goin pretty fast looked behind a hear come the the devil doin ninety nine i said move hot rod move man move hot rod move man move hot rod move me on down the the line oh yeah well thought i was smart the race was won a hear come the devil doin a hundred and one move hot rod move man move hot rod move man move hot rod move me on down the the line well goin pretty fast looked behind a hear come the the devil doin ninety nine i said move hot rod move man move hot rod move man move hot rod move me on down the the line oh yeah well ive led an evil life so they say but ill hide from the devil on judgement day i said move hot rod move man move hot rod move man move hot rod move me on down the the line","Race With the Devil [DVD]","2004"
"Bill Wyman","cry cry baby cry baby cry baby welcome back home now he told you that he loved you much more than i but he left you and you dont you just dont know why and when you dont know what to do you come runnin and start to cry cry baby cry baby cry baby like you always do dont you know nobody can love you the way i do take the pain and the heartache too ah honey you know that ill be around when you need me go on and cry cry baby cry baby cry baby welcome back home ive spent so many nights just waiting for you to come walkin through that door and even tho youve made a fool of me so many times before i know that all it takes is just the sight of your face to make me realize that ill always love you darlin and i can see that you got some more tears to shed i can see it baby because your eyes your eyes are getting red so cmon cmon cmon cmon cmon cmon and cry cry baby cry baby cry baby","Cry Baby","2005"
"Bill Wyman","youve got this strange effect on me and i like it youve got this strange effect on me and i like it you make this world seem right you make my darkness bright oh yes youve got this strange effect on me and i like it and i like it and i like the way you kiss me dont know if i should but this feeling its love and i know it thats why i feel good and i like it and i like it you make this world seem right you make my darkness bright oh yes youve got this strange effect on me and i like it and i like it you make my world seem right you make this darkness bright oh yes youve got this strange effect on me and i like it and i like it and i like it and i like it","This Strange Effect","2006"
"Bill Wyman","well now it takes more than a robin to make the winter go and it takes two lips of fire to melt away the snow well it takes two hearts a cookin to make a fire grow and baby youve got what it takes you know it takes a lot of kissin tell me about it to make a romance sweet ooh it takes a lot of lovin to make my life complete mmm and it takes a lot of woman to knock me off my feet and baby youve got what it takes i said mm mm mm uh huh mm mm mm ah ah hah mm mm you know youve got just what it takes because it takes more than an effort to stay away from you itd take more than a lifetime to prove that ill be true but it takes somebody special to make me say i do oh yeah and baby youve got what it takes ah ah hah mm mm uh huh mm mm mm you know youve got just what it takes because it takes oh yeah youre back in my spot again honey i like your spot to stay away from you i cant stay away from you it takes more than a lifetime daddy to prove that ill be true now its you but it takes somebody special like me baby to make me say i do and baby youve got what it takes cmon lets play it again huh cmon lets do it one more time all right and baby youve got what it takes one more time brook ah ha ok ah ha and baby youve got what it takes","Baby (You've Got What It Takes)","2006"
"Bill Wyman","im ready im willing and im able to rock and roll all night im ready im willing and im able to rock and roll all night come on pretty baby were gonna rock were gonna roll until the broad daylight because im ready mmm and im able mmm im willing and im able so youd better come and go with me were gonna rock and roll til tomorrow bout three talking on the phone is not my speed dont send me no letter cause i cant read dont be long cause ill be gone well go rock and rolling all night long cause im ready im willing and im able to rock and roll all night im ready im willing and im able to rock and roll all night come on pretty baby were gonna rock were gonna roll until tomorrow night","I'm Ready","2006"
"Bill Wyman","and if any last one of you ever likes to be part of this war part of it you get out you get out you get out one two oh i met a lot of friends who were cool but a lot of them were jerks and when i found about the trouble i was causing it only made me act even worse i played a lot of horrible songs yeah a lot of them were bad and when i listen back to the way i used to play it only made me even more mad i used to take what i wanted for free i only ever saw what i wanted to see we were jerks we were bad and thats all i ever wanted to be tear it up tear it up tear it up tear it up tear it up tear it up all night tear it up up up up up up up tear it up tear it up all right tear it up tear it up tear it up tear it up tear it up tear it up all night tear it up up up up up up up tear it up tear it up all right come on youve got none you want it you cant give in you get out youre bad come on i never cared much about rules and i did what i wanted in school i hung out on my own i went it alone and i probably really looked like fool but i did it like im top of the rope and ill do it like im top of the rope until i let go until i let go ill always tear it up on my own tear it up tear it up tear it up tear it up tear it up tear it up all night tear it up up up up up up up tear it up tear it up all right tear it up tear it up tear it up tear it up tear it up tear it up all night tear it up up up up up up up tear it up tear it up all right tear it up tear it up tear it up tear it up tear it up tear it up all night tear it up up up up up up up tear it up tear it up all right tear it up tear it up tear it up tear it up tear it up tear it up all night tear it up up up up up up up tear it up tear it up all right","Jitterbug Boogie","2006"
"Bill Wyman","dont you lie to me dont you lie to me because it makes me mad and i get shook up as a man can be well lets talk it over babe before we start i heard about the way that you go and play your part now dont you lie to me dont you lie to me because it makes me mad and i get shook up as a man can be well theres two kinds of people that i just cant stand thats a lying woman and a cheating man now dont you lie to me dont you lie to me because it makes me mad and i get shook up as a man can be well i can love you baby till our cows come home but im sick and tired of you treating me wrong now dont you lie to me dont you lie to me because it makes me mad and i get shook up as a man can be yeah well if you love me baby and it aint no lie ill be with you till the river runs dry now dont you lie to me dont you lie to me because that makes me mad and i get shook up as a man can be well lets talk it over babe before we start i heard about the way that you go and play your part now dont you lie to me dont you lie to me because it makes me mad and i get shook up as a man can be i get shook up come on yeah lie to me lie to me lie to me lie to me because it makes me mad and i get shook up as a man can be","Let's Talk It Over","2006"
"Bill Wyman","love if you see me then dont pass me by i need somebody or else im gonna die oh love if you need me just call and ill be there there is no sorrow that both of us cant share that both of us cant share love dont you despair love dont you despair oh love dont you despair","Love Will Keep Us Alive","2007"
"Bill Wyman","love if you see me then dont pass me by i need somebody or else im gonna die oh love if you need me just call and ill be there there is no sorrow that both of us cant share that both of us cant share love dont you despair love dont you despair oh love dont you despair","Love Will Keep Us Alive [DVD]","2007"
"Bill Wyman","dont you lie to me dont you lie to me because it makes me mad and i get shook up as a man can be well lets talk it over babe before we start i heard about the way that you go and play your part now dont you lie to me dont you lie to me because it makes me mad and i get shook up as a man can be well theres two kinds of people that i just cant stand thats a lying woman and a cheating man now dont you lie to me dont you lie to me because it makes me mad and i get shook up as a man can be well i can love you baby till our cows come home but im sick and tired of you treating me wrong now dont you lie to me dont you lie to me because it makes me mad and i get shook up as a man can be yeah well if you love me baby and it aint no lie ill be with you till the river runs dry now dont you lie to me dont you lie to me because that makes me mad and i get shook up as a man can be well lets talk it over babe before we start i heard about the way that you go and play your part now dont you lie to me dont you lie to me because it makes me mad and i get shook up as a man can be i get shook up come on yeah lie to me lie to me lie to me lie to me because it makes me mad and i get shook up as a man can be","Let's Talk It Over [Live]","2010"
"Bill Wyman's Bootleg Kings","just a kiss just a smile hold my hand baby once in a while thats all i need thats all i need and ill be satisfied think of me when youre away call me darling just once a day thats all i need thats all i need and ill be satisfied oh true love came to me when i met you true love makes me know i wont forget you when youre around me it makes me feel that life is worth livin baby love is so forgiving just a kiss just a smile hold my hand baby just once in a while thats all i need thats all i need and ill be no no no no no thats all i need thats all i need and ill be yeah yeah yeah thats all i need thats all i need and ill be so satisfied","I'll Be Satisfied [Live]","2006"
"Bill Wyman's Bootleg Kings","im ready im willing and im able to rock and roll all night im ready im willing and im able to rock and roll all night come on pretty baby were gonna rock were gonna roll until the broad daylight because im ready mmm and im able mmm im willing and im able so youd better come and go with me were gonna rock and roll til tomorrow bout three talking on the phone is not my speed dont send me no letter cause i cant read dont be long cause ill be gone well go rock and rolling all night long cause im ready im willing and im able to rock and roll all night im ready im willing and im able to rock and roll all night come on pretty baby were gonna rock were gonna roll until tomorrow night","I'm Ready [Live]","2006"
"Bill Wyman's Bootleg Kings","well now it takes more than a robin to make the winter go and it takes two lips of fire to melt away the snow well it takes two hearts a cookin to make a fire grow and baby youve got what it takes you know it takes a lot of kissin tell me about it to make a romance sweet ooh it takes a lot of lovin to make my life complete mmm and it takes a lot of woman to knock me off my feet and baby youve got what it takes i said mm mm mm uh huh mm mm mm ah ah hah mm mm you know youve got just what it takes because it takes more than an effort to stay away from you itd take more than a lifetime to prove that ill be true but it takes somebody special to make me say i do oh yeah and baby youve got what it takes ah ah hah mm mm uh huh mm mm mm you know youve got just what it takes because it takes oh yeah youre back in my spot again honey i like your spot to stay away from you i cant stay away from you it takes more than a lifetime daddy to prove that ill be true now its you but it takes somebody special like me baby to make me say i do and baby youve got what it takes cmon lets play it again huh cmon lets do it one more time all right and baby youve got what it takes one more time brook ah ha ok ah ha and baby youve got what it takes","Baby (You've Got What It Takes)","2006"
"Bill Wyman's Bootleg Kings","train i ride sixteen coaches long train i ride sixteen coaches long well that long black train got my baby and gone train train comin round the bend train train comin round the bend well it took my baby but it never will again no not again train train comin down down the line train train comin down down the line well its bringin my baby cause shes mine all mine shes mine all mine train train comin round round the bend round round the bend train train comin round round the bend round round the bend well it took my baby but it never will again never will again whoo oo oo oo oo hoo","Mystery Train","2006"
"Bill Wyman's Bootleg Kings","and if any last one of you ever likes to be part of this war part of it you get out you get out you get out one two oh i met a lot of friends who were cool but a lot of them were jerks and when i found about the trouble i was causing it only made me act even worse i played a lot of horrible songs yeah a lot of them were bad and when i listen back to the way i used to play it only made me even more mad i used to take what i wanted for free i only ever saw what i wanted to see we were jerks we were bad and thats all i ever wanted to be tear it up tear it up tear it up tear it up tear it up tear it up all night tear it up up up up up up up tear it up tear it up all right tear it up tear it up tear it up tear it up tear it up tear it up all night tear it up up up up up up up tear it up tear it up all right come on youve got none you want it you cant give in you get out youre bad come on i never cared much about rules and i did what i wanted in school i hung out on my own i went it alone and i probably really looked like fool but i did it like im top of the rope and ill do it like im top of the rope until i let go until i let go ill always tear it up on my own tear it up tear it up tear it up tear it up tear it up tear it up all night tear it up up up up up up up tear it up tear it up all right tear it up tear it up tear it up tear it up tear it up tear it up all night tear it up up up up up up up tear it up tear it up all right tear it up tear it up tear it up tear it up tear it up tear it up all night tear it up up up up up up up tear it up tear it up all right tear it up tear it up tear it up tear it up tear it up tear it up all night tear it up up up up up up up tear it up tear it up all right","Tear It Up","2006"
"Bill Wyman's Bootleg Kings","i see you turning the world in your hands just let it go ive loved you better than anyone else doesnt it show weve been standing at the window day and night looking at the rain when a simple conversation might help the situation please let me explain trust in me when you are alone trust in me when you cant go on if loving me is what you need trust in me dont make it easy i dont mind theres nothing left to lose you just try to see what you see and ill be there for you youve been standing at the window day and night tell me what you see sun in the daytime and moon at night well thats how easy it should be trust in me when you are alone trust in me when you cant go on if loving me is what you need trust in me trust in me when you cant go on trust in me when your strength is gone if loving me has the power to heal trust in me if you need someone to hold call me i will be there and if ever youre in trouble you need someone come to me baby trust in me move a little closer a little closer to the bone move on yeah move on trust in me when you are alone trust in me when you cant go on if loving me is what you need trust in me trust in me i trust in you i trust in you too","Trust in Me","2006"
"Bill Wyman's Rhythm Kings","groovin on a sunday afternoon really couldnt get away too soon i cant imagine anything thats better the world is ours whenever were together there aint a place id like to be instead of groovin down a crowded avenue doin anything we like to do theres always lots of things that we can see we can be anyone we want to be and all those happy people we could meet just groovin on a sunday afternoon really couldnt get away too soon ah ha ha ah ha ha ah ha ha well keep on spending sunny days this way were gonna talk and laugh our time away i feel it comin closer day by day life would be ecstasy you and me endlessly groovin on a sunday afternoon really couldnt get away too soon ah ha ha ah ha ha ah ha ha","Groovin'","1997"
"Bill Wyman's Rhythm Kings","i got a big surprise when i saw you smile i never dreamed that it could be but now i realize since i saw you smile theres only happiness for me so bye bye blues bye bye blues bells ring birds sing sun is shining no more pining just we two smiling thru dont sigh dont cry bye bye blues blues","Bye Bye Blues","2001"
"Bill Wyman's Rhythm Kings","without a warning you broke my heart takin it baby tore it apart and you left me standin in the dark said your love for me was dyin come on baby baby please come on baby cause im on my knees turn on your lights let it shine on me shine on your love light let it shine on me let shine let it shine let it shine when i get lonely in the middle of the night and i need you darlin to make things all right so come on baby baby please and im beggin you baby cause im on my knees turn on your lights let it shine on me turn on your love light let it shine on me let it shine let it shine let it shine without a warning you broke my heart takin it baby tore it apart and you left me standin in the dark shine your love for me was dark come on baby baby please come on baby cause im on my knees turn on your lights let it shine on me shine on your love light let it shine on me let shine let it shine let it shine","Turn on Your Lovelight","2001"
"Bill Wyman's Rhythm Kings","cry cry baby cry baby cry baby welcome back home now he told you that he loved you much more than i but he left you and you dont you just dont know why and when you dont know what to do you come runnin and start to cry cry baby cry baby cry baby like you always do dont you know nobody can love you the way i do take the pain and the heartache too ah honey you know that ill be around when you need me go on and cry cry baby cry baby cry baby welcome back home ive spent so many nights just waiting for you to come walkin through that door and even tho youve made a fool of me so many times before i know that all it takes is just the sight of your face to make me realize that ill always love you darlin and i can see that you got some more tears to shed i can see it baby because your eyes your eyes are getting red so cmon cmon cmon cmon cmon cmon and cry cry baby cry baby cry baby","Cry Baby","2005"
"Bill Wyman's Rhythm Kings","baby dont you worry about your man ill be comin home just as soon as i can i got love in the palm of my hand got to get back to you as soon as i can you dont know what you mean to me you dont know what you mean to me you dont know no no you dont know ive got lovin you on my mind im startin right now so i will be on time i wanna do all that i can just to prove to you that im a livin soul man you dont know what you mean to me you dont know what you mean to me you dont know no no you dont know gonna love you cause thats the way i planned it im gonna kiss you cause thats the way i planned it im gonna love you cause thats the way i planned it im gonna love you love you love you as hard as i can lets go baby dont you worry about your man ill be comin home just as soon as i can i got love in the palm of my hand got to get back to you as soon as i can you dont know what you mean to me you dont know what you mean to me you dont know no no you dont know you dont know what you mean to me you dont know what you mean to me no you dont know baby no no no no you dont know what you mean baby no no no no no no you dont know","You Don't Know","2005"
"Bill Wyman's Rhythm Kings","just a kiss just a smile hold my hand baby once in a while thats all i need thats all i need and ill be satisfied think of me when youre away call me darling just once a day thats all i need thats all i need and ill be satisfied oh true love came to me when i met you true love makes me know i wont forget you when youre around me it makes me feel that life is worth livin baby love is so forgiving just a kiss just a smile hold my hand baby just once in a while thats all i need thats all i need and ill be no no no no no thats all i need thats all i need and ill be yeah yeah yeah thats all i need thats all i need and ill be so satisfied","I'll Be Satisfied","2005"
"Bill Wyman's Rhythm Kings","dont you lie to me dont you lie to me because it makes me mad and i get shook up as a man can be well lets talk it over babe before we start i heard about the way that you go and play your part now dont you lie to me dont you lie to me because it makes me mad and i get shook up as a man can be well theres two kinds of people that i just cant stand thats a lying woman and a cheating man now dont you lie to me dont you lie to me because it makes me mad and i get shook up as a man can be well i can love you baby till our cows come home but im sick and tired of you treating me wrong now dont you lie to me dont you lie to me because it makes me mad and i get shook up as a man can be yeah well if you love me baby and it aint no lie ill be with you till the river runs dry now dont you lie to me dont you lie to me because that makes me mad and i get shook up as a man can be well lets talk it over babe before we start i heard about the way that you go and play your part now dont you lie to me dont you lie to me because it makes me mad and i get shook up as a man can be i get shook up come on yeah lie to me lie to me lie to me lie to me because it makes me mad and i get shook up as a man can be","Let's Talk It Over","2005"
