"Band","Lyrics","Song","Year"
"Edith Piaf","le jour ou tu mas rencontree etait un jour triste a mourir et je trainais dans mes pensees un ennui a nen plus finir mais il a suffi que tu viennes pour que joublie toutes mes peines cest merveilleux quand on est tous les deux le bonheur nous surveille cest merveilleux quand on est amoureux les beaux jours se reveillent cest merveilleux la vie est peinte en bleu a grands coups de soleil puisque je taime et que tu maimes cest merveilleux nous passerons toute la vie a chanter un si grand amour pour une chanson si jolie la vie na pas assez de jours nous en ferons une harmonie qui ne sera jamais finie cest merveilleux quand on est tous les deux le bonheur nous surveille cest merveilleux quand on est amoureux les beaux jours se reveillent cest merveilleux la vie est peinte en bleu a grands coups de soleil puisque je taime et que tu maimes cest merveilleux","C'Est Merveilleux","1997"
"Edith Piaf","la fille de joie est belle au coin de la rue la bas elle a une clientele qui lui remplit son bas quand son boulot sacheve elle sen va a son tour chercher un peu de reve dans un bal do faubourg son homme est un artiste seeest un drole de petit gars un accordeoniste qui sait jouer la java elle ecoute la java mais elle ne la danse pas elle ne regarde meme pas la piste et ses yeux amoureux suivent le jeu nerveux et les doigts secs et longs de lartiste ca lui rentre dans la peau par le bas par le haut elle a envie de chanter seeest physique tout son etre est tendu son souffle est suspendu seeest une vraie tordue de la musique la fille de joie est triste au coin de la are you la bas son accordeoniste il est parti soldat quand il reviendra de la guerre ils prendront une maison elle sera la caissiere et lui sera le patron que la vie sera belle ils seront de vrais pachas et tous les soirs pour elle il jouera la java elle ecoute la java quelle fredonne tout bas elle revoit son accordeoniste et ses yeux amoureux suivent le jeu nerveux et les doigts secs et longs de lartiste ca lui rentre dans la peau par le bas par le haut elle a envie de pleurer seeest physique tout son etre est tendu son souffle est suspendu seeest une vraie tordue de la musique la fille de joie est seule au coin de la rue la bas les filles qui font la gueule les hommes nen veulent pas et tant pis si elle creve son homme ne reviendra plus adieux tous les beaux reves sa vie elle est foutue pourtant ses jambes tristes lemmenent au boui boui ou why a un autre artiste qui joue toute la nuit elle ecoute la java elle entend la java elle a ferme les yeux et les doigts secs et nerveux ca lui rentre dans la peau par le bas par le haut elle a envie de gueuler seeest physique alors pour oublier elle sest mise a danser a tourner au son de la musique arretez arretez la musique","L'Accordéoniste","1998"
"Edith Piaf","les amants quand les amants entendront cette chanson cest sur ma belle cest sur quils pleureront ils ecoutront les mots damour que tu disais ils entendront ta voix damour quand tu maimais quand tu croyais que tu maimais que je taimais que lon saimait quand les amants entendront cette chanson cest sur ma belle cest sur quils pleureront couplet recitatif jentends toujours jentends ton rire quand quelque fois je te disais si un jour tu ne maimais plus si un jour je ne taimais plus tu repondais cest impossible et tu riais et tu riais et bien tu vois tu naurais pas du rire quand les amants entendront cette chanson cest sur ma belle cest sur quils pleureront ils ecoutront les mots damour que tu disais ils entendront ta voix damour quand tu maimais quand tu croyais que tu maimais que je taimais que lon saimait quand les amants entendront cette chanson cest sur ma belle cest sur quils pleureront","Les Amants","1998"
"Edith Piaf","pas la peine de suivre laiguil dit lpatron du bar ca navance a rien elle est en rtard ben jouez aux billes ca passe le temps et ca fait du bien il met ses vingt balls dans la mecanique un declic les bills sautent au garde a vous la premiere bondit comm une hysterique ca caval ca sonn ca sallum partout ding ding ca crepit comme une mitraillette ding un oeil sallum un bouch fleurit une pin up seclair des pieds a la tete au fond d la vitrin en verr depoli cent mill cest l ballet des nombres magiqus deux cents re ding ding la bill necout pas elle descend dans lcouloir comm pris de panique zut rate huit heurs ell ne viendra pas a quoi sert de guetter la porte dit lpatron du bar faut pas senerver vous ets beau gosse elle elle est pas morte une de perdue dix de retrouvees il remet vingt balls dans la mecanique de ses doigts crispes il tend le ressort la bill seme partout des flashs electriques pas autant pourtant quy en a dans son corps ah la sacree garce elle ira quand meme ding ding ding ca y est dans ltrou des cinq cent un partie a loeil il comprend lsysteme et ding et re ding ca dvient angoissant ding ding il sagrippe il secoue il cogne ding comme si cetait hola faudrait voir il va tout casser dit le patron qui rogne zut le jeu seteint neuf heurs plus despoir il sexcuse il sen va livide les nerfs detendus mais le coeur si gros il va jouer ailleurs dit lpatron candide il va jouer ailleurs ou bien sfoutre a leau ding cent mill ding ding deux cent mill quatr cent cinq cent mill ding ding ding re ding ding ding tilt","Le Billard Électrique","1998"
"Edith Piaf","cest a hambourg a santiago a white chapel ou borneo cest a hambourg a santiago a rotterdam ou a frisco hello boy you come with me amigo te quiero mucho liebling kom dort mit mir cest a hambourg au ciel de pluie quand les nuages vont a pas lents comme sen vont les lourds chalands le long des quais crevant dennui cest a hambourg ou bien ailleurs qua tous les gars en mal damour qua tous les gars depuis toujours moi je balance du reve en plein coeur cest a hambourg a santiago a white chapel ou borneo cest a hambourg a santiago a rotterdam ou a frisco cest a hambourg au ciel de pluie quil a pose ses mains sur moi et quil ma fait crier de joie en me serrant fort contre lui ma dit je taime a plus finir laisse donc la tous tes marins laisse donc la mer et puis viens moi jai du bonheur a toffrir ma petite gueule cest a hambourg au ciel de pluie dans les bastringues a matelots que je trimbale encore ma peau les bras ouverts a linfini car moi je suis comme la mer jai le coeur trop grand pour un seul gars jai le coeur trop grand et cest pour ca qu jai pris lamour sur toute la terre cest a hambourg a santiago a white chapel ou borneo so long boy adios amigo nacher schatz au revoir petite gueule","C'est a Hambourg","1998"
"Edith Piaf","nous les grognards les grenadiers sans grenades sans fusils ni souliers sans ennemis et sans armee on sennuie dans la nuit du passe nous les grognards les grenadiers sans grenades sans fusils ni souliers ce soir nous allons defiler au milieu de vos champs elysees wagram iena eylau arcole marengo ca sonne bien quells jolies bataills tout ce travail cetait pas pour rien puisque les noms de rues les noms davenues ou vous marchez cest avec le sang de nos vingt ans quon les a graves nous les grognards les grenadiers sans grenades sans fusils ni souliers sans ennemis et sans armee on sennuie dans la nuit du passe nous les grognards les grenadiers on est morts sur des champs etrangers on a visite la russie mais jamais nous navons vu paris on na pas eu le temps davoir un printemps qui nous sourit nos pauvres amours duraient un jour au revoir et merci roulez roulez tambours dans le petit jour on sen allait au son du clairon et du canon notre vie dansait nous les grognards les grenadiers on nous a oublies oublies depuis le temps de nos combats il y a eu tant et tant de soldats mais cette nuit vous nous verrez sans grenades sans fusils ni souliers defiler au pas cadence au milieu de vos champs elysees sans grenades sans fusils ni souliers a paris","Les Grognards","1998"
"Edith Piaf","il portait des culottes des bottes de moto un blouson de cuir noir avec un aigle sur le dos sa moto qui partait comme un boulet de canon semait la terreur dans toute la region jamais il ne se coiffait jamais il ne se lavait les ongles pleins de cambouis mais sur les biceps il avait un tatouage avec un coeur bleu sur la peau bleme et juste a linterieur on lisait maman je taime il avait une petite amie du nom de marie lou on la prenait en pitie une enfant de son age car tout le monde savait bien quil aimait entre tout sa chienne de moto bien davantage il portait des culottes des bottes de moto un blouson de cuir noir avec un aigle sur le dos sa moto qui partait comme un boulet de canon semait la terreur dans toute la region marie lou la pauvre fille limplora le supplia dit ne pars pas ce soir je vais pleurer si tu ten vas mais les mots furent perdus ses larmes pareillement dans le bruit de la machine et du tuyau dechappement il bondit comme un diable avec des flammes dans les yeux au passage a niveau ce fut comme un eclair de feu contre une locomotive qui filait vers le midi et quand on debarrassa les debris on trouva sa culotte ses bottes de moto son blouson de cuir noir avec un aigle sur le dos mais plus rien de la moto et plus rien de ce demon qui semait la terreur dans toute la region","L' Homme à la Moto","1998"
"Edith Piaf","cest fou cque jpeux taimer cque j peux taimer des fois des fois jvoudrais crier car jnai jamais aime jamais aime comme ca ca je peux te ljurer si jamais tu partais partais et me quittais me quittais pour toujours cest sur que jen mourrais que jen mourrais damour mon amour mon amour cest fou cquil me disait comme jolis mots damour et comme il les disait mais il ne sest pas tue car malgre mon amour cest lui qui ma quittee sans dire un mot pourtant des mots y en avait tant y en avait trop cest fou cque jpeux taimer cque jpeux taimer des fois des fois je voudrais crier car jnai jamais aime jamais aime comme ca ca je peux te ljurer si jamais tu partais partais et me quittais me quittais pour toujours cest sur que jen mourrais que jen mourrais damour mon amour mon amour et voila quaujourdhui ces memes mots damour cest moi qui les re dis cest moi qui les re dis avec autant damour a un autre que lui je dis des mots parce que des mots il y en a tant quil y en a trop cest fou cque jpeux taimer c que jpeux taimer des fois des fois jvoudrais crier car jnai jamais aime jamais aime comme ca ca je peux te ljurer si jamais tu partais partais et me quittais me quittais pour toujours cest sur que jen mourrais que jen mourrais damour mon amour mon amour au fond cnetait pas toi comme ce nest meme pas moi qui dit ces mots damour car chaque jour ta voix ma voix ou dautres voix cest la voix de lamour qui dit des mots encore des mots toujours des mots des mots damour cest fou cque jpeux taimer cque jpeux taimer des fois si jamais tu partais cest sur que jen mourrais cest fou c que j peux taimer cque jpeux taimer damour","Les Mots d'Amour","1998"
"Edith Piaf","paroles a quoi ca sert lamour a quoi a sert lamour on raconte toujours des histoires insens es a quoi a sert daimer lamour ne sexplique pas cest une chose comme a qui vient on ne sait do et vous prend tout coup moi jai entendu dire que lamour fait souffrir que lamour fait pleurer a quoi a sert daimer lamour a sert quoi a nous donner d la joie avec des larmes aux yeux cest triste et merveilleux pourtant on dit souvent que lamour est d cevant quil y en a un sur deux qui nest jamais heureux m me quand on la perdu lamour quon a connu vous laisse un go t de miel lamour cest ternel tout a cest tr s joli mais quand tout est fini il ne vous reste rien quun immense chagrin tout ce qui maintenant te semble d chirant demain sera pour toi un souvenir de joie en somme si jai compris sans amour dans la vie sans ses joies ses chagrins on a v cu pour rien mais oui regarde moi a chaque fois jy crois et jy croirai toujours a sert a lamour mais toi tes le dernier mais toi tes le premier avant toi y avait rien avec toi je suis bien cest toi que je voulais cest toi quil me fallait toi qui jaimerai toujours a sert a lamour","A Quoi Ça Sert l'Amour","1998"
"Edith Piaf","dans la ville inconnue je naime rien je prends toujours des rues qui vont trop loin dinterminables rues ou je me perds des quais des avenues et des boulevards deserts puis entre deux maisons jentends le tintamarre dun long train sur un pont qui sen va quelque part dans la ville inconnue soir et matin comme ce chien perdu je vais et je reviens il y a les passants qui ont lair de vous fuir et qui nont pas le temps de vous faire un sourir dans la ville inconnue quand vient la nuit jai peur des murs tout nus des murs tout gris jai peur de cet hotel au lit trop froid et du matin cruel qui me reveillera car je voudrais dormir dormir meme le jour avec mes souvenirs mes souvenirs damour dans la ville inconnue je pense a toi mais toi te souviens tu encore un peu de moi mais toi te souviens tu encore un peu de moi","La Ville Inconnue","1998"
"Edith Piaf","pour partir de chez moi pour partir de chez toi pour laisser tout tomber sans regarder derriere soi fallait il fallait il fallait il que lon saime fallait il en avoir de lamour toi et moi pour chaque fois se quitter sur un mot maladroit pour chaque fois le regretter et chaque fois recommencer fallait il fallait il fallait il que lon saime fallait il en avoir de lamour toi et moi pour saimer aussi mal aussi mal quon saimait pour se faire autant de mal autant de mal quon sest fait fallait il fallait il fallait il que lon saime fallait il en avoir de lamour toi et moi pour navoir jamais pu etre heureuse etre heureuse apres toi","Fallait-Il? [Recording Session Outtake][#][*]","1998"
"Edith Piaf","jezebel if ever a devil was born without a pair of horns it was you jezebel it was you if ever an angel fell jezebel it was you jezebel it was you if ever a pair of eyes promised me paradise deceiving me grieving me leaving me blue it was you jezebel it was you if ever a devils plan was made to torment man it was you jezebel it was you could be better had i never known a lover such as you forsaking dreams and all for the siren call of your arms like a demon love possessed me you upset me constantly what evil star is mine that my fates design should be if ever a pair of eyes promised me paradise deceiving believing believing you it was you jezebel it was you if ever a devil was born without a pair of horns it was you night and day every way jezebel jezebel jezebel","Jezebel","1999"
"Edith Piaf","si vous voulez bien ecouter je vais chanter un chant damour les parols sont banals a souhait nos deux amants saimaient damour si vous me laissez raconter lhistoir damour triste a pleurer alors laissez moi chanter si vous me laissez raconter je vais pleurer leur chant damour car helas on a separe nos deux amants nos fous damour la fille est morte un matin je ne peux chanter le chagin alors laissez moi pleurer oui mais ceux qui se sont aimes vraiment aimes aimes damour lamour ne sest jamais perdu il est partout mem dans les rues je suis sure que nos deux amants maintnant sen fout eperdument alors chantons leur amour la la la la la la la la la la la la la la la la alors laissez moi chanter","Un Chant d'Amour","1999"
"Edith Piaf","le jour ou tu mas rencontree etait un jour triste a mourir et je trainais dans mes pensees un ennui a nen plus finir mais il a suffi que tu viennes pour que joublie toutes mes peines cest merveilleux quand on est tous les deux le bonheur nous surveille cest merveilleux quand on est amoureux les beaux jours se reveillent cest merveilleux la vie est peinte en bleu a grands coups de soleil puisque je taime et que tu maimes cest merveilleux nous passerons toute la vie a chanter un si grand amour pour une chanson si jolie la vie na pas assez de jours nous en ferons une harmonie qui ne sera jamais finie cest merveilleux quand on est tous les deux le bonheur nous surveille cest merveilleux quand on est amoureux les beaux jours se reveillent cest merveilleux la vie est peinte en bleu a grands coups de soleil puisque je taime et que tu maimes cest merveilleux","C'est Merveilleux [Du Film Etoile Sans Lumière]","1999"
"Edith Piaf","il etait une amoureuse qui vivait sans etre heureuse son amant ne laimait pas cest drole mais cetait comme ca elle courut a la fontaine afin dy noyer sa peine et tout le diable et son train la poussaient dans le chemin cest pour ca que lamour pleurait dans son coin cest pour ca que le ciel ny comprenait rien les jours de lumiere les mots des prieres tous en procession lui faisaient escorte mais la fille est morte en criant pardon cest pour ca que lamour pleurait dans son coin cest pour ca que le ciel ny comprenait rien toutes les fleurs se fanerent et la nuit couvrit la terre pour chanter le dernier jour de cette morte damour echappes du noir manege les mal aimes en cortege partent essayer dempecher le soleil de se lever cest pour ca que lamour navait plus damis cest pour ca que le ciel cherchait un abri les jeux et les rondes toutes les joies du monde voulaient sen aller et le coeur des hommes tout pourri dautomne allait se faner cest pour ca que lamour navait plus damis cest pour ca que le ciel cherchait un abri mais voila que ma legende va danser sous les guirlandes ca ne pouvait pas durer lamour a tout arrange et depuis cest lui qui chante tant pis pour qui se tourmente vous pouvez toujours pleurer il est plus fort a chanter cest pour ca quon entend les accordeons cest pour ca que la rue eclate en chansons le chagrin des ames dans tout ce vacarme on ne lentend plus lamour fait la fete et chacun cest bete a coeur que veux tu cest pour ca quon entend les accordeons cest pour ca que la rue eclate en chansons","C'est Pour Ça","1999"
"Edith Piaf","adieu mon coeur on te jette au malheur tu nauras pas mes yeux pour mourir adieu mon coeur les echos du bonheur font tes chants tristes autant quun repentir autrefois tu respirais le soleil dor tu marchais sur des tresors on etait vagabonds on aimait les chansons ca fini dans les prisons adieu mon coeur on te jette au malheur tu nauras pas mes yeux pour mourir adieu mon coeur les echos du bonheur font tes chants tristes autant quun repentir un repentir","Adieu Mon Coeur","1999"
"Edith Piaf","marchant par dessus les tempetes courant dans la vague et le vent chassant les blanches goelettes cest nous ca les gaillards davant cest nous qui sommes les corsaires brigands tout comme etaient nos peres ho hisse et ho misericorde pour nous tenir au bout dune corde faudra dabord nous attraper faudra dabord nous aborder ho hisse ho pavillon noir ho hisse ho pavillon haut tant que le vent pousse la fregate y a du bon temps pour les pirates tant que la mer est par dessous cest le corsaire qui tient le bon bout ho hisse ho pavillon noir ho hisse ho pavillon haut tant pis pour les yeux de ta mere tant pis pour la reine et le roi tant mieux si tu deviens corsaire jesus etait un hors la loi viens donc frequenter les etoiles dormir dans le ventre des voiles ho hisse et ho misericorde pour nous tenir au bout dune corde faudra dabord nous attraper faudra dabord nous aborder ho hisse ho pavillon noir ho hisse ho pavillon haut tant que le vent pousse la fregate y a du bon temps pour les pirates tant que la mer est par dessous cest le corsaire qui tient le bon bout ho hisse ho pavillon noir ho hisse ho pavillon haut","Le Chant du Pirate","1999"
"Edith Piaf","non rien de rien non je ne regrette rien ni le bien quon ma fait ni le mal tout ca mest bien egal non rien de rien non je ne regrette rien cest paye balaye oublie je me fous du passe avec mes souvenirs jai allume le feu mes chagrins mes plaisirs je nai plus besoin deux balaye les amours avec leurs tremolos balaye pour toujours je reparts a zero non rien de rien non je ne regrette rien ni le bien quon ma fait ni le mal tout ca mest bien egal non rien de rien non je ne regrette rien car ma vie car mes joies aujourdhui ca commence avec toi","Non, Je Ne Regrette Rien","1999"
"Edith Piaf","la fille de joie est belle au coin de la rue labas elle a une clientele qui lui remplit son bas quand son boulot sacheve elle sen va a son tour chercher un peu de reve dans un bal du faubourg son homme est un artiste cest un drole de petit gars un accordeoniste qui sait jouer la java elle ecoute la java mais elle ne la danse pas elle ne regarde meme pas la piste et ses yeux amoureux suivent le jeu nerveux et les doigts secs et longs de lartiste ca lui rentre dans la peau par le bas par le haut elle a envie de chanter cest physique tout son etre est tendu son souffle est suspendu cest une vraie tordue de la musique la fille de joie est triste au coin de la rue labas son accordeoniste il est parti soldat quand y reviendra de la guerre ils prendront une maison elle sera la caissiere et lui sera le patron que la vie sera belle ils seront de vrais pachas et tous les soirs pour elle il jouera la java elle ecoute la java quelle fredonne tout bas elle revoit son accordeoniste et ses yeux amoureux suivent le jeu nerveux et les doigts secs et longs de lartiste ca lui rentre dans la peau par le bas par le haut elle a envie de chanter cest physique tout son etre est tendu son souffle est suspendu cest une vraie tordue de la musique la fille de joie est seule au coin de la rue labas les filles qui font la gueule les hommes nen veulent pas et tant pis si elle creve son homme ne reviendra plus adieux tous les beaux reves sa vie elle est foutue pourtant ses jambes tristes lemmenent au boui boui ou y a un autre artiste qui joue toute la nuit elle ecoute la java elle entend la java elle a ferme les yeux et les doigts secs et nerveux ca lui rentre dans la peau par le bas par le haut elle a envie de gueuler cest physique alors pour oublier elle sest mise a danser a tourner au son de la musique arretez arretez la musique","L' Accordéoniste [La Fille de Joie Triste]","2000"
"Edith Piaf","le grand totor quest en menage avec totoche qui la filoche et la defend cest pas un mec a la mie de pain poisse a la manque qui fait sa planque comme un feignant comme un chef dadministration il organise la production le necessaire et le superflu tout est regle tout est prevu pendant les heures dexploitation cest pas un homme cest un demon mais en dehors de ses fonctions cest pas un homme cest un mouton apres le boulot si quelle veut faire des heures en plus cest son affaire et dans le fond ca ne le regarde plus comme dit totor ca me fait pas tort pour largent quelle gagne au dehors on est daccord comme dit totor faut pas se conduire comme un butor comme dit totor jy laisse le droit de la depenser a volonte de la ramasser ou de la placer de se tuyauter de boursicoter dacheter de la rente ou du foncier en suivant les cours financiers des charbonnages ou des aciers jai pas le droit dy fourrer mon nez correque et reguyer pendant que les autres vont jouer le pastis a la belotte avec les potes dans les bistros totor controle tout ce que la totoche lui raconte et fait ses comptes dans son bureau pour le resquillage et le boni avant quelle parle il a compris ya rien a chiquer avec lui cest pas un homme cest un taxi au moins derreur ou domission a la premiere contestation la machine a coller des jetons est prete pour la distribution dans les affaires quand on se laisse faire on est foutu comme dit totor il faut dabord quand ca ne va plus y aller dautor et taper fort mais une fois quon a fait du sport comme dit totor ce serait un tort que de conduire comme un butor quand que cest regle a quoi que ca sert detre rancunier comme dit totor une fois quil a la main tournee il lui coll du taffetas gomme et lui dit pour la consoler blessee en service commande cest un accident du metier demain tiras pas travailler correque et reguyer et malgre ca ya des jours ou qula mome totoche fait sa caboche et reprend le dessus ca fait quun soir a sest fait voir avec tatave et ce quest le plus grave totor la su comme dit totor quon soye bourgeois barbeau prince ou nimporte quoi chacun son bien chacun son du sans ca la morale est foutu ce qui fait quen sortant du restaur tatav sest trouve devant totor qui ya dit les yeux dans les yeux on va regler ca tout les deux dans les affaires quand on se laisse faire on est foutu mais le mome tatav ya dit totor je te comprends pu je te jure totor tes dans ton tort avec la mome jai pas de remords on est daccord et quand on sort jy refile 100 balles dans le corridor alors totor ya dit jai rien a te reprocher tu vois mon pot si tu mavait pas renseigne on serait en train de sentrelarder mais moi je pouvais pas le deviner vu qua ma jamais rien donne finalement tu peux ten aller mais cest elle qui va derouiller correque et reguyer","Corrèque et Réguyer","2001"
"Edith Piaf","la la la la la la la la la la la la la la la la la la la la la la la la gondolier ten souviens tu les pieds nus sur ta gondole tu chantais la barcarolle tu chantais pour lui et moi lui et moi tu te rappelles lui et moi cetait ecrit pour la vie la vie si belle gondolier quand tu chantais la la la la la la la la la la la la la la la la la la la la la la la la io ti amo con tutt il cuor solo ate adorero e sappendo che tu mi ami ti amero mol ti di piu cet air la etait le notre gondolier si tu le vois dans les bras les bras dune autre gondolier ne chante pas la la la la la la la la la la la la la la la la la la la la la la la la la la la la la la la la la la la la la la la","Gondolier","2003"
"Edith Piaf","hey venus oh venus hey venus oh venus venus if you will please send a little girl for me to thrill a girl who wants my kisses and my arms a girl with all the charms of you venus make her fair a lovely girl with sunlight in her hair and take the brightest stars up in the skies and place them in her eyes for me venus goddess of love that you are surely the things i ask cant be too great a task venus if you do i promise that i always will be true ill give her all the love i have to give as long as we both shall live hey venus oh venus make my wish come true","Venus","2003"
