"Band","Lyrics","Song","Year"
"Don Carlos","worry onto those that shed innocent blood of jah people jah shall clean out the bad weeds and seperate them from the good cause the day of harvest is near worry unto those that say theyre of israel and they are not worry unto those that say theyre jews and they are not cause they shall be cast away like chaff that the wind driveth away i say jah shall clean out the bad weeds and seperate them from the good cause the day of harvest is near death to the black and white opressors who have oppressed jah children innocently i throw my word without partiality listen to i let it fall and let it fall let babylon fall jah shall clean out the bad weeds and seperate them from the good cause the day of harvest is near worry unto those that say theyre of israel and they are not worry unto those that say theyre jews and they are not cause jah shall have them in his region theyre half the season cause they shall be cast away like chaff that the wind driveth away i say jah shall clean out the bad weeds and seperate them from the good cause the day of harvest is near","Harvest Time","1997"
"Don Carlos","well now the youth man say i have come a long way between this earth and zion and the warrior say i too have made my way as i roll upon this rod of iron now dem man go and they shall live up but we shall stay to face this dragon war and dem man go and they shall live up but we shall stay to face this dragon war for the book does say like the sand of the sea shores we shall lie and the book does say the time will come when i and i shall testify born out of de masses caste us into the heart of babylon run upon a mount sinai oh most high come make it so jah jah know know a savior a sit upon a old rock log jah jah i know know a savior a coming from the tribe of judah jah jah i know know a savior lie beyond a wailing wall jah jah i know know a savior coming from a dis a heart of dragon war well now the youth man say he say i have come a long way between this earth and zion and the warrior say i too have made my way as i trot upon this rod of iron now dem man go and they shall live up but we shall stay to face this dragon war and dem man go and they shall live up but we shall stay to face this dragon war hollow de hollow de hollow their hearts hollow de hollow de hollow their words no well never hear dem barking coming to dem i say take them away to israel ya call upon a mont sinai oh most high come make it so jah jah know know a savior a coming from a true lamb lord jah jah i know know a savior trotted from the tribe of judah jah jah i know know a savior lie beyond a wailing wall jah jah i know know know know man and man and man and man dem fighting jah jah oh lord could a could a i and i a fighting jah jah dis a wailin on the wall wailin on the wall fighting dis a dragon war dem a savior to the son a savior to the son now dis a man shall go shall linger and dis a man shall go shall stumble dis a man shall go shall linger dis a man shall go shall stumble oh riding they fighting so they rock them soul de youth de man fighting oh jah now dem a oh man a dont stand there waiting youre the one dont stand there waiting youre the one dont stand there waiting youre the one dont stand there waiting youre the one","Jah Jah Know","2003"
"Don Carlos","you say yes i say no you say stop and i say go go go oh no you say goodbye and i say hello hello hello i dont know why you say goodbye i say hello hello hello i dont know why you say goodbye i say hello i say high you say low you say why and i say i dont know oh no you say goodbye and i say hello hello hello i dont know why you say goodbye i say hello hello hello hello goodbye hello goodbye hello goodbye i dont know why you say goodbye i say hello hello goodbye hello goodbye hello goodbye hello goodbye why why why why why why do you say goodbye goodbye bye bye oh no you say goodbye and i say hello hello hello i dont know why you say goodbye i say hello hello hello i dont know why you say goodbye i say hello you say yes i say no i say yes but i may mean no you say stop i say go go go i can stay still its time to go oh oh no you say goodbye and i say hello hello hello i dont know why you say goodbye i say hello hello hello i dont know why you say goodbye i say hello hello hello i dont know why you say goodbye i say hello wow oh hello hela heba helloa hela heba helloa hela heba helloa hela heba helloa hela hela heba helloa hela heba helloa hela heba helloa hela heba helloa hela heba helloa","Hello, Goodbye","2004"
"Don Carlos","how many roads must a man walk down before you call him a man yes n how many seas must a white dove sail before she sleeps in the sand yes n how many times must the cannon balls fly before theyre forever banned the answer my friend is blowin in the wind the answer is blowin in the wind how many times must a man look up before he can see the sky yes n how many ears must one man have before he can hear people cry yes n how many deaths will it take till he knows that too many people have died the answer my friend is blowin in the wind the answer is blowin in the wind how many years can a mountain exist before its washed to the sea yes n how many years can some people exist before theyre allowed to be free yes n how many times can a man turn his head pretending he just doesnt see the answer my friend is blowin in the wind the answer is blowin in the wind","Blowin' in the Wind","2004"
"Don Carlos","hello carol im depending on you hello carol im depending on you i got a fever an fresh cold so im depending on you from my heart an soul im depending on you so much tears on my pillow like a flowing river uh huh huh true true uh huh huh true true my mama forsake me then my daddy wont see me now im like a true true a bachelor true true with no relation","Hello Carol","2004"
"Don Carlos","were grooving alright were moving woah oh yeah ay woah oh oh oh were grooving nothing like roots reggae music now turn it up i wanna lose it nothing like roots reggae music oh oh were grooving nothing like roots reggae music now turn it up i wanna lose it nothing like roots reggae music higher self meditation the music brings upon me mixed with the healing of the nation well now thats all i need cause its the perfect combination were moving at our own speed were talking higher concentration so keep it moving with me yeah let me tell you now were grooving nothing like roots reggae music now turn it up i wanna lose it nothing like roots reggae music oh oh were grooving nothing like roots reggae music now turn it up i wanna lose it nothing like roots reggae music yeah ay were grooving feel the vibes of the music its alright woah oh cause when the music hold ears filled all night yeah ay you wanna jump you wanna shout you wanna skank you wanna shout it all about ill let the whole world know the music has got you oh oh we wanna move we wanna groove we wanna move we wanna play it non stop we wanna move we wanna groove we wanna move we wanna play it non stop because you cant stop this feeling you cant stop this groove cant stop this music you cant kill this mood music in the message the message in the music never leave sight in the right time itll give light well let me tell you now were grooving nothing like roots reggae music now turn it up i wanna lose it nothing like roots reggae music oh oh were grooving nothing like roots reggae music now turn it up i wanna lose it nothing like roots reggae music oh oh oh oh woah oh woah oh oh oh oh oh woah oh oh oh oh oh woah oh oh oh alright were moving grooving were grooving","Roots Reggae Music","2014"
"Don Carlos & Gold","worry onto those that shed innocent blood of jah people jah shall clean out the bad weeds and seperate them from the good cause the day of harvest is near worry unto those that say theyre of israel and they are not worry unto those that say theyre jews and they are not cause they shall be cast away like chaff that the wind driveth away i say jah shall clean out the bad weeds and seperate them from the good cause the day of harvest is near death to the black and white opressors who have oppressed jah children innocently i throw my word without partiality listen to i let it fall and let it fall let babylon fall jah shall clean out the bad weeds and seperate them from the good cause the day of harvest is near worry unto those that say theyre of israel and they are not worry unto those that say theyre jews and they are not cause jah shall have them in his region theyre half the season cause they shall be cast away like chaff that the wind driveth away i say jah shall clean out the bad weeds and seperate them from the good cause the day of harvest is near","Harvest Time","1983"
"Don Carlos & Gold","if you let me make love to you then why cant i touch you if you let me make love to you then why cant i touch you im not saying i want to change you i dont want to rearrange you if you let me make love to you then why cant i touch you if you let me make love to you then why cant i touch you from the very first moment i saw you its been a different world from the very first moment i saw you its been such a different world i seem to be a little bit stronger each moment seems just a little bit little bit longer missing links and little kinks have never been found and uncurled but youre still the same youre like a frozen flame well it sure seems a shame you let me make love to you but you wont let me touch you when i leave you im going someplace that ive never been before when i leave you im going someplace that ive never been before why dont you reach out and touch me reach out and touch me if you let me make love to you then why cant i touch you if you let me make love to you then why cant i touch you","Hog and Goat","2008"
"Don Carroll","let me be your lucky star shining down on you lucky star babe i want to be babe your lucky star let me be be babe i want to be baby baby your lucky star oh oh oh listen every night you look up in the sky babe theres a light shining in the dark there its me looking down on you girl in my heart youre the only one in my world takes some time just some time to know me and let me show you how much you mean to me all this love is waiting here just for you ill be your star shining through i want to be your lucky star i want to be i want to be your lucky star your lucky star babe","Lucky Star","2000"
"Don Carroll","youre my last breath youre a breath of fresh air to me i am empty so tell me you care for me youre the first thing and the last thing on my mind in your arms i feel sunshine give up yourself unto the moment the time is now give up yourself unto the moment lets make this moment last you may find yourself out on a limb for me could you expect it as a part of your destiny i give all i have but its not enough and my patience is shot so im calling your bluff give up yourself unto the moment the time is now give up yourself unto the moment lets make this moment last give up yourself unto the moment the time is now give up yourself unto the moment lets make this moment last and we gave it time all eyes are on the clock time takes too much time please make the waiting stop and the atmosphere is charged in you i trust and i feel no fear as i do as i must give up yourself unto the moment the time is now give up yourself unto the moment lets make this moment last give up yourself unto the moment the time is now give up yourself unto the moment lets make this moment last tempted by fate and i wont hesitate the time is now lets make this moment last and the night is young the time is now lets make this moment last give up yourself unto the moment the time is now give up yourself unto the moment lets make this moment last","Back Together (Copyright Reprise)","2004"
"Don Carroll","soul clap get up get up yeah woah me wanna see everybody on move dance all dollarman coming at ya we just wanna big up cutee be bob sinclar its like dancing listen it its the way just bounce yeah everybody dance now lets go whoo lets go make it hot come on lets go rock rock say what rock lets go everybody dance now rock this party dance everybody make it hot in this party dont stop move your body rock this party dance everybody make it hot in this party everybody dance now dont know whats on your mind you comfy have a good time why ___ ___ shake your behind im in a dancing mood yall know im feeling good this is my favorite tune put on your dancing shoes gonna make you feel so good tonight yall we gonna make you feel alright i came to rock at this party cause i can make you feel alright sweet boy youre rocking your body ill get you straight to the night oh oh you want this party oh oh you want it now sweet boy youre rocking your body cause im gonna make you mine tonight do do do do lets go do do do do whoo do do do do lets go dance now everybody move move now everybody shake shake now everybody everybody dance now __dance__ __ dont stand a chance gotta look better than then and dress nicer than then hold me tight yall hold me tight what hold me waist yall hold me waist yall what __ oh wipe me off lets go just dry me off do do do do lets go do do do do whoo do do do do lets go dance now everybody move move now everybody shake shake now everybody everybody dance now __flex__ __connect__ __big up__ tell em so you are the best you look better then you look better you just better then you just better shake you body shake you body show them your move show them your move","Everybody Movin'","2007"
"Don Carroll","youre my last breath youre a breath of fresh air to me i am empty so tell me you care for me youre the first thing and the last thing on my mind in your arms i feel sunshine give up yourself unto the moment the time is now give up yourself unto the moment lets make this moment last you may find yourself out on a limb for me could you expect it as a part of your destiny i give all i have but its not enough and my patience is shot so im calling your bluff give up yourself unto the moment the time is now give up yourself unto the moment lets make this moment last give up yourself unto the moment the time is now give up yourself unto the moment lets make this moment last and we gave it time all eyes are on the clock time takes too much time please make the waiting stop and the atmosphere is charged in you i trust and i feel no fear as i do as i must give up yourself unto the moment the time is now give up yourself unto the moment lets make this moment last give up yourself unto the moment the time is now give up yourself unto the moment lets make this moment last tempted by fate and i wont hesitate the time is now lets make this moment last and the night is young the time is now lets make this moment last give up yourself unto the moment the time is now give up yourself unto the moment lets make this moment last","Back Together","2008"
"Don Carroll","i see trees of green red roses too i see them bloom for me and for you and i think to myself what a wonderful world i see skies of blue clouds of white bright blessed days dark sacred nights and i think to myself what a wonderful world the colors of a rainbow so pretty in the sky are also on the faces of people going by i see friends shaking hands saying how do you do theyre really saying i love you i hear babies cry i watch them grow theyll learn much more than ill never know and i think to myself what a wonderful world yes i think to myself what a wonderful world","What a Wonderful World","2008"
"Don Chayo","despues de tantas noches de amargos sufrimientos por no saber de ti ya ves no te olvidado tampoco traicionado te sigo siendo fiel y pasara una noche y pasaran mil noches y tu jamas vendras pero yo que te sigo adorando seguire por tu amor esperando aunque sufra mas","Mil Noches","2013"
"Don Chayo","si tu supieras lo que sufro por tus besos no dejarias nunca nunca de besarme si tu supieras el carino que te tengo no dejarias nunca mas de amarme si tu supieras lo que sufro por tus ojos cuando no vienen a mirarme como lloro por esos ojos y esa boca estoy penando vente conmigo para hacerte mi tesoro si tu supieras lo que sufro por tu amor ya te vinieras a vivir aqui conmigo yo ya no quiero sufrir mas por lo que tienes ya traeme todo lo que dices que es muy mio si tu supieras lo que sufro por tus ojos cuando no vienen a mirarme como lloro por esos ojos y esa boca estoy penando vente conmigo para hacerte mi tesoro si tu supieras lo que sufro por tu amor ya te vinieras a vivir aqui conmigo yo ya no quiero sufrir mas por lo que tienes ya traeme todo lo que dices que es muy mio","Si Tu Supieras","2013"
"Don Cherry","there goes the girl i dreamed all through school about there goes the girl ill now be a fool about ring down the curtain im certain at present my future just passed dont even know if she has been spoken for if she is tied the ties must be broken for life cant be that way to wake me then break me my future just passed stars in the blue tho youre at a distance you can at least do this sometimes a boy encounters resistance help me to win this miss here are my arms may she find illusion there look in my heart there is no confusion there now that im loving im living at last my future just passed","My Future Just Passed","1956"
"Don Cherry","wouldnt it be a change for you and me to stay at home once ina while wed babaret until the break of day ill bet weve danced many a mile ill like to see a movie once more they dont keep people staying up until four wouldnt it be a pleasant novelty to tumble in early once more sleepy time gal youre turning night into day sleepy time gal youve danced the evning away before each silvery star fades out of sight please give me one little kiss then let us whisper goodnight its getting lat and dear your pillows waitin sleepy time gal when all your dancin is through sleepy time gal ill find a cottage for you youll learn to cook and to sew whats more youll love it i know when youre a stay at home play at home eight oclock sleepy time gal wouldnt it be a pleasant sight to see a kitchenette only for you wouldnt it be a pleasant sight to see a table set only for two id get a big victrola and then well start in dancing evry new dance again then it will be a pleasant novelty to tumble in just about ten sleepy time gal youre turning night into day sleepy time gal youve danced the evning away before each silvery star fades out of sight please give me one little kiss then let us whisper goodnight its getting lat and dear your pillows waitin sleepy time gal when all your dancin is through sleepy time gal ill find a cottage for you youll learn to cook and to sew whats more youll love it i know when youre a stay at home play at home eight oclock sleepy time gal","Sleepy Time Gal","1956"
"Don Cherry","you are my sunshine my only sunshine you make me happy when skies are grey youll never know dear how much i love you please dont take my sunshine away the other night dear as i lay sleeping i dreamed i held you in my arms when i awoke dear i was mistaken and i hung my head and cried you are my sunshine my only sunshine you make me happy when skies are grey youll never know dear how much i love you please dont take my sunshine away ill always love you and make you happy if you will only say the same but if you leave me to love another youll regret it all some day you are my sunshine my only sunshine you make me happy when skies are grey youll never know dear how much i love you please dont take my sunshine away you told me once dear you really loved me and no one else dear could come between but now youve left me and love another you have shattered all my dreams you are my sunshine my only sunshine you make me happy when skies are grey youll never know dear how much i love you please dont take my sunshine away","You Are My Sunshine","1991"
"Don Cherry","i love you for sentimental reasons i hope you do believe me ill give you my heart i love you and you alone were meant for me please give your loving heart to me and say well never part i think of you every morning dream of you every night darling im never lonely whenever you are in sight i love you for sentimental reasons i hope you do believe me ive given you my heart i love you for sentimental reasons i hope you do believe me ive given you my heart","I Love You for Sentimental Reasons","1995"
"Don Cherry","each time i see a crowd of people just like a fool i stop and stare its really not the proper thing to do but maybe youll be there i go out walking after midnight along the lonely thoroughfare its not the time or place to look for you but maybe youll be there you said your arms would always hold me you said your lips were mine alone to kiss now after all those things you told me how can it end like this some day if all my prayers are answered ill hear a footstep on the stair with anxious heart ill hurry to the door and maybe youll be there you said your arms would always hold me you said your lips were mine alone to kiss now after all those things you told me how can it end like this some day if all my prayers are answered ill hear a footstep on the stair with anxious heart ill hurry to the door and maybe youll be there and maybe youll be there","Maybe You'll Be There","1995"
"Don Cherry","and now the end is near and so i face the final curtain my friend ill say it clear ill state my case of which im certain ive lived a life thats full ive traveled each and every highway and more much more than this i did it my way regrets ive had a few but then again too few to mention i did what i had to do and saw it through without exemption i planned each charted course each careful step along the byway but more much more than this i did it my way yes there were times im sure you knew when i bit off more than i could chew but through it all when there was doubt i ate it up and spit it out i faced it all and i stood tall and did it my way ive loved ive laughed and cried ive had my fill my share of losing and now as tears subside i find it all so amusing to think i did all that and may i say not in a shy way no oh no not me i did it my way for what is a man what has he got if not himself then he has naught to say the things he truly feels and not the words of one who kneels the record shows i took the blows and did it my way","My Way","1995"
"Don Cherry","its quarter to three theres no one in the place except you and me so set em up joe i got a little story you oughta know were drinkin my friend to the end of a brief episode make it one for my baby and one more for the road i got the routine so drop another nickel in the machine im feelin so bad wish youd make the music pretty and sad could tell you a lot but youve got to be true to your code so make it one for my baby and one more for the road youd never know it but buddy im a kind of poet and i got a lot of things to say and when im gloomy you simply gotta listen to me till its all talked away well thats how it goes and joe i know your gettin pretty anxious to close so thanks for the cheer i hope you didnt mind my bendin your ear this torch that i found must be drowned or it soon might explode so make it one for my baby and one more for the road that long long road","One for My Baby (And One More for the Road)","1995"
"Don Cherry","well its cloudy in the morning gonna be raining in the afternoon cloudy in the morning and its gonna be raining in the afternoon if you dont like this rainy weather you better pack your bags and move but if youre running from it brother the only road that i can see if youre running from it brother the only road that i can see is the road that leads to nowhere and nowhere is a fool like me rain keep a falling falling round my window pane rain keep a falling falling round my window pane aint never seen so much rainy weather guess ill never see the sun again save those dimes and nickels save em for a rainy day save your dimes and nickels save em for a rainy day it aint gonna keep the rain from coming but at least you know youve paid your way rain rain rain keep a falling","Rainy Day Blues","1995"
"Don Cherry","red sails in the sunset way out on the sea please carry my loved one home safely to me he sailed at the dawning all day ive been blue red sails in the sunset im trusting in you swift wings you must borrow make straight for the shore we marry tomorrow then she goes sailing no more red sails in the sunset way out on the sea please carry my loved one home safely to me swift wings you must borrow make straight for the shore we marry tomorrow then she goes sailing no more red sails in the sunset way out on the sea please carry my loved one home safely to me please carry my loved one home safely to me","Red Sails in the Sunset","1995"
"Don Cherry","the evening breeze caressed the trees tenderly the trembling trees embraced the breeze tenderly then you and i came wanderin by and lost in a sigh were we the shore was kissed by sea and mist tenderly i cant forgert how two hearts met breathlessly your arms opened wide and closed me inside you took my lips you took my love so tenderly the shore was kissed by sea","Tenderly","1995"
"Don Cherry","in the hustle of the day were all inclined to miss little things that mean so much a word a smile and a kiss when a woman loves a man hes a hero in her eyes and a hero he can always be if hell just realise she may be weary women do get weary wearing the same shabby dress and when shes weary try a little tenderness she may be waiting just anticipating things she may never possess while shes without them try a little tenderness its not just sentimental she has her grief and her care but a word thats soft and gentle makes it easier to bear you wont regret it women dont forget it love is their whole happiness and its all so easy try a little tenderness","Try a Little Tenderness","1995"
