"Band","Lyrics","Song","Year"
"Dr. Dre","woooooooooo cmon uhh clap one two three and to the fo girl drop ya body break it down to the flo whoa cool and dre yall did it again uh get naughty go hisp a lil mo wooooo whattup dre go grab somebody shake ya ass some mo listen grab somebody shake ya ass some mo i see you cali grab somebody shake ya ass some mo uh grab somebody shake ya ass some mo uh grab somebody shake ya ass some mo uh i dont know what youve been told but im back bitches yep im back niggaz yeah im hearin rumors that my house foreclosed so i pack a bag and build a crib with mo woo mo rooms with mo space you like dat mo shoes its okay go buy dat i been settin trends befo this rap shit and i been gettin bread befo you dont know nann bitch uhh now its so fine you know im always into somethin sittin on some crispy chrome right twenty fos like a strobe light your girl trina got a ninja that can go the whole night vrooooooooom uhh you hear that sound thats the bentley gt coupe stare that down doin a buck fifty shift the gear back down on my way to free{ } im fin to tear that down now one two three and to the fo girl drop ya body break it down to the flo whoa get naughty go hisp a lil mo go grab somebody shake ya ass some mo grab somebody shake ya ass some mo grab somebody shake ya ass some mo grab somebody shake ya ass some mo grab somebody shake ya ass some mo i know you like the way its goin down tonight the djs in the groove and shit it sounds so right hold up its amazin so so contagious im so impatient my bodys on fire so stop your pacin dont keep me waitin homey grab my waist set my body on fire i dont need to drink just to get loose all it takes a big woo and guess who ima stay witcha we can do it all night i aint playin witcha your girl got it bad got to work it out put you on your back its a fact yeah i could turn you out now roll it up we could burn it out get your stamina up cmon lemme hear you count woo motherfuckers love the way i swing my ass up and bitches hate to see me when i tip my glass up but i dont give a fuck im up in v i p drunk off v s o p you know how we stunt take the diamond princess for play play ill do you worser than they did that dumb bitch on dre day uhh the west coast call me yay yayyy im from miami dade where they sip the ye ye uhh trina best believe i keep a rubber band full of hundreds in between i hit the scene with a million dollar dream i triple the scene covers of the magazines fly overseas ride in the limousine try shittin on me ill put yo ass to sleep try findin a bitch that can go harder than me why try cause aint nobody hotter than me now","Sum Mo","2005"
"Dr. Dre","california love california knows how to party california knows how to party in the city of l a in the city of good ol watts in the city the city of compton we keep it rockin we keep it rockin now let me welcome everybody to the wild wild west a state thats untouchable like elliot ness the track hits ya eardrum like a slug to ya chest pack a vest for your jimmy in the city of sex we in that sunshine state with a bomb ass hemp beat the state where ya never find a dance floor empty and pimps be on a mission for them greens lean mean money makin machines serving fiends i been in the game for ten years making rap tunes ever since honeys was wearing sassoon now its 95 and they clock me and watch me diamonds shinin lookin like i robbed liberace its all good from diego to the bay your city is the bomb if your city making pay throw up a finger if ya feel the same way dre putting it down for californ i a california california knows how to party knows how to party california west coast knows how to party yes they do thats right in the city of l a city of l a in the city of good ol watts good ol watts in the city the city of compton city of compton we keep it rockin we keep it rockin come on come on come on shake it shake it baby shake it shake it shake it baby shake it shake it mama shake it cali shake it shake it baby thats right uh shake it shake it baby baby shake it shake it mama shake it cali out on bail fresh outta jail california dreaming soon as i stepped on the scene im hearing hoochies screamin fiendin for money and alcohol the life of a west side player where cowards die and its all war only in cali where we riot not rally to live and die in l a we wearing chucks not ballies thats right uh dressed in locs and khaki suits and ride is what we do flossing but have caution we collide with other crews famous cause we program worldwide letem recognize from long beach to rosecrans bumping and grinding like a slow jam its west side so you know the row wont bow down to no man say what you say but give me that bomb beat from dre let me serenade the streets of l a from oakland to sactown the bay area and back down cali is where they put they mack down cali love california california knows how to party california knows how to party come on baby in the city south central of l a l a in the city of good ol watts uh thats right in the city the city of compton yup yup we keep it rocking we keep it rocking yeah yeah now make it shake cmon shake it shake it baby uh shake it shake it shake it baby yeah shake it shake it mama shake it cali shake it cali shake it shake it baby shake it cali shake it shake it shake it shake it mama west coast shake it cali uh yeah uh long beach in the house uh yeah oaktown oakland definitely in the house frisko frisko hey you know la is up in this pasadena where you at yeah inglewood inglewood always up to no good tupac even hollywood trying to get a piece baby sacramento sacramento where ya at yeah throw it up yall throw it up throw it up i cant see ya california love lets show these fools how we do this on that west side cause you and i know its the best side yeah thats right west coast west coast uh california love california love yeah just cmon shake shake it baby baby baby shake it mama shake it mama shake it mama rector scale talkin bout our earthquake on the rector scale city of compton city of compton where the girls shake their booties shake it mama shake it baby shake shake it baby shake shake it computer dribble dribble","California Love [Enhanced Stereo][Mix][Multimedia Track]","2005"
"Dr. Dre","creepin down the back street on these i got my glock cocked cause niggas want these now soon as i said it seems i got sweated by some nigga with a tech 9 tryin to take mine ya want to make noise make noise i make a phone call my niggas comin like the gotti boys bodies bein found on greenleaf with their fucking heads cut off motherfucker im dre so listen to the play by play day by day rollin in my 4 with 16 switches and got sounds for the bitches clockin all the riches got the hollow points for the snitches so would you just walk on by cause im too hard to lift and no this aint aerosmith its the motherfucking d are e from the cpt on a ryhmin spree a straight g hop back as i pop my top ya trip i let the hollow points commence to pop pop pop yeah cause if it dont stop i have to put my shit in reverse go back and take anothers stop cause im rollin in my six fo with all the niggas saying swing down sweet chariot stop and let me ride hell yeah swing down sweet chariot stop and let me ride with all the niggas saying swing down sweet chariot stop and let me ride hell yeah swing down sweet chariot stop and let me ride just another motherfucking day for dre so i begin like this no medallions dreadlocks or black fists its just that gangster glare with gangster raps that gangster shit that makes the gang of snaps word to the motherfucking streets and word to these hyped ass lyrics and dope beats that i hit ya with that i get ya with as i groove in my four on these hitting the switches bitches relax while i get my proper swerve on bumping like a motherfucker ready to get my serve on but before i hit the dope spot i gotta get the chronic the reme martin and my soda pop now im smelling like indo nesia bus stop full of fly bitches and skeezers on my dick cause my four on hit pancake front and back side to side and all that shit so when i crawl i comes correct now if your bitch in my shit its your bitch you check nigga now let the chevrolet slide as i dip a nigga trip to the south side yeah rollin in my six fo with all the bitches sayin swing down sweet chariot stop and let me ride hell yeah swing down sweet chariot stop and let me ride with all the niggas saying swing down sweet chariot stop and let me ride hell yeah swing down sweet chariot stop and let me ride check this out the sun went down when i hit slausson on my way to the strip now im just flossing checking my rear view cause niggas they will do jack moves black fools cause i smack fools try to set me up for a two eleven fuck around and get caught up in a one eight seven but i dont represent no gangbang some niggas like lynching but i just watch them hang so on and so on why dont you let me roll on i remember back in the days when i used to have to get my stroll on didnt nobody wanna speak now everybody peeping out they windows when they hear me beating up the streets is it dre is it dre thats what they say every single motherfucking day yo but i aint tripping im just kicking it while my ds keep spinning and these hoes keep grinning ill be rollin in my six fo with everybody saying swing down sweet chariot stop and let me ride hell yeah swing down sweet chariot stop and let me ride with all the niggas saying swing down sweet chariot stop and let me ride hell yeah swing down sweet chariot stop and let me ride","Let Me Ride [DVD]","2005"
"Dr. Dre","creepin down the back street on these i got my glock cocked cause niggas want these now soon as i said it seems i got sweated by some nigga with a tech 9 tryin to take mine ya want to make noise make noise i make a phone call my niggas comin like the gotti boys bodies bein found on greenleaf with their fucking heads cut off motherfucker im dre so listen to the play by play day by day rollin in my 4 with 16 switches and got sounds for the bitches clockin all the riches got the hollow points for the snitches so would you just walk on by cause im too hard to lift and no this aint aerosmith its the motherfucking d are e from the cpt on a ryhmin spree a straight g hop back as i pop my top ya trip i let the hollow points commence to pop pop pop yeah cause if it dont stop i have to put my shit in reverse go back and take anothers stop cause im rollin in my six fo with all the niggas saying swing down sweet chariot stop and let me ride hell yeah swing down sweet chariot stop and let me ride with all the niggas saying swing down sweet chariot stop and let me ride hell yeah swing down sweet chariot stop and let me ride just another motherfucking day for dre so i begin like this no medallions dreadlocks or black fists its just that gangster glare with gangster raps that gangster shit that makes the gang of snaps word to the motherfucking streets and word to these hyped ass lyrics and dope beats that i hit ya with that i get ya with as i groove in my four on these hitting the switches bitches relax while i get my proper swerve on bumping like a motherfucker ready to get my serve on but before i hit the dope spot i gotta get the chronic the reme martin and my soda pop now im smelling like indo nesia bus stop full of fly bitches and skeezers on my dick cause my four on hit pancake front and back side to side and all that shit so when i crawl i comes correct now if your bitch in my shit its your bitch you check nigga now let the chevrolet slide as i dip a nigga trip to the south side yeah rollin in my six fo with all the bitches sayin swing down sweet chariot stop and let me ride hell yeah swing down sweet chariot stop and let me ride with all the niggas saying swing down sweet chariot stop and let me ride hell yeah swing down sweet chariot stop and let me ride check this out the sun went down when i hit slausson on my way to the strip now im just flossing checking my rear view cause niggas they will do jack moves black fools cause i smack fools try to set me up for a two eleven fuck around and get caught up in a one eight seven but i dont represent no gangbang some niggas like lynching but i just watch them hang so on and so on why dont you let me roll on i remember back in the days when i used to have to get my stroll on didnt nobody wanna speak now everybody peeping out they windows when they hear me beating up the streets is it dre is it dre thats what they say every single motherfucking day yo but i aint tripping im just kicking it while my ds keep spinning and these hoes keep grinning ill be rollin in my six fo with everybody saying swing down sweet chariot stop and let me ride hell yeah swing down sweet chariot stop and let me ride with all the niggas saying swing down sweet chariot stop and let me ride hell yeah swing down sweet chariot stop and let me ride","Let Me Ride [Enhanced Stereo][Multimedia Track]","2005"
"Dr. Dre","california love california knows how to party california knows how to party in the city of l a in the city of good ol watts in the city the city of compton we keep it rockin we keep it rockin now let me welcome everybody to the wild wild west a state thats untouchable like elliot ness the track hits ya eardrum like a slug to ya chest pack a vest for your jimmy in the city of sex we in that sunshine state with a bomb ass hemp beat the state where ya never find a dance floor empty and pimps be on a mission for them greens lean mean money makin machines serving fiends i been in the game for ten years making rap tunes ever since honeys was wearing sassoon now its 95 and they clock me and watch me diamonds shinin lookin like i robbed liberace its all good from diego to the bay your city is the bomb if your city making pay throw up a finger if ya feel the same way dre putting it down for californ i a california california knows how to party knows how to party california west coast knows how to party yes they do thats right in the city of l a city of l a in the city of good ol watts good ol watts in the city the city of compton city of compton we keep it rockin we keep it rockin come on come on come on shake it shake it baby shake it shake it shake it baby shake it shake it mama shake it cali shake it shake it baby thats right uh shake it shake it baby baby shake it shake it mama shake it cali out on bail fresh outta jail california dreaming soon as i stepped on the scene im hearing hoochies screamin fiendin for money and alcohol the life of a west side player where cowards die and its all war only in cali where we riot not rally to live and die in l a we wearing chucks not ballies thats right uh dressed in locs and khaki suits and ride is what we do flossing but have caution we collide with other crews famous cause we program worldwide letem recognize from long beach to rosecrans bumping and grinding like a slow jam its west side so you know the row wont bow down to no man say what you say but give me that bomb beat from dre let me serenade the streets of l a from oakland to sactown the bay area and back down cali is where they put they mack down cali love california california knows how to party california knows how to party come on baby in the city south central of l a l a in the city of good ol watts uh thats right in the city the city of compton yup yup we keep it rocking we keep it rocking yeah yeah now make it shake cmon shake it shake it baby uh shake it shake it shake it baby yeah shake it shake it mama shake it cali shake it cali shake it shake it baby shake it cali shake it shake it shake it shake it mama west coast shake it cali uh yeah uh long beach in the house uh yeah oaktown oakland definitely in the house frisko frisko hey you know la is up in this pasadena where you at yeah inglewood inglewood always up to no good tupac even hollywood trying to get a piece baby sacramento sacramento where ya at yeah throw it up yall throw it up throw it up i cant see ya california love lets show these fools how we do this on that west side cause you and i know its the best side yeah thats right west coast west coast uh california love california love yeah just cmon shake shake it baby baby baby shake it mama shake it mama shake it mama rector scale talkin bout our earthquake on the rector scale city of compton city of compton where the girls shake their booties shake it mama shake it baby shake shake it baby shake shake it computer dribble dribble","California Love [Original Version][Version]","2006"
"Dr. Dre","youre back now at the jack off hour this is dj eazy dick on w balls right now something new by snoop doggy dogg and this one goes out to the ladies from all the guys a big bow wow wow cause we gonna make it a little mystery here tonight this is dj eazy dick on the station that slaps you across your fat ass with a fat dick when i met you last night baby before you opened up your gap i had respect for ya lady but now i take it all back cause you gave me all your pussy and ya even licked my balls leave your number on the cabinet and i promise baby ill give ya a call next time im feeling kinda horny you can come on over and ill break you off and if you cant fuck that day baby just lay back and open your mouth cause i have never met a girl that i love in the whole wide world well if kurupt gave a fuck about a bitch id always be broke id never have no motherfucking indo to smoke i gets loced and looney bitch you cant do me do we like bbd you hoochie groupie i have no love for hoes thats something i learned in the pound so how the fuck am i supposed to pay this hoe just to lay this hoe i know the pussys mines ima fuck a couple more times and then im through with it theres nothing else to do with it pass it to the homie now you hit it cause she aint nothing but a bitch to me and yall know that bitches aint shit to me i gives a fuck why dont yall pay attention approach it with a different proposition im kurupt hoe youll never be my only one trick ass bitch it aint no fun if the homies cant have none guess who back in the motherfucking house with a fat dick for your motherfucking mouth hoes recognize niggas do too cause when bitches get skinless and pull a voodoo what you gon do you really dont know so id advise you not to trust that hoe silly of me to fall in love with a bitch knowing damn well im too caught up with my grip now as the sun rotates and my game grows bigger how many bitches want to fuck this nigga named snoop doggy im all the above im too swift on my toes to get caught up with you hoes but see it aint no fun if my homies cant get a taste of it cause you know i dont love em whoa hey now ya know inhale exhale with my flow one for the money two for the bitches three to get ready and four to hit the switches in my chevy six fo rad to be exact with bitches on my side and bitches on back so back up bitch cause im struggling so get off your knees and then start juggling these motherfucking nuts in your mouth its me warren g the nigga with the clout it aint no fun if the homies cant have none","Ain't No Fun","2006"
"Dr. Dre","wed like to welcome yall to the fabulous carolina west i own this motherfucker and my name is taa dow yall niggas know who i am yall niggas tearing up shit but we got something old and something new for yall tonight put your hands together for snoop doggy dogg the dogg pound and the fabulous dramatics its like everywhere i look and everywhere i go im hearing motherfuckers trying to steal my flow but it aint no thing cause see my nigga coolio put me up on the game when i step through the do ya know some of these niggas is so deceptive using my styles like a contraceptive i hope ya get burnt it seems ya havent learnt its the nick nack patty wack i still got the bigger sack so put your gun away run away cause im back why hit em up get em up spit em up now tell me whats going on it make me want to holler cause my dollars come in ozones lone for the break up so take off your clothes and quit trying to spit at my motherfucking hoes seaking of hoes ill get to the point you think you got the bomb cause i rolled you a joint youse a flea and im the big dogg ill scratch you off my balls with my motherfucking paws yalls niggas better recognize and see where im coming from its still east side till i die why ask why as the world keeps spinning to the d o double g why its a crazy mixed up world its a doggy dogg world its a doggy dogg world its a doggy dogg world the doggs world well if you give me ten bitches then ill fuck all ten see my homey snoop doggy sipping juice and gin dont slip im fo to set trip to get papers styles vary packing flavor like life savors aint that something talk shit and im dumping i had your whole fucking block bumping dont sweat but check the technique im unique like china ya never find the bomb a rama then this nigga behind ya so peek a boo clear the way im coming through one two three you cant see me im a g like that strapped with hit hard tactics a fucking menace using hoes like tennis rackets its on again its on and popping all i see is green so there aint no stopping i want to see some panties dropping im coming from l a she used to chill with dre up in compton all i ever did was just use that hoe show her my dickies get with these and kick flows im dishing out blues im upsetting like bad news cut off khakis french braids and house shoes kurupt the names often marked for catching slugs and i smoke weed for the fuck of it ruff and rugged shit its unexplanitory how i gets wicked but its mandatory that i kick it check it im runnin hoes in 94 now must i prove it hoes call me sugar ray for the way i be sticking and moving prepare for a war its on im head hunting hit the button and light shit up like red dawn peep the massacre from a verbal assassin murdering with rhymes packing tec 9s for some action you really dont know do you you fucking with a hog you cant do me im going out looney like o dog tha dogg pound rocks the party all night long tell when till the early morn it dont stop and uh it dont quit for the the dogg pound clique to drop the cavvy dogg shit diggity daz out of the motherfucking cut once mo so grab a seat and grab your gin and juice and check out the flow i flip flop and serve hoes with a fat dick till i die im still screaming that bitches aint shit now im the mack daddy had he not known about the city where im from dumb diddy dumb as you groove to the gangster shit the d o double g the p o you n d the gangsta clique now as the pound break it down with the gangsta funk i can see and i can tell thats what the fuck you want so i blaze up the chronic so i can get high i promise ill smoke chronic till the day that i die","Doggy Dogg World","2006"
