"Band","Lyrics","Song","Year"
"Mongo Santamaría","got a good reason for taking the easy way out got a good reason for taking the easy way out now she was a day tripper one way ticket yeah it took me so long to find out and i found out shes a big teaser she took me half the way there shes a big teaser she took me half the way there now she was a day tripper one way ticket yeah it took me so long to find out and i found out ah ah ah ah ah ah tried to please her she only played one night stand tried to please her she only played one night stand now she was a day tripper sunday driver yeah it took me so long to find out and i found out day tripper day tripper yeah day tripper day tripper yeah day tripper day tripper yeah","Day Tripper","1997"
"Mongo Santamaría","you know when you say your marriage vows theyre supposed to be for real i mean if you think back about what you really said what its all about honor loving and obeying till death do us part and all but it shouldnt be that way it should it should it should be lies because it turns out to be lies if you dont honor what you said you lie to god the words should be changed ooo now as i recall we tried a million times again and again and again and that isnt all i gave my love to you each time to make amends suddenly i start to realize i cant make it pretty birds fly away i had to leave you for my healths sake what to do make you pay for leaving you my fine is to pay forever so if a fresh new love comes in i wont say those words again instead ill say ill try to love and protect you with all my heart as long as you want me to baby ooo if i love again im gonna try a new way this time memories of the things we did some were proud of some we hid so when two people have to part sometimes it makes them stronger do you remember all of the fights we had you say you love me with all your heart if you ever loved me will all of your heart youd never take 1 million to part i really tried you know i tried oh baby although we tried all of those promises was nothin but lies i really tried you know how i tried we really lied didnt we baby and on top of that you have scared the life my name but i cant understand cause if you love me how could you turn me into nothin least didnt i love you good and try to take care of you best i could you were so inviting and your love was like mellow wine pains of love miles of tears after lasting for my lifetime broken hearts last for years and break away to the blue day sunshine one thing i can promise friend ill never be back again but were not really bitter babe i promise you all the love in the world good love in the world but i know youll never be satisfied just to have me by your side memories haunt you all the time i will never leave youre mine god judged me on his side youve said bad things and youve lied still i remember some of the good things baby of love after dark and picnics in parks those are the days id love to get in my life id rather remember remember the joy we shared babe id rather remember all the fun we had all i ever really wanted was to love you and treat you right all we did was fuss and fight it dont matter baby take a lesson from them all i never thought id see the day when youd put me through what you put me through you try your best you say i gave you no rest when did you stop loving me when did i stop loving you when did you stop loving me when did i stop loving you when did you stop loving me when did i stop loving you when did you stop loving me when did i stop loving you","When Did You Stop Loving Me, When Did I Stop Loving You","1998"
"Mongo Santamaría","bailia baila simon ven a balailar mi son simon","Baila Simon","1999"
"Mongo Santamaría","lord have you ever been mistreated then you got to you got to know just what im talking about yes have you ever been mistreated then you got to you got to know just what im talking about lord i work five long years for one woman and she had the nerve to kick me out i got a job at a steel mill im shucking steel just like a slave five long years every friday yall i went straight home yeah i went straight home mistreated then you got to you got to know just what im talking about lord i work five long years for one woman and she had the nerve to kick me out lord but i finally learned a lesson i should have known long time ago the next woman i marry she gotta have two jobs and she gotta go out and work long and bring some dough lord said i been mistreated and you got to you got to know just what im talking about lord i work five long years for one woman and she had the nerve to kick me out have you ever been mistreated then you got to you got to know just what im talking about yes have you ever been mistreated then you got to you got to know just what im talking about lord i work five long years for one woman and she had the nerve to kick me out i got a job at a steel mill im shucking steel just like a slave five long years every friday yes yoall i went straight home i went straight home with all my pay yes ive been mistreated and you got to you got to know just what im talking about lord i work five long years for one woman and she had the nerve to kick me out lord i finally learned a lesson i should have known a long time ago the next woman i marry she gotta have two jobs and she gotta go out and work and bringing home some dough ive been mistreated yeah and you you know just what im talking about i work five long years for one woman and she had the nerves to kick me out","5 Long Years","2001"
"Mongo Santamaría","when my baby she left me she left me with a mule to ride when my baby she left me she left me with a mule to ride when her train left the station that old mule laid down and died man i sent this woman a brand new twenty dollar bill lord i sent that woman a brand new twenty dollar bill now if that dont bring her back im sure this old shotgun will lake michigan aint no river chicago aint no hill town lake michigan aint no river chicago aint no hill town if i feel like this tomorrow im gonna clear out be back down memphis bound ill be standing down on the landing when the big boat pull off and roll ill be standing on the landing when the big boat pull off and roll ill be hopin and ill be prayin that i never see your face no more when my baby left me she left me with a mule to ride when my baby she left me she left me with a mule to ride when her train left the station that old mule laid down and died lord i sent that woman a brand new twenty dollar bill man i sent my baby a brand new twenty dollar bill now if that dont bring her back im sure my shotgun will","My Baby She Left Me","2001"
"Mongo Santamaría","shake it baby shake it baby shake it baby ill buy you a diamond ring if you dont shake it baby aint gonna buy you a doggone thing shake it baby ill buy you a beautiful dress shake it baby ill buy you a beautiful dress if you dont shake it now baby you aint gonna have no happiness and when i sleep you sleep and when i talk you talk and when i walk you walk and when i eat you eat and when i fight you fight and come on baby the moment i shake it baby shake it baby shake it baby ill buy you a diamond ring if you dont shake it now baby aint gonna buy you a doggone thing shake it baby ill buy you a beautiful dress shake it baby ill buy you a beautiful dress if you dont shake it now baby you wont have no happiness and when i walk you walk and when i talk you talk and when i sleep you sleep baby and when i eat you eat and when i fight you fight and come on come on come on come on come on come on and when i scratch you scratch and when i itch you better itch some too and when i tell that i love you better tell me you love me too come on come on its all right shake it baby shake it baby shake it baby shake it baby shake it baby shake it baby shake it baby shake it baby shake it baby shake it baby shake it baby shake it baby","Shake It Baby","2001"
"Mongo Santamaría","i woke up early this mornin i was feelin kind of blue my landlady said you got a letter here and i began to sing the blues it was from my brother dont you know the boys laying down in vietnam lord they say you dont have no reason to fight baby but lord knows you think youre right but you got to be wrong dont you hear me you got to be wrong now pick up you wake up early in the mornin baby and you dont have nothin to eat you cant buy yourself no clothes baby lord knows who can you meet my brothers in vietnam people dont you know just why im singin these blues you might have no respect for your country darlin but thats why thats why im singin these blues you better pick up baby and get with it you hear me looka here the mothers all the wives all the fathers that have sons in vietnam you hear me this is to you always oh im gonna wake up early in the mornin people im bout to go out of my god darn mind lord im gonna wake up early in the mornin people im bout to go out of my god darn mind its so sad its so sad to think about your people lord when the other man thinks theyre wrong youre not right baby hear this just before i go lord i woke up in the mornin youre gonna look up youre gonna look up and find yourself gone lord i woke up this mornin youre gonna look up and find yourself gone how would you feel if it was your brother over there eh how would you feel lord then youre gonna ask the good lord to forgive you please forgive me for my sins","Vietcong Blues","2001"
"Mongol","quando sei qui con me questa stanza non ha piu pareti ma alberi alberi infiniti quando sei qui vicino a me questo soffitto viola no non esiste piu io vedo il cielo sopra noi che restiamo qui abbandonati come se non ci fosse piu niente piu niente al mondo suona unarmonica mi sembra un organo che vibra per te e per me su nellimmensita del cielo per te per me nel cielo","Il Cielo in Una Stanza","1999"
"Mongol800","dont worry be happy its my life 2 happy lunch time 2 2 dont worry be happy happy sunday its my life dont worry be happy happy sunday its my life dont worry be happy happy sunday its my life dont worry be happy happy sunday its my life with one more time dont worry be happy happy sunday its my life dont worry be happy happy sunday its my life","Don't Worry Be Happy","2000"
"Monia Liter","i dont need your photograph to keep by my bed your picture is always in my head i dont need you portrait dear to call you to mind for sleeping or waking dear i find the very thought of you and i forget to do the little ordinary things that everyone ought to do im living in a kind of daydream im happy as a king and foolish though it may seem why to me thats everything the mere idea of you the longing here for you youll never know how slow the moments go till im near to you i see your face in every flower your eyes in stars above its just the thought of you the very thought of you my love the mere idea of you the longing here for you youll never know how slow the moments go till im near to you i see your face in every flower your eyes in stars above its just the thought of you the very thought of you my love","The Very Thought of You","1993"
"Monia Liter","twas on the isle of capri that i found her beneath the shade of an old walnut tree oh i can still see the flowers blooming round her where we met on the isle of capri she was as sweet as the rose of the dawning but somehow fate hadnt meant her for me and tho i sailed with the tide in the morning still my hearts on the isle of capri summertime was nearly over blue italian skies above i said lady im a rover can you spare a sweet word of love she whispered softly tis best not to linger then as i kissed her hand i could see she wore a plain golden ring on her finger twas good bye to the isle of capri","Isle of Capri","2001"
"Monia Liter","all i do is dream of you the whole night thru with the dawn i still go on and dream of you youre every thought youre every thing youre every song i ever sing summer winter autumn and spring and were there more than twenty four hours a day theyd be spent in sweet content dreaming away when skies are grey when skies are blue morning noon and night time too all i do the whole day thru is dream of you all i do is dream of you the whole night thru with the dawn i still go on and dream of you youre every thought youre every thing youre every song i ever sing summer winter autumn and spring and were there more than twenty four hours a day theyd be spent in sweet content dreaming away when skies are grey when skies are blue morning noon and night time to","All I Do Is Dream of You","2003"
"Monia Liter","the very thought of you and i forget to do the little ordinary things that everyone ought to do im living in a kind of daydream im happy as a king and foolish though it may seem to me thats everything the mere idea of you the longing here for you youll never know how slow the moments go till im near to you i see your face in every flower your eyes in stars above its just the thought of you the very thought of you my love the mere idea of you the longing here for you youll never know how slow the moments go till im near to you i see your face in every flower your eyes in stars above its just the thought of you the very thought of you my love","The Very Thought of You [Alternate Take][#]","2003"
"Monia Liter","you oughta be in pictures youre wonderful to see you oughta be in pictures oh what a hit you would be your voice would thrill a nation your face would be adored youd make a great sensation with wealth and fame your reward and if you should kiss the way you kiss when were alone youd make evry girl and man a fan worshiping at your throne you oughta shine as brightly as jupiter and mars you oughta be in pictures my star of stars","You Oughta Be in Pictures","2003"
"Monia Liter","you oughta be in pictures youre wonderful to see you oughta be in pictures oh what a hit you would be your voice would thrill a nation your face would be adored youd make a great sensation with wealth and fame your reward and if you should kiss the way you kiss when were alone youd make evry girl and man a fan worshiping at your throne you oughta shine as brightly as jupiter and mars you oughta be in pictures my star of stars","You Ought to Be in Pictures","2008"
"Monica","now heres the situation lack of communication its tearing our love apart you play me like a ninny cause i wont give you any now you wont call me at all but if you want me yeah ill be there in a minute if you need me ill show you i care for you and ill always always ill always gonna be there for you oh oh ah love me yeah boy ill be your angel love me baby love me yeah boy ill be your angel angel baby so much for your commitment you told me you were different from all the creeps that i know though you say you love me that dont make it right if you aim boy then ill promise you all of me but if you want me ill be there in a minute if you need me ill show you i care for you and ill always always ill always gonna be there for you oh oh yeah love me yeah boy ill be your angel love me baby love me yeah boy ill be boy ill be boy ill be your angel angel baby love me im your angel everyone needs an angel let me be yours sho nuff special sho nuff sho nuff your so special to me sho nuff special so special your so special to me love me yeah boy ill be your angel ill be your ill be you angel love me yeah boy ill be your angel angel baby love me yeah boy ill be your angel ill be your ill be you angel love me yeah boy ill be your angel angel baby","Angel","1995"
"Monica","here we are face to face with the memries that cant be erased although we need each other things have changed its not the same sometimes it makes me wonder where would i be if you hadnt discovered reaching deep inside of me i know there was something that we could compare well i never meant to cause you no pain i just wanna go back to being the same and i only wanna make things right before you walk out of my life remembering the good times from a portrait hung on high its filled with so much color and the laughter we left behind i made the choice when you couldnt decide i made the choice i was wrong you were right deep down inside i apologize never meant to cause you no pain i just wanna go back to being the same well i only wanna make things right before you walk out of my life well i never meant to cause you no pain i just wanna go back to being the same well i only wanna make things right before you walk out of my life so ill make plans with you to always have time for you before you walk out of my life i guess its true can not live without you dont ever go away oh yeah never meant to cause you no pain i just wanna go back to being the same well i only wanna make things right before you walk out of my life never meant to cause you no pain i just wanna go back to being the same well i only wanna make things right before you walk out of my life well i never meant to cause you no pain i just wanna go back to being the same well i only wanna make things right before you walk out of my life","Before You Walk out of My Life","1995"
"Monica","its just one of them days when i wanna be all alone its just one of them days when i gotta be all alone its just one of them days dont take it personal i just wanna be all alone and you think i treat you wrong i wanna take some time out to think things through i know it always feels like im doing you wrong but im so in love with you so understand that im only in love your the only one i need so have no thought that i want to leave and baby trust me please just one of them days that a girl goes through when im angry inside dont want to take it out on you just one of them days dont take it personal i just wanna be all alone and you think i treat you wrong dont take it personal baby baby baby baby dont take it personal i see and i think about every thing we do and i find myself in misery and that aint cool hey now i really want to be with you the whole way through but the way you make me feel inside keeps me confused as i swing back from mood to mood its not because of you i never want you to be insecure so wont you understand that im only in love your the only one i need ill be there for you when you need me boy so baby dont you leave just one of them days that a girl goes through when im angry inside dont want to take it out on you just one of them days dont take it personal i just wanna be all alone and you think i treat you wrong just one of them days that a girl goes through when im angry inside dont want to take it out on you just one of them days dont take it personal i just wanna be all alone and you think i treat you wrong dont take it personal baby baby baby baby dont take it personal dont take it personal yeah dont take it personal just one of them days that a girl goes through when im angry inside dont want to take it out on you just one of them days dont take it personal i just wanna be all alone and you think i treat you wrong dont take it personal baby personal baby personal baby personal baby personal baby personal baby","Don't Take It Personal (Just One of Dem Days)","1995"
"Monica","its just one of them days when i wanna be all alone its just one of them days when i gotta be all alone its just one of them days dont take it personal i just wanna be all alone and you think i treat you wrong i wanna take some time out to think things through i know it always feels like im doing you wrong but im so in love with you so understand that im only in love your the only one i need so have no thought that i want to leave and baby trust me please just one of them days that a girl goes through when im angry inside dont want to take it out on you just one of them days dont take it personal i just wanna be all alone and you think i treat you wrong dont take it personal baby baby baby baby dont take it personal i see and i think about every thing we do and i find myself in mysery and that aint cool hey now i realy want to be with you the whole way through but the way you make me feel inside keeps me confused as i swing back from mood to mood its not because of you i never want you to be insecure so wont you understand that im only in love your the only one i need ill be there for you when you need me boy so baby dont you leave just one of them days that a girl goes through when im angry inside dont want to take it out on you just one of them days dont take it personal i just wanna be all alone and you think i treat you wrong just one of them days that a girl goes through when im angry inside dont want to take it out on you just one of them days dont take it personal i just wanna be all alone and you think i treat you wrong dont take it personal baby baby baby baby dont take it personal dont take it personal yeah dont take it personal just one of them days that a girl goes through when im angry inside dont want to take it out on you just one of them days dont take it personal i just wanna be all alone and you think i treat you wrong dont take it personal baby personal baby personal baby personal baby personal baby personal baby","Don't Take It Personal (Just One of Dem Days) [Remix]","1995"
"Monica","forever always oh baby baby lets talk it out cause youre so special and mean so much to me baby boy thereve been times you dogged me out i should have left you but stayed right by your side i chose to love you only but you wont let me you pushed my love away dont be so selfish with your love oh oh forever always im going to love you until my dying day forever always a love so special itll never fade away the other day you saw me out you had no reason to trip or have a doubt baby boy hes nothing but a friend of mine you dont have to be afraid if i ever lose you id throw my heart away i chose to love you only but youre so jealous you pushed my love away dont be so selfish with your love ooh forever always im going to love you until my dying day forever always a love so special itll never fade away babe its forever always its forever always babe its forever always forever always im going to love you until my dying day forever always a love so special itll never fade away forever always im going to love you until my dying day forever always a love so special itll never fade away","Forever Always","1995"
"Monica","i dont want to make this sound so cold but every now and then im gonna let you know oh theres gotta be something givin to me all you need to know is that im a fly young lady so do what you got to do if its me you chose but i got the oohs baby yeah hear oh im gonna give up some time if its worth my while cause its my world im playin my game you gotta get down with the way im runnin things or you wont be around you gotta get down with me me you gotta get down with the way its gotta be turn your frown to a smile you gotta get down with me me you gotta get down ooh baby oh you gotta get down with me down hey down down umm yeah you gotta get down with me me ive heard your kinda nice whats yours now its that slow take the time learn the ways then we can roll have you ever met a girl that knows her thang lookin kinda fly but baby can you swang so do what you got to do if its me you chose but i got the oohs baby i got the oohs baby im gonna give up some time if its worth my while cause its my world im playin my game you gotta get down you gotta get down you gotta get down","Get Down","1995"
"Monica","sit yourself down boy and talk to me tell me whats on your mind dont keep on telling me everythings okay cause if it was then you wouldnt be crying you been acting real funny when i see you lately sitting around poutin all day long now how in the world do you expect me to understand when i not even know whats wrong straighten it out lets straighten it out lets straighten it out baby lets straighten it out out lets straighten it out for the last few days when i saw you baby oh i admit something just wasnt right its so many things going through my head i didnt want to start another fight but if your tired of people being bothered baby in the world wed be all alone instead of being apart of a problem baby you and me oughta be getting along yeah straighten it out lets straighten it out we need to straighten it out lets straighten it out me and you you and me baby baby lets straighten it out out ah ah yeah hey lets straighten it out woo woo woo woo woo woo yeah straighten it out lets straighten it out lets straighten it out lets straighten it out baby lets straighten it out i think its time for you and me to straighten it out lets straighten it out yeah yeah yeah lets straighten it out now how in the world you expect me to understand um when i dont even know whats wrong baby baby baby straighten it out lets straighten it out yeah yeah ooh lets straighten it out can we straighten can you help me babe baby baby baby lets straighten it out can you help me sing sing it baby yeah yeah oh yeah yeah lets straighten it out lets straighten it out i want to straighten it out with you baby come on come on lets straighten it out oh yeah lets straighten it out lets straighten it out come on come on come on straighten it out lets straighten it out oh oh yeah lets straighten it out we need to straighten it out lets straighten it out lets straighten it out","Let's Straighten It Out","1995"
