"Band","Lyrics","Song","Year"
"Ambrose Orchestra","we were more than lovers we were more than sweethearts its so hard to understand dont know why it happened dont know how it started why should we be strangers after all we planned i cant show my face cant go anyplace people stop an stare its so hard to bear everybody knows you left me its the talk of the town every time we meet my heart skips a beat we dont stop to speak though its just a week everybody knows you left me its the talk of the town we send out invitations to friends and relations announcing our weddin day friends and our relations gave congratulations how can you face them what can you say lets make up sweetheart we cant stay apart dont let foolish pride keep you from my side how can love like ours be ended its the talk of the town how can you face them what can you say lets make up sweetheart we cant stay apart dont let foolish pride keep you from my side how can love like ours be ended its the talk of the town hm its the talk of the town","It's the Talk of the Town","2004"
"Ambrose Orchestra","moonlight i see millions of twinkling stars evning when a breeze becomes a sigh music i hear millions of soft guitars underneath the pampas moon where you hum a happy tune and you kiss your cares goodbye youll find your life will begin the very moment youre in argentina if youre romantic senor then you will surely adore argentina youll be as gay as can be if you will learn to si si like a latin for mister soon as you learn then you will never return to manhattan when you hear yo te amo youll still a kiss and then if she should say manana its just to let you know youre gonna meet again ill bet an old castanet that you will never forget argentina where there are rhumbas and tangos to tickle your spine moonlight and music and orchids and wine youll want to stay down argentina way youll find your way","Down Argentina Way [From Down Argentine Way]","2005"
"Ambrose Orchestra","and now the purple dusk of twilight time steals across the meadows of my heart high up in the sky the little stars climb always reminding me that were apart you wander down the lane and far away leaving me a song that will not die love is now the stardust of yesterday the music of the years gone by sometimes i wonder how i spend the lonely nights dreaming of a song the melody haunts my reverie and i am once again with you when our love was new and each kiss an inspiration but that was long ago and now my consolation is in the stardust of a song besides the garden wall when stars are bright you are in my arms the nightingale tells his fairytale of paradise where roses grew though i dream in vain in my heart it will remain my stardust melody the memory of loves refrain","Stardust","2005"
"Ambrose Orchestra","youd be so nice to come home to youd be so nice by the fire while the breeze on high sang a lullaby youd be all that i could desire under stars chilled by the winter under an august moon burning above youd be so nice youd be paradise to come home to and love under stars chilled by the winter under an august moon burning above youd be so nice youd be paradise to come home to and love","You'd Be So Nice to Come Home To","2006"
"Ambrose Orchestra","love was the thing that you wanted thats why we answered loves call now that youve got what you wanted you dont seem to want it at all careless now that youve got me loving you youre careless careless in everything you do you break up appointments and think you are smart if youre not careful youll break my heart careless now that my bridges all are burned youre careless careless in things where im concerned are you just careless as you seem to be or do you just care less for me","Careless","2006"
"Ambrose Orchestra","in a dream the strangest and the oddest things appear and what insane and silly things we do here is what i see before me vividly and clear as i recall it you were in it too i had the craziest dream last night yes i did i never dreamt it could be yet there you were in love with me i found your lips close to mine so i kissed you and you didnt mind it at all when im awake such a break never happens how long can a gal go on dreaming if theres a chance that you care then please say you do baby say it and make my craziest dream come true","I Had the Craziest Dream","2006"
"Ambrose Orchestra","ill never smile again until i smile at you ill never laugh again what good would it do for tears would fill my eyes my heart would realize that our romance is through ill never love again im so in love with you ill never thrill again to somebody new within my heart i know i will never start to smile again until i smile at you","I'll Never Smile Again","2006"
"Ambrose Orchestra","when a star is born they possess a gift or two one of them is this they have the power to make a wish come true when you wish upon a star makes no diffrence who you are anything your heart desires will come to you if your heart is in your dream no request is too extreme when you wish upon a star as dreamers do fate is kind she brings to those who love the sweet fulfillment of their secret longing like a bolt out of the blue fate steps in and sees you through when you wish upon a star your dreams come true when you wish upon a star makes no diffrence who you are anything your heart desires will come to you if your heart is in your dream no request is too extreme when you wish upon a star as dreamers do fate is kind she brings to those who love the sweet fulfillment of their secret longing like a bolt out of the blue fate steps in and sees you through when you wish upon a star your dreams come true","When You Wish Upon a Star","2006"
"Ambrose Orchestra","listen big boy now that you got me made goodness but im afraid somethins gonna happen to you listen big boy you gotta be hooked and how i would die if i should lose you now button up your overcoat when the wind is free take good care of yourself you belong to me eat an apple every day get to bed by three oh take good care of yourself you belong to me be careful crossing streets ooh ooh cut out sweets ooh ooh lay off meat ooh ooh youll get a pain and ruin your tum tum wear your flannel underwear when you climb a tree oh take good care of yourself you belong to me button up your overcoat when the wind is free oh take good care of yourself you belong to me boop boop a doop when you sass a traffic cop use diplomacy just take good care of yourself you belong to me beware of frozen funds ooh ooh stocks and bonds ooh ooh dockside thugs ooh ooh youll get a pain and ruin your bankroll keep the spoon out of your cup when youre drinking tea oh take good care of yourself you belong to me dont sit on hornets tails ooh ooh or on nails ooh ooh or third rails ooh ooh youll get a pain and ruin your tum tum keep away from bootleg hooch when youre on a spree oh take good care of yourself you belong to me","Button Up Your Overcoat","2008"
"Ambrose Orchestra","romance is a game for fools i used to say a game i thought id never play romance is a game for fools i said and grinned then you passed by and here am i throwing caution to the wind fools rush in where angels fear to tread and so i come to you my love my heart above my head though i see the danger there if theres a chance for me then i dont care mm mm mm mm fools rush in where wise men never go but wise men never fall in love so how are they to know when we met i felt my life begin so open up your heart and let this fool rush in fools rush in where wise men never never never go eh but wise men never fall in love so how are they to know ah when we met girl i felt my life begin so open up your heart and let this fool rush in just open up your heart and let this fool rush on in just open up your heart because i i i i i i i am coming in open up your heart and let this fool rush in","Fools Rush In","2017"
"Ambrose Orchestra","i hate to see that evening sun go down i hate to see that evening sun go down cause my baby hes gone left this town feelin tomorrow like i feel today if im feelin tomorrow like i feel today ill pack my truck and make my give a way st louis woman with her diamond ring pulls that man around by her if it wasnt for her and her that man i love would have gone nowhere nowhere i got the st louis blues blues as i can be that mans got a heart like a rock cast in the sea or else he wouldnt have gone so far from me i love my baby like a school boy loves his pie like a kentucky colonel loves his mint n rye i love my man till the day i die","St. Louis Blues","2017"
"Ambrose Orchestra","here i go again i hear those trumpets blow again all aglow again takin a chance on love here i slide again about to take that ride again starry eyed again takin a chance on love i thought that cards were a frame up i never would try now im taking that game up and the ace of hearts is high things are mending now i see a rainbow blending now well have a happy ending now takin a chance on love here i slip again about to take that trip again i got that grip again takin a chance on love now i prove again that i can make life move again um im in the groove again takin a chance on love i walk around with a horse shoe in clover i lie and brother rabbit of course you better kiss your foot good bye on that ball again im ridin for a fall again im gonna give my all again takin a chance on love","Taking a Chance on Love","2017"
"Ambrose Slade","mars bonfire get your motor running head out on the highway looking for adventure in whatever comes our way chorus youre not gonna make it happen all the world is a loving place fire all of your guns at once then explode into space i like streaking lightning a heavy metal thunder wrestling with the wind and the feeling that im under like a true natures child we were born born to be wild we were flyin so high i never wanna die born to be wild born to be wild i like streaking lightning a heavy metal thunder wrestling with the wind and the feeling that im under youre not gonna make it happen all the world is a loving place fire all of your guns at once then explode into space like a true natures child","Born to Be Wild","1969"
"Ambrose Slade","if this world were mine id place at your feet all that i own youve been so good to me if this world were mine id give you the flowers the birds and the bees for with your love inside me that would be all i need if this world were mine id give you anything if this world were mine id make you a king with wealth untold you could have anything if this world were mine id give you each day so sunny and blue if you wanted the moonlight id give you that too if this world were mine id give you anything oh baby youre my consolation and theres no hesitation when you want me honey just call me and honey youre my inspiration i feel so much sensation when im in your arms when you squeeze me and the sky would be blue as long as youre lovin me with you here in my arms life is so wonderful give me pretty lovin baby give me pretty lovin honey keep on lovin me you know i need you baby really really need you baby","If This World Were Mine","1969"
"Ambrose Slade","martha my dear though i spend my days in conversation please remember me martha my love dont forget me martha my dear hold your head up you silly girl look what youve done when you find yourself in the thick of it help yourself to a bit of what is all around you silly girl take a good look around you take a good look youre bound to see that you and me were meant to be with each other silly girl hold youre hand out you silly girl see what youve done when you find yourself in the thick of it help yourself to a bit of what is all around you silly girl martha my dear you have always been my inspiration please be good to me martha my love dont forget me martha my dear","Martha My Dear","1969"
"Ambrosia","say now you talk about the things i do but baby i ill try n explain the reasons why cause ive been thinking about the things we said late last night when every word i said just didnt come out right and you were so afraid that id found someone new but darlin well theres no need for what were going through because you and ive been in love too long to worry about tomorrow heres a place where we both belong i know youre the only woman that im dreaming of youre the only woman that i really love baby see what a foolish heart has done for me darling why would you break my heart and make me cry well now you cant go back and change the way things are and all this foolish talk wont take us very far and so i hope youre listening cause im telling you about the way i feel and what im going through because you and ive been in love too long to worry about tomorrow heres a place where we both belong i know youre the only woman that im dreaming of i say youre the only woman that i really love dont speak shhh when the pain of love surrounds you and the world may be unkind ill put my loving arms around you and take you far from this place and time because you and ive been in love too long to worry about tomorrow heres a place where we both belong i know youre the only woman ive been dreaming of baby youre the only woman that i really love youre the only woman i know youre the only woman well now youre the only woman","You’re the Only Woman",""
"Ambrosia","someone talks about a road at the end find lifes gold i went out to get a drink of water but i saw an ocean far away i thought of how much beyond awaits me foolishly i turned my head the other way do you like where youre livin at im not happy inside you could build a golden house yeah but still im sad inside i set out on a long and lonely journey and traveled through some strange and distant lands and many times i thought id found lifes meaning but it slipped away like water in the sand do you like where youre livin at im not happy inside you could build a golden house and still im sad inside one summer storm im waitin for the sun one summer storm ive waited so long waited so long yeah in our lives weve all drank of the water heard the ocean callin out our names some will seek and find their lifes meaning and some will turn their heads the other way","Drink of Water","1975"
"Ambrosia","lover arrive lover arrive take me on wings into your heart find a new start lover arrive lover arrive take me from here into your soul we can be whole remember the days wed run away laughing among all the fields you looked at me and all i could see were your eyes a shinin so real oh li li li li ah ah li li li li lover arrive lover arrive take me from here into your heart then we can start","Lover Arrive","1975"
"Ambrosia","pale to the mountains my existence seems sad as the cry of my unanswered dreams long have i waited for time to make clear all of the reasons that i must be here but i wont care if you are there make us all aware drawn by the river we watch as it flows wanting to taste of the wisdom it holds knowing that somewhere our fortunes well find but fortunes are something we hold in our minds we could share all thats there make us all aware seeking an answer yet harboring fear the day that it comes ill no longer be here but i wont care if you are there i wont care make us all oh i wont care make us all aware","Make Us All Aware","1975"
"Ambrosia","the clock gets to be such a bore whatcha livin for though i cant explain being sanes just a dreary chore id like to go fly past mountains see mama frog at her fountain shell be there in her golden frog sequined uniform golden chair three trained human clowns who will soon perform balancing books with their heads trying to recall what theyve said past the gate you will soon be in a garden paradise dont be late there the shining jewels sparkle in your eyes all waiting there for your pleasure whats keeping you from this treasure narration of jabberwock from alice in wonderland twas brillig and the slithy toves did gyre and gimble in the wabe all mimsy were the borogoves and the mome raths outgrabe beware the jabberwock my son the jaws that bite the claws that catch beware the jubjub bird and shun the frumlous bandersnatch he took his vorpal sword in hand long time the manxome foe he sought so rested he by the tumtum tree and stood awhile in thought and as in uffish thought he stood the jabberwock with eyes of flame came whiffling through the tulgey wood and burbled as it came one two one two and through and through the vorpal blade went snicker snack he left it dead and with its head he went galumphing back and hast thou slain the jabberwock come to my arms my beamish boy o frabjous day callooh callay he chortled in his joy twas brillig and the slithy toves did gyre and gimble in the wabe all mimsy were the borogoves and the mome raths outgrabe the clock gets to be such a bore whatcha livin for though i cant explain being sanes just a dreary chore id like to go fly past mountains see mama frog at her fountain","Mama Frog","1975"
"Ambrosia","ive never been a thief but i wont say ill never steal ive never been a star but that doesnt mean i dont appeal i always read the bible but too seldom do i kneel well i disregard the writing and i play just what i feel so what do i care why should i care all i really want is something more than you can order from a telephone if they call im not at home so write it off as another loss and let the world leave me alone let the world leave me alone ive been a truthful man but i wont say ive never lied ive always had a plan but somehow it never was applied never got my share of lovin ive always been denied i aint greedy but i aim to take what rightfully is mine all i really want is something that i do not have to share hide it under lock and key so theyll never see or theyll never know and let someone else be responsible and let the world leave me alone people try to tell me im a dreamer wastin everybody elses time movin all around im just a schemer gettin into everybodys way let the world leave me alone let the world leave me alone let the world leave me alone world leave me alone","World Leave Me Alone","1975"
"Ambrosia","but if you can want love you can hide all the memories inside and it wont take more than you can give just to find a way to live and as soon as you can look around theres a new love to be found","And","1976"
"Ambrosia","leaping quick on leopards back i face the brunt of his attack in the land of nod im king until the alarm clock rings stepping out from safetys door i hear the rushing traffic roar smiling to myself i say hooray its a brand new day slashing my way through vine ill kill if i have to ill be there on time clawed through the freeway jam i curse at the guy who passed me last time round in my office settled back drink a cup of coffee black stretch my mind and tryn erase the thought of the day to face life is like the leopards den and once you find youve fallen in a safari of the heart surely comes to an end madness is our damnation strange is the situation were all in to one man it matters nothing others it shatters something no one wins i could not see it myself though id read about it i could not hear it myself though id heard about it i could not feel it myself though i knew that it was real i could not hear it myself dont you lie about it i could not feel it myself but dont you cry about it for theres an animal in us all the brunt of which youll see","The Brunt","1976"
"Ambrosia","of mans progress i dont give a hoot and mans estrangements of natures arrangements has given cause for my heartbreak to boot the simple life though filled with strife and struggle with the land still remained its simple self and that i understand so city smog and dog eat dog for some may hold sublime well as for me if i had my way id had lived some other time praise the prairie and pass the cake id like to eat it too but being born now was my mistake ive passed the buckaroo id say youre right no chance why fight why be a cowboy star but hump back brahmas lovely cow mamas saw dust floor saloons dance hall queens romanced in my dreams so why pop my balloon no chance why fight still in my own right id be a cowboy star dreams of my life are so carried away if just in my dreams i could be for one day just for one day lost in my dreams ill be riding away like a cowboy star stage set sundown in my last showdown ill be","Cowboy Star","1976"
"Ambrosia","all this time all this worry all this way to go for nothin whats the sense of the hurry you tell me if you sense somethin i dreamed a lot when i was younger im older now and still i hunger for some understanding theres no understanding now was there ever one thin line draws the border between madness and the genius but no pen can erase it so we keep these things between us i dreamed a lot when i was younger im older now and still i hunger for some understanding theres no understanding now was there ever and my front brain would not accept my thinker see no kiddin","Harvey","1976"
"Ambrosia","sometimes i feel that weve been herded like sheep weve been led out like lambs to the slaughter and empty souls have kept the downtrodden down and took the best and left us the fodder still in my heart i feel such purpose a reason for being alive and i want to know i want to know sometimes it seems there was meant to be more than this rush and this battle to living and theres the times weve all tasted the space that you know when we feel that were giving so take some time to think about this im blinded now id like to see and i want to know i want to know i want to see through all the barriers that were created before i was born were they put out there just to guide me or keep the weak from becoming strong i want to know i want to know still in my heart i feel such purpose a reason for being alive and i want to know sometimes i fear that all men are asleep must we shout to awake those that slumber","I Wanna Know","1976"
"Ambrosia","think of the summer when i held you here everything was right all the years we spent in love just to end one night a lot of things are closin in on me shes gone and im in misery theres no place that i can really be out into my own so im runnin away i have got to be alone im runnin away it makes no sense at all think of the summers when i held you here all the dreams wed planned afternoons we spent alone i cant understand a lot of things are closin in on me shes gone and im in misery theres no place that i can really be out into my own all i really want to know what it is that makes love grow still inside me it remains i never spend a day without wondering how ill make it alone","Runnin' Away","1976"
"Ambrosia","somewhere ive never travelled thats were ive been today somewhere beyond all reason but it came the only way i could find it something inside of me i can find it someplace ive always dreamed of thats what i finally see and when im there i feel love so there i always want to be i believe it believe in myself i have seen it and teheres a day when youll wake with the sun in your eyes hearing a voice that is calling within you to rise rise someday ill be there though i know not where i go there ill be when i go somewhere id never travelled thats where it all began and as my dreams unravel i long to go that way again i am waiting waiting to take you there no more waiting off you go","Somewhere I've Never Travelled","1976"
"Ambrosia","nothings complete before every chain is linked and your mind wasnt meant to be sold out in the street you are wearing a disguise it reveals you when you cry does it hurt you when you try can i help you could i reach you tell me now because we need you too dont let worries be oh your walls against your being you can climb them whats beyond is surely worth your seeing you are wearing a disguise it reveals you when you cry does it hurt you when you try can i help you could i reach you tell me now because we need you too","We Need You Too","1976"
"Ambrosia","well i keep holdin on to yesterday i keep holdin on enough to say that im wrong i keep thinkinthat im lonely but its only missing you inside days that we were once together seems theyll never come alive so i keep holdin on to yesterday i keep holdin on enough to say that its wrong lord i dont know when ill see you i cant reach you anymore if id only known id need you then id keep you like before i keep holdin on to yesterday i keep holdin on enough to say that im wrong wrong wrong to keep holdin on my yesterdays have all gone by","Holdin' on to Yesterday","1976"
"Ambrosia","you come alive at quarter to three you make haste for a taste in the parking lot of misery so down it goes and up goes your need so youre fine for the time but youre on the line not in between what can this stuff do to me apothecary some more of the same today fills that need youre late again for chemistry class you were up in the lab with your chemical head in a flask the truth is though your mind is a mess youve just taken a dose now youre comatose in pandoras chest how could i do this to me apothecary oh please wheres the antidote for me looking for ways you can let it out sleep in the days for tonight youll roam about pull all the stops you begin to shout lifes a big dream and you sleep till you come out come out fill my need apothecary fill my need apothecary","Apothecary","1978"
"Ambrosia","art beware its all been done theres nothing new under the sun yeah what a waste of my time so take heed of all new schemes just variations on old themes yeah how could i be so blind its sad when youve got it down to a pat thing sad thing is all youll have its sad when youve got it down to some sure thing sure thing but its old hat art beware its all been done theres nothing new under the sun havent we heard your song yeah somewhere else before son that was nice good try son but what a waste of my time","Art Beware","1978"
