"Band","Lyrics","Song","Year"
"Pistol Annies","my hands are shaking but i can still pour the mistake that im making and ill pour one more it runs in my family it runs in my blood and just like my daddy i cant get enough every last drop i say is the last then i drive to the store and i fill up my glass dear sobriety please come back to me i left you high and dry im doomed for good this time i swore i wouldnt be im making a fool of me i need you desperately dear sobriety two years i gave in and i did not sway and i swore to my family id keep it that way saved by the good lord and hurt in their eyes but life would back splatter and i compromise if heartache wont kill you you find something that will and it turns out this battle is only uphill dear sobriety please come back to me i left you high and dry im doomed for good this time i swore i wouldnt be oh but im making a fool of me i need you desperately dear sobriety dear sobriety please come back to me i left you high and dry im doomed for good this time i swore i wouldnt be oh but im making a fool of me i need you desperately dear sobriety","Dear Sobriety","2013"
"Pistol Annies","dont talk about him tina best thing he ever did was leave ya you better pull yourself together tina i swear youre better than just waiting around on some rodeo man you gotta get yourself up and dust them boots off aint no use in staying sad or pissed off you know how them cowboys are they stay a while then they break your heart so put your lipstick on and lets go paint up this town and when the boys come around dont talk about him tina best thing he ever did was leave ya you better pull yourself together tina i swear youre better than just waiting around on some rodeo man hey bartender my friend needs a double something strong to get her through her trouble the boy down the bar just gave you a wink i bet hell buy you another drink before you know it youll be dancing his memory away just watch what you say dont talk about him tina best thing he ever did was leave ya you better pull yourself together tina i swear youre better than just waiting around on some rodeo man alright theres no easy way to mend a heart this oughta be a real good start so smile real pretty cause here he comes and dont you dare do anything dumb like talk about him tina best thing he ever did was leave ya you better pull yourself together tina i swear youre better than just waiting around on some rodeo man dont just wait around on some rodeo man","Don't Talk About Him, Tina","2013"
"Pistol Annies","ive never been a stranger to working hard but ive been known to play you wont likely find me letting down my guard but ill get drunk and carried away girls like us we dont mess around we dont tie you up just to let you down dont girls like us make the world go round and round i get up and get dressed and put it on and act like i got it together cause somebodys gotta put the supper on and no man would know better girls like us we dont mess around we dont tie you up just to let you down dont girls like us make the world go round and round at the end of another hell of a day i wouldnt change a thing i kick off my shoes mix up a drink and get on my knees and pray pray girls like us we dont mess around we dont tie you up just to let you down dont girls like us make the world go round dont girls like us make the world go round and round","Girls Like Us","2013"
"Pistol Annies","my brother got out of rehab right around christmas time mama made a turkey daddy was worried he was gonna have to break up a fight everybody was walking on eggshells drinking eggnog instead of beer we were holdin our tongues scratchin our heads wonderin how the hell we got to here hush hush dont you dare say a word hush hush dont you know the truth hurts hush hush when push comes to shove its best to keep it hush hush we were sitting around the dinner table and we were eating our pumpkin pie while the sugar coated pretty little secret was eating everybody alive well daddys reading propaganda and hes talking bout the end of days well cheers to the vodka mamas been sneakin lets all gather round and pray hush hush dont you dare say a word hush hush dont you know the truth hurts hush hush when push comes to shove its best to keep it hush hush so i snuck out behind the red barn and i took myself a toke since everybody here hates everybody here hell i might as well be the joke im gonna dance up on the table singing this little light of mine god gave it to me what goods it gonna do me if i dont by god let it shine hush hush dont you dare say a word hush hush dont you know the truth hurts hush hush when push comes to shove its best to keep it hush hush hide your tattoo put on your sunday best pretend youre not a mess be the happy family in the front pew hush hush dont you dare say a word hush hush dont you know the truth hurts hush hush when push comes to shove its best to keep it hush hush hush hush dont you dare say a word hush hush dont you know the truth hurts hush hush when push comes to shove its best to keep it hush hush","Hush Hush","2013"
"Pistol Annies","i feel a sin comin on i feel a right thats about to go wrong i got a shiver down to the bone i feel a sin comin on i gotta buzz in my brain drunk on a love goin down like champagne i got a feelin its gonna leave a lipstick stain and id be the only one to blame and you can see it all over my face sweet temptation all over the place give me tall dark and handsome mix it up with something strong i feel a sin i feel a sin comin on please jesus dont hold me back i know it aint mine but i want it so bad the smoke in the whiskey got me feeling easy and after ill fade in the glass and you can see it all over my face sweet temptation all over the place give me tall dark and handsome mix it up with something strong i feel a sin i feel a sin comin on and you can see it and you can see it all over my face all over my face sweet temptation all over the place give me tall dark and handsome mix it up with something strong i feel a sin i feel a sin comin on i feel a sin i feel a sin comin on","I Feel a Sin Comin' On","2013"
"Pistol Annies","i hope youre the end of my story i hope youre as far as it goes i hope youre the last word i ever utter its never your time to go sometimes this road that we travel feels like its leading us on and spinning our wheels just stirs up the gravel before you know it its gone i hope youre the end of my story i hope youre as far as it goes i hope youre the last word i ever utter its never your time to go ill keep on turning the pages oh what a story to tell youll still be my sweetheart when everything ages youll be the last book on the shelf i hope youre the end of my story i hope youre as far as it goes i hope youre the last word i ever utter its never your time to go i hope youre the last word i ever utter its never your time to go","I Hope You're the End of My Story","2013"
"Pistol Annies","he aint much on roses but hed walk a country mile to pick a handful of white flowers that would make his baby smile he wont do the dishes but hell sweep you off your feet and hell make you feel like the prettiest thing that hes ever seen cause he knows how to treat his woman and he knows how to make ends meet hell take you for a ride in his four wheel drive and hell fix about anything he likes to get dirty but he cleans up good he drinks with his buddies but he prays when he should and there aint nothing better than being loved by a workin man he dont write love letters but he loves to make things right with a heart the size of texas two arms to hold you tight he wont do the laundry but hell keep your car real clean and hell make you feel like the prettiest thing that hes ever seen cause he knows how to treat his woman and he knows how to make ends meet hell take you for a ride in his four wheel drive and hell fix about anything he likes to get dirty but he cleans up good he drinks with his buddies but he prays when he should and there aint nothing better than being loved by a workin man cause he knows how to treat his woman and he knows how to make ends meet hell take you for a ride in his four wheel drive and hell fix about anything he likes to get dirty but he cleans up good he drinks with his buddies but he prays when he should and there aint nothing better than being loved by a workin man i love my workin man","Loved by a Workin' Man","2013"
"Pistol Annies","i dont have to lay beside him feeling so alone but my baby is crying for his daddy and asking when hes coming home i dont have to feel neglected and im not damaged goods anymore but my baby has been devastated ever since he walked out that door im trading one heartbreak for another one kind of pain for a different kind of pain and i wonder if this is gonna hurt even more im finally alive but its killing who im living for i dont have to hear his complaining and i dont have to curse his name but my darling is missing his daddy and hell always have me to blame im trading one heartbreak for another one kind of pain for a different kind of pain and i wonder if this is gonna hurt even more im finally alive but its killing who im living for im trading one heartbreak for another one kind of pain for a different kind of pain and i wonder if this is gonna hurt even more im finally alive but its killing who im living for","Trading One Heartbreak for Another","2013"
"Pistol Annies","must be mistaking me with the maid we dont have cant even wash your whiskey out your glass i gave you no loving in a month or so cant live without you but i cant let you go hey hey its alright everybody fusses everybody fights with all of the baggage you and me carry well spend forever unhappily married you better start working some overtime cant buy high heels on nickels and dimes youre going bald and im getting fat i hate your mum and you hate my dad hey hey its alright everybody fusses everybody fights with all of the baggage you and me carry well spend forever unhappily married ill cook your dinner if you wash my car may as well keep going hell we made it this far well both play our parts in this disaster ill be the bitch and youll be the bastard hey hey its alright everybody fusses everybody fights with all of the baggage you and me carry well spend forever unhappily married hey hey its alright everybody fusses everybody fights with all of the baggage you and me carry well spend forever unhappily married well spend forever unhappily married well spend forever unhappily married can i get an amen amen","Unhappily Married","2013"
"Pistol Annies","red red red red red red red red redneck well the boys round here dont listen to the beatles run ole bocephus through a jukebox needle at a honky tonk where their boots stomp all night what thats right yeah and what they call work digging in the dirt gotta get it in the ground fore the rain come down to get paid to get the girl in your 4 wheel drive a country boy can survive yeah the boys round here drinking that ice cold beer talkin bout girls talkin bout trucks runnin them red dirt roads out kicking up dust the boys round here sending up a prayer to the man upstairs backwoods legit dont take no shit chew tobacco chew tobacco chew tobacco spit aw heck red red red red red red red red red red redneck well the boys round here theyre keeping it country aint a damn one know how to do the dougie you dont do the dougie no not in kentucky but these girls round here yep they still love me yeah the girls round here they all deserve a whistle shakin that sugar sweet as dixie crystal they like that yall and southern drawl and just cant help it cause they just keep fallin for the boys round here drinking that ice cold beer talkin bout girls talkin bout trucks runnin them red dirt roads out kicking up dust the boys round here sending up a prayer to the man upstairs backwoods legit dont take no shit chew tobacco chew tobacco chew tobacco spit let me hear you say ooh lets ride through the country side ooh lets ride down to the river side hey now girl hop inside me and you gonna take a little ride to the river lets ride thats right lay a blanket on the ground kissing and the crickets is the only sound we out of town have you ever got down with a red red red red red red red red red red redneck do you wanna get down with a red red red red red red red red red red redneck girl you gotta get down with the boys round here drinking that ice cold beer talkin bout girls talkin bout trucks runnin them red dirt roads out kicking up dust the boys round here sending up a prayer to the man upstairs backwoods legit dont take no shit chew tobacco chew tobacco chew tobacco spit ooh lets ride red red red red red red red red redneck ooh lets ride im one of them boys round here ooh lets ride red red red red red red red red redneck ooh lets ride well all im thinkin bout is you and me how well be so come on girl hop inside me and you were gonna take a little ride lay a blanket on the ground kissing and the crickets is the only sound we out of town girl you gotta get down with a come on through the country side down to the river side","Boys 'Round Here","2013"
"Pistol Annies","i hear the clock its 6 a m i feel so far from where ive been i got my eggs i got my pancakes too i got my maple syrup everything but you i break the yolks and make a smiley face i kinda like it in my brand new place i wipe the spots off of the mirror dont leave the keys in the door i never put wet towels on the floor anymore cause dreams last so long even after youre gone i know that you love me and soon you will see you were meant for me and i was meant for you i called my momma she was out for a walk consoled a cup of coffee but it didnt want to talk so i picked up a paper it was more bad news more hearts being broken or people being used put on my coat in the pouring rain i saw a movie it just wasnt the same cause it was happy and i was sad it made me miss you oh so bad cause dreams last so long even after youre gone i know that you love me and soon you will see you were meant for me and i was meant for you i go about my business im doing fine besides what would i say if i had you on the line same old story not much to say hearts are broken every day i brush my teeth and put the cap back on i know you hate it when i leave the light on i pick up a book and turn the sheets down and take a deep breath and a good look around put on my pjs and hop into bed im half alive but i feel mostly dead i try and tell myself itll be all right i just shouldnt think anymore tonight cause dreams last so long even after youre gone i know that you love me and soon you will see you were meant for me and i was meant for you you were meant for me and i was meant for you","You Were Meant for Me","2013"
"Pistol Annies","five acres of turnips ripe for the picking the sweat and the blood oughta be enough to keep me going a heart and a trowel the will to keep spinning faith thats untamed a prayer for the rain so the rose will keep growing oh dont take it for granted oh reap what you planted oh generations of shame oo in my granddaddys name tear in the screen door lettin the flies in the radios on the sweetest of songs but i know theyre lying oh secrets just simmer oh momma makes dinner oh then we all gather round oh another hole in the ground somethin beautiful comes out of this dirt something better than him at his worst one at a time dead on the vine five acres of turnips ripe for the picking the sweat and the blood oughta be enough to keep me going","5 Acres of Turnips",""
"Pistol Annies","i picked a good day for a recreational percocet ive got an itch to just get high im in the middle of the worst of it these are the best years of my life ive got the hankering for intellectual emptiness ive got the need to ease my mind ill watch some re runs on the tv set these are the best years of my life i was looking forward to staying here forever cause you asked me to didnt think that i could do better so i settled down in this ten cent town its about to break me im gonna mix a drink and try to drown this worthlessness call mom and tell her im alright well he dont love me but he aint gone yet these are the best years of my life uh uh uh uh uh uh uh uh uh yeah i was looking forward to staying here forever cause you asked me to didnt think that i could do better so i settled down in this ten cent town its about to break me i picked a good day for a recreational percocet ive got an itch to just get high im in the middle of the worst of it these are the best years of my life these are the best years of my life these are the best years of my life","Best Years of My Life",""
"Pistol Annies","she lives for the nightlife and trashy tattoos she loves country music and broken in boots nobody can blame her for the chip on her shoulder she finds plenty of pool table cowboys to hold her her daddy says she was destined for sadness and her grandmama lilys to blame for the madness the only forever she knew ended tragic so shell fall the night while the neon light flashes if i could trade love like cheyenne if i could be just as cold as the beer in her hand if i could move men and mountains with a wink and a grin oh if i could treat love like cheyenne she knows how to make him wild in the eyes comes on like a fever and sets him on fire i bet she wont even cry when its over shes fast like a train nobody can slow her if i could trade love like cheyenne if i could be just as cold as the beer in her hand if i could move men and mountains with a wink and a grin oh if i could treat love like cheyenne i wish i could treat love like cheyenne","Cheyenne",""
"Pistol Annies","didnt put no money on your commissary didnt write you a letter didnt even worry when mama said a boy beat you within an inch of your life i didnt bat an eye it didnt even phase me youre still just a kid to me i cant stomach what i see didnt put no money on your commissary i baked a cake for tammy lee didnt tell her why you had to leave i didnt cry when everybody lied for you except for me i didnt put no money on your commissary youre still just a kid to me and i cant stomach what i see didnt put no money on your commissary im glad the bars that your behind are keepin you alive didnt put no money on your commissary didnt put no money on your commissary didnt put no money on your commissary didnt put no money on your commissary didnt put no money on your commissary didnt put no money on your commissary didnt write you a letter didnt even worry you have a collect call from the howard county detention center will you accept the charges charges charges charges","Commissary",""
"Pistol Annies","it takes judge to get married takes a judge to get divorced well the last couple years spent a lotta time in court got my name changed back yeah yeah i got my name changed back yeah yeah well i wanted somethin new then i wanted what i had i got my name changed back yeah yeah well ive got me an ex that i adored but he got along good with a couple road whores got my name changed back yeah yeah i got my name changed back yeah yeah i dont wanna be a missus on paper no more i got my name changed back yeah yeah here we go i dont let a man get the best of me spent an afternoon at the dmv got my name changed back yeah yeah i got my name changed back yeah yeah now who i was aint who i be i got my name changed back yeah yeah thats right well how to win when you play the fool thats somethin they dont teach in school i played to win lookin back is funny i broke his heart and i took his money got my name changed back yeah yeah i got my name changed back yeah yeah well i dont wanna be a missus on paper no more i got my name changed back yeah yeah i got my name changed back i got my name changed back i got my name changed back i got my name changed back i got my name changed back i got my name changed back yeah yeah","Got My Name Changed Back",""
"Pistol Annies","when did i get this crazy when did i get so mean living wild and exhausted paying what it cost to feel so free run along little daddy take the dog and the house and dang me it aint worth the time that its gonna take to change me its as deep as the holler and clear as the water that stains me i want whatever it is i aint gettin from you i know you need me to need you i tried to teach you to be tough mm thered be no such thing as leaving if just loving somebody was enough run along little daddy take the dog and the house and dang me it aint worth the time that its gonna take to change me its as deep as the holler and clear as the water that stains me i want whatever it is i aint gettin from you la la la la la la la la la la la la la la la la la la la la la la la la la la la la la la la la la la la la la la la la la la la la la la la la la la la la la la la la la la la la la la la la la la la la la la la la la la la la la la la la la la la la la la la la la la la la la la la la la la la la la la la la la la la la la la la la la la la la la la la la la la la la la la la la la la la la la la la la la la la la la la la la","Leavers Lullaby",""
"Pistol Annies","baby we were just a masterpiece up there on the wall for all to see we were body and soul we were talked about once youve been framed you cant get out whos brave enough to take it down whos fool enough to lose the crown were just another thing theyll all forget about theyll be standing around laughin like nothing ever happened baby we were just a rodeo shining up our buckles for the show our knuckles white we held on tight cause the longest ride makes the crowd go wild whos gonna open up the gate no hope of riding to the eight we aint the cowboys honey were the clowns theyre all standing around laughin like nothing ever happened oooh oooh baby we were just a country song im still doin time the king is gone i tried to stand by my man we were making plans we were making plans whos brave enough to take us down whos fool enough to lose the crown maybe another thing theyll all forget about theyll be standing around laughing like nothing ever happened oooh oooh baby we were just a masterpiece baby we were just a masterpiece","Masterpiece",""
"Pistol Annies","if mama wouldve loved the milkman maybe she wouldnt judge me if shedve had a ride in his white van up and down baker street on a monday with her hair down and hand about to slide between his knees but mama never did love nothin but daddy and me if mama wouldve smoked her a cigarette maybe she wouldnt judge me if shedve done more than the dishes untied them apron strings shed be sittin in her sundress on the back porch mixing whiskey and sweet tea mama never did think twice about feelin this free mama never liked to pick wild flowers drinkin on a sunday was a sin she mightve made it past the water tower if shedve loved the milkman mmh mmh mama if i could be more like mama maybe she wouldnt judge me sometimes i think mama wants to be more like we but its too late cause her hairs gray and the years have started showing on her cheeks cause mama never did have nothin but daddy and me mama never liked to pick wild flowers drinkin on a sunday was a sin she mightve made it past the water tower if shedve loved the milkman mmh mmh mmh mmh mmh mmh uh uh uh uh uh uh","Milkman",""
"Pistol Annies","were on fire i think so stop drop and roll one takes one to grow one were one of a kind were right on the brink burned out like the prom queen were all mirrors and smoke rings so stop drop and roll one i dont really care how this phony ass fairytale ends i just hope that were leaving this honky tonk covered in men sometimes the loud ones are loners sometimes the rockers are stoners ones got the matches ones got the lashes ones running her mouth again were on fire i think so stop drop and roll one takes one to grow one were one of a kind were right on the brink burned out like the prom queen its all mirrors and smoke rings so stop drop and roll one get this thing off of me where in the hell is my bra this hurts a lot more than the last time we did mardi gras sometimes the drifters are daisies sometimes the sane ones are crazies ones got the tylenol ones got the adderall ones got a drink in her hand were on fire i think so stop drop and roll one takes one to grow one were one of a kind yeah were right on the brink burned out like the prom queen its all mirrors and smoke rings so stop drop and roll one","Stop Drop and Roll One",""
"Pistol Annies","there aint a damn man in dallas who wouldnt put a ring on my hand red dirt queen of the palace im runnin through em like a watering can my sugar daddys got a pool in the back got a rifle in the rack of his cadillac drivin me crazy my sugar daddys got diamonds in his watch got a boat on the dock cause a why not im his lady give me some sugar daddy there aint a horse in all of kentucky that i couldnt saddle up and ride im bettin on the one with the honey im gonna break him in good tonight my sugar daddys got chrome on his bike got bourbon on ice hes a white knight drivin me crazy my sugar daddys got a lift kit on his truck hes as wild as a buck and he thanks god im his baby give me some sugar daddy i can call em down from the mountain i can leave em high on the hog i let em drink from the fountain but leave em wantin more like a boss yeah my sugar daddys got the whole back forty with the will to afford it and hes top shelf drivin me crazy my sugar daddys got a rhinestone suit got a snake in his boot a guitar man he persuades me give me some sugar daddy if you want them finer things give me some sugar daddy if you want them diamond rings give me some sugar daddy howlin darlin do your thing give me some sugar daddy give me some sugar daddy give me some sugar daddy","Sugar Daddy",""
