"Band","Lyrics","Song","Year"
"Edmonton Symphony Orchestra","well i was borned a coal miners daughter in a cabin on a hill in butcher holler we were poor but we had love thats the one thing that daddy made sure of he shoveled coal to make a poor mans dollar my daddy worked all night in the van lear coal mines all day long in the field a hoin corn mommy rocked the babies at night and read the bible by the coal oil light and ever thing would start all over come break of morn daddy loved and raised eight kids on a miners pay mommy scrubbed our clothes on a washboard ever day why ive seen her fingers bleed to complain there was no need shed smile in mommys understanding way in the summertime we didnt have shoes to wear but in the wintertime wed all get a brand new pair from a mail order catalog money made from selling a hog daddy always managed to get the money somewhere yeah im proud to be a coal miners daughter i remember well the well where i drew water the work we done was hard at night wed sleep cause we were tired i never thought of ever leaving butcher holler well a lot of things have changed since a way back then and its so good to be back home again not much left but the floor nothing lives here anymore except the memory of a coal miners daughter","Coal Miner's Daughter [DVD]","1978"
"Edmonton Symphony Orchestra","theres a reason for the sunshine sky theres a reason why im feeling so high must be the season when that love light shines all around us so let that feeling grab you deep inside and send you reeling where your love cant hide and then go stealing through the moonless nights with your lover just let your love flow like a mountain stream let your love grow with the smallest of dreams and let your love show and youll know what i mean its the season yeah let your love fly like a bird on the wing and let your love bind you to all living things and let your love shine and youll know what i mean thats the reason theres a reason for the warm sweet nights and theres a reason for the candle lights must be the season when those love rites shine all around us so let the wonder take you into space and lay you under its loving embrace let feel the thunder as it warms your face you cant hold back just let your love flow just let your love flow","Let Your Love Flow [DVD]","1978"
"Edmonton Symphony Orchestra","busted flat in baton rouge waitin for the train feelin nearly faded as my jeans bobby thumbed a diesel down just before it rained rode us all the way to new orleans i pulled my harpoon out of my dirty red bandanna and was playing soft while bobby sang the blues with them windshield wipers slappin time i was holdin bobbys hand in mine we sang every song that driver knew freedoms just another word for nothin left to lose nothin aint worth nothin but its free feelin good was easy lord when he sang the blues and feelin good was good enough for me good enough for me and bobby mcgee from kentucky coal mines to the california sun bobby shared the secrets of my soul through all kinds of weather lord through everything i done bobby baby kept me from the cold then somewhere near salinas lord i let him slip away lookin for the home i hope hell find it and id trade all of my tomorrows for one single yesterday holdin bobbys body next to mine freedoms just another word for nothin left to lose nothin left is all that bobby left me feelin good was easy lord when he sang the blues and buddy that was good enough for me good enough for me and bobby mcgee","Me and Bobby McGee [DVD]","1978"
"Edmonton Symphony Orchestra","well im a good ol girl an i would like to please every way i can ive loved you an ive always let you have the upper hand how come you think youre so smart an im the weaker sex there aint a man alive can match a woman trick for trick weve come a long way baby all the way to hollywood from arkansas weve come a long way baby second class dont turn me on at all well i dont want to a wall to paint but im a gonna have my say from now on lover boy its fifty fifty all the way up to now ive been an object made for pleasin you times have changed and im demanding satisfaction too weve come a long way baby all the way to hollywood from arkansas weve come a long way baby second class dont turn me on at all weve come a long way baby all the way to hollywood from arkansas weve come a long way baby second class dont turn me on at all","We've Come a Long Way Baby [DVD]","1978"
"Edmonton Symphony Orchestra","youve come to tell me something you say i ought to know that he dont love me anymore and ill have to let him go you say youre gonna take him ah but i dont think you can cause you aint woman enough to take my man women like you theyre a dime a dozen you can buy them anywhere for you to get to him id have to move over and im gonna stand right here itll be over my dead body so get out while you can cause you aint woman enough to take my man sometimes a mans caught looking at things that he dont need he took a second look at you but hes in love with me well i dont know where that leaves you ah but i know where i stand cause you aint woman enough to take my man","You Ain't Woman Enough [DVD]","1978"
"Edmonton Symphony Orchestra","im sorry so sorry that i was such a fool i didnt know love could be so cruel oh oh oh oh uh oh oh yes you tell me mistakes are part of being young but that dont right the wrong thats been done im sorry im sorry so sorry so sorry please accept my apology but love is blind and i was to blind to see oh oh oh oh uh oh oh yes you tell me mistakes are part of being young but that dont right the wrong thats been done oh oh oh oh uh oh oh yes im sorry so sorry please accept my apology but love was blind and i was too blind to see sorry","I'm Sorry [DVD]","1978"
"Edmonton Symphony Orchestra","anytime youre feeling low and you got no place to go you dont have to be blue here is all you gotta do call me on the telephone tell me that youre all alone and ill come a runnin to you baby thats all you gotta do all you gotta do when youre lonesome is to call on me and ill come a runnin to you as a fast as i can ill love and squeeze you uh huh huh ill try to please you cause baby i want you to be my lovin man ive been waiting for the chance needing you to start a romance and if you feel the same way too heres all you gotta do tell me just a how you feel tell me that your love is real and ill give my heart to you baby thats all you gotta do all you gotta do when youre lonesome is to call on me and ill come a runnin to you as a fast as i can uh huh huh ill love and squeeze you uh huh huh ill try to please you cause baby i want you to be my lovin man ive been waitin for the chance needing you to start a romance and if you feel the same way too heres all you gotta do tell me just a how you feel tell me that your love is real and ill give my heart to you baby thats all you gotta do","That's All You Gotta Do [DVD]","1978"
"Edmonton Symphony Orchestra","kiss me once then kiss me twice then kiss me once again its been a long long time havent felt like this my dear since i cant remember when its been a long long time youll never know how many dreams ive dreamed about you or just how empty they all seemed without you so kiss me once then kiss me twice then kiss me once again its been a long long time ah kiss me once then kiss me twice then kiss me once again its been a long time havent felt like this my dear since i cant remember when its been a long long time","It's Been a Long Time [DVD][Version]","1979"
"Edmonton Symphony Orchestra","some like a night at the movies some like a dance or a show some are content with an evening spent home by the radio some like to live for the moment some like to just reminisce but whenever i have an evening to spend just give me one like this this is a lovely way to spend an evening cant think of anything id rather do this is a lovely way to spend an evening cant think of anyone as lovely as you a casual stroll through a garden a kiss by a lazy lagoon catching a breath of moonlight humming our favorite tune this is a lovely way to spend an evening i want to save all my nights and spend them with you catching a breath of moonlight humming our favorite tune this is a lovely way to spend an evening i want to save all my nights and spend them with you","A Lovely Way to Spend an Evening [Video][Multimedia Track]","1979"
"Edmonton Symphony Orchestra","{spoken} you know there was a time when if someone told you to do somethin you did it bam right on no questions asked it was yes sir and yes mam you never said no you know huh but you know things are changing nowadays its a new day babies folks want to take their own lives into their hands and make their own choices no longer do they want to go along with the program cause everybody say its right you know what i mean let me tell ya what im talkin about ya see cause i dont want no gold watch for workin fifty years from nine till five a while the boss is guzzling champagne and im beltin beer in some dive cause i want to be happy and free livin and loving for me i want to be happy and free livin and lovin for me like a natural man like a natural man a natural man like a natural man well now i refuse to listen to peoples thinkin that i live too high im gonna taste it now before my one life streaks on by cause i want to be happy and free livin and lovin for me i want to be happy and free livin and lovin for","Natural Man [Video][Multimedia Track]","1979"
"Edmonton Symphony Orchestra","music is a world within itself with a language we all understand with an equal opportunity for all to sing dance and clap their hands but just because a record has a groove dont make it in the groove but you can tell right away at letter a when the people start to move they can feel it all over they can feel it all over people they can feel it all over they can feel it all over people music knows it is and always will be one of the things that life just wont quit but here are some of musics pioneers that time will not allow us to forget for theres basie miller sachmo and the king of all sir duke and with a voice like ellas ringing out theres no way the band can lose you can feel it all over you can feel it all over people you can feel it all over you can feel it all over people you can feel it all over you can feel it all over people you can feel it all over you can feel it all over people you can feel it all over you can feel it all over people you can feel it all over you can feel it all over people you can feel it all over you can feel it all over people you can feel it all over i can feel it all over all over now people cant you feel it all over come on lets feel it all over people you can feel it all over everybody all over people","Sir Duke [DVD][Version]","1979"
"Edmonton Symphony Orchestra","sophisticated lady tryin to change my ways just because youre caught in your social maze i think its bout time that you realize your money and your powers got you mesmerized pretty lady get back pretty lady yea sophisticated lady put your blue jeans on youre anybodys baby when your mamas gone educated lady with your college degree amazes me why you just cant see learned everything from your books on the shelf but no one ever taught you how to think for yourself pretty lady get back pretty lady yea sweet thing sophisticated lady put your blue jeans on youre anybodys baby when your mamas gone sophisticated lady take a lesson from me i can help you be what you want to be together well see many brighter days if it takes forever gonna change your ways pretty lady get back pretty lady yea sweet thing sophisticated lady put your blue jeans on youre anybodys baby when your mamas gone sophisticated lady put your blue jeans on youre anybodys baby when your mamas gone sophisticated lady put your blue jeans on youre anybodys baby when your mamas gone","Sophisticated Lady [DVD][Version]","1979"
"Edmonton Symphony Orchestra","youll never find as long as you live someone who loves you tender like i do youll never find no matter where you search someone who cares about you the way i do whoa im not braggin on myself baby but im the one who loves you and theres no one else no oh oh oh oh oh oh oh one else youll never find itll take the end of all time someone to understand you like i do youll never find the rhythm the rhyme all the magic we shared just us two whoa im not tryin to make you stay baby but i know some how some day some way you are youre gonna miss my lovin youre gonna miss my lovin youre gonna miss my lovin youre gonna miss my lovin youre gonna miss my lovin youre gonna miss youre gonna miss my lo o ove whoa oh oh oh oh youre gonna miss my lovin late in the midnight hour baby youre gonna miss my lovin when its cold outside youre gonna miss my lovin youre gonna miss youre gonna miss my lo o ove youll never find another love like mine someone who needs you like i do youll never see what youve found in me youll keep searching and searching your whole life through whoa i dont wish you no bad luck baby but theres no ifs and buts or maybes youre gonna youre gonna miss miss my lovin youre gonna miss my lovin youre gonna miss my lovin i know youre gonna my lovin youre gonna miss my lovin youre gonna miss youre gonna miss my lo o ove whoa oh oh oh oh youre gonna miss my lovin late in the midnight hour baby youre gonna miss my lovin when it gets real cold outside youre gonna miss my lovin i know i know that you are gonna miss my lo o ove let me tell you that youre gonna miss my lovin yes you will baby youre gonna miss my lovin when im long gone i know i know i know that you are gonna miss","You'll Never Find Another Love Like Mine [DVD][Version]","1979"
"Edmonton Symphony Orchestra","it could of been me but it was you who went and bit off a little bit more than he could chew you said that you had it made but you been had the woman no good no how thinkin maybe the blood is bad bad ba a ad blood blo o od the woman was born to lie makes promises she cant keep with the wink on an eye bad ba a ad blood blo o od brother youve been deceived its bound to change you mind about all you believe from where i stand it looks mighty strange how you let a woman like that treat you like small change i dont understand what youre lookin to find the only thing bad blood do is mess up a good mans mind hear me talkin now bad ba a ad blood blo o od the bitch is in her smile the lie is on her lips such an evil child bad ba a ad blood blo o od is takin you for a ride the only thing good about bad blood is lettin it slide doo ron doo ron di di dit dit ron ron doo ron doo ron di di dit dit ron ron doo ron doo ron di di dit dit ron ron bad blood talkin bout bad blood doo ron doo ron di di dit dit ron ron doo ron doo ron di di dit dit ron ron doo ron doo ron di di dit dit ron ron bad blood here we go bad ba a ad blood blo o od the bitch is in her smile the lie is on her lips such an evil child bad ba a ad blood blo o od is takin you for a ride the only thing good about bad blood is lettin it slide the only thing good about bad blood is lettin it slide","Bad Blood [Stereo]","1981"
"Edmonton Symphony Orchestra","dont take your love away from me dont you leave my heart in misery if you go then ill be blue cause breaking up his hard to do remember when you held me tight and you kissed me all through the night think of all that weve been through breaking up is hard to do they say that breaking up is hard to do now i know i know that its true dont say that this is the end instead of breaking up i wish that we were making up again i beg of you dont say goodbye cant we give our love another try come on baby lets start anew cause breaking up is hard to do they say that breaking up is hard to do now i know i know that its true dont say that this is the end instead of breaking up i wish that we were making up again i beg of you dont say goodbye cant we give our love another try come on baby lets start anew cause breaking up is hard to do","Breaking Up Is Hard to Do [Stereo]","1981"
"Edmonton Symphony Orchestra","harbours open there doors to the young searching foreigner come to live in the light of the big l of liberty plains and open skies bill boards would advertise was it anything like that when you arrived dream boats carried the future to the heart of america people were waiting in line for a place by the river it was time when strangers were welcome here music would play they tell me the days were sweet and clear it was a sweeter tune and there was so much room that people could come from everywhere now he arrvies with hopes and his heart set on miracles come to marry his fortune with a hand full of promises to find theyve closed the door they dont want him anymore there isnt anymore to go around turning away he remembers he once heard a legend that spoke of a mystical magical land called america it was time when strangers were welcome here music would play they tell me the days were sweet and clear it was a sweeter tune and there was so much room that people could come from everywhere it was time when strangers were welcome here music would play they tell me the days were sweet and clear it was a sweeter tune and there was so much room that people could come from everywhere","The Immigrant [Stereo]","1981"
"Edmonton Symphony Orchestra","strolling along country roads with my baby it starts to rain it begins to pour without an umbrella wea re soaked to the skin i feel a shiver run up my spine i feel the warmth of her hand in mine oh i hear laughter in the rain walking hand in hand with the one i love oh how i love the rainy days and the happy way i feel inside after a while we run under a tree i turn to her and she kisses me there with the beat of the rain on the leaves softly she breathes and i close my eyes sharing our love under stormy skies oh i hear laughter in the rain walking hand in hand with the one i love oh how i love the rainy days and the happy way i feel inside i feel the warmth of her hand in mine oh i hear laughter in the rain walking hand in hand with the one i love oh how i love the rainy days and the happy way i feel inside oh i hear laughter in the rain walking hand in hand with the one i love oh how i love the rainy days and the happy way i feel inside oh i hear laughter in the rain walking hand in hand with the one i love oh how i love the rainy days and the happy way i feel inside","Laughter in the Rain [Stereo]","1981"
"Edmonton Symphony Orchestra","love love will keep us together think of me babe whenever some sweet talkin guy comes along singin his song dont mess around you gotta be strong stop cause i really love ya stop cause ill be thinkin of ya look in my heart and let love keep us together you you belong to me now aint gonna set you free now when those guys start hangin around talkin me down hear with your heart and you wont hear a sound oh stop cause i really love ya stop cause ill be thinkin of ya look in my heart and let love keep us together whatever young and beautiful but someday your looks will be gone when the others turn you off wholl be turnin you on i will i will i will i will be there to share forever love will keep us together ive said it before and ill say it again while others pretend ill need you now and ill need you then just stop cause i really love ya stop cause ill be thinkin of ya look in my heart and let love keep us together whatever i will i will i will i will scat singing to fade","Love Will Keep Us Together [Stereo]","1981"
"Edmonton Symphony Orchestra","life and death in an alley way just a heartbeat away from a ma a an whos learned to turn his head away from the pai ain that drai ains the la and harlems not too far from here you can smell the garbage feel the fear i hear theyre gonna build a skyscraper there ere as if we didnt need the extra air air new york city blue ues in order to wi in youve got to lo o ose old before your ti ime the dirt and the gri ime get into everythi ing and the papers love to say ay ay its the meanest town in the usa but i think its okay its the town ive ma ade my home on another side of park avenue respectable folks dont know ow ow hungry eyes take in the view of the wor orld that lay ays them low ow too many years on a welfare line the old song and da ance ti ime after time you can only get so pushed arou ound until you want to tear the damn thing dow own tear it dow own new york city blue ues0 in order to wi in youve got to lo ose old before your ti i ime the dirt and the gri ime get into everythi ing and the papers love to say ay ay its the meanest town in the usa a but i think its okay its the town ive made my ho o ome new york city blue ues in order to wi in youve got to lo ose old before your ti i ime the dirt and the gri ime get into everythi i ing and the papers love to say ay ay its the meanest town in the usa a but i think its okay its the town ive ma ade my ho o ome","New York City Blues [Stereo]","1981"
"Edmonton Symphony Orchestra","there was a man a lonely man who lost his love through his indifference a heart that cared that went unshared until it died within his silence and solitaire is the only game in town and every road that takes him takes him down while life goes on around him everywhere hes playing solitaire and keeping to himself begins to deal and still the king of hearts is well concealed another losing games comes to an end and deals them out again a little hope goes up in smoke just how it goes goes without saying there was a man a lonely man who would command the hand hes playing and solitaire is the only game in town and every road that takes him takes him down while life goes on around him everywhere hes playing solitaire and keeping to himself begins to deal and still the king of hearts is well concealed another losing games comes to an end and deals them out again and solitaire is the only game in town and every road that takes him takes him down while life goes on around him everywhere hes playing solitaire","Solitaire [Stereo]","1981"
"Edmonton Symphony Orchestra","standin on the outside lookin in you know its been a long time i dont know where to begin so much i want to say ay so much i want to do oo friends are tellin me its time that you broke through ive been through the hard times of searchin soul you know its been a hard climb from rocknroll now i feel a need in me so har ard to explai ai ai ain now ive seen the joy of light and i want to remai ai ain standing on the insi ide i finally broke that line ring around the circle le dont you know that it feels so fi i ine every waking moment i just want to sing the new ews that im standin on the inside kicked away them blues all the phoney fa aces stand in line all the backsla appers know my name this time now that ive turned the lo ock now that ive opened the door oor i wont be on the outside no anymore ore ore ore standing on the insi ide i finally broke that line ring around the circle le dont you know that it feels so fine every waking moment i just want to sing the new ews that im standin on the inside kicked away them blues now that ive turned the lock now that ive opened the door oor oor oor i wont be on the outside no anymore sing it out standing on the insi ide i finally broke that line ring around the circle le dont you know that it feels so fine every waking moment i just want to sing the new ews that im standin on the inside kicked away them blues standin on the inside standing on the inside standin on the i insi ide standing on the inside i kicked i kicked i kicked i kicked standing on the inside sta andin on the inside standin","Standing on the Inside [Stereo]","1981"
"Edmonton Symphony Orchestra","thats when the music takes me takes to a brighter day thats when the music takes me helpin me to find my way when the day is so long that i cant hold on when im down and i think my hope is gone ooh yeah thats when the music takes me closer to a brighter day i can feel my soul explodin theres a good feelin helpin me to find my way my my my way when the bluebird sings her sad sad song and the wind brings a cold to tag along oh yeah i can feel the spirit move me i can almost touch the sky reachin for a new tomorrow i know its hard but music makes me wanna try wanna try and then thats when the music takes me takes to a brighter day yeah yeah thats when the music takes me helpin me to find my way thats when the music takes me thats when the music takes me oh yeah but when the music takes me closer to a brighter day i can feel my soul explodin theres a good feelin helpin me to find my way yeah yeah yeah yeah and then im sayin thats when the music takes me takes to a brighter day yeah yeah yeah thats when the music takes me helpin me to find my way happy happy happy day happy happy happy day happy happy happy day thats when the music takes me thats when the music takes me thats when the music takes me and thats when the music takes me happy happy when the music takes","That's When the Music Takes Me [Stereo]","1981"
