"Band","Lyrics","Song","Year"
"Bill Trujillo","maybe i should have saved those left over dreams funny but heres that rainy day heres that rainy day they told me about and i laughed at the thought that it might turn out this way where is that worn out wish that i threw aside after it brought my lover near its funny how love becomes a cold rainy day funny that rainy day is here funny how love becomes a cold rainy day funny that rainy day is here","Here's That Rainy Day","1999"
"Bill Trujillo","im always chasing rainbows watching clouds drifting by my schemes are just like all my dreams ending in the sky some fellows look and find the sunshine i always look and find the rain some fellows make a winning sometimes i never even make a gain believe me im always chasing rainbows waiting to find a little bluebird in vain im always chasing rainbows watching clouds drifting by my schemes are just like all my dreams ending in the sky some fellows look and find the sunshine i always look and find the rain some fellows make a winning sometimes i never even make a gain believe me im always chasing rainbows","I'm Always Chasing Rainbows","1999"
"Bill Trujillo","the night is like a lovely tune beware my foolish heart how white the ever constant moon take care my foolish heart theres a line between love and fascination thats hard to see how many names such as this for they both have the very same sensation when youre locked in the magic of a kiss her lips are much too close to mine beware my foolish heart but should our eager lips combine then let the fire start for this time it isnt fascination or a dream that will fade and fall apart its love this time its love my foolish heart","My Foolish Heart","1999"
"Bill Turek","when the mellow moon begins to beam every night i dream a little dream and of course prince charming is the theme the he for me although i realize as well as you it is seldom that a dream comes true to me its clear that hell appear some day hell come along the man i love and hell be big and strong the man i love and when he comes my way ill do my best to make him stay hell look at me and smile ill understand and in a little while hell take my hand and though it seems absurd i know we both wont say a word maybe i shall meet him sunday maybe monday maybe not still im sure to meet him one day maybe tuesday will be my good news day hell build a little home just meant for two from which ill never roam who would would you and so all else above im waiting for the man i love","The Man I Love (G. & I. Gershwin) 1924","2004"
"Bill Turek","look at me im as helpless as a kitten up a tree and i feel like im clinging to a cloud i cant understand i get misty holding your hand walk my way and a thousand violins begin to play or it might be the sound of your hello that music i hear i get misty the moment youre near you can say that youre leading me on but its just what i want you to do dont you realize how hopelessly im lost thats why im following you on my own would i wander through this wonderland alone never knowing my right foot from my left my hat from my glove i get misty and too much in love im too misty and too much in love","Misty (Garner & Burke) 1954","2004"
"Bill Turner","i cant wait forever even though you want me to i cant wait forever to know if youll be true time wont let me time wont let me time wont let me wait too long cant you see ive waited too long to love you to hold you in my arms time wont let me time wont let me time wont let me aw oh i cant wait forever even though you want me to i cant wait forever to know if youll be true time wont let me time wont let me time wont let me wait that long it wont let me wait that long wait wait wait wait wait that long wait wait wait wait wait that long wait wait wait wait wait that long wait wait wait wait wait that long wait wait wait wait wait that long wait wait wait wait wait that long wait wait wait wait wait that long","Time Won't Let Me","2000"
"Bill Van Riper","i remember holdin on to you all them long and lonely nights i put you through somewhere in there im sure i made you cry but i cant remember if we said goodbye but i recall all of them nights down in mexico one place i may never go in my life again was i just off somewhere just too high but i cant remember if we said goodbye i only miss you here every now and then like the soft breeze blowin up from the carribean most novembers i break down and cry but i cant remember if we said goodbye","Goodbye","2002"
"Bill Vitek","the night is like a lovely tune beware my foolish heart how white the ever constant moon take care my foolish heart theres a line between love and fascination thats hard to see how many names such as this for they both have the very same sensation when youre locked in the magic of a kiss her lips are much too close to mine beware my foolish heart but should our eager lips combine then let the fire start for this time it isnt fascination or a dream that will fade and fall apart its love this time its love my foolish heart","My Foolish Heart","2006"
"Bill Vitt","well they tell me of a pie up in the sky waiting for me when i die but between the day youre born and when you die they never seem to hear even your cry so as sure as the sun will shine im gonna get my share now of whats mine and then the harder they come the harder theyll fall one and all ooh the harder they come the harder theyll fall one and all well the oppressors are trying to keep me down trying to drive me underground and they think that they have got the battle won i say forgive them lord they know not what theyve done ooh yeah oh yeah woah yeah ooooh and i keep on fighting for the things i want though i know that when youre dead you cant but id rather be a free man in my grave than living as a puppet or a slave yeah the harder they come the harder theyll fall one and all","The Harder They Come","1973"
"Bill Vitt","you got a lotta nerve to say you are my friend when i was down you just stood there grinning you got a lotta nerve to say you gotta helping hand to lend you just want to be on the side thats winning you say i let you down you know its not like that if youre so hurt why then dont you show it you say you lost your faith but thats not where its at you had no faith to lose and you know it i know the reason that you talk behind my back i used to be among the crowd youre in with do you take me for such a fool to think id make contact with the one who tries to hide what he dont know to begin with you see me on the street you always act surprised you say how are you good luck but you dont mean it when you know as well as me youd rather see me paralyzed why dont you just come out once and scream it no i do not feel that good when i see the heartbreaks you embrace if i was a master thief perhaps id rob them and now i know youre dissatisfied with your position and your place dont you understand its not my problem i wish that for just one time you could stand inside my shoes and just for that one moment i could be you yes i wish that for just one time you could stand inside my shoes youd know what a drag it is to see you","Positively 4th Street","1973"
"Bill Vitt","beauty is under the skin i say beauty is under the skin dont want to hear it but i know its true beauty is under the skin cover is holdin the book i say cover is holdin the book dont want to hear it but i know its true cover is holdin the book bridge a pretty face is gone in space a beautiful lady has got my place repeat verse 1 instrumental repeat bridge repeat verse 1 title x4","Beauty Is Under the Skin","1999"
"Bill Vitt","train i ride sixteen coaches long train i ride sixteen coaches long well that long black train got my baby and gone train train comin round the bend train train comin round the bend well it took my baby but it never will again no not again train train comin down down the line train train comin down down the line well its bringin my baby cause shes mine all mine shes mine all mine train train comin round round the bend round round the bend train train comin round round the bend round round the bend well it took my baby but it never will again never will again whoo oo oo oo oo hoo","Mystery Train","2006"
"Bill Walker's Orchestra","joy to the world the lord is come here was a man a man who was born in a small village the son of a peasant woman he grew up in another small village until he reached the age of thirty he worked as a carpenter then for three years he was a traveling minister but he never traveled more than two hundred miles from where he was born and where he did go he usually walked he never held political office he never wrote a book never bought a home never had a family he never went to college and he never set foot inside a big city yes here was a man though he never did one on the things usually associated with greatness he had no credentials but himself he had nothing to do with this world except through the devine purpose that brought him to this world while he was still a young man the tide of popular opinion turned against him most of his friends ran away one of them denied him one of them betrayed him and turned him over to his enemies then he went through the mockery of a trial and was nailed to a cross between two thieves and even while he was dying his executioners gambled for the only piece of property that he had in this world and that was his robe his purple robe when he was dead he was taken down from the cross and laid in a borrowed grave provided by compassionate friends more than nineteen centuries have come and gone and today hes a centerpiece of the human race our leader in the column to human destiny i think im well within the mark when i say that all of the armies that ever marched all of the navies that ever sailed the seas all of the legislative bodies that ever sat and all of the kings that ever reigned all of them put together have not affected the life of man on this earth so powerfully as that one solitary life here was a man joy to the world the lord is come","Here Was a Man (Dialogue) [Live]","2012"
"Bill Walker's Orchestra","im gonna try to be that way once upon a time there lived a man many years ago in a foreign land knew how to live right tried to be a light gave everybody a helping hand im gonna try to be that way im gonna try to be that way do the kind of things a man oughta do say the kind of things a man oughta say im gonna try to be that way he never done anybody wrong he tried to help everybody long he brought a better land to make a better man out of the rich or the poor or the weak or the strong and he preached love and brotherhood he went around doin good doin good everywhere he went they knew that he was sent and the people started actin like they should","I'm Gonna Try To Be That Way [Live]","2012"
"Bill Walker's Orchestra","these hands arent the hands of a gentleman these hands are calloused and old these hands raised a family these hands built a home now these hands raised to praise the lord these hands won the heart of my loved one and with hers they were never alone if these hands filled their task then what more could you ask for these fingers have worked to the bone now dont try to judge me by what youd like me be for my life hasnt been a success some people have power but still they grieve while these hands brought me happiness now im tired and im old and i havent much gold maybe things aint been all that i planned lord above hear my plea when its time to judge me take a look at these hard working hands take a look at these hard working hands","These Hands [Live]","2012"
"Bill Ware","night and stars above that shine so bright the mystry of their fading light that shines upon our caravan sleep upon my shoulder as we creep across the sand so i may keep the memry of our caravan this is so exciting you are so inviting resting in my arms as i thrill to the magic charms of you beside me here beneath the blue my dream of love is coming true within our desert caravan","Caravan","2001"
"Bill Ware","ooh lord dear lord above god almighty god of love please look down and see my people through i believe that god put sun and moon up in the sky i dont mind the gray skies cause theyre just clouds passing by heaven is a goodness time a brighter light on high do unto others as you would have them do to you and have a brighter by and by lord dear lord above god almighty god of love please look down and see my people through i believe god is now was then and always will be with gods blessing we can make it through eternity lord dear lord above god almighty god of love please look down and see my people through","Come Sunday","2001"
"Bill Ware","though folks with good intentions tell me to save my tears well im so mad about him i cant live without him never treats me sweet and gentle the way he should ive got it bad and that aint good my poor heart is so sentimental not made of wood ive got it so bad and that aint good but when the fish are jumpin and friday rolls around my man an i we gin some we pray some and sin some he dont love me like i love him the way he should ive got it bad and that aint good yes ive got it bad and that aint good","I Got It Bad (And That Ain't Good)","2001"
"Bill Ware","in a sentimental mood i can see the stars come thru my room while your loving attitude is like a flame that lights the gloom on the wings of evry kiss drift a melody so strange and sweet in this sentimental bliss you make my paradise complete rose pearls seem to fall its all like a dream to call you mine my hearts lighter thing since you made me this night a thing divine in a sentimental mood im within a world so heavenly for i never dreamt that youd be loving sentimental me in a sentimental mood i can see the stars come thru my room while your loving attitude is like a flame that lights the gloom on the wings of evry kiss drift a melody so strange and sweet in this sentimental bliss you make my paradise complete rose pearls seem to fall its all like a dream to call you mine my hearts lighter thing since you made me this night a thing divine in a sentimental mood im within a world so heavenly for i never dreamt that youd be loving sentimental me","In a Sentimental Mood","2001"
"Bill Ware","it dont mean a thing if it aint got that swing doo wah doo wah doo wah doo wah doo wah doo wah doo wah doo wah it dont mean a thing all you got to do is sing doo wah doo wah doo wah doo wah doo wah doo wah doo wah doo wah it makes no diffrence if its sweet or hot just give that rhythm evrything you got oh it dont mean a thing if it aint got that swing doo wah doo wah doo wah doo wah doo wah doo wah doo wah doo wah","It Don't Mean a Thing (If It Ain't Got That Swing)","2001"
"Bill Ware","you aint never been blue no no no you aint never been blue till youve had that mood indigo that feelin goes stealin down to my shoes while i just sit here and sigh go long blues i always get that mood indigo since my baby said goodbye and in the evenin when the lights are low im so lonely i could cry cause theres nobody who cares about me im just a poor fool thats bluer than blue can be when i get that mood indigo i could lay me down and die you aint never been blue no no no you aint never been blue till youve had that mood indigo that feelin goes stealin down to my shoes while i just sit here and sigh go long blues","Mood Indigo","2001"
"Bill Ware","in my solitude you haunt me with dreadful ease of days gone by in my solitude you taunt me with memories that never die i sit in my chair and filled with despair theres no one could be so sad with gloom everywhere i sit and i stare i know that ill soon go mad in my solitude im afraid dear lord above send back my love i sit in my chair filled with despair theres no one no one no onecould be so sad with gloom everywhere i sit and i stare i know that ill soon go mad in my solitude im afraid dear lord above send back my love","Solitude","2001"
"Bill Ware","sophisticated lady tryin to change my ways just because youre caught in your social maze i think its bout time that you realize your money and your powers got you mesmerized pretty lady get back pretty lady yea sophisticated lady put your blue jeans on youre anybodys baby when your mamas gone educated lady with your college degree amazes me why you just cant see learned everything from your books on the shelf but no one ever taught you how to think for yourself pretty lady get back pretty lady yea sweet thing sophisticated lady put your blue jeans on youre anybodys baby when your mamas gone sophisticated lady take a lesson from me i can help you be what you want to be together well see many brighter days if it takes forever gonna change your ways pretty lady get back pretty lady yea sweet thing sophisticated lady put your blue jeans on youre anybodys baby when your mamas gone sophisticated lady put your blue jeans on youre anybodys baby when your mamas gone sophisticated lady put your blue jeans on youre anybodys baby when your mamas gone","Sophisticated Lady","2001"
"Bill Warfield Big Band","somewhere over the rainbow way up high theres a land that ive heard of once in a lullaby somewhere over the rainbow skies are blue and the dreams that you dare to dream really do come true someday ill wish upon a star and wake up where the clouds are far behind me where troubles melt like lemon drops high above the chimney tops thats where youll find me somewhere over the rainbow blue birds fly birds fly over the rainbow why then oh why cant i if happy little bluebirds fly beyond the rainbow why oh why cant i somewhere over the rainbow way up high theres a land that ive heard of once in a lullaby somewhere over the rainbow skies are blue and the dreams that you dare to dream really do come true someday ill wish upon a star and wake up where the clouds are far behind me where troubles melt like lemon drops high above the chimney tops thats where youll find me somewhere over the rainbow blue birds fly birds fly over the rainbow why then oh why cant i if happy little bluebirds fly beyond the rainbow why oh why cant i","Over the Rainbow","1988"
"Bill Watrous","i wish i didnt love you so my love for you should have faded long ago i wish i didnt need your kiss why must your kiss torture me as long as this i might be smilin by now with some new tender friend smilin by now with my heart on the mend but when i try something in that heart says no youre still there i wish i didnt love you so","I Wish I Didn't Love You So",""
"Bill Watrous","just friends lovers no more just friends but not like before to think of what weve been and not to kiss again seems like pretending it isnt the ending two friends drifting apart two friends but one broken heart we loved we laughed we cried and suddenly love died","Just Friends [Take 2]","1973"
"Bill Watrous","there is no greater love than what i feel for you no greater love no heart so true there is no greater thrill than what you bring to me no sweeter song than what you sing to me youre the sweetest thing i have ever known and to think that you are mine alone there is no greater love in all the world its true no greater love than what i feel for you youre the sweetest thing i have ever known and to think that you are mine alone there is no greater love in all the world its true no greater love than what i feel for you","There Is No Greater Love","1986"
"Bill Watrous","how much do i love you ill tell you no lie how deep is the ocean how high is the sky how many times a day do i think of you how many roses are sprinkled with dew how far would i travel to be where you are how far is the journey from here to a star and if i ever lost you how much would i cry how deep is the ocean how high is the sky how far would i travel to be where you are how far is the journey from here to a star and if i ever lost you how much would i cry how deep is the ocean how high is the sky how high is the sky","How Deep Is the Ocean?","1992"
"Bill Watrous","unforgettable thats what you are unforgettable tho near or far like a song of love that clings to me how the thought of you does things to me never before has someone been more unforgettable in every way and forever more thats how youll stay thats why darling its incredible that someone so unforgettable thinks that i am unforgettable too","Unforgettable","1992"
"Bill Watrous","emily emily emily has the murmuring sound of may all silver bells coral shells carousels and the laughter of children at play say emily emily emily and we fade to a marvelous view two lovers alone and out of sight seeing images in the firelight as my eyes visualize a family they see emily emily and we fade to a marvelous view two lovers alone and out of sight seeing images in the firelight as my eyes visualize a family they see emily emily too","Emily","1993"
"Bill Watrous","the shadow of your smile when you have gone will color all my dreams and light the dawn look into my eyes my love and see all the lovely things you are to me our wistful little star it was far too high a teardrop kissed your lips and so did i now when i remember spring all the joys that love can bring i will be remembering the shadow of your smile","The Shadow of Your Smile","1993"
"Bill Watrous","have yourself a merry little christmas let your heart be light from now on our troubles will be out of sight have yourself a merry little christmas make the yuletide gay from now on our troubles will be miles away here we are as in olden days happy golden days of yore faithful friends who are dear to us gather near to us once more through the years we all will be together if the fates allow so hang a shining star upon the highest bough and have yourself a merry little christmas now have yourself a merry little christmas let your heart be light from now on our troubles will be out of sight have yourself a merry little christmas make the yuletide gay from now on our troubles will be miles away here we are as in olden days happy golden days of yore faithful friends who are dear to us gather near to us once more through the years we all will be together if the fates allow so hang a shining star upon the highest bough and have yourself a merry little christmas now","Have Yourself a Merry Little Christmas","1996"
"Bill Watrous","the night is like a lovely tune beware my foolish heart how white the ever constant moon take care my foolish heart theres a line between love and fascination thats hard to see how many names such as this for they both have the very same sensation when youre locked in the magic of a kiss her lips are much too close to mine beware my foolish heart but should our eager lips combine then let the fire start for this time it isnt fascination or a dream that will fade and fall apart its love this time its love my foolish heart","My Foolish Heart","1996"
"Bill Watrous","when somebody loves you its no good unless he loves you all the way happy to be near you when you need someone to cheer you all the way taller than the tallest tree is thats how its got to feel deeper than the deep blue see is thats how deep it goes if its real when somebody needs you its no good unless he needs you all the way through the good or lean years and for all the in between years come what may who know where the road will lead us only a fool would say but if youll let me love you its for sure im gonna love you all the way all the way","All the Way","1998"
"Bill Watrous","say it isnt so say it isnt so everyone is saying you dont love me say it isnt so everywhere i go everyone i know whispers that youre growing tired of me say it isnt so people say that you found somebody new and it wont be long before you leave me say it isnt true say that everything is still okay thats all i want to know and what theyre saying say it isnt so people say passing by say hes younger than i and it wont be long before you leave me tell me its a lie say that everything is still okay thats all i want to know and what theyre saying say it isnt so","Say It Isn't So","2000"
"Bill Watrous","oh danny boy the pipes the pipes are calling from glen to glen and down the mountain side the summers gone and all the roses falling its you its you must go and i must bide but come ye back when summers in the meadow or when the valleys hushed and white with snow its ill be here in sunshine or in shadow oh danny boy oh danny boy i love you so but when ye come and all the flowers are dying if i am dead as dead i well may be youll come and find the place where i am lying and kneel and say an ave there for me and i shall hear though soft you tread above me and all my grave will warmer sweeter be for you will bend and tell me that you love me and i shall sleep in peace until you come to me","Danny Boy","2006"
"Bill Watrous","ill be seeing you in all the old familiar places that this heart of mine embraces all day through in that small cafe the park across the way the childrens carousel the chestnut trees the wishing well ill be seeing you in every lovely summers day in everything thats light and gay ill always think of you that way ill find you in the morning sun and when the night is new ill be looking at the moon but ill be seeing you ill find you in the morning sun and when the night is new ill be looking at the moon but ill be seeing you","I'll Be Seeing You [Trio]","2006"
