"Band","Lyrics","Song","Year"
"Billie Holiday","gone with the wind just like a leaf that has blown away gone with the wind my romance has flown away yesterdays kisses are still on my lips i had a lifetime of heaven at my fingertips now all is gone gone is the rapture that filled my heart gone with the wind the gladness that thrilled my heart just like a flame love burned brightly then became an empty smoke dream that has gone with the wind","Gone With the Wind","1955"
"Billie Holiday","i need your love so badly i love you oh so madly but i dont stand a ghost of a chance with you i thought at last id found you but other lovers surround you and i dont stand a ghost of a chance with you if youd surrender just for a tender kiss or two you might discover that im the lover meant for you and id be true but whats the good of scheming i know i must be dreaming","I Don't Stand a Ghost of a Chance With You","1955"
"Billie Holiday","each night just about sunset i watch you passing my door its all i can do not to run to you cause i dont want to cry anymore nighttime when there is moonlight the same old moon i knew before its all i can do not to run to you cause i dont want to cry anymore all that i know about happiness i found just being with you then i would find myself losing my mind over some careless thing you would do oh why cant i forget you i know so well what is in store a moment or two up in the clouds with you then back where i was before no i dont want to cry anymore all that ive known about happiness i found just being with you then i would find myself losing my mind over some careless thing you would do oh why cant i forget you i know so well what is in store a moment or two up in the clouds with you then back where i was before no i dont want to cry anymore","I Don't Want to Cry Anymore","1955"
"Billie Holiday","the weather is frightening the thunder and lightning seem to be having their way but as far as im concerned its a lovely day the turn in the weather will keep us together so i can honestly say that as far as im concerned its a lovely day and everythings okay isnt this a lovely day to be caught in the rain you were going on your way now youve got to remain just as you were going leaving me all at sea the clouds broke they broke and oh what a break for me i can see the sun up high though were caught in a storm i can see where you and i could be cozy and warm let the rain pitter patter but it really doesnt matter if the skies are gray long as i can be with you its a lovely day","Isn't This a Lovely Day?","1955"
"Billie Holiday","you took my kisses and all my love you taught me how to care am i to be just remnant of a one side love affair all you took i gladly gave there is nothing left for me to save all of me why not take all of me cant you see im no good without you take my lips i want to lose them take my arms ill never use them your goodbye left me with eyes that cry how can i go on dear without you you took the part that once was my heart so why not take all of me","All of Me","1956"
"Billie Holiday","what makes me treat you the way i do gee baby aint i good to you theres nothing in the world too good for a girl thats good and true gee baby aint i good to you bought you a fur coat for christmas a diamond ring a big cadillac car and everything its love that makes me treat you the way i do gee baby aint i good to you what makes me treat you the way i do gee baby aint i good to you theres nothing in the world too good for a guy thats good and true gee baby aint i good to you fur coat for christmas a diamond ring a big cadillac car and everything theres nothing in the world that i wouldnt do gee baby aint i good to you what makes me treat you the way i do gee baby aint i good to you theres nothing in the world too good for a girl thats good and true gee baby aint i good to you fur coat for christmas a diamond ring big cadillac car and everything its love that makes me treat you the way that i do gee baby aint i good to you gee baby aint i good to you","Gee Baby, Ain't I Good to You","1956"
"Billie Holiday","spring is here why doesnt my heart go dancing spring is here why isnt the waltz entrancing no desire no ambition leads me maybe its because nobody needs me spring is here why doesnt the breeze delight me stars appear why doesnt the night invite me maybe its because nobody loves me spring is here i hear spring is here why doesnt my heart go dancing spring is here why isnt the waltz entrancing no desire no ambition leads me maybe its because nobody needs me spring is here why doesnt the breeze delight me stars appear why doesnt the night invite me maybe its because nobody loves me spring is here i hear","Spring Is Here","1956"
"Billie Holiday","im travlin light because my man has gone so from now on im travlin light he said goodbye and took my heart away so from today im travlin light no one to see im free as the breese no one but me and my menories some lucky night he may come back again so until then im travlin light no one to see im free as the breese no one but me and my menories some lucky night he may come back again so until then im travlin light","Trav'lin' Light","1956"
"Billie Holiday","im travlin light because my man has gone so from now on im travlin light he said goodbye and took my heart away so from today im travlin light no one to see im free as the breeze no one but me and my memories some lucky night he may come back again so until then im travlin light no one to see im free as the breeze no one but me and my memories some lucky night he may come back again some lucky night he may come back again so until then im travlin light","Trav'lin Light","1956"
"Billie Holiday","im travelin light because my man has gone so from now on im travelin light he said goodbye and took my heart away so from today im travelin light no one to see im free as the breeze no one but me and my memories some lucky night he may come back again so until then im travelin light no one to see im free as the breeze no one but me and my memories some lucky night he may come back again so until then im travelin light","Travelin' Light","1956"
"Billie Holiday","everything i have is yours you are part of me everything i have is yours my destiny i would gladly give the sun to you if the sun were only mine i would gladly give the earth to you and the stars that shine everything that i posses i offer you let my dream of happiness come through ill be happy just to spent my life waiting at your backend call everything i have is yours my life my all everything i have is yours you are part of me everything i have is yours my destiny i would gladly give the sun to you if the sun were only mine i would gladly give the earth to you and the stars that shine everything that i posses i offer to you let my dream of happiness come through ill be happy just to spent my life waiting at your backend call everything i have is yours my life my all","Everything I Have Is Yours","1956"
"Billie Holiday","i hadnt anyone till you i was a lonely one till you i used to lie awake and wonder if there could be a someone in the wide world just made for me now i see i had to save my love for you i never gave my love till you and through my lonely heart demanding it cupid took a hand in it i hadnt anyone till you","I Hadn't Anyone Till You","1956"
"Billie Holiday","comes a rainstorm put your rubbers on your feet comes a snow storm you can get a little heat comes love nothing can be done comes a fire then you know just what to do blow a tire you can buy another sure comes love nothing can be done dont try hiding cause there isnt any use you start sliding when your heart turns on the juice comes a headache you can lose it in a day comes a toothache see your dentist right away comes love nothing can be done comes a heat wave you can hurry to the shore comes the summer you can hide behind the door comes love nothing can be done comes the measles you can quarantine the room comes a mousy you can chase it with the broom comes love nothing can be done thats all brother if youve ever been in love thats all brother you know what im speaking of comes a nightmare you can always stay awake comes depression you may get another break comes love nothing can be done","Comes Love [Alternate Take][*]","1957"
"Billie Holiday","comes a rainstorm put your rubbers on your feet comes a snow storm you can get a little heat comes love nothing can be done comes a fire then you know just what to do blow a tire you can buy another sure comes love nothing can be done dont try hiding cause there isnt any use you start sliding when your heart turns on the juice comes a headache you can lose it in a day comes a toothache see your dentist right away comes love nothing can be done comes a heat wave you can hurry to the shore comes the summer you can hide behind the door comes love nothing can be done comes the measles you can quarantine the room comes a mousy you can chase it with the broom comes love nothing can be done thats all brother if youve ever been in love thats all brother you know what im speaking of comes a nightmare you can always stay awake comes depression you may get another break comes love nothing can be done","Comes Love [False Start][*]","1957"
"Billie Holiday","day in day out that same old voodoo follows me about that same old pounding in my heart whenever i think of you and baby i think of you day in and day out day out day in i neednt tell you how my days begin when i awake i get up with a tingle one possibility in view that possibility of maybe seeing you come rain come shine i meet you and to me the day is fine then i kiss your lips and the pounding becomes an oceans roar a thousand drums cant you see its love can there be any doubt when there it is day in day out","Day in Day Out","1957"
"Billie Holiday","left new york this morning early traveling south so wide and high sailing through the wide blue yonder its that air mail special on the fly listen to the motors humming she is streaking through the sky like a bird thats flying homeward its that air mail special on the fly over plains and high dark mountains over rivers deep and wide carrying mail to california its that air mail special on the fly watch her circle for the landing hear her moan and cough and sigh now shes coming down the runway its that air mail special on the fly","Air Mail Special","1958"
"Billie Holiday","my heart is sad and lonely for you i pine for you dear only why havent you seen it im all for you body and soul i spend my days in longing and wondering why its me youre wronging i tell you i mean it im all for you body and soul i cant believe it its hard to conceive it that youd turn away romance are you pretending it looks like the ending unless i can have just one more chance dear my life a wreck youre making my heart is yours for just the taking ill gladly surrender myself to you body and soul","Body and Soul [#][*]","1958"
"Billie Holiday","this lovely day will lengthen into evening well sigh goodbye to all we ever had alone where we have walked together ill remember april and be glad ill be content you loved me once in april your lips were warm and love and spring were new im not afraid of autumn and her sorrow for ill remember april and you the fire will dwindle into glowing ashes for flames live such a little while i wont forget but i wont be lonely ill remember april and smile","I'll Remember April [#][*]","1958"
"Billie Holiday","im gonna sit right down and write myself a letter and make believe it came from you im gonna write words oh so sweet theyre gonna knock me off of my feet a lot of kisses on the bottom ill be glad i got em im gonna smile and say i hope youre feeling better and close with love the way that you do im gonna sit right down and write myself a letter and make believe it came from you im gonna sit right down and write myself a letter and make believe that it came from you im gonna write words oh so sweet yeah lotta kisses on the bottom ill be glad i got em im gonna smile and say i hope youre feeling better and close with love the way that you do im gonna sit right down and write myself a letter and make believe it came from you im gonna sit right down and write myself a letter and make believe it came make believe that it came from you","I'm Gonna Sit Right Down and Write Myself a Letter [#][*]","1958"
"Billie Holiday","its very clear our love is here to stay not for a year but ever and a day the radio and the telephone and the movies that we know may just be passing fancies and in time may go but oh my dear our love is here to stay together were going a long long way in time the rockies may crumble gibraltar may tumble theyre only made of clay but our love is here to stay in time the rockies may crumble gibraltar may tumble theyre only made of clay but our love is here to stay","Love Is Here to Stay [#][*]","1958"
"Billie Holiday","lullaby of birdland thats what i always hear when you sigh never in my wordland could there be ways to reveal in a phrase how i feel have you ever heard two turtle doves bill and coo when they love thats the kind of magic music we make with our lips when we kiss and theres a weepy old willow he really knows how to cry thats how id cry in my pillow if you should tell me farewell and goodbye lullaby of birdland whisper low kiss me sweet and well go flyin high in birdland high in the sky up above all because were in love","Lullaby of Birdland [#][*]","1958"
"Billie Holiday","perdido i look for my heart its perdido i lost it way down in torito the day the fiesta started bolero i sway that they play the bolero i kissed me the listing sombrero and thats when my heart departed high was the sun when i held him close low was the moon when we said adios perdido my heart ever since is perdido i know i must go to torito to find what i lost perdido high was the sun when i held him close low was the moon when we said adios perdido goodnight perdido i lost perdido","Perdido [#][*]","1958"
"Billie Holiday","skyliner skyliner flying so freely we seem to really touch heaven higher higher ever higher sunbeams all dance on your wings where the light falls and then when night falls stars dance above giving a show for the people below as we fly as we fly so high hearing each single beat of the motors repeat with a sigh baby by and by ill hold him close thats the sweet song they sing me skyliner bring me home to love im hurrying home to you im through with being lonely im hurrying home to you dont you know youre my one and only fast fast traveling fast dear all the quarrels of the past well keep in the past dear i wanna be in your arms where i can hug and kiss you i wanna be in your arms wanna show you the way i miss you fast fast traveling fast dear and to have you close is all that im thinking of","Skyliner [#][*]","1958"
"Billie Holiday","this cant be love because i feel so well no sobs no sorrows no sighs this cant be love i get no dizzy spells my head is not in the skies my heart does not stand still just hear it beat this is too sweet to be love this cant be love because i feel so well i love to look in your eyes i love to look in your eyes this cant be love because i feel so well no sobs no sorrows no sighs this cant be love i get no dizzy spells my head is not in the skies my heart does not stand still just hear it beat this is too sweet to be love this cant be love because i feel so well i love to look in your eyes i love to look in your eyes","This Can't Be Love","1958"
"Billie Holiday","be wise be smart behave my heart dont upset your cart when shes so close be soft be sweet but be discreet dont go off your beat shes so close for comfort too close too close for comfort please not again too close too close to know just when to say when be firm be fair be sure beware on your guard take care while theres such temptation one thing leads to another too late to run for cover shes much too close for comfort now too close too close for comfort please not again too close too close to know just when to say when so be firm and be fair be sure beware on your guard take care while theres such temptation one thing leads to another too late to run for cover shes much too close for comfort now too close much too close shes much too close for comfort now","Too Close For Comfort [#][*]","1958"
"Billie Holiday","so i walk a little too fast and i drive a little too fast and im reckless its true but what else can you do at the end of a love affair so i talk a little too much and i laugh a little too much and my voice is too loud when im out in a crowd so that people are apt to stare do they know do they care that its only that im lonely and low as can be and the smile on my face isnt really a smile at all so i smoke a little too much and i drink a little too much and the tunes i request are not always the best but the ones where the trumpets blare so i go at a maddening pace and i pretend that its taking his place but what else can you do at the end of a love affair do they know do they care that its only that im lonely and low as can be and the smile on my face isnt really a smile at all so i smoke a little too much and i drink a little too much and the tunes i request are not always the best but the ones where the trumpets blare so i go at a maddening pace and i pretend that its taking his place but what else can you do at the end of a love affair","The End of a Love Affair [instrumental track & overdub take 8]","1958"
"Billie Holiday","so i walk a little too fast and i drive a little too fast and im reckless its true but what else can you do at the end of a love affair so i talk a little too much and i laugh a little too much and my voice is too loud when im out in a crowd so that people are apt to stare do they know do they care that its only that im lonely and low as can be and the smile on my face isnt really a smile at all so i smoke a little too much and i drink a little too much and the tunes i request are not always the best but the ones where the trumpets blare so i go at a maddening pace and i pretend that its taking his place but what else can you do at the end of a love affair do they know do they care that its only that im lonely and low as can be and the smile on my face isnt really a smile at all so i smoke a little too much and i drink a little too much and the tunes i request are not always the best but the ones where the trumpets blare so i go at a maddening pace and i pretend that its taking his place but what else can you do at the end of a love affair","The End of a Love Affair: The Audio Story [#][*]","1958"
"Billie Holiday","im a fool to want you im a fool to want you to want a love that cant be true a love thats there for others too im a fool to hold you such a fool to hold you to seek a kiss not mine alone to share a kiss the devil has known time and time again i said id leave you time and time again i went away but then would come the time when i would need you and once again these words ill have to say im a fool to want you pity me i need you i know its wrong it must be wrong but right or wrong i cant get along without you i cant get along without you","I'm a Fool to Want You [Edited Master]","1958"
"Billie Holiday","im a fool to want you im a fool to want you to want a love that cant be true a love thats there for others too im a fool to hold you such a fool to hold you to seek a kiss not mine alone to share a kiss the devil has known time and time again i said id leave you time and time again i went away but then would come the time when i would need you and once again these words ill have to say im a fool to want you pity me i need you i know its wrong it must be wrong but right or wrong i cant get along without you i cant get along without you","I'm a Fool to Want You [Take 3][#][*]","1958"
"Billie Holiday","you dont know what love is until youve learned the meaning of the blues until youve loved a love youve had to lose you dont know what love is you dont know how lips hurt until youve kissed and had to pay the cost until youve flipped your heart and you have lost you dont know what love is do you know how lost heart feels at the thought of reminiscing and how lips that taste of tears lose their taste for kissing you dont know how hearts burn for love that cannot live yet never dies until youve faced each dawn with sleepless eyes you dont know what love is you dont know how hearts burn for love that cannot live yet never dies until youve faced each dawn with sleepless eyes you dont know what love is what love is","You Don't Know What Love Is","1958"
"Billie Holiday","love is funny or its sad its quiet or its mad its a good thing or its bad but beautiful beautiful to take a chance and if you fall you fall and im thinking i wouldnt mind at all love is tearful or its gay its a problem or its play its heartache any way but beautiful and im thinking if you were mine id never let you go and that would be but beautiful i know love is tearful or its gay its a problem or its play its heartache any way but beautiful and im thinking if you were mine id never let you go and that would be but beautiful i know","But Beautiful","1958"
"Billie Holiday","so i walk a little too fast and i drive a little too fast and im reckless its true but what else can you do at the end of a love affair so i talk a little too much and i laugh a little too much and my voice is too loud when im out in a crowd so that people are apt to stare do they know do they care that its only that im lonely and low as can be and the smile on my face isnt really a smile at all so i smoke a little too much and i drink a little too much and the tunes i request are not always the best but the ones where the trumpets blare so i go at a maddening pace and i pretend that its taking his place but what else can you do at the end of a love affair do they know do they care that its only that im lonely and low as can be and the smile on my face isnt really a smile at all so i smoke a little too much and i drink a little too much and the tunes i request are not always the best but the ones where the trumpets blare so i go at a maddening pace and i pretend that its taking his place but what else can you do at the end of a love affair","End of a Love Affair","1958"
"Billie Holiday","ill be around no matter how you treat me now ill be around from now on your latest love can never last and when its past ill be around when shes gone goodbye again and if you find a love like mine just now and then drop a line to say youre feeling fine and when things go wrong perhaps youll see youre meant for me and ill be around when shes gone goodbye again and if you find a love like mine just now and then drop me a line say youre feeling mighty fine when things go wrong perhaps youll see youre meant for me and ill be around when shes gone when shes gone","I'll Be Around","1958"
"Billie Holiday","how can i tell you what is in my heart how can i measure each and every part how can i tell you how much i love you how can i measure just how much i do how much do i love you ill tell you no lie how deep is the ocean how high is the sky how many times a day do i think of you how many roses are sprinkled with dew how far would i travel to be where you are how far is the journey from here to a star and if i ever lost you how much would i cry how deep is the ocean how high is the sky","How Deep Is the Ocean? [*]","1958"
"Billie Holiday","ooh what a little moonlight can do ooh what a little moonlight can do to you youre in love your hearts fluttering all day long you only stutter cause your poor tongue just will not utter the words i love you ooh what a little moonlight can do wait a while till a little moonbeam comes peepin through youll get bored you cant resist him and all youll say when you have kissed him is ooh what a little moonlight can do ooh what a little moonlight can do ooh what a little moonlight can do to you youre in love your hearts fluttering all day long you only stutter cause your poor tongue just will not utter the words i love you ooh what a little moonlight can do wait a while till a little moonbeam comes peepin through youll get bored you cant resist him","What a Little Moonlight Can Do [*]","1958"
"Billie Holiday","day in day out that same old voodoo follows me about that same old pounding in my heart whenever i think of you and baby i think of you day in and day out day out day in i neednt tell you how my days begin when i awake i get up with a tingle one possibility in view that possibility of maybe seeing you come rain come shine i meet you and to me the day is fine then i kiss your lips and the pounding becomes an oceans roar a thousand drums cant you see its love can there be any doubt when there it is day in day out","Day In - Day Out","1959"
"Billie Holiday","as dorothy parker once said to her boyfriend fare thee well as columbus announced when he knew he was bounced it was swell isabelle swell as abelard said to heloise dont forget to drop a line to me please as juliet cried in her romeos ear romeo why not face the fact my dear it was just one of those things just one of those crazy flings one of those bells that now and then rings just one of those things it was just one of those nights just one of those fabulous flights a trip to moon on gossamer wings just one of those things if wed thought a bit of the end of it when we started painting the town wed have been aware that our love affair was too hot not to cool down so goodbye dear and amen heres hoping we meet now and then it was great fun but it was just one of those things","Just One of Those Things","1959"
