"Band","Lyrics","Song","Year"
"Ednita Nazario","por ti me casare es evidente y contigo claro esta me casare por ti me casare por tu caracter que me gusta hasta morir nose porque y eso me da mas miedo que verguenza porque casarse es una adivinanza por ti me casare por tu sonrisa porque estas casi tan loca como yo y tenemos en comun mas de un millon de cosas por ti me casare por ejemplo que los dos odiamos las promesas por ti me casare pero yo sere tu esposo tu seras mi esposa y yo prometere que te querre y tu tambien prometeras que me querras con tanto miedo que cruzaras los dedos por ti me casare una cuestion de piel firmaremos nuestro amor en papel y pobre del que se ria es un estupido no sabe no comprende que el amor es simpatia porque nuestro matrimonio es mucho mas que un pacto por ti me casare y al final seguro que todo sera perfecto por ti me casare aunque somos diferentes somos casi exactos y yo prometere que te querre y tu tambien prometeras que me querras hasta la muerte todo es cuestion de suerte suerte por ti me casare cuando te encuentre cuando sepa donde estas quien eres tu","Por Ti Me Casare","1996"
"Ednita Nazario","todavia no se acaba esta pasion aun hay tiempo de poner el corazon y en la noche quiere mas despertar tu cuerpo mas recorrer cada rincon de tu ansiedad no te vayas que la luna se ha empenado en ver el sol le a pedido unos minutos de ilusion y mi cuerpo pide mas mi razon me pide mas y un torrente corre por mis venas se que estoy atada a tu volcan sintiendo la explosion enredada a tu cuerpo sumergida en tu interior atada a tu volcan viviendo de este amor rogando que la noche no termine y aun asi no quiero llegar al final pues todavia tengo ganas para amar no te vayas no me dejes tan sedienta a tu calor dejame volcar en ti todo este amor y mi piel se enciende mas mis palabras vibran mas vuelve a navegar dentro de mi porque yo estoy atada a tu volcan intentare algun modo que no me aferre a todo no se estar viviendo sola sin tu amor rogando que la noche no termine y aun asi no quiero llegar al final pues todavia tengo ganas para amar","Atada a Tu Volcán","1996"
"Ednita Nazario","al reir me acuerdo de ti why de este gran vacio no hay nada que te aparte de mi ser mi mente no tedeja perecer no lo hara por que estas en mi why dependo de ti al solo pensar te siento siento que te acabas de ir por mas que borro tu ayer estas entre mi alma why piel no dejo de llorar yo estoy why tu no estaras llevara tu nombre el dia gris why de mar eternamente tu estartas en cada sol naciente de ti nunca vendra lo suficiente siempre hay mas why se escapa asi otro ao sin ti no haceindo ningun efecto siento que te acabas de ir por mas que borro tu ayer estas entre mi alma why piel no dejo de llorar yo estoy why tu no estaras miente aquel dijo que tiempo acaba con el dolor quien sabe el que nunca amo de ti se oye un final te grito why tu no vendras","Siento Que Te Acabas de Ir","1996"
"Ednita Nazario","te quiero mas alla de nuestros cuerpos yo te quiero en el fondo de mi pecho yo te siento necesidad que invade al respirar que me impide asi dudar y somos dos almas ajenas que se conocieron apenas ayer y veo que seria un mundo distinto sin tu risa que al tenerte cerca me gana la prisa y escapamos de la realidad para amarnos de verdad llora mi alma en tus manos se mece en tu pelo y se oculta en tu piel te quiero asi por ser simplemente original porque al sugerirte tu me das por ser la palabra en mis razones y al hablar te quiero asi por ser el primero en discutir por ser el que llora al ver sufrir por darmelo todo y por tu paciencia al tratarse de mi te quiero porque celas a la sombra que yo llevo porque acabas al problema con un beso y me sabes la forma al despertar y me escuchas al sonar depende mi vida de tu alma como el universo depende de dios te quiero te quiero asi y siempre te querre","Te Quiero","1996"
"Ednita Nazario","rebelame el momento en que dejaste de existir explica paso a paso lo que conlleva el convivir pues la vida es un juego de azar y en mis ojos no esta tu mirar dime tu a donde llevaste el amor porque no te encuentras en mi porque no esta tu voz en todo lo que tengo que decir dime tu que has hecho que ya me da igual si vienes y estas o te vas y todo lo peor es ver que no me sabes contestar te busco y no te encuentro aunque te tengo frente a mi no hay culpas ni lamentos solo pregunto al presentir que lo nuestro perdio identidad y hoy no se si reir o llorar dime tu a donde llevaste el amor porque no te encuentras en mi porque no esta tu voz en todo lo que tengo que decir dime tu que has hecho que ya me da igual si vienes y estas o te vas y todo lo peor es ver que no me sabes contestar dime tu que has hecho que ya me da igual si vienes y estas o te vas y todo lo peor es ver que ya no puedes contestar","Dime Tu","1997"
"Ednita Nazario","no necesariamente tiene que ser ahora no necesariamente tiene que ser urgente pero una furia loca pone mi sangre ardiente que sera que sera que sera sera el amor no necesariamente tiene que ser aprisa pero hoy quiero abrazarte perderme en tu sonrisa hazme llegar al cielo con un latido eterno lento lento lento quiero que tu me ames como si fuera unica quiero que me acorrales en el rincon mas intimo why enredada a tu cuerpo te robare el aliento quiero que me hagas el amor quiero que me hagas el amor no necesariamente tiene que ser perfecto deja volar tu mente entre el amor why el sexo bajo esta luna blanca danza feliz mi cuerpo no necesariamente tiene que ser legitimo quiero entregarme toda why que sea reciproco hazme temblar el alma hasta la luz del alba furia calma furia calma quiero que tu me ames como si fuera unica quiero que me acorrales en el rincon mas intimo why enredada a tu cuerpo te robare el aliento quiero que me hagas el amor quiero que me hagas el amor oh oh quiero que me hagas el amor quiero que me hagas el amor","Quiero Que Me Hagas el Amor","1997"
"Ednita Nazario","a que no le cuentas cuando estas callado que es porque me piensas a que no le cuentas que te pones triste cuando a mi me dejas a que no le cuentas que si llegas tarde vienes de dejarme a que no le dices que ella no es tu duena ni esta en tu conciencia a que no le cuentas de una vez por todas lo que estas viviendo dile que tu eres mio que tu perteneces a mi corazon a que no le cuentas a que no te animas pase lo que pase que ya no soportas tener que dejarme porque soy tu amante a que no le cuentas que al cerrar la puerta quieres escaparte a que no le cuentas que cuando te abraza sabes compararme a que no le cuentas que si llegas tarde vienes de dejarme a que no le dices que ella no es tu duena ni esta en tu conciencia a que no le cuentas de una vez por todas lo que estas viviendo dile que tu eres mio que tu perteneces a mi corazon a que no le cuentas a que no te animas pase lo que pase que ya no soportas tener que dejarme porque soy tu amante a que no le cuentas de una vez por todas lo que estas viviendo dile que tu eres mio que tu perteneces a mi corazon a que no le cuentas a que no te animas pase lo que pase que ya no soportas tener que dejarme porque soy tu amante","A Que No le Cuentas","1998"
"Ednita Nazario","baila baila corazon abrazate fuerte a mi no me sueltes por favor baila dulce en mi habitacion aprietame la cintura toma mi cuerpo y baila dulce mas que grande que grande mas cielo que el cielo el amor es tanto que al final da miedo mas profundo y puro que los sentimientos el amor te mata de puro sincero veneno bendito veneno unas gotitas de amor en vena hacen de lo malo bueno veneno lo siento siento por mi piel tan dulce como la miel y tan amargo como el centeno mas que grande que grande mas cielo que el cielo el amor es tanto que al final da miedo mas profundo y puro que los sentimientos el amor te mata de puro sincero porque el amor es un veneno vamos a bailar abrazaditos como angeles volar volar en un rincon de la ciudad vamos a morir como dos heroes anonimos mirando al mar y sini saber lo que decir mas que grande que grande mas cielo que el cielo el amor es tanto que al final da miedo mas profundo y puro que los sentimientos el amor te mata de puro sincero vamos a bailar abrazaditos como angeles volar volar en un rincon de la ciudad vamos a morir como dos heroes anonimos mirando al mar y sin saber lo que decir","Mas Grande Que Grande","1999"
"Ednita Nazario","tu sabes bien que sin ti no funcionare sera intentar volar sin alas tu sabes bien sin ti el invierno sera muy cruel ya no habra hogueras en mi playa y todo el tiempo que pasamos juntos no lo olvidare sera una mancha en el agua y cada noche que te ame lo juro la recordare junto a la luna en mi cama ay ay ay que sera de ti ay ay ay que va a ser de mi si tu te alejas y yo me quedo llorando por ti tu sabes bien que si me quitas del medio hoy voy a llorar un mar de lagrimas tu sabes bien no es tan facil decir adios y luego continuar en calma y cuando lejos muy lejos estes te recordare con tristeza en la mirada y cuando el deseo entre en mi piel imaginare tu mano bajo mi falda por que sera que el amor el amor es como una ola cuando llega te besa te abraza y con facilidad te abandona por que sera mi amor que va a ser de mi si tu te alejas y yo me quedo muy solita aqui ay amor ay amor ay amor","Tu Sabes Bien","1999"
"Ednita Nazario","he viste entre los arboles tu pelo que jugaba con el viento de pronto un sentimiento se apodera de mi mente y eres tu el sol sea levantado por delante y el mar te esta mirando desde el sur te miro y de repente el horizonte es tan distante como tu te miro y de repente el horizonte es tan distante como tu corazon que le has hecho a mi corazon corazon luna llena cancion de amor la vida siempre ha sido asi tu por tu lado y yo por mi corazon magico corazon que le has hecho a mi corazon corazon luna llena cancion de amor la vida siempre ha sido asi tu por tu lado y yo por mi corazon magico corazon que le has hecho a mi corazon corazon luna llena cancion de amor la vida siempre ha sido asi tu por tu lado y yo por mi corazon magico corazon que le has hecho a mi corazon corazon luna llena cancion de amor la vida siempre ha sido asi tu por tu lado y yo por mi corazon magico","Que Me Ame Mas","1999"
"Ednita Nazario","chico dont get discouraged the man he aint so hard to understand chico if you try now i know that you can lend a helping hand because theres good in everyone and a new day has begun you can see the morning sun if you try and i know things will be better oh yes they will for chico and the man yes they will for chico and the man","Chico and the Man","2000"
"Ednita Nazario","arjona tu me dices yo te digo y asi empieza nuestra guerra cotidiana yo me armo de adjetivos tu conjugas el peor de mis pasados ednita y te apunto donde duele y te acuerdo el peor de tus pecados tu reviras la ofensiva y disparas donde sabes que haces dano arjona y en el campo de batalla quedan muertos los minutos que perdemos tu me dices yo te digo y asi acaba nuestra guerra cotidiana esta guerra sin cuartel que nadie gana ambos porque hablamos y no usamos ese tiempo en darnos besos arjona en pintarnos con las manos las caricias que queremos ambos y que no nos damos porque siempre hablamos ednita de lo tuyo y de lo mio arjona del pasado y los culpables ambos mientras muere otro minuto porque hablamos arjona ya te dije que no es cierto ya dijiste que tu no eres lo que digo nadie cree nadie acepta cada quien defiende su utopia ednita y el fantasma de la duda se abre paso en la frontera del futuro y el presente moribundo se consuela con lo poco que nos queda arjona y te quiero ednita y me quieres pero somos mas idiotas que sensatos y aparece otro dia arjona y nos van quedando llagas incurables de esta maldita enfermedad de hablar de mas ambos porque hablamos y no usamos ese tiempo en darnos besos en pintarnos con las manos las caricias que queremos y que no nos damos porque siempre hablamos de lo tuyo y de lo mio del pasado y los culpables mientras muere otro minuto porque hablamos mientras muere otro minuto ednita porque hablamos arjona porque hablamos","Porque Hablamos","2001"
"Ednita Nazario","amarle ahora es imposible ya lo se el tiene ya otro amor y yo no tengo nada me siento triste al ver llegar la noche amor ahora se que fui yo quien mas perdia inevitablemente soy el pequeno rio que se perdio en su mar ay corazon me hiciste tanto dano tu me ensenaste a amarlo y ahora yo no se olvidar ay amor ay amor por que me dueles tanto ay amor ay amor recuerdame quererle ahora no tiene causa ni razon no tiene voluntad es solo una locura quedarme sola es mi destino ya lo ves aprendere a vivir asi sin el y silenciosamente levantare mi vuelo para volver jamas ay corazon","Ay Amor","2001"
"Ednita Nazario","prefiero quedarme sola no quiero vivir asi no puedo escapar de ti why quiero volver con el perfiero quedarme sola no puedo seguir asi con el alma herida why confundido mi corazon corazon desorientado corazon corazon estoy perdiendo la razon corazon desorientado corazon corazon no te equivoques por favor prefiero quedarme sola no quiero vivir asi no puedo escapar de ti why quiero volver con el perfiero quedarme sola no quiero ser infiel no puedo seguir contigo mo debo volver con el corazon desorientado corazon corazon estoy perdiendo la razon corazon desorientado corazon corazon no te equivoques por favor corazon desorientado corazon corazon estoy perdiendo la razon corazon desorientado corazon corazon no te equivoques por favor","Corazon Desorientado","2001"
"Ednita Nazario","yo quisiera decirte mil cosas y quiero decirte cantando eres distinto y me gustas eres alegre y me gustas eres todos para mi yo quisiera decirte te quiero y quiero decirte cantando eres unico y me gustas eres tan tierno y me gustas eres todo para mi eres mi talla perfecta eres la luz de mis suenos eres mi mundo pequeno eres todo para mi eres como el horizonte eres come la nostalgia eres mi melancolia eres todo para mi yo quisiera decirte mil cosas y quiero decirte cantando eres un loco y me gustas eres tan sabio y me gustas eres todo para mi yo quisiera decirte te quiero y quiero decirte cantando eres el sol de mis dias eres mi dulce alegria eres todo para mi","Eres","2001"
"Ednita Nazario","yo no se que hacer me enamore de ti en un dia y no se por que hiciste renacer mi vida aun sabiendo que lo nuestro no podria ser esta situacion de verte tanto a escondidas no puede seguir me danas sin querer mi vida y hoy te marchas de mi lado con otro querer y asi yo vivo mi vida herida y asi yo vivo sonando sonando que tu estaras a mi lado por siempre conmigo y asi yo vivo mi vida herida y asi yo vivo sonando sonando que tu estaras a mi lado por siempre a mi lado no te vayas sin saber cuanto te amo debes entender que ya no seguire mintiendo en este nuevo amor que se deshace con el tiempo y hoy que estoy en agonia te recordare nunca olvidare que me perdia en tu mirada y a traves de ti logre saber cuanto te amaba y hoy te marchas de mi lado con otro querer","Herida","2001"
"Ednita Nazario","el hombre que yo amo tiene algo de nino la sonrisa ancha tierna la mirada tiene la palabra de mil hombres juntos y es mi loco amante sabio inteligente el hombre que yo amo no le teme a nada pero cuando ama lo estremece todo guerrero incansable en busca de aventuras tiene manos fuertes calidas y puras el hombre que yo amo sabe que yo lo amo me toma en sus brazos y lo olvido todo el es mi motivo es mi propio sol el hombre que yo amo sabe que yo lo amo y vuela siempre lejos pero vuelve al nido el hombre que yo amo sabe que yo lo amo yo lo quiero loco pero loco mio el hombre que yo amo siempre sabe todo sabe de enojos no entiende rencores el arregla todo con sabiduria con solo mirarme me alegra la vida el hombre que yo amo esta vivo en mi mente es mi unico idolo entre tanto gente el hace una fiesta con mi pelo suelto ladron de mis suenos duende de mi almohada el hombre que yo amo sabe que yo lo amo me toma en sus brazos y el me da alegria que nadie me dio","El Hombre Que Yo Amo","2001"
"Ednita Nazario","mio aunque sea pretensioso yo te quiero solo mio para amar cada secreto de tu cuerpo solo mio mio desde el centro de la tierra hasta el fondo de mi alma mio mio solo mio mio en la noche mas obscura why en la luz de pleno da mio para amarte why adorarte con pasin why con ternuda mio mio mio quiero tu amor solo mio que nadie quiera tocarte que nadie se atreva jams conquistarte mio mio quiero tu amor solo mio que nadie intente robarte que nadie se atreva tan slo mirarte mio mio mio mio mio sin dejar ningn momento de sentirte slo mio mio desde el fondo de los mares hasta el beso ms profundo mio del instante mas sublime al contacto mas perfecto mio moi slo mio mio en la noche mas obscura why en la luz de pleno da mio para amarte why adorarte con pasin why con ternuda mio mio mio quiero tu amor solo mio que nadie quiera tocarte que nadie se atreva jams conquistarte mio mio quiero tu amor solo mio que nadie intente robarte que nadie se atreva tan slo mirarte mio mio quiero tu amor solo mio que nadie quiera tocarte que nadie se atreva jams conquistarte bis","Mio","2001"
"Ednita Nazario","no te imagines que yo me pasare la vida entera solo pensando en ti why esperandote coro esperandote esperandote coro esperandote no te imagines que yo soportare que solo vengas cuando quieras pasion why entregarte a mi coro why entregarte a mi why luego por ti coro why luego por ti ya no puedo esperar a que vengas cuando te de la gana nunca estas que me importa perderte ya no vuelvo a pensar mas en ti ni tonta sigo amandote siempre amandote why esperandote prefiero renunciar a ti why ponerle fin a esta situacion ni tonta sigo amandote siempre amandote why esperandote prefiero renunciar a ti why ponerle fin a esta situacion si tu me buscas ahora conseguiras que yo te olvide why ya no me encontraras recordandote coro recordandote esperandote coro esperandote solo hallaras que cuando es algo que hallar si tu de mi no encontraras nadie mas esperandote coro esperandote esperandote coro esperandote ya no puedo esperar a que vengas cuando te de la gana nunca estas que me importa perderte ya no vuelvo a pensar mas en ti ni tonta sigo amandote siempre amandote why esperandote prefiero renunciar a ti why ponerle fin a esta situacion ni tonta sigo amandote bis ni tonta sigo amandote ultimo bis why fade out hasta el final","Ni Tonta Sigo Amandote","2001"
"Ednita Nazario","qu peligroso amor es tu amor para m qu peligroso es why dulce a la vez que me siento segura pero lleno de dudas que me agranda ia vida why me alargo el silencio peligroso amor es tu amor para m me ha devuelto las ganas de vivir why de amar pero estoy condenada a tenerte why perderte se me ha vuelto un abismo mi vida por ti amor amor amor amor amargo amor tan dulce amor amor tan tierno amor que duele amor que hiere amor que endulza amor que vaga amor amor amor amor amargo amor tan dulce amor amor tan tierno amor que quema amor que enferma amor que llama amor que mata qu peligroso amor es tu amor para m yo no quiero jugar no es un juego el amor mariposa insegura ya no puede volar porque voy a perder why t vas a ganar amor amor amor amor amargo amor tan dulce amor amor tan tierno amor que duele amor que hiere amor que endulza amor que amarga amor amor amor amor amargo amor tan dulce amor amor tan tierno amor que quema amor que enferma amor que llama amor que mata amor amor amor amor amargo amor tan dulce amor amor tan tierno amor que duele amor que hiere amor que endulza amor que vaga","Peligroso Amor","2001"
"Ednita Nazario","que no juro que sin ti yo no vuelvo a morir debo dejarte ahora yo se que mi amor no podras olvidar aunque pasen las horas yo no quiero tenerte a mi lado compartiendo un amor atrapado esperando que cuando te marches ya no quieras verme pero a veces cuando algo termina simplemente se duerme en el tiempo y el carino que un dia te di quiso escaparse ahora pero cuidate lejos de mis besos abrigate lejos de mis brazos cuidate que mi amor debo dejarte ahora porque se que cuando regreses no estare cuando tu me llames te deje porque amor lo siento no estoy sola que no ya no digas que yo por tu amor no siento nada mientes tal vez sentiras que el amor que te di no era para siempre y yo no quiero que cuando recuerdes pienses que mi pasion fue un engano seguiria a tu lado tratando de salvarlo todo pero a veces cuando algo termina simplemente se duerme en el tiempo y el carino que un dia te di quiso escaparse ahora pero cuidate lejos de mis besos abrigate lejos de mis brazos cuidate que mi amor debo dejarte ahora porque se que cuando regreses no estare cuando tu me llames te deje porque amor lo siento no estoy sola pero cuidate lejos de mis besos abrigate lejos de mis brazos cuidate que mi amor debo dejarte ahora porque se que cuando regreses ya no estare cuando tu me llames te deje porque amor lo siento no estoy sola porque se que cuando regreses ya no estare cuando tu me llames te deje porque amor lo siento no estoy sola","Que No","2001"
"Ednita Nazario","quiero cantarle al amor motor del universo razn de la existencia de ti de m y de cada ser que habita el planeta quiero cantarle al amor en tres o cuatro versos cantarle porque calma mi ser porque alimenta mi alma quiero cantarle al amor porque me supo hallar quiero cantarle al amor que me vino a buscar se llev mi soledad y a cambio me dej su fantasa en el alma quiero cantarle al amor que me dio libertad quiero cantarle al amor porque me hizo volar se llev mi soledad y a cambio me dej su fantasa en el alma en el alma en el alma quiero cantarle al amor motor del universo razn de la existencia de ti de m y de cada ser que habita el planeta que quin no tenga el amor no pierda la esperanza tarde o temprano aparecer como aparece el sol en el alba quiero cantarle al amor porque me supo hallar quiero cantarle al amor que me vino a buscar se llev mi soledad y a cambio me dej su fantasa en el alma quiero cantarle al amor que me dio libertad quiero cantarle amor porque me hizo volar se llev mi soledad y a cambio me dej su fantasa en el alma quiero cantarle al amor porque me supo hallar quiero cantarle al amor que me vino a buscar se llev mi soledad y a cambio me dej su fantasa en el alma","Quiero Cantarle Al Amor","2001"
"Ednita Nazario","quiero ver quiero ver quiero ver con quien andas donde estas quiero ver quiero ver quiero ver lo que tramas con quien vas quiero ser la primera saber si me enganas la primera saber si no es mi a qiem amas si tu curiosidad por saber qien oculpa mi lugar quiero saber quiero saber dejame ver quiero saber quiero saber quien anda en mi lugar quiero saber quiero saber dejame ver quiero saber quiero saber quien te fue a conquistar quiero saber quiero saber dejame ver quiero saber quiero saber quien anda en mi lugar a de ser una chica muy lista quizas un raro ejemplar talvez solo se trate de una simple curiosidad quiero ser la primera saber quien me gana la primera saber si fue una falla humana siento curiosidad por saber qien oculpa mi lugar quiero saber quiero saber dejame ver quiero saber quiero saber quien anda en mi lugar quiero saber quiero saber dejame ver quiero saber quiero saber quien te fue a conquistar quiero saber quiero saber dejame ver quiero saber quiero saber quien anda en mi lugar quiero saber quiero saber dejame ver quiero saber quiero saber quien anda en mi lugar quiero saber quiero saber dejame ver quiero saber quiero saber quien te fue a conquistar quiero saber quiero saber dejame ver quiero saber quiero saber quien anda en mi lugar","Quiero Saber","2001"
"Ednita Nazario","no quiero escuchar que has dicho por ahi que fui tu gran amor why nunca lo entendi no quiero esperar que me hablen los demas que busquen el error sin saber la verdad que daba la vida sin buscar algo mas soy ala quebrada que aprendio a volar no dejare que intentes otra vez botar mi corazon sin querer sin querer no dejare que uses el amor que robes lo mejor sin querer sin querer no quiero escapar ir lejos de tu amor en recuerdo a lo que fue invento lo que soy ya todo lo raro tus huellas en mi piel no volvere a sentir que eres parte de mi que daba la vida sin buscar algo mas soy ala quebrada que aprendio a volar no dejare que intentes otra vez botar mi corazon sin querer sin querer no dejare que uses el amor que robes lo mejor sin querer sin querer no dejare que intentes otra vez","Sin Querer","2001"
"Ednita Nazario","sera mejor que te lo diga de una vez antes que llegue a suceder lo que sospecho hay un amor que no he podido desprender de lo mas hondo de mi ser por mas que quiero tenia tus manos tu mirar tu candidez y como tu era un atento caballero pero de pronto fue un infierno vivir con el y si he salido de las llamas debo cuidarme de caer en el brasero te pareces tanto a el cuando me amaba cuando yo era su universo y su razon de ser te pareces tanto a el cuando en su alma solo existia yo y me era fiel te pareces tanto a el que es un consuelo porque creo que algun dia te llegare a querer pero mientras voy matando su recuerdo yo se que a ti tambien tambien te perdere tenia tus manos tu mirar tu candidez y como tu era un atento caballero pero de pronto fue un infierno vivir con el y si he salido de las llamas debo cuidarme de caer en el brasero te pareces tanto a el cuando me amaba cuando yo era su universo y su razon de ser te pareces tanto a el cuando en su alma solo existia yo y me era fiel te pareces tanto a el que es un consuelo porque creo que algun dia te llegare a querer pero mientras voy matando su recuerdo yo se que a ti tambien te perdere te pareces tanto a el que es un consuelo porque creo que algun dia te llegare a querer pero mientras voy matando su recuerdo yo se que a ti tambien tambien te perdere","Te Pareces Tanto a El","2001"
