"Band","Lyrics","Song","Year"
"Monica","monica twista twista you already know its the 17th one week before the day you were born i been makin big plans just for over a month tryin to make this the best birthday you ever had show you that youre my baby damn all this strain got me feelin somethins wrong pulled up to my gate they keep sayin hes gone found envelopes in between my door biggest day got me panickin what the hell this letter gonna read hell no you say you dont want it no more hell no you say you cant give me what i want hell no how you just gonna leave when i stayed wit you through hard times and you cheated hell no i hate to say it but i need it hell no god please talk to me hell no your so called love was so deep when it told you you should run far and not give a damn about me how could you leave me when you see me desperately in need of what we had before how could you leave home i cried so many times but never did it cross my mind to think but let it go how could you leave home didnt even ever see if we ever meant this shit before but we been down this road before how could you leave home how could you leave me baby please my heart is beating for the beat we had before how could you leave home now i need you wanna laugh wanna stand wanna get just one more chance just to see you all my friends all my kin say mo just let that end but i breath you in the driveway i found pictures on the ground of our first date i never in a million years thought this would be me im trapped in love with somebody that no longer thinks im somebody special look at me hell no you say you dont want it no more hell no you say you cant give me what i want hell no how you just gonna leave when i stayed wit you through hard times and you cheated hell no i hate to say it but i need it hell no god please talk to me hell no your so called love was so deep that it told you you should run far and not give a damn about me how could you leave me when you see me desperately in need of what we had before how could you leave home i cried so many times but never did it cross my mind to think but let it go how could you leave home didnt even ever see if we ever meant this shit before but we been down this road before how could you leave home how could you leave me baby please my heart is beating for the beat we had before how could you leave home monica and twista yall i remember when you said i couldnt get none of that then i remember when you let me hit it from the back i remember we was young and sprung and steady talkin on the phone and how we both kept runnin back to each other we were always together forever to the end i dont really know why i froze up plannin for a weddin but gettin married its scary now i got you cryin cause a nigga didnt show up cant really tell you why but im twista from the chi and im dyin inside cause i know i really want you so for leavin one day i will have to give you the answer girl but right now i cant tell you why i left girl sweet personality and good sex girl fear will take a man life you suppose to be my wife goodbye hope to see you in the next world you was all up under me actin like you was so in love i was talkin bout you but thug nigga what you runnin for cop wit you in the benz you the first one seen on the block wit it took you to the club showed you how to lean wit it rock wit it you was bold when you wanna get some of that when you wanna hit the hole like a running back then you left now you wanna come runnin back hell no nigga i dont wanna hear none of that i know you quick betta spit that shit to so all i ever wanna say to you is how could you leave me when you how could you leave me when you how could you leave me when you see me desperately in need of what we had before how could you leave home i cried so many times but never did it cross my mind to think but let it go how could you leave home didnt even ever see if we ever meant this shit before but we been down this road before how could you leave home how could you leave me baby please my heart is beating for the beat we had before how could you leave home all the women i caught you with still i didnt leave but i didnt forget all those women i caught you with maybe i didnt leave but i didnt forget all those women i caught you with but i didnt leave but i didnt forget all those women women i caught you with i didnt leave but i didnt forget","Hell No (Leave Home)","2006"
"Monica","i aint never had nothing quite like this and cant believe a girl done made a come up like this aint never been in love like this before i aint never seen a ring shine like this i aint never had nobody fit me like this i cant believe that all of this is happenin to me if im dreamin let me sleep boy you you got my back and baby i got yours you you got that lovin that i would die for boy ive been waitin all this time and livin with nothing but now i got now i got everything i got a good man im makin weddin plans yeah the one i took home to mom and dad he stole my heart now i got everything someone who dont cheat somebody who wont leave me lonely even though it took a lifetime to get here now i finally i got everything its you never had no one go half on a baby someone to do it like i like can serve me daily no one ever love me like this before i never had a house feel like a home i never had a man that was full grown like you baby whatd i do to deserve you i may never know but i know i got you you got my back and baby i got yours you you got that lovin that i would die for boy ive been waitin all this time and livin with nothing but now i got you now i got everything i got a good man im makin weddin plans yeah the one i took home to mom and dad he stole my heart now i got everything someone who dont cheat somebody who wont leave me lonely even though it took a lifetime to get here now i finally see i got everything its you now that i got you i never wanna lose you i love everything you do dont wanna live without you just what ive been missin all this love im givin i wouldnt trade it for nothin my everything is you now i got everything i got a good man im makin weddin plans yeah the one i took home to mom and dad he stole my heart now i got everything someone who dont cheat somebody who wont leave me lonely even though it took a lifetime to get here now i finally i got everything its you","My Everything","2006"
"Monica","whoo whoo aye swizzie monica aye lets work bounce bounce bounce a t l you want that you gotta have that i know you need that you gotta have that come on hey you want that you gotta have that i know you need that you gotta have that ladies you get the paper make the paper you know im a come and save ya you know where i live i got them million dollar neighbors i came through ya block lookin so clean them chicks like damn he got that shoulder lean you can touch it you can grab it if you like it you can have it we flyin way far girl i make that ya habit im caked out to death you rocked out to death i make ya spend it all till it aint aint left im a have to spit it like this say the same thing wit a little twist soft sweet aint workin no more no im finna give it to ya raw so yo 22s aint nothin new you out hustlin you better bring it in soft sweet aint workin no more no im finna give it to ya raw so you can say bye to me being lady like say peace to me tryna keep the peace it aint work then you only hurtin me now you missin me when i go crazy get in line when i lose my mind see i found out i gotta get you mad for you to make me glad so i im a have to spit it like this say the same thing wit a little twist soft sweet aint workin no more no im finna give it to ya raw so yo 22s aint nothin new you out hustlin you better bring it in soft sweet aint workin no more no im finna give it to ya raw so ladies and gentlemen aye who oh hey get it come on okay okay okay swizzie well since you so street im a bring it to ya level imagine im a ya new connect you about to meet tomorrow keepin me happy is so important im the one who can keep us balling so take that apply it to this all that hard work apply it to here if you want me to be me to be the girl that you lost im a have to spit it like this say the same thing wit a little twist soft sweet aint workin no more no im finna give it to ya raw so yo 22s aint nothin new you out hustlin you better bring it in soft sweet aint workin no more no im finna give it to ya raw so im finna give it to ya raw so all my girls just give it to em raw so them boys with no game we aint for im a have to im a have to spit it like this like this say say the same thing wit a little twist soft sweet aint workin no more it aint workin no more no im finna give give it to ya raw it to ya raw so yo 22s aint nothin new you out hustlin everyday hustlin you better bring it in soft sweet yeah no no no aint workin no more no im finna give it to ya raw so hoo ooh i say hoo whoa oh whoa so raw","Raw","2006"
"Monica","ho ho sideline ho yous a ho yous a ho sideline ho when you called his phone did he pick it up no cause we was makin love did you meet his moms have you met his kid no did you know my kid was his get your shit together youre makin a fool of yourself yeah it dont matter if he spends the night his home is somewhere else aint you tired of being on the sideline tired of getting yours after i gets mine baby second place dont get a prize when you gonna realize you wasting your time baby aint you tired of him gettin in hittin it real quick then rollin and aint you tired of you need a little change and he lie about what he holdin aint you tired of spending all the holidays alone tired of being his little sideline ho do he take you out do he foot your bills no cause i know what his balance is have you been to his church do he ask you to pray no cause sundays family day do you got benefits no credit cards no house keys no then yous a sideline ho do you get pillow talk no held at night no if you dont make his breakfast yous a sideline ho yous a ho yous a ho sideline ho yous a ho yous a ho sideline ho yous a ho yous a ho sideline ho","Sideline Ho","2006"
"Monica","my last tear just fell from my eyes told myself that i wasnt going to cry no more you did what you did it is what it is and thats why i walked out the door moved on with my life but not really spent too much time wondering how could you you do this to us while we were in love i guess i was thinking too much i was thinking that the sex had your love you never could get enough cause i kept it hot i listen to you tell me your dreams and your fears i wiped your tears i was there and this is why this is hurting me why her why her did i get on your nerves did i give you too much that you couldnt handle my love why her why her tell me what she was worth it to make you put her first and deceive me you wanna come back but i gotta know why her i thought she was all that then why you at my door now look at you look at us whats all this for hope you got the answers to my questions why her this going to be the last time we say goodbye aint going to be no reruns of this episode you did what you did it is what it is maybe if you would of told me you werent happy you werent satisfied we could of worked it out maybe we could of tried but you didnt say nothing all of alone fakin it in front of me why i was thinking that the sex had your love you never could care enough but you know i cant deny i listen to you tell me your dreams and your fears i wiped your tears i was there and it hurts me why her why her did i get on your nerves did i give you too much that you couldnt handle my love why her why her tell me what she was worth it to make you put her first and deceive me you wanna come back but i gotta know why her i thought she was all that then why you at my door now look at you look at us whats all this for hope you got the answers to my questions why her now ladies yall know i speak from experience right i used to look at him and wonder why why her yeah know what im saying but ladies i learn not to worry about them living a happily ever after because that shit just build on a lie so it should of fall thats why i stand tall baby baby baby i just looked at him and said this is why you why her why her did i get on your nerves did i give you too much that you couldnt handle my love why her why her tell me what she was worth to make you put her first and deceive me the grass looks greener on the other side but i promise youll be back tonight now look at you look at us whats all this for hope you got the answer to my questions why her","Why Her?","2006"
"Monica","everything it was every breathe i took every feeling i felt was you been through fire you out the wire for you and i would die for you damit look at me all this hurt you see it was caused by you all the things baught they could never cause as much pain i took from you now you look at me saying baby please i could never be back to way things were when you were here with me now i realize that you cant make it with out me ooh thanks thanks thanks for the misery all that you done to me thanks thanks you know you didnt have to keep all that away from me thanks thanks dealt with a tragedy theres no more you and me thanks thanks now everything you didnt give someone else has given me who who was the one that made you roll the dice twice one time two times aint right who who was the one on the phone that night who who remember bahamas and how much she cried what do i say to you what nothing but prayed for who who in the h3llwas the man that i think was you who aint no dawm way i could ever feel safe with you bridge back to way things were when you were here with me now i realize that you cant make it with out me ooh thanks thanks thanks for the misery all that you done to me thanks thanks you know you didnt have to keep all that away from me thanks thanks dealt with a tragedy theres no more you and me thanks thanks thanks now everything you didnt give someone else has given me see their i was thinking all along you were the perfect example of a man to me but when i look back i mean really look back you only just missed half of the qualities of a man that i needed you to be but now thanks for all your selfishness that day will never be thank for the memories thanks thanks thanks for the misery all that you done to me thanks thanks you know you didnt have to keep all that away from me thanks thanks dealt with a tragedy theres no more you and me thanks thanks now everything you didnt give someone else has given me","Thanks for the Misery [Bonus Material]","2006"
"Monica","ooh baby baby baby whoa oh my my my my baby yeah girl oh i love you baby ooh yes i yes i do girl i love you in the night im gonna take it real real slow ooh my baby i understand what you told me and if i didnt know i always wanted someone just like you i really to hold you i d give the world to you oh my darlin you know i will yeah yeah you know i will i surely will i will never do anything to hurt you i wouldnt do one single thing to you babe i ll give all my love to you gonna give every bit of my love my love and if you need me baby i ll come runnin yes i will only to you to you my baby yes i will why dont we just lay down baby and hold each other real real close cause i dont want to rush you baby no no no no no if time if time is what you need the most i always wanted to love you you could make all my dreams come true i want to love you love you tonight oh my darlin yes i do na na yeah yeah yeah i will never do anything to hurt you i will never do one little thing to you baby i ll give all my love to you and im gonna give you every little bit of my love tonight girl and if you need me baby i ll come runnin oh ho yes i will only to you only to you baby oh oh oh i mmm mmm now now now now girl ive been longin for you baby for a long long time girl let s make love tonight babe i can make you feel real good baby i can make you feel real good baby sometimes sometimes i get a little lonely baby it gets so rough for me baby and i need somebody i could call all mine i need the love so fine so you are the one for me baby i know that you are the world for me baby you are the one yeah yeah yeah yeah yeah yeah whoa i will never do anything to hurt you i will never never do a thing to hurt you i ll give all my love to you i give you every single bit of my love and if you need me baby i ll come runnin all you got to do baby only to you when you need somebody pick up the phone i ll be there i ll be right there i will never do anything to hurt you ooh baby baby baby i ll give all my love to you understand understand what im sayin to you baby and if you need me baby i ll come runnin oh baby only to you only to you baby only to you baby only you baby i ll never hurt you i will never do anything to hurt you i ll give all my love to you and if you need me baby i ll come runnin only to you","I'll Give All My Love to You","2007"
"Monica","let me be the one who can take you from all the things you see and if you trust in me i can be that through anything you need anything you need and give it all to me baby dont you run from me baby ill give you every little piece of me no i wont leave out a thing cause i know i know youve seen a lot of things in your life got you feeling like this cant be right but i wont hurt you im down for you baby i know youve seen a lot of things i know youve seen a lot of things in your life got you feeling like this cant be right but i wont hurt you im down for you baby im down for you baby let me show you love can be easy if you just let it be if you let be nothing is promised but i believe if if i give it everything i ll give you everything ive got ill wont stop until you get it right all the trust all the love you know we got a lot baby i know youve seen a lot of things in your life got you feeling like this cant be right but i wont hurt you im down for you baby i know youve seen a lot of things i know youve seen a lot of things in your life got you feeling like this cant be right but i wont hurt you im down for you baby im down for you baby i trust you i love you i want you i need you baby i breath you never leave you life wouldnt be the same without you i trust you i love you i want you i need you baby i breath you never leave you life wouldnt be the same without you no no no no no i know youve seen a lot of things in your life got you feeling like this cant be right but i wont hurt you im down for you baby i know youve seen a lot of things i know youve seen a lot of things in your life got you feeling like this cant be right but i wont hurt you im down for you baby im down for you baby i know youve seen a lot of things in your life in your life in your life in your life i wont hurt you baby no in your life in your life in your life in your life i love you baby oh i dont care what they say about us oh no no no no no in your life in your life in your life in your life i wont hurt you baby know in your life in your life in your life in your life i wont hurt you baby no in your life in your life in your life in your life i love you baby yeah oh","Trust","2008"
"Monica","alright he my little running back but he know im running it he love that im from the bottom i be all on top of it yea he buy me louie i buy him gucci sneaks i got his homies saying i got homie on a leash im thinking i want this forever like drake cause im his nurse and he my dr dre im in bahamas drinking nuvo straight i told him ill be sick if you dont stay cause just nobody else that can do the things that you do i promise ill always be true and when you feel the need to love let me be the one you thinkin of but i will make it so right forever and ever baby i will always be there for you you just run to me cause ha ha ha therell never be another no ha ha ha therell never be another for me i will always be there you baby im riding with him like obama cause he dont give me drama and his bank account say comma comma comma comma comma i cant be no calmer its a honor take him to meet my momma c c cause he the best i be all up in his chest he undress me with his eyes when im getting dressed id be so impressed other niggas cant impress these are the only words id say when i cant express cause just nobody else that can make me feel the way you do forever ill be there for you and when you feel you need to love let me be the one you thinkin of cause i will make it so right forever and ever baby i will always be there for you you just run to me cause ha ha ha therell never be another no ha ha ha therell never be another for me i will always be there you baby when i met you on the first day wouldnt never knew that youd always have a thing on my heart but i gave you a chance and we were making plans now all i think about is you cause of you and i been through the worst weather and you know love cant get no better you were everything and everything is you and im never leaving baby ill stay because nobody else that can make me feel the way you do forever ill always be there for you when you feel the need to love let me be the one youre thinkin of cause i will make it so right forever and ever baby i will always be there for you you just run to me cause ha ha ha therell never be another no ha ha ha therell never be another for me i will always be there you baby ah","Always","2010"
"Monica","you must have it twisted or have a shortage i aint even empty handed i beg your pardon if im departing im taking everything cause ill be damned if another bitch wore your last name put your hands up ladies if you want it all put your hands up ladies if you want it all put your hands up ladies if you want it all say i want it all say i want it all i want it all i want it all i want it all i want it all i want it all i want it all i want it all i want it all i went looking for ur phone when i shouldnt have cause i found just what i was looking for a new number says its kelly should i call it or should i just ignore now im sittin here wondering when youre coming home then i thought about it everything thats going on i gotta leave this relationship but im not leaving here so let me get my list out what do i want other than this house first off let me put your bitch out call me crazy if you want her but i dont care now back to my list gotta have the house check do i want the car check do i want the money check gotta have it all check and i deserve it hope it was worth it and i dont think that ill be needing your service i need his house i need his house i need his car i need his car and then the bank and then the bank i want it all i want it all i gave you all my love and got nothing in return so now i want it all i want it all i want it all i want it all gimmi the house gimmi the house gimmi the car gimmi the car i want it all i want it all i want it all i want it all i want it all i want it all i want it all i want it all if im gonna have to hurt u gonna feel it how i feel it play the cards how i deal it you know i was the realist cause the way you going bout this like i never meant shit now you want the other bitch cause we had an argument o k roll the dice im a show you how it go and since u wanna do it dirty watch this fire crack a blow this aint no tip or tap shit its all about the principle how you expect to leave me without a comma or decimal pay me for my pain pay me for my time nigga you can say the bullshit cause everything is mine from the house in west pond to the yatch in burlese you can keep your sad face baby hand me them keys cause the shit you said it did it threw me way off track but when a woman is fed up no it aint no turning back only thing gonna make me smile is if i feel my satisfaction is seeing you hurt is fuckin you suffering while im relaxing so now i need his house i need his house i need his cars i need his cars and then the bank and then the bank i want it all i want it all i gave you all my love and got nothing in return so now i want it all i want it all i want it all i want it all gimmi the house gimmi the house i need the car gimmi the car i want it all i want it all i want it all i want it all i want it all i want it all put your hands up ladies if you want it all put your hands up ladies if you want it all put your hands up ladies if you want it all say i want it all say i want it all i want it all i want it all i want it all i want it all i want it all i want it all i want it all i want it all i need his house i need his car and then the bank i want it all i want it i want it i earned it your a liar your a cheater gimmi what i need ill leave you alone if you gimmi what i please ooh i want it all ooh ooh be a man about it put your hands up ladies if you want it all you know what you did to me put your hands up ladies if you want it all put your hands up ladies if you want it all say i want it all say i want it all i want it all","I Want It All","2010"
