"Band","Lyrics","Song","Year"
"Edith Frost","whyd i give my love away whyd i call out the unspoken whyd i change what seemed alright to bring my love out in the open when i socked it away for years i guess id made a barricade and hung my key by the door so thats what secrets are for theres a storm coming down in the morning with a freezing rain to add to our worries and i wont speak of these things anymore ill just bury them down in drifts of snow where spring may come to see them grow theres a storm coming down from virginia and a womans heart that yearns for the sun and i wont speak of these things anymore ill just bury them down under drifts of snow where spring may come to see them grow","Secrets","1997"
"Edith Frost","before the ice was broken i thought it was only me before the words were spoken we crept into other dreams now our shadows whisper were getting closer we know were falling we can go on forever we can go on forever we can go on til we hit the ground dont try to understand it the pleasure is worth the fear theyll watch us launch our rockets well grow wings and disappear cause our shadows whisper were getting closer we know were falling we can go on forever we can go on forever we can go on til we hit the ground we can go on forever we can go on forever we can go on til we hit the ground","Falling","1998"
"Edith Frost","my window faces the south im almost halfway to heaven snow is falling still i can see fields of cotton calling to me my window faces the south and though i am far from the swanee im never frownin or down in the mouth my window faces the south my window faces the south im almost halfway to heaven snow is falling still i can see fields of cotton calling to me my window faces the south though i am far from the swanee im never frownin or down in the mouth my window faces the south my window faces the south my window faces the south","My Window Faces the South","1998"
"Edith Frost","hes a gentle killer who dreams of fame sings like sorrow and guides me away he tempts me with whiskey and draws himself near and late in the night its the one thing i hear at sunset we swallow another one down watching the little dogs chasing around catching the droplets of rain in their mouths that fall from the leaves between us and the clouds we know we were born for this darkening night and something we used to know says its alright catching the droplets of rain in our mouths that fall from the leaves between us and the clouds","Between Us","1999"
"Edith Frost","i dont know what to do about you i dont know what to do about you i learned a lot of rules from the bible baby but i wonder wonder what i should do i wonder wonder what i should do i dont know why im stayin with you if everything theyre sayin is true i heard about you lyin to your mama baby and i wonder wonder what i should do i wonder wonder what i should do words dont hardly even matter when nothin seems to satisfy your mind trust is ready to find do you think you can make it to tomorrow when everything youre sayin is true then ill know what to do about you as always my wanderin mind takes me right down to the bottom of the basement when everything youre sayin is true then ill know what to do about you whenever you decide what youre wantin baby then i wonder wonder what i should do i wonder wonder what i should do plans dont hardly even matter when everybodys messin with your mind love is ready to find do you think you can make it to tomorrow when everything youre sayin is true then ill know what to do about you as always my wanderin mind takes me right down to the bottom of the basement im wanderin im a wanderin child goin right down to the bottom of the basement","Wonder Wonder","2001"
"Edith Márquez","dos recuerdos tengo en la vida que no se apartan de mi el dia que te conoci la noche que te perdi no se que pueda decirte o lo que tengo que hacer para volver a mirarme en esos ojos que ame al cielo pido silencio para que no vuelvas a mi o que tan solo me diga que es lo que ha sido de ti regresa mi amor te lo pido a menos que seas muy feliz regresa para que compruebes que pierdes el tiempo sin mi para que no busques en nadie lo que tienes en mi dos espinas llevo clavadas muy dentro del corazon nuestra primera vez y lo que no pudo ser a dios le pido que entiendas que si alguien te ama soy yo me duelen tanto tus dudas pero yo se que vendras regresa mi amor te lo pido a menos que seas muy feliz regresa para que compruebes que pierdes el tiempo sin mi para que no busques en nadie lo que tienes en mi","Dos Recuerdos","1998"
"Edith Márquez","enamorada como tu me tienes tan ilusionada tan dueno de mi alma te confias abandonada se me van los dias hablando con el aire sin ningun detalle pretendes que me calle por que dices que me quieres me provocas y me hieres porque estoy enamorada tu te burlas y me enganas porque soy tan entregada es que abusas tu de mi porque estoy enamorada me he negado muchas veces a caer en otros brazos te aprovechas porque sabes que yo estoy enamorada enamorada sabes que me tienes tan desesperada tan dueno de nada te extravias abandonada se me van las noches hablando con la luna los deseos se me esfuman yo mas sola que ninguna por que dices que me quieres me provocas y me hieres porque estoy enamorada tu te burlas y me enganas porque estoy tan entregada es que abusas tu de mi porque estoy enamorada me he negado muchas veces a caer en otros brazos te aprovechas porque sabes que yo estoy enamorada","Enamorada","1998"
"Edith Márquez","si la quieres esta bien no te voy a detener me olvidaste y te perdi yo deseo te vaya bien que te olvide yo jamas fuiste amor de atardecer el que se queda en tu ser porque fue amor puro y fiel amala como me amaste a mi que todo te lo di que a todo dije si llenale la vida de placer intenta enloquecer amarla hasta caer eso jamas sera eso jamas sera eso jamas sera en ella me amaras que te olvide yo jamas fuiste amor de atardecer el que se queda en tu ser el que fue amor puro y fiel amala como me amaste a mi que todo te lo di que a todo dije si llenale la vida de placer intenta enloquecer amarla hasta caer eso jamas sera eso jamas sera eso jamas sera en ella me amaras eso jamas sera eso jamas sera eso jamas sera en ella me amaras","Eso Jamas","1998"
"Edith Márquez","disculpame por suponerte especial por creer que eras mas alto que la luna vivi en una jaula de cristal pero hoy quiero volar como ninguna atiendeme no quieras darme explicacion yo deje que ocurriera la aventura perdoname por darte el corazon mi unica intencion era ser tuya cuanto antes vete por favor se te hace tarde adios fue mi error mi fantasia aposte a un perdedor asi es la vida fue mi error mi fantasia compartir lo mas valioso que tenia fue mi error mi fantasia pretender que francamente me querias fue mi error mi fantasia confundir amor total con cobardia atiendeme no quieras darme explicacion yo deje que ocurriera la aventura perdoname por darte el corazon mi unica intencion era ser tuya cuanto antes vete por favor se te hace tarde adios fue mi error mi fantasia aposte a un perdedor asi es la vida fue mi error mi fantasia compartir lo mas valioso que tenia fue mi error mi fantasia pretender que francamente me querias fue mi error mi fantasia confundir amor total con cobardia no es culpa mia","Mi Error, Mi Fantasia","1998"
"Edith Márquez","que pena me da saberte tan triste y tan solo despues de volar tan alto que duro es caer no te puedes quejar la vida te ha dado de todo tuviste carino de sobra y lo echaste a perder que sorpresas nos brinda el destino tu te fuiste a encontrar otro nido hoy regresas buscando un abrigo que no te dare mirame no soy la misma de antes esta sonrisa es por alguien que quiero a morir mirame es un placer saludarte hoy que tu vives tan triste y yo tan feliz que raro te ves perdieron el brillo tus ojos que fue del ayer el hombre seguro de si sintiendote un rey el mundo te queda tan corto hoy callas y bajas el rostro quien lo iba a decir que sorpresas nos brinda el destino tu te fuiste a encontrar otro nido hoy regresas buscando un abrigo que no te dare mirame no soy la misma de antes esta sonrisa es por alguien que quiero a morir mirame es un placer saludarte hoy que tu vives tan triste y yo tan feliz hoy que tu vives tan triste y yo tan feliz","Mirame","1998"
"Edith Márquez","que te vas y aunque por dentro me muera ni una lagrima mas en mi vida llorare por ti dignidad esa que tu no conoces y que me hace tener la mirada sin bajar los ojos frente a ti cualquiera tiene derecho a buscar por la vida quien le haga feliz pero lo que no entiendo es que si hay tanta gente tu me pagues asi precisamente con ella te vas no pudiste enganarme con nadie mas de la mas grande amiga hoy se ha vuelto tu amante que tristeza que yo sea la culpable precisamente con ella te vas no pudiste enganarme con nadie mas de la mas grande amiga hoy se ha vuelto tu amante que tristeza que yo sea la culpable por tanto hablarle de ti ya veras que el tiempo esta de mi lado ojala y no le cuentes detalles no sea que te pase lo que a mi cualquiera tiene derecho a buscar por la vida quien le haga feliz pero lo que no entiendo es que si hay tanta gente tu me pagues asi precisamente con ella te vas no pudiste enganarme con nadie mas de la mas grande amiga hoy se ha vuelto tu amante que tristeza que yo sea la culpable precisamente con ella te vez no pudiste enganarme con nadie mas de la mas grande amiga hoy se ha vuelto tu amante que tristeza que yo sea la culpable por tanto hablarle de ti de ti","Por Hablarle de Ti","1998"
"Edith Márquez","necesito prepararme ya que voy a estar sin ti perder el miedo al silencio dicen que es cuestion de tiempo no suelo estar sola no quiero estar sola necesito acostumbrarme ya que voy a estar sin ti los sentimientos que sobraban son los mismos que hoy se acaban hoy quedan heridas lo que eran caricias porque sola sola resulta que me esta cobrando el tiempo el hecho de haber vivido solo para ti y al velar tus pensamientos me quede vacia por dentro porque hoy nada tengo ya que voy a estar sin ti tanto tiempo dedicado tu a tus cosas yo a ti y si al principio enamorados terminamos siendo extraos firmando con jueces sin vernos las caras y es que sola sola me duele el hecho de quedarme sola sola pues yo vivia solo para ti con los recuerdos como herencia y un divorcio por sentencia voy a prepararme para acostumbrarme ya que voy a estar sin ti","Ya Que Voy a Estar Sin Ti","1998"
"Edith Márquez","acariciame el alma vida mia y toma en tus manos tibias mi ansiedad ver si quita con un besoeste llanto quitame con tu sonrisa el dolor acostumbrame al cielo de tus ojos dame entre tus brazos todo el calor dame con una mirada la certeza de que con tu amor la vida me pago carino mio quitame el frio y acostumbrame al cielo llevame lejos levanta el vuelo viaja despacio por mi cuerpo dime que al fin es para siempre este amor carino mio quita este frio y acostumbrame al cielo llevate lejos el sentimiento de que nada es eterno y que el amor es para siempre entre tu y yo acostumbrame al cielo acostumbrame al cielo acariciame el alma vida mia y toma en tus manos tibias mi ansiedad ver si quita con un besoeste llanto quitame con tu sonrisa el dolor carino mio quitame el frio y acostumbrame al cielo llevame lejos levanta el vuelo viaja despacio por mi cuerpo dime que al fin es para siempre este amor carino mio quita este frio y acostumbrame al cielo llevate lejos el sentimiento de que nada es eterno y que el amor es para siempre entre tu y yo acostumbrame al cielo acostumbrame al cielo acostumbrame al cielo acostumbrame al cielo","Acostúmbrame Al Cielo","2000"
"Edith Márquez","la ultima vez que te vi calle las cosas que siempre he sentido por ti por un impulso de las palabras que yo queria que tu escucharas por que jamas me detuve a pensar que era posible que el destino pudiera arrancarte asi de mi por que yo nunca debi callar cuanto te quise que yo diera por verte tan solo una vez mas ay quien pudiera volver en el tiempo y tenerte tan solo una vez mas para decirte que te amo para decir que te extrano y que este llanto es mi ofrenda por tu adios la ultima vez que te vi con la mirada dijiste te quiero y senti que el mundo entero seria de nosotros quien dijera que aquella tarde te despidieras por que jamas me detuve a pensar que era posible que el cruel destino pudiera arrancarte asi de mi por que yo nunca debi de callar cuanto te quise lo que yo diera por verte tan solo una vez mas ay quien pudiera volver el tiempo y tenerte tan solo una vez mas para decirte que te amo para decir q te extrano y que este llanto es mi ofrenda por tu adios por tu adios por tu adios","Despedida","2000"
"Edith Márquez","esta vez ya se que voy a estar muy sola pero en fin el mundo me ha cambiado y estoy bien porque el dia que te fuiste lo confieso casi muero sin ti y hoy me doy cuenta que en la vida hay opciones esta vez prometo no buscarte y no llorar por que se que asi lo has elegido y es mejor porque fue una injusticia del destino enamorarme de la persona equivocada y hoy ya se que si el amor es verdadero ni se pide ni se ruega ni se da y es que opciones da la vida de curarnos las heridas de volver a equivocarnos levantarse y corregir de tener la vista en alto desandar cada paso y olvidarme de ti y es que opciones da la vida de borrarme las mentiras de vivir sin tu carino y de nuevo ser feliz de volver a enamorarme y prometo que esta vez sabre elegir","Esta Vez","2000"
"Edith Márquez","unas nubes negras van por el cielo y poquito a poco han cubierto el sol como un presentimiento me tiembla desde adentro el corazon ya la lluvia moja este sentimiento que poquito a poco se desbordo en forma de mil lagrimas mis ojos no se pueden contener dime que no es cierto lo que siento dime que es mentira que te vas que todo esto ha sido solo un mal sueno que conmigo siempre estaras dime que todo lo he imaginado dime que me lo he inventado yo pero me despierto y el corazon me grita la verdad que ya no me quieres un caballo negro va desbocado y en una barranca se despeno tan grande es mi tristeza y tan incontrolable es el dolor unas flores blancas a nuestra historia y unos velos negros a nuestro amor el sol serian las flores los velos nubes negras del adios dime que no es cierto lo que siento dime que es mentira que te vas que todo esto ha sido solo un mal sueno que conmigo siempre estaras dime que todo lo he imaginado dime que me lo he inventado yo pero me despierto y el corazon me grita la verdad que ya no me quieres que tu no me quieres","Nubes Negras","2000"
"Edith Márquez","para no llorar para no llorar no debi ponerte en primer lugar me olvide de mi y te regale mi vida mi tiempo mi amor y mi fe para no llorar para no llorar me propongo ahora no volver atras no pensar en ti nunca nunca mas para que regreso al mismo lugar no te buscare eso lo veras que ni por tu casa yo vuelvo a pasar se que sufrire en mi soledad pero al fin de cuentas te voy a olvidar para no llorar para no llorar voy en el rescate de mi dignidad me humille por ti cuanto te rogue pero en poco tiempo me levantare para no llorar para no llorar me propongo ahora no volver atras no pensar en ti nunca nunca mas para que regreso al mismo lugar no te buscare eso lo veras que ni por tu casa yo vuelvo a pasar se que sufrire en mi soledad pero al fin de cuentas te voy a olvidar","Para No Llorar","2000"
"Edith Márquez","antes de partir escucha y deja de mirarme asi nunca fui feliz nunca fui feliz cuanto esperas de la vida sufrir no es una forma de vivir cuanto perdone cuanto perdone pero al final no llevo espinas en la piel al final soy mas mujer de lo que crees pero al final hay mas de orgullo que temor al final te quedas solo paran estar sobre tu cruz antes de partir escucha por un momento deja de fingir nunca te crei nunca te crei cuantas noches sin estrellas en las que yo jamas senti cuanto me calle cuanto me calle pero al final no llevo espinas en la piel al final soy mas mujer de lo que crees pero al final hay mas de orgullo que temor al final te quedas solo paran estar sobre tu cruz","Sobre Tu Cruz","2000"
"Edith Márquez","nooo porque tus errores me tienen cansado porque en nuestras vidas ya todo ha pasado porque no me has dado ni un poco de ti nooo porque con tus besos no encuentro dulzura porque tus reproches me dan amargura porque no sentimos lo mismo que ayer te digo que no porque ya no estano como antes tu ausencia porque ya disfruto aun sin tu presencia ya no queda esencia del amor de ayer no no no aunque me juraras que mucho has cambiado para mi lo nuestro ya esta terminado no me pidas nunca que vuelva jamas te digo que no porque ya no estano como antes tu ausencia porque ya disfruto aun sin tu presencia ya no queda esencia del amor de ayer no no no aunque me juraras que mucho has cambiado para mi lo nuestro ya esta terminado no me pidas nunca que vuelva jamas rv","No","2001"
"Edith Márquez","que mas te puedo dar lo tienes todo en mi no hay nada ya pero a tu modo ya no sera no quiero piedad ni compasion solo pedia tu verdad y no mentirle al corazon renuncio a todo mejor adios y ya no puede ser hoy en el juego del amor perdimos sin querer no hay nada por hacer cuando en el alma simplemente ya no existe fe y el desamor nos ha ganado la batalla si no hay nada por hacer que mas te puedo dar no quiero piedad ni compasion solo pedia tu verdad y no mentirle al corazon renuncio a todo mejor adios y ya no puede ser hoy en el juego del amor perdimos sin querer no hay nada por hacer cuando en el alma simplemente ya no existe fe y el desamor nos ha ganado la batalla si no hay nada por hacer que mas te puedo dar","¿Qué Más?","2001"
"Edith Márquez","hoy mire tus manos y las vi vacias no tenian caricias para dar estaban sin vida hoy busque tus brazos para cobijarme y con mucha tristeza descubri que mas que nunca estabas lejos de mi cuando grita la piel es mejor escucharla porque esta conectada en linea recta al corazon no soporta que el silencio se haga dueno del amor cuando grita la piel es que ya esta cansada de esperar que el invierno no se acabe de marchar es que no aguanta tanto frio es que ya no resiste mas cuando grita la piel hoy roce tu cuerpo mientras que dormias y no habia ni rastro del calor que tuviste un dia hoy trate de nuevo de encender el fuego pero ya no encontre dentro de tia lo que hasta ayer me hizo sentir tan mujer cuando grita la piel es mejor escucharla porque esta conectada en linea recta al corazon no soporta que el silencio se haga dueno del amor cuando grita la piel es que ya esta cansada de esperas que el invierno no se acabe de marchar es que no aguanta tanto frio es que ya no resiste mas cuando grita la piel dime donde estan las cosas que decias lo que me juraste a donde volvera cuando grita la piel es mejor escucharla porque esta conectada en linea recta al corazon no soporta que el silencio se haga dueno del amor cuando grita la piel es que ya esta cansada de esperar que el invierno no se acabe de marchar es que no aguanta tanto frio es que ya no resiste mas cuando grita la piel","Cuando Grita La Piel","2005"
"Edith Márquez","dejenme si estoy llorando ni un consuelo estoy buscando quiero estar solo con mi dolor si me ves que a solas voy llorando es que estoy de pronto recordando a un amor que aun no consigo olvidar dejame si estoy llorando es que sigo procurando en cada lagrima darme paz desechandola se llena el alma si ha sufrido perdiendo la calma y yo quiero olvidar que tu amor ya se fue si me ven que estoy llorando es que solo voy sacando la nostalgia que ahora vive en mi no me pidan ni una explicacion si es que va a danar mi corazon la felicidad que ya perdi me ha negado en este mar de llanto sentire que no te quise tanto y quizas me olvidare de ti dejenme si estoy llorando que no puedo soportar vivir sin ella ni un minuto mas dejenme solo con este dolor que fue mi error no aceptar el final distanciarlo fue mejor que poco a poco las lagrimas borran los recuerdos la nostalgia o al menos trata de de enganar al alma disfrazando la soledad pero la verdad no es esa porque tambien yo no lo olvido mi conciencia aun esta conmigo de tus labios no me he desprendido a pesar de todo no lo consigo he intentado alejarte de mi lado no he encontrado el metodo correcto de logralo recordarla a cada momento por tanto tiempo me es imposible olvidar sin razonar dejenme llorar si me ven que estoy llorando es que solo voy sacando la nostalgia que ahora vive en mi no me pidan ni una explicacion si es que va a danar mi corazon la felicidad que ya perdi lo ha negado en este mar de llanto sentire que no te quise tanto y quizas me olvidare de ti","Déjenme Si Estoy Llorando","2007"
"Edith Márquez","no renunciare a esa flor que tu me das cada manana a vivir conscientemente enamorada a sonar juntos los dos de madrugada no renunciare a la luz que tu me das si estoy a oscuras a saber que esto es amor y no aventura a encontrar limpio el camino de la duda no renunciare ni a tus ojos ni a tus brazos ni a tu boca ni a tu risa ni a tu loco proceder ni a tus besos con los que me vuelvo loca ni a la fuerza con que tu me haces querer no renunciare ni a tus ojos ni a tus brazos ni a tu boca ni a tu risa ni a tu loco proceder ni a tus besos con los que me vuelvo loca ni a la fuerza con que tu me haces querer no renunciare a la luz que tu me das si estoy a oscuras a saber que esto es amor y no aventura a encontrar limpio el camino de la duda no renunciare yo sin ti seria un barco a la deriva una mas de las que van por el perdidas y sin ti sentido no tendria mi vida no renunciare ni a tus ojos ni a tus brazos ni a tu boca ni a tu risa ni a tu loco proceder ni a tus besos con los que me vuelvo loca ni a la fuerza con que tu me haces querer no renunciare ni a tus ojos ni a tus brazos ni a tu boca ni a tu risa ni a tu loco proceder ni a tus besos con los que me vuelvo loca ni a la fuerza con que tu me haces querer","No Renunciaré","2007"
"Edith Márquez","perdona si te estoy llamando en este momento pero me hacia falta escuchar de nuevo aunque sea un instante tu respiracion disculpa se que estoy violando nuestro juramento se que estas con alguien que no es el momento pero hay algo urgente que decirte hoy estoy muriendo muriendo por verte agonizando muy lento y muy fuerte vida devuelveme mis fantasias mis ganas de vivir la vida devuelveme el aire carino mio sin ti yo me siento vacio las tardes son un laberinto y las noches me saben a puro dolor quisiera decirte que hoy estoy de maravilla que no me ha afectado lo de tu partida pero con un dedo no se tapa el sol estoy muriendo muriendo por verte agonizando muy lento y muy fuerte vida devuelveme mis fantasias mis ganas de vivir la vida devuelveme el aire carino mio sin ti yo me siento vacio las tardes son un laberinto y las noches me saben a puro dolor estoy muriendo agonizando a puro dolor a puro dolor agonizando pues no te tengo a mi lado estoy muriendo agonizando a puro dolor a puro dolor agonizando vuelve por favor","A  Puro Dolor","2007"
"Edith Márquez","amiga tengo el corazon herido el hombre que yo quiero se me va lo estoy perdiendo estoy sufriendo llorando de impotencia no puedo retenerlo amiga mientras quede una esperanza tu tienes que luchar por ese amor si el es el hombre de tu vida no te des nunca por vencida que vale todo si se lucha por amor como puedo hacer entrega todo todo se lo di intenta un modo no es posible que se pueda querer mas pensando asi lo perderas y si el se va lo habras perdido que me quedara lo que has vivido tu consejo no me aleja del dolor son cosas del amor amiga yo no se que esta pasando sera que habra encontrado otra mujer ya no es el mismo su indiferencia la siento por las noches rechaza mi presencia amiga no sera que has descuidado la forma de buscarlo en el amor quizas la casa la rutina se ha convertido en tu enemiga y estas cobrando un alto precio por tu error como puedo hacer entrega todo todo se lo di intenta un modo no es posible que se pueda querer mas pensando asi lo perderas y si el se va lo habras perdido que me quedara lo que has vivido tu consejo no me aleja del dolor son cosas del amor","Cosas del Amor","2009"
"Edith Márquez","tengo a veces deseos de ser nuevamente un chiquillo y en la hora que estoy afligido volverte a oir de pedir que me abraces y lleves de vuelta a casa que me cuentes un cuento bonito y me hagas dormir muchas veces quisiera oirte hablando sonriendo aprovecha tu tiempo tu eres aun un chiquillo a pesar la distancia y el tiempo no puedo olvidar tantas cosas que a veces de ti necesito escuchar lady laura abrazame fuerte lady laura y cuentame un cuento lady laura un beso otra vez lady laura lady laura abrazame fuerte lady laura hazme dormir lady laura un beso otra vez lady laura tantas veces me siento perdido durante la noche con problemas y angustias que son de la gente mayor con la mano apretando mi hombro seguro dirias ya veras que manana las cosas te salen mejor cuando era un nino y podia llorar en tus brazos y oir tanta cosa bonita en mi afliccion en momentos alegres sentado a tu lado reia y en mis horas dificiles dabas tu corazon lady laura abrazame fuerte lady laura y cuentame un cuento lady laura y hazme dormir lady laura lady laura abrazame fuerte lady laura llevame a casa lady laura y cuentame un cuento lady laura tengo a veces deseos de ser nuevamente un chiquillo el pequeno que tu todavia aun crees tener cuando a veces te abrazo y te beso en silencio entendido tu me dices aquello que yo necesito saber lady laura abrazame fuerte lady laura y cuentame un cuento lady laura un beso otra vez lady laura lady laura abrazame fuerte lady laura y llevame a casa lady laura un beso otra vez lady laura","Lady Laura","2011"
