"Band","Lyrics","Song","Year"
"Amazing Blondel","come i1 take you to town with me for to see the fine weaver of words come and take the walk down with me for to see all the things you had heard oh the road is short but tiring and the morning is warm and new come i11 take you to town with me if the company pleases you peasant ladies and gentlemen will come to spend the day gather trinkets as they dance and frolic on their way will you buy will you buy my oranges will you buy from me a friend wont you buy from a lady if you have some silver to spend salty fisherman you are the pride of all you know whos your fancy with today what prize you have to show i1 give the biggest catch my friend that ever spread the floor it yours is not the fairest face ive ever seen before","Weaver's Market","1973"
"Amazing Blondel","its all very well you saying i dont like what youre playing you know your birds been graying under wing you dont have time to capture the picture that your after and its too late to naturally change looking down a pleasant sight the res no time to blink an eye i know you like the feeling of natures open ceiling its time leave the pealing of the bells you dont look very strong lad they say it cant be all bad at least not if youre half mad when you go looking down a pleasant sight the res no time to blink an eye so now your eyes are clearing and your strength is reappearing and whats your most endearing quality so spread your invitation and take some consolation in knowing that salvation tips her hat looking down a pleasant sight the res no time to blink an eye","Leaving of the Country Lover","1977"
"Amazing Blondel","its easy for me to tell you the pangs of love you see the best in everything and circle like a dove oh with those easy living eyes you see them burn and can feel youre growing wise you know your place and turn together all the ties you cover up and keep her steady as she lies you take to laughing and singing songs of joy and take to walking in the evening with your lover boy oh if the very song of spring could make you happy then girl thats the one id sing and if you needed love then that is what id bring id never let you stay alone in anything flattery is easy when all you have to do is look into each others face and give the best of you oh you have such a lucky line you must be due to say t he very same of mine i think its there to make it better all the time if night time wants to win then my its got to shine","Lesson One","1977"
"Amazing Blondel","heres to my acquaintance and companion lift your glass i love you and leave you i do give you all my best heres to lovely lasses who by now are sleeping sound we miss you and kiss you we will until we can no longer hope and i would spread the softest ground for you to walk around if i could be your right hand id bless the seed that i would sow and hope that it would grow into a sight to hold you heres to my acquaintance and companion lift your glass i love you and leave you i do give you all my best heres to lovely lasses who by now are sleeping sound we miss you and kiss you we will until we can no longer hope and we could have the richest thing to make your songbird sing a tale to haunt the evening then i would give you every note of every song i wrote for them to ring forever heres to my acquaintance and companion lift your glass i love you and leave you i do give you all my best heres to lovely lasses who by now are sleeping sound we miss you and kiss you we will until we can no longer hope","Young Man's Fancy","1977"
"Amazing Blondel","silence stillness hangs brittle by the breeze break it not leave it free for that quiet is sound to me lilting from each flower a melody to see mellow meadow your mood steeped in cadence view each note see it pass sustained by the swaying grass treasured tune of nature sedate supernal mass landscape splendour spirit mender no extent of beauty equalls yours season sender harsh and tender answer to all yearnings and yet their cause shafts of sunlight shine thinly through the trees golden rays parched with dust thirst for clarity and just a little glimpse of life down beneath this foliar crust womblike woodland one chaste copse confined stay untouched undefiled all gods garden growing wild blooming forth in freedom so sweetly reconciled landscape splendour spirit mender no extent of beauty equalls yours unending time suspending terrestrial creation rainstorm rapids rush swollen down the slopes cleansing all in their path not one stone left unbathed just waterpools and wormscasts remain as aftermath holy hillside the alter of the plains all is seen from your brow to that face the four winds bow as maji to the saviour and oxen to their plough","Landscape [Extract from ""The Paintings""]","1993"
"Amazing Blondel","your glances are showing that loves seed is growing its shoot sprouting flowing sincerely and tho youll not say it you hope and you pray it will bloom and display itself clearly take these arms clasp them hard love is all that matters now so forget your coy facade take this heart scathed and scarred it is all i have to give and its all ill expect you to guard your face is telling that loves grain is swelling all bounderies excelling steadily but youll not admit it youll try to outwit it and lose so youll quit it quite readily take these arms clasp them hard love is all that matters now so forget your coy facade take this heart scathed and scarred it is all i have to give and its all ill expect you to guard sweetheart sweetheart please let me now your true feelings the ones you darent show your barriers are breaking and steps that im taking will find out youre faking indifference for your eyes are speaking with looks slowly weakening saying loves what youre seeking in preference take these arms clasp them hard love is all that matters now so forget your coy facade take this heart scathed and scarred it is all i have to give and its all ill expect you to guard","Toye","1995"
"Amazing Blondel","strains of delight come greet my ears such music sweet can ease all fears as windy waves upon the shore do calm the cormorant by their roar wistfully watching i wonder as ships go out to sea at mariners yonder and how their lives must be with oceans to wander coves of tranquility oh none could be fonder of his sailors life than he sights of beauty come soothe my eyes paint pictures pure to flay disguise uncharted coastlines to appraise through foul or fair all tempests youll bear yet show not a care for the danger youre in you leave all behind trade kin and your kind for capstan to wind and a yarn to spin idyll of grandeur excite my mind conjure up peace with adventure entwined crystal clear fathoms and myriad wrecks attired in booty arrayed on their decks","Seascape","1999"
"Amazing Device","im weakening and i dont know how much more of this world i can stand inject into me flowing through my blood stream now i cant go out in the condition that im in with my eyes rolled back and my heart pounding the hallucinations start and their leaving their marks your needles in my arms kill the ache inside of me for the sake of sanity my amphetamines now i cant go out in the condition that im in kill this craving for my saving grace hemorrhaging the blood is rushing im alittle dizzy im alittle dizzy now i cant go out in the condition that im in with my eyes rolled back and my heart pounding the hallucinations start and their leaving their marks your needles in my arms kill the ache inside of me for the sake of sanity my amphetamines now i cant go out in the condition that im in kill this craving for my saving grace your soul is the drug it rolls of the tongue it rolls off the tongue just like feeling a familiar touch a junkie just cant get enough a fiend i guess will always be a fiend kill the ache inside of me for the sake of sanity my amphetamines now i cant go out in the condition that im in kill this craving for my saving grace my saving grace it rolls off of the tongue","My Saving Grace","2003"
"Amazing Device","she plays it discreet she thinks no one sees we noticed if its not the first time then tell me when will it be the last shes battered and broken her will her face her trust and her faith in someone as transparent and cold as ice in a clear plastic bag all the rags on the floor are stained and adorn with all the love that he beat out of her she plays it discreet she thinks no one sees we noticed we noticed shes down on her knees praying well see we noticed we noticed hes as weak as he seems and all he is equals nothing if you feel like you need a do over then press the button his soul is transparent and cold like ice in a clear plastic bag all the rags on the floor are stained and adorn with all the love he beat out of her she plays it discreet she thinks no one sees we noticed we noticed shes down on her knees praying well see we noticed we noticed his selfish love and his homemade bruises his selfish love and his homemade bruises curse his love write it off with his homemade bruises she plays it discreet she thinks no one sees we noticed we noticed shes down on her knees praying well see we noticed we noticed","Discreet","2003"
"Amazing Stories","i see the lord seated on the throne exalted and the train of his robe fills the temple with glory and the whole earth is filled and the whole earth is filled and the whole earth is filled with his glory holy holy holy holy holy is the lord holy holy holy holy holy is the lord i see the lord seated on the throne exalted and the train of his robe fills the temple with glory and the whole earth is filled and the whole earth is filled and the whole earth is filled with his glory holy holy holy holy holy is the lord holy holy holy holy holy is holy is holy is the lord","I See the Lord","2000"
"Amazing Transparent Man","if i could see into your heart then would i know just where to start because im lost and i need to be found crazy as it sounds i need you around if i could stand to be on my own then i would probably just leave you alone but im gonna feel this way till im six feet underground crazy as it sounds i need you around turning tossing and turning my love is burning me down if i could change one thing in this world id change your mind and make you my girl because im lost and i need to be found crazy as it sounds i need you around im gonna feel this way till im six feet underground crazy as it sounds i need you around","Need You Around","2001"
"Amazing Transparent Man","i hate the world today youre so good to me i know but i cant change tried to tell you but you look at me like maybe im an angel underneath innocent and sweet yesterday i cried must have been relieved to see the softer side i can understand how youd be so confused i dont envy you im a little bit of everything all rolled into one im a bitch im a lover im a child im a mother im a sinner im a saint i do not feel ashamed im your hell im your dream im nothing in between you know you wouldnt want it any other way so take me as i am this may mean youll have to be a stronger man rest assured that when i start to make you nervous and im going to extremes tomorrow i will change and today wont mean a thing im a bitch im a lover im a child im a mother im a sinner im a saint i do not feel ashamed im your hell im your dream im nothing in between you know you wouldnt want it any other way just when you think you got me figured out the seasons already changing i think its cool you do what you do and dont try to save me im a bitch im a lover im a child im a mother im a sinner im a saint i do not feel ashamed im your hell im your dream im nothing in between you know you wouldnt want it any other way im a bitch im a tease im a goddess on my knees when you hurt when you suffer im your angel undercover ive been numb im revived cant say im not alive you know i wouldnt want it any other way","Bitch","2003"
"Amazirée","tonight i wanna give it all to you in the darkness theres so much i wanna do and tonight i wanna lay it at your feet cause girl i was made for you and girl you were made for me i was made for lovin you baby you were made for lovin me and i cant get enough of you baby can you get enough of me tonight i wanna see it in your eyes feel the magic theres something that drives me wild and tonight were gonna make it all come true cause girl you were made for me and girl i was made for you i was made for lovin you baby you were made for lovin me and i cant get enough of you baby can you get enough of me","I Was Made for Loving You","1999"
"Amazonics","my my my my dont you worry bout whats on your mind oh my im in no hurry i can take my time oh my im going red and my tongues getting tied tongues getting tied im off my head and my mouths getting dry im high but i try try try oh my lets spend the night together now i need you more than ever lets spend the night together now i feel so strong that i cant disguise oh my lets spend the night together but i just cant apologize oh no lets spend the night together dont hang me up and dont let me down dont let me down we could have fun just groovin around around and around oh my my lets spend the night together now i need you more than ever lets spend the night together lets spend the night together now i need you more than ever you know im smiling baby you need some guiding baby im just deciding baby now i need you more than ever lets spend the night together lets spend the night together now this doesnt happen to me evryday oh my lets spend the night together no excuses offered anyway oh my lets spend the night together ill satisfy your every need every need and i now know you will satisfy me oh my my my my my lets spend the night together now i need you more than ever lets spend the night together now","Let's Spend the Night Together","2005"
"Amazonics","i was born in a cross fire hurricane and i howled at my ma in the driving rain but its all right now in fact its a gas but its all right im jumpin jack flash its a gas gas gas i was raised by a toothless bearded hag i was schooled with a strap right across my back but its all right now in fact its a gas but its all right im jumpin jack flash its a gas gas gas i was drowned i was washed up and left for dead i fell down to my feet and i saw they bled i frowned at the crumbs of a crust of bread yeah yeah yeah i was crowned with a spike right through my head but its all right now in fact its a gas but its all right im jumpin jack flash its a gas gas gas jumping jack flash its a gas jumping jack flash its a gas jumping jack flash its a gas jumping jack flash its a gas jumping jack flash","Jumpin' Jack Flash","2006"
"Amazonics","hey little girl i wanna be your boyfriend sweet little girl i wanna be your boyfriend do you love me babe what do you say do you love me babe what can i say because i wanna be your boyfriend hey little girl i wanna be your boyfriend sweet little girl i wanna be your boyfriend ooh ooh ooh ooh ah because i wanna be your boyfriend hey little girl i wanna be your boyfriend sweet little girl i wanna be your boyfriend because i wanna be your boyfriend do you love me babe what do you say do you love me babe what can i say because i wanna be your boyfriend hey little girl i wanna be your boyfriend sweet little girl i wanna be your boyfriend hey little girl i wanna be your boyfriend","I Wanna Be Your Boyfriend","2008"
"Amazulu","vernonll meet me when the boat lands keys to th m g will be in his hands adjust to the driving n im on my way its all on the right side in montego bay oh oh oh oh oh oh oh oh oh oh oh oh oh oh oh oh oh oh oh oh come sing me la come sing me montego bay oh oh oh oh oh oh oh oh oh oh n gillianll meet me like a brother would i think i remember but its twice as good like how cool the rum is from his silver tray i thirst to be thirsty in montego bay sing out oh oh oh oh oh oh oh oh oh oh oh oh oh oh oh oh oh oh oh oh come sing me la come sing me montego bay oh oh oh oh oh oh oh oh oh oh ill lay on a lilo till im lobster red i still feel the motion here at home in bed i tell you its hard for me to stay away you aint been till you been high in montego bay oh oh oh oh oh oh oh oh oh oh oh oh oh oh oh oh oh oh oh oh come sing me la come sing me montego bay oh oh oh oh oh oh oh oh oh oh oh oh oh","Montego Bay","1986"
"Amazulu","too good to be forgotten too good to be forgotten benny was a boy i met while walking home one day he made me forget my marbles he said he had another game to play one thing led to another now what more can t sar just one of the reasons why i got him by my side today he was too good to be forgotten now what more can i say too good to be forgotten no ill never let him get away one in a million people shout it from the highest steeple hes just one of the few got my mind got my life wrapped up in love well his hair was shiny long and black it smelled so sweet and bright i thought of him and dreamed of him all night affer night i love the ground he walks on the very air he breathes i aint never gonna leave him cause i am as happy as ican be hes just too good to be forgotten now what more can i say he was too good to be forgotten now what more can i say too good to be forgotten no ill never let him get away he was too good to be forgotten now what more can i say too good to be forgotten no ill never let him get away he was too good to be forgotten now what more can i say fifty million reasons why ill never let him get away he was too good to be forgotten now what more can i say too good to be forgotten no ill never let him get away","Too Good to Be Forgotten","1986"
"Amazulu","here she come down say money money well shoot em down turn around come home honey hey she gimme love an i feel alright now everybody you got me tossin turnin in the night make me feel alright i say yeah yeah yeah yeah yeah yeah yeah yeah yeah yeah yeah yeah well you make me feel mony mony so mony mony good mony mony yeah mony mony so good mony mony oh yeah mony mony come on mony mony all right baby mony mony say yeah yeah yeah yeah yeah yeah yeah yeah yeah yeah yeah yeah break dis shake dis mony mony shot gun get it done come on honey dont stop cookin it feels so good yeah hey well dont stop now hey come on mony well come on mony i say yeah yeah yeah yeah yeah yeah yeah yeah yeah yeah yeah yeah well you make me feel mony mony so mony mony good mony mony yeah mony mony so good mony mony oh yeah mony mony come on mony mony all right baby mony mony i say yeah yeah yeah yeah yeah yeah yeah yeah yeah yeah yeah yeah oo i love your mony moan moan mony oo i love your mony moan moan mony oo i love your mony moan moan mony oo i love your mony moan moan mony i say yeah yeah yeah yeah yeah yeah yeah yeah yeah yeah yeah yeah come on mony mony come on mony mony come on mony mony mony mony mony mony mony mony mony mony","Mony Mony","2000"
"Amba Shepherd","i wasnt born yesterday ive succumbed to your wicked ways so im movin up up and away up up and away up up and away seem to think im your property and your misconduct is trashing me now im searching for the debris for the debris for the debris im a victim of vandalism cause you covered me in graffiti im a victim of vandalism since you left your mark on me im a victim of vandalism cause you covered me in graffiti im a victim of vandalism since you left your mark on me im a victim of vandalism im a victim of vandalism im a victim of vandalism im a victim of vandalism i wasnt born yesterday ive succumbed to your wicked ways so im movin up up and away up up and away up up and away so you can sabotage and you betray damage done now wouldnt you say you really rub me up the wrong way up the wrong way up up the wrong way im a victim of vandalism cause you covered me in graffiti im a victim of vandalism since you left your mark on me vandalism vandalism im a victim of vandalism im a victim of vandalism im a victim of vandalism im a victim of vandalism","Vandalism","2012"
"Amba Shepherd","just one day in the life so i can understand fighting just to survive but you taught me i can we are the lucky ones we are we are oh we are the lucky ones we are we are just one day in the life so i can understand fighting just to survive but you taught me i can we are the lucky ones we are we are oh we are the lucky ones we are we are we are the lucky ones we are we are oh we are the lucky ones we are we are","Apollo [Lucky Date Remix]","2013"
"Amba Shepherd","just one day in the life so i can understand fighting just to survive but you taught me i can we are the lucky ones we are we are oh we are the lucky ones we are we are","Apollo","2013"
"Ambassador","i may burn out like a candle and i may pass away i may fall just like a shooting star my heart will stay ill be yours until forever forever ill be true to the promise i have made from the day that i found you forever your in my heart even if were apart i say forever ill be yours forever i love you i say forever ill be yours forever i love you my love will never fade away even if ill die and i will love you until the end of time even without your smile so help me please i beg you dont walk away i need you just stay with me and be by my side take my hand and will work it out so help me please i beg you to stay","Forever","2003"
"Ambassador","from the philly pad ive been servin christ and now its really nonbelievers are treating jesus like a silly fad weak like the spot achilles had they got me really mad talking bout relationships they never really had the kill me dog but its not about the skills we have because the city is sickly the need the balm on gilead known for doin things thats odd to see like the iliad like standing on top of the water like a lily pad the life giver who turns my heart like a river from when it was trashy and when it was nasty like lives he fills his quiver with children with who follow his orders sons and daughters whove been changed like dollars to quarters holler hell pour you grace and then give you some more give you wisdom when youre in a trial like a court case cant show you the pure face but you can get the pure taste goodness never running out like youre raw space all sing to the only acceptable offering all things reconciled by his death on the cross beam with blood that was clean and blood that ca ching he purchased men so that must mean worship the king god the son the only one with a plan to redeem stronger that the army navy air force and the marines elohim the a to z and all thats in between the supreme who could have let us fall yet intervened called the elect made sure we accept roots us in christ so we can grow like a chia pet so hail the king priest and prophet the inexhaustible topic the person of god you can peep with your optic in the eyes of this world my life is trife they dont understand when i say ive died to christ died to my rights livin selfless render myself helpless trustin god set my heart where his eternal wealth is what else is there to live for what else is there to hope in still i bow to christ with a broken with a broken will becoming broken bread and poured out wine when seen with the natural eye authentic christian livin blows the mind what validates my faith go check youll see from the holy scroll to the codex that god inspires the whole text the scriptural facts will surprise and paralyze you like broke necks shake up your whole set leave your soul vexed i pray you dream of his holiness and wake up in cold sweats cant dissolve the mixture no matter how odd the picture you cant deny the god of scripture equipped with tha truths that transform becoming a thorn where man swarm we bring the real when we kingdom build upon the rock hes the one you can either stand on or be the one whom he lands on weather the sinkin sand storms until you realize theres no other god worth taking a chance on we keep our hands on the plow breaking up the fallow ground while christ can found seek him and follow now its been told that men without christ would face insurmountable odds and the greatest of these would be a close encounter with god and you dont want that even though your free to give it a try 100 before the most high either live it or die cause ever since adam sinned life was done but thanks to christ the son when death marked us up with its pricin gun jesus came and smiled and paid for us all and brought the work of sin to an end like the child labor law when the wild and wayward saw that in jesus god forgave us all who repented and consented that our way was wrong then they saw why the truth rocks us so hard enough to work arduous to bogard yo just pardon us like the marginous distance between mars and us understand men are from dust and smart enough or large enough to harness up and jump the marvelous distance between us and god we just tarnish up his image my mission is to open eyes and im steady mobilizin because of the hope i find in jesus tougher than teflon hung with the common thugs though he had more class than upper eshelon im in love with the way he put us back together life was broke then christ came in handy like black and decker the fact is pleasure could never measure up black to christ so tell us wheres your treasure at this song was not on the tapes you gave us so i assume that you have it and can get the lyrics","Hands in the Air","1999"
