"Band","Lyrics","Song","Year"
"Dr. Hook & the Medicine Show","well here i am in the wind again floating where it takes me laughin and a splashin in the summer sun until the alarm clock awakes me then its coffee and a kiss and two cigarettes and im back out in the cold cold weather chasin my dream but i just cant seem to rub two coins together sing it life aint easy they never said it would be life aint easy whoever said it should be life aint easy and nothing comes free free free free life aint easy tell me all about it life aint easy no no no no life aint easy and nothing comes free for you or me that woman she dont understand the way my mind keeps driftin and the lord dont always lend a hand when my poor heart needs liftin is home and kids really all there is or is there something better and how much soul must a poor man sell to rub two coins together dont you know that life aint easy no no no no life aint easy whoever said it would be life aint easy and nothing comes free free free free life aint easy can you hear me life aint easy tell me all about it life aint easy and nothing comes free free free free life aint easy tell me all about it life aint easy no no no no life aint easy and nothing comes free for you or me life aint easy life aint easy","Life Ain't Easy","1980"
"Dr. Hook & the Medicine Show","shel silverstein jeffrey comanor im gonna throw my grass out the window crumple up my papers too give away my speed cause all im gonna need is just a little bit of love from you and well be makin it natural aint it just about time that old stuff i was so keen on i no longer have to lean on cause your loves enough to keep me high now if any you heads want some panama red all you gotta do is to reach out your hand ill trade my stash for just a little bit of cash to buy a simple golden wedding band and well be makin it natural but dont you ask me how its been the cause of all my sorrow but i think ill start tomorrow cause i sure could use a hit right now im gonna throw it out the window some day give away my cocaine bust my spikes and flush a million mikes of acid right down the drain and well be makin it natural makin it natural c 1972 evil eye music inc","Makin' It Natural","1980"
"Dr. Hook & the Medicine Show","shel silverstein monterey jack woke up in his shack on a monday monterey jack had a little bitty snack of some elderberry wine monterey jack walked down the track all the way to ol harleys shack stuck his knife in ol harleys back and they say thats the way ol harley davison died 1 2 3 4 ol jack hoff was gettin off in a doorway ol jack hoff was gettin off with little sarah lee ol jack hoff was gettin off when he mumbled and stumbled and started to cough and his vein went hard and he went soft and they say thats the way how ol jack hoff o g d spoken you mean o d no o g oh man whats that thats when you o d and you say oh gee 1 2 3 4 tom mccann was sittin in the sand by the ocean tom mccann looked into his hand and found a jelly roll tom mccann was feelin grand all the girls were lickin his hand hes a heel but man oh man everybody knows that tom mccanns got soul spoken its over no it aint no it aint either here it is again thats really the end c tro essex music ltd","Monterey Jack","1980"
"Dr. Hook & the Medicine Show","shel silverstein penicillin penny shes the queen of the sunset strip if she ever gives you any then you better see your doctor real quick from the back seat of cadillac cars to the floor of mens room bars shes penicillin penny and her futures written in the stars shes penicillin penny and ever since the day she came and came they say shes had so many she gives em all numbers not names i always call her hun but she calls me 1001 and penicillin penny starts to boogie when the day is done shes penicillin penny and if you ever see her passin through better run into your house before she stops and lays a little on you if you ever let her in your door it takes 20 million units or more to cure the love that penicillin pennys gonna lay on you c 1972 tro essex music ltd","Penicillin Penny","1980"
"Dr. Hook & the Medicine Show","shes the queen of the silver dollar and she rules this smokey kingdom and her scepter is a wine glass and a bar stool is her throne and the jesters flock around her and fight to win her favor and see which one will take the queen of the silver dollar home she arrives in all her splendor every night at nine oclock and her chariot is the crosstown bus that stops right down the block the old piano minstrel plays her song as she walks in and the queen of the silver dollar is home again shes the queen of the silver dollar and she rules this smokey kingdom and her scepter is a wine glass and a bar stool is her throne and the jesters flock around her and fight to win her favor and see which one will take the queen of the silver dollar home her royal gown is a satin dress thats stained and slightly torn her sparkling jewels are rhinestones and her shoes are scuffed and worn from the many roads shes traveled and the wondrous sights shes seen i watch her and i pray god save the queen shes the queen of the silver dollar and she rules this smokey kingdom and her sceptre is a wine glass and a bar stool is her throne and the jesters flock around her and fight to win her favor and see which one will take the queen of the silver dollar home the queen of the silver dollar is not as haughty as she seems she was once an ordinary girl with ordinary dreams til i found her and i won her and i brought her to this world yes im the one who made a queen of a simple country girl shes the queen of the silver dollar and she rules this smokey kingdom and her sceptre is a wine glass and a bar stool is her throne and the jesters flock around her and fight to win her favor and see which one will take the queen of the silver dollar home","Queen of the Silver Dollar","1980"
"Dr. Hook & the Medicine Show","shel silverstein josie its been a long hard day down the road to where its at i must have lost my way when i got there they said i was too late now youre the only one can get me straight so wont you sing me a rainbow josie roll me a song just tonight make it right cause its been wrong for oh so long theres lots of shades of darkness josie deep inside a man so sing me a rainbow if you can the train i went to meet had come and gone seems like i spend all my time gettin off and gettin on i sold my mind and gave my dreams away and tomorrow ill start lookin round for yesterday but til then sing me a rainbow josie roll me a song just tonight make it right cause its been wrong for oh so long theres lots of kinds of hunger josie you dont understand so sing me a rainbow if you can if you can if you can sing me a rainbow if you can c 1972 evil eye music inc","Sing Me a Rainbow","1980"
"Dr. Hook & the Medicine Show","shel silverstein i didnt say dont do it babe when she packed up to go i didnt say come back here honey and try with me once more and when she asked me if i loved her i just turned away shes gone and now im hearing all the things i didnt say i didnt say im sorry babe cause half the fault was mine i didnt say well work it out cause all we need is love and faith and time i said if thats the way you want it i wont stand in your way shes gone and now im hearing all the things i didnt say i didnt take her in my arms and kiss away her tears i didnt say my life dont mean a thing if you aint here i thought of all the many games id be free to play but all i do is listen to the things i didnt say i didnt say take off your coat ill make some coffee and a talk i didnt say the motorway is such a long and lonely endless walk i said goodbye good luck and god bless you then she walked away and left me here to live with all the things i didnt say and now i guess shell never hear the things i didnt say c 1972 tro essex music ltd","The Things I Didn't Say","1980"
"Dr. Hook & the Medicine Show","no one knows my lady when shes lonely no one sees the fantasies and fears my lady hides there are those whove shared her love and laughter but no one hears my lady when she cries but me no one hears my lady when she cries and when she cries she makes you want to run and chase the sun and bring it back to brighten up a corner of her dark and troubled skies when she cries you may have seen her lyin in your lamplight and if youve heard her whispered words it comes as no surprise so be the one she shares her secret smiles with but send me back my lady when she cries for me my ladys gonna need me when she cries and when she cries she makes you want to run and chase the sun and bring it back so bring me back my lady when she cries for me cause my ladys gonna need me when she cries","When She Cries","1980"
"Dr. Hook & the Medicine Show","shel silverstein i swear you could taste the chicken and tomatoes and the noodles and the marrowbone but it really wasnt nothing but some water and potatoes and the wonderful wonderful soupstone hanging from a string in my mamas kitchen back in the hard time days was a little ol stone bout the size of an apple it was smooth and worn and grey there wasnt much food in my mamas kitchen so whenever things got tight mama boiled up some water put in the stone and said lets have some soup tonight and i swear you could taste the chicken and tomatoes and the noodles and the marrowbone but it really wasnt nothing but some water and potatoes and the wonderful wonderful soupstone it had been in the family for a whole lotta years so we knew it was a nourishing thing and i remember mama as she stirred it in the water and we could all hear her sing its a magical stone and as long as we got it well never have a hungry night just add a little love to the wonderful soupstone and everything will be alright and i swear you could taste the chicken and tomatoes and the noodles and the marrowbone but it really wasnt nothing but some water and potatoes and the wonderful wonderful soupstone so it carried us all through the darkening days til finally the sunshine came and the soupstone started into gathering dust but it hung there just the same and ever since then the foods been plenty but every now and then i find that mama in the kitchen with the wonderful soupstone drifts across my mind and again i can taste the chicken and tomatoes and the noodles and the marrowbone but it really wasnt nothing but some water and potatoes and the wonderful wonderful soupstone and again i can taste the chicken and tomatoes and the noodles and the marrowbone but it really wasnt nothing but some water and potatoes and the wonderful wonderful soupstone c 1972 tro essex music ltd","The Wonderful Soup Stone","1980"
"Dr. Hook & the Medicine Show","shel silverstein baxter taylor down in lousiana where the black trees grow live a voodoo lady named marie lavaux she got a black cat tooth and a mojo bone and anyone wouldnt leave her alone she go greeeeeeeeeeee another man done gone she live in a swamp in a hollow log with a one eyed snake and a three legged dog she got a bent bony body and stringy hair and if she ever seen you messin round there she go greeeeeeeeeeee another man done gone and then one night when the moon was black into the swamp came handsome jack a no good man that you all know and he was lookin around for marie lavaux he said marie lavaux you lovely witch why dont you gimme a little charm gonna make me rich he said now gimme million dollars and ill tell you what ill do this very night im gonna marry you itll be greeeeeeeeeeee another man done gone so marie did some magic and she shook a little sand she made a million dollars and she put it in his hand then she giggled and she wiggled and she said hey hey im gettin ready for my wedding day but ol handsome jack he said good bye marie you too damn ugly for a rich man like me so marie started cryin her fangs started shakin her body started turnin she started quakin she said greeeeeeeeeeee another man done gone so if you ever get down where the black tree grow and meet a voodoo lady named marie lavaux and if she ever asks you to make her your wife man you better stay with her for the rest of your life or itll be greeeeeeeeeeee c 1972 evil eye music inc","Marie Lavaux","1984"
"Dr. Hook & the Medicine Show","shel silverstein i was sitting in my basement i just rolled myself a taste of something green and gold and glorious to get me through the day then my friend yelled through the transom grab your coat and get your hat son theres a nut down on the corner givin dollar bills away but i laid around a bit then i had another hit then i rolled myself a bauma then i thought about my mama then i fooled around played around jacked around a while and then i got stoned and i missed it i got stoned and i missed it i got stoned and it rolled right by i got stoned and i missed it i got stoned and i missed it i got stoned oh me oh my now it took seven months of urging just to get that local virgin with the sweet face up to my place to fool around a bit next day she woke up rosy and she snuggled up so cosy when she asked me how i liked it lord it hurt me to admit i was stoned and i missed it i was stoned and i missed it i was stoned and it rolled right by i was stoned and i missed it i was stoned and i missed it i was stoned oh me oh my now i aint makin no excuses for the many things i uses just to sweeten my relationships and brighten up my day but when my earthly race is over and im ready for the clover and they ask me how my life has been i guess ill have to say i was stoned and i missed it i was stoned and i missed it i was stoned and it rolled right by i was stoned and i missed it i was stoned and i missed it i was stoned oh me oh my c 1975 tro essex music ltd","I Got Stoned and I Missed It","1985"
"Dr. Hook & the Medicine Show","i was sittin all alone watching people get it on with each other they were dancing cross the floor turning moving back and forth they were lovers one more lonely night for me i looked up what did i see sexy eyes moving cross the floor got me wanting more sexy eyes sexy eyes gettin down with you i wanna move with you sexy eyes i got up and took your hand and we both began to dance to the music ooh your magic cast a spell it didnt take long till we fell and we knew it no more lonely nights for me this is how its gonna be sexy eyes moving cross the floor got me wanting more sexy eyes sexy eyes gettin down with you i wanna move with you sexy eyes no more lonely nights for me this is how its gonna be sexy eyes moving cross the floor got me wanting more sexy eyes sexy eyes gettin down with you i wanna groove with you sexy eyes sexy eyes moving cross the floor got me wanting more sexy eyes sexy eyes gettin down with you i wanna groove with you sexy eyes","Sexy Eyes","1985"
"Dr. Hook & the Medicine Show","when youre in love with a beautiful woman its hard when youre in love with a beautiful woman you know its hard everybody wants her everybody loves her everybody wants to take your baby home when youre in love with a beautiful woman you watch your friends when youre in love with a beautiful woman it never ends you know that its crazy you wanna trust her then somebody hangs up when you answer the phone when youre in love with a beautiful woman you go it alone maybe its just an ego problem problem is that ive been fooled before by fair weather friends and faint hearted lovers and every time it happens it just convinces me more when youre in love with a beautiful woman you watch her eyes when youre in love with a beautiful woman you look for lies everybody tempts her everybody tells her shes the most beautiful woman they know when youre in love with a beautiful woman you go it alone when youre in love with a beautiful woman you watch your friends when youre in love with a beautiful woman it never ends when youre in love with a beautiful woman you watch her eyes","When You're in Love With a Beautiful Woman","1985"
"Dr. Hook & the Medicine Show","you make my pants want to get up and dance you make my face want to grin you make my knees want to kneel down say please honey wont you kiss me again you make my pants want to get up and dance you make my face want to grin you make my knees want to kneel down say please honey wont you kiss me again i was a lost and lonely man now i get through life the best i can til the day i laid my eye on you that day i decided what i had to do you make my pants want to get up and dance you make my face want to grin you make my knees want to kneel down say please honey wont you kiss me again start the music strike up the band i never done the boogie but i believe i can never met a girl half as sweet as you nobodys ever moved half the moves you do you make my pants want to get up and dance you make my face want to grin you make my knees want to kneel down say please honey wont you kiss me again you make my pants want to get up and dance you make my face want to grin you make my knees want to kneel down say please honey wont you kiss me again","You Make My Pants Want to Get up and Dance","1985"
"Dr. Hook & the Medicine Show","i was looking hard for love then i found you and when i found you i just couldnt help but fall you wrapped your arms around me ran your magic up and down me now i can finally say ive got it all but i cant say it came easy but its easy since it came now i can finally just lay back and smile and i realize it may not last forever but i sure do like this style cause it feels good having it real good for a while i tried so hard i feel like i deserve it to have someone i need as much as you the feel for love you taught me it comes each time you want me and leaves my body soft when you are through but i cant say it came easy but its easy since it came now i can finally just lay back and smile and i realize it may not last forever but i sure do like this style cause it feels good having it real good for a while no i cant say it came easy but its easy since it came now i can finally just lay back and smile and i realize it may not last forever but i sure do like this style cause it feels good having it real good for a while yes it feels good having it real good yes it feels good having it real good yes it feels good having it real good","Feels Good","1988"
"Dr. Hook & the Medicine Show","whos gonna water my plants whos gonna patch my pants and whos gonna give me the chance to feel brand new whos gonna iron my shirts whos gonna kiss where it hurts and who needs a man when he flirts the way i do who if not you who if not you who if not you tell me who if not you whos gonna wake me on time wholl smile and say i look fine and whos gonna stay on my mind the whole day through whos gonna see that im fed then whos gonna want me in bed but wholl watch tv instead because i do who if not you tell me who if not you who","If Not You","1988"
"Dr. Hook & the Medicine Show","she was only sixteen only sixteen but i loved her so but she was too young to fall in love and i was too young to know wed laugh and wed sing and do funny things and it made our hearts glow but she was too young to fall in love and i was too young to know so why did i give my heart so fast it never will happen again but i was a mere child of sixteen ive aged a year since then she was only sixteen only sixteen ooh with eyes that would glow but she was too young to fall in love and i was too young to know so why did i give my heart so fast it never will happen again but i was a mere child of sixteen ive aged a year since then now she was only sixteen only sixteen ooh but i loved that girl so but she was too young to fall in love and i was too young to know yes she was too young to fall in love and i i was too young i was much too young to know","Only Sixteen","1988"
"Dr. Hook & the Medicine Show","youre looking kinda lonely girl would you like someone new to talk to ah yeh alright im feeling kinda lonely too if you dont mind can i sit down here beside you ah yeah alright if i seem to come on too strong i hope that you will understand i say these things cause id like to know if youre as lonely as i am and if you mind sharing the night together oh yeah sharing the night together oh yeah sharing the night we could bring in the morning girl if you want to go that far and if tomorrow find us together right here the way we are would you mind sharing the night together oh yeah sharing the night together oh yeah sharing the night would you like to dance with me and hold me you know i want to be holding you ah yeah alright cause i like feeling like i do and i see in your eyes that youre liking it too ah yeah alright like to get to know you better is there a place where we can go where we can be alone together and turn the lights down low and start sharing the night","Sharing the Night Together","1988"
"Dr. Hook & the Medicine Show","when youre in love with a beautiful woman its hard when youre in love with a beautiful woman you know its hard everybody wants her everybody loves her everybody wants to take your baby home when youre in love with a beautiful woman you watch your friends when youre in love with a beautiful woman it never ends you know that its crazy you wanna trust her then somebody hangs up when you answer the phone when youre in love with a beautiful woman you go it alone maybe its just an ego problem problem is that ive been fooled before by fair weather friends and faint hearted lovers and every time it happens it just convinces me more when youre in love with a beautiful woman you watch her eyes when youre in love with a beautiful woman you look for lies everybody tempts her everybody tells her shes the most beautiful woman they know when youre in love with a beautiful woman you go it alone when youre in love with a beautiful woman you watch your friends when youre in love with a beautiful woman it never ends when youre in love with a beautiful woman you watch her eyes","When You're in Love With a Beautiful Woma","1988"
"Dr. Hook & the Medicine Show","years from now ill want you years from now and ill hold you years from now as i love you tonight you are my one true friend always my one true friend and ill love you till lifes end as i love you tonight i know this world that we live in can be hard now and then and it will be again many times weve been down but still love has kept us together the flame never dies when i look in your eyes the future i see wanting you years from now and holding you years from now and loving you years from now as i love you tonight i know this world that we live in can be hard now and then and it will be again many times weve been down but still love has kept us together the flame never dies when i look in your eyes the future i see wanting you years from now and holding you years from now and loving you years from now as i love you tonight","Years from Now","1988"
"Dr. Hook & the Medicine Show","ive got a couple more years on you babe thats all ive had more chances to fly and more places to fall and it aint that im wiser its only that ive spent more time with my back to the wall and ive picked up a couple more years on you baby thats all ive walked a couple more roads than you baby thats all and im tired of runnin while youre only learning to crawl and youre headin somewhere but ive been to somewhere and found it was nowhere at all and ive picked up a couple of years on you baby thats all now sayin goodbye girl dont never come easy at all but youve got to fly cause youre hearin those young eagles call and someday when youre older youll smile at a man strong and tall and youll say ive got a couple more years on you baby thats all ive got a couple more years on you baby thats all youll say ive had more chances to fly and more places to fall it aint that im wiser its only that ive spent more time with my back to the wall and ive picked up a couple more years on you baby thats all","A Couple More Years","1995"
"Dr. Hook & the Medicine Show","second street and broadway sittin in a doorway head held in his hands looked to all the world like he was prayin foot wrapped in old rag bottle in a brown bag i saw him trying to stand then i heard the words that he was sayin he said come on carrie carry me a little farther come on carrie carry me one more mile i dont know where its leadin to but i know i can make it if i lean on you so come on carrie carry me a little i carried you now carry me a little come on carrie carry me a little while well he struggled to his feet and staggered down the street to the window of a five and dime he stood and laughed a while at his reflection and then i heard him shoutin something bout a mountain he could surely climb if she was only there to point the right direction but she aint no but she aint no he said come on carrie carry me a little farther come on carrie carry me one more mile i dont know where its leadin to but i know i can make it if i lean on you so come on carrie carry me a little i carried you now carry me a little come on carrie carry me a little while yeah carry me carrie carry me yeah carry me carrie carrie carry me you got to carry me you got to carry me carry me carrie carry me carrie you got to carry me you got to carry me","Carry Me, Carrie [Live: in England]","1996"
