"Band","Lyrics","Song","Year"
"Dr. Feelgood","you treat a man like a dog and thats just what you get you may try to leave him but hell follow you yet cant do a thing to get him off a your trail you better give up hes hot on your tail you used to laugh at me when i said ill come back you let me roll over you let me play dead you think your little lap dog is dragging you down im a oooh love hound you went downtown and i followed you there a sniff of perfume still hung in the air you took the taxi i took my time rolled down the window and you hid me outside you used to laugh at me when i said ill come back you let me roll over you let me play dead you think your little lap dog is dragging you down im a oooh love hound no earthly reason to live in my home just pure motor reflex is keeping me going dont bother explaining itll bring me down child all i can hear is the call of the wild you can tease your little puppy mama thats alright but when they grow up they just love to fight you tremble in the dark when you hear that sound im a oooh love hound a love hound howls under the moon a love hound gonna come and love you soon love you baby till the morning light feel that little old love hound bite open up your window mama whats that sound im a oooh love hound","Love Hound","1981"
"Dr. Feelgood","run get my shotgun give me two shells in my hand run get my shotgun put two shells in my hand its a bullet for my baby a dedication for her backdoor man two kinds of people two kind of people i just cannot stand two kinds of people two kind of people i just cannot stand one is a lone woman the other is a cheatin man organ and guitar solo run get my shotgun put two shells in my hand please run get my shotgun put two shells in my hand im gonna kill my baby and blast and blast her fancy man","Shotgun Blues","1981"
"Dr. Feelgood","hey little lady have you got a cigarette to spare i like your high heels and the shade of your hair all those secrets you promised not to tell ill monkey on you baby youve got me in your spell im like a monkey up a tree im like a monkey you will see ill monkey on you baby if you monkey on me do you fancy drivin to the house of and i was made for lovin and im lovin you you say youre a student well understudy me ill monkey on you baby if you monkey on me those goody good girl looks have bowled me over clean not exactly our love but then im not really keen imagine were walkin alone along the sand ill monkey on you baby and i want to hold your hand im like a monkey up a tree im like a monkey you will see that ill monkey on you baby tell me that youll monkey on me ill monkey on you if you monkey on me i will monkey on","Monkey","1982"
"Dr. Feelgood","shes the one dont let her get away shes the one believe me when i say she stole my love and know shes gotta pay shes the one id like to let her go shes the one cause i hardly know she stole my love and now shes gotta pay its not right for her to run around she took my love and stomped it to the ground shes the one stole my love from me shes the one but i wont set her free she stole my love and now shes gotta pay its not right for her to run around she took my love and stomped it to the ground shes the one stole my love from me shes the one but i wont set her free she stole my love and know shes gotta pay","She's the One","1982"
"Dr. Feelgood","im a real man i got a real guitar im a real man dont even know where the boys are dont want to frighten you little girl youre so sweet and nice dont want to have to tell you twice im a real man im goin to rock like a real man dont get no shock from that elevator music in your computer program howd you like to rock with a real man yes im a real man baby im not lyin im thirty four years old now and i still dont mind dyin you can put the voodoo on me girl theres nothing i cant dodge just check out this roller in my garage kids these days im talkin about these young folk about as wild as pollyanna after she growed up after a hard day at the casiotone they just dont want to live theyre about as dangerous as a junior executive im a real man im goin to rock like a real man dont get no shock from that elevator music in your computer program howd you like to rock with a real man every dollar i earn girl i let it all burn and if i wind up in jail theres only one of 2672 women that i know who would gladly pay my bail guitar break now you might say im just some fool on a boast but i wasnt gonna hear ya girl from coast to coast this aint dan rather talkin this aint the presidents son im still gonna have my fun im a real man im goin to rock like a real man dont get no shock from that elevator music in your computer program howd you like to rock with a real man turn off that elevator music in your computer program howd you like to rock with a real man turn off that elevator music in your computer program come on and rock with a real man","I'm a Real Man","1986"
"Dr. Feelgood","im gon get up in the mornin i believe ill dust my broom im gon get up in the mornin i believe ill dust my broom girlfriend the black man you been lovin girlfriend cant get my room im gon write a letter telephone every town i know im gon write a letter telephone every town i know if i cant find her in west helena she must be in east monroe i know i dont want no woman wants every downtown man she meet i dont want no woman wants every downtown man she meet shes a no good doney they shouldnt low her on the street i believe i believe ill go back home i believe i believe ill go back home you can mistreat me here babe but you cant when i go home and im gettin up in the mornin i believe ill dust my broom im gettin up in the mornin i believe ill dust my broom girlfriend the black man you been lovin girlfriend cant get my room im on call up chiney see is my good gal over there im on call up chiney see is my good gal over there if i cant find her on philippines island she must be in ethiopia somewhere","Dust My Broom","1986"
"Dr. Feelgood","my babe she dont stand no cheatin my babe oh no she dont stand no cheatin not my babe oh yes she dont stand no cheatin she dont stand none of that midnight creepin my babe true little baby thats my babe true little baby my babe i know she loves me my babe oh yes i know she loves me my babe oh yes i know she loves me she dont do nothin but kiss and hug me my babe true little baby thats my babe true little baby my babe she dont stand no foolin my babe oh no she dont stand no foolin my babe oh no she dont stand no foolin when shes hot there aint no coolin my babe true little baby thats my babe true little baby shes my baby true little baby shes my babe true little baby shes my baby true little baby shes my babe true little baby","My Babe","1986"
"Dr. Feelgood","something you got baby makes me work all day something you got baby makes me bring home my pay something you got baby you ought to know my my whoa whoa i love you so something you got baby makes the world go round something you got baby keep me home every night something you got baby you ought to know you ought to know whoa whoa my my whoa i love you so something you got makes me work all day something you got makes me bring home my pay something you got you ought to know my my whoa whoa i love you so","Something You Got","1986"
"Dr. Feelgood","how could i explain this feeling thats true honey i can hardly stand it i want to make love to you when the stars fall from the heavens and the rivers have stopped to flow if you just stop and talk to me honey thats when i know i aint gonna try and tell ya how its made me so blue sitting alone and wondering i want to make love to you please stop and tell me tell me you want me too oh come on baby i want to make love to you i want to make love to you i want to make love to you i want to make love to you i want to make love to you when the stars fall from the heavens and the rivers have stopped to flow if you just stop and talk to me honey thats when id know i want to make love to you i want to make love to you i want to make love to you i want to make love to you i want to make love to you uh come on baby i want to make love to you i want to make love to you i cant stand it baby make love to you i want to make love to you uh talk to me i want to make love to you","(I Wanna) Make Love to You","1987"
"Dr. Feelgood","lookin at the blood red sky alone in my window heard another distant cry alone in my window wind up and i go inside alone in my window i gotta have another try rushin by the blood red tide alone in my window cant swallow and my mouth is dry alone in my window i just cant grip another line alone in my window watchin my time pass me by in my window say yeah hurricane comes i hollered dont ask me why alone in my window i was supposed to get another try alone in my window and no one told me how to ride alone in my window its funny how it all slips by in my window say yeah when the hurricane comes to town when the hurricane comes to town when the hurricane comes comin back here in a hot july alone in my window with my net im huntin dragonflies alone in my window mamas callin gotta go inside alone in my window sunsettin in the golden sky in my window say yeah","Hurricane","1987"
"Dr. Feelgood","well listen pretty baby lets go out tonight tell your mama not to worry everythings gonna be alright dont let me hear you talking just be there when i call cause i do i do my way or it wont be done at all little girl better hear what i say im an easygoing guy but i always gotta have my way i was born a tiger ive always had my way nothings gonna change me on this or any day dont let me hear you argue when i say walk or jump a woman aint been born yet that can play me for a chump little girl better hear what i say im an easygoing guy but i always gotta have my way dont ask me for a reason dont even wonder why ill walk away and leave you i dont want to see you cry ive done a lot of planning ive got lotta things to do so dont give me no trouble or me and you are through little girl better hear what i say im an easygoing guy but i always gotta have my way im an easygoing guy but i always gotta have my way but i always gotta have my way","My Way","1989"
"Dr. Feelgood","standin there by the window starin out of the night you got so many troubles of a nervous mind but dont worry baby its gonna work out fine you hear the sound of footsteps steal across the floor you pick the receiver you dont know what for then you saw a shadow steppin through the door why dont worry baby what the world may bring why dont worry baby it wont change a thing cause life is a fight and then you die standin there by the window starin out of the night see your lover leaning against the old street light its gonna be alright he was a tossin and turnin and he just couldnt sleep said you shouldnt bother it was just a dream so where was he goin headin down the street why dont worry baby what the world may bring why dont worry baby it wont change a thing because life is a fight and then you die","Don't Worry Baby","1991"
"Dr. Feelgood","im going down im going down down down down down im going down baby down down down down down ive got my big feets in the window my head is on the ground let me crawl let me crawl across your floor let me crawl baby let me crawl across your floor im going back to canvey island thats where i used to live before im going down im going down down down down down im going down down down down down down ive got my big feets in the window my head is on the ground let me crawl let me crawl across your floor let me crawl baby let me crawl across your floor im going back to canvey island thats where i used to live before","Going Down","1991"
"Dr. Feelgood","well im standing at the crossroads again with an empty heart and a dollar ten maybe ill bump into some famous names robert johnson elmore james im standing at the crossroads again well i woke up this morning like i usually do my baby was nowhere around i looked in the mirror i looked in the hall in my slippers and my dressing gown there were lipstick traces on the bedroom door goodbye she wrote i dont want you no more i guess im not the man she was looking for but just the man she found well im standing at the crossroads again with an empty heart and a dollar ten maybe ill bump into some famous names robert johnson elmore james im standing at the crossroads again here i am on my own again where did i go wrong this time i treat them good like a gentleman should and i never ever step out of line im no kid i know my way around six foot six i weigh 200 pounds but i cant hold no romance down maybe i should give up trying well im standing at the crossroads again with an empty heart and a dollar ten maybe ill bump into some famous names robert johnson elmore james im standing at the crossroads again well im standing at the crossroads again well im standing at the crossroads again","Standing at the Crossroads Again","1991"
"Dr. Feelgood","i ride a mare with a neck of steel i pack a spare with a loaded wheel shoes and tie made of rhino hide i keep an eye on the countryside im hunting shooting fishing ahead of the pack i keep an eye over my shoulder but i never look back i carry cash buried in my boot i spit on thrash that i pass en route i pay each fine with a mental note i sign no line and decline to vote im hunting shooting fishing ahead of the pack i keep an eye over my shoulder but i never look back i never look back guitar solo i keep no files and no fixed abode i eat up miles on a twisted road i fight the sky with a lightning rod im riding high by the grace of god i know the names of the men and dives ive heard the claims of their tortured wives ive searched for clues caught em in the act theyve blown a fuse when ive made contact im hunting shooting fishing ahead of the pack i keep an eye over my shoulder but i never look back i never look back i never look back i never look back guitar outro","Hunting Shooting Fishing","1992"
"Dr. Feelgood","money who needs it let me live a life free and easy put a toothbrush in my hand let me be a travelling man im a roadrunner baby roadrunner roadrunner im a road runner baby cant stay in one place too long im a road runner you might look at me and ill be gone well you can love me if you wanna but i do declare when i get restless i got to move somewhere yes im a road runner baby anywhere is my home and i love the life i live and im gonna live the life i love roadrunner baby roadrunner roadrunner dont want no woman to tie me down gotta be free baby to roam around all my life ive been like this you can love me at your own risk when the dust hits my shoes i got the urge to move cause im a road runner baby gotta keep on keepin on and i live the life i love and im gonna love the life i live roadrunner baby roadrunner roadrunner","(I'm A) Road Runner","1995"
"Dr. Feelgood","leave a late show still feel alive want a place to go round about five down to the doctors down to the doctors come on down to the doctors make you feel good all night everybody needs a shot of rnb so come on down to my surgery down to the doctors down to the doctors come on down to the doctors make you feel good all night eight bars on piano down to the doctors down to the doctors come on down to the doctors make you feel good all night come here baby aint gonna do you no harm i just want to shoot some rocknroll in your arm down to the doctors down to the doctors come on down to the doctors make you feel good all night","Down at the Doctors","1995"
"Dr. Feelgood","were in the heart of the city where the alligator roams im a little lost lamb aint got no place to go i aint got one penny just got a shirt on my back i left home in a hurry i aint never goin back im lookin for a lover in the heart of the city well im a standin on the street and im a steppin off the end yeah im lookin for a lover lookin lookin everywhere maybe im in with a chance i hear a clickety clack theres a girl my lord i see her stop check turn and double back im lookin for a lover in the heart of the city im lookin im lookin im lookin im lookin im lookin lookin lookin lookin everywhere in the heart of the city were in the heart of the city were in the heart of the stars i hear the crash of music and a thousand guitars and the boys are on the prowl and theyre checkin on me they know a bird up in the hand is worth two out on the streets checkin on neat in the heart of the city heart heart of the city heart heart oh yeah heart heart of the city heart heart oh yeah repeat to fade","Heart of the City","1995"
"Dr. Feelgood","i can tell cause its plain to see i can tell the way you look at me the way that you smile when you hold my hand i know pretty baby cause i understand i can tell i can tell i know you dont love me no more gonna tell your mama gonna tell your papa too just what more can a good man do you been running round with joey brown i know pretty baby that you put me down i called you up on the phone strange voice tells me youre not at home your mama told me you know you can wait when you show up you know your draggin real late","I Can Tell","1996"
"Dr. Feelgood","rat tailed jimmy is a second hand hood he deals out in hollywood got a 65 chevy primered flames traded for some powdered goods jigsaw jimmy hes runnin a gang but i hear hes doin okay got a cozy little job sells the mexican mob packages of candy cane hes the one they call dr feelgood hes the one that makes ya feel alright hes the one they call dr feelgood cops on the corner always ignore somebodys getting paid jimmys got it wired laws for hire got it make in the shade got a little hideaway does business all day but at night hell always be found selling sugar to the sweet people on the street call this jimmys town hes the one they call dr feelgood hes the one that makes ya feel alright hes the one they call dr feelgood hes gonna be your frankenstein ive got one thing youll understand dr feelgood hes not what youd call a glamorous man dr feelgood got one thing thats easily understood dr feelgood hes the one they call dr feelgood oh yeah hell tell you hes the king of these barrio streets moving up to shangri la came by his wealth as a matter of luck says he never broke no law two time loser running out of juice time to move out quick heard a rumor going round jimmys going down this time its gonna stick hes the one they call dr feelgood hes the one that makes ya feel alright hes the one they call dr feelgood hes gonna be your frankenstein let him soothe your soul just take his hand dr feelgood some people call him an evil man dr feelgood let him introduce himself real good dr feelgood hes the only one they call feelgood dr feelgood ive got one thing youll understand dr feelgood hes not what youd call a glamorous man dr feelgood got one thing thats easily understood dr feelgood hes the one they call dr feelgood dr feelgood dr feelgood dr feelgood dr feelgood dr feelgood dr feelgood dr feelgood dr feelgood feelgood feelgood feelgood feelgood","Dr. Feelgood","1997"
"Dr. Feelgood","well im so tired of crying but im out on the road again im on the road again well im so tired of crying but im out on the road again im on the road again i aint got no woman just to call my special friend you know the first time i traveled out in the rain and snow in the rain and snow you know the first time i traveled out in the rain and snow in the rain and snow i didnt have no payroll not even no place to go and my dear mother left me when i was quite young when i was quite young and my dear mother left me when i was quite young when i was quite young she said lord have mercy on my wicked son take a hint from me mama please dont you cry no more dont you cry no more take a hint from me mama please dont you cry no more dont you cry no more cause its soon one morning down the road im going but i aint going down that long old lonesome road all by myself but i aint going down that long old lonesome road all by myself i cant carry you baby gonna carry somebody else","On the Road Again","1998"
"Dr. Feelgood","seems like everyday i see you pass my way i try to catch your eye each time you walk on by you know that im obsessed just by the way youre dressed the way you swing your hips and how you paint your lips oooh just one look you bring me to my knees oooh there aint no potion gonna cure my disease you got me sweet louise you got me down on my knees you got me sweet louise why youre so hard to please you know i fantasize about your big brown eyes i love the clothes you wear the way you fix your hair oooh just one look you bring me to my knees oooh there aint no potion gonna cure my disease you got me sweet louise you got me down on my knees you got me sweet louise why youre so hard to please dont you know i could write a book just about the way you look what you got is so hard to find i cant get you out of my mind you walk into the room i smell your sweet perfume and everything you got sure makes my blood run hot oooh just one look you bring me to my knees oooh there aint no potion gonna cure my disease you got me sweet louise you got me down on my knees you got me sweet louise why youre so hard to please you got me sweet louise you got me down on my knees you got me sweet louise you got me sweet louise you got me sweet louise you got me down on my knees you got me sweet louise","Sweet Louise","1998"
"Dr. Feelgood","white boy in town big black blue sound night club i paid in i got a stamp on my skin main attraction dead on his feet black man rhythm with a white boy beat they got him on milk and alcohol they got him on milk and alcohol stay put i wanna go hard work bad show more liquor it dont help hes gonna die it breaks my heart i decided eventually this aint doing a thing for me they got him on milk and alcohol they got him on milk and alcohol they got him on milk and alcohol they got him on milk and alcohol they got him on milk and alcohol they got him on milk and alcohol got up i walked out to the car start it up feel bad sad night i never saw a red light sirens were a screamin all around i pulled on over and i shut her down a black cop gave me a shove with his gun said up against the wall and dont make a run they got me on milk and alcohol they got me on milk and alcohol","Milk and Alcohol","1998"
"Dr. Feelgood","baby jane dont leave me hangin on the line i knew you when you had no one to talk to now youre moving in high society dont forget i know secrets about you i used to think you were on my side but now im no longer sure i wish i knew what i know now before when i give my heart again i know its gonna last forever no one tell me where or when i know its gonna last forever baby jane dont it make you feel sad just when i thought that we were winning you and i were so close in evry way dont time fly when youre loving and laughing ive said goodbye so many times the situation aint all that new optimisms my best defense ill get through without you when i give my heart again i know its gonna last forever no one tell me where or when i know its gonna last forever i wont be that dumb again i know its gotta last forever when i fall in love again i know its gonna last forever baby jane ive said all i want to say go your own way dont think twice about me cause ive got ideas and plans of my own so long darling ill miss you believe me the lesson learned was so hard to swallow but i know that ill survive im gonna take a good look at myself and cry when i give my heart again i know its gonna last forever no one tell me where or when i know its gonna last forever i wont be that dumb again i know its gotta last forever when i fall in love again i know its gonna last forever","Baby Jane [Live]","1999"
"Dr. Feelgood","dont call my name i just must answer this aint no game i aint no chanter dont get me wrong i dont want trouble you come back strong ill come back double i dont mess around im dangerous shes like a knife sharp but pretty shell break your heart just for fun you bet your life youll get no pity shell drop you flat when its done look but just dont touch shes dangerous dangerous dangerous big city lights cold city nights sharks taking bites dangerous dangerous dangerous so just get smart and keep away now you wouldnt like the games we play now it gets kinda rough were dangerous dangerous dangerous","Dangerous","1999"
"Dr. Feelgood","i called you last night about half past nine you said you was out but i knew you was lyin you double crossed me baby cheatin on me too when are you gonna understand someone double crossin you i knew you was in when you said you was out when you gonna tell me what its all about double crossed me baby cheatin on me to double crossed me baby cheatin on me to when are you gonna understand someone double crossin you i ran to your house just as fast as i can i saw you in the arms of another man i called you again it was past midnight somebody turned out your bedroom light double crossed me baby cheatin on me to double crossed me baby cheatin on me to double crossed me baby cheatin on me to when are you gonna understand that someone double crossin you","Double Crossed","1999"
