"Band","Lyrics","Song","Year"
"Don Costa","when a zither starts to play youll remember yesterday in its haunting strain vienna lives again free and bright and gay in your mind a sudden gleam of a half forgotten dream seems to glimmer when you hear the third man theme once again there comes to mind someone that you left behind love that somehow didnt last in that happy city of the past does she still recall the dream that rapture so supreme when first she heard the haunting third man theme carnivals and carousels and ferris wheels and parasols the danube nights the dancing lights again will shine the zithers sweet refrain keeps swirling in your brain like new may wine strauss waltzes candle glow and the laughter of long ago fill the magic chords and make it seem like today you never knew that you could be enchanted by a melody the years will never drive it out you dont know why its something you cant live without you hear it in the twilight hush and in the morning traffic rush a song thats always new in your heart a part of you oh shines so brightly when you hear the third man theme when a zither starts to play youll remember yesterday in its haunting strain vienna lives again free and bright and gay in your mind a sudden gleam of a well remembered dream seems to glimmer when you hear the third man theme once again there comes to mind someone that you left behind love that somehow didnt last in that happy city of the past does she still recall the dream that rapture so supreme when first she heard the haunting third man theme carnivals and carousels and ferris wheels and parasols the danube nights the dancing lights again will shine the zithers sweet refrain keeps swirling in your brain like new may wine strauss waltzes candle glow and the laughter of long ago fill the magic chords and make it seem like today you never knew that you could be enchanted by a melody the years will never drive it out you dont know why its something you cant live without you hear it in the twilight hush and in the morning traffic rush a song thats always new in your heart a part of you oh shines so brightly when you hear the third man theme","Third Man Theme","1998"
"Don Costa","old father time checked so thered be no doubt called on the north wind to come on out then cupped his hands so proudly to shout la de da de da de da tis autumn the trees say theyre tired they bore too much fruit charmed all the wayside theres no dispute now shedding leaves they dont give a hoot la de da de da de dum tis autumn then the birds got together to chirp about the weather after makin their decision with birdie like precision turned about and made a bee line to the south oh holding you close is really no crime ask the birds the trees and old father time its just to help the mercury climb la de da de da de da tis autumn old father time checked so thered be no doubt called on the north wind to come on out then cupped his hands so proudly to shout la de da de da de da tis autumn then the birds got together to chirp about the weather humming after makin their decision with birdie like precision turned about and made a bee line to the south oh holding you close is really no crime ask the birds the trees and old father time its just to help the mercury climb la de da de da de da tis autumn tis autumn","'Tis Autumn","2012"
"Don Costa","life is not a highway strewn with flowers still it holds a goodly share of bliss when the sun gives way to april showers here is the point you should never miss though april showers may come your way they bring the flowers that bloom in may so if its raining have no regrets because it isnt raining rain you know its raining violets and where you see clouds upon the hills you soon will see crowds of daffodils so keep on looking for a blue bird and listening for his song whenever april showers come along and where you see clouds upon the hills you soon will see crowds of daffodils so keep on looking for a blue bird and listening for his song whenever april showers come along","April Showers","2012"
"Don Costa","sweetheart of mine ive sent you a valentine sweetheart of mine its more than a valentine be careful its my heart its not my watch youre holding its my heart its not the note i sent you that you quickly burned its not the book i lent you that you never returned remember its my heart the heart with which so willingly i part its yours to take to keep or break but please before you start be careful its my heart","Be Careful, It's My Heart","2012"
"Don Costa","day by day im falling more in love with you and day by day my love seems to grow there isnt any end to my devotion its deeper dear by far than any ocean i find that day by day youre making all my dreams come true so come what may i want you to know im yours alone and im in love to stay as we go through the years day by day","Day By Day","2012"
"Don Costa","gee its all fine and dandy sugar candy ive got you then i only see the sunny side even trouble has its funny side when youre gone sugar candy i get lonesome i get blue when youre handy its fine and dandy but when youre gone what can i do","Fine and Dandy","2012"
"Don Costa","the gentleman is a dope a man of many faults a clumsy joe who wouldnt know a rumba from a waltz the gentleman is a dope and not my cup of tea why do i get in a dither he doesnt belong to me the gentleman isnt bright he doesnt know the score a cake will come hell take a crumb and never ask for more the gentlemans eyes are blue but little do they see why am i beatin my brains out he doesnt belong to me hes somebody elses problem shes welcome to the guy shell never understand him half as well as i the gentleman is a dope he isnt very smart hes just a lug youd like to hug and hold against your heart the gentleman doesnt know how happy he could be but look at me cryin my eyes out as if he belonged to me hell never belong to me the gentleman doesnt know how happy he could be but look at me cryin my eyes out as if he belonged to me hell never ever hell never belong to me","The Gentleman is a Dope","2012"
"Don Costa","youre so late getting home from the office did you miss your train were you caught in the rain no dont bother to explain can i fix you a quick martini as a matter of fact ill have one with you for to tell you the truth ive had quite a day too guess who i saw today my dear i went in town to shop around for something new and thought id stop and have a bite when i was through i looked around for someplace near and it occurred to me where i had parked the car there was a most attractive french cafe and bar it really wasnt very far the waiter showed me to a dark secluded corner and as my eyes became accustomed to the gloom i saw two people at the bar who were so in love that even i could spot it clear across the room guess who i saw today my dear ive never been so shocked before i headed blindly for the door they didnt see me passing through guess who i saw today guess who i saw today guess who i saw today i saw you","Guess Who I Saw Today","2012"
"Don Costa","i could cry salty tears where have i been all these years little wow tell me now how long has this been goin on there were chills up my spine and some thrills i cant define listen sweet i repeat how long has this been goin on oh i feel that i could melt into heaven im hurled i know how columbus felt finding another world kiss me once then once more what a dunce i was before what a break for heavens sake how long has this been goin on let me dream that its true kiss me twice then once more that makes thrice lets make it four what a break for heavens sake how long has this been goin on","How Long Has This Been Going On","2012"
"Don Costa","this lovely day will lengthen into evening well sigh goodbye to all we ever had alone where we have walked together ill remember april and be glad ill be content you loved me once in april your lips were warm and love and spring were new im not afraid of autumn and her sorrow for ill remember april and you the fire will dwindle into glowing ashes for flames live such a little while i wont forget but i wont be lonely ill remember april and smile","I'll Remember April","2012"
"Don Costa","saturday night is the loneliest night in the week cause thats the night that my sweetie and i used to dance cheek to cheek i dont mind sunday night at all cause thats the night friends come to call and monday to friday go fast and another week is past but saturday night is the loneliest night in the week i sing the song that i sang for the memories i usually seek until i hear you at the door until youre in my arms once more saturday night is the loneliest night in the week saturday night is the loneliest night in the week i sing the song that i sang for the memories i usually seek until i hear you at the door until youre in my arms once more saturday night is the loneliest night in the week until i hear you at the door until youre in my arms once more saturday night is the loneliest night in the week","Saturday Night (is the Loneliest Night of the Week)","2012"
"Don Costa","when i was a young man courting the girls i played me a waiting game if a maid refused me with tossing curls id let the old earth make a couple of whirls while i plied her with tears in lieu of pearls and as time came around she came my way as time came around she came oh its a long long while from may to december but the days grow short when you reach september when the autumn weather turns the leaves to flame and you aint got time for waiting game when days dwindle down to a precious few september november and these few golden days id share with you those golden days i share with you when you meet with the young girls early in the spring you court them in song and rhyme they answer with words and a clover ring but if you could examine the goods they bring they have little to offer but the songs they sing and the plentiful waste of time of day a plentiful waste of time oh its a long long while from may to december but the days grow short when you reach september when the autumn weather turns the leaves to flame one hasnt got time for the waiting game oh the days dwindle down to a precious few september november and these few precious days ill spend with you these precious days ill spend with you","September Song","2012"
"Don Costa","the boat rides we would take the moonlight on the lake the way we danced and hummed our favorite song the things we did last summer ill remember all winter long the midway and the fun the kewpie dolls we won the bell i rang to prove that i was strong the things we did last summer ill remember all winter long the early morning hike the rented tandem bike the lunches that we used to pack we never could explain that sudden summer rain the looks we got when we got back the leaves began to fade like promises we made how could a love that seemed so right go wrong the things we did last summer ill remember all winter long ive tried so to forget at times i do and yet the memory of you lingers like our song the things we did last summer ill remember all winter long","The Things We Did Last Summer","2012"
"Don Costa","i have a feeling that something is wrong this is not the way that things should b e weve known each other too well and too long you dont have to act with me this is no laughing matter somehow i want to cry i know your sweet and idle chatter really means goodbye this is no laughing matter i thought wed never part this is no time for pretty patter while you break my heart what of all the moon dreams shared together beside the garden wall love cant always have that perfect weather a little rain must fall think of the dreams youll shatter if you should say were through this is no laughing matter darling im in love with you","This is No Laughing Matter","2012"
"Don Costa","be wise be smart behave my heart dont upset your cart when shes hes so close be soft be sweet but be discreet dont go off your beat shes hes too close for comfort too close too close for comfort please not again too close too close to know just when to say when be firm be fair be sure beware on your guard take care while theres such temptation one thing leads to another too late to run for cover shes hes too close for comfort now","Too Close For Comfort","2012"
"Don Costa & His Orchestra","oh you can kiss me on a monday a monday a monday is very very good or you can kiss me on a tuesday a tuesday a tuesday in fact i wish you would or you can kiss me on a wednesday a thursday a friday and saturday is best but never never on a sunday a sunday a sunday cause thats my day of rest most any day you can be my guest any day you say but my day of rest just name the day that you like the best only stay away on my day of rest oh you can kiss me on a cool day a hot day a wet day which everyone you choose or try to kiss me on a gray day a may day a pay day and see if i refuse and if you make it on a bleak day a freak day a week day why you can be my guest but never never on a sunday","Never on Sunday","2011"
"Don Costa & His Orchestra","our love affair is a wondrous thing that well rejoice in remembering our love was born with our first embrace and a page was torn out of time and space our love affair may it always be a flame to burn through eternity so take my hand with a fervent prayer that we may live and we may share a love affair to remember our love affair is a wondrous thing that well rejoice in remembering our love was born with our first embrace and a page was torn out of time and space our love affair may it always be a flame to burn through eternity so take my hand with a fervent prayer that we may live and we may share","An Affair to Remember","2014"
"Don Costa & His Orchestra","when ever we kiss i worry and wonder your lips may be near but where is your heart its always like this i worry and wonder youre close to me here but where is your heart its a sad thing to realize that youve a heart that never melts when we kiss do you close your eyes pretending that im someone else you must break the spell this cloud that im under so please wont you tell darling where is your heart","The Song from Moulin Rouge (Where Is Your Heart)","2014"
"Don Costa & His Orchestra","when a zither starts to play youll remember yesterday in its haunting strain vienna lives again free and bright and gay in your mind a sudden gleam of a half forgotten dream seems to glimmer when you hear the third man theme once again there comes to mind someone that you left behind love that somehow didnt last in that happy city of the past does she still recall the dream that rapture so supreme when first she heard the haunting third man theme carnivals and carousels and ferris wheels and parasols the danube nights the dancing lights again will shine the zithers sweet refrain keeps swirling in your brain like new may wine strauss waltzes candle glow and the laughter of long ago fill the magic chords and make it seem like today you never knew that you could be enchanted by a melody the years will never drive it out you dont know why its something you cant live without you hear it in the twilight hush and in the morning traffic rush a song thats always new in your heart a part of you oh shines so brightly when you hear the third man theme when a zither starts to play youll remember yesterday in its haunting strain vienna lives again free and bright and gay in your mind a sudden gleam of a well remembered dream seems to glimmer when you hear the third man theme once again there comes to mind someone that you left behind love that somehow didnt last in that happy city of the past does she still recall the dream that rapture so supreme when first she heard the haunting third man theme carnivals and carousels and ferris wheels and parasols the danube nights the dancing lights again will shine the zithers sweet refrain keeps swirling in your brain like new may wine strauss waltzes candle glow and the laughter of long ago fill the magic chords and make it seem like today you never knew that you could be enchanted by a melody the years will never drive it out you dont know why its something you cant live without you hear it in the twilight hush and in the morning traffic rush a song thats always new in your heart a part of you oh shines so brightly when you hear the third man theme","The Third Man Theme","2014"
"Don Costa Chorus","oh you can kiss me on a monday a monday a monday is very very good or you can kiss me on a tuesday a tuesday a tuesday in fact i wish you would or you can kiss me on a wednesday a thursday a friday and saturday is best but never never on a sunday a sunday a sunday cause thats my day of rest most any day you can be my guest any day you say but my day of rest just name the day that you like the best only stay away on my day of rest oh you can kiss me on a cool day a hot day a wet day which everyone you choose or try to kiss me on a gray day a may day a pay day and see if i refuse and if you make it on a bleak day a freak day a week day why you can be my guest but never never on a sunday","Never on Sunday","2005"
"Don Costa Chorus","the night was clear and the moon was yellow and the leaves came tumbling down i was standing on the corner when i heard my bulldog bark he was barkin at the two men who were gamblin in the dark it was stagger lee and billy two men who gambled late stagger lee threw seven billy swore that he threw eight stagger lee told billy i cant let you go with that you have won all my money and my brand new stetson hat stagger lee went home and he got his forty four said im goin to the barroom just to pay that debt i owe stagger lee went to the barroom and he stood across the barroom door he said nobody move and he pulled his forty four stagger lee cried billy oh please dont take my life ive got three little children and a very sickly wife stagger lee shot billy oh he shot that poor boy so bad till the bullet came through billy and it broke the bar tenders glass","Stagger Lee","2006"
"Don Costa Orchestra","my funny valentine sweet comic valentine you make me smile with my heart your looks are laughable unphotographable yet your my favorite work of art is your figure less than greek is your mouth a little weak when you open it to speak are you smart but dont change your hair for me not if you care for me stay little valentine stay each day is valentines stay valentine each day is valentine my valentine each day is valentines day","My Funny Valentine","2007"
"Don Covay & the Goodtimers","have mercy have mercy baby have mercy have mercy on me well i went to see a gypsy and had my fortune read she said don your babys gonna leave you her back is packed up under the bed and i cry have mercy have mercy baby have mercy have mercy on me i say if you leave me baby girl if you put me down well im a goin to the nearest river child and jump from above to the ground dont leave me have mercy have mercy baby mercy yeah have mercy have mercy on me well hey hey baby hey hey now what you tryin to do huh hey hey baby hey hey now please dont say were through i said if you stay baby i tell you what im gonna do im gonna work to a job seven days a week and bring my money home to you well i say mercy mercy mercy mercy","Mercy, Mercy","1965"
"Don Covay & the Goodtimers","come back and take this hurt off me baby come back and take this hurt off me cause im too young to be in misery now baby come back and take this hurt off me ill be waiting at the bus station cause thats where you left me standin i got my clothes in a twenty five cent locker fool i be here fool till the greyhound fool bring you back again girl fool fool fool fool come back and take this hurt off me baby come back and take this hurt off me cause im too young to be in misery now baby come back and take this hurt off me i knocked on my mothers door she said a don walk on in son you dont have to say a mumblin word i know your woman done and left ya again she left me she left me she left me yes she did i say now come back and take this hurt off me baby come back and take this hurt off me baby baby baby baby baby now what kind of love could this be now baby baby baby i dont know what youve got sho thats its got me its got em its got em its got em mercy but now ive been to see my doctor yeah i been to see the doctor now he did all he could he did all he could but there was nothin he could do for me girl youre the only one who could come come come come come come come on baby now come back and take this hurt off me baby come back and take this hurt off me its hurtin me hurtin me heartbreak now hurtin me its hurtin me now its hurtin me heartache its hurtin me too much pain its hurtin me come back again its hurtin me i need your lovin its hurtin me mercy baby its hurtin me heartbreak now its hurtin me","Take This Hurt Off Me","1965"
"Don Covay & the Goodtimers","you must believe me no matter what the people might say you must believe me darling it just didnt happen that way no no it just didnt happen that way you come home with something on your mind tell me darling why are you crying i said be serious no time for fun youre tryin to tell me something that ive done the things you heard couldnt be denied but before your opinion listen to my side you must believe me no matter what the people might say you must believe me darling it just didnt happen that way no no it just didnt happen that way oh oh oh oh you come home with something on your mind tell me darling why are you crying i said be serious no time for fun youre tryin to tell me something that ive done the things you heard couldnt be denied but before your opinion listen to my side you must believe me no matter what the people might say you must believe me you must believe me you must believe me","You Must Believe Me","1965"
"Don Covay & the Goodtimers","yeah yeah yeah yeah yeah yeah yeah youre a bad little girl its true but im not gonna walk out on you they say youre a good for nothing girl but ill stand up and tell the world youre good for me oh yes you are youre good for me oh like a honey is good for the bee youre good for me you do two wrongs for every right you put salt in my coffee just for a spite youre no good for yourself youre no good for nobody else but youre good for me oh youre good for me oh sugar dumpling cant you see youre good for me let me tell you bout it yeah yeah yeah yeah yeah whoa oh oh ooh i was down on my sickbed it was the end for me everyone said doctor jones did all he could only your love did me some good youre good for me oh yes you are youre good for me like the sugar is good for the tea youre good for me thats all im living for cause youre good yeah yeah yeah yeah yeah whoa oh oh ooh yeah yeah yeah yeah yeah whoa oh oh ooh yeah yeah yeah","You're Good for Me","1965"
"Don Covay & the Goodtimers","fool ive been feelin meager been hurt so many times but ive got faith in you you can ease my troublin mind come on now iron out the rough spots girl iron out the rough spots yeah you can do it baby come on an do it baby fool hurts gotta hold on me girl and i cant explain just what it is now but if youll turn to me ill be alright if you will come on girl iron out the rough spots people let her iron out the rough spots come on right now what you gon do about this wrinkle in my heart what cha gonna do huh about this wrinkle in my heart ooo ill be headed in the right direction if youll give me twenty four hours of your protection yeah hold me kiss me love me yeah ooo we baby iron out the rough spots girl iron out the rough spots come on i need ya baby iron iron iron yeah when im in trouble be my lawyer when im hurt be my doctor baby when i need ya i want ya to be my lover i want ya to iron iron iron all the wrinkles outta my heart with your lovin cause i need you right now come on now baby baby baby im beggin down on my last pair a knees please do somethin for me have a little mercy mercy mercy baby i want you to take your lovin iron iron iron out all the rough rough rough spots in my heart baby now girl a i need you huh baby baby yeah yeah thats alright its gonna be alright an im gonna take you to love love cmon think were makin love make my heart secure oh baby now","Iron Out the Rough Spots","1966"
"Don Covay & the Goodtimers","sometimes you love me like a good woman oughta sometimes you hurt me so bad my tears run like water sometimes you get me out yeah right before your friends now then you kiss on me baby tell me you love me again yeah your love is like seesaw your love is like seesaw yeah your love is like seesaw baby go up down all around like a see saw sometimes you tell me im your sweet candy man then sometimes baby i just never know where i stand you lift me up when im on the ground soon as i get up child you send me tumbling down oh your love is like seesaw your love is like seesaw yeah your love is like seesaw baby go up down all around like a seesaw yeah when im kissing you and i like it and ask you to kiss me again i reach at you you jump out of sight you change just like the wind got it right got it right got it right now your love is like seesaw yeah your love is like seesaw your love is like seesaw baby go up down go up down go up down all around like a seesaw never know baby sometimes you love me sometimes you baby i dont need no talking of love i want someone to love me all the time right now sometimes you love me you love me up and down all around i never know when youre with me baby never know when youre kissing me i love you i need to love","See Saw","2009"
