"Band","Lyrics","Song","Year"
"Amber Morgan","some things ive done make my conscience burn my very spine shudder and squirm i only hope that ive learned from my sin i heard a voice when i was thirteen got baptized washed up clean but the world has a way if you know what i mean to scuff you up again and again i cant explain a blessed thing not a falling star or a feathered wing or how a man in chains has the strength to sing just one thing is clear to me theres always more than what appears to be and when the lights just right i swear i see poetry now somebody made every natural thing from the soul inside out to saturns rings how my baby smiles and how ray charles sings of course we were created the clouds make rain the ocean makes sand the earth breathes fire and lava makes land now that took a mighty hand and a wild imagination i cant explain a blessed thing not a falling star or a feathered wing or how a man in chains has the strength to sing just one thing is clear to me theres always more than what appears to be and when the lights just right i swear i see poetry the dreams i dreamed came back ten fold the friends i have the woman i hold i look down and im on streets of gold after all the mud along the way and sometimes the big old mystery just leans right on me and whispers that im home and i am free and ill take that any day i cant explain a blessed thing not a falling star or a feathered wing or how a man in chains has the strength to sing just one thing is clear to me theres always more than what appears to be and when the lights just right i swear i see poetry","Poetry","2005"
"Amber Morrow","i wish i wish i wish to every city i wish i wish i wish every hood i wish i wish i wish and every block ghetto america rollin through the hood just stopped by to say whats up and let you know your baby boy aint doing so tough and even though you passed going on four long years still waking up late at night crying tears just thinking about those days you used to talk to me smilin while im sippin on this hennessey and remember we bragged on how rich we would be to get up out this hood was like a fantasy and now you hear my songs the radio is bangin oh i cant believe my ears and what everybodys sayin and boy ill tell you folks dont know the half i would give it all up just to take one ride with you how i used to kick it on the front porch with you and how i used to lay back and smoke weed with you and all the little basement party joints wed do now im just missing you how i wish i wish that i could hold you now i wish that i could touch you now i wish that i could talk to you be with you somehow i know youre in a better place even though i cant see your face i know youre smiling down on me saying everythings okay and if i make it out this thug life ill see you again someday i wish i wish i wish i wish i wish i wish now ever since this money come its been nothing but stress sometimes i wish that i could just trade in my success yall look at me and say boy youve been blessed but yall dont see the inside of my unhappiness man i swear this shit gets heavy like a ton thats why you hear me shootin this real shit off like a gun hmm i wonder how my friends would treat me now if i wasnt iced up with a bentley and a house thats why fake ass niggas get fake ass digits and fake ass playas get a real playa hatin em honey love goes platinum and yall ass come around but yall dont want to raise the roof until my shit is going down and now you hear my songs the radio is bangin oh i cant believe my ears and what everybodys sayin boy ill tell you folks dont know the half i would give it all up just to take one ride with you how i used to hoop off in them tournaments with you and how i used to club hop on weekends with you your family called the morning of the tragic end damn my condolences voices in my head be telling me to come to church said the lord is the only way for you to stop the hurt dreaming of windows black tinted like a hearse when waking up to life sometimes seems worst and all i ever wanted is to be a better man and i try to keep it real with my homies now for me to save the world i dont understand how did i become the leader of a billion men and now you hear my songs the radio is bangin oh i cant believe my ears and what everybodys sayin boy ill tell you folks dont know the half i would give it all up just to take one ride with you how i used to street perform on friday with you and how i used to go to church on easter sunday with you standing here throwing them songs at me somebody pray for me i wish that i could hold you now i wish that i could touch you now i wish that i could talk to you be with you somehow i know youre in a better place even though i cant see your face i know youre smiling down on me saying everythings okay","I Wish","2014"
"Amber Morrow","i wish i wish i wish to every city i wish i wish i wish every hood i wish i wish i wish and every block i wish i wish i wish ghetto america rollin through the hood just stopped by to say whats up and let you know your baby boy aint doin so tough even though you passed goin on four long years still wakin up late at night cryin tears just thinkin about those days you used to talk to me smilin while im sippin on this hennessey and remember wed brag on how rich we would be to get out this hood was like a fantasy and now you hear my songs the radio is playin oh i cant believe my ears and what everybody is sayin boy i tell you folks dont know the half i would give it all up just to take one ride with you how i used to kick it on the front porch with you and how i used to lay back and smoke weed with you and all the little basement party joints wed do now im just missing you how i wish i wish that i could hold you now i wish that i could touch you now i wish that i could talk to you be with you somehow i know i know youre in a better place even though i cant see your face i know youre smilin down on me sayin everythings okay and if i make it out this thug life see you again someday i wish i wish i wish i wish i wish i wish ever since this money come its been nothing but stress sometimes i wish that i could just trade in my success yall look at me and say boy youve been blessed but yall dont see the inside of my unhappiness man i swear this shit gets heavy like a ton thats why you hear me shootin this real shit off like a gun i wonder how my friends would treat me now if i was iced up with a bentley and a house thats why fake ass niggas get fake ass digits and fake ass players get a real player hatin em honey love goes platinum and yall ass come round but yall dont wanna raise the roof until my shit is goin down and now you hear my songs the radio is playin oh i cant believe my ears and what everybody is sayin boy i tell you folks dont know the half i would give it all up just to take one ride with you and how i used to hoop off in them to tournaments with you and how i used to club hop on weekends with you your family called the morning of the tragic end damn my condolences i wish that i could hold you now i wish that i could touch you now i wish that i could talk to you be with you somehow i know youre in a better place even though i cant see your face i know youre smilin down on me sayin everythings okay and if i make it out this thug life see you again someday i wish i wish i wish i wish i wish i wish voices in my head been tellin me to come to church say the lord is the only way for you to stop the hurt dreamin of windows black tinted like a hearse but wakin up to life sometimes seems worse and all i ever wanted is to be a better man and i try to keep it real with my homies man want me to save the world i dont understand how did i become the leader of a billion fans and now you hear my songs the radio is playin oh i cant believe my ears and what everybodys sayin boy i tell you folks dont know the half i would give it all up just to take one ride with you how i used to street perform on friday with you and how id go to church on easter sunday with you instead of yall throwin them stones at me somebody pray for me oh i wish that i could hold you now i wish that i could touch you now i wish that i could talk to you be with you somehow i know youre in a better place even though i cant see your face i know youre smilin down on me sayin everythings okay oh i wish that i could hold you now i wish that i could touch you now i wish that i could talk to you be with you somehow i know youre in a better place even though i cant see your face i know youre smilin down on me sayin everythings okay oh i wish that i could hold you now i wish that i could touch you now i wish that i could talk to you be with you somehow i know youre in a better place even though i cant see your face i know youre smilin down on me sayin everythings okay oh i wish that i could hold you now i wish that i could touch you now i wish that i could talk to you be with you somehow","I Wish [Version]","2014"
"Amber Navran","its time to go its time to go home to home to i pushed aside the truth cause aint no days promised i know i made mistakes trying to pray quiet i gave away my peace but i know where to find it im going going home im going home i spent way too much time tryna fit in laying on this flow dying flashing through my life and everybody said its cool but where they telling me we young and how we only gon live once and its the way to fully enjoy this party but i was having fun before i ever took the risk and now they bangin on my chest telling me its time to go thinkin bout my family know this one gon hurt em honest damn im sorry mama but i gotta time to go goin home tell grand mama i love her and if you see my baby hug her cause these people said i gotta go save jordans for my brother tell little sister your daughter peer pressure is coming its real mama damn near all you and none of that is cool but its her decision to choose just remember me when its your time time to go home i pushed aside the truth cause aint no days promised i know i made mistakes trying to pray quiet i gave away my peace but i know where to find it im going going home brought my baby out to play today thinking when i saw em arguing this cant be good i told her come on come on baby time to go now we lying right here dying and it hurts i couldnt save her why theyd have to shoot my baby god damn near all of you over colors she would color wit tomorrow i know theyll both forget us when its time to go time to go goin home bought her building blocks just yesterday so excited to play but now theres blood soaking her clothes and we aint have nothing do wit it why they have to trip we was just out here enjoying the day and now they had to come and ruin shit damn near all of you now we laying on the ground and everything around me fading cause i know deep down its time for us to time to go home to i was having fun then mama told me its time to go then i heard a thing go bang bang bang bang bang now we lying and its time for us to time to go she grabbed me tried to run but it was far too late and now we staring at the sun she waiting on me damn near all you i hope you dont forget us and i pray that god forgive you when its finally your time your time time to go home to sweet songs and halos and and im so undistracted laughing at the winds and long goodbyes and ashes i will find my strength at last my mind captive im going im going going home we was staring at the sun too we was shooting at each other and now we both dying too i got a family and i know he got a family too im praying to my god and he praying to his too he fighting for his family and im fighting for mine too money oil land gold the only plan was to make it back safe with both my feet and hands but now its time to go well now im on my way back going its time to go theyll give my wife a flag and tell my sons how brave their dad was and when i make it back home its time to go i hope they save the letters pics and know how much i wished i wished it wasnt time for me to damn near all of you but know i had em on my heart and i aint want no purple heart im sorry baby but i gotta go its time to go home to i pushed aside the truth cause aint no days promised i know i made mistakes trying to pray quiet i gave away my peace but i know where to find it im going im going its time to go home to damn near all of you home to its time to go home to its time to go home to its time to go home to damn near all of you home to its time to go home to its time to go home to i pushed aside the truth cause aint no days promised i know i made mistakes trying to pray quiet i gave away my peace but i know where to find it im going its time to go home to damn near all of you home to time to go home to","Jesus Coming","2017"
"Amber Pacific","ill hold a place for you inside inside my heart for you and i i wont forget these tears i cried with every year that passes by and i cant sleep without you and i cant breathe anymore good times last forever ill keep my heart with yours for every minute i am gone i am gone swear youll never leave me ill be there every time in your heart and in your eyes ill give it up this time again some things are better left unsaid and all i have are lasting dreams our words worth more this time it seems and i cant sleep without you and i cant breathe anymore good times last forever ill keep my heart with yours for every minute i am gone i am gone swear youll never leave me ill be there every time in your heart and in your eyes good times last forever ill keep my heart with yours for every minute i am gone i am gone swear youll never leave me ill be there every time in your heart and in your eyes in your eyes good times last forever ill keep my heart with yours for every minute i am gone i am gone swear youll never leave me ill be there every time in your heart and in your eyes in your eyes in your eyes","Always You (Good Times)","2004"
"Amber Pacific","i cant give you the moment the chance to be right i wont save this for tonight i cant give you the reason the truth or the light but i will keep you in my sight i cant say that im scared as this pain sets me free i have lived without love without all that i need see the marks that i bare and the shame that runs deep you have made every moment so worthless to me and i cant understand this at all runaway from this life is so far from the things that i know wont let go get away from this fight i dont want to give in or let go i wont let go i cant say that im proud as this pain spreads through me i have said my last words i have thrown out the keys i get back to despair as my eyes fall asleep now our dreams come to ends i am so incomplete and i cant comprehend this at all runaway from this life is so far from the things that i know that i know get away from this fight i dont want to give in or let go i wont let go i cant give you the reason the truth or the light but i will keep you in my sight runaway from this life is so far from the things that i know get away from this fight i dont want to give in or let go runaway from this life is so far from the things that i know wont let go get away from this fight i dont want to give in or let go i wont let go","Runaway","2007"
"Amber Pacific","its time to fake what you say as youre turning away though its hard to be fake facing you every day with regret with remorse for the things that were said but you know how alone well end up in the end cause i dont want to see our lives destroyed by dismay in these times of try we live or die again youre my summer that fades to these cold autumn days youre my keepsake my friend and my fears youre the strength thats inside and i swear on my life i will always be there by your side its hard to live without love with the chance that you may find the whole world is waiting to hear what you say from the heart through your veins to the answers that came here to save me to guide me to show me the way so i dont want to see our lives destroyed by dismay in these times of try we live or die again so take this time to see that i cant leave this all to chance so take this time to see that i have hope that lies will end i will always be there by your side i will always be there by your side","Summer (In B)","2007"
"Amber Pacific","dont wanna call you cause i miss you too much dont want to play cause im outta luck in this town in this town tomorrow ill be in another state i get so nervous cause i just cant wait to see you i guess i need you dont believe everything you read about me people talk but it doesnt matter what they say i know youre always waiting for a status update it comes a little too late cant stop thinking im to blame cause youre ready for the next one the distance killed the burning flame and i cant stop myself from trying to figure out the fastest way to work this out cause im ready for you three words cant fix us anymore i know youve been working nine to five i know you miss me but you try to hide your feelings cause i gave you reasons i remember when you took your breaks you called to tell me all about your day i miss that why cant we fix that dont believe everything you read about me people talk but it doesnt matter what they say i know youre always waiting for a status update it comes a little too late cant stop thinking im to blame cause youre ready for the next one the distance killed the burning flame and i cant stop myself from trying to figure out the fastest way to work this out cause im ready for you three words cant fix us anymore cant fix us anymore three words cant fix us anymore cant stop thinking im to blame cause youre ready for the next one the distance killed the burning flame and i cant stop myself from trying to figure out the fastest way to work this out cause im ready for you three words cant fix us anymore","Three Words","2010"
"Amber Riley","and i am telling you im not going youre the best man ill ever know theres no way i can ever go no no theres no way no no no no way im living without you im not living without you i dont wanna be free im staying im staying and you and you youre gonna love me ooh ooh mm mm youre gonna love me and i am telling you im not going even though the rough times are showing theres just no way theres no way were part of the same place were part of the same time we both share the same blood we both have the same mind and time and time weve had so much to share and no no no no no no im not waking up tomorrow morning and finding that theres nobody there and i mean theres no way no no no no way im living without you im not living without you you see theres just no way theres no way tear down the mountains yell scream and shout like you can say what you want im not walking out stop all the rivers push strike and kill im not gonna leave you theres no way i will and i am telling you im not going youre the best man ill ever know theres no way i can ever ever go no no no no way no no no no way im living without you oh im not living without you not living without you i dont wanna be free im staying im staying and you and you and you youre gonna love me youre gonna love me yes you are ooh ooh love me ya ya love me love me love me love me love youre gonna love me","And I Am Telling You I'm Not Going","2009"
"Amber Riley","ooh dont make me over now that id do anything for you dont make me over now that you know how i adore you dont pick on the things i say the things i do just love me with all my faults the way that i love you im begging you dont make me over now that i cant make it without you dont make me over i wouldnt change one thing about you just take me inside your arms and hold me tight and always be by my side if i am wrong or right im begging you dont make me over oh ah dont make me over ah now that youve got me at your command ah oh accept me for what i am ooh ah accept me for the things that i do ooh ah accept me for what i am oh ah accept me for the things that i do oh ah now that id cant make it without you i wouldnt change one thing about you just take me inside your arms and hold me tight and always be by my side if i am wrong or right im begging you dont make me over ooh ah dont make me over ah now that youve got me at your command ah oh accept me for what i am oh ah accept me for the things that i do oh ah accept me for what i am oh ah accept me for the things that i do oh ah","Don't Make Me Over","2009"
"Amber Riley","ba ba ba ba ba ba da ba ba da ba ba ba ba ba ba ba da ba ba da ba ba ba ba ba ba ba da ba ba da ba ba ba ba ba ba ba da ba ba da ba jump jump jump i get up and nothin gets me down you got it tough ive seen the toughest around and i know baby just how you feel youve got to roll with the punches to get to whats real oh cant you see me standing here i got my back against the record machine i aint the worst that youve seen aint the worst that youve seen oh cant you see what i mean cant you see what i mean ba ba ba ba ba ba da ba ba da ba ah might as well jump jump might as well jump go ahead and jump jump go ahead and jump a oh hey you who said that baby how you been you say you dont you dont know you wont know until you begin oh cant you see me standing here i got my back against the record machine i aint the worst that youve seen aint the worst that youve seen oh cant you see what i mean cant you see what i mean yeah might as well jump jump go ahead and jump might as well jump jump go ahead and jump yeah oh yeah yeah jump ba ba ba ba ba ba da ba ba da ba ba ba ba ba ba ba da ba ba da ba jump yeah might as well jump jump might as well jump go ahead and jump go ahead and jump ba ba ba ba ba ba da ba ba da ba ba ba ba ba ba ba da ba ba da ba whoa jump jump jump jump jump","Jump","2009"
"Amber Riley","um um um um um um um um um um um um um um um um um um sometimes in our lives we all have pain we all have sorrow but if we are wise we know that theres always tomorrow lean on me when youre not strong and ill be your friend ill help you carry on for it wont be long til im gonna need somebody to lean on please please swallow your pride pride if i have things you need to borrow for for no one can fill those of your needs that you wont let show so just call call on me brother hey when you need a hand when you need a hand we all need need somebody to lean on i just might have a problem i just might have a problem that youll understand we all need somebody to lean on lean on me hey when youre not strong when youre not strong ill be your friend ill be your friend and ill help you carry on help you carry on for it wont be long oh it wont be long til im gonna need somebody to lean on just lean on me you just call on me brother hey when you need a hand when you need a hand we all need need somebody to lean on somebody to lean on i just might i just might have a problem that youll understand we all need somebody to lean on oh lean on me if if there is a load there is a load you have to bare you have to bare that you cant carry im im higher right up the road ill share your load if you just call me call me im calling call me when you need a friend call me call me call me call me when you need a friend call me when you need a friend call me if you need a friend call me any time of day call me ooh it wont be long til im gonna need somebody to lean on lean on lean on lean on lean on lean on me when you need a friend lean on lean on lean on me lean on me you can lean on me im gonna need somebody somebody to lean on im gonna need somebody to lean on somebody to lean on yeah","Lean On Me","2009"
"Amber Riley","guess this means youre sorry youre standing at my door guess this means you take back all you said before like how much you wanted anyone but me said youd never come back but here you are again cause we belong together now yeah forever united here somehow yeah you got a piece of me and honestly my life my life would suck would suck without you maybe i was stupid for telling you goodbye maybe i was wrong for trying to pick a fight i know that ive got issues but youre pretty messed up too either way i found out im nothing without you cause we belong together now yeah forever united here somehow yeah you got a piece of me and honestly my life my life would suck would suck without you being with you is so dysfunctional i really shouldnt miss you but i cant let you go oh yeah la la la la la la la la la la la la la la la la la la la la la la cause we belong together now yeah forever united here somehow yeah you got a piece of me and honestly my life my life would suck would suck without you yeah cause we belong together now yeah together now forever united here somehow yeah somehow you got a piece of me and honestly my life my life would suck would suck without you","My Life Would Suck Without You","2009"
