"Band","Lyrics","Song","Year"
"Monica Grabin","i saw the splendor of the moonlight on honolulu bay theres something tender in the moonlight on honolulu bay and all the beaches are filled with peaches who bring their ukes along and in the glimmer of the moonlight they love to sing this song if you like ukulele lady ukulele lady like ayou if you like to linger where its shady ukulele lady linger too if you kiss ukulele lady while you promise ever to be true and she sees another ukulele lady foolin round with you maybe shell sigh an awful lot maybe shell cry and maybe not maybe shell find somebody else by and by to sing to when its cool and shady where the tricky wicky wacky woo if you like ukulele lady ukulele lady like ayou she used to sing to me by moonlight on honolulu bay fond memories cling to me by moonlight although im far away some day im going where eyes are glowing and lips are made to kiss to see somebody in the moonlight and hear the song i miss if you like ukulele lady ukulele lady like ayou if you like to linger where its shady ukulele lady linger too if you kiss ukulele lady while you promise ever to be true and she sees another ukulele lady foolin round with you maybe shell sigh an awful lot maybe shell cry and maybe not maybe shell find somebody else by and by to sing to when its cool and shady where the tricky wicky wacky woo if you like ukulele lady ukulele lady like ayou","Ukulele Lady","2007"
"Monica Hammond","i know youre praying for a change to see a sunny day nothing good has come your way for so long you need someone to understand this place your heart is in you just want to dream again and believe your skies may look dim and grey but know your breakthroughs not far away so hold on you are too close to give up now you have so much to live for remember what you prayed for hold on please dont let go in this season know that flowers bloom when rain falls you just hold on you ask when will this go away know that god can feel your pain believe hell never fall short of his word sometimes we forget that he holds us his hands but im reminding you dont give up your skies may look dim and grey but know your breakthroughs not far away i know youre praying for a change to see a sunny day nothing good has come your way for so long you need someone to understand this place your heart is in you just want to dream again and believe ive been where you are almost at the breaking point in my life i know you say its impossible but youve got to hang on cause its just about over all of your dreams all of your desires are coming to pass so im telling you dont lose your faith hold on to his word dont give up your skies may look dim and grey but know your breakthroughs not far away i know youre praying for a change to see a sunny day nothing good has come your way for so long you need someone to understand this place your heart is in you just want to dream again and believe never let go you are too close now","Hold On","2013"
"Monica Hatch","oh danny boy the pipes the pipes are calling from glen to glen and down the mountain side the summers gone and all the roses falling its you its you must go and i must bide but come ye back when summers in the meadow or when the valleys hushed and white with snow its ill be here in sunshine or in shadow oh danny boy oh danny boy i love you so but when ye come and all the flowers are dying if i am dead as dead i well may be youll come and find the place where i am lying and kneel and say an ave there for me and i shall hear though soft you tread above me and all my grave will warmer sweeter be for you will bend and tell me that you love me and i shall sleep in peace until you come to me","Danny Boy","1995"
"Monica Hatch","i often wonder why he came to me brought such a flame to me and let it die and if another love should find my heart it will remind my heart of your goodbye with every new love you will come back to me in others eyes its you i see if i love again though its someone new if i love again itll still be you in someone elses firm embrace ill close my eyes but see your face if i love again ill find other charms but ill make believe you are in my arms and though my lips whisper i love you my heart will not be true ill be loving every time i love again","If I Love Again","2000"
"Monica Hatch","i took one look at you thats all i meant to do and then my heart stood still my feet could step and walk my lips could move and talk and yet my heart stood still though not a single word was spoken i could tell you knew that unfelt clasp of hands told me so well you knew i never lived at all until the thrill of that moment when my heart stood still i took one look at you thats all i meant to do and then my heart stopped right there my feet could step and walk my lips could move and talk and yet my heart stood still though not a single word was spoken i could tell you knew that unfelt claps of hands told me so well you knew i never lived at all until the thrill of that moment when my heart stood still","My Heart Stood Still","2000"
"Monica Hatch","listen to my tale of woe its terribly sad but true all dressed up no place to go each evening im awfully blue i must win some handsome guy cant go on like this i could blossom out i know with somebody just like you so oh sweet and lovely lady be good oh lady be good to me i am so awfully misunderstood so lady be good to me oh please have some pity im all alone in this big city i tell you im just a lonesome babe in the wood so lady be good to me oh please have some pity im all alone in this big city i tell you im just a lonesome babe in the wood so lady be good to me oh lady be good to me","Oh, Lady Be Good","2000"
"Monica Hatch","youre just too marvelous too marvelous for words like glorious glamorous and that old standby amorous its all too wonderful ill never find the words that say enough tell enough i mean they just arent swell enough youre much too much and just too very very to ever be in websters dictionary and so im borrowing a love song from the birds to tell you that youre marvelous too marvelous for words youre much youre too much and just too very very to ever be to ever be in websters dictionary and so im borrowing a love song from the birds to tell you that youre marvelous tell you that youre marvelous tell you that youre marvelous too marvelous for words","Too Marvelous for Words","2000"
"Monica Heldal","with brown eyes shining shore light on the way to go and the sun tries youre feeling home i guess youre broke and we lost sight of it and breath tide up in someones hold and i screamed at burgh island in sepia tones and if i was ever to leave id say before i go that youre the best moment i have ever known with brown eyes shining shore light on the way to go and the sun tries you so long and we lost sight of it and breath tide up in someones hold and well break for it on burgh island in sepia tones and if i was ever to leave ill say before i go that youre the best moment i have ever known oh i bite my tongue that you maybe the first to the wind cause i heard each song the man is a fickle child the one blowing oh i bite my tongue that you maybe the first to the wind cause i heard each song the man is a fickle child the one blowing","Burgh Island","2012"
"Monica Lander","si supieras que aun dentro de mi alma conservo aquel carino que tuve para ti quien sabe si supieras que nunca te he olvidado volviendo a tu pasado te acordaras de mi los amigos ya no vienen ni siquiera a visitarme nadie quiere consolarme en mi afliccion desde el dia que te fuiste siento angustias en mi pecho deci percanta que has hecho e mi pobre corazon sin embargo yo siempre te recuerdo con el carino santo que tuve para ti y estas en todas partes pedazo de mi vida y aquellos ojos que fueron mi alegria los busco por todas partes y no los puedo hallar al cotorro abandonado ya ni el sol de la manana asoma por la ventana como cuando estabas vos y aquel perrito companero que por tu ausencia no comia al verme solo el otro dia tambien me dejo","La Cumparsita","1994"
"Monica Lander","corrientes tres cuatro ocho segundo piso ascensor no hay porteros ni vecinos adentro cocktel de amor pisito que puso maple piano estera y velador un telefono que contesta una fonola que llora viejos tangos de mi flor y un gato de porcelana pa que no maulle el amor y todo a media luz que es un brujo el amor a media luz los besos a media luz los dos y todo a media luz crepsculo interior que suave terciopelo la media luz de amor juncal doce venticuatro telefonea sin temor de tarde te con masitas de noche tango y amor los domingos t danzante los lunes desolacin hay de todo en la casita almohadones y divanes como en botica coco alfombras que no hacen ruido y mesa puesta al amor","A Media Luz","1994"
"Monica Lander","uno busca lleno de esperanzas el camino que los suea os prometieron a sus ansias sabe que la lucha es cruel y es mucha pero lucha y se desangra por la fe que lo empecina uno va arrastra ndose entre espinas y en su afa n por dar su amor sufre y se destroza hasta entender que uno se quedo sin coraza3n precio de castigo que uno entrega por un beso que no llega o un amor que lo engaa o vacia3 ya de amar y de llorar tanta traicia3n si yo tuviera el coraza3n el mismo que perda si olvidara a la que ayer lo destrozo y pudiera amarte me abrazara a a tu ilusia3n para llorar tu amor pero dios te trajo a mi destino sin pensar que ya es muy tarde y no sabra c como quererte da c jame que llore como aquel que sufre en vida la tortura de llorar su propia muerte buena como eres salvarias mi esperanza con tu amor uno esta tan solo en su dolor uno esta tan ciego en su penar pero un fria3 cruel que es peor que el odio punto muerto de las almas tumba horrenda de mi amor maldijo para siempre y me robo toda ilusia3n si yo tuviera el coraza3n el mismo que perda si olvidara a la que ayer lo destrozo y pudiera amarte me abrazara a a tu ilusia3n para llorar tu amor letras transcritas por diego vanegas","Uno","1994"
"Monica Lewis","i dont want you but id hate to lose you youve got me in between the devil and the deep blue sea i forgive you cause i cant forget you youve got me in between the devil and the deep blue sea i ought to cross you off my list but when you come a knocking at my door fate seems to give my heart a twist and i come running back for more i should hate you but i guess i love you youve got me in between the devil and the deep blue sea youve got me in between the devil and the deep blue sea the devil and the deep blue sea","Between the Devil and the Deep Blue Sea","1955"
"Monica Lewis","give me a kiss to build on and my imagination will thrive upon that kiss sweetheart i ask no more than this a kiss to build a dream on give me a kiss before you leave me and my imagination will feed my hungry heart leave me one thing before we part a kiss to build a dream on when im alone with my fancies ill be with you weaving romances making believe theyre true give me your lips for just a moment and my imagination will make that moment live give me what you alone can give a kiss to build a dream on","A Kiss to Build a Dream On","1955"
"Monica Lewis","here i go again i hear those trumpets blow again all aglow again takin a chance on love here i slide again about to take that ride again starry eyed again takin a chance on love i thought that cards were a frame up i never would try now im taking that game up and the ace of hearts is high things are mending now i see a rainbow blending now well have a happy ending now takin a chance on love here i slip again about to take that trip again i got that grip again takin a chance on love now i prove again that i can make life move again um im in the groove again takin a chance on love i walk around with a horse shoe in clover i lie and brother rabbit of course you better kiss your foot good bye on that ball again im ridin for a fall again im gonna give my all again takin a chance on love","Taking a Chance on Love","1955"
"Monica Lewis","love is funny or its sad or its quiet or its mad its a good thing or its bad but beautiful beautiful to take a chance and if you fall you fall and im thinking i wouldnt mind at all love is tearful or its gay its a problem or its play its a heartache either way but beautiful and im thinking if you were mine id never let you go and that would be but beautiful i know","But Beautiful","1958"
"Monica Lewis","romance is a game for fools i used to say a game i thought id never play romance is a game for fools i said and grinned then you passed by and here am i throwing caution to the wind fools rush in where angels fear to tread and so i come to you my love my heart above my head though i see the danger there if theres a chance for me then i dont care mm mm mm mm fools rush in where wise men never go but wise men never fall in love so how are they to know when we met i felt my life begin so open up your heart and let this fool rush in fools rush in where wise men never never never go eh but wise men never fall in love so how are they to know ah when we met girl i felt my life begin so open up your heart and let this fool rush in just open up your heart and let this fool rush on in just open up your heart because i i i i i i i am coming in open up your heart and let this fool rush in","Fools Rush In","1958"
"Monica Lewis","the weather is frightening the thunder and lightning seem to be having their way but as far as im concerned its a lovely day the turn in the weather will keep us together so i can honestly say that as far as im concerned its a lovely day and everythings okay isnt this a lovely day to be caught in the rain you were going on your way now youve got to remain just as you were going leaving me all at sea the clouds broke they broke and oh what a break for me i can see the sun up high though were caught in a storm i can see where you and i could be cozy and warm let the rain pitter patter but it really doesnt matter if the skies are gray long as i can be with you its a lovely day","Isn't This a Lovely Day?","1958"
"Monica Lewis","why do they think up stories that link my name with yours why do the neighbors chatter all day behind their doors i know a way to prove what they say is quite untrue here is the gist a practical list of donts for you dont throw bouquets at me dont please my folks too much dont laugh at my jokes too much people will say were in love dont sigh and gaze at me your sighs are so like mine your eyes mustnt glow like mine people will say were in love dont start collecting things give me my rose and my glove sweetheart theyre suspecting things people will say were in love dont praise my charm too much dont look so vain with me dont stand in the rain with me people will say were in love dont take my arm too much dont keep your hand in mine your hand feels so grand in mine people will say were in love dont dance all night with me till the stars fade from above theyll see its alright with me people will say were in love","People Will Say We're in Love","1958"
"Monica Lewis","you dont know what love is til youve learned the meaning of the blues until youve loved a love youve had to lose you dont know what love is you dont know how lips hurt until youve kissed and had to pay the cost until youve flipped your heart and you have lost you dont know what love is do you know how a lost heart fears at the thought of reminiscing and how lips that taste of tears lose their taste for kissing you dont know how hearts burn for love that can not live yet never dies until youve faced each dawn with sleepless eyes you dont know what love is","You Don't Know What Love Is","1958"
"Monica Lewis","you make me feel so young you make me feel as though spring has sprung and every time i see you grin im such a happy in div dual the moment that you speak i wanna go play hide and seek i wanna go and bounce the moon just like a toy balloon you and i are just like a couple of tots runnin across the meadow pickin up lots of forget me nots you make me feel so young you make me feel there are songs to be sung bells to be rung and a wonderful spring to be sprung and even when im old and gray im gonna feel the way i do today cause you make me feel so young","You Make Me Feel So Young","1958"
"Monica Lewis","old man sunshine listen you never tell me dreams come true just try it and ill start a riot beatrice fairfax dont you dare ever tell me he will care im certain its the final curtain i never want to hear from any cheerful pollyannas who tell you fate supplies a mate its all bananas theyre writing songs of love but not for me a lucky stars above but not for me with love to lead the way ive found more clouds of gray than any russian play could guarantee i was a fool to fall and get that way hi ho alas and also lack a day although i cant dismiss the memory of his kiss i guess hes not for me i was a fool to fall and get that way hi ho alas and also lack a day although i cant dismiss the memory of his kiss","But Not for Me","1990"
"Monica Lewis","as a tot when i trotted in little velvet panties i was kissed by my sisters my cousins and my aunties sad to tell it was hell an inferno worse than dantes so my dear i swore never never more on my list i insisted that kissing must be crossed out now i find i was blind and oh my how i lost out i could cry salty tears where have i been all these years little wow tell me now how long has this been going on there were chills up my spine and some thrills i cant define listen sweet i repeat how long has this been going on oh i feel that i could melt into heaven im hurled i know how columbus felt finding another world kiss me once then once more what a dunce i was before what a break for heavens sake how long has this been going on dear when in your arms i creep that divine rendezvous dont wake me if im asleep let me dream that its true kiss me twice then once more that makes thrice lets make it four what a break for heavens sake how long has this been going on how long has this been going on","How Long Has This Been Going On?","1990"
"Monica Lewis","theres a saying old says that love is blind still were often told seek and ye shall find so im going to seek a certain lad ive had in mind looking everywhere havent found him yet hes the big affair i cannot forget only man i ever think of with regret id like to add his initial to my monogram tell me where is the shepherd for this lost lamb theres a somebody im longing to see i hope that he turns out to be someone wholl watch over me im a little lamb whos lost in the wood i know i could always be good someone wholl watch over me although he may not be the man some girls think of as handsome to my heart he carries the key wont you tell him please to put on some speed follow my lead oh how i need someone to watch over me","Someone to Watch over Me","1990"
"Monica Lewis","spring is here why doesnt my heart go dancing spring is here why isnt the waltz entrancing no desire no ambition leads me maybe its because nobody needs me spring is here why doesnt the breeze delight me stars appear why doesnt the night invite me maybe its because nobody loves me spring is here i hear spring is here why doesnt my heart go dancing spring is here why isnt the waltz entrancing no desire no ambition leads me maybe its because nobody needs me spring is here why doesnt the breeze delight me stars appear why doesnt the night invite me maybe its because nobody loves me spring is here i hear","Spring Is Here","1990"
"Monica Lewis","all our friends keep knocking at the door theyve asked me out a hundred times or more but all i say is leave me in the gloom and here i stay within my lonely room cause i dont want to walk without you baby walk without my arm about you baby i thought the day you left me behind id take a stroll and get you right off my mind but now i find that i dont want to walk without the sunshine whyd you have to turn off all that sunshine oh baby please come back or youll break my heart for me cause i dont want to walk without you no sire","I Don't Want to Walk Without You","1992"
"Monica Lewis","i fall in love too easily i fall in love too fast i fall in love too terribly hard for love to ever last my heart should be well schooled cause ive been fooled in the past and still i fall in love too easily i fall in love too fast i fall in love too easily i fall in love too fast i fall in love too terribly hard for love to ever last my heart should be well schooled cause ive been fooled in the past and still i fall in love too easily i fall in love too fast","I Fall in Love Too Easily","1992"
"Monica Lewis","how did i know that the warmth of the glow would last how did i guess that the long loneliness was past i merely looked at you and i knew that i knew its you or no one for me im sure of this each time we kiss now and forever and when forevers done youll find that you are still the one please dont say no to my plea cause if you do then im all through theres this about you my worlds an empty world without you its you or no one for me please dont say no to my plea cause if you do then im all through theres this about you my worlds an empty world without you its you or no one for me for me","It's You or No One","1992"
"Monica Lewis","my mama done tol me when i was in knee pants my mama done tol me son a womanll sweet talk and give ya the big eye but when the sweet talkins done a womans a two face a worrisome thing wholl leave ya tsing the blues in the night now the rains a fallin hear the train a collin whoo ee my mama done tol me hear dat lonesome whistle blowin cross the trestle whoo ee my mama done tol me a whoo ee duh whoo ee ol clickety clacks a echoin back th blues in the night the evenin breezell start the trees to cryin and the moonll hide its light when you get the blues in the night take my word the mockin birdll sing the saddest kind o song he knows things are wrong and hes right from natchez to mobile from memphis to st joe wherever the four winds blow i been in some big towns an heard me some big talk but there is one thing i know a womans a two face a worrisome thing wholl leave ya tsing the blues in the night my mama was right theres blues in the night","Blues in the Night","1998"
"Monica Lewis","i get no kick from champagne mere alcohol doesnt thrill me at all so tell me why should it be true that i get a kick out of you some get a kick from cocaine im sure that if i took even one sniff it would bore me terrifically too yet i get a kick out of you i get a kick every time i see you standing there before me i get a kick though its clear to see you obviously dont adore me some get a kick in a plane flying too high with some gal in the sky is my idea of nothing to do but i get a kick out of you i get a kick out of you","I Get a Kick Out of You","1998"
"Monica Lewis","ill be seeing you in all the old familiar places that this heart of mine embraces all day through in that small cafe the park across the way the childrens carousel the chestnut trees the wishing well ill be seeing you in every lovely summers day in everything thats light and gay ill always think of you that way ill find you in the morning sun and when the night is new ill be looking at the moon but ill be seeing you ill find you in the morning sun and when the night is new ill be looking at the moon but ill be seeing you","I'll Be Seeing You","1998"
"Monica Lewis","all all its not alright your role it played through time come and rescue me youre needed here at home and your space a moment in time a hand to hold a hand i tried who was it called to you who called your storys alive with hellos and goodbyes bright lights first kiss and drunken nights how i miss you i miss you now and hey and i cant wait another day and hey that crooked smile upon your face oh theyll never get old all the stories you told from the beach to the ring to the songs of your soul how i miss you i miss you now and hey and the rain falling cold outside covered me the day you died you could have waited one more day i shouldve called i dream of your life the war and the fight the music you played the love for your wife and i miss you i miss you now and hey i cant wait another day and hey that crooked smile upon your face oh theyll never get old all the stories you told from the beach to the ring to the songs of your soul how i miss you and i miss you i miss you now and hey and i am mad at the age that stole you away by surviving the beach you gave me my stay and i understand by this that i am all that you were was changed by the sand but i miss you i miss you now and hey i cant wait another day and hey that crooked smile upon your face oh theyll never get old all the stories you told from the beach to the ring to the songs of your soul how i miss you how i miss you","Miss You","1998"
"Monica Lewis","the man who only lives for making money lives a life that isnt necessarily sunny likewise the man who works for fame theres no guarantee that time wont erase his name the fact is the only work that really brings enjoyment is the kind that is for girl and boy meant fall in love and you wont regret it thats the best work of all if you can get it holding hands at midnight neath a starry sky nice work if you can get it and you can get it if you try strolling with the one girl sighing sigh after sigh nice work if you can get it and you can get it if you try just imagine someone waiting at the cottage door where two hearts become one who could ask for anything more loving one who loves you and then taking that vow its nice work if you can get it and if you get it wont you tell me how just imagine someone waiting at the cottage door where two hearts become one who could ask for anything more loving one who loves you and then taking that vow nice work if you can get it and if you get it wont you tell me how","Nice Work If You Can Get It","1998"
