"Band","Lyrics","Song","Year"
"Billie Holiday","tell me more and more and then some you know what i long to hear i want more and more and then some of that i love you only dear tell me more and more and then some the way that you feel and then when youve told that old sweet story and youre through start right in again ive made that old mistake know the awful ache of a heart thats double crossed the waitins been so long hard to believin if ive missed my guess happiness is lost tell me more and more and then some you know how i love that stuff whisper on from now til doomsday but i never will hear enough tell me more and more and then some the way that you feel and then when youve told that old sweet story and youre through start right in again ive made that old mistake know the awful ache of a heart thats double crossed the waitins been so long hard to believin if ive missed my guess happiness is lost tell me more and more and then some you know how i love that stuff whisper on from now til doomsday but i never will hear enough","Tell Me More","1991"
"Billie Holiday","time on my hands you in my arms nothing but love in view then if you fall once and for all ill see my dreams come true moments to spare with someone you care tor one love affair for two and so with time on my hands and you in my arms and love in my heart all for you","Time on My Hands","1991"
"Billie Holiday","what is this going to get us where are we headin in when do we start to i rye dear when do we really begin what is this going to get us hanging around till tour saying goodnight at daybreak kissing goodbye in the doorway we can go on the way weve gone im at the end of my rope i cant live on love ive so much of and i cant keep livin on hope what is this going to get us only an aching heart when is this going to get us together never to part","What Is This Going to Get Us?","1991"
"Billie Holiday","youre a lucky guy when you consider the highest bidder cant buy the gleam in your eyes youre a lucky guy thank you lucky stars youve got a honey who wants no money shell take you just as you are thank you lucky stars hey fellow say fellow dont you realize its fated you rated open up your eyes youre lucky guy youre just beginning so have your inning and let your troubles boom by no one can deny youre a lucky guy hey fellow say fellow look at mr jones hes there and hes staring even he must know youre a lucky guy so why not treasure your highest pleasure and live right up till you die no one can deny boy youre a lucky guy","You're a Lucky Guy","1991"
"Billie Holiday","youre just a no account you never will amount to nothin at all when there is work to do and someone yells for you you dont hear them call the good lord set aside his sundays for folks to rest more that one days rest is wrong you start restin sunday and rest so hard youre tired the whole week long youre just a no account you never will amount to nothin at all i just cant figure how each time you milk the cow the tit gets so small we got machines to do your work for you but you wont press the button on the wall youre just a no account you never will amount to nothin at all youre just a no account you never will amount to nothin at all i just cant figure how each time you milk the cow the tit gets so small we got machines to do your work for you but you wont press the button on the wall youre just a no account you never will amount to nothin at all","You're Just a No Account","1991"
"Billie Holiday","it was a morning long before dawn without a warning i found he was gone how could he do it why should he do it he never done it before am i blue am i blue aint these tears in these eyes telling you how can you ask me am i blue why wouldnt you be too if each plan with your man done fell through there was a time when i was his only one but now im the sad and lonely one lonely was i gay until today now hes gone and were through am i blue","Am I Blue?","1991"
"Billie Holiday","im in a lowdown groove from carrying a torch for you oh what a lowdown groove really dont know what to do my heart has no sense of humor dear as far as youre concerned its more than a winchell rumor this time i really got burned i dont need a song to prove that im in such a lowdown groove","I'm in a Low-Down Groove","1991"
"Billie Holiday","be sure its true when you say i love you its a sin to tell a lie millions of hearts have been broken just because these words were spoken i love you yes i do i love you if you break my heart ill die so be sure that its true when you say i love you its a sin to tell a lie","It's a Sin to Tell a Lie","1991"
"Billie Holiday","jim doesnt ever bring me pretty flowers jim never tries to cheer my lonely hours dont know why im so crazy for jim jim never tells me im his hearts desire i never seem to set his love afire gone are the years ive wasted on him sometimes when i get feelin low i say lets call it quits then i hang on and let him go breakin my heart in bits someday i know that jim will up and leave me but even if he does you can believe me ill go on carrying the torch for jim ill go on lovin my jim","Jim","1991"
"Billie Holiday","love is like a hydrant turns off and on like some friendships when your moneys gone love stands in with the loan sharks when your hearts in tongs it i had some strong wings like an aeroplane had some broad wings like an aeroplane i would fly away forever hover to come again oh love oh love oh loveless love has said our hearts are goldiess gold from milkless milk and silkless silk we are growing used to soul less souls such grafting times we never saw thats why we have a pure full law in everything we find a flaw even love oh love oh loveless love just to fly away from loveless love","Loveless Love","1991"
"Billie Holiday","romance in the dark with you all at once i knew darlin love was near i thrill to my finger tips i could feel your lips darlin oh so near the music was so entrancing the lights all began to fade i said to myself keep dancing but only my heart obeyed a flame grew from just a spark when i found romance in the dark with you","Romance in the Dark","1991"
"Billie Holiday","i hate to see that evening sun go down i hate to see that evening sun go down cause my baby hes gone left this town fellin tomorrow like i feel today if im feelin tomorrow like i feel today ill pack my truck and make my give a way st louis woman with her diamond ring pulls that man around by her if it wasnt for her and her that man i love would have gone nowhere nowhere i got the st louis blues blues as i can be that mans got a heart like a rock cast in the sea or else he wouldnt have gone so far from me i love my baby like a school boy loves his pie like a kentucky colonel loves his mintn rye i love my man till the day i die","St. Louis Blues","1991"
"Billie Holiday","id wait for you id slave for you id be a beggar or a knave for you if that isnt love it will have to do until the real thing comes along id gladly move the earth for you to prove my love dear and its worth for you if that isnt love it will have to do until the real thing comes along with all the words dear at my command i just cant make you understand ill always love you darling come what may my heart is yours what more can i say id lie for you id sigh for you id tear the stars down from the sky for you if that isnt love it will have to do until the real thing comes along with all the words dear at my command i just cant make you understand ill always love you baby come what may my heart is yours what more can i say id lie for you id cry for you id lay my body down and die tor you if that isnt love it will have to do until the real thing comes along","Until the Real Thing Comes Along","1991"
"Billie Holiday","everywhere in every home hope is burning bright while millions of hearts are kneeling saying tonight wherever you are our hearts are with you wherever you are our prayers are with you too all through the darkness our faith is your guiding star may god bless you all wherever you are","Wherever You Are","1991"
"Billie Holiday","the very thought of you and i forget to do those little ordinary things that everyone ought to do im livin in a kind of a daydream im happy as a queen and foolish though it may seem to me thats everything the mere idea of you the longing here for you youll never know how slow the moments go till im near to you i see your face in every flower your eyes in stars above its just the thought of you the very thought of you my love i see your face in every flower your eyes in stars above its just the thought of you the very thought of you my love","The Very Thought of You","1992"
"Billie Holiday","my story is much too sad to be told but practically everything leaves me totally cold the only exception i know is the case where im out on a quiet spree fighting vainly the old ennui and i suddenly turn and see your fabulous face i get no kick from champagne mere alcohol doesnt thrill me at all so tell me why should it be true that i get a kick out of you some get a kick from cocaine im sure that if i took even one sniff that would bore me terrificly too yet i get a kick out of you i get a kick everything i see youre standing there before me i get a kick though its clear to me you obviously dont adore me i get no kick in a plane flying too high with some guy in the sky is my idea of nothing to do yet i get a kick out of you","I Get a Kick Out of You","1992"
"Billie Holiday","any old time you want me i am yours for the asking darling any old time you need me ill be their with love thats lasting darling all through the years well stand together sharing the tears and stormy weather and the sunshine will be yours and mine any old time your blue youll have our love to chase away the blues and any old thing you do ill see you through so just remember that i am waiting dear if ever you want me ill be near any old time and any place you may be","Any Old Time","1992"
"Billie Holiday","just friends lovers no more just friends but not like before to think of what weve been and not to kiss again seems like pretending it isnt the ending two friends drifting apart two friends but one broken heart we loved we laughed we cried and suddenly love died","Just Friends","1992"
"Billie Holiday","no one to talk with all by myself no one to walk with but im happy on the shelf aint misbehavin im savin my love for you i know for certain the one i love im through with flirtin its just you im thinkin of aint misbehavin im savin my love for you like jack horner in the corner dont go nowhere what do i care your kisses are worth waitin for believe me i dont stay out late dont care to go im home about eight just me and my radio aint misbehavin im savin my love for you like jack horner in the corner dont go nowhere what do i care your kisses are worth waitin for believe me i dont stay out late dont care to go im home about eight just me and my radio aint misbehavin im savin my love for you","Ain't Misbehavin'","1992"
"Billie Holiday","i love the look s of you and the lure of you the sweet of you and the pure of you the eyes the arms and the that mouth of you the east west north and the that south of you id love to gain complete control of you handle even the heart and soul of you love at least a small percent of me do cause because i love all of you","All of You","1992"
"Billie Holiday","when somebody loves you its no good unless he loves you all the way happy to be near you when you need someone to cheer you all the way taller than the tallest tree is thats how its got to feel deeper than the deep blue see is thats how deep it goes if its real when somebody needs you its no good unless he needs you all the way through the good or lean years and for all the in between years come what may who know where the road will lead us only a fool would say but if youll let me love you its for sure im gonna love you all the way all the way","All the Way","1992"
"Billie Holiday","i never knew the charm of spring i never met it face to face i never new my heart could sing i never missed a warm embrace till april in paris chestnuts in blossom holiday tables under the trees april in paris this is a feeling that no one can ever reprise i never knew the charm of spring i never met it face to face i never new my heart could sing i never missed a warm embrace till april in paris whom can i run to what have you done to my heart","April in Paris","1992"
"Billie Holiday","autumn in new york why does it seem so inviting autumn in new york it spells the thrill of first nighting glittering crowds and shimmering clouds in canyons of steel theyre making me feel im home its autumn in new york that brings the promise of new love autumn in new york is often mingled with pain dreamers with empty hands may sigh for exotic lands its autumn in new york its good to live it again autumn in new york the gleaming rooftops at sundown autumn in new york it lifts you up when youre let down jaded roues and gay divorces who lunch at the ritz will tell you that its devine its autumn in new york transforms the slums into mayfair autumn in new york youll need no castle in spain lovers that bless the dark on benches in central park greet autumn in new york its good to live it again","Autumn in New York [Common Take - LP]","1992"
"Billie Holiday","autumn in new york why does it seem so inviting autumn in new york it spells the thrill of first nighting glittering crowds and shimmering clouds in canyons of steel theyre making me feel im home its autumn in new york that brings the promise of new love autumn in new york is often mingled with pain dreamers with empty hands may sigh for exotic lands its autumn in new york its good to live it again autumn in new york the gleaming rooftops at sundown autumn in new york it lifts you up when youre let down jaded roues and gay divorces who lunch at the ritz will tell you that its devine its autumn in new york transforms the slums into mayfair autumn in new york youll need no castle in spain lovers that bless the dark on benches in central park greet autumn in new york its good to live it again","Autumn in New York [Rare Take - 78 RPM]","1992"
"Billie Holiday","baby wont you please come home cause your daddys all alone i have tried in vain never no more to call your name when you left you broke my heart because i never thought wed part every hour in the day you will hear me say baby come home","Baby Won't You Please Come Home","1992"
"Billie Holiday","heaven im in heaven and my heart beats so that i can hardly speak and i seem to find the happiness i seek when were out together dancing cheek to cheek heaven im in heaven and the cares that hung around me through the week seem to vanish like a gamblers lucky streak when were out together dancing cheek to cheek oh i love to climb a mountain and to reach the highest peak but it doesnt thrill me half as much as dancing cheek to cheek oh i love to go out fishing in a river or a creek but i dont enjoy it half as much as dancing cheek to cheek dance with me i want my arms about you the charm about you will carry me through to heaven im in heaven and my heart beats so that i can hardly speak and i seem to find the happiness i seek when were out together dancing cheek to cheek oh i love to climb a mountain and to reach the highest peak but it doesnt thrill me half as much as dancing cheek to cheek oh i love to go out fishing in a river or a creek but i dont enjoy it half as much as dancing cheek to cheek dance with me i want my arms about you the charm about you will carry me through to heaven im in heaven and my heart beats so that i can hardly speak and i seem to find the happiness i seek when were out together dancing cheek to cheek","Cheek to Cheek","1992"
"Billie Holiday","comes a rainstorm put your rubbers on your feet comes a snow storm you can get a little heat comes love nothing can be done comes a fire then you know just what to do blow a tire you can buy another sure comes love nothing can be done dont try hiding cause there isnt any use you start sliding when your heart turns on the juice comes a headache you can lose it in a day comes a toothache see your dentist right away comes love nothing can be done comes a heat wave you can hurry to the shore comes the summer you can hide behind the door comes love nothing can be done comes the measles you can quarantine the room comes a mousy you can chase it with the broom comes love nothing can be done thats all brother if youve ever been in love thats all brother you know what im speaking of comes a nightmare you can always stay awake comes depression you may get another break comes love nothing can be done","Comes Love","1992"
"Billie Holiday","someone told someone and someone told you but they wouldnt hurt you not much since everyone spread the story with his own little personal touch do nothin till you hear from me pay no attention to whats said why people tear the seam of anyones dream is over my head do nothin till you hear from me at least consider our romance if you should take the word of others youve heard i havent a chance true ive been seen with someone new but does that mean that im untrue when were apart the words in my heart reveal how i feel about you some kiss may cloud my memory and other arms may hold a thrill but please do nothin till you hear it from me and you never will do nothin till you hear from me do nothin till you hear from me pay no attention to whats said why people tear the seam of anyones dream is over my head do nothin till you hear from me at least consider our romance if you should take the word of others youve heard i havent a chance true ive been seen with someone new but does that mean that im untrue when were apart the words in my heart reveal how i feel about you some kiss may cloud my memory and other arms may hold a thrill but please do nothin till you hear it from me and you never will","Do Nothin' Till You Hear from Me","1992"
"Billie Holiday","dont worry bout me ill get along forget about me just be happy my love lets say that our little show is over and so the story ends why not call it a day the sensible way and still be friends look out for yourself that should be the rule give your heart and your love to whomever you love darlin dont be a fool why do we cling to this old faded thing that used to be so if you can forget then dont worry bout me why should we cling to some old faded thing that used to be so if you can forget then you dont worry bout me","Don't Worry 'Bout Me","1992"
"Billie Holiday","east of the sun and west of the moon well build a dream house of love dear near to the sun in the day near to the moon at night well live in a lovely way dear living our love at pale moonlight just you and i forever and a day love will not die well keep it that way up among the stars well find a harmony of life to a lovely tune east of the sun and west of the moon dear east of the sun and west of the moon just you and i forever and a day love will not die well keep it that way up among the stars well find a harmony of life to a lovely tune east of the sun and west of the moon dear east of the sun and west of the moon","East of the Sun (And West of the Moon)","1992"
"Billie Holiday","black cats creep across my path until im almost mad i must have roused the devils wrath cause all my luck is bad i make a date for golf and you can bet your life it rains i try to give a party and the guy upstairs complains i guess ill go through life kust catching colds and missin trains everything happens to me i never miss a thing ive had the measles and the mumps and every time i play an ace my partner always trumps guess im just a fool who never looks before he jumps everything happens to me at first my heart thought you could break this jinx for me that love would turn the trick to end despair but know i just cant fool this head that thinks for me ive mortgaged all my castles in the air ive telegraphed and phoned i send an airmail special too your answer was goodbye and there was even postage due i fell in love just once and then it had to be with you everything happens to me","Everything Happens to Me","1992"
"Billie Holiday","a fine romance with no kisses a fine romance my friend this is we should be like a couple of hot tomatoes but youre as cold as yesterdays mashed potatoes a fine romance you wont nestle a fine romance you wont wrestle i might as well play bridge with my old maid aunt i havent got a chance this is a fine romance a fine romance my good fellow you take romance ill take jello youre calmer than the seals in the arctic ocean at least they flap their fins to express emotion a fine romance with no quarrels with no insults and all morals ive never mussed the crease in your blue serge pants i never get the chance this is a fine romance","A Fine Romance [Take 2]","1992"
"Billie Holiday","a foggy day in london town it had me low and it had me down i viewed the morning with much alarm the british museum had lost its charm how long i wondered could this thing last but the age of miracles it hadnt past and suddenly i saw you standing right there and in foggy london town the sun was shining everywhere","A Foggy Day","1992"
"Billie Holiday","how can i tell you what is in my heart how can i measure each and every part how can i tell you how much i love you how can i measure just how much i do how much do i love you ill tell you no lie how deep is the ocean how high is the sky how many times a day do i think of you how many roses are sprinkled with dew how far would i travel to be where you are how far is the journey from here to a star and if i ever lost you how much would i cry how deep is the ocean how high is the sky","How Deep Is the Ocean?","1992"
"Billie Holiday","breeze stop moaning those wit melodies my man has left me so i cant face the music without singing the blues rain your rhythm on my window pane drives me insane because i cant face the music without singing the blues my heart is so broken ive spoken to the lord for a little sympathy and if he dont help me so help me its the bottom of the deep blue sea for me im gonna end this misery im almost crazy cause i cant face the music without singing the blues my heart is so broken ive spoken to the lord for just a little sympathy and if he dont help me so help me gonna jump to the bottom of the deep blue sea for me im going to end this misery im going crazy cause i cant face the music without singing the blues tell you im almost crazy baby cause im tired of facing these blues","I Can't Face the Music","1992"
"Billie Holiday","i cried for you now its your turn to cry over me every road has a turning thats one thing youre learning i cried for you what a fool i used to be now i found two eyes just a little bit bluer i found a heart just a little bit truer i cried for you now its your turn to cry over me","I Cried for You","1992"
"Billie Holiday","once i was young yesterday perhaps danced with jim and paul and kissed some other chaps once i was young but never was naive i thought i had a trick or two up my imaginary sleeve and now i know i was naive i didnt know what time it was then i met you oh what a lovely time it was how sublime it was too i didnt know what time it was you hold my hand warm like the month of may it was and ill say it was grand grand to be alive to be young to be mad to be yours alone grand tosee your face feel your touch hear your voice say im all your own i didnt know what time it was live was no prize i wanted love and here it was shining out of your eyes im wise and i know what time it is now once i was old twenty years or so rather well preserved the wrinkles didnt show once i was old but not too old for fun i used to hunt for little girls up my imaginary gun but now i aint for only one i didnt know what time it was then i met you oh what a lovely time it was how sublime it was too i didnt know what time it was you hold my hand warm like the month of may it was and ill say it was grand grand to be alive to be young to be mad to be yours alone grand tosee your face feel your touch hear your voice say im all your own i didnt know what time it was live was no prize i wanted love and here it was shining out of your eyes im wise and i know what time it is now","I Didn't Know What Time It Was","1992"
"Billie Holiday","though folks with good intentions tell me to save my tears well im so mad about him i cant live without him never treats me sweet and gentle the way he should ive got it bad and that aint good and when the weekends over and monday rolls around i end up like i start out just crying my heart out he dont love me like i love him no nobody could ive got it bad and that aint good lord above me make him love me the way he should i got it bad and that aint good","I Got It Bad (And That Ain't Good)","1992"
"Billie Holiday","dont want my mammy i dont need a friend my heart is broken it wont ever mend i aint much carin just where i will end i must have that man im like an oven thats cryin for heat he treats me awful each time we meet its just unlawful how that boy can cheat but i must have that man hes hot as hades a ladys not safe in his arms when shes kissed but im afraid that when hes cooled off and maybe im ruled off his list ill never be missed i need that person much worse n just bad im half alive n hes drivin me mad hes only human if hes to be had i must have that man i must have that man","I Must Have That Man!","1992"
