"Band","Lyrics","Song","Year"
"Don Ellis","its very clear our love is here to stay not for a year but ever and a day the radio and the telephone and the movies that we know may just be passing fancies and in time may go but oh my dear our love is here to stay together were going a long long way in time the rockies may crumble gibraltar may tumble theyre only made of clay but our love is here to stay in time the rockies may crumble gibraltar may tumble theyre only made of clay but our love is here to stay","Love Is Here to Stay","1981"
"Don Ellis","well all i want is a party doll to come along with me when im feelin wild to be everlovin and true and fair to run her fingers through my hair come along and be my party doll come along and be my party doll come along and be my party doll ill make love to you to you ill make love to you well i saw a gal walkin down the street the kind of a gal i would love to meet she had blonde hair and eyes of blue baby im a gonna have a party with you come along and be my party doll come along and be my party doll come along and be my party doll ill make love to you to you ill make love to you evry man has gotta have a party doll to be with him when hes feelin wild to be everlovin true and fair to run her fingers through his hair to run her fingers through his hair come along and be my party doll come along and be my party doll come along and be my party doll ill make love to you to you ill make love to you come along and be my party doll come along and be my party doll come along and be my party doll ill make love to you to you ill make love to you ooh ooh ooh","Party Doll","2003"
"Don Estelle","you promised me green grass not to tell what you heard whispering grass say you cant keep your word keep your word why do you whisper green grass why tell the trees what aint so whispering grass the trees dont have to know no no why tell them all your secrets who kissed there long ago whispering grass the trees dont need to know dont you tell it to the breeze cause she will tell the birds and bees and evryone will know because you told the blabbering trees yes you told them once before its no secret any more why tell them all the old things theyre buried under the snow whispering grass dont tell the trees cause the trees dont need to know why do you whisper green grass why tell the trees what aint so whispering grass the trees dont have to know no no why tell them all your secrets who kissed there long ago whispering grass the trees dont need to know dont you tell it to the breeze cause she will tell the birds and bees and evryone will know because you told the blabbering trees yes you told them once before its no secret any more why tell them all the old things theyre buried under the snow whispering grass dont tell the trees","Whispering Grass","1998"
"Don Estelle","when they begin the beguine it brings back the sound of music so tender it brings back a night of tropical splendor it brings back a memory ever green im with you once more under the stars and down by the shore an orchestras playing and even the palms seem to be swaying when they begin the beguine to live it again is past all endeavor except when that tune clutches my heart and there we are swearing to love forever and promising never never to part what moments divine what rapture serene till clouds came along to disperse the joys we had tasted and now when i hear people curse the chance that was wasted i know but too well what they mean so dont let them begin the beguine let the love that was once a fire remain an ember let it sleep like the dead desire i only remember when they begin the beguine oh yes let them begin the beguine please make them play till the stars that were there before return above you till you whisper to me once more darling i love you then we suddenly know what heaven were in when they begin the begin the begin the beguine when they begin the begin the begin the beguine when they begin the beguine","Begin the Beguine","2006"
"Don Estelle","woo wo o oo wo wo wo o oo wo wo wo o oo wo wo when the deep purple falls over sleepy garden walls and the stars begin to twinkle in the night in the mist of a memory you wander all back to me breathing my name with a sigh in the still of the night once again i hold you tight tho youre gone your love lives on when light beams and as long as my heart will beat sweet lover well always meet here in my deep purple dreams when the deep purple falls over sleepy garden walls and the stars begin to twinkle in the night in the mist of a memory you wander all back to me breathing my name with a sigh in the still of the night once again i hold you tight tho youre gone your love lives on when moonlight beams and as long as my heart will beat sweet lover well always meet here in my deep purple dreams and as long as my heart will beat sweet lover well always meet here in my deep purple dreams wo o oo wo wo wo o oo wo wo wo o oo wo wo","Deep Purple","2006"
"Don Estelle","put your sweet lips a little closer to the phone lets pretend that were together all alone ill tell the man to turn the jukebox way down low and you can tell your friend there with you hell have to go whisper to me tell me do you love me true or is he holding you the way i do tho love is blind make up your mind ive got to know should i hang up or will you tell him hell have to go you cant say the words i want to hear while youre with another man if you want me answer yes or no darling i will understand put your sweet lips a little closer to the phone lets pretend that were together all alone ill tell the man to turn the jukebox way down low and you can tell your friend there with you hell have to go","He'll Have to Go","2006"
"Don Estelle","no new years day to celebrate no chocolate covered candy hearts to give away no first of spring no song to sing in fact heres just another ordinary day no april rain no flowers bloom no wedding saturday within the month of june but what it is is something true made up of these three words that i must say to you i just called to say i love you i just called to say how much i care i just called to say i love you and i mean it from the bottom of my heart no summers high no warm july no harvest moon to light one tender august night no autumn breeze no falling leaves not even time for birds to fly to southern skies no libra sun no halloween no giving thanks to all the christmas joy you bring but what it is though old so new to fill your heart like no three words could ever do i just called to say i love you i just called to say how much i care i do i just called to say i love you and i mean it from the bottom of my heart i just called to say i love you i just called to say how much i care i do i just called to say i love you and i mean it from the bottom of my heart of my heart of my heart i just called to say i love you i just called to say how much i care i do i just called to say i love you and i mean it from the bottom of my heart of my heart baby of my heart","I Just Called to Say I Love You","2006"
"Don Estelle","my love must be a kind of blind love i cant see anyone but you sha bop sha bop are the stars out tonight i dont know if its cloudy or bright i only have eyes for you dear the moon may be high but i cant see a thing in the sky i only have eyes for you i dont know if were in a garden or on a crowded avenue you are here and so am i maybe millions of people go by but they all disappear from view and i only have eyes for you","I Only Have Eyes for You","2006"
"Don Estelle","ill never smile again until i smile at you ill never laugh again what good would it do for tears would fill my eyes my heart would realize that our romance is through ill never love again im so in love with you ill never thrill again to somebody new within my heart i know i will never start to smile again until i smile at you","I'll Never Smile Again","2006"
"Don Estelle","in my imagination im finding consolation somewhere along the rio grande sadly im reminiscing madly again im kissing someone along the rio grande it happened in monterey a long time ago i met her in monterey in old mexico stars and steel guitars and luscious lips as red as wine broke somebodys heart and im afraid that it was mine it happened in monterey without thinking twice i left her and threw away the key to paradise my indiscreet heart longs for the sweetheart that i left in old monterey making believe im merry in evry glass of sherry i see the sparkle of her eye and when i hear the cello tender and sweet and mellow i hear the music of her sigh it happened in monterey a long time ago i met her in monterey in old mexico stars and steel guitars and luscious lips as red as wine broke somebodys heart and im afraid that it was mine it happened in monterey without thinking twice i left her and threw away the key to paradise my indiscreet heart longs for the sweetheart","It Happened in Monterey","2006"
"Don Estelle","say its only a paper moon sailing over a cardboard sea but it wouldnt be make believe if you believed in me yes its only a canvas sky hanging over a muslin tree but it wouldnt be make believe if you believed in me without your love its a honky tonk parade without your love its a melody played in a penny arcade its a barnum and bailey world just as phony as it can be but it wouldnt be make believe if you believed in me say its only a paper moon sailing over a cardboard sea but it wouldnt be make believe if you believed in me yes its only a canvas sky hanging over a muslin tree but it wouldnt be make believe if you believed in me without your love its a honky tonk parade without your love its a melody played in a penny arcade its a barnum and bailey world just as phony as it can be but it wouldnt be make believe if you believed in me its phony its plain to see how happy i would be if you believed in me","It's Only a Paper Moon","2006"
"Don Estelle","maybe youll think of me when you are all alone maybe the one who is waiting for you will prove untrue then what will you do maybe youll sit and sigh wishing that i were near then maybe youll ask me to come back again and maybe ill say maybe may be youll think of me when you are all alone maybe the one who is waiting for you will prove untrue then what will you do maybe youll sit and sigh wishing that i were near then maybe youll ask me to come back again and maybe ill say maybe","Maybe","2006"
"Don Estelle","i wander out yonder oer the hills where the mountains high seem to kiss the sky someone is out yonder oer the hills waiting patiently waiting just for me ramona i hear the mission bells above ramona theyre ringing out our song of love i press you caress you and bless the day you taught me to care to always remember the rambling rose you wear in your hair ramona when day is done youll hear my call ramona well meet beside the water fall i dread the dawn when i awake to find you gone ramona i need you my own lets wander out yonder oer the hills by a babbling brook where well find a nook to build our own love nest oer the hills darling of my heart never more to part ramona i hear the mission bells above ramona theyre ringing out our song of love i press you caress you and bless the day you taught me to care to always remember the rambling rose you wear in your hair ramona when day is done youll hear my call ramona well meet beside the water fall i dread the dawn when i awake to find you gone ramona i need you my own","Ramona","2006"
"Don Estelle","beneath this snowy mantle cold and clean the unborn grass lies waiting for its coat to turn to green the snowbird sings the song he always sings and speaks to me of flowers that will bloom again in spring when i was young my heart was young then too anything that it would tell me thats the thing that i would do but now i feel such emptiness within for the thing that i want most in lifes the thing thing that i cant win spread your tiny wings and fly away and take the snow back with you where it came from on that day the one i love forever is untrue and if i could you know that i would fly away with you the breeze along the river seems to say that hell only break me heart again should i decide to stay so little snowbird take me with you when you go to that land of gentle breezes where the peaceful waters flow spread your tiny wings and fly away and take the snow back with you where it came from on that day the one i love forever is untrue and if i could you know that i would fly away with you","Snowbird","2006"
"Don Estelle","blue spanish eyes teardrops are falling from your spanish eyes please please dont cry this is just adios and not goodbye soon ill return bringing you all the love your heart can hold please say si si say you and your spanish eyes will wait for me blue spanish eyes prettiest eyes in all of mexico true spanish eyes please smile at me once more before i go soon ill return bringing you all the love your heart can hold please say si si say you and your spanish eyes will wait for me say you and your spanish eyes will wait for me","Spanish Eyes","2006"
"Don Estelle","the song a robin sings through years of endless springs the murmur of a brook at evening tides that ripples through a nook where two lovers hide that great symphonic theme thats stella by starlight and not a dream my heart and i agree shes everything on this earth to me that great symphonic theme thats stella by starlight and not a dream my heart and i agree shes everything on this earth to me","Stay as Sweet as You Are","2006"
"Don Estelle","oh she may be weary them young girls they do get wearied wearing that same old miniskirt dress but when she gets weary you try a little tenderness oh man that un hunh i know shes waiting just anticipating the thing that youll never never possess no no no but while she there waiting try just a little bit of tenderness thats all you got to do now it might be a little bit sentimental no but she has her greavs and care but the soft words they are spoke so gentle yeah yeah yeah and it makes it easier to bear oh she wont regret it no no them young girls they dont forget it love is their whole happiness yeah yeah yeah but its all so easy all you got to do is try try a little tenderness yeah damn that hart hard all you got to do is know how to love her youve got to hold her squeeze her never leave her now get to her got got got to try a little tenderness yeah yeah lord have mercy now all you got to do is take my advice youve got to hold her dont squeeze her never leave her youve got to hold her and never so you got to try a little tenderness a little tenderness a little tenderness a little tenderness youve got to got to got to youve gotta hold her dont squeeze her never leaver her you got got got got to now now now got got got to try a little tenderness ye","Try a Little Tenderness","2006"
"Don Estelle","when the swallows come back to capistrano thats the day you promised to come back to me when you whispered farewell in capistrano twas the day the swallow flew out to sea all the mission bells will ring the chapel choir will sing the happiness youll bring will live in my memory when the swallows come back to capistrano thats the day i pray that youll come back to me all the mission bells will ring the chapel choir will sing the happiness youll bring will live in my memory when the swallows come back to capistrano thats the day i pray that youll come back to me","When the Swallows Come Back to Capistrano","2006"
"Don Estelle","love me tender love me sweet never let me go you have made my life complete and i love you so love me tender love me true all my dreams fulfill for my darling i love you and i always will love me tender love me long take me to your heart for its there that i belong and will never part love me tender love me true all my dreams fulfill for my darling i love you and i always will love me tender love me dear tell me you are mine ill be yours through all the years til the end of time love me tender love me true all my dreams fulfill for my darling i love you and i always will","Love Me Tender","2006"
"Don Everly","what child is this who laid to rest on marys lap is sleeping whom angels greet with anthems sweet while shepherds watch are keeping this this is christ the king whom shepherds guard and angels sing haste haste to bring him laud the babe the son of mary why lies he in such mean estate where ox and ass are feeding good christian fear for sinners here the silent word is pleading nails spear shall pierce him through the cross be borne for me for you hail hail the word made flesh the babe the son of mary so bring him incense gold and myrrh come peasant king to own him the king of kings salvation brings let loving hearts enthrone him raise raise the song on high the virgin sing her lullaby joy joy for christ is born the babe the son of mary","What Child Is This?","1962"
"Don Everly","brother jukebox sister wine mother freedom father time since she left me by my self youre the only family ive got left i go down to that same old cafe where i try to wash my troubles away im still down and im still alone but it means staying home all night long brother jukebox sister wine mother freedom father time since she left me by my self youre the only family ive got left i go home and i climb that old stairway and i tell myself tomorrows a new day but i know ill just go out again spend my time with my new next of kin brother jukebox sister wine mother freedom father time since she left me by my self youre the only family ive got left brother jukebox sister wine mother freedom father time since she left me by my self youre the only family ive got left youre the only family ive got left youre the only family ive got left","Brother Jukebox","1977"
"Don Everly","im drifting into deep water im starting to care for you youre gettin me in deep water be careful what you do you want a romance but im seeking love i know ill regret it when it ends oh im winding up in deep water why cant we just be friends ts restless in this deep water im lost between right and wrong my love is true as deep water your love wont last as long where will it lead me and where will it end i cant help but wish i only knew oh im winding up in deep water so deep in love with you im drifting into deep water","Deep Water","1977"
"Don Everly","the barroom is closin and the bartender sacks me six to go theres two losers left here me and some girl i dont know we walk out together with no one to hold through the night and out on the street our lonely eyes meet and we know weve found at last sight love at love sight weve no voice no choice in the matter love at last sight cause were all thats left of together we reach out our hands then we touch then we hang on for life everyones gone and were all alone and we know weve found love at last everyones gone and were all alone and we know weve found love at last","Love at Last Sight","1977"
"Don Everly","ive been in love before but never like this ive tasted love before but never like this i will gladly at last turn my back on the past and ride off to the sunset with you or just stay right here if thats what you want to do ive lost my mind before but never like this ive had good times before but never like this if the day ever comes when you feel you must leave me and our love should cease to exist i may fall in love again but never like this if the day ever comes when you feel you must leave me and our love should cease to exist i may fall in love again but never like this","Never Like This","1977"
"Don Everly","oh id like to be in ireland or maybe even iceland take a trip to norway ooh id like to go away i cant stay in tennessee thats some other place for me i know what youre gonna say ooh id like to go away ooh id like to go away ill pack my bags and leave this evenin i cant stay another day when you told me you were leavin we both knew i couldnt stay maybe i should fly to china or drive to north carolina it doesnt matter which way ooh id like to go away ooh id like to go away ill pack my bags and leave this evenin i cant stay another day when you told me you were leavin we both knew i couldnt stay maybe i should fly to china or drive to north carolina it doesnt matter which way ooh id like to go away ooh id like to go away ooh id like to go away ooh id like to go away mmm id like to go away ooh id like to go away ooh id like to go away ooh id like to go away","Oh, I'd Like to Go Away","1977"
"Don Everly","we used to have good times together but now i feel them slip away it makes me cry to see love die so sad to watch good love go bad remember how you used to feel dear you said nothing could change your mind it breaks my heart to see us part so sad to watch good love go bad is it any wonder that i feel so blue ue ue when i know for certain that im losing you ou ou ou ou ou ou remember how you used to feel dear you said nothing could change your mind it breaks my heart to see us part so sad to watch good love go bad so sad to watch good love go bad","So Sad","1977"
"Don Everly","i dont look like that picture but i know that its me and i dont sound the same way i did then but i can sing old song made famous way back when and i can turn the memories loose again i never thought of money they just told me it was there a brand new car for a brand new millionaire but fame can be a feather thats caught up in the wind and i can turn the memories loose again dreams that disappeared can come alive today the love you thought was gone still lingers in a song ive seen the world through windows from buses cars and planes success can be a freedom or a chain i dont regret one moment all i did was sing and i can turn the memories loose again dreams that disappeared can come alive today the love you thought was gone still lingers in a song i dont regret one moment all i did was sing and i can turn the memories loose again and i can turn the memories loose again","Turn the Memories Loose Again","1977"
"Don Everly","i cant believe your lips are touchin mine after all the hurt and all this time but i believe that sometimes losers win yesterday just passed my way again i should have known the tears i made you cry would never mean wed really say goodbye tonight sweetheart were back were we began yesterday just passed my way again they say you cant turn back the hands of time but tonight im holdin the hands that once were mine and youre lovin me as if the world might end yesterday just passed my way again yesterday just passed my way again","Yesterday Just Passed My Way Again","1977"
"Don Everly","everytime you leave you tear the soul from me i die a little more each time part i cant control my dreams my heart cant seem to learn to turn and lock its door when you return i know that youll come back again as soon as you get blue and i know what will happen then one kiss and ill give one to you everytime you leave you tear the soul from me but i want to live so ill forgive everytime you leave","Everytime You Leave","1979"
"Don Everly","it must be love oh what a feeling i sit at home alone i wait here by the phone i know you never call oh what a feeling it must be love although its bitter it must be love i cant forget her the days turn into weeks her letters i shall keep the ones you didnt write oh what a feeling it must be love oh what a feeling it must be love oh what a feeling","Oh What a Feeling","1991"
"Don Everly","they say the blues went out of style to cry is to act just like a child while each day that were apart love how can it be i never will since you broke my heart they say the best way s not to care just play a few hands of solitaire read a book or study art all the remedies dont work for me since you broke my heart","Since You Broke My Heart","1991"
"Don Everly","we used to have good times together but now i feel them slip away it makes me cry to see love die so sad to watch good love go bad remember how you used to feel dear you said nothing could change your mind it breaks my heart to see us part so sad to watch good love go bad is it any wonder that i feel so blue when i know for certain that im losing you remember how you used to feel dear you said nothing could change your mind it breaks my heart to see us part so sad to watch good love go bad so sad to watch good love go bad","So Sad (To Watch Good Love Go Bad)","1991"
"Don Everly","never felt like this until i kissed you how did i exist until i kissed you never had you on my mind now youre there all the time never knew what i missed until i kissed you uh huh i kissed you oh yeah things have really changed since i kissed you uh huh my lifes not the same now that i kissed you oh yeah mmm you got a way about you now i cant live without you never knew what i missed until i kissed you uh huh i kissed you oh yeah you dont realize what you do to me and i didnt realize what a kiss could be mmm you got a way about you now i cant live without you never knew what i missed until i kissed you uh huh i kissed you oh yeah you dont realize what you do to me and i didnt realize what a kiss could be mmm you got a way about you now i cant live without you never knew what i missed until i kissed you uh huh i kissed you oh yeah i kissed you uh huh i kissed you oh yeah i kissed you uh huh","('Til) I Kissed You","2000"
"Don Everly","je veux temmener a nashville la ou je ne suis pas ne te montrer les rues de la ville la ou je nai jamais joue les copains denfance la graine de violence mon reve tout bleu comme un blues je veux temmener a nashville la ou je ne suis pas ne rechercher la premiere fille qui ne ma jamais aime la premiere voiture les jeans ptits durs mon reve tout bleu comme un blues je veux temmener a nashville la ou je ne suis pas ne te montrer la bague qui brille du college dou j nai pas ete vire la premiere guitare laudition dun soir mon reve tout bleu comme un blues","Nashville Blues","2004"
