"Band","Lyrics","Song","Year"
"Monie Love","brother what is with you you cant take a hint i need to shove a sprint between your eyes for you to see you and me were never meant to be your homeboy likes me i like him too get out the picture i get your point but im not rolling with the punch i scrunched up the letter you wrote me in lunch in 5th period i pay no notice to your motion my work is on the table my pens in locomotion every time i turn around youre looking at my face i try to ignore you the bell rings i race out the room zoom to another room sit down what do you know the lovers in town the other brother who the one i want to talk to sitting three seats back and im a walk over to him and give him the letter i wrote because my feelings towards him are brewing ya know monie in the middle where she at in the middle yep monies in the middle where that at in the middle monie in the middle where she at in the middle go mon mon what is she monie in the middle repeat 2x in 7th the knucklehead walks in and sits down beside me i said yo why you trying to ride me day in and day out i cant seem to get you off my back what do you think i should do about that in fact its embarrassing what a bufoon you even follow me in the ladies bathroom give me a break i cant take it the stakes are too high besides there goes the other brother im not keith sweat so dont sweat me the other brothers smooth approach is what gets me he intruiges the mon you know so i suggest the course towards me you blow youre wasting time pursuing monie cause shes pursuing the lover only and as my mother did she told me go for what you know mo yo monie in the middle where she at in the middle yep monies in the middle where that at in the middle monie in the middle where she at in the middle go mon mon what is she monie in the middle repeat 2x bringing matters to a close and everybody knows that im no longer in the middle i made my decision precisely precision is a must for me to solve another riddle step into a brand new rhythm ism schisms nope im not with em ive given my undivided attention you know what im saying no type of games im playing when monie in the middle where she at in the middle yep monies in the middle where that at in the middle monie in the middle where she at in the middle go mon mon what is she monie in the middle repeat 4x monie in the monie in the monie in the middle monie in the monie in the monie in the middle monie in the monie in the monie in the middle the middle the middle the the the middle repeat 2x ad libs to fade","Monie in the Middle","1990"
"Monie Love","work work work thats all i ever hear you talkin about what happened to play some time all work no play is good for now you square i do declare become aware come over here share this hyper funky party atmosphere i think its fair to spread your time more evenly than you do get the clue get down do exactly what im about to do is that hard for you i didnt think so so lets go with the flow and you know you can work it out with sister mo work it out work work it out are you ready to get into this funky funky funky stuff i hope that there will be enough there is no need for me to bluff cause what im about to do is set the mood just so you get picture let the rhythm get fly hitcha i will lead the peoples witcha sway a little mo i know the flow will get you so why dontcha try to let go of your entire ratio let the music fill your shoes take care of all your worldly blues ill try my best to do the rest so whaddya say so slap you in the face with good intentions im forgettin to mention monie mons imaginative invention bein able to party monday tuesday wednesday thursday friday saturday even sunday catch my drift okay next section time to work it out you got the clout the ability to achieve your every need so let me see you can do what youre doin now ill show you how let me hear you shout with sister monie we can work it out work work work work work work work it out work work work work work work work it out work work work work work work work it out work work work work work work work it out well whaddya whaddya whaddya know sweet little mo gettin hype you better believe that im the type cause no one else can rock this mic as nice as me mcs please let me be i dont want no beef howmany howmany howmany times must you make yourself a slave yourediggin yourediggin a grave get out the corner that you make wont you live just a little get out of the middle kill the doubt with sister monie you can work it out","Work It Out","1991"
"Monie Love","chorus 4 da children lets stick together 4 da children try make life a little better 4 da children try to make this world a better place 4 da children 4 da children mothers all over the world stop look alert a lot of things are tryna meddle with your work from the day you give birth your time becomes a little less you got a permanent job in which therell be no rest you have to keep an eye open cause theres far too much to contend with hope you got a good partner you can go round the bend with you have to accept that to a certain extent your private life is at a halt yep its a true commintment well the horse is through the gate get ready now cause here they come what you teach your child determines what they will become how much your child is worth to you to this there is no digit brothers like ed o g said be a father can you dig it i write this here song to express my sentimentality and help to encourage some to wake up to reality of why your parents boss you around like indeed they do i only understand because im now a parent too chorus what a world what a world that we live in people try to steal your babies and drugs is what is given to a child by a child its the style aint it wild collectively the facts aint a lot to make you smile but s smile does exist among the dirt and the mist it happens when the angel in your life is kissed and loved and hugged and cherished and cared for when the wounds of the world are sore hearts are breakin hearts are breakin can you see it being strong is must and were too busy tryna be it staring out into a scum filled a world with disgust define the line between success and gettin left back in the dust opposition that arises you know we have to get over and listen to those not only wiser but also older turn our children into responsible men and ladies and to the cops stop beatin on our babies chorus 2x i didnt bring a child into this world for politicians trippin on each other starting wars and causing friction makin life a little harder for those strugglin to cope bring a cease towards your fighting instead of the peoples hope its easy for the powers that be to make decisions tell you to get on with get on with who gave you the permission sending the youth that we produce to help you score i dont see any of your kids so fight your own wars as to discrimination little ones dont know the meaning unless we separate they could be on the same team and its okay to teach your child all their history until it somehow slowly develops to bigotry pass up opportunities to segregate the space think about the childrens future make this world a better place before decide to act wild remember everybody is somebody elses child chorus 2x","4 da Children","1993"
"Monie Love","im a mother that gave birth young so what about it does it mean right away that im wrong all in due time well my time is right now so dont ask me who where what when or how i know i got me and a good partner beside me one that will never try to desert of defy me so who are you to tell me how to run my family i can plan it by myself i need nobody planning me cause yeah i might be young but my stabilitys correct everything about my little one i must protect what she sees what she hears and everything surrounding a decent state of mind is what my daughter will be found in chorus born 2 b r e e d young mother be thankful be strong the fact that youre young it aint wrong a mother i will try to be tha fact is i was born 2 b r e e d so tell me what do the kids learn at school how to pack a pistol how to play a class fool then they blame the parents when the kid plays hooky subject to getting shot is something that i wouldnt want to be maybe it is safer to stay within your home protecting yourself from getting a bullet within your dome its something to think about the word safe i often wonder if there exists such a place whether on a bus a train or plain walkin youre subject to the devious ones that might be hawkin ill teach my child to respect every day as a blessing and follow the path of her future lesson by lesson chorus so ask me again if i need ghetto assistance theres food on my table and my babys not wearing piss pants i could teach my child more at home that you could ever corrupt the youthful mind i produce that will be never this one will learn from me the other babies too cause what you teach is censorship i want to teach whats true so bother me not with our by the book method if i was already deaf i would be getting deafer i know exactly what im doing in it i believe my life is in my offspring cause i was born 2 b r e e d chorus","Born 2 B.R.E.E.D.","1993"
"Monie Love","full term love 2x to be or not to be that is the question brothers be hawking sisters sometime with no intention of tryna get serious i mean make a commitment come on honey insecurity flows in by the shipment pardon the expression but are you already taken i live around the way boy so dont be tryna fake and if you want to know me better i suggest you follow cause i aint tryna start up nothing destined to be hollow you say you understand good no need for me to wonder want to be my man alright well heres my name and number but if youre not sure you better stop look listen and learn because im looking for a love that will last full term full term love 4x ok were on a date you want to take me to movies dinner and dancing and after that a little room please no im not the one so the thought you can delete because its very tracky and its only been a week now you want to hit the sheets no dont really think so make it all complete no i dont really think so want to be fast then before you even blink ill be talking to another whered you meet him at the rink oh speedy gonzalez you better slow down because im levelheaded with my feet on the ground why dont you try and do something constructive for instance committing to a love that will last the full distance full term love 8x you wonder why you see me at the bus stop everyday its because i have a job so theres nothing no one can say dont try to treat me like a stepchild with ring around the collar or even a pest because i dont want your dollars its simply just a cool thing called love and understanding a little sincerity and thats all that im demanding a brother who can say honey your wish is my command and if you cant get it then ill leave you where youre standing im tryna get something thats mo better you see an easy around the way go sweat her im telling you now without being undercover that i might be an around the way girl but im a full term lover brother full term love 8x","Full Term Love","1993"
"Monie Love","honey looking butter word hows he living greasy i remember rick way back in prehistoric wearing holey pants and always reading marvel comics never used deodorant clothes were always soiled instead of body lotion rick used the crisco oil never had a hair cut breath was always stenching used to try to catch me sitting on the school bench and speaking to me stinking to me killing all the flowers wish i had a certs in my pocket he could devour now hes out the projects no longer a resident heard his father died and left him crazy dead presidents seen the brother yesterday pulled up in a beamer looked me up and down and said are you still a primadonna i said no ill get with you if you want me youre looking kinda buttermilk biscuit on the money no need for him to sweat cause you got my respect hes living kinda greasy yep he got himself correct jimmy was a stick toothpick is what they called him never combed his hair which is why his mother balled him used to stick up kids going home from other schools till somebody beat him down flipped his butt and changed the rules he was back around the way being someone elses joey because he was bald they named him obi wan kenobi he said yo imo be a rap star one day they said shut your yellow teeth get me a forty okay well slap me upside my head there go jimmy and there go all them brothers sayin gimme gimme gimme i see him on the box almost every other day ricochet from the down and out butter up today he made it to the top to this there was no misdemeanor and on jimmys side you know the grass was always greener so hop skip and jump for the twinkle not a deadbeat because he knew exactly how to rock the greasy beats knew a kid cursed with the kiss of being bummy never got any play didnt find it very funny he looked so scary and his head going bald liked to give us all his number but nobody ever called his name was vom boogie cause hes always throwing up loved to drink himself sick never thought hed ever stop used to like to wear socks all the way up to his knees and he kept tryna talk to my girl bonita b i saw bonita b just a few moments ago riding round inside a lexus acting like she didnt know who i was standing there thats alright cause shes a sucker if he wasnt living greasy she wouldnt be with the brother count yourself lucky that you caught when you did i might still talk to him regardless who hes with cause he looking kinda butter and i think he could please med because hes living way beyond fat hes living greasy","Greasy","1993"
"Monie Love","who ever said that you couldnt succeed when your heart bleeds you need on your knees and you begging please and if it ever came your way it be a better day and if it dont dont give up hope and continue to pray i know ive had my fair share of despair honey i wouldnt give up on the mere thought of mo money so this is what i did i forbid the attitude thatll get ya suckered out of a picture i never saw myself as some kinda hero so listen up because your time could be near yo quitters never win winners never quit if you dont believe in yourself nobody else will do it the very young can be blinded thinking what they find is an easy way out its road that escapes the clout well think again because theres prices on another level a faster route and now your foot is layin on the pedal when did your heart decide that you could just settle for less dont you know in your category you were truly blessed i think you suffered a severe loss of self esteem and now it seems your whole life is a movie scene youre still a rompa you can change if you really want to double back recollect when you turned the wrong corner dont be content until you meet your demands you can do it blood you can be a much better man i had some lucky circumstances but i had to work amidst the possibility of maybe gettin jerked but im here aint i and im in the mix too that demonstrates how much a strong heart and mind can do so please dont become a victim of pessimism keep your goals to yourself nobody messing with em keep your mind straight from those who want to dictate the spam of your intelligence they seem to underrate its a form of oppression that they demonstrate and nine times out of ten theyre guarded by a false plate never give up individual dreams of your future state and determine your own fate suckas that speak on a tracky technique choose to preach on a sub level spewing evil of the devil you gotta check it disconnect it to the minimal speaking tongues under drums like a subliminal figure that you gotta kiss before you kick and every trick will then stick without licks you its over dick you didnt touch me then you don t touch me now believing in the power of myself i know how","I'm a Believer","1993"
"Monie Love","im glad heaven allowed me to be saved the sidewalk to forever for me has been paved i live a little passion every day im in your presence and when im away i carry with me your very essence i try to imagine a scenario without you it doesnt happen cause my mind never doubts you my admiration is in awe of your persona your plateau is high everything else is much lower how do i explain to you with lack of complication speaking to one who fills me up with exhilaration i mean what i say you know i really do im just trying to say in a word of 2 i love you chorus in a word or 2 i love you everything you do sacrifice is a word thats second nature you give more than you take its hard for somebody to hate ya dream a little longer i can penetrate your visions beauty lies within your thoughts to stay is what im wishin i love the way the world around you quivers but you float also how other people get frustrated but you wont the way you relax while the world is so intense im so much in love with you that sometimes it dont make sense you please me in every way and ill never make amendments you are my teacher ill always be in attendance id like to commend you for all the things i see you do in a world or 2 id like to say i love you chorus 2 in a word or 2 i love you everything you do when im in your arms theres no place id rather be stormy weather come oh you go right through me how can i even begin to thank you enough the life id live if i didnt have you it would be tough i shudder to think of how empty my heart would feel if you should disappear and none of this was ever real i feel a quiet comfort when i am within your arms you make all my stormy weather become a gentle calm i wish to never be separated from such a bliss the warmth of your touch the motion of your kiss i wish to never lose sight of the smile within your face its you or nothin baby you could never be replaced so to let you know before i go before im through in a word or 2 i love you chorus 3 in a word or 2 i love you baby i really do l o v e you","In a Word or 2","1993"
"Monie Love","gotta let a woman be a woman 2x dont touch the merchandise you got it honey youre standing here see me coming you try to puff out your money and i sure dont give a toss about the car you drive whether benz 500 sl or a banger five so let me pass without a convo cause im not into your rap is kickin boomin a system with no rhytm to it and ill be mighty obliged if you just step to the side and move your sorry frontin butt before i run right through it you think im fresh o well best youll never get to hear and i got money in a bank account also my dear so i dont need you hanging round to be my sugar daddy so you can paddy on that paddy wagon but without me and you can let a woman be a woman coming through coming through make my way my tank is full like sald and pepa said my cow died i dont need ya bull so keep your skiving and conniving kindly to yourself nobody asked you for a statement stick it on a shelf cause ima make it to the top to this there is no doubt by my talent no stoppin stones thats what its all about you can consider what you want cause i dont give a bit a lot of things are blowin up and you aint part of shit go sing your boo boo song your lifes a losers drama this chick is truly not with it so save it for your mama gettin paid stayin paid yep it is my way of life im cuttin through this funky rhythm as sharp as a knife your trashy talk is not romantic so get out my face the litter of your loins is scattered up and down the place so you can pucker up and kiss this here funky behind i got to full cheeks ill take you 2 at a time let a woman be a woman kickin up a fuss cuss cuss youre full o puss were the underground legionnaires you aint part of us all you do is complain all about the womens role little do you know its climbing on the voters poll babblin babblin babblin babblin but not sayin nothin bring a cease to all your speech punk and quit the bluffin on this groove ill be as funky as i want to be so step off you little chuck d wannabe you can pop all that junk but keep it out my face make a move towards me and you will be erased stoppin to a brothers level no im not sucker cause when you lay down with dogs you catch fleas motherfucker","Let a Woman B a Woman","1993"
"Monie Love","low and behold theres a story to be told of a sister who missed a plane destiny was rearranged i never knew that i would be in this position makin money makin music makin a complete transition but hey in here yeasterday today and tomorrow forever after that because none of my shit is borrowed cleverly constructed my flairs abundant developed from hangin with all the roughnecks back in london pogo swiftly gets biznizz done with no parkin in a mellow manner cookies on the side sparkin flavour la treacherous few will do you lovely so dont run around playin with you like you know money blessed when the lord snipped my microphone cord and said rock it any way you can you got the whole world in your hand i made amendments to achieve my inner passion makin performances in musical fashions check it out hypocritical subjects playin like primadonna before they knew who i was yet its alright cause my rhyme will pack a fist full personification smile metaphor list full blissful is the interpretation i deliver make you quiver make you kidneys dance all around your liver im a giver of lyrical sex to your ear drum come all ya faithful to the record store and get some soul seasones with the future of the funk its not hard to find i stand out from the junk push a punk to oblivion spin em til theyre dizzy and die i wont be at that funeral cause im busy dont try to injust me suicidal you must be if you suddenly develop the urge to cuss me a lus will be given if correct is how you livin and the rhymes you recite are yours not given sucka a sucka be sucka see or you talking g or should i say pea brain no better yet shit for brains you want to save somebody save your bloddy self its grievous to see a waste of human tissue go to hell appointing yourself to be lord of the premises when you look like death warmed up and you smell of piss hiss hiss hiss there a kiss of death coming in your direction so you better start running doubleups of original creations is taking over rapidly false duplication artists that are supposed to be self acclaimed tapping into other artists domain its a bore to the brain blahblahblahblahblahblahblah shut the hell up i cant understand a word youre sayin i buy too and for what the hell im payin check yourself before you point the finger and start slayin method bottom pit used by emcee we aint shit is the scraping of the barrel cause theyre full of it yesterdays news tomorrows forgotten thought and how in the hell are you gonna pay for the shit you bought just like you im in it for self do whatever it takes whether you or someone else it is amazing how the human mind works find somebody that you feel you can jerk you should have never let yourself get talked into this one fuck around and your ass wont be a missed one when it comes to the crunch on a lyrical basis i pass with flying colors you might as well face this i dont even want to go on with this nonsense youre just a repetitionist baby no contest war with me and youll wish youd never been born ill shut your ass up quick and put a muscle on ya","Mo' Monie","1993"
"Monie Love","hello and hallelujah for the wheel of fortune thank god they got a selection of men they can auction be him black be him white rude stink or polite they got catalogue you know honey dips hold tight form a line form a line behind me you know what im sayin i bin waiting since last year child im not playin imo find myself somebody if it takes all week find me a piece of butt and no longer will i seek first off i got a drug dealer a heart stealer bucks hangin out his butt to him it was no big deal bought me this bought me that tried to spread me forget that my name was not country crock you big spock looking muskrat having money dont make you god find yourself a hole for you to stick your rod no no no we cant be lovers no no no we cant be friends only one thing left to do have to spin again the second was a bum crumb nothing having mug personality ok but face looking like a pug he said come over to my house and watch movies i said who me so that you can do me not that i would but at least the dealer would have paid you dont want to spend no money and you want to get laid back off heres a dollar and the deal treat yourself to white castles for me its back to the wheel the third was a white collar working in manhattan when he walked when he talked when he ate there was a pattern he tried to change the way i dressed and i talked showing me the difference in the different types of forks i said hey mr connoiseur you can stuff it you gotta love me for me or love nothin take your forks and shove em all where the sun dont shine and im back to spin the wheel just one more time the final was a cop from up the block the type that catches kids from picking next door neighbors locks he liked to keep tabs dont you know he was a psycho he also liked to hit i said well now its time that i go i said dont touch me you might lose your nutz ill stick em in a pickle jar and wouldnt give a butt keep your hands to yourself if you know what im sayin theres a knife in my bag brother man im not playin ya know there you go there you have it wheel of fortune didnt work instead of meetin gentlemen i met a bunch of jerks one wid too much money the other not a cent one too snobby and the other had no sense i guess for monie its right back to the drawling board how long will it be before i actually score i gotta find somebody to unleash all this affection i know what imo do i think ill try the love connection","Wheel of Fortune","1993"
