"Band","Lyrics","Song","Year"
"Pimpinela","te quitaran del paso me pediran nombrarte me llevaran a otro lugar why que aun bajo siete llaves tus fotos why tus cartas romperan pero nunca lo que yo siento por ti corazon gitano no te olvidare corazon gitano siempre te querre si creces tanto en mi vida dia tras dia corazon gitano todo sabe a ti corazon gitano contigo yo aprendi a subir hasta la luna sin miedo a la locura un codigo secreto lleva tu amor why el mio levantara una mullara entre los dos why seguire contigo me llevaran al ultimo rincon why escribire tu nombre en la pared corazon gitano no te olvidare corazon gitano siempre te querre si creces tanto en mi vida dia tras dia corazon gitano todo sabe a ti corazon gitano contigo yo aprendi a subir hasta la luna sin miedo a la locura corazon gitano corazon gitano no te olvidare corazon gitano siempre te querre si creces tanto en mi vida dia tras dia corazon gitano todo sabe a ti corazon gitano contigo yo aprendi a subir hasta la luna sin miedo a la locura corazon gitano no te olvidare corazon gitano siempre te querre si creces tanto en mi vida dia tras dia corazon gitano todo sabe a ti corazon gitano contigo yo aprendi a subir hasta la luna sin miedo a la locura","Corazon Gitano [Verison Dance]","1999"
"Pimpinela","hoy han vuelto a mi mente de un rincon del corazon los lugares y la gente que la vida se llevo y aunque el tiempo ha pasado aunque todo ya cambio siempre siguen a mi lado siempre siguen a mi lado siempre estan donde estoy yo las cosas simples de la vida jamas se pueden olvidar y con el paso de los anos se quieren cada dia mas trayendonos esos recuerdos que sin querer te hacen llorar las cosas simples de la vida vuelven un dia sin llamar trayendonos esos recuerdos que sin querer te hacen llorar hoy ha vuelto a mi memoria la nostalgia de tu amor las palabras las historias que mi padre me dejo y aunque todo esta tan lejos aunque todo ya paso al mirarme en el espejo al mirarme en el espejo hoy los vi a mi alrededor las cosas simples de la vida jamas se pueden olvidar y con el paso de los anos se quieren cada dia mas trayendonos esos recuerdos que sin querer te hacen llorar las cosas simples de la vida vuelven un dia sin llamar trayendonos esos recuerdos que sin querer te hacen llorar","Las Cosas Simples","1999"
"Pimpinela","senor juez senor juez esta carta es para usted mi mujer me ha dejado por una telenovela cuando llego a mi casa nunca huele a comida mi mujer siempre en el cuarto y la television prendida oye soy yo hay panigassi de mi vida oye soy yo hay panigassi de mi vida no me habla no me mira no se bana no cocina los ninos tienen hambre al menor le dio un calambre se nos murio el perro se nos va a morir la abulea y en casa no hay quien pueda con la telenovela ho no no hay quien pueda con la telenovela ho no no hay quien pueda con la telenovela dejame que te la cuente ella esta embarazada ese hijo no es suyo pero el no sabe nada por mi no se preocupe no dire ni una palabra por un plato de comida y una cerveza bien helada si un plato de comida y una cerveza bien helada se nos murio el perro se nos va a morir la abulea y en casa no hay quien pueda con la telenovela ho no no hay quien pueda con la telenovela senor juez senor juez lamento yo decirle suicidarme ya no puedo porque tengo que saber el final de la novela","La Telenovela","1999"
"Pimpinela","hace dos anos y un dia que vivo sin el hace dos anos y un dia que no lo he vuelto a ver y aunque no he sido feliz aprendi a vivir sin su amor pero al ir olvidando de pronto una noche volvio quien es soy yo que vienes a buscar a ti ya es tarde por que porque ahora soy yo la que quiere estar sin ti por eso vete olvida mi nombre mi cara mi casa y pega la vuelta jamas te pude comprender vete olvida mis ojos mis manos mis labios que no te desean estas mintiendo ya lo se vete olvida que existo que me conociste y no te sorprendas olvida de todo que tu para eso tienes experiencia en busca de emociones un dia marche de un mundo de sensaciones que no encontre y al descubrir que era todo una gran fantasia volvi porque entendi que queria las cosas que viven en ti adios ayudame no hay nada mas que hablar piensa en mi adios por que porque ahora soy yo la que quiere estar sin ti por eso vete olvida mi nombre mi cara mi casa y pega la vuelta jamas te pude comprender vete olvida mis ojos mis manos mis labios que no te desean estas mintiendo ya lo se vete olvida que existo que me conociste y no te sorprendas olvida de todo que tu para eso tienes experiencia por eso vete olvida mi nombre mi cara mi casa y pega la vuelta jamas te pude comprender vete olvida mis ojos mis manos mis labios que no te desean por eso vete olvida mi nombre mi cara mi casa y pega la vuelta estas mintiendo ya lo se vete olvida mis ojos mis manos mis labios que no te desean por eso vete olvida mi nombre mi cara mi casa y pega la vuelta jamas te pude comprender","Olvidame Y Pega la Vuelta [Dance Version]","1999"
"Pimpinela","con tristeza sin hablar en aquel atardecer nos miramos sin llorar cuando ya partia el tren no podia ser verdad se moria nuestro amor why yo sola en el anden aguantando el corazon con un nudo en la garganta te dije adios con el alma echa pedazos perdi tu amor con un nudo en la garganta te vi partir why al sentir que te alejabas pense en morir no te quize lastimar no era esa mi intencion yo queria solo amar tu querias el amor si pudiera olvidar algun dia este dolor pero sigo estando aqui aguantando el corazon con un nudo en la garganta te dije adios con el alma echa pedazos perdi tu amor con un nudo en la garganta te vi partir why al sentir que te alejabas pense en morir aunque ya ha pasado mucho tiempo todavia sigo viendo tu imagen en cada tren que parte en cada tren que llega con un nudo en la garganta te dije adios con el alma echa pedazos perdi tu amor con un nudo en la garganta te vi partir why al sentir que te alejabas pense en morir","Con un Nudo en la Garganta","1999"
"Pimpinela","tan solo el ganador se lleva lo mejor y no hay nada que hacer nada que escoger ya no quiero hablar todo ha terminado deja de actuar pienso suplicar yo aposte por ti pero me has fallado no hay nada que decir no hay por que fingir yo te quise dar lo que mas quieras dime por favor donde esta el error a partir de ti construi mis suenos que hizo de mi todo lo perdi tan solo el ganador se lleva lo mejor y no hay nada que hacer nada que escoger la vida seguira manana dios dira mas siempre el ganador se lleva lo mejor no quiero hablar mas si te pones triste no he venido aqui a verte sufrir te pido perdon si esto te hace dano si me ves tan mal a punto de llorar","Solo Hay un Ganador","1999"
"Pimpinela","porque aun queda la esperanza porque nada esta perdido porque aquellos que no escuchen el deseo de la gente moriran en el olvido por la fe de tu familia por los suenos de tus hijos porque sobran las razones para continuar luchando no hay que darse por vencido aguante campeon why tire pa delante aguante campeon why tire pa delante porque haya mas trabajo porque acabe la injusticia porque dejen de enganarnos why de una vez por todas nos devuelvan la sonrisa porque duele la impotencia pero mas duele el fracaso porque nada es para siempre hoy debemos ser pacientes pero no bajar los brazos aguante campeon why tire pa delante aguante campeon why tire pa delante porque esto es urgente porque se nos va la vida porque mientras que unos hablan hay millones de inocentes que se mueren cada dia porque no estamos solos porque somos mayoria porque hay mas gente honesta es que yo estoy segura que esto va a cambiar un dia aguante campeon why tire pa delante aguante campeon why tire pa delante","Aguante Campeón","2000"
"Pimpinela","tu eres mi hermano del alma realmente el amigo que en todo camino y jornada esta siempre conmigo y aunque eres un hombre aun tienes alma de nino aquel que me da su amistad su respeto y carino recuerdo que juntos pasamos muy duros momentos y tu no cambiaste por fuertes que fueran los vientos es tu corazon una casa de puertas abiertas tu eres realmente mas cierta en horas inciertas en ciertos momentos dificiles que hay en la vida buscamos a quien nos ayude a encontrar la salida y aquella palabra de aliento y de fe que me has dado me da la certeza que siempre estuviste a mi lado tu eres mi amiga del alma en toda jornada sonrisa y abrazo festivo en cada llegada me dices verdades tan grandes con frases abiertas tu eres realmente mas cierta en horas inciertas no preciso ni decir todo esto que te digo pero si es bueno sentir que eres tu mi hermano amigo yo no preciso ni decir todo esto que te digo pero si es bueno sentir que eres tu mi hermano amigo","Amigo","2000"
"Pimpinela","sali de casa contento diciendo que lindo dia yo saludaba a la gente why nadie me respondia why sin querer empuje a una senora que con voz de lora mirandome fijo me dijo idiota no ve por donde camina que viva la gente que tenga why ponga buena onda buena onda que escriban cien veces los que rezongan buena onda buena onda si la vida es tango hay que darle milonga buena onda buena onda why que al amargado todos le respondan buena onda buena onda ayer fui al supermercado why casi pierdo la vida pague why no me di cuenta que habi a gente en la fila why los de atras se acordaron de mi madre viniendose encima why un hombre con pena me dijo nena si no te vas te asesinan que viva la gente que tenga why ponga buena onda buena onda que escriban cien veces los que rezongan buena onda buena onda si la vida es tango hay que darle milonga buena onda buena onda why que al amargado todos le respondan buena onda buena onda volvi a casa en la noche cansado why deprimido prendi la tele why me dije al fin un poco tranquilo why de repente casi muero de un infarto era mi senora que llena de crema salio gritando donde te habi as metido que viva la gente que tenga why ponga buena onda buena onda que escriban cien veces los que rezongan buena onda buena onda si la vida es tango hay que darle milonga buena onda buena onda why que al amargado todos le respondan buena onda buena onda que lleven que traigan que tiren why pongan buena onda buena onda que no quiero ver a nadie rezonga que rezonga buena onda buena onda why que salga el mundo a bailar esta conga buena onda buena onda why que nadie le hable al que no responda buena onda buena que viva la gente que tenga why ponga buena onda buena onda que escriban cien veces los que rezongan buena onda buena onda si la vida es tango hay que darle milonga buena onda buena onda why que al amargado todos le respondan buena onda buena onda","Buena Onda","2000"
"Pimpinela","ella ponia alma y vida miedo verguenza y resignacion el se encargaba de las heridas de los insultos y humillacion cuentale al mundo lo que pasa no calles mas tanto dolor abre las puertas de tu alma pide ayuda por favor ella esperaba dia tras dia que algun milagro salve a los dos el le marcaba la otra mejilla con la hebilla de un cinturon cuentale al mundo lo que pasa no calles mas tanto dolor abre las puertas de tu alma pide ayuda por favor ella creia en sus promesas hasta que todo se derrumbo golpe tras golpe contra una mesa perdio el hijo que nunca vio cuentale al mundo lo que pasa no calles mas tanto dolor abre las puertas de tu alma pide ayuda por favor cuentale al mundo lo que pasa no calles mas tanto dolor abre las puertas de tu alma pide ayuda por favor","Cuéntale Al Mundo","2000"
"Pimpinela","aunque me quede callada y sea indiferente no te confundas conmigo que no soy lo que parece todos tenemos secretos que no se pueden decir pero tu nunca te olvides que cuando vas yo volvi ojos que no ven corazon que presiente esto es asi aunque lo niegue la gente ojos que no ven corazon que presiente esto es asi y el corazon nunca miente te veo solo de noche es un misterio tu vida eres como un fantasma que entra y sale a escondidas no se por que te sorprendes si siempre fuimos asi siento algo ultimamente algo que nunca senti ojos que no ven corazon que presiente esto es asi aunque lo niegue la gente ojos que no ven corazon que presiente esto es asi y el corazon nunca miente aqui termina la historia de la mitad de mi vida cuando encontre una carta en la que el le decia mejor dejemos un tiempo ella sospecha de mi hoy vivo sola y tranquila tratando de ser feliz ojos que no ven corazon que presiente esto es asi aunque lo niegue la gente ojos que no ven corazon que presiente esto es asi y el corazon nunca miente","Ojos Que No Ven","2000"
"Pimpinela","volvio de nuevo con la misma amenaza voy a marcharme esta noche de tu vida y en vez de hablarle y suplicarle como siempre mirandolo de frente le dije adios mi vida se quedo tan confundido que no supo que hacer cuando vi que se callaba como nunca me agrande y le dije en la cara tantas veces marchate que de los nervios al poco rato me empezo a lavar los platos ya lo ven ya lo ven es como dice la gente ya lo ven ya lo ven perro que ladra no muerde con el orgullo destrozado en mil pedazos me fui mirando para atras por si volvia cuando de pronto escuche aquel portazo me dije no hagas caso ya volvera algun dia la llame un mes entero y no me quiso responder me cito una manana y mientras iba yo pense debe haberse arrepentido pero cuando al fin llegue no habia nadie solo una nota en la calle esta tu ropa ya lo ven ya lo ven es como dice la gente ya lo ven ya lo ven perro que ladra no muerde","Perro Que Ladra","2000"
"Pimpinela","desafiamos mil veces al destino queriendo separar lo que dios ha unido cualquier amor normal no hubiera resistido y aqui estamos los dos heridos pero vivos sarna con gusto no pica amor sincero no muere solos no somos nada juntos nada nos puede sarna con gusto no pica amor sincero no muere solos no somos nada juntos nada nos puede convivimos al borde del abismo haciendo entre los dos un culto al egoismo no existe un corazon que hubiera soportado las cosas que tu y yo nos hemos perdonado sarna con gusto no pica amor sincero no muere solos no somos nada juntos nada nos puede sarna con gusto no pica amor sincero no muere solos no somos nada juntos nada nos puede solos no somos nada juntos nada nos puede","Sarna con Gusto","2000"
"Pimpinela","no pidas desayunos en la cama no pidas caramelos en la almohada no pidas cocina a la francesa ni que este detras tuyo vestida de mucama no pidas que te cante serenatas no pidas que me ria en las mananas no pidas al mal tiempo buena cara ni salir por decreto una vez a la semana pero si quieres amor pideme el alma si quieres amor pideme el alma si buscas senales de carino pideme un beso con eso alcanza no pidas que me vista de muneca no pidas que no use tu tarjeta no quieras que me quede en la ventana esperando a que vuelvas tejiendote calceta no pidas que lo hagamos a diario no pidas que me tire del armario ni que prenda fuegos artificiales cada vez que cumplimos un nuevo aniversario pero si quieres amor pideme el alma si quieres amor pideme el alma si buscas senales de carino pideme un beso con eso alcanza no pidas lo que sabes que no tengo no pidas que disfrace mis defectos ni que sea la mujer que hay en tus suenos puedo hacerte feliz aun no siendo eso pero si quieres amor pideme el alma si quieres amor pideme el alma si buscas senales de carino pideme un beso con eso alcanza","Señales de Cariño","2000"
"Pimpinela","querida amiga tu bien sabes que a veces a pesar de todo me siento solo querida amiga esta carta que te escribo solo es para decirte quiero estar contigo querida amiga a pesar de la distancia aun conservo la fragancia de tu risa y tu alegria querida amiga dejaria lo que tengo por sentir solo un momento a tu mano en la mia por una caricia querida amiga madre mia madre hoy te recuerdo mas que nunca y mi corazon de busca madre te quiero hacer tantas preguntas nada es facil sin tu ayuda madre porque que tu vida fue mi vida ese punto de llegada y de partida madre porque seras mientras yo viva el amor que no se olvida madre porque a mi lado has sufrido cuando me has visto vencido madre es tanto lo que yo te debo y nunca te he dicho te quiero querida amiga he tardado tanto tiempo en decirte lo que siento por pensar solo en mi vida querida amiga cambiaria lo que tengo por estar solo un momento a tu lado en este dia por una palabra querida amiga madre mia madre hoy te recuerdo mas que nunca y mi corazon de busca madre te quiero hacer tantas preguntas nada es facil sin tu ayuda madre porque que tu vida fue mi vida ese punto de llegada y de partida madre porque seras mientras yo viva el amor que no se olvida madre porque a mi lado has sufrido cuando me has visto vencido madre es tanto lo que yo te debo y nunca te he dicho te quiero","Querida Amiga","2001"
"Pimpinela","si cada uno de nosotros hubiera hecho algo mas de lo que hicimos si cada uno hubiera sido un poco menos egoista de lo que fuimos si en vez de tanta indiferencia hubiera habido mas paciencia amor mio yo se que hoy seria todo tan distinto donde se han ido a donde estan los suenos perdidos a donde iran las ilusiones y aquel amor que un dia sentimos pero como ha pasado pero como fue que un dia cambiamos y sin querer hoy solo somos tan solo dos desconocidos si cada uno de nosotros le hubiera demostrado al otro mas carino si cada uno hubiera visto lo que pasaba mas alla de uno mismo si en vez de andar por dos caminos hubiera habido solo uno compartido yo se que hoy seria todo tan distinto si cada uno de nosotros le hubiera puesto mas detalles a la vida si cada uno hubiera dado sin un motivo alguna vez una caricia si en vez de tanta indiferencia hubiera habido mas paciencia amor mio hoy no estariamos aqui firmando nuestro adios en un libro donde se han ido a donde estan los suenos perdidos a donde iran las ilusiones y aquel amor que un dia sentimos pero como ha pasado pero como fue que un dia cambiamos y sin querer hoy solo somos tan solo dos desconocidos","Si Cada Uno de Nosotros","2002"
"Pimpinela","quiero que lleguen pronto los buenos tiempos quiero que la tristeza termine aqui quiero ver a mi hijo crecer sin miedos quiero ver a la gente otra vez feliz quiero que llegue pronto ese momento quiero que la alegria no tenga fin y que un angel que baje del cielo nos ensene el camino a seguir para hacer juntos el mundo nuevo que todos sonamos un dia vivir quiero un angel que baje a la tierra que el milagro se pueda cumplir demasiado dolor y miseria que los buenos tiempos ya esten por venir quiero que lleguen pronto los buenos tiempos quiero que haya trabajo y vivir en paz quiero no ver a tanta gente sufriendo quiero que la injusticia termine ya quiero que todo esto sea mas que un sueno que pronto se convierta en realidad y que un angel que baje del cielo nos ensene el camino a seguir para hacer juntos el mundo nuevo que todos sonamos un dia vivir quiero un angel que baje a la tierra que el milagro se pueda cumplir demasiado dolor y miseria que los buenos tiempos ya esten por venir","Los Buenos Tiempos","2005"
"Pimpinela","me controlas todo lo que hago no me escuchas cuando te hablo tu obsesion es tratar de cambiarme tus reproches son insoportables siempre soy la que esta equivocada no te dejo conforme con nada desconfias de lo que te digo yo no se para que estas conmigo cuidado estas tirando demasiado y no comprendes que la cuerda con que me has atado se puede romper cuidado estas tirando demasiado si este precio hay que pagar para estar a tu lado no se si lo hare yo no se si lo hare no demuestras nada conmigo ya me tratas como un amigo si te busco estas siempre cansada si no estoy te deje abandonada","Cuidado","2005"
"Pimpinela","es nuestro gran problema del siglo veintiuno no busques mas a un hombre que no queda ninguno despues de otro desengano junte coraje y volvi a empezar simpatico el divorciado casi me vuelvo a enamorar hay algo que aun no te he dicho una sorpresa te voy a dar y entraron cuatro ninitos gritando juntos hola papa no creas lo que ves no se puede confiar y ahora que voy a hacer a donde ire a buscar donde estan los hombres donde se han metido si no estan casados son medio raros o aburridos donde estan los hombres que yo no los veo si no son tramposos son mentirosos o tienen miedo el dia que vi a un soltero me dije no se me va a escapar salimos un mes entero todos los dias con la mama si quieres vivir conmigo a mi viejita hay que llevar al fin se marcho ofendido cuando la quise envenenar no creas lo que ves no se puede confiar y ahora que voy a hacer a donde ire a buscar donde estan los hombres aqui donde se han metido aqui si no estan casados son medio raros o aburridos no es asi donde estan los hombres aqui que yo no los veo por que si no son tramposos son mentirosos o tienen miedo no puede ser y casi sobre la hora yo conoci al hombre ideal sensible y divertido era mi sueno hecho realidad hoy vine con un amigo vamos a ir todos a bailar bailaron apretaditos toda la noche tal para cual no creas lo que ves no se puede confiar y ahora que voy a hacer a donde ire a buscar donde estan los hombres donde se han metido si no estan casados son medio raros o aburridos donde estan los hombres que yo no los veo si no son tramposos son mentirosos o tienen miedo donde estan los hombres aqui donde se han metido aqui si no estan casados son medio raros o aburridos no es asi donde estan los hombres aqui que yo no los veo por que si no son tramposos son mentirosos o tienen miedo no puede ser","Dónde Están los Hombres","2005"
"Pimpinela","por se que te hubiera que te hubiera elegido por ser tu lo que siempre he querido por que cuando con el yo te veo en silencio me muero de celos pero asi lo ha querido el destino tu con el y yo solo tu amigo yo no se como hare para verte y no amarte despues como duele morirse de amor y ser solo tu amigo como duele tener que callar lo que siento por ti tu y yo no podemos ser mas que dos buenos amigos y esperar en silencio que el tiempo te aparte de mi por que aveces no se lo que hago cuando siento que estas a mi lado por que sueno despierto y dormido que una noche te escapas con migo si no te puedo amar de otro modo te amare como amante y amigo yo no se como hare para verte y no sufrir despues como duele morirse de amor y ser solo tu amigo como duele tener que callar lo que siento por ti tu y yo no podemos ser mas que dos buenos amigos y esperar en silencio que el tiempo te aparte de mi","Dos Buenos Amigos","2005"
"Pimpinela","y otra vez aqui con la mesa lista para ti como ayer como siempre en cada ano y aunque ya no estas nunca nadie ocupa tu lugar nuestro amor tiene un sitio reservado ya los ninos no preguntan ni siquiera donde estas y aunque el mundo continua en cada diciembre no puedo dejar de llorar yo te extrano riendo en el bano te imagino sirviendo el vino yo te veo tirado en el suelo cuando los ninos te retaban a duelo yo te siento flotando en el viento te deseo en mis pensamientos yo te busco y en suenos te llamo cuando en la cama ya no encuentro tu mano cuesta tanto no tenerte al llegar la navidad y aunque el tiempo me ha hecho fuerte en cada diciembre no puedo dejar de llorar yo te extrano riendo en el bano te imagino sirviendo el vino yo te veo tirado en el suelo cuando los ninos te retaban a duelo yo te siento flotando en el viento te deseo en mis pensamientos yo te busco y en suenos te llamo cuando en la cama ya no encuentro tu mano yo te extrano riendo en el bano te imagino sirviendo el vino yo te veo tirado en suelo cuando los ninos te retaban a duelo yo te siento flotando en el viento te deseo en mis pensamientos yo te busco y en suenos te llamo cuando en la cama ya no encuentro tu mano","En Cada Diciembre","2005"
"Pimpinela","mira las cosas que tiene la vida ayer sin ti yo me moria y hoy soy yo quien dice adios y hoy soy yo quien dice adios dime y tu que es lo que pretendias si vives entre fantasias que sabes tu lo que es amor que sabes tu lo que es amor el amor no siembra rencores el amor no te hace infeliz el amor no mata ilusiones como me has matado tu a mi cada uno tiene razones si tu quieres yo te las doy no me des mas explicaciones esto para mi no es amor el amor jamas te traiciona y tu que me quieres decir en tu vida hay otra persona esto no es amor para mi oh no oh no esto no es amor para mi 2 el amor te habla de frente el amor no engana asi el amor no humilla a la gente como me lo has hecho tu a mi tu te desahogas conmigo y la culpa fue de los dos yo jamas te di un motivo lo que yo te di fue amor y el amor no inventa mentiras tu me obligaste a mentir el amor no oculta otra vida como la que tienes sin mi el amor jamas te traiciona puede cometer un error en tu vida hay otra persona esto para mi no es amor el amor que pido es sincero como fue el amor que te di lo que tu me das no lo quiero esto no es amor para mi oh no oh no esto no es amor para mi","Esto No Es Amor","2005"
"Pimpinela","sabes lo tengo decidido tu sigue tu camino que el mio empieza hoy dime por que te vas ahora si todo lo que hicimos ha sido por los dos no sigas mintiendo no tienes razon yo siempre dependo de tu decision no quiero seguir siendo esclava de tu incomprension estoy cansada herida de estar siempre pendiente de tu vida de nuevo con el mismo reproche cada dia no es esto lo que yo siempre quise para mi estoy cansada furiosa de ver tu indiferencia por mis cosas lo siento ya me canse de oirte todo el tiempo por eso tal vez alguien lo quiera hacer por ti no sigas mintiendo no tienes razon yo siempre dependo de tu decision no quiero seguir siendo esclava de tu incomprension estoy cansada herida de estar siempre pendiente de tu vida de nuevo con el mismo reproche cada dia no es esto lo que yo siempre quise para mi estoy cansada furiosa de ver tu indiferencia por mis cosas lo siento ya me canse de oirte todo el tiempo por eso tal vez alguien lo quiera hacer por ti estoy cansada cansada herida furiosa estoy cansada y ahora llego el momento de intentarlo sola lo siento ya me canse de oirte todo el tiempo por eso tal vez alguien lo quiera hacer por ti","Estoy Cansada","2005"
